artist,title,lyric
  The Carpenters  ,This Masquerade,Are we really happy With this lonely game we play Looking for the right words to say Searching but not finding Understanding anyway we're lost In this masquerade both afraid to say We're just too far away From being close together From the start we tried to talk it Over but the words got in the way We're lost inside this lonely game we play Thoughts of leaving disappear Each time I see your eyes And no matter how hard I try To understand the reason Why we carry on this way We're lost in this masquerade We tried to talk it over But the words got in the way We're lost inside this lonely game we play Thoughts of leaving disappear Each time I see your eyes And no matter how hard I try To understand the reason Why we carry on this way We're lost in this masquerade We're lost in this masquerade
  Stacie Orrico  ,I`m Not Missing You,"Oh, Oh I`m not missing you Been through just about everything that I could go through When it comes to relationships Don`t know what I was missing or why I ain`t listen When I told myself that was it Now here I go, hurt again Cause of my curiosity Now that it`s over What else could it be, he just had to cheat  I made a promise never to settle Why didn`t I keep it? Cause I hated the heartbreak Crying and cheating, the fooling around  CHORUS (But) I`m not missing you I`m not going through the motions Waiting and hoping you call me I`m not missing you You might have had me open But I must be going because I got life to do I know I`m usually hanging on I used to hate to see you gone But this time it`s different I don`t even feel the distance I`m not missing I`m not missing you  It`s a shame in a way cause I feel that I may not ever find the right one for me Did I leave him, is he right in front of my face oh Will my true love ever be? Why would I go on a search again When I know what the end will be What good is love when it keeps on hurting me?  I made a promise never to settle Why didn`t I keep it? Cause I hated the heartbreak Crying and cheating, the fooling around  Chorus x 2  No I can`t be with you Cause I`m scared felt like I was falling when you left me I can`t keep going through life Unaware of what I missed And the person I could be Love`s good when it`s right And when it`s left in your memory All the times I let you down I guess love will be nice for someone else`s life  (But) I`m not missing you I`m not going through the motions Waiting and hoping you call me I`m not missing you You might have had me open But I must be going because I got life to do I know I`m usually hanging on I used to hate to see you gone (I used to hate it) Oh different, oh feel the distance I`m not missing I`m not missing you  I`m not going through the motions Waiting and hoping you call me (knockin` at my door) You might have had me open But I must be going because (it`s the best day of my life) I know I`m usually hanging on I used to hate to see you gone Oh different, feel the distance I`m not missing I`m not missing you I`m not missing you (oh baby) I`m not missing you I`m so over you It ain`t even a problem"
  A Few Good Men  ,Don`t Cry (Behind My Back),"Don't cry, don't cry Baby don't, behind my back Don't cry, don't cry  Lady, I, I want to tell you That you're all that I want and all that I need And if you feel you wanna cry Just let me look inside  I understand the pain that you feel And when you need someone to hold you You can come and run to me And I will be your guiding in the night  Please, don't act like that Don't cry behind my back Said, I never like the power in your eye Light the fire inside your heart  If you put your hand in mine Just let me read your mind Baby, baby, please don't act like that Don't cry behind my back  Baby, you, you're the one for me And when you need me by your side I will be there 'Cause I know what's in your mind  Sometimes you want to cry But you feel afraid to reveal it to me But if you bring your broken heart I will mend every part So I can be the one to heal it totally  Please don't act like that Don't cry behind my back Said, I never like the power in your eye Light the fire inside your heart  If you put your hand in mine Just let me read your mind Baby, baby, please don't act like that Don't cry behind my back  So when you're feeling down and out I feel it in my heart And when you need someone to hold you tight You know that you can depend on me  And I know Lovin's nothing less You give and get something At times when you feel you can't go on  Don't cry, don't cry Don't cry, don't cry behind my back Don't cry, don't cry Don't cry, don't cry behind my back  I said, loving's nothing less You give and get something  Please don't act like that Don't cry behind my back Said, I never like the power in your eye Light the fire inside your heart  If you put your hand in mine Just let me read your mind Baby, baby, please don't act like that Don't cry behind my back"
  Anjulie  ,Love Songs,Love songs and limousines Wishing wells and make believe Disco balls and dancing queens I fall so easy Rich guys and candlelight Telling me the things I like I`m too young and they`re too right for me I fall so easy for cheesy things in life Sad sad movies make me cry Pretty people I admire I used to hate I fall so easy for the stupid little lines Hollywood and sunny skies Fancy restaurants with three forks and knives I fall so easy Until you came my way Turn my clouds to white from gray Showered me with pink champagne I let go so easier That girl I used to be Cynical and heartbreak free Confidence exude in me now I fall so easy for cheesy things in life Sad sad movies make me cry Pretty people I admire I used to hate I fall so easy for the stupid little lines Hollywood and sunny skies Fancy restaurants with three forks and knives I fall so easily in love in love I fall so I fall I fall so easily in love
  Britney Spears  ,Toxic (Album Ver.),"Baby, can’t you see I’m calling A guy like you Should wear a warning It’s dangerous I’m fallin’  There’s no escape I can’t hide I need a hit Baby, give me it You’re dangerous I’m lovin’ it  Too high Can’t come down Losing my head Spinning ‘round and ‘round Do you feel me now  With a taste of your lips I’m on a ride You’re toxic I’m slipping under With a taste of poison paradise I’m addicted to you Don’t you know that you’re toxic And I love what you do Don’t you know that you’re toxic  It’s getting late To give you up I took a sip From my devil cup Slowly It’s taking over me  Too high Can’t come down It’s in the air And it’s all around Can you feel me now  With a taste of your lips I’m on a ride You’re toxic I’m slipping under With a taste of poison paradise I’m addicted to you Don’t you know that you’re toxic And I love what you do Don’t you know that you’re toxic  Don't you know that you're toxic  Taste you're lips I'm on a ride You're Toxic I'm slippin under With a taste of a poison paradise I'm addicted to you Don't cha know that you're toxic  With a taste of you're lips I'm on a ride You're Toxic I'm slippin under With a taste of a poison paradise I'm addicted to you Don't cha know that you're Toxic  Intoxicate me now With you're lovin now I think i'm ready now (I Think I'm Ready Now) Intoxicate me now With your lovin now I think I'm ready now"
  Astrid S  ,Jump,"If I fell with no one around Would it even make a sound Cause I can't even make one now And I get these thoughts in my head But I wouldn't do it anyway Or at least that's what I say  Til I'm right on the edge I take a look at the bottom And I know it will hurt hitting ground But I don't think that I'd mind the falling Would anyone know Is there anyone watching I'm getting crazy ideas in my head And I don't think I'm able to stop them Jump  When the water rushes in I feel it filling up my lungs I'm in the calm before the storm When I dive, feel the wind in my hair Nobody can talk me down I'm really gonna do it now  I'm standing right on the edge Looking down at the bottom And I know it will hurt hitting ground But I don't think that I'd mind the falling Would anyone know Is there anyone watching I'm getting crazy ideas in my head And I'm not even trying to stop them Jump I'm standing right on the edge Looking down at the bottom And I know it will hurt hitting ground But I don't think that I'd mind the falling Would anyone know Is there anyone watching I'm getting crazy ideas in my head And I'm not even trying to stop them Jump"
  Cowsills  ,"The Rain, The Park And The Other Thing","I saw her sitting in the rain, raindrops falling on her. She didn't seem to care. She sat there and smiled at me. And I knew (I knew, I knew, I knew, I knew) she could make me happy (happy, happy). Flowers in her hair, flowers everywhere. I love the flower girl, oh, I don't know just why. She simply caught my eye. I love the flower girl, she seemed so sweet and kind. She crept into my mind. Suddenly the sun broke through (see the sun). I turned around she was gone (where did she go). And all I had left was one little flower from her hair. But I knew (I knew, I knew, I knew, I knew) she had made me happy (happy, happy). Flowers in her hair, flowers everywhere. I love the flower girl Was she reality or just a dream to me? I love the flower girl Her love showed me the way to find a sunny day Sunny day ... sunny day ... sunny day I love the flower girl Was she reality or just a dream to me?"
  The 1975  ,Robbers,She had a face straight out a magazine God only knows but you'll never leave her Her balaclava is starting to chafe And when she gets his gun he's begging Babe stay stay stay stay stay I'll give you one more time We'll give you one more fight Said one more line Will I know you Now if you never shoot you'll never know And if you never eat you'll never grow You've got a pretty kind of dirty face And when she's leaving your home She's begging you to stay stay stay stay stay I'll give you one more time We'll give you one more fight Said one more line There'll be a riot 'cause I know you Well now that you've got your gun It's much harder now the police have come And I'll shoot him if it's what you ask But if you'd just take off your mask You'd find out everything's gone wrong Now everybody's dead And they're driving past my old school And he's got his gun he's got his suit on She says Babe you look so cool You look so cool You look so coo-oo-oo-ool You look so cool you look so cool You look so coo-oo-oo-ool
  Shawn Mendes  ,Mutual,I want you close to me I want you close I want you closer But when you're here with me It's hard to tell just what you're after You say you want all of me today But tomorrow's not the same My feelings never change What do you want from me What do you want Uh I need to know If this is mutual Before I go And get way too involved I want you bad Can you reciprocate No I don't want to have to leave But half of you's not enough for me This inconsistency What does it mean You got me questioning The way you act and take it back Do I mean anything Just tell me honestly You say you want all of me today But tomorrow's not the same My feelings never change What do you want from me What do you want Uh I need to know If this is mutual Before I go And get way too involved I want you bad Can you reciprocate No I don't want to have to leave But half of you's not enough for me Are you playing me Is this a game When you show up late Say love at 2 am Then tell me you can't say Girl yeah What do you want from me Baby ohh I need to know If this is mutual Before I go And get way too involved I want you bad baby Can you reciprocate No I don't want to have to leave But half of you's not enough for me
  Nana Mouskouri  ,The Rose,Some say love it is a river That drowns the tender reed Some say love it is a razor That leaves your soul to bleed Some say love it is a hunger An endless aching need I say love it is a flower And you it's only seed It's the heart afraid of breaking That never learns to dance It's the dream afraid of waking That never takes the chance It's the one who won't be taken Who cannot seem to give And the soul afraid of dying That never learns to live When the night has been so lonely And the road has been too long And you think that love is only For the lucky and the strong Just remember in the winter Far beneath the bitter snow Lies the seed that with the sun's love In the spring becomes a rose
  Mary Lambert  ,Just Got Home,"Golden heart, my perfect star Keep me safe with your two arms You feel like I just got home You feel like I just got home Cat's on the welcome mat The snow is outside Put the kettle on The fire blazing bright Hurry and kiss me So I know that you missed me You feel like I just got home You feel like I just got home Can't I just spend me life By your side and be your wife And read in bed and hold you close And make sure you always know You feel like I just got home You feel like I just got home Cat's on the welcome mat The snow is outside Put the kettle on The fire blazing bright Hurry and kiss me So I know that you missed me You feel like I just got home You feel like I just got home"
  Basia  ,Astrud,Nobody knows where she came from The tall and tanned young and lovely girl With a voice as light as air Nobody knows but no one cares Cause everybody loves her When she signs makes you dream a fairy tale With a certain smile She can make you feel so nice Saying gently Goodbye sadness Still will break your heart Listen to her once You'll feel lucky she was there One note samba would never be the same  Where is she now the lovely girl With the softest voices you ever heard Asking fly me to the moon I know I'll find her in the sun of Copacabana Meditating Her lonely heart is nothing new With a certain smile She can make you feel so nice Saying gently Goodbye sadness Still will break your heart Listen to her once You'll feel lucky she was there One note samba would never be the same Never be the same  Listen to her once You'll feel lucky she was there One note samba would never be  Nobody knows where she came from The tall and tanned young and lovely girl With a voice as light as air Nobody knows but no one cares Cause everybody loves her When she signs makes you dream a fairy tale
  Backstreet Boys  ,Quit Playing Games (With My Heart),Even in my heart I see You're not bein' true to me Deep within my soul I feel Nothing's like it used to be Sometimes I wish I could turn back time Impossible as it may seem But I wish I could so bad baby Quit playing games with my heart with my heart with my heart I should've known from the start from my heart my heart with my heart I live my life the way To keep you comin' back to me Everything I do is for you So what is it that you can't see Sometimes I wish I could turn back time Impossible as it may seem But I wish I could so bad baby Quit playing games with my heart with my heart with my heart I should've known from the start from my heart my heart Quit playing games baby baby The love that we had was so strong Don't leave me hangin' here forever Oh baby baby This is not a lie let's stop this tonight  Quit playing games  Sometimes I wish I could turn back time Impossible as it may seem But I wish I could so bad baby Quit playing games with my heart with my heart with my heart I should've known from the start from my heart my heart with my heart Quit playing games with my heart  Quit playing games with my heart my heart my heart my heart
  Zaz  ,La Parisienne,Lorsque je suis arrivee dans la capitale J'aurais voulu devenir une femme fatale Mais je ne buvais pas je ne me droguais pas Et je n'avais aucun complexe Je suis beaucoup trop normale ca me vexe Je ne suis pas parisienne ca me gene ca me gene Je ne suis pas dans le vent C'est navrant c'est navrant Aucune bizarrerie ca m'ennuie ca m'ennuie Pas la moindre affectation Je ne suis pas dans le ton Je n'suis pas vegetarienne ca me gene ca me gene J'n'suis pas Karateka ca me met dans l'embarras Je ne suis pas cinephile C'est debile c'est debile Je ne suis pas MLF Je sens qu'on m'en fait grief M'en fait grief m'en fait grief Bientot j'ai fait connaissance d'un groupe d'amis Vivant en communaute dans le meme lit Comm' je ne buvais pas je ne me droguais pas Et n'avais aucun complexe Je crois qu'ils en sont restes tout perplexes Je ne suis pas nymphomane On me blame on me blame Je ne suis pas travesti ca me nuit ca me nuit Je ne suis pas masochiste ca existe ca existe Pour reussir mon destin Je vais voir le medecin Je ne suis pas schizophrene ca me gene ca me gene Je ne suis pas hysterique ca s'complique ca s'complique Je lui dis je desespere Je n'ai pas de gouts pervers De gouts pervers de gouts pervers Mais si me dit le docteur en se rhabillant Apres ce premier essai c'est encourageant Si vous ne buvez pas vous ne vous droguez pas Et n'avez aucun complexe Vous avez une obsession c'est le sexe Depuis je suis a la mode Je me rode je me rode Dans les lits de Saint Germain C'est divin c'est divin Je fais partie de l'elite ca va vite ca va vite Et je me donne avec joie Tout en faisant du yoga Je vois les films d'epouvante Je m'en vante je m'en vante En serrant tres fort la main Du voisin du voisin Me sachant originale Je cavale je cavale J'assume ma libido Je vais draguer en velo Maint'nant je suis parisienne J'me surmene j'me surmene Et je connais la detresse Et le cafard et le stress Enfin a l'ecologie J'm'initie j'm'initie Et loin de la pollution et loin de la pollution et loin de la pollution Je vais tondre les moutons je vais tondre les moutons je vais tonfre les moutons Des moutons des moutons des moutons
  Kelly Clarkson  ,Baby It`s Cold Outside,I really can't stay Baby it's cold outside I've got to go away But I can call you a ride This evening has been I'm so glad you that you dropped in So very nice Time spent with you is paradise My mom will start to worry I'll call the car and tell him to hurry My daddy will be pacing the floor Wait what are you still livin' home for So really I'd better scurry Your drive his name is Murray But maybe just a half a drink more Oh we're both adults so who's keepin' score What will my friends think It's your body and your choice If I have one more drink It's your body and your choice Ooh you really know how Your eyes are like starlight now To cast a spell One look at you and then I fell I ought to say No no no sir Then you really ought to go go go At least I'm gonna say that I tried Well Murray he just pulled up outside I really can't stay I understand baby Baby it's cold outside I simply should go Text me when you get home The answer is no Mm I guess that's respectable This welcome has been I've been lucky that you dropped in So nice and warm But you better go before it storms My sister will be suspicious Well gosh your lips look delicious My brother will be there at the door Oh he loves my music baby I'm sure My gossipy neighbor's for sure I'm a genie tell me what your wish is But maybe just a cigarette more Oh that's somethin' we should probably explore I've got to get home Oh baby I'm well aware Say lend me a coat Oh keep it girl I don't care You've really been grand I feel good to touch me hands But don't you see I want you to stay it's not up to me There's bound to be talk tomorrow Well they can talk what do they know At least there will be plenty implied Oh let their mind do this and Ma'am I really can't stay Baby just go It's cold baby It's cold baby But ooh I don't wanna go It's cold outside
  The Vamps  ,Hoping For Snow,"I've made mistakes but so of you it's been a year of nothing new and now I'm waiting for this to unfold   They're raising clouds but at my tide I keep on waving spirits high if you don't open to me in the cold  And no, you're not the only reason I came home and maybe it's the seasons I don't know and maybe it's because I'm on my own  Last year you took a piece of my heart this year I guess it's falling appart Everyone's hoping for snow but I'm just hoping that you come home  Last year we stole a dance in the dark this year we're just a thought from up far Everyone's hoping for snow but I'm just hoping that you might make it home  I catch a breath it chills my lungs it takes me back to when we were young I always seem to get lost in the past  As I let go I'll breathe you out before my eyes it form a cloud and dissappear when you stick to the glass  Oh, you're not the only reason I came home and maybe it's the seasons I don't know and maybe it's because I'm on my own  Last year you took a piece of my heart this year I guess it's falling appart Everyone's hoping for snow but I'm just hoping that you come home  Last year we stole a dance in the dark this year we're just a thought from up far Everyone's hoping for snow but I'm just hoping that you might make it home  I see you out, out in the street and nothing on your face shows that you're missing me and all our friends from way back when keep asking me just how you've been and how I've been, and it's killing me  Last year you took a piece of my heart this year I guess it's falling appart Everyone's hoping for snow but I'm just hoping that you did come home  Last year you took a piece of my heart this year I guess it's falling appart Everyone's hoping for snow but I'm just hoping that you come home  Last year we stole a dance in the dark this year we're just a thought from up far Everyone's hoping for snow but I'm just hoping that you might make it home"
"  Matoma ,  Becky Hill  ",False Alarm,I heard sirens in my head From the first time that we met Thought it was a false alarm Yeah we started as a spark Didn't think we'd come this far But here we are oh I'm dancing in flames I'm dancing in flames I ain't scared of the blaze Don't rescue me And now I'm burning in your arms Endless fire in my heart No it's not a false alarm No it's not a false alarm But here we are I'm never get my hopes up Cause then I'll never get let down But you were something special I didn't notice until now I heard sirens in my head From the first time that we met Thought it was a false alarm Yeah we started as a spark Didn't think we'd come this far But here we are oh I'm dancing in flames I'm dancing in flames I ain't scared of the blaze Don't rescue me And now I'm burning in your arms Endless fire in my heart No it's not a false alarm No it's not a false alarm No it's not a false alarm No no No it's not a false alarm No no No it's not a false alarm Maybe I'm too careful Didn't trust the signs Didn't wanna jump Too scared of the height And now I'm burning in your arms Endless fire in my heart No it's not a false alarm No it's not a false alarm Oh no it's not a false alarm No no No it's not a false alarm No it's not a false alarm No it's not a false alarm
  Olly Murs  ,Change Is Gunna Come,"Something's come feel it down in my bones  Yeah it's been a long time gone but you here tonight  Now let's not look back you keeping me right on track  Feel the karma coming back we're gonna be alright    If everything's a constant battle sometimes you won't win  If all our stress turn into struggles we won't be givin' in    We'll be living on an all time high  I'm trying to keep it  We've learnt to walk but now it's time to run  A change is gonna come  Living on an all time high  I'm gonna live it  First thought we couldn't but it can be done  Change is gonna come    Troubled times, been a good friend of mine  Yeah it's been around a while keeping me down  But through it all even with a broken soul  Here I am standing tall cause you're around    If everything's a constant battle sometimes you won't win  If all our stress turn into struggles we won't be givin' in    We'll be living on an all time high  I'm trying to keep it  We've learnt to walk but now it's time to run  A change is gonna come  Living on an all time high  I'm gonna live it  First thought we couldn't but it can be done  Change is gonna come    For every sign that said we'd never find the means to (A change is gonna come)  For every word they said they never heard that they knew (A change is gonna come)  And give it time I want some piece of life Same as you do  Sing it    Change is Coming  You better be waiting  You better be  Ready  Running  Faster faster it's coming    Living on an all time high  I'm trying to keep it  We've learnt to walk but now it's time to run  A change is gonna come  Living on an all time high  I'm trying to keep it  We've learnt to walk but now it's time to run  A change is gonna come  Living on an all time high  I'm gonna live it  First thought we couldn't but it can be done  Change is gonna come    Change is Coming  Oh you better be running  I see you ready  I came running  Faster faster it's coming    A deep change is Coming  Oh you better be running  I see you ready  I came running  Faster faster it's coming"
  Eternal  ,Someday,"Someday When we are wiser When the world's older When we have learned I pray Someday we may yet live To live and let live Someday Life will be fairer Need will be rarer And greed will not pay God speed This bright millennium On its way Let it come Someday  Someday Our fight will be won then We'll stand in the sun then That bright afternoon 'Till then On days when the sun is gone We'll hang on If we wish upon the moon  There are some days dark and bitter Seems we haven't got a prayer But a prayer for something better Is the one thing we all share  Someday When we are wiser When the whole world is older When we have learned I pray Someday we may yet live To live and let live One day, someday Someday Life will be fairer Need will be rarer Greed will not pay God speed This bright millennium Let it come If we wish upon the moon One day Someday Soon  One day Someday Soon"
