artist,title,lyric
  E-Type  ,Here I Go Again,"Here I go again it's time for me to fade away Here I go  Here I go  It's time again to let the storm rise and I'm waiting here with great expectations and I know You call it what you want but for now I'm standing tall and I'm here to get it all give me your best shot or go  You gotta move on you better believe it And you'll find out this is the time of your life You gotta move on you better believe it You can be sure this is the ride of your life  Here I go again, it's time for me to fade away I'm out of here I go again, I've lost the game And no one is to blame Here I go again, it's time for me to fade away I'm out of here I go again, I've lost the game And no one is to blame  Here I go  So time waits for no one and I only get a chance to be on top of the world and you know If you want to move on you will have to be strong cause it won't last long you will reap what you sow  You gotta move on you better believe it And you'll find out this is the time of your life You gotta move on you better believe it You can be sure this is the ride of your life  Here I go again, it's time for me to fade away I'm out of here I go again, I've lost the game And no one is to blame Here I go again, it's time for me to fade away I'm out of here I go again, I've lost the game And no one is to blame  Here I go Yeah, yeah Yeah, yeah  So time is running out I feel I have to let you go And I know, no one is to blame  Here I go Here I go Here I go again, baby Here I go Here I go Here I go again, baby  Here I go again, it's time for me to fade away I'm out of here I go again, I've lost the game And no one is to blame Here I go again, it's time for me to fade away I'm out of here I go again, I've lost the game And no one is to blame  Here I go"
  Mr. Mister  ,Kyrie,The wind blows hard against this mountain side across the sea into my soul It reaches into where I cannot hide setting my feet upon the road  My heart is old it holds my memories my body burns a gemlike flame Somewhere between the soul and soft machine is where I find myself again  * Kyrie eleision down the road that I must travel Kyrie eleision through the darkness of the night Kyrie eleision where I going will you follow Kyrie eleision in a highway in the light  When I was young I thought of growing old of what my life would mean to me Would I have followed down my chosen road? Or only wished that I could be  * REPEAT * REPEAT
  Dami Im  ,I Hear a Song,"Honey, honey I can see the stars all the way from here Can't you see the glow on the window pane? I can feel the sun whenever you're near Every time you touch me I just melt away  [Pre-Chorus] Now everybody asks me why I'm smiling out from ear to ear They say love hurts but I know It's gonna take a little work Nothing's perfect, but it's worth it After fighting through my tears And finally, you put me first  [Chorus 1] Baby, it's you, you're the one I love You're the one I need, you're the only one I see Come on, baby, it's you You're the one that gives your all You're the one I can always call When I need you, make everything stop Finally, you put my love on top  [Post-Chorus] Ooh, come on, baby! You put my love on top, top, top, top, top You put my love on top Ooh, come on, baby! You put my love on top, top, top, top, top You put my love on top  [Verse 2] Baby, baby, I can feel the wind whipping past my face As we dance the night away Boy your lips taste like a night of champagne As I kiss you again, and again, and again, and again  [Pre-Chorus] Now everybody asks me why I'm smiling out from ear to ear They say love hurts but I know It's gonna take a little work Nothing's perfect, but it's worth it After fighting through my tears And finally, you put me first  [Chorus 1] Baby, it's you, you're the one I love You're the one I need, you're the only one I see Come on, baby, it's you You're the one that gives your all You're the one I can always call When I need you, make everything stop Finally, you put my love on top  [Post-Chorus] Ooh, come on, baby! You put my love on top, top, top, top, top You put my love on top Ooh, come on, baby! You put my love on top, top, top, top, top You put my love on top  [Chorus 2] Baby, it's you, you're the one I love You're the one I need, you're the only thing I see Come on, baby, it's you You're the one that gives your all You're the one that always call When I need you, baby, everything stops Finally, you put my love on top  Baby, you're the one that I love Baby, you're all I need You're the only one I see Come on, baby, it's you You're the one that gives your all You're the one I always call When I need you, make everything stop Finally, you put my love on top  Baby, 'cause you're the one that I love Baby, you're the one that I need You're the only one I see Baby, baby, it's you You're the one that gives your all You're the one that always calls When I need you everything stops Finally, you put my love on top  Baby, 'cause you're the one that I love Baby, you're the one that I need You're the only one I see Baby, baby, it's you You're the one that gives your all You're the one that always calls When I need you everything stops Finally, you put my love on top"
  Dschinghis Khan  ,Corrida,"Corrida Corrida, Der große Tag ist da Alle jubeln und singen und schrei'n Corrida Corrida, Der Augenblick ist nah Und Miguel steht dort unten allein Und er kann es noch nicht glauben Denn sein Traum wird endlich wahr Und den Sieg hat er vor Augen La Corrida Corrida Ol?   Corrida Corrida, die M?nner steh'n bereit Und dann ?ffnen sie langsam das Tor Corrida Corrida, und jetzt ist es soweit Und der Stier kommt ganz langsam hervor Tut eure Pflicht Picadores Reitet so gut ihr nur k?nnt Auf in den Kampf Bandilleros Die Corrida Corrida beginnt   Corrida Corrida In der Arena herrscht Schweigen Jetzt wird sich zeigen, wer von den beiden Sieger wird Corrida Corrida Wer wird der St?rkere bleiben Staub hat die Sonne verh?llt Und ein Schrei von ganz weit oben Ein Gesicht so weiß wie Schnee Und ein Herz sch?agt immer schneller: La Corrida Corrida Ol?   Corrida Corrida Es geht um Tod oder Leben Flimmernde Hitze, trommelnde Hufe im weissen sand Corrida Corrida Da hebt Miguel seinen Degen Alle schau'n zu wie gebannt Einer nur kann heut' gewinnen Wer wird dem Teufel entrinnen Hell blitzt die silberne Klinge Und er kommt - sieh' dich vor Sieh' dich vor...   Und ein Schrei von ganz weit oben Ein Gesicht so weiß wie Schnee Eine Rose f?llt zu Boden La Corrida Corrida ?  Ol?!"
  Rachael Yamagata  ,Miles On A Car,You've always been a city boy at heart I've always loved the other life lying underneath the stairs I need the space you only find on the back road But you're the only thing that feels like home Baby it's just miles on a car Just miles on a car I only need a map of where you are There'll never be a place that is too far I want my legacy to read Ooh she did her best to get her lover that was needed The best things in life don't come for free But I'll go the distance if it brings you back to me Baby it's just miles on a car I'm just miles on a car I only need a map of where you are There'll never be a place that is too far And nothing ever has to be so hard 'Cause they're just miles on a car they're just miles on the car Just miles on a car Just miles on a car I only need a map of where you are There'll never be a place that is too far And nothing ever has to be so hard 'Cause they're just miles on a car They're just miles on a car They're just miles on a car
  Group 1 Crew  ,Let It Roll,"Hey, you know we got it goin’ you know we  Ho, you know we got it goin’ you know we    Take a minute to listen to what we talkin’ bout  No time for drama we got a message we're letting out  G1C and the Father we gonna show you how  Let go of all the things that's holding you down  So just believe there ain't nothing getting in our way  Don’t get caught up on the little things that people say  Just let it roll off your back and go about your day  Now all my people come and gather around yeah    Everybody (let it roll)  You know you wanna (let it roll)  Don’t stop (let it roll)  Let it roll, let it roll, let it roll (Let it roll)    you know you wanna (let it roll)  Don’t stop (let it roll)  Let it roll, let it roll, let it roll    Hey everybody we just came to party like  Work your way down, down to the floor  Keep acting like you can’t get enough    They want something that makes dance  Freeze! Got you in a b-boy stance  We! Won’t stop ‘til we get a chance  To see! The whole world dance to this track  Body rock Group 1 won’t stop  Pop & lock We got hip-hop  Whether you want it or not  God ain't done with what we got    Let this music take you to a place  Where all your problems roll away  Feel the rhythm in your soul  And all you worries let them go    Hey DJ play that stuff  I don’t think they’ve had enough  You know how we rock it  Down to the ground won’t stop it    G1C got what you want, wanna  Get crazy if you really want it, want it    Check it out let it roll off your back  Let them hate cause a fact is a fact  We done been through so many things  It always seems like the world keeps holding us back  We ain’t got no time to slow down  The world is in need of a crew who knows how  To rock the mic without compromise  And still keep it fly and bring the funk to the ho-down"
  Weird Al Yankovic  ,Handy,"First things first, I'm a craftsman craftsman Remodelling is my only passion it's my passion And I'm the greatest in the business Want referrals, yo My clientele will bear you witness right, right I can help when your door jamb sticks heh There is nothing in the world I can't fix yeah I do tiles, I do stone, I do bricks Call me, I'll come rushing over with my bag of tricks bag of tricks Where you go when your disposal is rusted rusted Termite problem making you disgusted yuck When your front window is busted hey hey hey Just one man that's always trusted I'm so handy, you already know I'll fix your plumbing when your toilets over flows I'm so handy, I'll bring you up to code When your dishwasher's about to explode Now you see that your furnace is needing some service I'm fully bonded, no need to be nervous Perhaps you would like a new counter Formica Maybe I'll hook up your dish washer combo dryer But all your pipes are antique Your water pressure's too weak You got an attic full of dry rot Because your roof sprung a leak Your fridge is starting to reek Your hardwood floors really squeak But don't you worry I'll just show you my amazing technique Now let me glue that, glue that and screw that, screw that Any random chore you got, well I can do that, do that Or maybe I'll just rewire your house for fun I got 99 problems but a switch ain't one I'm so handy, everyone said so I'll grout your bathroom, resurface your patio I'm so handy, I'm the guy to know When your leaf blower doesn't blow oh oh oh Patch the drywall, clean your gutters and mow the lawn Make that phone call, I'll install anything you want Yeah, check my big staple gun, my socket wrenches are second to none I won't quit 'til I'm done, don't even care if I hammer my thumb OW Still rocking my screwdriver Got the whole world thinking I'm MacGuyver Your heating bills are shocking I can solve that with some duct tape and some caulking Your house is a disaster, huh Need a guy whose a master with the plaster, huh Let me be your stripper Taking off lacquer, no one does it quicker I'm so handy, you already know I'll beat all price quotes, my hourly rates are low I'm so handy, you should call this pro I'm in the phone book and se habla Espanol"
  Leo Sayer  ,More Than I Can Say,I love you more than I can say I'll love you twice as much tomorrow love you more than I can say  I miss you every single day why must my life be filled with sorrow love you more than I can say I don't you know I need you so oh tell me please I gotta know do you mean to make me cry am I just another guy  I miss you more than I can say why must my life be filled with sorrow I love you more than I can say  oh don't you know I need you so so tell me please I gotta know do you mean to make me cry am I just another guy  I love you more than I can say I'll love you twice as much tomorrow love you more than I can say I love you more than I can say I love you more than I can say more than I can say I'll love you twice as much tomorrow More than I can say I'll love you twice as much tomorrow  More than I can say I love you more than I can say  More than I can say I love you more than I can say
  MKTO  ,Wasted,"Before she even falls asleep I got one foot out the door, one foot out the door I think she said her name but I was wasted I don't care anymore, one foot out the door Night after night, day after day Jack and coke smokin' on the fire escape Is it too soon or is it too late Am I crazy to think that I could be in love when it all ends up, it all ends up wasted I'd give you my heart, but I'd just fuck it up, and we'd end up, we'd end up wasted La la la la la la la 3x So I numb the pain away I know how to leave but not how to stay I wonder if I will ever find someone to fill me up inside Someone to kiss my fears away If I believed in god I'd pray, to god I'd pray Am I crazy to think that I could be in love when it all ends up, it all ends up wasted I'd give you my heart, but I'd just fuck it up, and we'd end up, we'd end up wasted La la la la la la la 3x Night after night, day after day Jack and coke smokin' on the fire escape Is it too soon or is it too late Am I crazy to think that I could be in love when it all ends up, it all ends up wasted I'd give you my heart, but I'd just fuck it up, and we'd end up, we'd end up wasted I say we'd end up wasted, ooooh La la la la la la la 3x We'd end up wasted"
  Taylor Swift  ,Delicate,This ain't for the best My reputation's never been worse so You must like me for me We can't make Any promises now can we babe But you can make me a drink Dive bar on the East Side where you at Phone lights up my nightstand in the black Come here you can meet me in the back Dark jeans and your Nikes look at you Oh damn never seen that color blue Just think of the fun things we could do 'Cause I like you This ain't for the best My reputation's never been worse so You must like me for me Yeah I want you We can't make Any promises now can we babe But you can make me a drink Is it cool that I said all that Is it chill that you're in my head 'Cause I know that it's delicate delicate Is it cool that I said all that Is it too soon to do this yet 'Cause I know that it's delicate Isn't it Isn't it Isn't it Isn't it Isn't it Isn't it Isn't it Isn't it delicate Third floor on the West Side me and you Handsome you're a mansion with a view Do the girls back home touch you like I do Long night with your hands up in my hair Echoes of your footsteps on the stairs Stay here honey I don't wanna share 'Cause I like you This ain't for the best My reputation's never been worse so You must like me for me Yeah I want you We can't make Any promises now can we babe But you can make me a drink Is it cool that I said all that Is it chill that you're in my head 'Cause I know that it's delicate delicate Is it cool that I said all that Is it too soon to do this yet 'Cause I know that it's delicate Isn't it Isn't it Isn't it Isn't it Isn't it Isn't it Isn't it Isn't it delicate Sometimes I wonder when you sleep Are you ever dreaming of me Sometimes when I look into your eyes I pretend you're mine all the damn time 'Cause I like you Is it cool that I said all that Is it chill that you're in my head 'Cause I know that it's delicate delicate Yeah I want you Is it cool that I said all that Is it too soon to do this yet 'Cause I know that it's delicate delicate 'Cause I like you Is it cool that I said all that Isn't it Is it chill that you're in my head 'Cause I know that it's delicate Isn't it Yeah I want you Is it cool that I said all that Isn't it Is it too soon to do this yet 'Cause I know that it's delicate Isn't it delicate
"  이민 (Coco Lee, 李玟)  ",Before I Fall In Love,My heart says we've got something real  Can I trust the way I feel  'Cuz my heart's been fooled before  Am I just seeing what I want to see  Or is it true could you really be    Someone to have and hold  with all my heart and soul  I need to know before I fall in love  someone who'll stay around  through all my ups and downs  please tell me now  before I fall in love    I'm at the point of no return  so afraid of getting burned  but I wanna take a chance  Oh please give me a reason to believe  Say you're the one that you'll always be    Someone to have and hold  with all my heart and soul  I need to know before I fall in love  someone who'll stay around  through all my ups and downs  please tell me now  before I fall in love    It's been so hard for me to give my heart away  But I would give my everything just to hear you say    Someone to have and hold  with all my heart and soul  I need to know before I fall in love  someone who'll stay around  through all my ups and downs  please tell me now  before I fall in love
  Jay Sean  ,Emergency,How do you love someone that's hurt so bad Even 911 ain't got a thing to help them How do you mend a wound that cuts straight through their heart And you can see that everything that's left just ain't enough I know we did some damage I know Nobody else understands it No no Well baby here's my shoulder you can lean on And it's 24/7 I know Whenever you need a friend yeah No no I wait on standby and I won't ever leave In case of emergency Emergency emergency In case of emergency How do you love someone who sees the past But can't seem to change or keep repeating mistakes from wayback How do you love someone who sees the bad in everything Drinking from a half-empty glass thinking suicidal Only ones we hurt are ourselves and I don't know why I know we did some damage I know Nobody else understands it No no Well baby here's my shoulder you can lean on You can lean on me And it's 24/7 I know Whenever you need a friend yeah Whenever baby I wait on standby and I won't ever leave In case of emergency Emergency emergency I'll be right there in case of emergency I wouldn't leave you in darkness Weren't I always here when you needed me the most I will walk with you through all your flames Step away from borderline you know what's done is done You don't need to worry oh In case of emergency In case of emergency yeah You know I Emergency emergency Baby yeah yeah In case of emergency in case of emergency
  Guy Sebastian  ,All I Need Is You (Acoustic Ver.),"I remember in the day being oh so independent I remember how I'd say I could never fall I was cynical  Funny now in the days Since you came into my life Now I'll never be the same Baby I'm amazed by the love you gave  Finally I can see What a life really means to me, to me All I need is you in my life forever All I need is you everyday by my side Got to let you know you're the one that I treasure I can search the world but never find A better love that is between you and I (I) All I need is you (Yeah, oh, oooh, yeah, I)  When I look into your eyes There's a feeling that I can't explain That is when I realise That all I desire is to lay by your side Know whenever I'm alone I wonder how I lived without you Should've known all along That my only world is with you in it girl  Suddenly I can see What a life really means to me yeah, to me Yeah  All I need is you in my life forever All I need is you everyday by my side Got to let you know you're the one that I treasure I can search the world but never find A better love that is between you and I (I) All I need is you (Yeah, oh, oooh, yeah, I)  How did I find such a love so sweet When I've only done a little right Now I can see that it can be deserved That the freedom that you give is mine (yeah, yeah)  All I need is you in my life forever All I need is you everyday by my side Got to let you know you're the one that I treasure I can search the world but never find A better love that is between you and I (I) All I need is you in my life forever All I need is you everyday by my side Got to let you know you're the one that I treasure I can search the world but never find A better love that is between you and I (I) All I need is you All I need is you All I need is you All I need is you All I need is you All I need is you All I need is you All I need is you All I need is you All I need is you All I need is you All I need is you All I need is you All I need is you All I need is you"
  Labrinth  ,Where The Wild Things,We live that Vegas life With a face like Krugger and Jason We made some friends that night There was rum red wine there was Jameson's Taking no prisoners right Yeah we own the sky like spaceships We float on air So high off the ground We float on air Hey don't you know Ooh-ooh ooh-ooh Oh yes it's gonna happen tonight Hey don't you know Ooh-ooh ooh-ooh Cinderella's burnin' up with Snow White It's where the wild things are It's where the wild things are It's where my heart's gon' start It's where the wild things are Put your fucking glasses up Animals animals Put your fucking glasses up Look ma I'm flying now The young the rich and the reckless She took my hand and she let me down To the powder room and the necklace You can't bring us back to earth 'Cause the poison's got us in heaven We float on air Don't fuck with my heart I'll float on air Hey don't you know Ooh-ooh ooh-ooh Oh yes it's gonna happen tonight Hey don't you know Ooh-ooh ooh-ooh Cinderella's burnin' up with Snow White It's where the wild things are It's where the wild things are It's where my heart's gon' start It's where the wild things are Put your fucking glasses up Animals animals Put your fucking glasses up Hands up Put your fucking glasses up
"  Cleo Laine ,  John Williams  ",He Was Beautiful,"He was beautiful, beautiful to my eyes.From the moment I saw him.Sun filled the sky.He was so so beautiful, beautiful just to hold.In my dreams he was spring time Winter was cold.How could I tell him what I so clearly could seeThough I longed for him and althoughtrust in me completely So I never could be free.Oh, but it was beautiful knowing now that he canI will always remember times that we sharedNow it's all over still the feelings linger onFor my dream keeps returning now that he's gone.For it was beautiful, beautiful, beautiful to be loved."
  Tyler Shaw  ,It Happens All the Time,"All of the noise inside our room is quiet with rage  And both of our minds are unsure  To all of these ears outside our walls  Our home is ours.  Where love seemed to feel our hearts.   But these pictures can tell lies  And my words will still fall short  And my heart lays disguised  I'm sorry I   Never meant to make you cry  Never meant to make you love me  Now I'm wide awake with open eyes  Lost in all the love that we shared.  Oh, I'm sorry that you even care  Break these chains and walk without me.   Your eyes are red.  The lie was born, stole our truth  Beneath all your joy, lay my despair.  Behind all these clouds,  There is no sun to raise its head  The love we have left is just yours.   And these pictures can tell lies  And my words will still fall short  And my heart lays disguised  I'm sorry I   Never meant to make you cry  Never meant to make you love me  Now I'm wide awake with open eyes  Lost in all the love that we shared.  Oh, I'm sorry that you even care  Break these chains and walk without me.   All our ways were paved with gold  But built upon the sand  And we could climb above the water  And rest upon the land.  It's up to you, you make the choice  For I could stay if you need  For our home, for your heart.   Never meant to make you cry  Never meant to make you love me  Now I'm wide awake with open eyes  Lost in all the love that we shared.  Oh, I'm  Never meant to make you cry  Never meant to make you love me  Oh, I'm sorry that you even care  Break these chains and walk without me"
  Paul McCartney  ,Carry That Weight,"""Boy, you gotta carry that weight Carry that weight a long time Boy, you gotta carry that weight Carry that weight a long time  I never give you my pillow I only send you my invitation And in the middle of the celebrations I break down  Boy, you gotta carry that weight Carry that weight a long time Boy, you gotta carry that weight Carry that weight a long time  """
  Sia  ,Big Girls Cry,Tough girl In the fast lane No time for love No time for hate No drama no time For games Tough girl Whose soul aches I'm at home On my own Check my phone Nothing though Act busy Order in Pay TV It's agony I may cry ruining my makeup Wash away all the things you've taken And I don't care if I don't look pretty Big girls cry when their hearts are breaking Big girls cry when their hearts are breaking Big girls cry when their heart is breaking Tough girl I'm in pain It's lonely at the top Blackouts and airplanes I still pour you a glass of champagne Tough girl Whose soul aches I'm at home On my own Check my phone Nothing though Act busy Order in Pay TV It's agony I may cry ruining my makeup Wash away all the things you've taken And I don't care if I don't look pretty Big girls cry when their hearts are breaking Big girls cry when their hearts are breaking Big girls cry when their hearts are breaking I wake up I wake up I wake up I wake up I wake up I wake up I wake up I wake up I wake up I wake up I wake up I wake up I wake up alone I may cry ruining my makeup Wash away all the things you've taken And I don't care if I don't look pretty Big girls cry when their hearts are breaking Big girls cry when their hearts are breaking Big girls cry when their heart is breaking
