artist,title,lyric
  The Ludvig  ,I`m in Love With You,"It's late in the evening And I'm waiting for you Soon I'll stop breathing And I'll blame it on the full moon  Chorus So darling, please believe I'm in love with you I'm in love with you So darling, please believe I'm in love with you I'm in love with you  Verse 2 Leave your shoes at the door I can't wait no more We might be too young But I think we're in love  Chorus So darling, please believe I'm in love with you I'm in love with you So darling, please believe I'm in love with you I'm in love with you  Bridge Time flies by In your eyes When I am with you I feel alive  Chorus So darling, please believe I'm in love with you I'm in love with you So darling, please believe I'm in love with you I'm in love with you So darling, please believe I'm in love with you"
  Frank Walker  ,Stitch Em Up (feat. Justin Jesso),You crashed my car I drank too much We fought all night 'Bout you and I And called it love When you say goodbye I'd had enough But in the end I keep comin' back to us Can't we just remember all the good times All the good times we had Can't we just remember all the good times So we don't hurt so bad I don't wanna hate you but if I forget I know it'll hurt a little less Can't we just remember all the good times And never make the same mistakes again We'll never heal these scars We'll never lose this love We'll break each other's hearts So we can stitch 'em up We'll never heal these scars We'll never lose this love We'll break each other's hearts So we can stitch 'em up So we can stitch 'em up Don't get upset And block my calls I'd come home late you'd yell And I would punch the walls And when I left you'd had enough But in the end You still miss the thought of us Can't we just remember all the good times All the good times we had Can't we just remember all the good times So we don't hurt so bad I don't wanna hate you but if I forget I know it'll hurt a little less Can't we just remember all the good times And never make the same mistakes again We'll never heal these scars We'll never lose this love We'll break each other's hearts So we can stitch 'em up We'll never heal these scars We'll never lose this love We'll break each other's hearts So we can stitch 'em up We'll never heal these scars We'll never lose this love We'll break each other's hearts So we can stitch 'em up So we can stitch 'em up So we can stitch 'em up
  Vazquez Sounds  ,Let It Be,When i find myself in times of trouble Mother Mary comes to me Speaking words of wisdom Let it be And in my hours of darkness She is standing bright in front of me Speaking words of wisdom Let it be Let it be Let it be Let it be Let it be Whisper words of wisdom Let it be When the broken hearted people Living in the world agree There will be an answer Let it be Though they may be parted There is still a chance that they will see There is will be an answer Let it be Let it be Let it be Let it be Let it be There is will be an answer Let it be Let it be Let it be Let it be Let it be Whisper words of wisdom Let it be Let it be Let it be Let it be Let it be Whisper words of wisdom Let it be When the night is cloudy There is still a light that shines on me Shine until tomorrow Let it be I wake up to the sound of music Mother Mary comes to me Speaking words of wisdom Let it be Let it be Let it be Let it be Let it be There is will be an answer Let it be Let it be Let it be Let it be Let it be There is will be an answer Let it be Let it be Let it be Let it be We are just let it be Whisper words of wisdom Let it be
  Lapsley  ,Brownlow,This is how I'm seeing us go This is how I'm seeing us go I'm higher than I was before Higher than I was before This is how I'm seeing us go Higher than I was before Higher than I was before This is how I'm seeing us go I set the deal straight But 24 7 a person can't wait I will turn and walk away If you want me to If it's best for you If you want me to I wouldn't say that I was known for doing the right thing I wouldn't say that I was always comfortable in my own skin No I know But I know It's like I'm jumping into a pool that I don't know where the bottom end is What's the current and I don't know if I am sure of this But I live for the moment My life on the turn when it comes down to this And when I am sure of this And when it comes down to this And when I am sure of this And when it comes down to this And when I am sure of this And when it comes down to this I'm higher than I was before Higher than I was before This is how I'm seeing us go Higher than I was before Higher than I was before This is how I'm seeing us go I set the deal straight But 24 7 a person can't wait I will turn and walk away If you want me to If it's best for you If you want me to I wouldn't say that I was known for doing the right thing I wouldn't say that I was always comfortable in my own skin No I know But I know It's like I'm jumping into a pool that I don't know where the bottom end is What's the current and I don't know if I am sure of this But I live for the moment My life on the turn when it comes down to this And when I am sure of this And when it comes down to this And when I am sure of this And when it comes down to this And when I am sure of this And when it comes down to this This is how I'm seeing us go This is how I'm seeing us go
  Barry Manilow  ,Looks Like We Made It,There you are lookin' just the same as you did last time I touched you And here I am close to gettin' tangled up inside the thought of you Do you love him as much as I love her And will that love be strong when old feelings start to stir Looks like we made it Left each other on the way to another love Looks like we made it Or I thought so till today Until you were there everywhere And all I could taste was love the way we made it Love's so strange playin' hide and seek with hearts and always hurtin' We're the fools standin' close enough to touch those burnin' memories And if I hold you for the sake of all those times love made us lose our minds Could I ever let you go Whoa no we made it Left each other on the way to another love Looks like we made it Or I thought so till today Until you were there everywhere And all I could taste was love the way we made it Oh we made it Looks like we made it Left each other on the way to another love Looks like we made it Or I thought so till today Until you were there everywhere And all I could taste was love the way we made it Looks like we made it Oh babe we made it
  Yonezu Kenshi  ,Petrichor,これは夢かもしれない (코레와 유메카모 시레나이) 이건 꿈일지도 몰라  深く霧の立ちこめた場所で (후카쿠 키리노 타치 코메타 바쇼데) 깊은 안개가 가득한 곳에서  一人？き？けた (히토리 아루키 츠즈케타) 혼자서 계속 걷기 시작 했어  何？へ向かうのかわからないまま (도코에 므카우노카 와카라니이 마마) 어디로 가는지도 모르는 채  今何の？てもなく (이마 난노 아테모 나쿠) 지금 갈 곳도 없이  意味も見つからず迷いだす (이미모 미츠카라즈 마요이다스) 의미도 찾지 못한 채 헤매기만 해  心は？れるビアンコの海 (코코로와 유레루 비안코노 우미) 마음은 흔들리는 비앙코의 바다  レインコ？トを這う水滴が？けては落ちていく (레인코토오 하우 스이테키가 하지케테와 오치테이쿠) 우비를 기어가는 물방울은 터져 떨어져 가고  ？しさはまだ 募っていく (므나시사와 마다 츠놋테 이쿠) 공허함은 아직 쌓여가고 있어  また僕は大事なことを忘れて彷徨う亡？ (마타 보쿠와 다이지나 코토오 와스레테 사마요우 보우레이) 또 다시 난 소중한 것을 잃고 헤매는 망령  いつまで？っても歌えない (이츠마데 탓테모 우타에나이) 아무리 시간이 지나도 노래 할 수 없어  間違いさえもわからない (마치가이사에모 와카라나이) 잘못 조차 모르고  ここは今空？な夢の世界とそう思い？んで (코코와 이마 쿠우쿄나 유메노 세카이토 소우 오모이콘데) 여기는 지금 공허한 꿈의 세계라고 믿고  僕は？いてくんだって (보쿠와 아루이테쿤닷테) 나는 걸어가고 있었어  叫び疲れたまま (사케비 츠카레타마마) 소릴 지르고 지친 채로  これは夢かもしれない (코레와 유메카모 시레나이) 이건 꿈일지도 몰라  だとすればいつ目が？めるのか (다토스레바 이츠 메가 사메루노카) 그렇다고 하면 언제 깨는 걸까  もしも？めぬ夢なら (모시모 사메누 유메나라) 혹시 깰 수 없는 꿈이라면  それは夢と呼べるだろうか (소레와 유메토 요베루 다로우카) 그것도 꿈이라고 할 수 있을까  重たい？に？せ返る雨が降り (오모타이 카라다니 므세카에루 아메가 후리) 무거운 몸에 숨이 막힐 듯 비가 내리고  きっとまだ心は？れる弛んだ空？ (킷토 마다 코코로와 유레루 타룬다 쿠우키) 분명 아직 마음은 흔들리고 나른한 공기에  泰山木の？は息をつき眠っている (타이산보쿠 츠보미 이키오 츠키 네믓테이루) 태산목 꽃봉오리는 숨을 내쉬며 잠들고 있어  ？しさはまだ 募っていく (므나시사와 마다 츠놋테이쿠) 공허함은 아직 쌓여만 가  怖がって躊躇してどうしようもなく彷徨う亡？ (코와갓테 츄-쵸시테 도우시요-모나쿠 사마요우 보우레이) 무서워하고 주저하고 어쩔 수가 없이 헤매는 망령  誰かのせいにしてしまいたい (다레카노 세이니 시테시마이타이) 누군가의 탓으로 해버리고 싶은데  それすらどうも難しいここは今空？な夢の (소레스라 도우모 므즈카시이 코코와 이마 쿠우쿄나 유메노) 그것조차 너무 어려워 여긴 지금 공허한 꿈 속  世界とそう思い？んで ただただそう思い？んで (세카이토 소우 오모이콘데 타다타다 소우 오모이 콘데) 세상이라 믿어 그냥 그렇게 믿고  ？しさがのしかかる (므나시사가 노시카카루) 공허함에 몸을 짓눌려  また僕は大事なことを忘れて彷徨う亡？ (마타 보쿠와 다이지나 코토오 와스레테 사마요우 보우레이) 또 다시 난 소중한 것을 잃고 헤매는 망령  いつまで？っても歌えない (이츠마데 탓테모 우타에나이) 아무리 시간이 지나도 노래 할 수 없어  間違いさえもわからない (마치가이사에모 와카라나이) 잘못 조차 모르고  ここは今空？な夢の世界とそう思い？んで (코코와 이마 쿠우쿄나 유메노 세카이토 소우 오모이콘데) 여기는 지금 공허한 꿈의 세계라고 믿고  僕は？いてくんだって (보쿠와 아루이테쿤닷테) 나는 걸어가고 있었어  叫び疲れたまま (사케비 츠카레타마마) 소릴 지르고 지친 채로  ？き？けたまま (아루키 츠즈케타마마) 계속 걷는 채로
  Why Don`t We  ,Come To Brazil,We was up late 'til the daytime She was movin' to the bassline Big butt but little waistline Can't fit it all on the FaceTime Skrt-Skrt She said You don't even know me If it's real love better show me 'Cause she don't plan on slowing down The party was boring then without warning Saw something foreign walk through the door And I can't ignore it I need some more yeah I just might come to Brazil Met her late night last night at a party in the Hills She told me how she liked my vibe and I said That's real Said she goin' home in the morning I said Well you're so fine I might come to Brazil We on the way to the airport She 'bout to put a stamp on my passport One-way ticket ain't coming home ooh The party was boring then without warning Saw something foreign walk through the door And I can't ignore it I need some more yeah I just might come to Brazil Met her late night last night at a party in the Hills She told me how she liked my vibe and I said That's real That's real Said she goin' home in the morning I said Well you're so fine I might come to Brazil Brazil I could catch a flight red-eye Girl it's no big deal It's no big deal And I ain't tryna flex too much that's just how I feel Said she goin' home in the mornin' I said Well Why don't we come to Brazil I might Met her late night last night at a party in the Hills In the Hills yeah party in the Hills She told me how she liked my vibe and I said That's real Real that's real Said she goin' home in the morning I said Well I might oh well you're so fine I might come to Brazil
  Nico & Vinz  ,Our Love,"I see you holding it in I never, ever want you feeling this way Let it out, I know I've been gone I still love you baby, nothing has changed Been caught up working every day, every night And we're drifting apart It's my fault, but I'll make it right, make it right I'm going back to your heart For our love, our love Everything can wait, everything can wait for our love And right now, right now I will find a way, so you don't have to wait for my love For our love, our love Everything can wait, everything can wait for our love And right now, right now Nothing's in the way, so you don't have to wait for my love You're right here, right by my side Ready to pick me up when I'm down But I failed to show you that I Appreciate it when you're around Been caught up working every day, every night And we're drifting apart It's my fault, but I'll make it right, make it right I'm going back to your heart For our love, our love Everything can wait, everything can wait for our love And right now, right now I will find a way, so you don't have to wait for my love For our love, our love Everything can wait, everything can wait for our love And right now, right now Nothing's in the way, so you don't have to wait for my love Everything can wait for you There's nothing that I wouldn't do That's how much you mean to me yeah So I'm making time For our love, our love Everything can wait, everything can wait for our love And right now, right now I will find a way, so you don't have to wait for my love For our love, our love Everything can wait, everything can wait for our love And right now, right now Nothing's in the way, so you don't have to wait for my love For our love, our love Everything can wait, everything can wait for our love And right now, right now I will find a way, so you don't have to wait for my love For our love, our love Everything can wait, everything can wait for our love And right now, right now Nothing's in the way, so you don't have to wait for my love"
  Mariah Carey  ,Petals,I've often wondered if there's Ever been a perfect family I've always longed for undividedness And sought stability A flower taught me how to pray But as I grew that flower changed She started failing in the wind Like golden petals scattering And I miss you dandelion And even love you And I wish there was a way For me to trust you But it hurts me every time I try to touch you But I miss you dandelion And even love you I gravitated towards a patriarch So young predictably I was resigned to spend my life With a maze of misery A boy and girl befriended me We're bonded through despondency I stayed so long but finally I fled to save my sanity And I miss you little sis and Little brother And I hope you realize I'll always love you And although you're struggling You will recover And I miss you little sis and Little brother So many I considered Closest to me Turned on a dime and sold me Out dutifully Although that knife was chipping Away at me They turned their eyes away and Went home to sleep And I missed a lot of life But I'll recover Though I know you really like To see me suffer Still I wish that you and I'd Forgive each other 'Cause I miss you Valentine And really loved you I guess I loved you I tried so hard But To preserve my sanity And I found the strength to break away Fly
  Arin Ray  ,Who Came Up Missin,"[Chorus: Arin Ray] Who came up missin’? I know who didn’t (I think it was me) You heard about it I wouldn’t doubt it (Ooh, i don’t want her)  [Bridge] Let’s groove to the beat of our hearts Even though they could tell on you (Follow me) Only have it be us And touch In love (In love)  [Chorus: Arin Ray] Who came up missin’? I know who didn’t I heard about it I wouldn’t doubt it  [Outro] Let’s groove Who came up missin’? (Let’s groove, let’s groove) Who came up missin’? Who came up missin’? Who came up missin’?"
  Justin Bieber  ,One Less Lonely Girl (Album Version),one less lonely girl one less lonely girl One less lonely girl How many I told you`s And start overs and shoulders Have you cried on before How many promises be honest girl How many tears you let hit the floor How many bags you`d packed Just to take `em back tell me that How many either or`s But no more If you let me inside of your world There`ll be one less lonely girl Oh oh I saw so many pretty faces Now all I see is you Oh no Don`t need these other pretty faces Cause when your mine in the world There`s gonna be one less lonely girl One less lonely girl One less lonely girl One less lonely girl There`s gonna be one less lonely girl I`m gonna put you first I`ll show you what you`re worth If you let me inside your world There`s gonna be one less lonely girl Christmas wasn`t merry 14th of February Not one of `em spent with you How many dinner dates set dinner plates And he didn`t even touch his food How many torn photographs I saw you taping back Tell me that couldn`t see an open door But no more If you let me inside of your world There`ll be one less lonely girl Oh oh I saw so many pretty faces Now all I see is you Oh no Don`t need these other pretty faces Cause when your mine in this world There`s gonna be one less lonely girl One less lonely girl One less lonely girl One less lonely girl I`m gonna put you first I`ll show you what you`re worth If you let me inside your world There`s gonna be one less lonely girl I can fix up your broken heart I can give you a brand new start I can make you believe I just wanna set one girl free to fall She`s free to fall With me My hearts locked and nowhere that I got the key I`ll take her and leave the world With one less lonely girl one less lonely girl one less lonely girl One less lonely girl one less lonely girl There`s gonna be one less lonely girl I`m gonna put you first I`ll show you what you`re worth If you let me inside your world one less lonely girl One less lonely girl One less lonely girl I`m gonna put you first I`ll show you what you`re worth If you let me inside your world There`s gonna be one less lonely girl
  Atomic Kitten  ,The Tide Is High (Get The Feeling),The tide is high But I'm holding on I'm gonna be your number one I'm not the kinda girl Who gives up just like that Oh no It's not the things you do That tease and hurt me bad But it's the way you do the things You do to me I'm not the kinda girl Who gives up just like that Oh no The tide is high But I'm holding on I'm gonna be your number one The tide is high But I'm holding on I'm gonna be your number one Number one Number one Every girl wants You to be her man But I'll wait 'Til it's my turn I'm not the kinda girl Who gives up just like that Oh no The tide is high But I'm holding on I'm gonna be your number one The tide is high But I'm holding on I'm gonna be your number one Number one Number one Everytime that I get the feeling You give me something to believe in Everytime that I got you near me I don't believe that I want it to be But you know that I'm gonna take my chance now I'm gonna make it happen somehow And you know I can take the pressure A moment's pain for a lifetime pleasure Every girl wants You to be her man But I'll wait 'Til it's my turn I'm not the kinda girl Who gives up just like that Oh no The tide is high But I'm holding on I'm gonna be your number one The tide is high But I'm holding on I'm gonna be your number one Everytime that I get the feeling You give me something to believe in Everytime that I got you near me I don't believe that I want it to be But you know that I'm gonna take my chance now I'm gonna make it happen somehow And you know I can take the pressure A moment's pain for a lifetime pleasure
  Debbie Gibson  ,Electric Youth ,I get lost in your eyes and I feel my spirits rise and soar like the wind is it love that I am in I get weak in a glance Isn't this what's called romance and now I know cause when I'm lost I can't let go I don't mind not knowing what I'm headed for You can take me to the skies It's like being lost in heaven when I'm LOST IN YOUR EYES I just fell Don't know why Something's there we can't deny and when I first knew was when I first looked at you And if I can't find my way If salvation seems worlds away oh I'll be found when I am LOST IN YOUR EYES I don't mind not knowing what I'm headed for You can take me to the skies Oh it's like being lost in heaven When I'm LOST IN YOUR EYES I get weak in a glanc Isn't this what's called romance Oh I'll be found When I am lost in your eyes
  Smokey Robinson  ,Speak Low (Album Ver.),"Speak low when you speak love Our summer day withers away too soon, too soon Speak low when you speak love Our moment is swift, like ships adrift, we're swept apart, too soon Speak low, darling, speak low Love is a spark, lost in the dark too soon, too soon.  I feel wherever I go That tomorrow is near, Tomorrow is here and always too soon, Time is so old and love so brief Love is pure gold and time a thief.  We're late, darling, we're late, The curtain descends, everything ends too soon, too soon.  I wait, darling, I wait, Will you speak low to me, speak love to me and soon  I wait, darling, I wait, Will you speak low to me, Slow to me, oh please, Just don't say no to me Let it flow to me, slow to me Soon, soon, soon, Oh, soon, darling, speak low to me Darling, speak slow to me, Oh, oh, oh!  ------------- Lyrics Powered by LyricFind Written By NASH, OGDEN / WEILL, KURT Lyrics © Warner/Chappell Music, Inc."
  Olly Murs  ,Love Me Again,"You walk in, you're with him, it ain't exactly hard to notice Yeah, yeah, yeah Watch you dance in his hands, it's hard to deal with all this closeness, closeness  [Pre-Chorus] Now I'm standing here all alone Putting numbers up in my phone But none of these girls compare to you Three drinks baby I'm a mess Too late to second guess One thing I gotta ask you  [Chorus] Can you love, can you love, can you love me again? I messed up, I know what I did wrong, but don't say it's the end Can you love, can you love, can you love me again? Let's forgive and forget 'cause I'm hating this state that I'm in Can you love, can you love, can you love me again? (oh na na)  [Post-Chorus] Hey, l-l-love me again (Oh na na) Hey, l-l-love me again (Oh na na) Hey, l-l-love me again (Oh na na) Hey, l-l-love me  [Verse 2] Confession; I'm messed up That chapters gone, why can't we close it? Yeah, yeah, yeah See you there in the dark, it's like you're moving in slow motion Emotion (Can you love, can you love, can you love?)  [Pre-Chorus] Now I'm standing here all alone Putting numbers up in my phone But none of these girls compare to you Three drinks baby I'm a mess Too late to second guess One thing I gotta ask you  [Chorus] Can you love, can you love, can you love me again? I messed up, I know what I did wrong, but don't say it's the end Can you love, can you love, can you love me again? Let's forgive and forget 'cause I'm hating this state that I'm in Can you love, can you love, can you love me again? (Oh na na)  [Post-Chorus] Hey, l-l-love me again (Oh na na) Hey, l-l-love me again (Oh na na) Hey, l-l-love me again (Oh na na) Hey, l-l-love me  [Bridge] Missing that, missing that hot body Missing you putting that up on me Wishing you wouldn't hang up on me (Can you love, can you love, can you love?) Cause I'm missing that, missing that hot body Missing you putting that up on me Wishing you wouldn't hang up on me, yeah  [Outro] Hey, l-l-love me again (Oh na na) Hey, l-l-love me again (Can you love me?) Hey, l-l-love me again (Oh na na) Hey, l-l-love me again (Can you love me?) Hey, l-l-love me again (Oh na na) Hey, l-l-love me again (Can you love me?) Hey, l-l-love me again (Oh na na) Hey, l-l-love me again (Can you love me?) Hey, l-l-love me again (Oh na na) Hey, l-l-love me again (Can you love me again?) Hey, l-l-love me again (Oh na na) Hey, l-l-love me again (Can you love me again?) L-l-love me again"
  Motley Crue  ,Shout At The Devil,He's the wolf screaming Lonely in the night He's the blood stain On the stagep He's the tear in your eye Been tempted by his lie He's the knife in your back He's rage He's the razor to the knife Oh lonely is our lives My head's spinnin' Round and round But in seasons of wither We'll stand and deliver Be strong and laugh and...... Shout at the devil  He'll be the love in your eyes He'll be the blood Between your thighs And then have you scream For more He'll put strength To the test He'll put the thrill Back in bed Sure you've heard It all before He'll be the risk in the kiss Might be anger on your lips Might run scared For the door But in seasons of wither We'll stand and deliver Be strong and laugh and.. Shout at the devil
