artist,title,lyric
  George Ezra  ,Pretty Shining People,"(Hey, pretty shining people)  [Verse 1] Me and Sam in the car, talking 'bout America Heading to the wishing well, we've reached our last resort And I turned to him, said, ""Man help me out I fear I'm on an island in an ocean full of change Can't bring myself to dive in to an ocean full of change  Am I losing touch Am I losing touch now?"" (Losing touch now)  [Pre-Chorus] He said, ""Why why, what a terrible time to be alive If you're prone to overthinking and Why why, what a terrible time to be alive If you're prone to second-guessing and..."" (Hey)  [Chorus] Hey pretty smiling people, we're alright together We're alright together Hey pretty shining people, we're alright together We're alright together, he-ey  [Verse 2] Took it in turns to dream about the lottery What we might have done If we had entered and had won We're (Ah) each convinced that nothing would have changed But if this were the case Why is it a conversation anyway?  Are we losing touch? Are we losing touch now? (Ah)  [Pre-Chorus] He said, ""Why why, what a terrible time to be alive If you're prone to overthinking and Why why, what a terrible time to be alive If you're prone to second-guessing and...""  [Chorus] Hey pretty smiling people, we're alright together We're alright together Hey pretty shining people, we're alright together We're alright together, he-ey Hey pretty smiling people, we're alright together We're alright together Hey pretty shining people, we're alright together We're alright together Hey pretty smiling people, we're alright together We're alright together Hey pretty shining people, we're alright together We're alright together, he-ey  [Bridge] Don't we all need love? The answer is easy Don't we all need love? The answer is easy Don't we all need love? The answer is easy Don't we all need love? The answer is easy  [Chorus] Hey pretty smiling people, we're alright together We're alright together Hey pretty shining people, we're alright together We're alright together Hey pretty smiling people, we're alright together We're alright together Hey pretty shining people, we're alright together We're alright together, he-ey"
  MØ  ,Fire Rides (Night Ver.),"Your sweet violin house Believes the signs were seen on the clouds Believes the signs were read in our dreams But we seem to follow through the stages What’s it gonna be with the violins What’s it gonna be when the fire rides in What’s it gonna be right when the sound of you and I die young What am I to do with my room oh But the wall’s turning yellow What am I to do in the city if I can’t have it all and I just wanna feel pretty But my old dreams are doomed as a soft record I found in these in the city as I found in the eyes of yours As I found in the eyes of yours In too deep Give up and run No fire rides in but you gotta go In too deep I had become My darkest dream Of which I’m running from What am I to do with the thunder Don’t know who to cost or to pawn I just wanna walk to the mountains, walk to the mountains all alone But my old dreams are doomed as a soft record I found in these in the city as I found in the eyes of yours As I found in the eyes of yours In too deep Give up and run No fire rides in but you gotta go In too deep I had become My darkest dream Of which I’m running from In too deep My pulse is gone No fire rides in but you gotta go In too deep I had become My darkest dream Of which I’m running from You’re nothing You’re nothing You’re nothing We’re nothing What’s it gonna be with the violins What’s it gonna be when the fire rides in What’s it gonna be right when the sound of you and I die young"
  Lady GaGa  ,Marry The Night (The Weeknd & Illangelo Remix),I`m gonna marry the night I won`t give up on my life I`m a warrior queen Live passionately tonight I`m gonna marry the dark Gonna make love to the stark I`m a soldier to my own emptiness I am a winner I`m gonna marry the night I`m gonna marry the night Gonna marry the night I`m gonna marry the night I`m not gonna cry anymore I`m gonna marry the night Leave nothin` on these streets to explore Ma-ma-ma-marry Ma-ma-ma-marry Ma-ma-ma-marry the night Oh Ma-ma-ma-marry Ma-ma-ma-marry Ma-ma-ma-marry the night I`m gonna lace up my boots Throw on some leather and cruise Down the street that I love In my fishnet gloves I`m a sinner Then I`ll go down to the bar But I won`t cry anymore I`ll hold my whiskey up high Kiss the bartender twice I`m a loser I`m gonna marry the night I`m gonna marry the night I`m gonna marry the night I`m not gonna cry anymore I`m gonna marry the night Leave nothin` on these streets to explore Ma-ma-ma-marry Ma-ma-ma-marry Ma-ma-ma-marry the night Oh Ma-ma-ma-marry Ma-ma-ma-marry Ma-ma-ma-marry the night Nothing`s too cool To take me from you New York is not Just a tan that you`ll never lose Love is the new Denim or black Skeleton guns Are wedding bells in the attic Get Ginger ready Climb to Camino front Won`t poke holes in the seats with my heels `Cause that`s where we make love Come on and run Turn the car on and run I`m gonna marry the night I`m gonna burn a hole in the road I`m gonna marry the night Leave nothin` on these streets to explode Ma-ma-ma-marry (marry) Ma-ma-ma-marry Ma-ma-ma-marry the night Oh Ma-ma-ma-marry (marry) Ma-ma-ma-marry (marry) Ma-ma-ma-marry the night Oh Ma-ma-ma-marry Ma-ma-ma-marry Ma-ma-ma-marry the night I`m gonna marry (marry) Marry (marry) I`m gonna marry (marry) Marry (marry) Come on Come on The night The night The night The night The night The night The night The night The night The night The night The night The night The night The night The night The night
  Daste  ,Palette,Picture the world Picture the world at your feet Your mind will dissolve Your mind will dissolve all you think  Verse 2 Your lifestyle is all Your lifestyle is all that they see The music is yours The music is yours to keep
  Michael Jackson  ,Human Nature,Looking out Across the nighttime The city winks a sleepless eye Hear her voice Shake my window Sweet seducing sighs Get me out Into the nighttime Four walls won't hold me tonight If this town Is just an apple Then let me take a bite If they say Why why tell 'em that it's human nature Why why does he do it that way If they say Why why tell 'em that it's human nature Why why does he do me that way Reaching out To touch a stranger Electric eyes are everywhere See that girl She knows I'm watching She likes the way I stare If they say Why why tell 'em that it's human nature Why why does he do me that way If they say Why why tell 'em that it's human nature Why why does he do me that way I like livin' this way I like lovin' this way That way Why why That way Why why Looking out Across the morning Where the city's heart begins to beat Reaching out I touch her shoulder I'm dreaming of the street If they say Why why tell 'em that it's human nature Why why does he do me that way If they say Why why ooo tell 'em Why why does he do me that way If they say why why ooo tell 'em why why does he do me that way If they say why why da da da da da da da da why why does he do me that way I like living this way
  Phil Good  ,Do You Ever?,"Do you ever wonder how Or if you're really who you're supposed to be? Lately I've been wondering Do you ever wanna know If you could forget what you once believed? Lately I've been wondering  [Pre-Chorus] Well, I can't be myself imitating someone else No, it won't end well Yeah, I can but I hardly sustain It breaks me down right now Well, I'm on the edge of it  [Chorus] Do you ever wanna Do you ever wanna run Do you ever Do you ever wanna run away? In the middle of the night In the middle of a crowded room Do you ever Do you ever wanna run away?  [Verse 2] I got my mind made up And I'm never coming back again Face it, no more in-between I don't wanna wait no more Wasting time I can't afford, no Not anymore  [Pre-Chorus] Well, I can't be myself imitating someone Can't be myself if I'm always faking it  [Chorus] Do you ever wanna Do you ever wanna run Do you ever Do you ever wanna run away? In the middle of the night In the middle of a crowded room Do you ever Do you ever wanna run away? Yeah Do you ever wanna run away? Do you ever wanna run away?"
  Clare Maguire  ,Break These Chains,I just don’t believe I’m ready for today This paranoid pain is coming back again Oh that picture Momma placed By the window how I hate my face  And there’s people all outside Behind the curtains silver lines With all their lies They’re all like mine all like mine But when the wind blows I’ll go I’ll go  And I will be released Break these chains set me free And I will be released Break these chains  I can think of brighter days They were golden in a way Words were not this grey But now prices will be paid When I walk in the path Of all you guilty ones someday  Cause I cannot help my heart When it’s beating in the dark Afraid next time I won't cry I won't cry And when the times change I’ll go away I’m away  And I will be released Break these chains set me free And I will be released Break these chains set me free Like a pilot I will fly Way up in the sky I’ll be free I’ll be high high high  And I will be released Break these chains Break these chains So I can be released Praying on my knees That I can be released That I can be released I can be released Praying on my knees That I will be released I will be released  And I will be released Break these chains set me free And I will be released Break these chains Set me free  Like a pilot I will fly Way up in the sky I’ll be free I’ll be high high high  And I will be released Break these chains Break these chains  I can think of brighter days They were golden in a way Words were not this grey But I can break these chains
  Trevor Wesley  ,Chivalry Is Dead (Acoustic Bonus Track),Girl just let your hair down Let's paint the whole town Life is our playground Yeah But I'm not a kid no more So I must open doors And make you feel like the lady you are My mamma raised me To be classy Not flashy I'm happy to please you Though I can tell that's not what you're used to And they say they say chivalry is dead dead dead Girl let a real man pick up the slack And treat you with respect Yeah And you don't have to love me Love me Love me You don't have to love me Love me Love me Just 'cause I'm a gentleman don't mean I ain't taking you to bed Oh baby let me buy your meals I see you're head-over-heels I feel like you deserve it There's no pressure We can do whatever makes you comfortable yeah I could float your boat It's cold Take my coat I'll sing a music note From a song that I just wrote Girl just take my hand And let me be your man Though that's not what you're used to And they say they say chivalry is dead dead dead Girl let a real man pick up the slack And treat you with respect Yeah And you don't have to love me love me love me You don't have to love me Just 'cause I'm a gentleman don't mean I ain't taking you to bed That's just how you treat a lady treat a lady treat a lady treat a lady treat a lady treat a lady And they say they say chivalry is dead dead dead Girl let a real man pick up the slack And treat you with respect Yeah And you don't have to love me You don't have to love me Just 'cause I'm a gentleman don't mean I ain't taking you to bed Just 'cause I'm a gentleman don't mean I ain't taking you to bed
  J.Fla  ,Are You My Villain (SJUR Remix),Anyone else can talk game But not like you So many people get close But not like you do So close to the truth Wondering what lies feel like You hold me like I'm delicate But you can cut me up with your knife I been walking on a tight rope Feeling like I can't let go can't let go See you on the other end But I don't know what lies below Are you my hero or my villain Are you my hero or my villain my villan Are you my hero or my villain Are you my hero or my villain Don't be the one to come and save the day Then be the one that's gonna fly away Oh no Are you my hero or my villain babe When you say you got me I believe you I know that this is deadly But it's comfortable too I'm too busy playing you To care about the risk this time Come on keep on touching me Give it to me you're mine I been walking on a tight rope Feeling like I can't let go can't let go See you on the other end But I don't know what lies below Are you my hero or my villain Are you my hero or my villain my villan Are you my hero or my villain Are you my hero or my villain Don't be the one to come and save the day Then be the one that's gonna fly away Oh no Are you my hero or my villain babe I want you you want me Love ain't easy I want you you want me Love ain't easy Are you my hero or my villain Are you my hero or my villain my villan Are you my hero or my villain Are you my hero or my villain Don't be the one to come and save the day Then be the one that's gonna fly away Oh no Are you my hero or my villain babe
  Britney Spears  ,Born To Make You Happy,I'm sitting here alone up in my room And thinking about the times that we've been through oh my love I'm looking at a picture in my hand Trying my best to understand I really want to know what we did wrong with a love that felt so strong If only you were here tonight I know that we could make it right I don't know how to live without your love I was born to make you happy 'Cause you're the only one within my heart I was born to make you happy Always and forever you and me That's the way our life should be I don't know how to live without your love I was born to make you happy I know I've been a fool since you've been gone I'd better give it up and carry on oh my love 'Cause living in a dream of you and me is not the way my life should be I don't want to cry a tear for you So forgive me if I do If only you were here tonight I know that we could make it right I don't know how to live without your love I was born to make you happy 'Cause you're the only one within my heart I was born to make you happy Always and forever you and me That's the way our life should be I don't know how to live without your love I was born to make you happy I'd do anything I'd give you my world I'd wait forever to be your girl Just call call out my name and I will be there Just to show you how much I care I don't know how to live without your love I was born to make you happy 'Cause you're the only one within my heart I was born to make you happy Always and forever you and me That's the way our life should be I don't know how to live without your love I was born to make you happy I was born to make you happy Always and forever you and me That's the way our life should be I don't know how to live without your love I was born to make you happy
  Marc Anthony  ,When I Dream At Night,I have been in love and been alone I have traveled over many miles to find a home There's that little place inside of me That I never thought could take control of everything But now I just spend all my time with anyone Who makes me feel the way she does  [Chorus] 'cause I only feel alive when I dream at night Even though she's not real it's all right 'cause I only feel alive when I dream at night Every move that she makes holds my eyes And I fall for her every time  I've so many things I want to say I'll be ready when the perfect moment comes my way I had never known what's right for me Till the night she opened up my heart and set it free But now I just spend all my time with anyone Who makes me feel the way she does  [Chorus]  Now I just spend all my time with anyone Who makes me feel the way she does  [Chorus]
  Noah & The Whale  ,2 Atoms In A Molecule,"Last night I had a dream we were inseparably entwined Like a piece of rope made out of two pieces of vine Held together, holding each other with no one else in mind Like 2 atoms in a molecule inseparably combined  But then I woke from the dream to realise I was alone A tragic event I must admit but let's not be overblown I'm not trying to write a love song just a sad, pathetic moan Maybe I just need a change, maybe I just need a new cologne  Now I look at love like being stabbed in the heart You torture each other from day to day and then one day you part Most of the time it's misery but there's some joy at the start Oh for that I'd say it's worth it, just use a blade that's short and sharp on me  And if love is just a game then how come it's no fun If love is just a game how come I've never won I guess maybe it's possible I might be playing it wrong And that's why every time I roll the dice I always come undone"
  The Beach Boys  ,Sloop John B,"We come on the sloop John B My grandfather and me Around Nassau town we did roam Drinking all night Got into a fight Well I feel so broke up I want to go home  So hoist up the John B's sail See how the mainsail sets Call for the Captain ashore Let me go home, let me go home I wanna go home, yeah yeah Well I feel so broke up I wanna go home  The first mate he got drunk And broke in the Cap'n's trunk The constable had to come and take him away Sheriff John Stone Why don't you leave me alone, yeah yeah Well I feel so broke up I wanna go home  So hoist up the John B's sail See how the mainsail sets Call for the Captain ashore Let me go home, let me go home I wanna go home, let me go home Why don't you let me go home (Hoist up the John B's sail) Hoist up the John B I feel so broke up I wanna go home Let me go home  The poor cook he caught the fits And threw away all my grits And then he took and he ate up all of my corn Let me go home Why don't they let me go home This is the worst trip I've ever been on  So hoist up the John B's sail See how the mainsail sets Call for the Captain ashore Let me go home, let me go home I wanna go home, let me go home Why don't you let me go home"
  Anne-Marie  ,Birthday,I'm another year older I won't cry about you anymore Told my friends to come over To dye my hair mmm It's not even the weekend And I'm wearin' that dress I can't afford Givin' life a new meanin' Without you there Do some stupid shit maybe get a tattoo Oh Whatever I can do to get my mind off you Oh It's my birthday I'ma do what I like I'ma eat what I like I'ma kiss who I like It's my birthday I'ma do what I like I'ma wear what I like I'ma party tonight Goddamn it's my birthday Everybody love me Yeah yeah yeah Look at me give me money Damn it's my birthday Everybody love me And I ain't thinkin' 'bout you It's my birthday I blow out all the candles I blow out all the candles uh I can't even afford my rent Ooh So I'm not buyin' the drinks 'cause I'ma leave that to my friends it's you Ballin' now with everybody in the room yeah That's what I do that's what I do yeah Oh Whatever I can do to get my mind off you Ha that's what I do that's what I do Oh It's my birthday I'ma do what I like I'ma eat what I like I'ma kiss who I like It's my birthday I'ma do what I like I'ma wear what I like I'ma party tonight Goddamn it's my birthday Everybody love me Yeah yeah yeah Look at me give me money Woo Damn it's my birthday Oh-woo Everybody love me And I ain't thinkin' 'bout you It's my birthday Ain't got any wiser Gonna be hungover Never learned my lesson Yeah yeah yeah yeah And I ain't gonna listen I don't really care 'cause It's my birthday I'ma do what I like I'ma eat what I like Yeah I'ma kiss who I like It's my birthday I'ma do what I like Ha I'ma wear what I like I'ma party tonight Goddamn it's my birthday Everybody love me Yeah yeah yeah Look at me give me money Damn it's my birthday Everybody love me And I ain't thinkin' 'bout you It's my birthday my birthday And I ain't thinkin' 'bout you It's my birthday No my birthday No woah And I ain't thinkin' 'bout you No yeah It's my birthday my birthday Yeah it's my birthday and I'ma do whatever I like And I ain't thinkin' 'bout you Yeah do whatever I like It's my birthday my birthday It's my birthday so you better treat me nice
  Bert Kaempfert  ,Wonderland By Night (이용복 `밤하늘의 연가` 원곡인  베르트 켐페르트 악단의 `밤하늘의 부르스`),Stars hang suspended Above a floating yellow moon Two hearts were blended While angels sang a lover's tune And so we kissed Not knowing if our hearts would pay the price But heaven welcomed us to paradise Blessing our love Then came the sunrise Fading the moon and stars from sight Recalling always Our wonderland by night
  Prince Royce  ,With You,"Just a little reminder I'm not a good liar You sat on my pillow Just taking my pride away I talked to my mama She told me find my hideaway I ain't slept in days Cause you're my hideaway I always heard that one is the lonely one I wake up thinking 'bout you Can't go to sleep Can't without you If I could fall, fall asleep With you, with you If I could fall, fall asleep With you, with you Running around, I dropped my heart on my pocket Should've been headed straight to you Making my rounds, I think I lost what I got here Now I can't think of nothing but you I know they say that wouldn't get so lonely But do me a favor End this pain, I ain't slept in days now Come back home, with me If I could fall, fall asleep With you, with you If I could fall, fall asleep With you, with you Loving the feels like your body All of these curves to find you Girl, you belong to me We could be naughty All of my words will be true I'm down to turn up at your party I'm down to be here 'til the morning Loving the feels like your body All of my words'll find you If I could fall, fall asleep With you, with you If I could fall, fall asleep With you, with you With you, with you If I could fall If I could fall"
  Norah Jones  ,After The Fall,I never told you about the summer Everyday was changing Only photographs But life goes on In your mind so warm  Out on my own now And I like the way it feels You couldn't come through And I'm too far gone  After the fall Do you still want it all?  You never told me about the winter Everyday was changing But I remember But life went on In my mind so cold  Out on your own now Do you like the way it feels? Didn't I come through? You were too far gone  After the fall I still want it all
  Billie Eilish  ,ocean eyes,I've been watching you for some time Can't stop staring at those ocean eyes Burning cities and napalm skies Fifteen flares inside those ocean eyes Your ocean eyes No fair You really know how to make me cry When you give me those ocean eyes I'm scared I've never fallen from quite this high Falling into your ocean eyes Those ocean eyes I've been walking through a world gone blind Can't stop thinking of your diamond mind Careful creature made friends with time You left her lonely with a diamond mind And those ocean eyes No fair You really know how to make me cry When you give me those ocean eyes I'm scared I've never fallen from quite this high Falling into your ocean eyes Those ocean eyes No fair You really know how to make me cry When you give me those ocean eyes I'm scared I've never fallen from quite this high Falling into your ocean eyes Those ocean eyes
  R5  ,Smile,"Today I feel like running naked through your street To get your attention whoa I broke up with my girl so tell me where to meet Or did I mention whoa oh oh  I dream on, dream about you What can I do to make you feel all right? Baby I don't want to see you cry, no  I want to see you smile I want to see you smile  Today I feel like blowing all my cash on you I'd buy you anything until I'm broke (until I'm broke) Today I want to turn your skies from gray to blue And if it rains on you I'll be your coat whoa oh oh  I dream on, dream about you What can I do to make you feel all right? Baby, I don't want to see you cry, no  I want to see you smile I want to see you smile  Let me take your picture, baby I'll save it for a rainy day I don't need much I guess I'm just old fashioned in that way So on the count of three, lets see you  A one, a two, a one-two-three!  Smile I wanna make you smile oh oh I wanna see you smile I wanna see you smile  It's the things you do I wanna make you smile"
  Lisa Mitchell  ,Neopolitan Dreams,"""You go on I'll be okay I can dream the rest away It's just a little touch of fate It'll be okay It sure takes its precious time But it's got right and so have I  I turn my head up to the sky I focus one thought at a time I do not let the little thieves Under my tightly buttoned sleeves You couldn't be a longer time I feel like I am walking blind I have nowhere I'll have time  There are no legible signs There are no legible signs  I like the way that you talk I like the way that you walk It's hard to recreate Such an individual gate You wait your turn in the queue You say your sorries and thank you's I don't think you're ever A hundred percent in the room  You're not in the room You're not in the room  Deepest of the dark nights Here lies the highest of highs Neapolitan dreams, stretching out to the sea You wait your turn in the queue You say your sorries and thank you's I don't think you're ever A hundred percent in the room You're not in the room You're not in the room  """
