artist,title,lyric
  Christina Aguilera  ,Oh Holy Night,"Oh yeah, oh yeah, yeah, ooh yeah  Oh holy night The stars are brightly shining It is the night of our dear Savior's birth, oh yeah Now long lay the world in sin and error pining Till he appeared and the soul felt it's worth The thrill of hope, the weary world rejoices For yonder breaks, a new and glorious morn  Fall on your knees Oh hear the angel voices Oh night divine Oh night when Christ was born Oh night divine, oh night, oh night divine  Our Father, who art in heaven Hallowed be thy Name Thy kingdom come, thy will be done On earth as it is in heaven Give us this day our daily bread And forgive us our trespasses As we forgive those who trespass against us Lead us not into temptation But deliver us from evil For thine is the kingdom The power, and the glory For ever and ever Amen  Fall on your knees Oh hear the angels voices Oh night divine, ooh Oh night when Christ was born Oh night divine, oh night  Oh, yeah, yeah [laughs] Oh yeah No oh, oh yeah  Oh ooh, oh ooh Now ooh, oh ooh Oh yeah  It was a holy, holy night Ohh, oh ooh, oh ooh (Oh holy night) It was a holy night when Jesus Christ was born (Oh holy night) Holy Jesus, Jesus Christ (Oh holy night) And the power, and the glory, yeah (Oh holy night) When Jesus Christ, Jesus Christ (Oh holy night) He was born on this night, on this night (Oh holy night) Jesus Christ Forever, and ever, and ever, and ever (Oh holy night)..."
  Tim Kamrad  ,Heartbeat,You make me forget All the weight I got on my back With every heartbeat Save me from the past Let me catch up with every breath Broken pieces Cut my hands But I picked them all up All those demons Kept hunting me down Bullets tried to hit me But you helped me ricochet And there is no one else who treats me This way this way Yeah You make me forget All the weight I got on my back With every heartbeat Save me from the past Let me catch up with every breath With every heartbeat You make me forget All the weight I got on my back With every heartbeat Save me from the past Let me catch up with every breath With every heartbeat Brand new feeling Setting me free baby It’s killing every doubt And you’re the reason You got me back on my feet baby Back on my feet baby Bullets tried to hit me But you helped me ricochet And there is no one else who treats me This way this way Yeah You make me forget All the weight I got on my back With every heartbeat Save me from the past Let me catch up with every breath With every heartbeat Ooh Ooh With every heartbeat Ooh Ooh With every heartbeat Bullets tried to hit me But you helped me ricochet And there is no one else who treats me This way this way Bullets tried to hit me But you helped me ricochet And there is no one else who treats me This way this way Yeah You make me forget All the weight I got on my back now With every heartbeat Save me from the past Let me catch up with every breath With every heartbeat yeah Ooh Oh yeah Ooh With every heartbeat Ooh Let me catch up with every breath With every heartbeat
  Little Mix  ,Wings,Mama told me not to waste my life She said spread your wings my little butterfly Don't let what they say keep you up at night And if they give you shhhh Then they can walk on by My feet feet can't touch the ground And I can't hear a sound But you just keep on running up your mouth yeah Walk walk on over there 'Cause I'm too fly to care oh yeah Your words don't mean a thing I'm not listening Keep talking all I know is Mama told me not to waste my life She said spread your wings my little butterfly Don't let what they say keep you up at night And they can't detain you 'Cause wings are made to fly And we don't let nobody bring us down No matter what you say it won't hurt me Don't matter if I fall from the sky These wings are made to fly Hey hey woo I'm firing up on that runway I know we're gonna get there someday But we don't need no ready steady go no Talk talk turns into air And I don't even care oh yeah Your words don't mean a thing I'm not listening Keep talking all I know is Mama told me not to waste my life She said spread your wings my little butterfly Don't let what they say keep you up at night And they can't detain you 'Cause wings are made to fly And we don't let nobody bring us down No matter what you say it won't hurt me Don't matter if I fall from the sky These wings are made to fly I don't need no one saying hey hey hey hey I don't hear no one saying hey hey hey hey hey hey hey hey You better keep on walking I don't wanna hear your talking boy'd You better keep on walking I don't wanna hear your talking boy'd Your words don't mean a thing I'm not listening They're just like water off my wings Mama told me not to waste my life She said spread your wings my little butterfly Don't let what they say keep you up at night And they can't detain you 'Cause wings are made to fly And we don't let nobody bring us down No matter what you say it won't hurt me Don't matter if I fall from the sky These wings are made to fly And we don't let nobody bring us down No matter what you say it won't hurt me Don't matter if I fall from the sky These wings are made to fly
  Mariah Carey  ,Emotions (Club Mix),You've got a feeling emotions  I feel good I feel nice I feel good Satisfied  You've got me feeling emotions Deeper than I've ever dreamed of You've got me feeling emotions Higher than the heavens above I feel good I feel nice I've never felt so Satisfied I'm in love I'm alive Intoxicated Flying high It feels like a dream When you touch me tenderly I don't know it's real But I like the way I feel Inside You've got me feeling emotions Deeper than I've ever dreamed of You've got me feeling emotions Higher than the heavens above In the morning When I rise You are the first thing On my mind And in the middle Of the night I feel your heart beat Next to mine It feels like a dream When you love me tenderly I don't know if you're for real But I like the way I feel Inside You've got me feeling emotions Deeper than I've ever dreamed of You've got me feeling emotions Higher than the heavens above You've got me feeling emotions Deeper than I've ever dreamed of You've got me feeling emotions Higher than the heavens above You know the way to make me lose control When you're looking into my eyes You make me feel so  You've got me feeling emotions Deeper than I've ever dreamed of You've got me feeling emotions Higher than the heavens above You've got me feeling emotions  You've got me feeling emotions You've emotions Deeper than I've ever dreamed of You've emotions You've got me feeling higher
  Ewan McGregor  ,El Tango De Roxanne,We'll drive you We'll drive you Mad Roxanne You don't have to put On that red light Work the streets for money You don't care if It's wrong if it is right Roxanne You don't have to wear That dress tonight Roxanne You don't have to sell your Body to the night  His eyes upon your face His hand upon your hand His lips caress your skin It's more than I can stand   Roxanne
  Sabrina  ,Treasure,Give me all give me all Give me all attention baby I got to tell you a little something about yourself You are wonderfil flawless ooh you are a sexy baby But you walk around here like you wanna be someone else Woah I know that you don't know it But you're fine So fine fine so fine Woah Oh boy I'm gonna show you when you're mine oh mine mine oh mine Treasure That is what you are Oh baby you're my golden star you're my golden star You could make my wish come true If you let me Treasure you If you let me Treasure you Pretty boy pretty boy pretty boy you should be smiling A boy like you should never look so Blue You're everything I see in my dreams I wouldn't say that to you if it wasn't true Woah I know that you don't know it But you're fine So fine fine so fine Woah Oh boy I'm gonna show you when you're mine Oh mine mine oh mine Treasure That is what you are Oh baby you're my golden star you're my golden star You could make my wish come true Oh If you let me Treasure you If you let me Treasure you You are my Treasure You are my Treasure You are my Treasure You you you you You are You are my Treasure You are my Treasure You are my Treasure You you you You are Treasure That is what you are Oh baby you're my golden star you're my golden star You could make my wish come true If you let me Treasure you If you let me Treasure you
  Alesso  ,Heroes (we could be) (Feat. Tove Lo),We go hideaway in daylight We go undercover when under sun Got a secret side in plain sight Where the streets are empty That’s where we run Everyday people do Everyday things but I Can’t be one of them I know you hear me now We are a different kind We can do anything We could be heroes We could be heroes Me and you We could be heroes We could be heroes Me and you We could be Anybody’s got the power They don’t see it ‘Cos they don’t understand Spin around and run for hours You and me we got the world in our hands Everyday people do Everyday things but I Can’t be one of them I know you hear me now We are a different kind We can do anything We could be heroes We could be heroes Me and you We could be heroes We could be heroes Me and you We could be We could be heroes We could be heroes Me and you We could be All we're looking for is love and a little light Love and a little light We could be All we're looking for is love and a little light Love and a little light We could be heroes We could be heroes Me and you We could be
  Ria Mae  ,Bend,"All night, straight ahead at the headlights Scream at me, baby Yelling like I ruined your life All night with my back against the wall Push me, push me, I'll never fall, oh  Baby, this mistrust is contagious I'm going crazy Looking for something to save us  You can try and bend my heart but it won't break You can change my clothes, you can change my name Break, break, break out of these chains I can bend, bend, bend so far but I won't break  Oh, oh, oh Disappear in the middle of night Shame baby, when its good, it's so right I'm tired of it now, stop building all these walls Head trip now, head trip, then we fall off  Baby, this mistrust is contagious I'm going crazy Looking for something to save us  You can try and bend my heart but it won't break You can change my clothes, you can change my name Break, break, break out of these chains I can bend, bend, bend so far but I won't break  You hold onto my heart so hard And I just follow as you spin me around You fill me up with fear so far that I can't swallow and I can't make a sound  Oh, oh, oh You can try and bend my heart but it won't break You can change my clothes, you can change my name Break, break, break out of these chains I can bend, bend, bend so far but I won't break  You can try and bend my heart but it won't break You can change my clothes, you can change my name Break, break, break out of these chains I can bend, bend, bend so far but I won't break  Oh, oh, oh Oh, oh, oh"
  Madonna  ,Get Together (Album Ver.),"Get Together written by Madonna, Anders Bagge, Peer Astrom, and Stuart Price Track 2, Time: 5:30 ------------------------- There's too much confusion It's all an illusion There's too much confusion  Down, down, down in your heart Find, find, find the secret Turn, turn, turn your head around Baby we can do it, we can do it all right  Do you believe in love at first sight It's an illusion, I don't care Do you believe I can make you feel better Too much confusion, come on over here  Chorus:  Can we get together I really, I really want to be with you Come on, check it out with me I hope you, I hope you feel the same way too  I searched, I searched, searched my whole life To find, to find, find the secret And all I did was open up my eyes Baby we can do it, we can do it all right  Do you believe that we can change the future Do you believe I can make you feel better  (chorus, repeat)  It's all an illusion There's too much confusion I'll make you feel better If it's bitter at the start Then it's sweeter in the end  Do you believe in love at first sight It's an illusion, I don't care Do you believe I can make you feel better Too much confusion, come on over here  (chorus)  Chorus2:  Can we get together I really want to be with you Come on, check it out with me I hope you feel the same way too  It's all an illusion There's too much confusion I'll make you feel better If it's bitter at the start Then it's sweeter in the end"
  Jennifer Lopez  ,I`m Real (Murder Remix Feat. Ja Rule-Clean Version),Murder inc What's my motherfucking name R-U-L-E Blowin' back on this Mary Jane I'm analyzin' the game And the game done unchose me To bring pain to pussy niggas and pussy hoes they one in the same Ever since you told me There's only room for two I've been makin less room for you Now only God can hold me Hug me love me judge me the only Man that hovers above me holla I met so many men and It's like they're all the same My appetite for loving Is now my hunger pain And when I'm feelin sexy Who's gonna come for me My only problem is Their insecurity Are you tired of bein alone Yeah yeah Sick of arguing on the phone Yeah yeah Are you tellin all your friends Yeah yeah That your nigga don't understand My love Because I'm real The way you walk the way you move the way you talk Because I'm real The way you stare the way you look your style your hair Because I'm real The way you smile the way you smell it drives me wild Because I'm real And I can't go on without you Girl I've been thinkin bout this relationship And I want to know is this as good as it gets Because we've been through the worst times and the best times But it was our time even if it was part-time Now they been looking at me smiling at me laughing like we wasn't happy But not knowing that we're growing and we're getting married Hard loving and straight thugging Bitch I ain't doing this shit for nothing I'm here to get it popping hopping let's ride up in the Benz Hair blowing in the wind sun glistening off my skin hey I'm nasty heh you know me But you still don't fuck with your baby Because I'm real The way you walk the way you move the way you talk Because I'm real The way you stare the way you look your style your hair Because I'm real The way you smile the way you smell it drives me wild Because I'm real And I can't go on without you Now people loving me and hating me treating me ungratefully But not knowing that they ain't making or breaking me My life I live it to the limit and I love it Now I can breathe again baby now I can breathe again Now people screaming what the deal with you and so and so I tell them niggas mind their biz but they don't hear me though Because I live my life to the limit and I love it Now I could breathe again baby now I could breathe again Tired of bein alone Yeah yeah Sick of arguing on the phone Yeah yeah Are you tellin all your friends Yeah yeah That your nigga don't understand My love Because I'm real The way you walk the way you move the way you talk Because I'm real The way you stare the way you look your style your hair Because I'm real The way you smile the way you smell it drives me wild Because I'm real And I can't go on without you Because I'm real The way you walk the way you move the way you talk Because I'm real The way you stare the way you look your style your hair Because I'm real The way you smile the way you smell it drives me wild Because I'm real And I can't go on without you
  Why Don`t We  ,Friends,Can’t keep controllin’ it When you come around me Gotta get a hold of it Tell me if you’re ready cuz I’m ready Yeah you know what you doin’ when you walkin in that dress Baby I can tell that you ain’t easily impressed I got tunnel vision think its time that I confess If I could just get my arms around you Baby don’t you say that we’re just friends When you know we could be lovers instead Wanna give you a night you’ll never forget Do the things we never did You’re out your head so out your mind To think that I would let you pass me by Oh baby don’t you say that we’re just friends When you know we could be lovers instead You know you’re beautiful I don’t gotta say it You try to brush me off But I know that you’re playin quit playin Yeah you know what you doin’ when you walkin in that dress Baby I can tell that you ain’t easily impressed I got tunnel vision think its time that I confess If I could just get my arms around you Baby don’t you say that we’re just friends When you know we could be lovers instead Wanna give you a night you’ll never forget Do the things we never did You’re out your head so out your mind To think that I would let you pass me by Oh baby don’t you say that we’re just friends When you know we could be lovers instead Yeah Yeah Oh baby don’t you say that we’re just friends When you know we could be lovers instead
  N Sync  ,Girlfriend,"Would you be my girlfriend Check it Check it He don't want ya like I want ya believe me, boo, I been told he don't appreciate ya much I could tell be the way he holds ya He don't love ya like I do love you or squeeze ya like I squeeze I make your neck pop back and in fact I buckle your knees Ok, Baby what's it gonna take for you to be my lady Tell me right now I hear your friends say you should Your parents tell you what's good your little sister keeps yellin' Nelly, I wish you you would But ya hesitatin' debatin' wether or not it's real I ain't shootin' game boo I'm just tellin' ya how I feel I'm diggin' everything about you your hips and the way they swing I'd hate to see ya leave boo but let us see you all the way I'd be your personal shrink, boo I care what ya think I bought the bently in pink cause my dough in sync Now tell your man bye bye and tell him you're long gone Ain't no needin' waitin' up you done got you another home woo I don't know why you care why you thinkin' bout him huh? He doesn't even know you're there 'Cause he don't love your eyes And he don't love your smile Girl you know that ain't fair The middle of the night Is he gonna be by your side Or will he run and hide You don't know cause things ain't clear And baby when you cry Is he gonna stand by your side Does the man even know you're alive I got an idea Why don't you be my girlfriend I'll treat you good I'll treat you good girl I know you hear your friends when they say you should 'Cause if you were my girlfriend I'd be your shining star The one to show you where you are Girl you should be my girlfriend Does he know what you feel know what you feel? Are you sure that it's real are you sure? Does he ease your mind Or does he break your stride? Did you know that love could be a shield yeah The middle of the night Is he gonna be by your side Or will he run and hide You don't know cause things ain't clear And baby when you cry oh no Is he gonna stand by your side? no no Does the man even know you're alive I got an idea... listen girl Why don't you be my girlfriend yeah yeah I'll treat you good I'll treat you good girl I know you hear your friends when they say you should 'Cause if you were my girlfriend I'd be your shining star The one to show you where you are Girl you should be my girlfriend Need a Fianc'e, cute as Beyonce Ghetto like Da Brat Ready to scrap when I say The talents of Alicia, fall Miss Keys Take the hips off Trina And the lips off Eve I put you so high on a pedestal It might make your nose bleed So much ice around your ankles And watch your toes freeze What's wrong ma Your man ain't bringing you joy Don't trip, flip your script to a country boy Now c'mon Ever since I saw your face Nothing in my life has been the same I walk around just saying your name Without you my world would end, yeah I've looked around this whole damn place And everything says you were meant to be My girlfriend .. oh Won't you be my girlfriend yeah I'll treat you good uh I know you hear your friends when they say you should 'cause if you were my girlfriend I'd be your shining star The one to show you where you are Girl you should be my girlfriend Would you be my girlfriend"
  Iselin  ,Lost,"Love is lost in an old routine Nothing special about you and me Always get stuck on things I'm head of overthinking It sure hurts sometimes  Pre-Chorus 1 Think I fill your space with a new black sweater Breaking up is meant for the arts Sleep away the days just to feel a bit better Try to tame my wandering heart  Chorus I know that I can be too much I’m just a little lost of feeling, of, of feeling I didn't mean to fuck it up I'm just a little lost of feeling, of, of feeling  Verse 2 I don’t wanna put no blame Hoping that you feel the same Walking that same old street With paper and words I see you It still hurts sometimes  Pre-Chorus 2 Think I fill your space with the place that shattered Moving on is all that I've got Give in to the haste just to feel a bit better Try to tame my wandering heart  Chorus I know that I can be too much I'm just a little lost of feeling, of, of feeling I didn't mean to fuck it up I'm just a little lost of feeling, of, of feeling  I know that I can be too much I'm just a little lost of feeling, of, of feeling I didn't mean to fuck it up I'm just a little lost of feeling, of, of feeling  Outro Just a little lost Of feeling, of, of feeling Just a little lost Of feeling, of, of feeling"
  Virginia To Vegas  ,Emotions,"Do you love me, or just love to take my time up? If you want me like I want you, make your mind up I've been waiting, praying you don't keep these games going All this time I played the fool and I just didn't know it  Every time I take you home When I wake up, you're gone Damn  You always play with, play with my emotions You got me, and you know it You got me running, running in slow-motion So why you always playing, playing with my emotions? Why you play with my emotions?  Are you with me? Won't you give me just a sign tonight? If you give me more than secrets, I'll be yours for life I've been waiting, praying you don't keep these games going All this time I played the fool and I just didn't know it  Every time I take you home When I wake up, you're gone Damn  You always play with, play with my emotions You got me, and you know it You got me running, running in slow-motion So why you always playing, playing with my emotions? Why you play with my emotions? Why you play with my emotions? Why you play with my emotions? Play with my emotions  Do you love me, or just love to take my time up? If you want me like I want you, make your mind up Are you with me? Won't you give me just a sign tonight? If you give me more than secrets, I'll be yours for life  You always play with, play with my emotions You got me, and you know it You got me running, running in slow-motion So why you always playing, playing with my emotions? Why you play with my emotions? Why you play with my emotions? Why you play with my emotions? Play with my emotions Why you play with my emotions?"
"  Liberty ,  City  ",I Met Her In Miami,I met her in miami ohhh south beach she drives the top of her ferarri cruise the streets then we party till sunrise make love on the beach can't get her off my mind she's doing to me  Check into my room and I put the lite on and saw her standing there I couldnt find no words she caught me staring cos her beauty was so rare  She moves like an angel the closest thing to heaven i hav eva seen (she) she could have had a choice of many and I cant cant beleive that she chose me  I met her in miami ohhh south beach she drives the top of her ferarri cruise the streets then we party till sunrise make love on the beach cant get her off my mind shes doing to me  We just did it all just like I knew her my whole life this is so unreal ohhhhh could it be I'm dreaming but I know that i'm not dreaming her touch is so real  (cos) she moves like an angel closest thing to heaven i hav eva seen (she) she could have had a choice of many and I cant cant beleive that she chose me  I met her in miami ohhh south beach she drives the top of her ferarri cruise the streets then we party till sunrise make love on the beach can't get her off my mind she's doing to me  I met some pretty gals round the world still i cant forget her face (her pretty face........pretty face) no matter where I've been wat I've seen still I wont forget that day (that special day)  I met her in miami ohhh south beach she drives the top of her ferarri cruise the streets then we party till sunrise make love on the beach can't get her off my mind she's doing to me
