artist,title,lyric
  Kylie Minogue  ,No More Rain,"Have you thought that the sky was meas drack, and them look up and see moving star. Have you never scared of the water struch on the edge, and them dive in, how quickly you forget.  I feel the catch woke at night, and we back night so warm   [Chorus] I feel that Wave coming love over me, got glicter drop fall on my knees, Got the sound of you ring in my ears,  sun coming on a nother day, got a second hand change, go to it again, got the rainbow colours, no more rain,  no more rain no more rain, more more no more.  have you ever dreamed, that you flying until you looked down, you never learn how to live, feet ferly on the ground.  our love carrys the hurt you holed, funny how live can holed, oh yeah  [chorus] I feel that Wave coming love over me, got glicter drop fall on my knees, Got the sound of you ring in my ears,  sun coming on a nother day, got a second hand change, go to it again, got the rainbow colours, no more rain,  no more rain no more rain, more more no more.  Wait for love, coming over me, got glicter drop fall on my knees, Got the sound of you ring in my ears,  sun coming on a nother day, got a second hand change, go to it again, got the rainbow colours, no more rain,  [chorus] Wave coming love over me, got glicter drop fall on my knees, Got the sound of you ring in my ears,  sun coming on a nother day, got a second hand change, go to it again, got the rainbow colours, no more rain,  no more rain no more rain, more more no more.  no more"
  Stacey Kent  ,If I Had You,I could show the world how to smile I could be glad all of the while I could change the gray skies to blue If I had you I could leave the old days behind Leave all my pals I'd never mind I could start my life anew If I had you I could climb a snow-capped mountain Sail the mighty ocean wide I could cross the burning desert If I had you by my side I could be a king dear uncrowned Humble or poor rich or renowned There is nothin' I couldn't do If I had you I could climb a snow-capped mountain Sail the mighty ocean wide I could cross the burnin' desert If I had you by my side I could be a king uncrowned Humble or poor rich or renowned There is nothin' I couldn't do If I had you
  Mabel  ,Thinking Of You (Feat. AJ Tracey) (Cadenza Remix),"Why can't I tell if you're into me I'm a nine, you're five Been away for a couple of weeks It could be more cause I lost track of time Driving on the wrong side, thinking of you On the tenth floor, thinking of you And it isn't like me to be insecure Oh, what have you done to my mind Whoa  Pre-Chorus: Mabel Wanna be with you Wanna be with you Oh my god, I'm a mess Boy, you got to me, got to me You know you got to me  Chorus: Mabel Tried to forget about you and no chance I wasn't looking for a romance Blue skies but I'm in the dark Waiting on someone that gotta pick me up Ooh, oh, whoa-oh Thinking of you, thinking of you Ooh, oh, whoa-oh Thinking of you, thinking of you  Break: AJ Tracey I'm thinking of you, are you thinking 'bout me I'm thinking of you, are you thinking 'bout me Girl, I said I'm thinking of you, are you thinking 'bout me  Verse 2: AJ Tracey You wasn't looking for this, but it found you I ain't chasing hoes, I'm tryna always be around you You said give me some space, cause I'm thinking it through I'm just tryna hear you call and say I'm thinking of you You're breathtaking like Gucci Mane's Cartiers I'm away on business, I'm still thinking 'bout you half the day It's like I'm tryna be that character I can't portray And baby got a smile that can brighten up the darkest day I'm on the M-way, charge with the mandem Still I'm thinking of you, I'm alone so I'm drinking for two You're like a song I'm tryna get out my head And it's like everywhere I go, the DJ's spinning the tune See, my favourite hoodie's sitting there, smelling of you I weren't looking for a wedding, it's true, it's like I'm red and you're blue We really need to talk about what this is I see my phone ringing, I'm just dreading it's you  Verse 3: Mabel In the hills with the windows down Telling me he wants to show me around He knows somebody with a fancy house On the playlist, soon to be famous He took me to the beach, I was thinking of you Standing in his room but I was thinking of you And I don't want you to be insecure Oh, don't wanna play with your mind, whoa  Pre-Chorus: Mabel Wanna be with you Wanna be with you Oh my god, I'm a mess Boy you got to me, got to me You know you got to me, oh  Chorus: Mabel Tried to forget about you and no chance I wasn't looking for a romance Blue skies but I'm in the dark Waiting on someone that gotta pick me up Ooh, oh, whoa-oh Thinking of you, thinking of you Ooh, oh, whoa-oh I'm thinking of you, thinking of you, thinking of you  Bridge: Mabel Ooh, I'm coming right back You're enough to make me turn around and backtrack Ooh, I'm coming right back Tell all your friends that I'm coming right back Ooh, I'm coming right back You're enough to make me turn around and backtrack Ooh, I'm coming right back Tell all your friends that I'm coming right back"
  Royal Estate  ,Pacing,A small town girl In a big plastic city Growing out of her window  You stick around Just to have some fun And see how it turns out  Pre-Chorus: You're taking turns at every corner But soon you��ll find your way out  Chorus: So you keep pacing around this city Down and never up Tired of all these girls Just hanging around  You're looking for a sign To say that you found out How to overcome what this City's all about  Verse 2: Caught in between The sounds of these streets You��re lost in the noise  You scream for purpose Underneath your chest Afraid that they��ll find out  Pre-Chorus: You're taking turns at every corner But soon you��ll find your way out  Chorus: So you keep pacing around this city Down and never up Tired of all these girls Just hanging around  You're looking for a sign To say that you found out How to overcome what this City's all about  -Interlude-  -Chorus-  Outro: You keep pacing You��re not hanging around You keep walking You��re gonna make it out You keep pacing Girl you don��t understand You keep walking To find you way out
  Bazzi  ,Who Am I?,I can't go on instagram no more That shit make me wanna die I can't see another photograph Painted the perfect lie I'm so tired of feelin' paper thin Like I can tear anytime Trapped inside the brain I'm in Please get me out of my mind Can anybody stop this train Take me back into my younger days I was happy with the simple days Who am I anymore Who am I anymore 'Cause really I don't know All I wanted was to be something To be something But right now But right now I don't know Oh Who am I anymore Don't have a fuckin' clue I was hopin' I could be something I could be something But right now But right now I don't know Oh Yeah yeah Take a look in the mirror I don't know who I've become Please take me back to the days when I was young I ain't had no purpose only thing I had was fun Now the only thing I feel inside me is numb I can't spend another second on my phone I can focus on your life On each other live my own yeah Yeah I got some issues tryna fight them all alone But if I'm in by myself this house will never be old Stop this train Stop this train Younger days Take me to my younger days Pipe down the flow Who am I anymore Who am I Yeah 'Cause really I don't know Really baby I don't know All I wanted was to be something To be something But right now But right now I don't know Oh Who am I anymore Don't have a fuckin' clue I don't have a clue I was hopin' I could be something I could be something But right now But right now I don't know Oh
  Shirley Bassey  ,Big Spender,"The minute you walked in the joint I could see you were a man of distinction A real Big Spender Good looking, so refined Say, wouldn't you like to know what's going on in my mind  So let me get right to the point I don't pop my cork for every man I see HEY Big Spender Spend a little time with me  Wouldn't you like to have fun Fun Fun How's about a few laughs Laughs I can show you a good time Let me show you a good time  The minute you walked in the joint I could see you were a man of distinction A real Big Spender Good looking, so refined Say, wouldn't you like to know what's going on in my mind  So let me get right to the point I don't pop my cork for every man I see HEY Big Spender HEY Big spender HEY Big spender  Spend a little time with me"
  Machine Gun Kelly  ,why are you here,We can never be friends I hate that I saw you again last night You were with somebody and so was I Met you in the bathroom at 12 05 And I fucked you again we can never be friends yeah yeah yeah I'm not myself I'm not myself when you're around no Can't be helped We are insane that's just the way it goes I'm a demon in the night she's an angel with the white Told me Keep on all the lights I'ma show you what you like Help you put back on your clothes make sure nothing's on your nose Ain't even tell my closest homies nobody knows I hate that I saw you again last night You were with somebody and so was I Met you in the bathroom at 12 05 And I fucked you again we can never be friends yeah yeah yeah I wanna cry Wanna cry I need to smoke I'm feelin' sick inside Sick inside From seein' you next to a friend of mine We didn't speak but I read your mind Both tellin' lies our alibis didn't work this time Didn't work this time I'm a demon in the night she's an angel with the white Told her Keep on all the lights you can show me what you like Help me put back on my clothes make sure nothing's on my nose Can't even tell my closest homies nobody knows I hate that I saw you again last night You were with somebody and so was I Met you in the bathroom at 12 05 And I fucked you again we can never be friends yeah yeah yeah We can never be friends yeah yeah yeah We can never be friends yeah yeah yeah We can never be friends we can never be friends yeah yeah yeah Yeah I know that I said I was at home Okay yeah you caught me Caught me I thought that you said you were all alone Look at you lying I hate that I saw you again last night I hate that I saw you again You were with somebody and so was I Met you in the bathroom at 12 05 And I fucked you again And I we can never be friends yeah yeah yeah Oh we can never be friends yeah yeah yeah Yeah We can never be friends yeah yeah yeah Yeah yeah We can never be friends we can never be friends yeah yeah yeah
  Eric Benet  ,The Last Time,"The first time I fell in love was long ago. I didn't know how to give my love at all. The next time I settled for what felt so close. But without romance, you're never gonna fall. After everything I've learned; Now it's finally my turn. This is the last time I'll fall... in love. The first time we walked under that starry sky, there was a moment when everything was clear. I didn't need to ask or even wonder why, because each question is answered when your near. and I'm wise enough to know when a miracle unfolds, this is the last time i'll fall in love. Now don't hold back, just let me know. Could i be moving much too fast or way too slow. 'Cause all of my life, I've waited for this day. To find that once in a lifetime, this is it, I'll never be the same. You'll never know what it's taken me to say these words. And now that I've said them, they could never be enough. As far as I can see, there's only you and only me. This is the last time I'll fall in love. Last time i'll fall in love. The last time i'll fall... in love."
  C21  ,When Your Love Is Too Far,"Baby im tired of thinking i was wrong I'm lost with no sign A game with no end  I've been there searching gold but suddenly You played with my mind Got words from behind  A promise is right babe I can believe in some No win by default in your life I'm lost when you're mindless  How can i fall down  Baby when your love is too far Theres no strength in my heart No will leads to distance Can you feel it now Your love is too far I swear but again The silence between us I can feel it now ooh yeah  Baby desire still relies on you Take a look at me now As it still lingers on  You let my feelings grow But honestly I'm through with your game You cant always be right  A promise is sacred I can believe in some With you its a million to one I'm lost cuz you're mindless But how can i fall down  Baby when your love is too far Theres no strength in my heart No will leads to distance Can you feel it now Your love is too far I swear but again The silence between us I can feel it now ooh yeah yeah yeah  Maybe in another life babe I just want it good and real You can beg, steal or lie babe But you dont know when"
  Leona Lewis  ,Alive,I don't mind if it rains for a century I don't mind the rain I don't mind if you're here laying next to me I don't mind the pain So put it on me put it on me ah Put it on me I want your love You're my light I see you and I come alive I see you and I come alive I revive I see you and I come alive I see you and I come alive Fire runs through my veins at the speed of light Fire through my veins A thousand suns lead the way to an endless night I can ease the pain I want your love You're my light I see you and I come alive I see you and I come alive I revive I see you and I come alive I see you and I come alive I see you and I come alive Put it on me put it on me ah Put it on me I want your love You're my light I see you and I come alive I see you and I come alive I revive I see you and I come alive I see you and I come alive I don't mind if it rains for a century I don't mind the rain
