artist,title,lyric
  Lil Wayne  ,On My Own,"[Lil Wayne] Eagle, eagle carter man In a 96 regal contravan On my way to the east to the laundromat Gotta wash that money and get on my ass Gotta flip them bricks it be gone so fast I got to do something I done blown my last Holla holla at ya boy I be on the ave In that g pricko is what I am known to have Shit tend to be slow I put on a mask And make it Halloween and take all your bags I say hallie hallie hallie why don't you go on and stab And Make these motherfuckers understand Look coach you pitchin' at me under hand But I am a designated hitter I adjust so fast Ya men designing women I am a one woman's man I'm the cash money prince blow the trumpet man They say they want the drugs to stop But I am a major step back when my album drop I got that wet crack flow out ya mami's pot I got that I got that jet black four at ya mami's spot I am trying to get that dough I demand it now You panic now, you better pan it down For the neighbors be over here tearing it down This is Weezy F. baby I am crowned the prince  [Chorus: x2] This is my town, my home This is my crown, my throne, This is me on my own, let's get it on  [Lil Wayne] And the hand gun is so included Don't get it confused I want no confusion And keep ya hoe I don't want your contagious I make my hoes stop and let the dough keep moving A bitch over some money is a hungry nuisance Its money over bitches that I'm keep on provin' Its weezy f. I got ya momma cruisin' Outta all the hot boyz she say I am the coolest I brought my bag of oranges, its time to juice it This game is a bitch and I'm try to seduce I floss awful lot and haters tryin' to reduce it Put the laser on the 45 iron, stupid One shot to remind who is the fly lil nigga that's behind the trigger I am all chronic combined with liquor You will never see me like momma tigger An eighty's baby a fightin' nigga, I got it on my mind like a psychic nigga I am something you call pepper like a viking snake See me over the viking stove I am lighting bricks Or in the middle of the shoot out, I'm tighting clips Pop another one shoot back while lighting spliffs (I do this) You catching my drift representing with my section on my belly and shit I am the prince  [Chorus: x2]  [Lil Wayne] So roll the carpet out, cause you fuckin' with a nigga from the royal south See you are either in or you are out And if you out stay in 'cause them warriors are out Because those vultures, cops, and those lawyers are out So I just open up the gate and let my holliers out No nigga I never call your house I am probably some where taking Toya out Not answer my phone and ignoring your spouse She leavin' messages about me enjoying her mouth Hey, I am ready to knock a boy in the mouth Give me the name, naw better yet point him out Me and the streets got a joint account I am from the streets that you need to be warned about New Orleans, wodie put the that in your mouth And if we feed you with a lot of iron it will flatten you out A few roaches but never had no rats in this house Never telling one another leave tht in the house Always been a small hustler moving my packing out If I ever run into some trouble send my savages out These niggas talking sweet I will get them cavities out I got graveyard flowers man I am passing them out Hey bitch nigga get ya ass on the ground and bow down to ya majesty now I am the prince  [Chorus: x2]"
  치타 (CHEETAH)  ,Hurt Me,난 니가 가졌던 것 중에 최고 길들여지지 않지 Boy 마치 기다렸단 듯 고민 없이 날 집어 가졌었지만 But 지금에 와선 영원하자는 말은 일회용품 보다 가치 없었던 거야 말하고 있어 너의 낯선 눈빛이 우리의 약속은 모두 물거품이 된 거야 우리 헤어짐에 이유는 Just do not love 이미 지난 유통기한 It isn't love 완벽한 결말 우리는 남이야 여자의 맘은 갈대 라는 말 이제 알 거 같아 그래서 말인데 부탁이야 거짓말처럼 내 앞에 나타나는 짓 혹시라도 그런 짓은 마 넌 사랑을 지껄였지만 날 사랑한적 없지 너 같은 부류 난 꺼렸지만 밀쳐낸 적 없지 왜 이제서야 만났을까라는 물음도 더 소중하기 위해서라는 답도 그래 답이 아니었나 봐 또 잠깐 눈 멀었나 봐 난 항상 새로움에 목이 말라 좀 궁금했던 거 그건 너도 마찬가지 아니겠어 그런 애들은 너 아니고도 널렸어 아름다웠던 너와의 시간은 그만큼 불안했어 매일 내 사랑은 왜 이런지 궁금해 그게 불만 이였어 너 아닌 누굴 만나도 Uninteresting 똑같아 똑같아 Dry-as-dust yeah
  하운드투스 (HOUND TOOTH)  ,시간이 필요해 (With 강범수),Oh So Sweety Lady 지금 넌 Sweaty Body 곤란해 지금 참 이리도 Sassy 해 왜 문뒤에 둘이 위험해 우리 맞닿는 입술이 Oh shit 이리도 Sexy 해 왜 어떻게 이리도 빠른데 왜 내 맘에 네가 녹아드는게 밀어내고 싶지 않은데 왜 이미 꽉 차 있는 내 맘이 Damn Girl 난 좀 더 시간을 빌릴게 Oh 널 담아가기엔 공간이 없네 복잡하네 Like Dishes In Buffet 미안해 But 넌 Beautiful Girl 다음번에 놀래 아 아직은 시간이 필요해 진짜 시간이 필요할까 솔직히 너말고 그녈보면 피곤함과 따분함 느껴져 근데도 정이라는 끈은 나를 꽉 묶어서 스치는 인연으로 만들 수 없어 떨려 난 추위를 잘 타나봐 그래서 니가 필요해 내가 헤퍼보이겠지만 이게 남자야 아 근데 백퍼 꼬이겠지 봐 지금 또 내 폰 소리냈지 Uh 그녀에게도 예의가 아닌걸 그냥 거리를 둘게 아니다 그냥 이제 뭔지 모르겠어 혼내 날 그렇다고 어장관리는 아냐 오해마 내 얘긴 깨진 독은 아닌데 많이 새긴 하는 것 같아 이런 제길 난 이제 기댈 곳은 어디 금은방을 가볼까 아니 은은 됐고 지금 금이 필요해서 그래 Girl Girl 난 좀 더 시간을 빌릴게 Oh 널 담아가기엔 공간이 없네 복잡하네 Like Dishes In Buffet 미안해 But 넌 Beautiful Girl 다음번에 놀래 아 아직은 시간이 필요해 Girl 난 좀 더 시간을 빌릴게 Oh 널 담아가기엔 공간이 없네 복잡하네 Like Dishes In Buffet 미안해 But 넌 Beautiful Girl 다음번에 놀래 아 아직은 시간이 필요해
  YDG  ,아버지,그는 나의 아버지 사랑하는 아버지 날 창조하신 아버지 거룩하신 아버지 아버지 아버지 아버지가 나의 아버지 하늘 아버지 나를 사랑하시는 아버지 Let me praise my God Let me praise my God Let me praise my God Let me praise my God 아버지 아버지 아버지가 나의 아버지 하늘 아버지 오늘도 날 이끄시는 아버지 난 곤두박질치던 내 인생의 끝을 봤어 30년이란 시간 동안 모르고 살아서 절망이란 절벽 끝에 서서 깨달았던 그분이야 말로 내 인생 참된 구원자란 걸 난 사악하고 독했지 야비하고 또 못됐지 모든 이에게 삿대질 그리고 어둠 가운데 속했지 음란과 시기 질투 거짓말 같은 일은 눈 감고도 했지 그러던 나에게로 갑자기 찾아온 아버지의 피맺힌 아버지 앞에서 비로소 내 모든 죄들을 깨닫고 회개한 거야 하늘의 아버지 사랑이 지난 내 과거를 말끔히 씻으신 거야 이제는 남은 내 인생 아버지께로 맡기며 살아갈래 탄탄대로가 아니더래도 두려움 따위는 없지 내 삶에 그는 나의 아버지 사랑하는 아버지 날 창조하신 아버지 거룩하신 아버지 아버지 아버지 아버지가 나의 아버지 하늘 아버지 나를 사랑하시는 아버지 Let me praise my God Let me praise my God Let me praise my God Let me praise my God 아버지 아버지 아버지가 나의 아버지 하늘 아버지 오늘도 날 이끄시는 아버지 Let me praise my God Let me praise my God Let me praise my God Let me praise my God 아버지 아버지 아버지가 나의 아버지 하늘 아버지 오늘도 날 이끄시는 아버지
  AZ  ,Superstar,"HookYou know we came so far Young superstar (money in the bank) We want more, you know we want more We want more, you know we want more We want more, you know we want more We want more, you know we want more  AZIt's no stoppin' him, he's in the books like Pac and em From early, homey had hip-hop in him The era of the unlaced kicks, he was rockin' em Way before the sheepskin flicks, chicks been jockin' him Right down the block from Wop and em Niggas either dead or the feds is knockin em, he's still here Comparisons in these years is real rare It's embarrassing, the bars he spit, he still care Never let a bitch in his ear, it ain't worth it When alone, you gotta look in the mirror, what's the purpose? From the gutter, bad motherfucker From under that hustler's umbrella, none other Than he who speaks would need it Once said, then his dead homey won't repeat it, well bred Black with the solar facts, so exact I was told they want the old god back, I'm here  HookYou know we came so far Young superstar (money in the bank) We want more, you know we want more We want more, you know we want more We want more, you know we want more We want more, you know we want more  AZA-Zah Malik Allah Repertoire like W.E.B. Du Bois, who yall? Fraus like I came from afar See bullet wounds, blood leak through the tar, baby pa I'm the homey Obi Wan Kanobe, no Soke Supposedly I'm potent with poetry, the almighty Most likely in the midst of the sheisty I know the D.A. got dreams to indict me, do the math I came, I saw, I smashed Seen niggas get millions, get murdered and bagged All I ask is those that respect the code Respect my mode, I'm a HBO episode Filmed in the streets of New York, it's real talk My whole life is sealed in the cork, it's rap's fault Coupes, cribs, chauffers and yachts, gimme props 'Til I'm dead and my physical rots, I'm still hot  HookYou know we came so far Young superstar (money in the bank) We want more, you know we want more We want more, you know we want more We want more, you know we want more We want more, you know we want more  OutroLook, the rain is gone, the game Just like Ming and Sean, Dave and Kareem We the American dream, with 215 Vacheron Constantin The $300,000 Dan Nice and Alain Silberstein The Princess catalog from Vinny Carl's regime That's the most prestigious catalog in the world, man That's $800,000,000 in diamonds, man, all precious cut The $40,000,000 Gulf Stream The Enzo Ferrari, the F-1 McLaren The Pagani Zanda made my Hiroshime The mansion in Rome and island Any complainin's all in the dream I'm like Bo Bill with a twirl of king I'm like the count of Beijing with a mix of Ming I'm like, Lebron James holdin' down his team I'm like, Elijah Muhammad on top of his Din A wonder and a light you ain't never seen Y'all in trouble niggas, it's a new regime We on the screen, every magazine Call me at home in Athens, Rome, nigga's officially on Nigga I'm in that zone, we in full rotation and syndication Malik man, you still got a crush on Ananda? Me and AZ in the Pagani Zanda We in Germany on the auto-don And I'm the Don and he the Don The girls wrapped in our arms, seen accentuous charm Hate if you want but don't front! It's the billion dollar boys with the billion dollar toys With the billion dollar bitches With the maintenance on livin' about the minute a month"
  라비(RAVI)  ,Lean on me,서러웠지 이리 와 내 품에 기대 버거웠지 언제나 있던 일인데 오늘따라 왠지 더 네 눈물이 뜨거워 보여 자 내게 기대 oh baby lean on me 네 기분이 가는 대로 맘대로 행동해도 돼 오늘의 네 빡침을 내게 고백해도 되고 욕해도 돼 창피하더라도 내 품 안에서 울어도 돼 비밀은 지킬게 아니 나도 잊어버릴게 그래 그래 그년이 나빴네 그래 그 새끼가 잘못했네 다 맞아 네 말 화가 많이 날 만 했어 원래 세상엔 멋쟁이보다 병신이 많대 하지만 걱정 마 여기 널 위한 내가 있어 서러웠지 이리 와 내 품에 기대 버거웠지 언제나 있던 일인데 오늘따라 왠지 더 네 눈물이 뜨거워 보여 자 내게 기대 Oh baby lean on me Oh lean on me Baby lean on me 널 위해 준비된 가슴 Lean on me Oh lean on me Baby lean on me 널 위해 양팔을 더 크게 벌릴게 줄곧 있는 일이지만 오늘따라 왠지 더 땀이 나고 울컥하며 서럽고 더러워서 싸그리 다 때려치고 싶었지 다 내려놓고 싶었지 네 맘 알아 이리 와 봐 내 품에서 내 귀에다가 네가 하고픈 말들을 다 담아봐 더 꽉 안아봐 누구보다 단단한 내 품의 유통기한은 영원이야 내 염원이야 나로 인해 미소 짓는 시간 그거면 충분해 난 자 내게 기대 서러웠지 이리 와 내 품에 기대 버거웠지 언제나 있던 일인데 오늘따라 왠지 더 네 눈물이 뜨거워 보여 자 내게 기대 Oh baby lean on me Oh lean on me Baby lean on me 널 위해 준비된 가슴 Lean on me Oh lean on me Baby lean on me 널 위해 양팔을 더 크게 벌릴게 자 이제 일 얘기는 그만하고 내 얘기를 들어봐 내가 준비한 에피소드와 농담 그리고 애교도 많아 attention 네가 원하면 야해질 수도 있어 attention 네가 웃을 수 있다면 다 할 수 있어 서러웠지 이리 와 내 품에 기대 버거웠지 언제나 있던 일인데 오늘따라 왠지 더 네 눈물이 뜨거워 보여 자 내게 기대 Oh baby lean on me Oh lean on me Baby lean on me 널 위해 준비된 가슴 Lean on me Oh lean on me Baby lean on me 널 위해 양팔을 더 크게 벌릴게
  Ludacris  ,Rest Of My Life (Feat. Usher & David Guetta),If you live for somethin' You're not alone my friend So fill up your cup and lift your lighter A toast to life They say what don't kill me can make me stronger So two drinks a night should help me live longer I blow some smoke to give my lungs a test Because why tiptoe through life to arrive safely at death I'm on a journey yeah I'm on a roll Sometimes I gotta close my eyes just to open my soul And tonight is the night I gotta feeling I'm about to act a fool So if you go fix some drinks me and Usher 'bout to break some rules That's somewhere to go but the world is moving slow I was born for the fast life I go for broke a lesson I can't afford But for what it's worth I'm ready to pay For the rest of my life For the rest of my life Na na hey oh Na na hey oh Na na hey oh Na na hey for the rest of my life If I got one life to live I'mma party 'til I'm dead What the hell is a life worth living if it's not on the edge Trying to keep my balance I'm twisted so just in case I fall Written on my tombstone should say Women Weed and Alcohol That's somewhere to go but the world is moving slow I was born for the fast life I go for broke a lesson I can't afford But for what it's worth I'm ready to pay For the rest of my life For the rest of my life Na na hey oh Na na hey oh Na na hey oh Na na hey for the rest of my life If you live for somethin' You're not alone my friend So fill up your cup and lift your lighter A toast to life I'm stuck in this moment freeze the hands of time Cause I feel inner peace when I'm out of my mind And you can call me crazy but I like to roll the dice So I'm willing to bet that I'mma be crazy for the rest of my life For the rest of my life For the rest of my life
  듀스  ,그 때,창 밖으로 보이는 지금 하얀 저녁 모두 기쁜 얼굴을 하고 바쁜 발걸음들 어느새 뽀얗게 돼버린 창을 열고 눈을 감고 다시 그 때를 생각하고 있어 우리들은 너무나도 어렸어 하얀 눈처럼 우린 순수했어 나의 사랑 오늘도 그 때처럼 눈이 와 너도 이 눈을 맞고 있을까 지금 우리 둘이 정말 행복했었던 크리스마스 영원히 난 잊을 수 없을 꺼야 지금 너는 곁에 없지만 나는 슬퍼하지 않아 내겐 추억이 있으니까 너와 나의 작은 얘길 뿐이지만 나에겐 가장 소중한 기억으로 남았어 우리들이 정말 행복했었던 크리스마스 영원히 난 잊을 수 없을 꺼야 지금 너 곁에 없지만 나는 슬퍼하지 않아 내겐 추억이 있으니까 우리들이 정말 행복했었던 크리스마스 영원히 난 잊을 수 없을 꺼야 지금 너 곁에 없지만 나는 슬퍼하지 않아 내겐 추억이 있으니까 내겐 추억이 있으니까
  타이미  ,Water (inst.),물이 흐르듯 흘러가려 하지 남들 위로 올라갈 때 내려가지 그저 흐르는 대로 그저 머무는 대로 물이 흐르듯 흘러가려 하지 남들 위로 올라갈 때 내려가지 그저 흐르는 대로 그저 머무는 대로 여긴 어둡고 습해 나를 묶어 둘게 필요해서 이런 이름을 짓고 적이란 애들을 찢고 살아왔지 문득 뒤로 돌아봤지 내 지난 시간들은 복수에 눈이 멀었어 어떤 것들이 남았지 내 한숨처럼 곧 사라지네 하루 아침에 바뀐 나를 나도 잘 모르겠단 말야 영원할 것 같이 날 가뒀던 맘의 창문을 깼단 말야 이제야 말할 수 있어 난 돌아가고 싶어 오래전 그 때로 음악 하나 사랑했던 나의 꽤 순수했던 때로 돈 되는 것도 좋지 성공하는 것도 좋지만 내가 왜 사는 건지 난 지금 답이 필요할 뿐 이제 높은 위치는 꿈 안에서 그 흔적없이 사라졌어 악몽처럼 날 괴롭히던 것들을 버리고 푹 자다 깼어 난 살아야겠어 남들과는 다른 길을 걷더라도 갈래 누가 행복이 거기 있냐고 물으면 넌 대체 뭐라고 할래 다 내려놓고 가볍게 나를 맡긴 채로 사는 게 생각보단 어려워서 밑바닥에 고인 채 고민해 물이 흐르듯 흘러가려 하지 남들 위로 올라갈 때 내려가지 그저 흐르는 대로 그저 머무는 대로 물이 흐르듯 흘러가려 하지 남들 위로 올라갈 때 내려가지 그저 흐르는 대로 그저 머무는 대로 다시 돌아가면 어둠이겠지 아마 내가 빛이 되기 전까지 더 높이 올라가면 날 가두겠지 알아 내가 믿지 못하기 때문이라고 날 괴물이라고 치고 뿔이라도 심어 존재를 고민해 뿌리가 보이면 파 내 삶은 어차피 다 꿈이라고 더는 무리라고 온통 눈물이라고 what 어디로 가는지 나도 모르겠어 왜 고민은 계속하고 매 순간을 버리고 사냐고 겁쟁아 아니 껍데기야 저건 내 욕심이 만든 꼭대기라고 right 난 오를 일 없어 저 산 무너뜨리고 엎드린 채 내 발에 입 맞춰 like water flows 모두 이곳에 내려놓고 작은 연못에 내려가 살래 조용히 흐르다 보면 닿을지 모르지 바다에 남을지 모르지 바닥에 외롭게 고여 있더라도 미련은 없다고 이제는 맡겨보려고 해 ay like water flows 물이 흐르듯 물이 흐르듯 그저 흐르는 대로 흐르는 대로 그저 머무는 대로 머무는 대로 물이 흐르듯 물이 흐르듯 그저 흐르는 대로 흐르는 대로 그저 머무는 대로 머무는 대로
  릴러말즈 (Leellamarz)  ,Never Know (Feat. pH-1),never ever know never ever know 혼자 있는 기분이 들 때는 이 노래를 들어 너가 어딜 가던 i want it 너의 모든 것 이젠 알아들어 세상을 저주해 너 한 명만 이 세상 속 제일 행복하도록 이 모든 걸 모르겠지 내가 어디에 앉아 혼자 운지 you never know never ever know never ever know never know never ever know never know never ever know never know never ever know never know never ever know never ever know never know never ever know 지금 누구랑 있어 right now 이 시간에 단둘이서 만나 그 사진은 누가 찍어줬어 바빠 보이는데 말 걸어서 미안 담에 봐 I just wanna know 도대체 너가 뭘 하고 돌아다니고 있는지 i just wanna know Yaya 어 내가 도대체 뭘 사람마다 다른거지 이건 아냐 내 잘못 Yaya 그 미소는 이제 더는 날 위한 게 아냐 슬퍼 My lady 아프거나 내가 필요하면 불러 우린 바쁜 도시 속 사람들 속에서 춤춰 몰랐던 얘긴데 너가 그렇게 남자랑 어울려 혼자 있는 기분이 들 때는 이 노래를 들어 너가 어딜 가던 i want it 너의 모든 것 이젠 알아들어 세상을 저주해 너 한 명만 이 세상 속 제일 행복하도록 이 모든 걸 모르겠지 내가 어디에 앉아 혼자 운지 you never know never ever know never ever know never know never ever know never know never ever know never know never ever know never know never ever know never ever know never know never ever know never know i don't even know where you been around no i never ever know always the last one to find out girl i never ever ever thought this would be the last chapter of our story liquor ain't my thang but i'm bout to go and pour it i can never hate you but you already know it like ugh that's the worst part had a lot of break ups but it's hurting like the first time you just real smart i ain't got no time for no drama this ain't worldstar snap snap oou get busy for the lenses seen you ride around in your brand new lexus everything's a business you were always independent and i'm still dead inside like the end of 6 senses you will never know you will never know nah you will never know you will never know nah maybe it's better this way maybe it's better this way maybe it's better this way
  D-League  ,Do Yo Thang,"[JJK]  J to the J to the K 언제나 Makes the Fucking Way. 모든게 변해도 내 선택은 HIPHOP. D to the E to the F 언제나 Makes the Fucking.. 샘플을 요리하는 Chef. (Defiga Track!) Bring that Dope Beat. 끄덕임을 땅으로. ADV는 하늘 높이. I mean.. Club안을 땀으로. Rap Attack으로 도피. I mean.. 틀려먹은 답으로 이끌려가는 파블로프의 개들은 또 까불어.입 다물어. Oh, PLEASE! I mean..I'm just doing my thing. Rhyme 잘치는 Slugger. MC로서의 역할. 늘 보고 들은걸 적어. 즉, 내 랩은 너에겐 밖을 향한 창.그러지 못한 랩퍼. Style을 바꾼다나, 참. 역할 불이행. 딱 니 이야기 하는 중. 줏대 없는 주둥아리. Yeah, I'm talking about YOU!  저마다 본분이란게 있단다. 그래, 넌 뭔데? 살아지는대로 살지말고, 병신아. DO YOUR THANG.      [Huckleberry P]  구부정한 허리. 통 큰 바지. 집업 무지 후드티. 작은 키. 허겁지겁 MIC 를 집어드는 내 직업. 빈 지갑. but 지겹지않어. I dont' give a sh...""do yo thang!"" 을 모토로 난 공짜로 New york 행, 유럽행. 자유롭게 무일푼 여행 떠나는 재미. 여행을 좋아해서 이름이 HuckleberryP. 싸인, 코싸인. 쌓이는 타인의 지식 사이로 자이로 스윙처럼 왔다갔다. 포기란 가시방석에 죄다 갖다 바친 당신의 양심, 안 따갑나? 꿈을 꾼 지 한 시간만에 눈치보고 포기하는 한심한 사내. 추위가 느껴지는 주위 시선에 'I can do it', 할 수 있단 자신감을 주입해!        [김낙싸움닭]  난 운명을 쫓아 점찍는 파파라치. 사는건 어쩌면 백지, 정답 없는 답안지 그래 난 보고 듣고 내 멋대로 판단하지. 이게 내 방식, 때론 무대포 간단하지. 아직 내 약력 따위는 숫처녀. 하지만 거친 숨처럼. 열정은 저 태양의 노른자 처럼 이글거려. 쪽박 찬다 처도 계속 부를래 각설이 타령. 날 밀어내고 날 미워해도 딱 붙을래 딱풀처럼. 세상이란건 반드시 저지른 자의 것! 불 붙은 이상 업의 법의 몫은 나의 것! 원수는 잊어도 은혜는 잊지 않는 것! 그래! 내 그릇은 커서 뒤늦게 차는 법! 태산은 티끌의 작품, 허드렛일도 달갑게 natural born 짝꿍, 힙합과 처음 만난게. 아무리 거친 파도라도 난 뚫고 나가지. 당겨진 방아쇠 난 총알탄 사나이."
