artist,title,lyric
  EPICKER  ,"Log Off (Feat. 김수정, Orkid)",걱정 말고 쉬어 잠시만 Log off Oh 그래 잠깐 쉰다고 하루가 끝나진 않거든 잠깐만 풀어줘 너의 긴장 일 집착 다시 입장을 위한 잠깐의 휴식 타임 또 굳이 말하지 않아도 알고 있을 거면서 넌 근데 아깝다 생각하는 게 결국에 또 버릇이 돼서 두 발짝 나아가기 위해 한 발짝 뒤로 물러서는 것에 괜히 다시 두려워해 뭐야 그럴 때 내가 해줄 수 있는 말은 하나야 no no 도움 닫기를 위한 4minute 더 높이 뛰기 위해 필요하지 이럴 때 난 들어도 되거든 고지식 긍정적인 Mind 늘 니 안에 자리 차지 하길 바라는 한가지 단어는 휴식 쭉 계속 일만하다간 늘 열나서 Error 떠 그러니까 잠깐 Log off하라고 잠시 동안만 하던 일을 멈춰줄래 너의 모든걸 여기에 풀어놓고 갈래 Log off Log off해 Lady Log off Log off해 Man 쉬게 잠깐 풀어봐 엉클어진 끈 나는 게임을 해 앉은 자리로 밤 새 뜬 눈으로 기를 빼면 눈이 팬더 돼 다른 사람도 그래 하나같이 바쁘네 모두 쪽잠을 청해 다들 피곤해 잠이 필요해 but time files 스케쥴이 꽉 차 출퇴근길의 서막 도로와 전철도 꽉 차 시계를 멈춰봐 잠깐 다들 편하게 앉아 여유로운 커피 한 잔 흡연자는 담배 한 가치 물레방아 competition 지쳐 졸음이 와도 무시하고 깨있어 그것이 바로 passion keep movin' keep runnin' cuz we need motivation 살려면 그게 최선 now we log on 이제는 log off 하고 get in the car 어디든 가 살랑이는 바람을 쐬고 집에서 한 숨 자고 묻어뒀던 꿈도 꿔 개운하게 일어나서 바라보는 morning you will love it 잠시 동안만 하던 일을 멈춰줄래 너의 모든걸 여기에 풀어놓고 갈래 Log off Log off해 Lady Log off Log off해 Man 쉬게 잠깐 풀어봐 엉클어진 끈 무슨 끈 긴장이나 짜증나는 일이나 하기 싫은데도 억지로 해야 되는 일이나 뭐 기타 등등 얽히고 설킨 실타래에 더욱 곤두서 뭉친 신경 널 안마할 이 곡 넌 어떻게 생각해 나 지금의 고뇌에 대해서 아직 못 내린 결론에 성급할 필요 없어 삶은 해결 가능한 문젤 주셨을꺼야 그냥 달려가자고 임마 잠시 동안만 하던 일을 멈춰줄래 너의 모든걸 여기에 풀어놓고 갈래 Log off Log off해 Lady Log off Log off해 Man 쉬게 잠깐 풀어봐 엉클어진 끈
  Social Club Misfits  ,War Cry (Feat. Tauren Wells),"This is our war cry, we'll rise up And this is our time to rise up, rise up, yeah  Verse 1: Marty I thought by now I would get it His love for me is unmeasured Still feel like I could do better Was paralyzed by depression But heaven and earth came together And You came to my rescue I use my voice as a weapon On earth like it's in heaven Yeah, I never handle things too well But I was made to fly, not to fail I don't need man's approval When God sent me to bring heaven Down for the kids going through hell Yeah, we gon' make it I don't care what the world's been saying It's time to step up, not cave in The grace He gave us, amazing A love that could conquer the hatred But it's up to us A new generation to show His love From the ends of the earth to the day He comes  Chorus: Tauren Wells This is our war cry, we'll rise up And this is our time to rise up, rise up, yeah This is our war cry, we'll rise up And this is our time to rise up, rise up, yeah  Verse 2: Fern Okay, we turned the stage to an altar at the last show Something about when you know you’re being impactful Using the tools I was given but being tactful Went from the pit to raps inside of a mac full With the power size of a Mack truck I went through the hard times, no bad luck Graduated cap, gown with the tassle Now I make art like Basel But I still keep it classic like a left eye rhyme Big Poppa like the Bed Stuy guy I got the dirt off my shoulders like Jay in his prime I stood on my own two like the veterans taught If I ever lay down, let it be for some rest And whenever I'm recharged, let me be at my best So whenever I’m pouring out all your love to the rest Now you can go and tell them the rest  Chorus: Tauren Wells This is our war cry, we'll rise up And this is our time to rise up, rise up, yeah This is our war cry, we'll rise up And this is our time to rise up, rise up, yeah  Outro: Tauren Wells Yeah, yeah, yeah, oh Yeah, yeah, yeah, oh War cry Yeah, yeah, yeah, oh Yeah, yeah, yeah, oh War cry"
  키리얼  ,그동안 몰랐던 소중함 (Feat. Maslo),아름다운 세상에 해지고 고맙다는 말마저 다 끝내지도 못한채로 떠나가버렸네 now One Two 그냥 그렇게 차디찬 어제와는 틀린 활기찬 이 아침 빛나는 저 햇살이 내게 삶이 뭔지를 다시금 일깨워주네 지끈거리는 머리를 비우고 난 뒤 조그맣긴 하지만 소중한 그 모든 것들을 포근하게 담아두고만 싶은 생각이 드는 걸 날카롭게 날이 선 현실을 배반해 무던히도 부모님의 가슴을 울버린의 칼로 생채기 내 제길 Rap이 내 길에 큰 빽인데 라며 오직 한길을 고집한 외골수 그게 바로 내 모습 물론 나도 쪽팔리긴하지만 추스려 부끄럽고 쑥스럽긴 해도 물끄러미 바라보기만 해선 안되는 걸 그동안 몰랐던 소중함에 놀라 이 못난 내 속맘에 가득한 이 고마움 모두가 한 번쯤은 주변을 돌아봐 모든게 낯설게만 느껴지고 있잖아 시간 참 빨리 가도 귀찮아 하지 말고 느껴봐 그동안 몰랐었던 소중함 모두가 한 번쯤은 주변을 돌아봐 모든게 낯설게만 느껴지고 있잖아 시간 참 빨리 가도 귀찮아 하지 말고 느껴봐 그동안 몰랐었던 소중함 활기찬 목소린 내 아침을 깨우는 활력소 내 주변 일들에 무관심 했던 지난 세월에 나 진정 소중한 것들이 뭔지 몰랐어 나 빈정거려 남을 인정이란 걸 하는 법을 몰랐어 나 펜을 잡고 가사를 써내려가네 앞에는 작고 약한자를 괴롭혀 그들에게는 게으름펴대 불평을 내뱉어도 나 급해 늘 찾고 도움을 받지만은 감사는 커녕 욕만해 하루종일 적었던 가사는 온통 욕망에 물든 채 쓸데 없는 것뿐 더 좋은 말의 표현들은 왜 찾을 수가 없는지 짧게 스쳐 지나간 생각 속에 잠깐 그동안의 내 실수들과 헛된 착각이만든 중압감 더 이상 갑갑한 소리는 내 곁에서 떠나보낼께 모두가 한 번쯤은 주변을 돌아봐 모든게 낯설게만 느껴지고 있잖아 시간 참 빨리 가도 귀찮아 하지 말고 느껴봐 그동안 몰랐었던 소중함 모두가 한 번쯤은 주변을 돌아봐 모든게 낯설게만 느껴지고 있잖아 시간 참 빨리 가도 귀찮아 하지 말고 느껴봐 그동안 몰랐었던 소중함  아름다운 세상에 해지고 고맙다는 말마저 다 끝내지도 못한채로 떠나가버렸네 now One Two 그냥 그렇게 모두가 한 번쯤은 주변을 돌아봐 모든게 낯설게만 느껴지고 있잖아 시간 참 빨리 가도 귀찮아 하지 말고 느껴봐 그동안 몰랐었던 소중함 모두가 한 번쯤은 주변을 돌아봐 모든게 낯설게만 느껴지고 있잖아 시간 참 빨리 가도 귀찮아 하지 말고 느껴봐 그동안 몰랐었던 소중함
  The Roots  ,Complexity (Explicit),"[Hook: Jill Scott] I've been wondering about the complexity Of what we have here Shouldn't there be more? Just can't see more I've been wondering about the complexity Of what we have here Shouldn't there be more? Just can't see more  [Verse 1] You're physically in this, but how could we tell If we was meant to be in bliss if you're not mentally as well? This energy you're sending me is tricky as hell Usually it's like a 50/50, we could take a L Before we start things, at this point being apart brings The feeling of somebody plucking at your heart strings I know it probably shouldn't feel like this But any other woman I see is in your likeness It's from your cheekbones To your lips, to your curves, to your deep moans To that walk, to your words You love feeling like a breakdown on the verge First we on good terms, then you on my last nerves Got my back just aching, my shoes is all tight It's too complex when we choose to do it right It's wrong, one minute you a soldier strong Then you trying a route talking about it's over and gone  [Hook: Jill Scott] I've been wondering about the complexity Of what we have here Shouldn't there be more? Just can't see more I've been wondering about the complexity Of what we have here Shouldn't there be more? Just can't see more  [Verse 2] When your boyfriend's in town, it's bound to be trouble, love His name Black, and he known to be a lover of Getting it on with my smoker's jacket on Eyes racing back and forth listening to Chaka Khan Trying to figure the cause why you always acting off Like I'm slacking off Maybe our signal's getting crossed For the case Love, you feel like you making a waste of Your precious time you need to get a taste of Some space to breathe, a moment as friends We should've felt ourselves slipping into it again Cuz it's like off and on, on and off Passion, lost and found, found and lost Clashing, asking for nothing but understanding Your hearts made of glass, use care when handling Girl, all in all I never leave you stranded Cuz my respect you commanded, you figure it out  [Hook: Jill Scott] I've been wondering about the complexity Of what we have here Shouldn't there be more? Just can't see more I've been wondering about the complexity Of what we have here Shouldn't there be more? Just can't see more  [Verse 3] I used to come into the party and stand around Cuz I was kinda too shy to really get down I used to play the corner and watch the scene Deep down knowing I wanted to find me a queen And I could feel that in my stomach and up in my chest Because I knew a lot of women, and some was fresh But then I found you girl, and just like me You had a heart that was yearning to be set free Now listen, see you and me we need to take the time To erase any doubt that's inside your mind It's not a mountain that I'm ever too tired to climb And who's counting, but I know at least a thousand times I let you know I'm here for you, care for you, and confide in you Break bread, share with you, and provide for you And that's full time, it's no 9 to 5 with you That's why I'm trying to work it out with you, it's gonna work  [Hook: Jill Scott] I've been wondering about the complexity Of what we have here Shouldn't there be more? Just can't see more I've been wondering about the complexity Of what we have here Shouldn't there be more? Just can't see more"
  Yuzion  ,Look At Me!!,young trapper look at me 내가 원하는 건 저기 하늘 위 나도 돈 벌 거야 전부 가질 거야 난 ya 넌 할 수 없이 날 부러워 하게 될 거야 huh young trapper look at me 내가 원하는 건 저기 하늘 위 나도 돈 벌 거야 전부 가질 거야 난 ya 넌 할 수 없이 날 부러워 하게 될 거야 huh young and rich 원해 난 아직은 어리니까 돈만 벌게 된다면 나는 young and rich야 huh 너넨 돈이 많아도 나보다 나이 많아 나는 돈이 없어도 너보다 잘 벌 거야 하늘 위로 올라가 이제 여긴 내 자리 너네들 자린 없어 그러니깐 그냥 집에 가 ya ya young trapper young trapper look at me look at me ya look at me 난 더 높이 난 더 멀리 가 look at me 난 더 높이 난 더 멀리 가 young trapper look at me 내가 원하는 건 저기 하늘 위 나도 돈 벌 거야 전부 가질 거야 난 ya 넌 할 수 없이 날 부러워 하게 될 거야 huh young trapper look at me 내가 원하는 건 저기 하늘 위 나도 돈 벌 거야 전부 가질 거야 난 ya 넌 할 수 없이 날 부러워 하게 될 거야 huh
  윤미래  ,38℃,this is song about hate and love you know there is a thin line between love and hate the question is which side you wanna be on when you die sometimes I feel like we're all alone in this world and all that really matter is that I'm your girl sometimes we flippin things get in the way when 우리의 미래도 다 알수없길래 그 어떤 고통도 나 참을수있길래 can't nobody hold this out I know you're gonna thug it through hold me by the side of you when I hold that pistol woogh as long as you keep it true they can't separate our souls 큰 사탕으로 응고되는 더 큰 집착에 사람들은 내게 말해 더욱 세차게 오래가지 못 할거라고 매몰차게 너무나도 짧은 그들만의 생각에 무시해 믿음이라는 것을 나는 믿기에 무시해 그 생각들을 인정할 수 없기에 주시해 널 지켜가는 내가 여기 있기에 주시해 날 믿고 따라 오는 네가 있기에 Baby I got you Baby you got me Baby I got you Baby you got me 부드러운 촉감 속에 너무나도 희고 또 투명한 그 상상 속으로 환상 속으로 잔상 속으로 들어가 이미 나 네 안에 갇혀 모든걸 가져 흔들림 없이 생각의 문은 닫혀 네 안에 갇혀 이미 나 닫혀 네게 나뿐인 너의 맘을 파헤쳐 녹아버린 얼음보다 쓸모 없이 버려진 H 2 O 멀리 어딘가로 너 없이 이 세상에 섭씨 영하 38도 옆으로 눕힌 팔처럼 고독은 영원하리 식은땀에 젖어 떨리는 팔다리 The body temprature falls as if somebody's shot me stick to the bone crystal baby you got me Baby I got you Baby you got me Baby I got you Baby you got me  I got you back fooI pull the grigger for you you know what I mean I'd even died for you Why won't you stay true there is now separating us two Baby I got you Baby you got me Baby I got you Baby you got me Baby I got you Baby you got me Baby I got you Baby you got 나
  정상수  ,비트 위를 걷네,난 오늘 밤도 비트 위를 걷네 가사를 쓰며 마음 속의 화를 껐네 힙합 안에서 가식과 가면을 벗네 쿵쿵짝 리듬에서 자유 얻네 내성적인 아이가 이제 다 컸네 세상의 무대 위에 홀로 우뚝 섰네 차가운 겨울바람에 입술이 텄네 내 멋대로 수염을 길렀네 세상의 손가락은 계속 날 찔렀네 가끔 분을 참지 못해 소리질렀네 이제 모든 마음을 비우고 두 팔을 뻗네 떨어지는 가랑비에 가슴이 젖네 인생이란 바다 배를 띄워 노를 젓네 움츠려 있던 날개를 활짝 폈네 9회 말 2아웃에 만루 홈런 쳤네 잠들어 있던 내 안의 엔진을 켰네 어둠과 절망에 맞서 싸워 이겼네 거친 세상에서 중심을 지켰네 힙합 리듬에 영혼이 깨어나 RAP 을 쓰고 뱉으며 난 다시 태어나 거듭되는 시도 속에 MC가 되어 가 공책을 롸임들로 빽빽히 채워가 거리를 걸으며 삶의 방식을 배워가 눈빛과 표정에 나의 색깔이 배어나 묵묵히 걸으며 계속 역사를 세워가 갈고 닦여진 내 Rap 그 솜씨가 빼어나 난 오늘 밤도 비트 위를 걷네 진실된 마음으로 가사를 썼네 이 밤이 깊어감에 영혼에 살이 쪘네 박자라는 샌드백을 쉴 새 없이 쳤네 뒤틀리는 세상의 광경에 숨이 멎네 사람들은 말과 글로 서로를 죽였네 마음 안의 백지를 서슴없이 구겼네 저마다 내가 옳다고 맞다고 우겼네 현대인은 인터넷 미디어에 묶였네 끝없이 사고 쓰고 바꾸라고 부추겼네 세상의 변화에 지쳐 쉬며 목을 축였네 전능하신 주 앞에 무릎 꿇고 머리 숙였네 내 죄와 모든 허물 세상에선 뒤로 숨겼네 밤이 되면 욕망에 이끌려 움직였네 술에 취해 밤거리를 비틀거리며 누볐네 거리와 술집은 사람들로 붐볐네 차디찬 바람이 불어 두 뺨을 부볐네 무심코 던진 한마디가 가슴을 후볐네 힙합 리듬에 영혼이 깨어나 RAP 을 쓰고 뱉으며 난 다시 태어나 거듭되는 시도 속에 MC가 되어 가 공책을 롸임들로 빽빽히 채워 가 거리를 걸으며 삶의 방식을 배워 가 눈빛과 표정에 나의 색깔이 배어나 묵묵히 걸으며 계속 역사를 세워 가 갈고 닦여진 내 Rap 그 솜씨가 빼어나 난 오늘 밤도 비트 위를 걷네 나의 Rhyme note 위에 한 획을 그었네 무너져 가는 시대 신의 한 수를 뒀네 창조주께서 내게 능력을 줬네 반복되는 리듬 위에 춤을 췄네 낮과 밤을 오가며 씨를 주웠네 삶이라는 틀 안에 쇳물을 부었네 Hiphop 에 나를 던져 운명을 바꿨네 힙합 리듬에 영혼이 깨어나 RAP 을 쓰고 뱉으며 난 다시 태어나 거듭되는 시도 속에 MC가 되어 가 공책을 롸임들로 빽빽히 채워가 거리를 걸으며 삶의 방식을 배워가 눈빛과 표정에 나의 색깔이 배어나 묵묵히 걸으며 계속 역사를 세워 가 갈고 닦여진 내 Rap 그 솜씨가 빼어나
  팔로알토 (Paloalto)  ,Celebration (Feat. Dok2),난 대표하지 홍대만이 아닌 한국힙합을 내 역사가 증명해 나의 실력과 진가를 가짜와 진짜를 세상이 나누는 기준이 성공이라면 난 오로지 내 선택을 믿으리 여기까지왔어 종이와 펜을잡던 젊은 시인의 꿈이 커지는걸 너흰 지켜봤어 가족과 친구 fan 이젠 미소를 지을때야 희망을 잃지마 부디 신념을 지키게 내가 보고싶을땐 내 음악을 크게 틀어 소홀할때 많지만 사실 혼자많이 울었어 나이들수록 티를내는게 서툴러져 진심이 닿지않는데도 곁에머물러줘 산다는건 끊임없이 외로움과 싸우는거 그 싸움에 지쳐만가는 나와 너무 닮은 너 우린 이겨냈고 또 이겨내면 되 결코 버티는게 아닌 이건 지켜내는 game incredible winner's flow 패자들은 dig a hole prayers 진실이 무너지지않게 빌어줘 incredible winner's flow 패자들은 dig a hole savior 내가 무너지지않게 지켜줘 i still run this city run run this city still run this city run run this city celebration 거리건 클럽이건 나와 내 형제들을위해 채운잔을 throw it up 음악에 바쳤지 불같은 20대를 방송을 타지않아도 이끌지 이 시대를 믿고 지켜봐준이여 너의 선택이 틀리지 않았음을 증명할수있는건 나의 승리지 glory song을 불렀던 심장은 뛰네 지금도 청춘365 난 진흙속에 피는 꽃 신이 주신기회기에 여전히 신의의지고 먼길을 돌아 hilite 이젠 나의 집으로 미움과 동시에 난 기대를 받지 독한 미움을 통해 앞으로의 미래를 봤지 난 vision을 갖춘 이들과 흐름을 바꿔 이건 성숙한 자들의 game 모르면 닥쳐 과연 우리가 세상을 밝힐 횃불인가 아님 또 의미없는 단어나열 되풀인가 나 아닌 누가 대신 내 목소리를 낼수있나 역사에서 감히 누가 내 이름을 뺄수있나 incredible winner's flow 패자들은 dig a hole prayers 진실이 무너지지않게 빌어줘 incredible winner's flow 패자들은 dig a hole savior 내가 무너지지않게 지켜줘 i still run this city run run this city still run this city run run this city celebration 거리건 클럽이건 나와 내 형제들을위해 채운잔을 throw it up 가진건 땅 좋은 집이 아닌 리듬이고 이 리듬이 곧 나의 유일한 믿음이고 이 믿음이 또 나의 하나뿐인 기쁨이고 이 기쁨이 돈 that's why i'm still spittin' this flow 누가 시키는거 다 무시하고 지키는 고집 아무리 미끼를 던져도 i ain't givin'em love just hate it or love it 누가 뭐래든 이 길을 걸어 내 방법대로 살어도 반드시 이기는 법 왜냐면 난 있는척 한적도 없거늘 못 배웠어도 아는척한적이 없거든 첫걸음부터 제대로 시작해 그어떤 상황에서도 항상 꿀리지않게 i'mma be right there 365 i'm out chyeah 목에 힘빼고와 boy u ain't come around here its the mister p and urs truly gonzo hilite&illionaire we do it cuz yolo incredible winner's flow 패자들은 dig a hole prayers 진실이 무너지지않게 빌어줘 incredible winner's flow 패자들은 dig a hole savior 내가 무너지지않게 지켜줘 i still run this city run run this city i run this city run run this city celebration 거리건 클럽이건 나와 내 형제들을위해 채운맘을 throw it up
  A$AP Rocky  ,West Side Highway (Feat. James Fauntleroy),"These days of preference has no complexion You could be light, dark, mixed or fair skin Just light the candle, gold sweats down the handle, life's a gamble And she know, love with me is like a C note, outside of Reno A couple white lies, a cup of white wine a Pinot, Italian Grigio House keys to PO Ride from overseas but that's basic Wasted high on the west side highway Drunk enough to fuck with, face it Hangovers, leftovers in the Range Rover Shame on her, make up or get a makeover Thank over, glim fitted start to takeover When I brainstorm, all the hoes ain't got a thing on her Audemars, season order like summer fall I throw the Audemars, then I throw out all the ball New Dior from the boutique store Only thing in common that we got is that we want it all Little cutie pie, saw her looking super fly More Justin Timberlake on my suit and tie Try to scrutinize, cause I keep two inside Suicides, no sir, hoes get the uber ride Or we can kiss 'til the sun come up Or, sit on my lap 'til somethin' come up She ain't really wanna club, I don't really wanna judge Girl just wanna have fun 'til the fun run up On the high way to my place, it's higher than you ever been By to my way, we be all day, me, you and all your friends In love, fuckin' in love Just too much These days of preference has no complexion You could be light, dark, mixed or fair skin Just light the candle, gold sweats down the handle, life's a gamble And she know, love with me is like a C note, outside of Reno A couple white lies, a cup of white wine a Pinot, Italian Grigio House keys to PO Ride from overseas but that's basic Wasted high on the west side highway Drunk enough to fuck with, face it On the high way to my place, it's higher than you ever been By to my way, we be all day, me, you and all your friends In love, fuckin' in love Just too much"
  BLNK  ,Burning (Prod. Conda),Burning I’m fucking riding on my routine Burning I’m fucking riding on my routine Burning I’m fucking riding on my routine Burning I’m fucking riding on my routine Burning I’m fucking riding on my routine Burning I’m fucking riding on my routine Burning I’m fucking riding on my routine Burning I’m fucking riding on my routine I’m fucking riding on my routine I’m fucking riding on my routine I’m fucking riding on my routine I’m fucking riding on my routine I’m fucking riding on my routine I’m fucking riding on my routine I’m fucking riding on my routine I’m fucking riding on my routine 나의 한 쪽 눈이 보이지 않아도 돼 세상을 볼 수 있지 다르게 작업실 바닥에서 자도 돼 내 꿈은 바닥부터 다시 해 고난은 나 원한대로 그 시간에 맞추지 않아 엄마를 데려가 저만치 배를 띄워 작년은 괴로웠다고 말하기엔 아직 가난이 더 매워 Burn Burn Burn Burn Burn Burning 2015년의 컬러그린 부끄러운 그 단어를 난 거부했지 작년의 내 우울증이 건드린 그 단어들로 이 앨범을 저글링 난 죽은 사람처럼 엎드리지 역마살 때문에 다시 돌아오지 또 롤러코스터는 하찮은 지금 내 사랑을 설명하지 #FLAME 아무도 오지 않는 방에 짐을 풀어 지구 반대편에 사랑이 내 안부를 물어오지 사랑을 만지는 내 손은 미끄러워졌지 그저 할 수 있는 건 불 타오르는 것 Let’s Burn Burning Im fucking riding on my routine Burning Im fucking riding on my routine Burning Im fucking riding on my routine Burning Im fucking riding on my routine Burning Im fucking riding on my routine Burning Im fucking riding on my routine Burning Im fucking riding on my routine Burning Im fucking riding on my routine Burning Im fucking riding on my routine Burning Im fucking riding on my routine Burning Im fucking riding on my routine Burning Im fucking riding Im fucking
  루피 (Loopy)  ,NEO SEOUL LOVE (feat. YERIN BAEK),You can leave Better go finding ones Cuz not many days We got to get along Say no words This ain’t no you I know I’m just lookin' at the mirror now Summertime sadness playin’ Feelin’ no more And you say baby can we spend a night ya Till I cant’ feel my face 삼켜 잔을 비워 How can I live a life Everything’s fine Everything’s fine Too many stories Not enough in loves Everything’s fine Everything’s gon be alright Everything’s gonna be alright So baby don’t want u to go now And since said u love me boo Fuck it so I stay twisted in a night So now in this tragedy I guess I can't just stay in love We gotta do something for the world But you decided to stay the same With you dreamed the perfect home With you I dreamed fucking dreams day and night Some said only lovers could survive Would it be different If I stayed Summertime sadness playin’ Feelin’ no more And you say baby can we spend a night ya Till I cant’ feel my face 삼켜 잔을 비워 How can I live a life Everything’s fine Everything’s fine Too many stories Not enough in loves Everything’s fine Everything’s fine Everything’s gon be alright Everything’s gonna be alright So baby don’t want u to go now And since said u love me boo Fuck it so I stay twisted in a night
