artist,title,lyric
  My Chemical Romance  ,Cemetery Drive,This night walk the dead In a solitary style and crash the cemetery gates In the dress your husband hates Way down mark the grave Where the search lights find us drinking by the mausoleum door And they found you on the Bathroom floor I miss you I miss you so far And the collision of your kiss that made it so hard Back home off the run Singing songs that make you slit your wrists It isn't that much fun staring down a loaded gun So i won't stop dying won't stop lying If you want i'll keep on crying Did you get what you deserve Is this what you always want me for I miss you I miss you so far And the collision of your kiss that made it so hard Way down way down Way down way down Way down way down Way down way down I miss you I miss you so far And the collision of your kiss that made it so hard well we I miss you well we I miss you so far And the collision of your kiss that made it so hard Made it so hard Way down way down Way down way down Way down way down Way down way down Way down
  Ron Sexsmith  ,Thinking Out Loud,"Thinking out loud Is all I'm doing Trying to raise my love Above the ruins  With each song I kick it around, Thinking... My love I can tell  There's a load on your mind If we poured ourselves Like this bottle of wine And let it flow,  We'll figure it out Thinking out loud But it's hard to think with all the racket Going on inside our heads  All this worrying is getting us nowhere Let's go somewhere instead Just thinking out loud Is it all we're good for?  Trying to raise our love But always falling short Heaven knows What it's all about  Thinking out loud With each song I kick it around Thinking out loud"
"  Missio ,  Death Stranding: Timefall  ",Sing To Me,"Talking to the mirror like I’ve seen him somewhere before He said I look familiar, did we meet the other night? Somebody once told me that there’s two sides to life, what’s yours? I might have accidentally let the darkness eat the light And that’s why  [Pre-Chorus] I prayed, I prayed, God sent me right to voicemail It’s like, all day my vanity is for sale Take it away, my head is in my own hell  [Chorus] Sing to me, I am not doing well Getting tired of my own words Sing to me 'cause I can’t hear myself Through the loudness of my own hurts Call me selfish when I say this, say this I’m kinda helpless, and I need you Sing to me 'cause I’m not doing well  [Verse 2] Somehow I got nominated as a king of sadness Got so much I know that I can even feed the birds And that’s why  [Pre-Chorus] I prayed, I prayed, God sent me right to voicemail It’s like, all day my vanity is for sale Take it away, my head is in my own hell  [Chorus] Sing to me, I am not doing well Getting tired of my own words Sing to me 'cause I can’t hear myself Through the loudness of my own hurts Call me selfish when I say this, say this I’m kinda helpless, and I need you Sing to me 'cause I’m not doing well  [Bridge] Somebody told me that there’s two sides to this life I think I might've chosen darkness over light  [Chorus] Sing to me, I am not doing well Getting tired of my own words Sing to me 'cause I can’t hear myself Through the loudness of my own hurts Call me selfish when I say this, say this I’m kinda helpless, and I need you Sing to me 'cause I’m not doing well  [Outro] Sing to me, I am not doing well Sing to me, I am not doing well"
  Led Zeppelin  ,Custard Pie,"Drop down, baby, let your daddy see Drop down, my lady, just dream of me Well, my mama allow me to fool around all night long Well, I may look like I'm crazy, I should know right from wrong See me comin', throw your man outdoor Ain't no stranger, done been this way before See me comin', mama, I throw your man outdoor I ain't no stranger, I been this way before Put on your night shirt and your morning gown You know by night I'm gonna shake 'em on down Put on your night shirt, mama, and your morning gown Well, you know by night I'm sure gonna shake 'em on down Shake it, shake it Ooh, your custard pie, yeah, sweet and nice When you cut it, mama, save me a slice Your custard pie, yeah I declare you're sweet and nice like your custard pie When you cut it, mama mama, please save me a slice Oh I chew on a piece of your custard pie I chew on a piece of your custard pie I chew on a piece of your custard pie I chew on a piece of your custard pie Drop down Drop down Drop down Drop down Drop down Drop down Chew on a piece of your custard pie"
  My Chemical Romance  ,Teenagers,They're gonna clean up your looks With all the lies in the books To make a citizen out of you Because they sleep with a gun And keep an eye on you son So they can watch all the things you do Because the drugs never work They gonna give you a smirk 'Cause they got methods of keeping you clean They gonna rip up your heads Your aspirations to shreds Another cog in the murder machine They said all teenagers scare the living shit out of me They could care less as long as someone'll bleed So darken your clothes or strike a violent pose Maybe they'll leave you alone but not me The boys and girls in the clique The awful names that they stick You're never gonna fit in much kid But if you're troubled and hurt What you got under your shirt We'll make them pay for the things that they did They said all teenagers scare the living shit out of me They could care less as long as someone'll bleed So darken your clothes or strike a violent pose Maybe they'll leave you alone but not me Ohhh yeah They said all teenagers scare the living shit out of me They could care less as long as someone'll bleed So darken your clothes or strike a violent pose Maybe they'll leave you alone but not me All together now Teenagers scare the living shit out of me They could care less as long as someone'll bleed So darken your clothes or strike a violent pose Maybe they'll leave you alone but not me Teenagers scare the living shit out of me They could care less as long as someone'll bleed So darken your clothes or strike a violent pose Maybe they'll leave you alone but not me
  G. 고릴라밴드  ,토요일 오후 2시,네게로 간다 늦진 않았어 더 생각할 시간이 없어 필요없어 지금 너에게 간다 혼자 살아가도 너없이 나도 살 수 있다고 생각했어 미친거지 이렇게 힘이 들줄 몰랐어  지금 난 너에게 간다 난 너에게 간다 그 사람 날 용서하진 않겠지만 나를 막을 수 없다 어쩔 수가 없다 이제 난 다시 널 가지려한다 널 택하려 한다 화려한 너에 그 웨딩 드레스도 모두 내것이 된다 내 여자가 된다 그댄  혼자 살아가도 너없이 나도 살 수 있다고 생각했어 미친거지 이렇게 힘이 들줄 몰랐어  지금 난 너에게 간다 난 너에게 간다 그 사람 날 용서하진 않겠지만 나를 막을 수 없다 어쩔 수가 없다 이제 난 다시 널 가지려한다 널 택하려 한다 화려한 너에 그 웨딩드레스도 모두 내것이 된다 내 여자가 된다 난 너에게 간다 난 너에게 간다 난 너에게 간다  나를 막을 수 없다 어쩔 수가 없다 이제 난
  전영록  ,잊어야 하네,아쉬움에 젖어 마를때까지 해가 뜨고 지고 세월이 가네 이내 작은 마음 다할때까지 꽃이 피고 지고 사랑도 가네  기다려야하나 떠나갔는데 헤매이지말자 간곳없는데  사라져버린 발자욱처럼 꺼져가버린 불꽃들처럼 잊어야하네 잊어야하네 그리움에 지쳐 돌아설까봐 나는 이제 가네 세상끝까지  이내 작은 마음 다할때까지 꽃이 피고 지고 사랑도 가네  기다려야하나 떠나갔는데 헤매이지말자 간곳없는데  사라져버린 발자욱처럼 꺼져가버린 불꽃들처럼 잊어야하네 잊어야하네 그리움에 지쳐 돌아설까봐 나는 이제 가네 세상끝까지 세상끝까지 세상끝까지
  Machine Head  ,Who We Are,This is who we are This is what I am We have nowhere else to go Divided we will stand We are the ugly Beaten and torn Brooding with power and ready for more We are the hungry Sick of this world Of robbers of thieving Of vultures unfurled We have been left on our own Be all the lost longing for home We are the unwanted lives Strung out and angry the deprived We are the young And young at heart The strong and the brave that are destined to start We are the change The world needs to see Look in our eyes and see our belief This is who we are This is what I am We have nowhere else to go Divided we will stand We are the broken Meant to be left Damaged and headless like dolls in a chest We are the future Seeds that you've sown In dirt that won't ever grow turns now to stone We have been hung out to dry We are the drunken We are the high We despise this human race Look in our eyes and sell your disgrace This is who we are This is what I am We have nowhere else to go Divided we will stand Dream Into glory we will ride Be unbridled in determination burn the seasons Into glory we will ride Be unbridled in determination Burn the seasons We are the savage Meant to be brought to justice To be thrown in jail and left to rot We are the other American dream Whose characters fight for their lives And they scream We have been left disavowed Those of the black Not of the shroud We won't hear religious lies Their God has left us to die This is who we are This is what I am We have nowhere else to go Divided we will stand This is who we are This is what I am We have nowhere else to go Divided we will stand
  Pink Floyd  ,Speak To Me,"""I've been mad for fucking years, absolutely years, been over the edge for yonks, been working me buns off for bands...""  ""I've always been mad, I know I've been mad, like the most of us... very hard to explain why you're mad, even if you're not mad..."""
  Candlebox  ,Lucy,"Anoher lie for us to live in Pages pick it up anytime she likes Another life for her to put down, pick it up, pick it up Anytime she might find enough to, enought to get her high And I'll get her high Turn it off, I found her weakness BOXES filled with memories shavings Lead into something better I heard it yesterday Old news my friend She's broken hearted I know, she'd seen it all along She's better off lately They said it's all she's after Everytime, Everytime, yeah Can she free it Has it all been wasted Can we see her one last time Another lie for her to live in Breakdowns, pull her out and knock us down everytime Another time for her to find out She'll let it go blue And then she'll fall down Gently Until she's broken hearted I know, she's seen it all along She's better off lately They said it's all she's after Everytime, Everytime, yeah Can she free it Has it all been wasted Can she free it one last time Can she free it see her one last time So when she lays her head down Do you read all the thought that she feeds aloud She can, she can see through And when she says she found out All the things that she thought we could read about She can, she can see through When she said she played out All the dreams that she thought she could dream about Do you feel, do you feel, do you feel Do you feel the need to break free You don't need to take me Lay her down, lay it Lucy, lucy, lucy, lucy, lucy"
  Cigarettes After Sex  ,K.,I remember when I first noticed that you liked me back We were sitting down in a restaurant waiting for the check We had made love earlier that day with no strings attached But I could tell that something had changed how you looked at me then Kristen come right back I've been waiting for you to slip back in bed When you light the candle And on the Lower East Side you're dancing with me now And I'm taking pictures of you with flowers on the wall Think I like you best when you're dressed in black from head to toe Think I like you best when you're just with me And no one else Kristen come right back I've been waiting for you to slip back in bed When you light the candle And I'm kissing you lying in my room Holding you until you fall asleep And it's just as good as I knew it would be Stay with me I don't want you to leave Kristen come right back I've been waiting for you to slip back in bed When you light the candle
  서태지  ,널 지우려 해,우연히 길을 걷다 음 마주친 그 모습에 너무 놀랬어 작고 귀엽고 깨물어 주고싶던 그녀의 모습 너무 닮았어 너를 잊었다고 생각했었어 너를 본건지 넌 어디있는지 너도 가끔씩은 내 생각을 하는지 쓸데없는 걱정으로 한숨만 짓네 이제는 너를 지우려고해 두번 다신 너를 떠올리진 않아 가슴 아픈 일이지만 네 생각에 눈물 짓지 않을거야 내 마음을 찾고 싶었어 생각하면 마음만 아픈데 아직까지 널 잊지 못하나 짓궂었던 너의 목소리가 내 귓가에서 들릴 것 같아 슬픈 일들도 좋은 추억도 이 눈물과 함께 담아 날려버리고 이제 나도 나를 찾아 떠나가겠어 이제는 너를 지우려고해 두번 다시 너를 떠올리진 않아 가슴 아픈 일이지만 네생각에 눈물 짓지 않을거야 내 마음을 찾고 싶었어 내가 너를 처음 본 곳 마지막 한 번 가보고 싶었어 비가 오는 이밤 길을 정신없이 그냥 걷고 있네 한도 없이 걷다보면 너를 잊을수 있을 것 같아 얼마나 더 가야하는가 언제나 언제나 너를 지을수 있나 소리쳐 너를 부르고 있어 큰소리쳐 너를 부르고 있어
  The Avett Brothers  ,At The Beach,"I know that you're smiling, baby, I don't even need to see your face Sunset at the shoreline, we are laughing, breaking up, Just like the waves Are you feeling, feeling, feeling like I'm, feeling Like I'm floating, floating, up above that big blue ocean Sand beneath our feet, big blue sky above our heads, no need to keep stressing from our everyday life on our minds We have got to leave all that behind  Well, I have got a sister, And she has got a baby with brand new eyes And her daddy is an engineer, And they just took her to the sea for the first time Now they're under, under, underneath a big umbrella Summer, summer, summer time to help us forget, nine to fives We have got to leave all that behind  I have worries to give to the sea We can walk dear the pier is farther than it seems  Midnight at the shoreline, fireworks above us A screaming bloom They're sent by some teenager and kid whoever you are I am thanking you Now we're dancing, dancing, dancing with no music What is happening, happening, happening and no feelings Except this is right We just had to leave all that behind"
  404  ,숲속에서,비 오는 밤이었어요 비 오는 밤이었어요 그대와 난 길을 잃고서 숲속에서 걷다가 넘어지다가 걷다가 넘어지다가 그곳에 들어갔어요 숲속에서 난 정말 모르겠다고 난 정말 모르겠다고 소리를 질러봐도 점점 더 멀어지고 이젠 이미 틀렸어요 생각을 해 봐도 아무 소용없다네 말을 해도 아무 대답 없다네 생각해도 아무 소용 없다네 말을 해도 아무 대답 없다네 생각해도 아무 소용 없다네 말을 해도 아무 대답 없다네 생각해도 아무 소용 없다네 말을 해도 아무 대답 없는 그대와 나
  들국화  ,이별이란 없는거야,이별이란 생각으로 울지마 그건 너의 작은 착각일뿐야 가면 어딜가니 좁은 이 하늘아래 한 동안 둘이 서로 멀리 있는걸텐데 웃으며 나를 보내줘 언젠가 만나겠지 새로운 모습으로 이별이란 말은 없는거야 이 좁은 하늘아래 안녕이란 말은 없는거야 이 세상 떠나기 전에 안녕이란 말 때문에 울지마 그건 너의 작은 착각일뿐야 가면 어딜가니 좁은 이 마음속에 언제나 별빛처럼 너는 반짝일텐데 웃으며 나를 보내줘 언젠가 만나겠지 새로운 마음으로 이별이란 말은 없는거야 이 좁은 하늘아래 안녕이란 말은 없는거야 이 세상 떠나기 전에 이별이란 말은 없는거야 이 좁은 하늘아래 안녕이란 말은 없는거야 이 세상 떠나기 전에
  Saosin  ,Come Close,Taking back overdone Free and safely Souvenirs out of style Right in front and right on do it so I'll be mad you'll be gone And I'm sad Cause you be alone on my veins tango with daddy and separate only smile my only rights of passage Only you mark my words to get engaged in California And I'm sad that you'll be gold upon gold in my veins tango with daddy and separate only smile my only rights of passage Don't say that I'm the one you want to lose Don't say that I'm the one you want to lose Don't say that I'm the one you want to lose Don't say that I'm the one you want to lose Don't say that I'm the one you want to lose
  Bombay Bicycle Club  ,Always Like This,Oh she can wait For what I can give She knows what I am but She won't believe me Is it all ok' Will I come off the lightest I can't believe it It's always like this like this like this like this like this like this like this like this like this Kept it at bay Yes you kept your words There on your mouth But it's not what I heard If I follow the light That I deem the brightest I won't believe that It's always like this I'm not whole I'm not whole You waste it all I'm not whole I'm not whole You waste it all I'm not whole I'm not whole You waste it all I'm not whole I'm not whole You waste it all I'm not whole Oh you can wait For what I can give You know what I am So you know how I live Try to look proud But you're not in the slightest Its happening now And it's always been like this like this like this like this like this like this like this I'm not whole I'm not whole You waste it all I'm not whole I'm not whole You waste it all I'm not whole I'm not whole You waste it all I'm not whole I'm not whole You waste it all I'm not whole I'm not whole You waste it all I'm not whole I'm not whole You waste it all I'm not whole I'm not whole You waste it all I'm not whole I'm not whole You waste it all I'm not whole
  Deicide  ,Kill The Christian,"""You are the one we despise Day in day out your words compromise lives I will love watching you die Soon it will be and by your own demise  Buried in hypocrisy Lacerate your faith in god Morally diseased On the cross of Calvary your body bashed, defeated, stabbed  Blessing as you hate Loyal to your enemies Monetary faith As him you'll pay for the lies of your prophecy Satan wants you dead  Kill the christian, kill the christian Kill the christian, kill the christian Kill the christian, kill the christian Kill the christian  Armies of darkness unite Destroy their temples and churches with fire Where in his world will you hide Sentenced to death, the anointment of Christ  In due time your path leads to me Put you out of your misery  The death of prediction Kill the christian  Kill the christian...dead!  """
  Van Halen  ,Dance The Night Away,"Have you seen her So fine and pretty Fooled me with her style and ease And I feel her from across the room Yes, it's love in the third degree Ooh, baby, baby Won'tcha turn your head my way Ooh, baby, baby Come on, take a chance You're old enough to dance the night away Oh, come on, baby, dance the night away A live wire Barely a beginner, but just watch that lady go She's on fire, 'cause dancing gets her higher than anything else she knows Ooh, baby, baby Won'tcha turn your head my way Ooh, baby, baby Well, don't skip romance, 'cause you're old enough to dance the night away Oh, come on, baby, dance the night away Dance the night away Dance, dance, dance the night away"
  ruru  ,blink,so is it safe to say that i need you don't wanna lose you in a blink of an eye i'm tryna choose my words don't leave me behind i wouldn't blame you for losing your mind everyday i got some things to do eating convenience store food too scared to be true to myself we love what we're used to we're young we're eused to it everyday I'm praying that you would stay but even if you go away i don't know what i'd do you love and you lose you love and you lose so is it safe to say that i need you don't wanna lose you in a blink of an eye i'm tryna choose my words don't leave me behind i wouldn't blame you for losing your mind so is it safe to say that i need you don't wanna lose you in a blink of an eye
  우주나비  ,아득한 새벽 (괜찮아질거야),끝나지 않을 이야기 또 그렇게 시작되려고해 어둠을 쫓아야했던 너와 나 그 끝을 몰랐던 조금만 기다려 나를 잡아줘 상처투성이 나 또 쓰러지지 않게 내가 믿고 싶어하는건 너 뿐인거야 뒤돌아서 나를 봐봐 위태롭게 서 있잖아 너를 믿고 싶어하는건 나 뿐인거야 나를 멀리 밀어내도 소용 없다는걸 어둠은 걷힐거야 새벽은 우리 앞에 이제 모두 괜찮아 질거란걸 우린 알잖아  어둠을 쫓아야했던 너와 나 그 끝을 몰랐던 날 믿고 널 믿고 이끄는 대로 어둠저편을 건너 괜찮아 질거야 내가 믿고 싶어하는건 오직 너뿐야 지금의 널 깨뜨릴 수 없다면 날 기다려줘 너를 믿고 싶어하는건 오직 나뿐야 지금의 날 깨뜨릴 수 없다면 기다려 아직은 잠들지마 어둠은 걷힐거야 깊은 밤을 달려왔던 상처는 괜찮을거야 어둠은 걷힐거야 새벽은 우리 앞에 이제 모두 괜찮아 질거란걸 우린 알잖아  그렇게 기다렸던 새벽은 우리 앞에 망설임도 주저함도 이제는 괜찮을거야
  Nada Surf  ,Popular ,"Three important rules for breaking up Don't put off breaking up when you know you want to Prolonging the situation only makes it worse Tell him honestly, simply, kindly, but firmly Don't make a big production Don't make up an elaborate story This will help you avoid a big tear jerking scene If you wanna date other people say so Be prepared for the boy to feel hurt and rejected Even if you've gone together for only a short time, And haven't been too serious, There's still a feeling of rejection When someone says she preferres the company of others To your exclusive company, But if you're honest, and direct, And avoid making a flowery emotional speech when you brake the news, The boy will respect you for your frankness, And honestly he'll appreciate the kind of straight foward manner In which you told him your decision Unless he's a real jerk or a cry baby you will remain friends  I'm head of the class'm popular I'm a quarter back I'm popular My mom says I'm a catch I'm popular I'm never last picked I got a cheerleader chick  Being attractive is the most important thing there is If you wanna catch the biggest fish in your pond You have to be as attractive as possible Make sure to keep your hair spotless and clean Wash it at least every two weeks Once every two weeks And if you see Jonny football hero in the hall Tell him he played a great game Tell him you like his article in the newspaper  I'm the party star I'm popular I've got my own car I'm popular I'll never get caught I'm popular I make football bets I'm a teachers pet.  I purpose we support a one month limit on going steady I think It will keep you both more able to deal with weird situation And get to know more peopleI think if you're ready to go out with Jonny Now's the time to tell him about your one month limit He wont mind he'll apreciate your fresh look on dating And once you've dated someone else you can date him again I'm sure he'll like it Everyone will appreciate it You so novel what a good idea You can keep you time to your self You don't need date insurance You can go out with whoever you want to Every boy, every boy, in the whole world could be yours If you'll just listen to my plan  THE TEENAGE GUIDE TO POPULARITY"
  걸  ,Rock`n Roll Revolution,끔찍한 일이 될거야 Darling 어른이 된다는상상만으로도 내겐 숨이 막혀버릴것 같은 고통일거야 Oh help me날 이해해줘 널 좋아하지만 And my lover I love you 내맘 정하긴 곤란해 네겐 항상 날마다 다른 이벤트로 너를 기쁘게 해줄 남자가 더욱더 어울릴지도 몰라 때로는 나도 휴일이 있었으면 해 우우 Oh my love 넌 잠시도 날 가만두질 않으니 그렇지만 혼자인 날은 우우 오히려 더 불안한건 나인걸 이런 제길 이런게 또 어딨어 예 Woo I need your love Woo I need your love love love 네게로 빠져드는 내가 두려워 이런 제길 이런게 또 어딨어 예  끔찍한 일이 될거야 Darling 어른이 된다는상상만으로도 내겐 숨이 막혀버릴것 같은 고통일거야 Oh help me날 이해해줘 널 좋아하지만 And my lover I love you 내맘 정하긴 곤란해 네겐 항상 날마다 다른 이벤트로 너를 기쁘게 해줄 남자가 더욱더 어울릴지도 몰라 때로는 나도 휴일이 있었으면 해 우우 Oh my love 넌 잠시도 날 가만두질 않으니 그렇지만 혼자인 날은 우우 오히려 더 불안한건 나인걸 이런 제길 이런게 또 어딨어 예 Woo I need your love Woo I need your love love love 네게로 빠져드는 내가 두려워 이런 제길 이런게 또 어딨어 예 Woo I need your love Woo I need your love love love 네게로 빠져드는 내가 두려워 이런 제길 이런게 또 어딨어 예
