artist,title,lyric
  Blur  ,Tender,Tender is the night Lying by your side Tender is the touch Of someone that you love too much Tender is the day The demons go away Lord I need to find Someone who can heal my mind Come on Come on Come on Get through it Come on Come on Come on Love's the greatest thing Come on Come on Come on Get through it Come on Come on Come on Love's the greatest thing That we have I'm waiting for that feeling Waiting for that feeling Waiting for that feeling to come Oh my baby Oh my baby Oh why Oh my Oh my baby Oh my baby Oh why Oh my Tender is the ghost The ghost I love the most Hiding from the sun Waiting for the night to come Tender is my heart I'm screwing up my life Lord I need to find Someone who can heal my mind Come on Come on Come on Get through it Come on Come on Come on Love's the greatest thing Come on Come on Come on Get through it Come on Come on Come on Love's the greatest thing That we have I'm waiting for that feeling Waiting for that feeling Waiting for that feeling to come Oh my baby Oh my baby Oh why Oh my Oh my baby Oh my baby Oh why Oh my  Come on Come on Come on Get through it Come on Come on Come on Love's the greatest thing Come on Come on Come on Get through it Come on Come on Come on Love's the greatest thing That we have I'm waiting for that feeling Waiting for that feeling Waiting for that feeling to come Oh my baby Oh my baby Oh why Oh my Oh my baby Oh my baby Oh why Oh my Tender is the night Lying by your side Tender is the touch Of someone that you love too much Tender is my heart you know I'm screwing up my life Oh Lord I need to find Someone who can heal my mind Come on Come on Come on Get through it Come on Come on Come on Love's the greatest thing Come on Come on Come on Get through it Come on Come on Come on Love's the greatest thing That we have I'm waiting for that feeling Waiting for that feeling Waiting for that feeling to come Oh my baby Oh my baby Oh why Oh my Oh my baby Oh my baby Oh why Oh my Oh my baby Oh my baby Oh why Oh my Oh my baby Oh my baby Oh why Oh my Oh my baby Oh my baby Oh why Oh my
  Hatebreed  ,I Will Be Heard,Now is the time for me to rise to my feet Wipe the spit from my face Wipe these tears from my eyes  Now is the time for me to rise to my feet Wipe the spit from my face Wipe these tears from my eyes I've got to take my life back One chance to make it right I gotta have my voice be heard And bring meaning to this life  Cause I trusted for nothing I've been led astray I've been tried and trusted But i won't except defeat Now i've done things I regret And it's time to re the rolls And I just wanna make good on All the promises I have made  I will be I will be heard I will be I will be heard  Through the worst we prevail So our voices will be heard Through the worst we prevail So our voices will be heard  Now is the time for me to rise to my feet Wipe the spit from my face Wipe these tears from my eyes I've got to take my life back One chance to make it right I gotta have my voice be heard And bring meaning to this life  Cause I trusted for nothing I've been led astray I've been tried and trusted But i won't except defeat Now i've done things I regret And it's time to re the rolls And I just wanna make good on All the promises I have made  I will be I will be heard I will be I will be heard
  The Beatles  ,"Here, There And Everywhere (Remastered 2009)",To lead a better life I need my love to be here Here making each day of the year Changing my life with the wave of her hand Nobody can deny that there's something there There running my hands through her hair Both of us thinking how good it can be Someone is speaking but she doesn't know he's there I want her everywhere and if she's beside me I know I need never care But to love her is to need her everywhere Knowing that love is to share Each one believing that love never dies Watching her eyes and hoping I'm always there I want her everywhere and if she's beside me I know I need never care But to love her is to need her everywhere Knowing that love is to share Each one believing that love never dies Watching her eyes and hoping I'm always there I will be there and everywhere Here there and everywhere
  Young Empires  ,Sunshine,"So wave goodbye, don't say good night I swear somehow, that you're the only one I think about  The sunshine in my dreams It's too dark to wake me up No angels come no shadows fall Since I've been away I can't get you, get you out of my mind I can't get you, get you all the time  Somewhere, somehow We're gonna find out without I swear right now, we could be anyone I have no doubt  The sunshine in my dreams It's too dark to wake me up No angels come no shadows fall Since I've been away I can't get you, get you out of my mind I can't get you, get you all the time I can't get you, get you out of my mind I can't get you, get you all the time  Down cause I was bouncing I was falling You were there taking my hand You were there, you were there, oh  I can't get you, get you out of my mind I can't get you, get you all the time I can't get you, get you out of my mind I can't get you, get you all the time"
  Syd Matters  ,Obstacles,"Let's say sunshine for everyone But as far as I can remember We've been migratory animals Living under changing weather  Someday we will foresee obstacles Through the blizzard, through the blizzard Today we will sell our uniform Live together, live together  We played hide and seek in waterfalls We were younger, we were younger We played hide and seek in waterfalls We were younger, we were younger We played hide and seek in waterfalls We were younger, we were younger We played hide and seek in waterfalls We were younger, we were younger  Someday we will foresee obstacles Through the blizzard, through the blizzard"
  The Beatles  ,She's Leaving Home (Remastered 2009),Wednesday morning at five o'clock as the day begins Silently closing her bedroom door Leaving the note that she hoped would say more She goes down stairs to the kitchen clutching her handkerchief Quietly turning the backdoor key Stepping outside she is free She We gave her most of our lives Is leaving Sacrificed most of our lives Home We gave her everything money could buy She's leaving home after living alone For so many years Father snores as his wife gets into her dressing gown Picks up the letter that's lying there Standing alone at the top of the stairs She breaks down and cries to her husband Daddy our baby's gone Why would she treat us so thoughtlessly How could she do this to me She We never thought of ourselves Is leaving Never a thought for ourselves Home We struggled hard all our lives to get by She's leaving home after living alone For so many years Friday morning at nine o'clock she is far away Waiting to keep the appointment she made Meeting a man from the motor trade She What did we do that was wrong Is having We didn't know it was wrong Fun Fun is the one thing that money can't buy Something inside that was always denied For so many years She's leaving home Bye bye
  Kent  ,Avtryck,"Somnar om och vaknar igen som jag alltid gr Svara: fick du nog? Fick du nog ikvll? Vaknar upp och somnar igen vet inte vad jag vntar p Svara: fick du nog ja det fick du nog Kan du ngra fler runda ord att imponera med gr ett intryck, le! Gr ett avtryck som sitter lngre n de du redan gjort ppen hand och allt rinner ut vad hade du vntat dig?  Svara: fick du nog? Fick du nog ikvll? Fyller p tills allting tar slut Du kommer inte att hitta det nd Svara: fick du nog? Ja, det fick du nog Har du lrt dig att st vid ditt ord? Snt imponerar mer n ett leende Hr r ett avtryck som sitter lngre n det du redan gjort..  Svara: fick du nog ja det fick du nog Kan du ngra fler runda ord att imponera med gr ett intryck, le! Gr ett avtryck som sitter lngre n de du redan gjort  Vad har du gjort? Vad har du gjort?"
  Jimi Hendrix  ,Red House,"Oh, yeah There's a Red House over yonder That's where my baby stays Lord, there's a Red House over yonder Lord, that's where my baby stays I ain't been home to see my baby, in ninety nine and one half days. Wait a minute something's wrong here The key won't unlock this door. Wait a minute something's wrong Lord, have mercy, this key won't unlock this door, something's goin' on here. I have a bad bad feeling that my baby don't live here no more. That's alright, I still got my guitar Look out now . . . Yeah . . . That's alright, I still got my guitar . . . Well, I might as well go back over yonder Way back up on the hill That's something to do Lord, I might as well go back over yonder Way back yonder cross the hill 'Cause if my baby don't love me no more, I know her sister will."
  차은주  ,이 노래,그대여 이젠 힘겨워 말아요 멀리서 이렇게 진심으로 응원하고 또 응원해 슬픈 생각도 하지 마요 그대의 눈물에 난 잠도 잘 수가 없어 뒤척여 그대의 등을 도닥여주고픈 어깨를 감싸주고 싶은 맘 가득하고 또 가득해 그댈 위해 이 노랠 불러요 하늘이 있다면 그대 맘에 닿을 테니까 부족하다고 말하는 그대가 나의 삶에서 가장 중요한 사람이란 걸 아나요 그대가 생각한 그대 보다 멋지고 따뜻한 사람이라는 걸 아나요 그대 다친 맘 다 낫게 할게요 그대의 머리를 내게 기대어도 좋아요 어서요 그대 지친 맘 모두 쉬어요 눈 감고 걸어도 절대 넘어지지 않아요 마음 다해 노래 부를게요 그대 마음속에 빛이 비치도록 말로 전할 수는 없다 해도 그대 맘에 닿아 눈물이 멈추도록 그대여 이젠 외로워 말아요 멀리서 이렇게 진심으로 기도하고 또 기도해 슬픈 눈물은 흘리지 마요 그대 그 모습에 내 맘도 울고 있네요 아프게 그대 어깨를 감싸주고 싶지만 그럴 수 없는 나를 위해라도 웃어주어요 어서요 이 노랠 그댈 위해 불러요 하늘이 있다면 그대 맘에 닿을 테니까 마음 다해 노래 부를게요 그대 마음속에 빛이 비치도록 말로 전할 수는 없다 해도 그대 맘에 닿아 눈물이 멈추도록 온 마음 다해 노래 부를게요 말로 전할 수는 없다 해도 온 마음 다해 그댈 위해 이 노래를 부를게요
  넬 (NELL)  ,기억을 걷는 시간,아직도 너의 소리를 듣고 아직도 너의 손길을 느껴 오늘도 난 너의 흔적 안에 살았죠 아직도 너의 모습이 보여 아직도 너의 온기를 느껴 오늘도 난 너의 시간 안에 살았죠 길을 지나는 어떤 낯선이의 모습속에도 바람을 타고 쓸쓸히 춤추는 저 낙엽위에도 뺨을 스치는 어느 저녁의 그 공기속에도 내가 보고 듣고 느끼는 모든 곳에 니가 있어 그래 어떤가요 그대 어떤가요 그댄 당신도 나와 같나요 어떤가요 그대 지금도 난 너를 느끼죠 이렇게 너를 부르는 지금 이순간도 난 그대가 보여 내일도 난 너를 보겠죠 내일도 난 너를 듣겠죠 내일도 모든게 오늘 하루와 같겠죠 길을 지나는 어떤 낯선이의 모습속에도 바람을 타고 쓸쓸히 춤추는 저 낙엽위에도 뺨을 스치는 어느 저녁의 그 공기속에도 내가 보고 듣고 느끼는 모든 곳에 니가 있어 그래 어떤가요 그대 어떤가요 그댄 당신도 나와 같나요 어떤가요 그대 길가에 덩그라니 놓여진 저 의자위에도 물을 마시려 무심코 집어든 유리잔 안에도 나를 바라보기위해 마주한 그 거울속에도 귓가에 살며시 내려앉은 음악속에도 니가있어 어떡하죠 이젠 어떡하죠 이젠 그대는 지웠을텐데 어떡하죠 이젠 우린 랄라라 라랄라랄라 랄라라 라랄라랄라 랄라라 라랄라랄라 어떡하죠 이젠 랄라라 라랄라랄라 랄라라 라랄라랄라 랄라라 라랄라랄라라 어떡하죠 이젠 그리움의 문을 열고 너의 기억이 날 찾아와 자꾸 눈시울이 붉어져 어떡하죠 이젠 그리움의 문을 열고 너의 기억이 날 찾아와 자꾸만 가슴이 미어져 어떡하죠 이젠 그리움의 문을 열고 너의 기억이 날 찾아와 자꾸 눈시울이 붉어져 어떡하죠 이젠 그리움의 문을 열고 너의 기억이 날 찾아와 자꾸만 가슴이 미어져 어떡하죠 이젠 랄라라 라랄라랄라 랄라라 라랄라랄라 랄라라 라랄라랄라 랄라라 라랄라랄라 랄라라 라랄라랄라 랄라라 라랄라랄라 랄라라 라랄라랄라 랄라라 라랄라랄라 랄라라 라랄라랄라 랄라라 라랄라랄라 랄라라 라랄라랄라 랄라라 라랄라랄라
  AFI  ,Too Shy To Scream,I come quietly Silent entities Can lack a certain weight When unseen Do they speak of me My voice left with the breeze That whispered you should flee or you shall be seen I'd die If you only met my Eyes Before you pass by Will you pause to break my heart I'd die If you only met my Eyes Before you pass by Will you pause to break my heart  I am everywhere Everywhere but here For here is where you grace The nameless Were I not so weak Could I even speak I'd warn that you should leave Before you seen with me I'd die If you only met my Eyes Before you pass by Will you pause to break my heart I'd die If you only met my Eyes Before you pass by Will you pause to break my heart Will you pause to break my heart Will you pause  I am everywhere Everywhere but here I am everywhere Everywhere but here I'd die If you only met my Eyes Before you pass by Will you pause to break my heart I'd die If you only met my Eyes Before you pass by Will you pause Oh I'd die If you only met my Eyes Before you pass by Will you pause to break my heart Will you pause to break my heart Will you pause
  Paula Cole  ,I Don`t Want To Wait,So open up your morning light And say a little prayer for I you know that if we are to stay alive Then see the peace in every eye  She had two babies One was six months one was three In the war of 44 Every telephone ring every heartbeat stinging When she thought it was God calling her Oh would her son grow to know his father I don't want to wait for our lives to be over I want to know right now what will it be I don't want to wait for our lives to be over Will it be yes or will it be sorry  He showed up all wet on the rainy front step Wearing shrapnel in his skin And the war he saw lives inside him still It's so hard to be gentle and warm The years pass by and now he has granddaughters I don't want to wait for our lives to be over I want to know right now what will it be I don't want to wait for our lives to be over Will it be yes or will it be You look at me from across the room You're wearing your anguish again Believe me I know the feeling It sucks you into the jaws of anger So breathe a little more deeply my love All we have is this very moment And I don't want to do what his father and his father and his father did I want to be here now So open up your morning light And say a little prayer for I You know that if we are to stay alive Then see the peace in every eye I don't want to wait for our lives to be over I want to know right now what will it be I don't want to wait for our lives to be over Will it be yes or will it be I don't want to wait for our lives to be over I want to know right now what will it be I don't want to wait for our lives to be over Will it be yes or will it be sorry  So open up your morning light And say a little prayer for I You know that if we are to stay alive Then see the love in every eye
  The 1975  ,12,"She had a face straight outta magazine God only knows but you'll never leave her Her balaclava is starting to chafe And when she gets his gun he's begging, Babe, stay, stay, stay, stay, stay  I'll give you one more time We'll give you one more fight Said one more lie Will I know you  Now if you never shoot, you'll never know And if you never eat, you'll never grow You've got a pretty kind of dirty face And when she's leaving your home she's begging you, Stay, stay, stay, stay, stay  I'll give you one more time We'll give you one more fight Said one more line Be a riot, cause I know you  Well, now that you've got your gun It's much harder now the police have come Now I'll shoot him if it's what you ask But if you just take off your mask You'd find out everything's gone wrong  Now everybody's dead And they're driving past my old school He's got his gun, he's got his suit on She says, Babe, you look so cool, you look so cool, you look so coo-o-o-oo-oo-ool You look so cool, you look so cool, you look so coo-o-o-oo-oo-ool"
  유승우  ,서툰 사랑,사랑 그 아픈 맘 때문에 눈물이 흘러서 이젠 내게 말하려 하는 널 보지 못해 사랑 그 슬픈 맘 때문에 추억을 못 잊고 이별하자 니 마음에 이율 물어 사랑을 하면서 많이 느꼈죠 그대 얼마나 날 위한 사람이었는지 이젠 그대가 날 위해 있지 않네요 혹시 나만큼 슬프다면 돌아와줬으면 애써 웃음 짓는 눈빛은 이별일 걸 알기에 사랑을 하면서 많이 느꼈죠 그대 얼마나 날 위한 사람이었는지 이젠 그대가 날 위해 있지 않네요 혹시 나만큼 슬프다면 돌아와줬으면 혹시 나만큼 슬프다면 돌아와줬으면
  자우림  ,애인발견,바보같다 생각했어 너를 한 번 봤을 땐 멍청한 눈 헝클어진 머리 마른 몸 착하다고 생각했어 너를 두 번 봤을 땐 상냥한 눈 귀여운 머리 날씬한 몸 사람들은 너를 몰라 안경너머 진실을 봐 어리숙한 모습뒤에 천사같은 네 영혼을 나 밖에는 아무도 모를거야 바보같다 생각했어 너를 한 번 봤을 땐 어눌한 말 촌스러운 표정 어색했지 착하다고 생각했어 너를 두 번 봤을 땐 솔직한 말 신선한 표정 좋았지 사람들은 나를 몰라 안경너머 진실을 봐 웃고 있는 얼굴 뒤에 기댈 곳 없는 내 어깨를 너 밖에는 아무도 모를거야 사람들은 우릴 몰라 안경너머 진실을 봐 이 세상엔 아름다운 사람들이 이렇게도 가득가득 많고 많은데 너는 너무 착해 내가 널 지켜줄거야 지금 이대로 좋은 사람 그대로 나는 너무 약해 네가 날 지켜줘야해 지금 이대로 좋은 사람 그대로
  Blessthefall  ,40 Days...,"Let's start at one And count the days Let's hope to God that time flies like they say Cause this instance can't distance my heart from yours tonight But I'm lying awake now and I'm holding your picture It's so cold here without you  And I need you now, cause it's killing me And I wish somehow, you were here with me When I fall asleep I feel you with me Till I fall asleep and you are with me  Could this be more I've been up all night riding subway lines Now we're sleeping on your floor  Can we make this a lifetime, you're all I want right now Life keeps telling me I need to go But what if I wanna stay Cause I'm lost here without you  And I need you now, cause it's killin me And I wish somehow, you were here with me  When I fall asleep, I feel you with me Till I fall asleep, and you are with me  I've found a love I've never had before, you changed me And I will wait however long it takes, you changed me You say the words that I've been thinking I'll never let you go  And I need you now, cause it's killing me And I wish somehow, you were here with me  When I fall asleep, I feel you with me Till I fall asleep, and you are with me  You changed me You changed me  Next stop is Davisville, Davisville station"
  DAY6 (데이식스)  ,Hunt,수많은 사람들 사이에서 너가 시야 안에 들어오면 You know oh you know 난 바로 설레여 Ooh 내가 널 놓칠 일은 절대로 없어 no Come on 너의 앞에 다가가서 수줍은 미소가 보이면 You know uh uh uh you know 난 바로 널 가져 Ooh Girl I can make you feel alive 한번도 널 찾은 이후로 아무도 너 말곤 누구도 안보여 내 눈에 보이는 건 You you you Baby 어디 갈 생각은 하지 마 도망칠 생각도 하지 마 Baby girl 우아 우아 널 사냥해 우아 우우 난 널 사냥해 Sweet girl oh sweet girl oh baby Be ma girl be ma girl ma baby Sweet girl oh sweet girl oh baby Be ma girl be ma girl ma baby 아무 말 없이 널 쳐다봐 너도 속으로 느끼잖아 You know uh uh uh you know 너도 날 원해 Ooh 이제 그만 받아들여 babe you are mine come on 한번도 널 찾은 이후로 아무도 너 말곤 누구도 안보여 내 눈에 보이는 건 You you you Baby 어디 갈 생각은 하지 마 도망칠 생각도 하지 마 Baby girl 우아 우아 널 사냥해 우아 우우 난 널 사냥해 Sweet girl oh sweet girl oh baby Be ma girl be ma girl ma baby Sweet girl oh sweet girl oh baby Be ma girl be ma girl ma baby 미안한데 니 앞에 서기만 하면 개가 돼 널 낚아 채기 전에 눈빛은 바로 매가 돼 먹잇감 바라보듯이 널 보며 침 흘려 집으로 보낼 생각은 없어서 일부러 워 잠깐 쉬었다 가자 더워 자켓 좀 벗어놓자 이미 버스는 놓쳤어 이것은 미쳤어 비젼이 있어 보여 oh my jesus Yes good morning 헝클어진 머리마저도 그리 섹시하니 그러니 Baby 어디 갈 생각은 하지 마 도망칠 생각도 하지 마 Baby girl 우아 우아 널 사냥해 우아 우우 난 널 사냥해 Sweet girl oh sweet girl oh baby Be ma girl be ma girl ma baby Sweet girl oh sweet girl oh baby Be ma girl be ma girl ma baby
  하현곤 팩토리  ,코끝이 찡하네,코끝이 찡하네 자려고 누웠는데 아련한 가을추억이 떠올라서 코끝이 찡하네 가을이 시작되는 이 밤 첫 사랑이 시작된 날이라서 가을은 잊을수 없는 계절이 되고 내게 소중한 추억을 주었네 가을은 사랑이 뭔지 알게 해주고 내게 쓸쓸함도 함께 주었네 코끝이 찡하네 어둔 저 밤하늘에 달빛이 차가운 내 마음에 잠기네 가을은 잊을수 없는 계절이 되고 내게 소중한 추억을 주었네 가을은 사랑이 뭔지 알게 해주고 내게 쓸쓸함도 함께 주었네
  Pearl Jam  ,Smile,"Don't it make you smile? When the sun don't shine Don't it make you smile?  Don't it make you smile? Don't it make me smile? Oh, when the sun don't shine, it don't shine at all, yeah Don't it make me smile? I miss you already I miss you always I miss you already I miss you all day This is how I feel  Ah, I miss you already I miss you always Three crooked hearts... Swirls all around her I miss you all day"
  Deicide  ,Once Upon The Cross,"Once upon the cross  Fear him, fear him, fear him... Satan  Nazarene in the valley of persuasion To receive last temptations from Lord Satan ""Take a bite"" said the serpent ""eat of it"" Without no choice to do so, you cannot resist  Impaled crucifixion Compassion forgot Eternal damnation Once upon a cross  Blasphemy laughs at thee Jesus you've been deceived Struggling on the cross Gagging to breathe Despite your god, question why You were retrieved by the angel of light  Kill him, kill him, kill him... Satan  Nazarene screaming on his crucifixion Prophecy in its final contradiction When you die is when the lie will be believed Upon the cross, before the world to see  Once upon the cross"
  Incubus  ,Drive,Sometimes I feel the fear of uncertainty stinging clear And I can't help but ask myself how much I'll let the fear take the wheel and steer It's driven me before and it seems to have a vague haunting mass appeal But lately I am beginning to find that I should be the one behind the wheel Whatever tomorrow brings I'll be there with open arms and open eyes Whatever tomorrow brings I'll be there I'll be there So if I decide to waiver my chance to be one of the hive will I choose water over wine and hold my own and drive It's driven me before and it seems to be the way that everyone else gets around But lately I'm beginning to find that when I drive myself my light is found Whatever tomorrow brings I'll be there with open arms and open eyes Whatever tomorrow brings I'll be there I'll be there Would you choose water over wine hold the wheel and drive Whatever tomorrow brings I'll be there with open arms and open eye Whatever tomorrow brings I'll be there I'll be there
  A Rocket To The Moon  ,Wild & Free,I pulled up to a drive I tightened up my tie And I'd hate to make her wait No sleep from the night before Her dad answers the front door And already knows my name I stand in fear As she gets near Then everything's okay I hope this feeling never goes away I never thought I'd find a love like this There's no need To hide that feeling we get Whenever we touch We can't resist We go back to our first date Our first kiss Her face lit by the movie screen She's leanin' into me And time seems to slip away Later on we take a walk and Good thing she likes to talk Cause I can't think of what to say She looks at me And she can see The chance I wanna take She moves in closer Takes my breath away I never thought I'd find a love like this There's no need To hide that feeling we get Whenever we touch We can't resist We go back to our first date Our first kiss Every time feels like a first time Looking back on what we had It never went away She still makes me feel it everyday I never thought I'd find a love like this There's no need To hide that feeling we get Whenever we touch We can't resist We go back to our first date I never thought I'd find a love like this There's no need To hide that feeling we get Whenever we touch We can't resist We go back to our first date Our first kiss
