artist,title,lyric
  Staind  ,Mudshovel,"You take away I feel the same  Verse 1 You take away I feel the same All the promises you made To me you made in vain I lost myself inside your Tainted smile again  Refrain 'Cause you can't feel my anger You can't feel my pain You can't feel my torment Drivin' me insane I can't fight these feelin's They will bring you pain You can't take away Make me whole again  Verse 2 I feel betrayed Stuck in your ways And you rip me apart With the brutal things you say I can't deal with this shit anymore I just look away  Refrain 'Cause you can't feel my anger You can't feel my pain You can't feel my torment Drivin' me insane I can't fight these feelin's They bring only pain You can't take away Make me whole again  Interlude Mudshovel, mudshovel, mudshovel, mudshovel Mudshovel, mudshovel, mudshovel, mudshovel  Verse 3 You take away I feel the same All these promises You promised only pain If you take away And leave me with nothing again  Refrain 'Cause you can't feel my anger You can't feel my pain You can't feel my torment Drivin' me insane I can't fight these feelin's They will bring me pain You can't take away Make me whole again You will feel my anger You will feel my pain You will feel my torment Drivin' you insane I can't fight these feelin's They will bring you pain You won't take away I'll be whole again  Outro Mudshovel, mudshovel, mudshovel, mudshovel Mudshovel, mudshovel, mudshovel, mudshovel"
  노브레인  ,뻐꾸기 둥지 위로 날아간 새,도대체 왜 이럴까 누가 좀 말려 줘봐 왜 자꾸 어두워만 지면은 밖으로 나가는지 모르겠어 오늘은 또 어디서 누구를 또 만날까 분명히 어제처럼 별 볼일 없이 끝 날테지만 오늘 밤이 이 세상에서 마지막이 될 것 처럼 혼신의 힘을 다해서 춤추고 노래해 한 마리 새처럼 내가 혼자라는 외로움이 그 안에 다시 못 들어오게 비라도 내리게 하늘을 찔러봐 저기 맑은 하늘 모두 다가 너의 세상이니까 도대체 몇 명인지 셀 수도 없을 만큼 오늘밤 그대 곁에 왔다가 스쳐간 여자들은 많겠지만 어떻게 오셨나요 누구랑 오셨나요 똑같은 얘기들을 하고 있는 넌 뻐꾸기 같아 오늘밤에 누구라도 자기 짝을 찾기 위해 혼신의 힘을 다해서 춤추고 노래해 한 마리 새처럼 그냥 잠시라도 내안에서 함께할 사랑 찾고 싶어서 시간이 갈수록 불안해지지만 그렇다고 다시 어제처럼 혼자이긴 싫었어 깨어진 어둠에 아침이 오나봐 주윌 둘러보고 알게 됐어 오늘도 역시 혼자라는 걸 다시 또 혼자야 오늘도 혼자야 저기 너무 맑은 하늘위로 새가 되어 버린 너 저기 너무 맑은 하늘위로 새가 되어 버린 너
  Kasabian  ,You`re In Love With A Psycho,You know it's the place I need But you got me walking circles like a dog on a lead And the doctors say I'm crazy that I'm eight miles thick I'm like the taste of macaroni on a seafood stick And you got me switched on baby like electric eel And I'm tight with Axel Foley that's just how I feel Like a grapefruit and a magic trick the prodigal son I'm walking I'm walking I'm walking I walk so quick And it just don't mean a thing We've been waiting far too long We'll play it out again This is just my serenade You're in love with a psycho You're in love with a psycho And there's nothing you can do about it I got you running all around it You're in love with a psycho You're in love with a psycho And there's nothing you can do about it You never gonna be without it Jibber jabber at the bargain booze And reciting Charles Bukowski I got nothing to lose And I wait for you to follow me to share my chips But you're walking you're walking you walk you walk so quick Nobody's gonna take you there I stick around for the thousand yard stare I go to sleep in a duffle bag I'm never up never down down down down Hey you're in love with a psycho You're in love with a psycho And there's nothing you can do about it I got you running all around it You're in love with a psycho You're in love with a psycho And there's nothing you can do about it You're never gonna be with Maybe this way we'll find a solution Maybe this way we'll find a solution of problems Oh to love we gotta find love You're in love with a psycho You're in love with a psycho And there's nothing you can do about it I got you running all around it You're in love with a psycho Tu amor es muy loco And there's nothing you can do about it You never gonna be without it
  Rae Morris  ,Do You Even Know?,"Blow away, in time It's hard to see yourself in the corner I gather reasons why Try to justify what I taught her Did you love Did you love someone To the bitter end When the love couldn't come And you want to leave, where you came from And cast your heart And mind to the ocean Do you even know that I keep everything in Do you even know that I keep everything in Do you even know that I keep everything in Do you even know me at all It's brave to seek sometimes But I'm not brave enough to get over The many miles I've run Have only put more weight On my shoulders When I loved When I loved someone To the bitter end When the love couldn't come I just want to leave Where we came from And cast my heart and mind to the ocean Do you even know that I keep everything in Do you even know that I keep everything in Do you even know that I keep everything in Do you even know me at all Head tied Over what we're doing My mind Wasn't built for this Do you even know that I keep everything in Do you even know that I keep everything in Do you even know that I keep everything in Do you even know me at all"
  Amber Run  ,Noah,"My name is Noah, the sea is my home This small waiting boat will be my throne I'm proud of what I've built and the things that I've done And all of the people I've learned to love Singing Noah, Noah My name is Judas and my eyes are tired And even my presence is a warning sign That wherever you go and whatever you do Your past will always follow you Singing Noah, Noah So why don't we light a fire And I'll let the flames grow higher So why don't we light a fire and leave the rest behind Cause life's for living right Singing Noah, Noah Singing Noah, Noah Get busy living or get busy dying I hate to see you left behind Get busy living or get busy dying I hate to see you left behind Singing Noah, Noah"
  Agnes Obel  ,Philharmonics,Down by the river by the boats Where everybody goes to be alone Where you won't see any rising sun Down to the river we will run When by the water we drink to the dregs Look at the stones on the river bed I can tell from your eyes You've never been by the riverside Down by the water the riverbed Somebody calls you somebody says Swim with the current and float away Down by the river everyday Oh my God I see how everything is torn in the river deep And I don't know why I go the way Down by the riverside When that old river runs pass your eyes To wash off the dirt on the riverside Go to the water so very near The river will be your eyes and ears I walk to the borders on my own To fall in the water just like a stone Chilled to the marrow in them bones Why do I go here all alone Oh my God I see how everything is torn in the river deep And I don't know why I go the way Down by the riverside Oh my God I see how everything is torn in the river deep And I don't know why I go the way Down by the riverside Oh oh hey hey Oh oh hey hey Oh oh hey hey Down by the riverside Down by the riverside
  Soundgarden  ,Superunknown,In my eyes indisposed In disguise as no one knows Hides the face lies the snake The sun in my disgrace Boiling heat summer stench Neath the black the sky looks dead Call my name through the cream And I'll hear you scream again Black hole sun Won't you come And wash away the rain Black hole sun Won't you come Won't you come Won't you come Stuttering cold and damp Steal the warm wind tired friend Times are gone for honest men And sometimes far too long for snakes In my shoes a walking sleep And my youth I pray to keep Heaven send Hell away No one sings like you anymore Black hole sun Won't you come And wash away the rain Black hole sun Won't you come Won't you come Black hole sun Won't you come And wash away the rain Black hole sun Won't you come Won't you come Black hole sun Black hole sun Won't you come Black hole sun Black hole sun Won't you come Black hole sun Black hole sun Won't you come Black hole sun Black hole sun Hang my head drown my fear Till you all just disappear Black hole sun Won't you come And wash away the rain Black hole sun Won't you come Won't you come Black hole sun Won't you come And wash away the rain Black hole sun Won't you come Won't you come Black hole sun Black hole sun Won't you come Black hole sun Black hole sun Won't you come Black hole sun Black hole sun Won't you come Black hole sun Black hole sun Won't you come Black hole sun Black hole sun Won't you come Black hole sun Black hole sun Won't you come Won't you come
  Fucked Up  ,Magic Word,"Put a bug into my ear When I woke up I was here I blew smoke onto a page and watched the letters re-arrange Pushed the words into my veins Tripped the valve inside my brain Spoke a language I could see I swam inside reality  Chorus Write in vines and speak in tongues Double meanings in my lungs Brazen head spits out the skies These words are heavy but I'm alright  Verse 2: The tangled web inside my head changed the canvas as it spread Concepts mushroomed as I talked Notions opened as I walked Chemistry is just a word we use to describe What occurs when subtle changes in our mind make energy from common lives  Chorus  Bridge Things move everywhere, I look, I'm stuck in someone else's book Letter perfect engineer then it all just disappears Alright  Chorus  All of my words became one all the changes were undone I'm a strange loop, that is clear, put a bug into my ear"
  Regina Spektor  ,Samson,"You are my sweetest downfall I loved you first, I loved you first Beneath the sheets of paper lies my truth I have to go, I have to go Your hair was long when we first met  Samson went back to bed Not much hair left on his head He ate a slice of wonder bread And went right back to bed And the history books forgot about us And the Bible didn't mention us And the Bible didn't mention us Not even once  You are my sweetest downfall I loved you first, I loved you first Beneath the stars came fallin' on our heads But they're jist old light, they're just old light Your hair was long when we first met  Samson came to my bed Told me that my hair was red Told me I was beautiful And came into my bed Oh, I cut his hair myself one night A pair of dull scissors and the yellow light And he told me that I'd done alright And kissed me till the mornin' light, the mornin' light And kissed me till the mornin' light  Samson went back to bed Not much hair left on his head He ate a slice of wonder bread And went right back to bed Oh, we could'nt bring the columns down Yeah, we couldn't destroy a single one And history books forgot about us And the Bible didn't mention us Not even once  You are my sweetest downfall I lobed you first"
  James Blunt  ,Sun On Sunday,A silent tear An empty smile So insincerely but so gently in denial And me the thief So selfishly All the moments meant for you I made them mine How was I so blind to miss you crumbling inside Is it too late now to fix you let me make it right Cause there'll be no sun on Sunday No reason for words to rhyme Cause if you're bleeding So am I A wishful look A hesitate You're hoping I will notice that you're not ok And me the fool You turn away It's only then I feel the weight of my mistakes How was I so blind to miss you crumbling inside Is it too late now to fix you let me make it right Cause there'll be no sun on Sunday No reason for words to rhyme Cause if you're bleeding So am I And if I cut you If I bruise you Then the scars are always mine Cause I Love You So to lose you Would be worse than if I died How was I so blind to miss you crumbling inside Is it too late now to fix you let me make it right Cause there'll be no sun on Sunday No reason for words to rhyme Cause if you're bleeding So am I
  Murderdolls  ,Die My Bride,Well Id rather cut you then the wedding cake And I do And your bloody guts on my rented tux I do I do want to kill you Ill tear us apart Till death do us part And dip my chips in the blood that drips Now I kiss your cold dead lips And I smear the cake right in your face Let your God take you to a better place Well I love you to death Well I love you to death Die! Die! Die! DIE MY BRIDE!! Die! Die! Die! DIE MY BRIDE!! All you ever meant to me was ab -so- lutely nothing And with this ring I be-wed Dont want to kiss you bitch! I want to bash your head! Well I love you to death Well I love you to death Die! Die! Die! DIE MY BRIDE!! Die! Die! Die! DIE MY BRIDE!! Die! Die! Die! DIE MY BRIDE!! Die! Die! Die! DIE MY BRIDE!!
  Amber Run  ,See You Soon,And I know you feel smaller now Oh in more ways than one but there are things that you do girl Oh like nobody else Like how your hair falls down your back Oh your eyes crease when you laugh Oh how you don't walk but you bounce Oh how you don't cry but you gasp Let that be a lesson to you That there's depth where there's distance too And all that you can do Is say I'll see you soon I'll see you soon and I'm aware of your problems and all the things that you've done all that I've know is that you burn like the sun Oh how your hair falls down your back Oh your eyes crease when you laugh Oh how you don't walk but you bounce Oh how you don't cry but you gasp Let that be a lesson to you That there's depth where there's distance too And all that you can do Is say I'll see you soon Is say I'll see you soon I'll see you soon No I'll see you soon No I'll see you soon Let that be a lesson to you That there's depth where there's distance too And all that you can do Is say I'll see you soon Is say I'll see you soon
  퍼필  ,Dear,"현실의 바다를 건너 이상의 세계로...나 날아가리...    캔버스 안에 그리는 수채화들같이  우리삶의 무게는 붓끝이 닿을수록 진해져가는 색칠놀이  인생의 그림이 진해져가는 만큼  더러워져가는 물통속에 회오리안에 어린시절 던져버려  현실과 이상의 시소타다 찾게되는 나만의 파라다이스  내마이크로폰이 인도하는 그곳을 향해 떠나 내노래 병풍삼아  희비의 교차를 얘기하며 나누는 술잔,한숨    아침에 일어나서 제일 먼저생각해  첫째는 나의 그녀 둘째는 퍼플필즈  길바닥에 떨어져있는 꽁초를  필수밖에 없는 꼴초의 절박함은 필수  다시 돌아올수없어 여기까지  수많은 라임을 선택해 여기까지  이넓은 세상에 비해 나그리  크지않기에 부족한 내실력에 노력에 노력을 더해    그누가 막더라도 그 끝이 멀더라도  나다시 태어나도 내가 가야할곳  A-yo 나 제대로 바라보지못했어  깊은 한숨 드넓은 하늘아래 한없이 작은 내모습  그누가 막더라도 그 끝이 멀더라도  나다시 태어나도 내가 가야할곳  A-yo just give me the microphone  너에겐 진실들만 세상의 가려진 거짓그만    나 새로태어날땐 올바른 입과 손가락  가졌으나 내입은 여인을 탐하며 세월흘러보내고  내 탐익의 손가락끝은 여인을 홀리며 세월보내다  나 증오의 눈을떴으니 내앞의 사악한 자들을 향한 외침  들은 좀비가 되버린 그들의 비아냥속에 화형  달은 보지않고 손가락 끝을 파먹어버렸네  발바닥핥던 자들이 그들의 심복이 되어 찌르곤  차갑던 겨울보다 마음이 얼어붙어있네    눈을떠 바라본 이곳 현실속에서  지금 나의 현재 위치에 만족하려 애써왔네  숱한먼지를 마시며 벌어온 10만원에  한남자의 자존심은 사라졌어 한순간에  되지않는 일들의 연속의 연속 늘어나는  썩은 니코틴양만이 차곡차곡 결국엔  다시 쥐어잡을수밖에 (mic!) 낡은 서랍속 shure beta 57A    그누가 막더라도 그 끝이 멀더라도  나다시 태어나도 내가 가야할곳  A-yo 나 제대로 바라보지못했어  깊은 한숨 드넓은 하늘아래 한없이 작은 내모습  그누가 막더라도 그 끝이 멀더라도  나다시 태어나도 내가 가야할곳  A-yo just give me the microphone  너에겐 진실들만 세상의 가려진 거짓그만    어릴적 어머니는 세상의 더러움을 숨겨주시고  아버지는 고난과 역경을 몸으로 막아주시니  이넓은 세상에 혼자힘으로 살기는 힘들어  부모의 위대함에 더러운 손을 내밀어  내뜻을 새기는 과정의 아픔을 날 아껴주는이가  기꺼이 짊어짐에 오늘도 감사의 편지  이넓은 세상에 혼자힘으로 살기는 힘들어  사랑의 위대함에 더러운 손을 내밀어        암흑과도 같은 이길앞에 서있어    온통뿌옇게 변해버린 이세상에 너 꺼지지않는 태양처럼    그빛으로 날 지켜줘 내가 네게 다가갈때 까지...  A-yo just give me the microphone  너에겐 진실들만 세상의 가려진 거짓그만"
  Milky Chance  ,Cocoon,"Eh ah, eh ah, eh ah, eh oh Eh ah, eh ah, oh Eh ah, eh ah, eh ah, eh oh Eh ah, eh ah, oh  I know that you must feel like facing with a ruin, facing with a ruin I messed it up as always, I'm afraid of losing, I'm afraid of losing I made you thinking oh so wrong I made you feeling the worst And I don't how to get along With myself when I'm weakened When I'm weakened  So let's go back to our cocoon On the blackened afternoon I see your heart is beating too Let me bleed instead of you So let's go back to our cocoon On the blackened afternoon I see your heart is beating too Let me bleed instead of you Let me bleed, let me bleed Eh ah, eh ah Let me bleed, let me bleed Eh ah, eh ah Instead of you  I've been always playing Solid as I'm waving, solid as I'm waving So I became a liar, I've been underrating Overestimated I made it really hard for you Hard for you to love me But there's so many things we could do And all we need is escaping, escaping  So let's go back to our cocoon On the blackened afternoon I see your heart is beating too Let me bleed instead of you So let's go back to our cocoon On the blackened afternoon I see your heart is beating too Let me bleed instead of you Let me bleed, let me bleed Eh ah, eh ah Let me bleed, let me bleed Eh ah, eh ah Instead of you  Eh ah, eh ah, oh Eh ah, eh ah  So let's go back to our cocoon On the blackened afternoon I see your heart is beating too Let me bleed instead of you So let's go back to our cocoon On the blackened afternoon I see your heart is beating too Let me bleed instead of you Let me bleed, let me bleed Let me bleed, let me bleed Let me bleed, now I will bleed Instead of you"
  버스터즈 (BURSTERS)  ,오늘이 세상 마지막 날이라 해도,무너져 내려 발 밑까지 흩어져 버린 지난날의 기억 그래도 살아가야 할 이유가 있어 수없이 먼지 쌓인 손을 털고 일어서 습관처럼 낡은 지갑을 꺼내 하얗게 닳아버린 너의 사진을 쥐고 거칠고 힘든 나 살아갈 날들 내 남은 인생 너 하나를 위해 오늘이 세상 마지막 날이라 해도 난 너 하나로 충분해 쏟아져 내리는 눈물을 참아 괜찮아 난 더 강해졌어 널 위해 약속할게 눈감는 순간에도 널 기억해 거칠고 힘든 나 살아갈 날들 내 남은 인생 너 하나를 위해 오늘이 세상 마지막 날이라 해도 난 너 하나면 날 기다리다 지쳐 잠든 넌 기도해 나 돌아올 새벽 그 길 비춰주오 끝나지 않은 악몽 같아도 난 남은 인생 너 하나를 위해 오늘이 세상 마지막 날이라 해도 난 너 하나면 거칠고 힘든 나 살아갈 날들 내 남은 인생 너 하나를 위해 오늘이 세상 마지막 날이라 해도 난 너 하나로 충분해 거칠은 삶을 살아도 난 끝없는 악몽 같아도 난 오늘이 세상의 마지막 날이라 해도 오늘이 세상의 마지막 날이라 해도 오늘이 세상의 마지막 날이라 해도
  Elliott Smith  ,Pitseleh,"I'll tell you why I don't want to know where you are I got a joke I've been dying to tell you A silent kid is looking down the barrel To make the noise that I kept so quiet Kept it from you, Pitseleh  Verse 2 I'm not what's missing from your life now I could never be the puzzle pieces They say that God makes problems just to see what you can stand Before you do as the Devil pleases Give up the thing you love  But no one deserves it  Verse 3 The first time I saw you I knew it would never last I'm not half what I wish I was I'm so angry I don't think it'll ever pass And I was bad news for you just because I never meant to hurt you"
  장한별  ,뭣 같은 LOVE (Feat. 린지 of 피에스타),그까짓 사랑 난 없어도 돼 커피 한 잔쯤 혼자 즐겨도 돼 마치 헐리웃 스타들처럼 just like a movie a movie star 뚜루뚜뚜 난 한 여자에 목매지 않아 질릴 때 마다 바꿔 만날까 봐 마치 헐리웃 스타들처럼 just like a movie a movie star 뚜루뚜뚜 a movie a movie a movie star show 뭣 같은 Love no way out 더 이상 사랑은 없어 멍청한 Love don't you know 더 질리게 하지마 뭣 같은 Love time to go 난 지울 꺼야 럽럽럽 지겨운 Love 더 이상 붙잡지마 답 없는 Love 날 지워 여자는 많아 너를 대신 할 몇 번을 말해 전혀 i'm not lonely lonely 세상 여자들 다 내 것처럼 just like a movie a movie star 뚜루뚜뚜 a movie a movie a movie star show 뭣 같은 Love no way out 더 이상 사랑은 없어 멍청한 Love don't you know 더 질리게 하지마 뭣 같은 Love time to go 난 지울 꺼야 럽럽럽 지겨운 Love 더 이상 붙잡지마 답 없는 Love 날 지워 내 얘기 따위 너는 듣지 않아 맘대로 생각해 이 밤이 가도 후회 안 할 것 같아 놓치마 your chance please open your eyes it's not a movie a movie star 뚜루뚜뚜 a movie a movie a movie star show 뭣 같은 Love no way out 더 이상 사랑은 없어 멍청한 Love don't you know 더 질리게 하지마 뭣 같은 Love time to go 난 지울 꺼야 럽럽럽 지겨운 Love 더 이상 붙잡지마 답 없는 Love 날 지워 뭣 같은 Love
  이혁  ,남자,약속 늦지 않을게 담배 끊을게 술도 좀 줄여볼게 만난 지 천일 되는 날 처음 너를 안던 날 그런 날도 다 기억해둘게 그간 좀 소홀했지 무뚝뚝했었지 나란 놈 그런 놈이야 나의 죄를 사해줘 달라질 거야 네게 꼭 맞는 남자로 니가 아파할 때도 슬퍼 울먹일 때도 모자란 이 사람 사랑해준 너를 슬픔 속에 구해 낼 거야 넌 가만있어 사랑만줘 난 지켜 낼 거야 난 할 거야 사랑 다투고 짜증내고 나 같은 놈에겐 사랑 사치 같아도 그걸 뺏기고 살 순 없는 남자야 너 하나 내 전부니까 니가 아파할 때도 슬퍼 울먹일 때도 모자란 이 사람 사랑해준 너를 슬픔 속에 구해 낼 거야 넌 가만있어 사랑만 줘 난 지켜 낼 거야 난 할 거야 내가 경험해야 할 오로지 단 한사람 너뿐이야 너 하나야  너의 사랑 하나만 그저 그것하나만 내겐 사랑하나만 너의 사랑하나만 보잘 것 없고 용기만 가진 사람 사랑해준 너를 위해서 내 전불 걸고 사랑할게 모든 걸 잃어도 내 전불 뺏겨도 난 할 거야 사랑  사랑
  Hazel English  ,Fix,Fill your body Just to get outside of it You’d give up yourself Just to get another fix  Pre-Chorus Tell me you want Me to stay the night I’ll wait for hours Fuelled by my desire I wanna feel alive I wanna feel alive  Chorus Darling just give in Get out of your head again Craving that feeling Take me away again Take me away again I wanna feel alive I wanna feel alive  Verse 2 Build your boundaries Just to watch it all caving in You’d give up control Just to let another in  Pre-Chorus Tell me you want Me to stay the night I’ll wait for hours Fuelled by my desire I wanna feel alive I wanna feel alive  Chorus Darling just give in Get out of your head again Craving that feeling Take me away again Take me away again I wanna feel alive I wanna feel alive  Bridge I wanna feel alive I wanna feel alive  Outro Darling just give in Get out of your head again
  Meg Myers  ,Curbstomp,I'm a sinner I'm a liar Want forgiveness But I'm tired I'm addicted to the fire Let go I'm ready for it Let go I'm ready I'm a victim I'm a coward Try to wake up Don't have the power I'm a daughter in the choir Let go I'm ready for it Let go I'm ready Oh Oh Oh Oh Oh Oh Oh Oh I'm a shadow I'm a creeper Want forgiveness Getting weaker I'm addicted to the fever Let go I'm ready for it Let go I'm ready I'm a danger I'm a cipher Try to wake up No desire I'm a daughter in the choir Let go I'm ready for it Let go I'm ready Oh Oh Oh Oh Oh Oh Oh Oh No no no eyes baby No no no mind baby No no no smile baby No no no lies Lay me down tonight No lies Lay me down tonight Lay me down tonight Lay me lay me lay me lay me down tonight Blood I want it Giving up the fight Blood I want it Lay me down tonight Blood i want it Take me to the sky Blood I want it Everything's alright now
