artist,title,lyric
  로코베리  ,그깟 자존심,나의 곁에 있겠다고 고백했던 내가 없인 안된다고 붙잡았던 그런 네가 이젠 모른척해 이런일이 있을거라 생각못해 아무말도 하지 못했었던 그때의 내가 너무나도 후회가되죠 사랑하는데 왜 난 그깟 자존심으로 널 잃었는지 비가 내려오는 날 그 거리에 서서 우산도 없이 그저 널 기다렸지 네가 나타나 주길 바라면서 말야 신호등에 빨간불빛이 우리사일 얘기해 흔들리는 익숙한 버스안 창문에 비치는 내모습이 슬픈 나를 설명해 그래도 돌아가고 싶지 않아 미안해 치열한 사랑앞에 지치는게당연해 이런게 이별이라 말한다면 인정해 나는 널 사랑해 그런데 널 보내 아무말도 하지 못했었던 그때의 내가 너무나도 후회가되죠 사랑하는데 왜 난 그깟 자존심으로 널 잃었는지 비가 내려오는 날 그 거리에 서서 우산도 없이 그저 널 기다렸지 네가 나타나 주길 바라면서 말야 be without you i miss u i need u forever 음
  Sev  ,Stand Straight,"Stand on the head, an illusion passing by You're better off dead, when justice starts to fly Cuz it knocks you down, and when you're trying to get up The mad boy surrounds you, so come on what's up  We are the children of the earth they say And our implausible motive is to seize the day An eternity, it would take us to regain our strength As the stereotypical push it  What does it all mean, this path tone deaf scream Don't stereotype me, cuz you're walking on a tight beam But talk all the talk in your dreams unseen Be all you can be in the Army, well that's not me Where did it all go, who will ever know That these times in my mind forever moving so slow So don't be so fake, your voice has to break Through the barrier unseen with no mistakes  Just jump in the air Everybody over there To the people over there And everybody everywhere  I find in my mind this stations overdrive That these voices I hear, never have to hide From these crippled ass punks trying to be like solo So why even try when you know that you can't go There, when your bitch ass looks turn to stare Glare, I turn it back boom in the air 150 miles an hour, speed up and crash You gotta fucking bullet for your ass  We are the children of the earth they say And our implausible motive is to seize the day An eternity, it would take us to regain our strength As the stereotypical push it  Just jump in the air Everybody over there To the people over there And everybody everywhere  Stand straight, head strong It takes, not long Stand straight, head strong It takes, not long  Sev, Sev now stand to attention Like Mr. John Holmes, I've got the erection For you, score you, didn't mean to ignore you But waiting, contemplating, gets you in a 5.0 folder Depending on the ending, I can turn the situation around Change up location, take it underground With a big ass house, fine ass girl Plenty of dough, and by the way, look who's going pro"
  플라워  ,Stay,Remember Me 니가 외로워질때 가끔 날 생각하겠지 아마도 후회를 할지도 몰라 지나간 일들을 기억하며 Remember Me 너를 잃은 슬픔에 조금씩 야위어가는데 이제야 난 내 맘을 알게 됐어 너에게 돌아가야해 Oh Stay 힘들겠지 나에게 다시 돌아와줘 언제라도 이젠 날 용서해줘 내곁을 떠난 너의 맘을 되돌려줘 너의 모습 난 잊지못해 이제 하늘에 기도해 For You  Remember Me 아무일도 없듯이 우리 살아가겠지 이제야 난 내 맘을 알게됐어 너에게 돌아가야해 Oh Stay 힘들겠지 나에게 다시 돌아와줘 언제라도 이젠 날 용서해줘 내곁을 떠난 너의 맘을 되돌려줘 Oh Stay 힘들겠지 나에게 다시 돌아와줘 기다릴게 나에게 대답해 줘 내 곁을 떠난 너의 맘을 되돌려줘 너의 모습 난 잊지 못해 이제 하늘에 기도해 For You
  Queen  ,Flick Of The Wrist (2011 Remaster),"""Dislocate your spine if you don't sign he says I'll have you seeing double (double) Mesmerize you when he's tongue-tied Simply with those eyes, ooh ooh ooh Synchronize your minds and see The beast within him rise  Don't look back Don't look back It's a rip-off Flick of the wrist and you're dead baby Blow him a kiss and you're mad, ooh ooh ooh ooh Flick of the wrist - he'll eat your heart out A dig in the ribs and then a kick in the head He's taken an arm and taken a leg All this time honey Baby you've been had  Intoxicate your brain with what I'm saying If not you'll lie in knee-deep trouble Prostitute yourself he says Castrate your human pride, ooh ooh ooh Sacrifice your leisure days Let me squeeze you till you've dried  Don't look back Don't look back It's a rip-off, aah, aah, aah  Work my fingers to my bones I scream with pain I still make no impression Seduce you with his money-make machine Cross-collateralize, (big-time money money) Reduce you to a muzak-fake machine Then the last goodbye It's a rip-off  Flick of the wrist and you're dead baby Blow him a kiss and you're mad, ooh ooh ooh ooh Flick of the wrist - he'll eat your heart out A dig in the ribs and then a kick in the head He's taken an arm, and taken a leg All this time honey Baby you've been had  """
  Train  ,Drink Up,"It was just an ordinary Wednesday night 1147, when the stars aligned Saw your face, and then I felt the butterflies Someone's gonna fall in love tonight  If you let me take you to my special place I can make sure everybody knows your name Don't regret the things you do, or things you say Even if you did it for the fame  Can't let this moment This moment slip away 'Cause things like this don't happen to us everyday So take this moment And put it in a glass If you want a sip, I got memories on tap Drink up, drink up Write your name on a cup Drink up, drink up Write your name on a cup  Sitting on the roof of someone else's car Wrapped up in a blanket of the brightest stars Hoping either one of us will go too far Feeling for each other in the dark  Can't let this moment This moment slip away 'Cause things like this don't happen to us everyday So take this moment And put it in a glass If you want a sip, I got memories on tap Drink up, drink up Write your name on a cup Drink up, drink up Write your name on a cup  This is the night when everything is right Yeah, when the stars align This is the night, been waiting all my life To put your name right next to mine  Can't let this moment This moment slip away 'Cause things like this don't happen to us everyday So take this moment And put it in a glass If you want a sip, I got memories on tap Drink up, drink up Write your name on a cup Drink up, drink up Write your name on a cup"
  L.A. Guns  ,Beautiful,"Look around me, you astound me You are oh so beautiful, oh yeah I am home Every song I sang I sang for you. Been away far to long, thought of you with every song  It's gonna take a little time Gonna take a little concentration I think that time has come to state When I said I couldn't get enough of that situation Well I recognize, I don't want to stay away Oh so beautiful, oh so beautiful  Oh so beautiful, oh so beautiful  And through this crazy ride You've been there deep inside Deep inside I know I'm not alone When I'm with you I call it home And now it's all so clear,    my doubts just disappear  All my life (chorus) I've been waiting  And I think its right Don't go away. Oh so beautiful, oh so beautiful Oh so beautiful, oh so beautiful I've been around this great big world  Must have loved a million girls When I'm with you, I call it home"
  Dire Straits  ,So Far Away,"Here I am again in this mean old town And you're so far away from me And where are you when the sun go down? You're so far away from me  You're so far away from me So far I just can't see You're so far away from me You're so far away from me, alright  I'm tired of bein' in love and bein' all alone When you're so far away from me I'm tired of makin' out on the telephone 'Cause you're so far away from me  You're so far away from me You're so far I just can't see You're so far away from me You're so far away from me, alright  And I get so tired when I have to explain When you're so far away from me See you've been in the sun and I've been in the rain And you're so far away from me  You're so far away from me You're so far I just can't see You're so far away from me You're so far away from me, take it down  So far away from me Oh, you're so far away from me Yeah, you're so far away from me So far away from me  And you're so far away from me So far away from me So far away from me You're so far away from me You're so far away from me So far away from me  So far away from me You're so far away from me  Alright  You're just so far away from me"
  후아유  ,Be alright,everyday alright 맘이 가는 대로 따라가 everyday alright 당당하게 너를 보여줘 세상이 원하는 방식대로 그렇게 살아갈 필요는 없어 그래 꿈을 꾸는 거야 alright 하고 싶은 게 너무 많아 매일 매일 멋진 사랑도 하고 싶어 다시 다시 내 맘이 가는 대로 내 느낌이 가는 대로 행복할 수 있다면 그래 괜찮아 everyday alright 맘이 가는 대로 따라가 everyday alright 당당하게 너를 보여줘 세상이 원하는 방식대로 그렇게 살아갈 필요는 없어 그래 꿈을 꾸는 거야 alright 헛된 후회는 하지 않아 두번 다신 원하는 대로 사는 거야 그래 그래 내 맘이 가는 대로 내 느낌이 가는 대로 행복할 수 있다면 그래 괜찮아 everyday alright 맘이 가는 대로 따라가 everyday alright 당당하게 너를 보여줘 세상이 원하는 방식대로 그렇게 살아갈 필요는 없어 그래 꿈을 꾸는 거야 everyday alright 맘이 가는 대로 따라가 everyday alright 당당하게 너를 보여줘 세상이 원하는 방식대로 그렇게 살아갈 필요는 없어 그래 꿈을 꾸는 거야 alright
  Ryan Adams  ,My Wrecking Ball,"Driving through the streets tonight It's hot, I've got the windows down I wish I could call you, I wish you were still around Nothing much left in the tank Somehow this thing still drives Think I forgot what it needed but somehow still survive And all the walls we built they must come down But hey, you're my wrecking ball won't you come and maybe knock me down Hey, you're my wrecking ball won't you come and maybe knock me down Hey, you're my wrecking ball won't you come and knock me down, come and knock me down Come and knock me down tonight Lying in the bed at night Feeling like I'm somebody else My thoughts inside my head get lost inside the haunted house Everyone I used to know left their dreams by the door I accidentally kick ‘em and talk until you're still not sure If you want to sell them out at all Well hey, you're my wrecking ball won't you come and maybe knock me down Hey, you're my wrecking ball won't you come and maybe knock me down Hey, you're my wrecking ball won't you come and maybe knock me down Hey, you're my wrecking ball won't you come and knock me down, come and knock me down Come and knock me down tonight Come and knock me down, come and knock me down, come and knock me down tonight Come and knock me down, come and knock me down, come and knock me down tonight Come and knock me down, come and knock me down, come and knock me down tonight Driving through the streets tonight It's hot, I've got the windows down I wish I could call you, I wish you were still around"
  Oasis  ,Cigarettes & Alcohol,Is it my imagination Or have I finally found something worth living for  I was looking for some action But all I found was cigarettes and alcohol  You could wait for a lifetime To spend your days in the sunshine You might as well do the white line Cos when it comes on top You gotta make it happen You gotta make it happen You gotta make it happen You gotta make it happen  Is it worth the aggravation To find yourself a job when there's nothing worth working for  It's a crazy situation But all I need are cigarettes and alcohol  You could wait for a lifetime To spend your days in the sunshine You might as well do the white line Cos when it comes on top You gotta make it happen You gotta make it happen You gotta make it happen You gotta make it happen  You gotta You gotta You gotta make it You gotta You gotta You gotta make it You gotta You gotta You gotta make it You gotta You gotta You gotta make it
  캔  ,답 (Answer),세상을 사는게 같다 하지만 그래도 누군가를 원한다 채워줄 수 있는데 난 힘들어 채운만큼 내 마음은 텅 비어가   조금만 사랑해 조금만 그리워 그런거 존재하지는 않나봐 함께 맺던 인연들을 끊을수 없겠지 지나간 바람과 같을수 없겠지   내게서 저 멀리 떠나가 이젠 지쳐버린 내 마음인걸 엇갈린 시간에서 벗어나줘 너와 나 좋은 추억만을 기억할 수 있게  모질다고 생각하지 마라 앞으로도 나를 미워해라 이순간 날 버려 그것이 너에게는 답이야 나를 떠나 이제 행복할꺼야 그만 널 놓아주겠어 널 버리는게 내 답이야  애원해도 울어도 내맘은 변하지 않아 이제는 어긋난 사랑이야 이게 진정 사랑인줄 착각한 내가 사과할께 이걸로 이 사랑은 끝이 난거야  내게서 저 멀리 떠나가 이젠 지쳐버린 내 마음인걸 엇갈린 시간에서 벗어나줘 너와 나 좋은 추억만을 기억할수 있게  모질다고 생각하지 마라 앞으로도 나를 미워해라 이순간 날 버려 그것이 너에게는 답이야 나를 떠나 이젠 행복할꺼야 그만 내가 널 놓아주겠어 널 버리는게-  넌 내가 정말 밉지가 않니 이렇게도 나를 사랑하니 왜그리 착해서 내맘을 더 아프게 하니 소리라도 질러 원망 해봐 울지만 말고 뭐라 말해봐 그렇게 해줘 맘 편하게 나 떠나갈수 있게  넌 정말 내 맘을 몰라 넌 내맘을 정말 몰라 워- 바보야 정말- 넌 정말 내맘을 몰라 넌 정말 내 맘을 몰라 워-   미안해 정말-  세상을 사는게 같다 하지만 그래도 아직 너를 원한다 채워 줄수 없는게 난 슬펐어  너를 지우는게 나의 답이야   
  Kent  ,Innan allting tar slut,Moderna tankar om varandra och Du liknar ingen annan Antika l？？쨋ften som Vi blandar tills Vi b？？짜da slutat andas luften omkring? Refr: ？？？？r Du lycklig nu? ？？？？r Du lycklig nu ? ？？？？r Du lycklig nu? Har Vi tid innan allting tar slut? ？？？？ntligen har Jag hittat orden & Jag hittar Dina h？？짚nder under bordet Vi hinner bli n？？짜got stort ？？짚n V？？짚xa n？？짜gra meter   innan sommaren blir oktober? Refr. Det ligger tomhylsor i parken V？？짜ra f？？쨋tter ？？짚r en meter ？？쨋ver marken Jag visste att Du skulle bli stark sen Min hand i Din hand n？？짚r kapporna v？？짚nder efter vinden? Refr. x 2
  Elton John  ,Candle In The Wind (Remastered 2014),"Goodbye, Norma Jeane Though I never knew you at all You had the grace to hold yourself While those around you crawled They crawled out of the woodwork And they whispered into your brain They set you on the treadmill And they made you change your name  Chorus And it seems to me you lived your life Like a candle in the wind Never knowing who to cling to When the rain set in And I would've liked to known you But I was just a kid Your candle burned out long before Your legend ever did  Verse 2 Loneliness was tough The toughest role you ever played Hollywood created a superstar And pain was the price you paid And even when you died Oh, the press still hounded you All the papers had to say Was that Marilyn was found in the nude  Chorus And it seems to me you lived your life Like a candle in the wind Never knowing who to cling to When the rain set in And I would've liked to known you But I was just a kid Your candle burned out long before Your legend ever did  Verse 3 Goodbye, Norma Jeane Though I never knew you at all You had the grace to hold yourself While those around you crawled Goodbye, Norma Jeane From the young man in the 22nd row Who sees you as something more than sexual More than just our Marilyn Monroe  Chorus And it seems to me you lived your life Like a candle in the wind Never knowing who to cling to When the rain set in And I would've liked to known you But I was just a kid Your candle burned out long before Your legend ever did  Outro Your candle burned out long before Your legend ever did"
  토일렛키  ,Fake (윤형재 X 정수아),나는 네게 난 해준 게 없어 해준 게 없어 나는 네게 난 해줄 게 없어 해줄 게 없어 우리 둘 만난 오랜 날들이 하나의 그림 안에 색칠되어 지울 수가 없어 되돌릴 수 없어 날 용서해 미안해 모든 게 잘못돼버렸어 늦은 약속들이 너에겐 큰 상처였나 널 사랑해 기도해 너만은 행복해지기를 우리가 약속했던 그 날처럼 나는 네게 난 할 말이 없어 할 말이 없어 나는 네게 난 거짓이었어 거짓이었어 너와 나 만나온 긴 시간이 깊숙이 박혀버린 가시 되어 빼낼 수가 없어 되돌릴 수 없어 날 용서해 미안해 모든 게 잘못돼버렸어 늦은 약속들이 너에겐 큰 상처였나 널 사랑해 기도해 너만은 행복해지기를 우리가 약속했던 그 날처럼 나는 네게 난 거짓이었어
  Bad Brains  ,Soul Craft,Life..life..life..Life And Creation!!!  Life and creation Some a dem a come Gonna have fe run No thrills dem gonna have to pay Peaceful direction in this unity Strap on survival kit no drugs inside of you  Fly the soul craft on your own Don't miss the soul craft  look..look..look..Look in the Action!!  Look in the action Jah Jah is the attraction Life is all or nothing Don't forget to seek and pray Peaceful direction in this unity Strap on survival kit no drugs inside of you  Fly the soul craft on your own Don't miss this soul craft  Fly the soul craft one instant time Don't miss the soul craft  Look...Look..Look..Look in the Action!!  Look in the action Jah Jah is the attraction Life is all or nothing Don't forget to seek and pray Peaceful direction in this unity Strap on survival kit no drugs inside of you Live in the soul craft Cause you got the soul craft Take heed to the soul craft Riddems in Zimbabwe Life and creation some of them a come Gonna have fe run No thrills dem gonna have fe pay Peaceful direction in this unity Strap on survival kit no drugs inside of you Live in the soul craft Cause you got the soul craft Take heed to the soul craft He is our salvation
  Imagine Dragons  ,Gold,First comes the blessing of all that you dreamed But then comes the curses of diamonds and rings Only at first did it have its appeal But now you can’t tell the false from the real Who can you trust Who can you trust When everything everything everything you touch turns to gold gold gold Everything everything everything you touch turns to gold gold Gold Gold Gold Gold Statues and empires are all at your hands Water to wine and the finest of sands When all that you have’s turnin’ stale and it’s cold Oh you no longer fear when your heart’s turned to gold Who can you trust Who can you trust When everything everything everything you touch turns to gold gold gold Everything everything everything you touch turns to gold gold Gold Gold Gold Gold I’m dying to feel again Oh anything at all But oh I feel nothing nothing nothing Nothing When everything everything Everything you touch turns to gold gold gold Everything everything Everything you touch turns to gold gold Gold Gold Gold Gold
  강산에  ,그날 아침,그날아침그날아침 그날아침그날아침 그날아침그날아침 그날아침그날아침 그날아침그날아침 그날아침그날아침 그날아침그날아침 그날아침그날아침 그날아침그날아침 그날아침그날아침 그날아침그날아침 그날아침그날아침 그날아침그날아침 그날아침그날아침 그날아침그날아침 그날아침그날아침 그날아침당신집앞
  Feist  ,Comfort Me,When you comfort meAnd doesn't bring me comfort actuallyWhen you comfort meTrue life in haikuAnd balances of phraseout of the blueAnd meaning shown to youWhere does sadness seeThe mirror has a mirror in his teethThat's what sadness seesBig sky tiny birdAnd when the paragraph betrays the wordBig sky tiny birdwho-who-who who-who-who-who-who-whowho-who-who who who who who who who whoWhile you held me upI held out my calendar like a cupWhile you held me upMake it about meI wanna to hold the blame to guillotineMake it all blame freeHee-hee-hee hee-hee-hee hee-hee-heehee-hee-hee hee-hee-hee hee-hee-hee-heeNa na na na-na na na na na-na na na na na na na na na nana na na na-na na na na na-na na na na na na na na na nana na na na-na na na na na-na na na na na na na na na na...
  우연주  ,청춘 유감,빛이 없는 동굴 속의 아인 미래의 독버섯을 키우지 작은 틈새로 들리는 소음과 비명 소릴 자장가 삼아 고통과 절망으로 신음 하는 곳까지 사랑의 힘으로 멀리 퍼지길 바래 왜 우리가 안을 수 없을까 더 많이 울게 어려워도 부딪혀도 일어나 밖은 전쟁 약자를 밟아야 배부른 강자가 되는 세상 말라버린 두 손 마주잡을 힘조차 남겨 두지를 않아 고통과 절망으로 신음 하는 곳까지 사랑의 힘으로 멀리 퍼지길 바래 왜 우리가 안을 수 없을까 더 많이 울게 어려워도 부딪혀도 일어나 왜 우리가 안을 수 없을까 더 많이 울게 어려워도 부딪혀도 일어나 빛이 없는 동굴 속의 아인 미래의 독버섯을 키우지 작은 틈새로 들리는 소음과 비명 소릴 자장가 삼아 밖은 전쟁 약자를 밟아야 배부른 강자가 되는 세상 말라버린 두 손 마주잡을 힘조차 남겨 두지를 않아
  오석준  ,꿈을 넘어서,한 번도 느껴보지 못한 너를 나는 그리워하지 언제나 포근하게 감싸주는 널 꿈속에서 나는 만나지 난 꿈속에서처럼 너의 눈빛이 투명한 걸 알아 너를 향한 사랑이 꿈을 넘어 너의 숨결로 이젠 느껴지길 바래 꿈을 넘어 꿈에서 깨어나도 난 눈을 감고 있었지 다시 혼자여야 하는게 싫어 언제나 너의 꿈속에서 살고 싶어 그 꿈 속에 너의 어린 품안에 사랑한다는 것이 그저 우연처럼 만난다지만 이제 너를 찾을께 내 꿈속에서 느꼈었던 너를 이젠 만날거야  난 꿈속에서처럼 너의 눈빛이 투명한 걸 알아 너를 향한 사랑이 꿈을 넘어 너의 숨결로 이젠 느껴지길 바래 꿈을 넘어 꿈에서 깨어나도 난 눈을 감고 있었지 다시 혼자여야 하는게 싫어 언제나 너의 꿈속에서 살고 싶어 그 꿈 속에 너의 어린 품안에 사랑한다는 것이 그저 우연처럼 만난다지만 이제 너를 찾을께 내 꿈속에서 느꼈었던 너를 이젠 만날거야
  Young The Giant  ,Anagram,People In the middle Lifes a riddle Not a game of dice Not for a man who rolls with us Days turn Faster than a minute How was I to know this Would you even notice me Cause theyre imposters We threw away the time Anagram Im just a messenger man Its the last time around One of these days I wish you were A hologram If were just passengeres then I wish it was the first time around One of these days I wish you were AH oooooh All the people in White stockings talk with pride Theyll be lifting up the flags high Which will I decide Cause theyre imposters Im making up Anagram Im just a messenger man Its the last time around One of these days I wish you were A hologram If were just passengeres then I wish it was the first time around One of these days I wish you were Ah oooooh Collide A stain in the light of your eyes Ill see you another time Come on baby roll the dice Im feeling like its gonna break This time will stars align Im thinking that its all the same Anagram Im just a messenger man Its the last time around One of these days I wish you were A hologram If were just passengeres then I wish it was the first time around One of these days I wish you were Ah oooooh Anagram Anagram
  봄여름가을겨울  ,아웃 사이더,더부룩한 머리에 낡은 청바지 며칠씩 굶기도 하고 검은색 가죽점버 입고 다녀도 손엔 하이데커의 책이 있지 다들 같은 모양의 헤어스타일 유행따라 옷을 입고 다른 이의 시선을 신경쓰는 것은 개성없어 보여 싫지 그것은 세상 어느 곳엘 가도 누구나 갖고 있는 것이잖아 누구의 이해도 바라지 않고 지난 일에 집착하지 않아 아무도 이해못할 말을 하고 돌아서서 웃는 나는 아웃사이더  명예도 없고 금전도 없어 자존심이 있을뿐야 쾡하니 검게 반짝이는 눈은 로트랙의 그림을 보네 그것은 세상 어느 곳엘 가도 누구나 갖고 있는 것이잖아 누구의 이해도 바라지 않고 지난 일에 집착하지 않아 아무도 이해못할 말을 하고 돌아서서 웃는 나는 아웃사이더  누구의 이해도 바라지 않고 지난 일에 집착하지 않아 아무도 이해못할 말을 하고 돌아서서 웃는 아웃사이더 누구의 이해도 바라지 않고 지난 일에 집착하지 않아 아무도 이해못할 말을 하고 돌아서서 웃는 나는 아웃사이더
