artist,title,lyric
  포지션  ,어색한 만남,누구나 말을 하지 인생은 묘한거라고 살면서 예상하지 못한 일도 많고 어릴때 널 좋아했던 순진한 내모습들도 이제는 다른 남자와 난 똑같은데 그 거리에서 다시 널 만날수 있을줄은 몰랐어 어색한 미소로 애써 날 외면하지 마 기억이 나질 않아 어릴적 너의 모습이 하지만 변해있는 네 모습이 좋아 지나간 시절들이 이제는 사진속에 있지만 너를 다시 볼 수 없겠지만 어색한 표정 짓지마 넌 이미 애기엄마 되었고 너 또한 나에겐 어린시절 친구일 뿐이라는 걸  행복한 니가 되어 있기를 혼자서 많이 생각했었지 워 그 거리에서 다시 널 만날수 있을줄은 몰랐어 어색한 미소로 애써 날 외면하지 말았으면 해
  Pixies  ,Something Against You (Remastered),"I've got something against you I've got something against you Here we go I've got something against you I've got something against you I've got something against you I've got something against you I've got something against you Oh yeah, I am one happy prick"
  Arcade Fire  ,Modern Man,"So I wait my turn, I'm a modern man And the people behind me, they can't understand Makes me feel like Makes me feel like  So I wait in line, I'm a modern man And the people behind me, they can't understand Makes me feel like Something don't feel right  Like a record that's skipping I'm a modern man And the clock keeps ticking I'm a modern man Makes me feel like Makes me feel like  In my dream I was almost there And you pulled me aside and said you're going nowhere They say we are the chosen few But we're wasted And that's why we're still waiting On a number from the modern man Maybe when you're older you will understand Why you don't feel right Why you can't sleep at night now  In line for a number but you don't understand Like a modern man In line for a number but you don't understand Like a modern man  Oh I had a dream I was dreaming And I feel I'm losing the feeling Makes me feel like Like something don't feel right I erase the number of the modern man Want to break the mirror of the modern man Makes me feel like Makes me feel like  In my dream I was almost there But you pulled me aside and said you're going nowhere I know we are the chosen few But we're wasted And that's why we're still waiting In line for a number but you don't understand Like a modern man In line for a number but you don't understand Like a modern man  And you feel so right But how come you can't sleep at night? In line for a number but you don't understand Like a modern man  I'm a modern man I'm a modern man I'm a modern man I'm a modern man"
  Chuck Berry  ,Maybellene,"Chorus Maybellene, why can't you be true Oh Maybellene, why can't you be true You done started doing the things you used to do  Verse 1 As I was motorvatin' over the hill I saw Maybellene in a Coupe DeVille A Cadillac a-rollin' on the open road Nothin' will outrun my V8 Ford The Cadillac doin' 'bout ninety-five She's bumper to bumper rollin' side by side  Chorus Maybellene, why can't you be true Oh Maybellene, why can't you be true You've started back doing the things you used to do  Chorus Maybellene, why can't you be true Oh Maybellene, why can't you be true You done started back doing the things you used to do  Verse 2 A Cadillac pulled up to one hundred and four The Ford got hot and wouldn't do no more It done got a cloud and started to rain I tooted my horn for the passin' lane The rain water blowin' all under my hood I knew that was doin' my motor good  Chorus Maybellene, why can't you be true Oh Maybellene, why can't you be true You done started back doing the things you used to do  Chorus Oh Maybellene, why can't you be true Oh Maybellene, why can't you be true You done started back doing the things you used to do  Verse 3 The motor cooled down, the heat went down And that's when I heard that highway sound The Cadillac a-sittin' like a ton of lead A hundred and ten a half a mile ahead The Cadillac lookin' like it's sittin' still And I caught Maybellene at the top of the hill  Chorus Maybellene, why can't you be true Oh Maybellene, why can't you be true You done started back doing the things you used to do"
  Roger Waters  ,5:01 AM (The Pros And Cons Of Hitch Hiking Part 10),"An angel on a Harley Pulls across to greet a fellow rolling stone Puts his bike up on it's stand Leans back and then extends A scarred and greasy hand...he said He said, how ya doin bro? Where ya been? Where ya goin'? Then he takes your hand In some strange Californian handshake And breaks the bone [Whiny person:]"
  Sheppard  ,Touch,"You and I and nobody else Feeling feelings I've never felt The way you got me under your spell Don't you keep it all to yourself  [Pre-Chorus] So won't you take it? I feel like for the first time I am not faking Fingers on my buttons and now you're playing Master of anticipation, don't you keep it all to yourself  [Chorus] Just a touch of your love is enough To knock me off of my feet all week Just a touch of your love, oh Just a touch of your love, oh Just a touch of your love is enough To take control of my whole body Just a touch of your love, oh Just a touch of your love, oh  [Verse 2] Photograph with no T-shirt on Why you making me wait so long? I promise to keep this a secret, I'll never tell But don't you keep it all to yourself  [Pre-Chorus] So won't you take it? I feel like for the first time I am not faking Fingers on my buttons and now you're playing Master of anticipation, don't you keep it all to yourself  [Chorus] Just a touch of your love is enough To knock me off of my feet all week Just a touch of your love, oh Just a touch of your love, oh Just a touch of your love is enough To take control of my whole body Just a touch of your love, oh Just a touch of your love, oh  [Bridge] And now my whole week, my whole week is golden Can you see me glowing? That's how I feel And I'm not afraid to fade into emotions 'Cause I know that this could be something real  [Chorus] Just a touch of your love is enough To knock me off of my feet all week Just a touch of your love, oh Just a touch of your love, oh Just a touch of your love is enough To take control of my whole body Just a touch of your love, oh Just a touch of your love, oh Just a touch of your love, oh! Just a touch of your love"
  Maroon 5  ,Coming Back For You,Looking at the same sky that we used to lay under Are you thinking about the love that I took from us When you close your eyes do you see me love Am I keeping you awake What you scared about are you giving up When you know you know you know You know that I'm coming back for you Don't you worry girl Don't you worry girl You know that I'm coming back for you Don't you worry girl I'll be back for you So you better wait up keeping the bed warm for me All night putting your whisper on me Givin' that love and emotion that I know Doesn't really matter what you do I'll be back for you I'm coming back for you yeah I know there are million of miles in between our hearts But I will come running for you I don't care how far When you close your eyes do you see me love Am I keeping you awake What you scared about are you giving up When you know you know you know You know that I'm coming back for you Don't you worry girl Don't you worry girl You know that I'm coming back for you Don't you worry girl I'll be back for you So you better wait up keeping the bed warm for me All night putting your whisper on me Givin' that love and emotion that I know Doesn't really matter what you do I'll be back for you I'm coming back for you yeah Yeah yeah yeah Yeah yeah yeah Yeah yeah yeah Yeah yeah yeah You know that I'm coming back for you Don't you worry girl Don't you worry girl I'm coming back for you Don't you worry now now Don't you worry now You know that I'm coming back for you Don't you worry girl Don't you worry girl You know that I'm coming back for you Don't you worry girl I'll be back for you So you better wait up keep the bed warm for me All night putting your whisper on me Giving that love and emotion that I know Doesn't really matter what you do I'll be back for you I'm coming back for you yeah
  Green Day  ,Hitchin` A Ride,"Hey mister, where you headed? Are you in a hurry? I need a lift to happy hour. Say oh no. Do you brake for distilled spirits? I need a break as well. The well that inebriates the guilt. 1, 2. 1, 2, 3, 4.  Cold turkey's getting stale, tonight I'm eating crow. Fermented salmonella poison oak no  There's a drought at the fountain of youth, and now I'm dehydrating. My tongue is swelling up, as say 1, 2. 1, 2, 3, 4. Troubled times, you know i can not lie. I'm off the wagon and I'm hitchin' a ride.  There's a drought at the fountain of youth, and now I'm dehydrating. My tongue is swelling up, I say Shit!"
  The Verve  ,Valium Skies,"I see houses, rows and rows of red bricks I see black cars, some blood stained ex's  I get this feeling that I, Ive been here before How many lifes will I waste, how many tears must I taste Before my freedom, ahh (repeat)  I see mountains, blood red sunsets I see a billion stars, (...dunno)  I get this feeling that I, Ive been here before How many lifes will I waste, how many tears must I taste Before my freedom, ahh (repeat)  I wont be late wont be late (repeat)  I get this feeling that I, Ive been here before How many lifes will I waste, how many tears must I taste Before my freedom, ahh (repeat) I get this feeling that I, Ive been here before How many lifes will I waste, how many tears must I taste Before my freedom, ahh (repeat)"
  한희정  ,내일,모두가 돌아간 자리 행복한 걸음으로 갈까 정말 바라던 꿈들을 이룬 걸까 밀렸던 숙제를 하듯 빼곡히 적힌 많은 다짐들 벌써 일어난 눈부신 해가 보여 또 하루가 가고 내일은 또 오고 이 세상은 바삐 움직이고 그렇게 앞만 보며 걸어가란 아버지 말에 울고 셀수록 가슴이 아픈 엄마의 늘어만 가는 주름 조금 늦어도 괜찮단 입맞춤에 또 하루가 가고 내일은 또 오고 이 세상은 바삐 움직이고 그렇게 앞만 보며 걸어가란 아버지 말에 또 한참을 울고 다짐을 해보고 어제 걷던 나의 흔적들은 푸르른 하늘 위로 나의 꿈을 찾아 떠나고 난 고집스런 내일 앞에 약속을 하고 매일
  Rialto  ,Summer`s Over,Kamikaze seagull planes Fighting over chip shop take away remains When you're walking on the cliffs You can't help thinking of How far down the sea is And what if it should give I didn't mean to bring you down Summer's over seaside town She says we shouldn't have come so far This seaside town summer's over Empty pubs echo with sounds Juke box selections that keep going Round and round Maybe rain is all we need To come and wash The summer rubbish off the beach Oh let just go to sleep I didn't mean to bring you down Summer's over seaside town She says we shouldn't have come so far This seaside town  I didn't mean to bring you down Summer's over seaside town She says we shouldn't have come so far This seaside town summer's over In the back of the arcades Kids borrow money to play One more final game While mothers wait in family cars I wonder why we ever chose To come so far But I wish you wouldn't ask I didn't mean to bring you down Summer's over seaside town She says we shouldn't have come so far This seaside town I didn't mean to bring you down Summer's over seaside town She says we shouldn't have come so far This seaside town summer's over This summer's over seaside town This seaside town  summer's over  summer's over summer's over summer's over summer's over
  The Ataris  ,Summer `79,"gotta live it up one time before its over we will make history tonite  out at the drive in all of our closest friends, they will be sneaking in youll be spending your whole nite trying everything you can to get that girl to notice you  we are the champions playing loud on the radio station everyone sing along with these anthems of our generation cruisin down pacific coast highway with the top down, crawl into the backseat lets create anthems of our own tonite  down at the roller rink all the cool kids crowd around the air hockey table ""hey my best friend likes you!"" i hear you shout at me as you go skating by  we are the champions playing loud on the radio station everyone sing along with these anthems of our generation cruisin down pacific coast higway with the top down crawl into the backseat lets create anthems of our own tonite  sneak out of your window, darlin lets live at (?), honey well never look back  climb out on this rooftop and stare at the city lites below us this world belongs to us tonite the kids will keep raging on and they are never gonna stop"
  호피폴라  ,One more light,Should've stayed were there signs I ignored Can I help you not to hurt anymore We saw brilliance when the world was asleep There are things that we can have but can't keep If they say Who cares if one more light goes out In a sky of a million stars It flickers flickers Who cares when someone's time runs out If a moment is all we are We’re quicker quicker Who cares if one more light goes out Well I do The reminders pull the floor from your feet In the kitchen one more chair than you need And you're angry And you're angry And you should be And you should be it's not fair Just 'cause you can't see it Just 'cause you can't see it doesn't mean it doesn't mean it isn't there Who cares if one more light goes out In a sky of a million star It flickers flickers Who cares when someone's time runs out If a moment is all we are We’re quicker quicker Who cares if one more light goes out Well I do Who cares if one more light goes out In a sky of a million stars Who cares if one more light goes out In a sky of a million stars It flickers flickers Who cares when someone's time runs out If a moment is all we are We’re quicker quicker Oh Oh Oh Oh Who cares if one more light goes out In a sky of a million stars It flickers flickers Who cares when someone's time runs out If a moment is all we are We’re quicker quicker Should've stayed were there signs I ignored Can I help you not to hurt anymore Oh We do
  Sundara Karma  ,Olympia,Oh no Olympia said she loves me Olympia said she needs me But what about all the marquis No not them Because they're all so autocratic  There's something pale underneath the beat A white innocence marked by lecherous men I thought I'd suffer in the city heat I thought I'd suffer now let's hope to begin again  If they could see Modern Venus Tender and frail Hell she's nervous But she's the best in all of Paris At aching and breaking hearts  And oh lord Is heaven such a fine thing We're floating in a dead town Hoping to find someone to be near And we'll fly away Holding onto something We're drifting in a dull sound Hoping to find someone who will hear  Oh no Olympia said she loves me Olympia said she needs me But what about all the marquis No not them Because they're all so autocratic  I can't invest with this currency A blind diligence wrapped and bowed with a lie But still we stay for the company But still we stay cause we don't wanna ever die  If they could see Modern Venus Tender and frail Hell she's nervous But she's the best in all of Paris At aching and breaking hearts  And oh lord Is heaven such a fine thing We're floating in a dead town Hoping to find someone near And we'll fly away Holding onto something We're drifting in a dull sound Hoping to find someone who will hear
  Wolf Parade  ,I`ll Believe In Anything,Give me your eyes I need sunshine Give me your eyes I need sunshine Your blood Your bones Your voice And your ghost  We've both been very brave Walk around with both legs Fight the scary day We both pull the tricks out of our sleeves  But I'll believe in anything And you'll believe in anything Said I'll believe in anything And you'll believe in anything  If I could take the fire out from the water I'd share a life and you'd share a life If I could take the fire out from the water I'd share a life and you'd share a life If I could take the fire out from the water I'd take you where nobody knows you And nobody gives a damn Said nobody knows you And nobody gives a damn  And I could take another hit for you And I could take away your trips from you And I could take away the salt from your eyes And take away the spitting salt in you And I could give you my apologies By handing over my neologies And I could take away the shaking knees And I could give you all the olive trees Oh look at the trees and look at my face and look at a place far away from here  Give me your eyes I need sunshine Give me your eyes I need sunshine Your blood Your bones Your voice And your ghost  We've both been very brave Walk around with both legs Fight the scary day We both pull the tricks out of our sleeves  But I'll believe in anything And you'll believe in anything  If I could take the fire out from the water I'd share a life and you'd share a life If I could take the fire out from the water I'd share a life and you'd share a life If I could take the fire out from the water I'd take you where nobody knows you And nobody gives a damn I said nobody knows you And nobody gives a damn I said nobody knows you And nobody gives a damn either way About your blood Your bones Your voice And ghost Because nobody knows you And nobody gives a damn either way  And now I'll believe in anything
  Amber Run  ,Spark (Radio Edit),"First it's the spark and then it's the flame  Then it's swinging round round lamp posts in the rain  Well then it's that feeling that you you just can't shake  That your life's about to start and you just can't wait    First it's the spark and then it's the flame  Then it's getting blood drunk in the middle of the day  And though it's a comma in a full stops place  It's that wherever I go I see your face    And though I'll die busking  I'm gonna love you, I'm gonna love you now    Let the light in, let the light in  Let the light in, let the light in  Let the light in, let the light in  Let the light in, let the light in    First it was fun now it's fireworks  Well so bright and so harsh that they'll make your eyes hurt  Oh it's the circles of smoke from your cigaret  Oh it's the beating of drums in the back of your chest    Ooohhh yeeaaahhhh.....    Though I'll die busking  I'm gonna love you, I'm going to love you now    Let the light in, let the light in  Let the light in, let the light in  Let the light in, let the light in  Let the light in, let the light in  Let the light in, let the light in  Let the light in, let the light in  Let the light in, let the light in  Let the light in, let the light in"
  Matt Maltese  ,Studio 6,"I see two lovers kiss on the street by studio 6 And I remember the petrol thick mist we settled our lips And I remember hearing your father laugh  While we made love in the next room, we made love in the next room And I remember one of those mornings I reached out to wake you but I learned that he'd taken you back  I look through the glass to housing blocks and and energy fans I see slow familiar lovers, I see them pull their curtains back And I remember pulling your curtains back Then we made love to the old moon, we made love to the old moon And I remember one of those mornings I reached out to wake you but I learned that he'd taken you back  And I remember you wearing that pink august coat that my grandmother wore with my grandfather's love And you're a little more clear with this wine in my hand And it colours my tongue as if your lipstick has run  And I remember hearing your father laugh While we made love in the next room, we made love in the next room"
  더더 (THETHE)  ,여자이니까,가슴 깊이 담아두려했던 그 이름을 불러봅니다 먼지 쌓인 추억들 위를 다시 걸어보지만 그 숨결 이제 어디있나요 수 없이 많은 시간에 셀 수 없는 밤들에 이젠 날 잊었나요 그 그리움이 어느새 흐려지고 무뎌져 이젠 날 보냈나요 다신 우린 만나지 말아요 지는 황혼 속에 맡겨둬요 흘러 흘러 먼 훗날 운명처럼 마주해줘요  가슴 깊이 담아두려했던 그 이름을 불러봅니다 먼지 쌓인 추억들 위를 다시 걸어보지만 그 숨결 이제 어디있나요  다신 우린 만나지 말아요 지는 황혼 속에 맡겨둬요 흘러 흘러 먼 훗날 운명처럼 마주해줘요 다신 우린 만나지 말아요 지는 황혼 속에 맡겨둬요 흘러 흘러 먼 훗날 운명처럼 마주해줘요
  Bring Me The Horizon  ,Happy Song,"S.P.I.R.I.T. Spirit, let's hear it S.P.I.R.I.T. Spirit, let's hear it Let's go!  I've had enough There's a voice in my head Says I'm better off dead  But if I sing along A little fucking louder to a happy song I'll be alright  You want to give up Gave it all that you've got and it still doesn't cut  But if you sing along A little fucking louder to a happy song You'll be just fine 'cause  Every now and again we get that feeling And the great big void inside us opens up And I really wish that you could help But my head is like a carousel And I'm going round in circles I'm going round in circles  S.P.I.R.I.T. Spirit, let's hear it S.P.I.R.I.T. Spirit, let's hear it  We are possessed We're all fucked in the head Alone and depressed  But if we sing along A little fucking louder to a happy song Maybe we'll forget 'cause  Every now and again we get that feeling And the great big void inside us opens up And I really wish that you could help But my head is like a carousel And I'm going round in circles I'm going round in circles  Don't wake us up, we'd rather just keep dreaming 'Cause the nightmares in our heads are bad enough And I really wish that you could help But my head is like a carousel And I'm going round in circles I'm going round in circles  The world has coalesced Into one giant mess Of hate and unrest So let's all sing along A little goddamn louder to a happy song And pretend it's all ok  Let's go!  So sing along Let's sing along A little fucking louder A little fucking louder Well, don't you feel so much better?  S.P.I.R.I.T. Spirit, let's hear it (well, that's the spirit)  S.P.I.R.I.T. Spirit, let's hear it (yeah, that's the spirit)"
"  Bastille ,  Grades ,  Lizzo  ","Torn Apart, Pt II (Bastille Vs. GRADES Vs. Lizzo)","We were born to be together Torn apart, torn apart We were born to be together Torn apart, torn apart My yin and yang is killin' me Gotta get back, back to the synergy Don't forget where I been but you're gonna remember When I shake a shake my ass like a leaf of September Buddy I, I don't mean to kill your vibe But if you got it, you get it And I've been getting this shit for a long time Happiness only brings heartache I'm so beyond naughty And if you don't like it, then why do you want me I see ya, don't front if I tickle the strings on your heart You play second fiddle to my instrumental Your critical nature departs in the middle of all of my riddles You've given up trying and now you just tear me apart, ah"
  Nickelback  ,Good Times Gone,Lost it on the chesterfield Or maybe on a gamblin' wheel Lost it in a diamond mine It's dark as hell And hard to find You can climb to the Top of the highest tree You can look around But you still won't see What I'm lookin' for  Where the good times gone Where the good times gone All the stupid fun And all that sht we've done Where the good times gone Well I still don't know  Out in the back In the old corn field Underneath the tractor wheel Thought I'd dig till i'd find it first Broke my back And died of thirst You can bribe the devil You can pray to God You can sell off Everything you got And you still won't know  Where the good times gone Where the good times gone All the stupid fun And all that sht we've done Where the good times gone And you still don't know  Saw it on the silver screen Preacher says Don't know what it means Last page ad In a comic book Bought me a map Showed me where to look It ain't carved of stone Or made of wood And if you paid for it Then it's still no good And you still won't know What I'm looking for  Where the good times gone Where the good times gone All the stupid fun And all that sht we've done Where the good times gone
  David Bowie  ,Moonage Daydream (2012 Remastered Ver.),I'm an alligator I'm a mama-papa coming for you I'm the space invader I'll be a rock 'n' rollin' bitch for you Keep your mouth shut you're squawking like a pink monkey bird And I'm busting up my brains for the words Keep your 'lectric eye on me babe Put your ray gun to my head Press your space face close to mine love Freak out in a moonage daydream oh yeah Don't fake it baby lay the real thing on me The church of man love is such a holy place to be Make me baby make me know you really care Make me jump into the air Keep your 'lectric eye on me babe Put your ray gun to my head Press your space face close to mine love Freak out in a moonage daydream oh yeah Keep your 'lectric eye on me babe Put your ray gun to my head Press your space face close to mine love Freak out in a moonage daydream oh yeah Keep your 'lectric eye on me babe Put your ray gun to my head Press your space face close to mine love Freak out in a moonage daydream oh yeah Freak out far out in out
