artist,title,lyric
  Flor  ,unsaid,"Are you near me I can feel you near me I can feel you close Are you with me Please say you're with me I can't be alone Can't be my selfish nature Can't be my sin Are these feelings I long for best left unsaid You can read me Oh, I know you read me You get in my hand I won't keep it I won't keep it to myself You've won again Can't be my selfish nature Can't be my sin Are this feelings I long for best left unsaid Nothink hurts when you hide away Let'em in and they'll bring the pain But something about you feels okay Comfort can't help me grow up anyways Can't be my selfish nature Can't be my sin Are these feelings I long for best left unsaid Left unsaid Best left unsaid"
  Kids In Glass Houses  ,Give Me What I Want (Album Ver.),We take three steps forward and three steps back She says I don't like the way you're dressed So then four words later she takes four back She says I don't like the way you're tryin' your best to impress You win Everything you do Makes me wanna run Home will you get me going Home will you get me going Home home Give me what I want Give me what I want Give me what I want Give me What I want Want Give me what I want Give me what I want Give me what I want Give me What I want Want Glass half empty glass half full I'd you've got some catching up to do Your glass half empty glass half full I'd say you've got some catching up to do Best to impress You win Everything you do Makes me wanna run Home will you get me going Home will you get me going Home home Give me what I want Give me what I want Give me what I want Give me What I want Want Give me what I want Give me what I want Give me what I want Give me What I want Want What is it you want me to know I give up on you What is it you want me to know Ooh ooh ooh ooh What is it you want me to know I give up on you What is it you want me to know Ooh ooh ooh ooh Give me what I want Give me what I want Give me what I Want want want
  뷰렛  ,No Pain No Gain,나를 봐 고통은 스쳐 지나갈 뿐 머물지 않아 그래 내일은 또 다시 길을 찾아낼 꺼야 두렵지 않아 나를 봐 이렇게 화려한 무엇도 가진 건 없어 새롭게 시작해 너를 봐 그렇게 무엇도 거칠 것 없이 세상에 맞서봐 우리가 걸어야 할 길은 거칠고 어둡다 해도 그래 오늘도 이렇게 한걸음 또 내디뎠어 내 꿈을 향해 나를 봐 이렇게 화려한 무엇도 가진 건 없어 새롭게 시작해 너를 봐 그렇게 무엇도 거칠 것 없이 세상에 맞서봐  바람결에 나를 맡겨 새로워진 나를 느껴 쓰라린 실패는 삼켜 매 순간 다시 태어나 나를 봐 이렇게 화려한 무엇도 가진 건 없어 새롭게 시작해 너를 봐 그렇게 무엇도 거칠 것 없이 세상에 맞서봐
  Oasis  ,Bag It Up,Gold and silver and sunshine is rising up Pour yourself another cup of Lady Grey Take my hand in the meantime when you've had enough You'll find me on the end of a runway babe Tell the world that you love them in a melody Send my old piano and a telegram Gotta get me a doctor with a remedy I'm gonna talk a walk with the Monkey Man  Someone tell me I'm dreaming The freaks are rising up through the floor Everything I believe in Is telling me that I want more more more Lay your love on the fire when you come on in I got my hee bee jee bees in a hidden bag Tell me what you desire and we'll bag it up high  Someone tell me I'm dreaming The freaks are rising up through the floor Everything I believe in Is telling me that I want more more more Lay your love on the fire when you come on in I got my hee beem jee bees in a hidden bag Tell me what you desire and we'll bag it up high Shine a light on your fire when you come on in I got my hee bee jee bees in a hidden bag Tell me what you desire and we'll bag it up high
  Parachute  ,What Side Of Love,"What side of love are you on What side of love Is it giving you all that you want All that you want Is it taking you higher Are you walking the wire What side of love are you on  It will wake you up in the dead of night When you feel alone it can change your mind It can tell you every word to say, whispering to walk away  It can make you feel you're bulletproof Or can cut you down with the smallest truth Sometimes it can take control Sometimes it just lets you go Ooh, lets you go  What side of love are you on Is it giving you all that you want Is it taking you higher Are you walking the wire What side of love are you on  It can light you up It can leave you cold From the atmosphere To the ground below  If black and white turn into gray Maybe love is just the same Ooh, just the same So tell me  What side of love are you on What side of love Is it giving you all that you want All that you want Is it taking you higher Are you walking the wire Ooh What side of love are you on What side of love  Oh, oh, don't give up, don't give up on All, all what we've got, what we've got, no Oh, oh, don't give up, don't give up on Taking sides with me  Well you don't have a choice once it's gone So what side of love are you on  What side of love are you on What side of love Is it giving you all that you want All that you want Is it taking you higher Are you walking the wire Ooh What side of love are you on What side of love  Oh, oh, don't give up, don't give up All, all, what we've got, what we've got Oh, oh, don't give up, don't give up  What side of love are you on What side of love What side of love Don't give up, don't give up Don't give up What we've got, what we've got Oooh, what we've got"
  Rufus Wainwright  ,Agnus Dei,Agnus dei Agnus dei Qui tollis peccata mundi Agnus dei Agnus dei Qui tollis peccata mundi Dona nobis pacem Dona nobis pacem Pacem Dona nobis pacem  Translation: Lamb of God You who take away the sins of the world Lamb of God You who take away the sins of the world  Give us peace Give us peace Peace Give us peace.
  LINKIN PARK  ,Until It`s Gone,A fire needs a space to burn A breath to build a glow I've heard it said a thousand times But now I know That you don't know what you've got Oh you don't know what you've got No you don't know what you've got Until It's Gone Until It's Gone Until It's Gone I thought I kept you safe and sound I thought i made you strong But something made me realize That I was wrong 'Cause finding what you got sometimes Means finding it alone And I can finally see your light When I let go 'Cause you don't know whats you've got 'Til It's Gone Until It's Gone 'Til It's Gone Until It's Gone Until It's Gone Until It's Gone 'Til It's Gone 'Til It's Gone 'Cause you don't know what you've got Oh you don't know what you've got No you don't know what you've got It's your battle to be fought No you don't know what you've got 'Til It's Gone 'Til It's Gone 'Til It's Gone
  Godsmack  ,No Rest For The Wicked,"Walk to find line slip the edge, I'm not me Rise above a suicide, taking it out of me Got a feeling, it's going far away, yeah Looking at wounds from yesterday Gonna fly, taken my time, strip down to nothing Gonna try, but there's no rest for the wicked  Been through the skin of a dragon a thousand times In every day I live for you, still I'm not alive Got a feeling, I'm gonna fall away Gimme a sign what reason that I should stay Gonna fly, taken my time, strip down to nothing Gonna try, but there's no rest for the wicked Gonna fly, take my time, strip down to nothing Gonna try, but there's no rest for the wicked  Are you ready to go just to hide in? Do you think you can make me a better man? Crack me open, expose me to your ways Ignorance and arrogance on my way Oh yea No rest for the wicked baby!  Gonna fly, take my time, strip down to nothing Gonna try, but there's no rest for the wicked Gonna fly, take my time, strip down to nothing Gonna try, but there's no rest for the wicked"
  서태지  ,우리들만의 추억 Part 1 (`93 마지막 축제),소리쳐 주던 예쁘게 웃었던 아름다운 너희들의 모습이 좋았어 함께 기뻐하고 모두 다같이 웃고 서로를 걱정했던 우리들만의 옛 추억들 한결 같은 너희들의 정성이 우리에겐 너무 커다란 힘이 되었지 편지속에 수많았던 사연들 예쁜 마음 모두다 느낄수가 있었어 Devastating Taiji in the place to be with Ju no and Hyun suk right beside me Creating the sound to the fullist effect Pumping it hard to gain the respect Art to the Truth and Truth to the Art Coming to you straight from the heart We're rocking the mike as never before so to all the freaks in the house move to the dance floor 소리쳐 주던 예쁘게 웃었던 아름다운 너희들의 모습이 좋았어 함께 기뻐하고 모두 다같이 웃고 서로를 걱정했던 우리들만의 옛 추억들 우리들이 힘든일을 겪을땐 그곁에는 아무도 있어주진 않았어 다만 우리가 견딜수 있던건 너희들의 크나큰 사랑이었어 Dance to the music and move Move to the sound and groove To the soft MC's I'm a lyrical poet Listen to my rhyms and you'll surely know it A hard hiphopper there is nine higher sucka MC's they call me sire T to the A to the I to the J to the I  소리쳐 주던 예쁘게 웃었던 아름다운 너희들의 모습이 좋았어 함께 기뻐하고 모두 다같이 웃고 서로를 걱정했던 우리들만의 옛 추억들
  더 넛츠 (The NuTs)  ,어느새 눈물만,그녀의 한마디에 백번은 웃고 그 몸짓에 백번쯤은 울기도 했죠 사랑이 내게 시작되던 그 순간부터 나는 없던걸요  언젠간 헤어짐이 올꺼라 해도 이번만은 아니기를 간절히 빌죠 미안해 말만 남겨둔체 떠나간 그대 모른체로 잊으체로 살라죠  다시 그대를 만나면 웃으며 보내도 가슴만큼은 마음만큼은 또 참아요 다시 한숨만 나와도 그댈 위해 어느새 눈물만 훔쳐요 (Chorus 그댈 사랑하니까)  헤어질 이유들이 천개라 해도 사랑할 수 밖에 이유는 하나 그대를 향한 마음처럼 발걸음 또한 고장난 듯 어느샌가 향해요  다시 그대를 만나면 웃으며 보내도 가슴만큼은 마음만큼은 또 참아요 다시 한숨만 나와도 그댈 위해 어느새 눈물만 훔쳐요  그대보다 더 많이 첨부터 언제나 더 많이 사랑한 잘못이니깐 지운척 또 지울께요  그댈 사랑해 사랑해 외치고 외쳐도 기억속에서 추억속에서 또 막아요 입에 맴돌던 말들을 숨긴체로 어느새 눈물만  다시 그대를 만나면 웃으며 보내도 가슴만큼은 마음만큼은 또 참아요 다시 한숨만 나와도 그댈 위해 어느새 눈물만 훔쳐요
