artist,title,lyric
  Peach Pit  ,Techno Show,"I really don't wanna go be at that techno show It's not like me to go and watch some guy spin a bass drop  Chorus I'm off it though And about to say I'm for that bass With you here it seems okay for me to be out of place in this dank room Man I'm just screwed  Verse 2 I didn't know how to be, and got lit Out of my tree You saw me there at the back and waved me up to come and dance  Chorus I'm off it though And about to say I'm for that bass With you here it seems okay for me to be out of place in this dank room Man I'm just screwed  Bridge I'm off it though And about to say I'm for that bass  Chorus I'm off it though And about to say I'm for that bass With you here it seems okay for me to be out of place in this dank room Man I'm just screwed  Extra Lyrics in Youtube Description Then lost it all, in a laugh Then Adrienne, lit me up  I've had enough to drink To last me til next week But it's so dark inside this club I can't see How far I'm past done"
  Quella Vecchia Locanda  ,Villa Doria Pamphili,"Scender sulla terra, Quando intrisa di rugiada, Puoi porgere le mani verso lei. Aspettar che il vento Porti giù tutte le stelle E circondar quel cuore che le attende. Scricchiolar le foglie, Confondersi nell'aria, Tra i gemiti di un canto nascerà.  Dolce l'armonia, Con la natura gioca, Si innalza per poi scivolar sui prati. Vibra in noi la gioia Per l'attimo ineguale, In quel fragore tutta la sua gloria. Grido mi risponde, Volando su quell'ala E in tuffo tu il tuo nido mi aprirai."
  잔나비  ,나 그대에게 모두 드리리,나 그대에게 드릴 말 있네 오늘 밤 문득 드릴 말 있네 나 그대에게 모두 드리리 터질 것 같은 이 내 사랑을 그댈 위해서라면 나는 못할 게 없네 별을 따다가 그대 두 손에 가득 드리리 나 그대에게 드릴 게 있네 오늘 밤 문득 드릴 게 있네 그댈 위해서라면 나는 못할 게 없네 별을 따다가 그대 두 손에 가득 드리리 나 그대에게 모두 드리리 터질 것 같은 이 내 사랑을
  Children Of Bodom  ,Hate Me!,I was born in ashes of molten hatred Raised by demons in abodes of the end The Reaper's scythe I fall upon to light my path Wrecked by mangled wounds of life i have become The resurrection of the Evil one Ya know that I don't fucking care if I live or die I need a bishop preaching fire To get away with my sins I despise everything I see Ain't got respect for humanity Never lived or wanted immortality The Reaper's shadow I fall upon to obscure my path I'm being batered up until I bleed You mutherfuckas just leave me be Ya could never give me the cure for the pain I feel inside I need a bishop preaching fire To get away with my sins I despise everything I see I don't give a fuck if you hate me Led by the reaper I walk in the night Show me the way to yer kingdom come  I believe in Armageddon I've been baptized in alcohol I'm embodiment of Antichrist I'm living for my own demise  I was born in ashes of molten hatred Raised by demons in abodes of the end The Reaper's scythe I fall upon to light my path Wrecked by mangled wounds of life i have become The resurrection of the Evil one Ya know that I don't fucking care if I live or die I need a bishop preaching fire To get away with my sins I despise everything I see I don't give a fuck if you hate me  Led by the reaper I walk in the night Show me the way to yer kingdome come  I believe in Armageddon I've been baptized in alcohol I believe in Armageddon I've been baptized in alcohol If you hate me
  한스 밴드  ,어머니의 일기,너그럽게 웃으시는 당신에게서 따뜻한 사랑을 배웠죠 철이 없는 나를 항상 지켜주시는 하늘처럼 커보인 당신 우연히 서랍속에 숨겨둔 당신의 일기를 봤어요 나이가 먹을수록 사는게 자꾸 힘에 겨워 진다고 저 때문에 아빠하고 다투시던날 잠드신줄 알았었는데 불이 꺼진 부엌에서 나는 봤어요 혼자 울고 계신 당신을 알아요 내 앞에서 뭐든지 할수 있는 강한분인 걸 느껴요 하지만 당신도 마음약한 여자라는 걸  알아요 내 앞에서 뭐든지 할수 있는 강한분인 걸 느껴요 하지만 당신도 마음약한 여자라는 걸 라라라라라라 라라라라라라 라라라라라라 라라라라라라 라라라라라라 라라라라라라 라라라라라라 라라라라라라 워 어후 당신만은 내가 다 이해해요 느껴요 아름다운 당신의 사랑을요 이세상에 하나뿐인 소중한 당신 당신모습 닮아갈래요
  뷰렛  ,웃지 않는 공주,hey 내 손을 잡아줘 이 마음이 들끓어 잠들 수 없는 날 위해 hey 조금만 울어줘 이 쓰라린 눈물이 말라버린 날 위해 아주 먼 훗날 날 기억해줘 hey 이렇게 바랄께 이 외로운 심장은 어서 멎어버리길 hey 이 외로운 성안에 홀로 가둬버린 나 갇혀버린 나  잔혹하게 더럽혀진 방 닫을 꺼야 참혹하게 변해버린 성 지킬 꺼야  hey 이렇게 바랄께 이 무거운 육신은 어서 벗어버리길 hey 이 외로운 세상에 갇혀버린 나 무너져가는 나  악한 마음과 비천한 꿈속을 헤 매이는 밤은 또 날 쫓을 꺼야 악몽처럼 똑같은 고통과 숨막힘에
  Scarlett Johansson  ,Falling Down (With David Bowie),I have come 500 miles Just to see a halo Come from St Petersburg Scarlett and me Well I open my eyes I was blind as can be When you give a man luck He must fall in the sea And she wants you To steal and get caught For she loves you For all that you are not Falling down falling down Falling down falling down You forget all the roses Don't come around on Sunday She's not gonna choose you For standing so tall Go on and take a swig Of that poison and like it And don't ask For silverware Don't ask for nothing Go on and put your ear To the ground you will be Hearing that sound Falling down falling down Falling down falling down  Go on down and see That wrecking ball Come swinging on along Everyone knew That hotel was a goner They broke all the windows They took all the door knobs And they hauled it away In a couple of days Now someone yell timber And take off your hat It's a lot smaller down Here on the ground Falling down falling down Falling down falling down
  Michael Learns To Rock  ,Out Of The Blue,I was almost about to lose my faith Was still dreaming but feared it was too late But then you came along to my surprise And stole my heart before my very eyes You took me right out of the blue Simply by showing that you love me too Only by giving me your everything With a love so true you took me out of the blue I was wondering what love was all about I was trying but couldn't work it out But then you came along to my surprise And made my frozen mind come alive You took me right out of the blue Simply by showing that you love me too You let me out of the darkness You brought me out in the sun I think you must be the only one for me 'cos you took me Right out of the blue Simply by showing that you love me too Only by giving me your everything Breathing air below my wings You took me right out of the night Simply by filling my heart with light Only by giving me your energy With a love so true you took me out of the blue
  넥스트  ,날아라 병아리,육교 위의 네모난 상자 속에서 처음 나와 만난 노란 병아리 얄리는 다시 조그만 상자 속으로 돌아가 우리 집 앞뜰에 묻혔다 나는 어린 내 눈에 처음으로 죽음을 보았던 1974년의 봄을 아직 기억한다 내가 아주 작을 때 나보다 더 작던 내 친구 내 두 손 위에서 노랠 부르며 작은 방을 가득 채웠지 품에 안으면 따뜻한 그 느낌 작은 심장이 두근두근 느껴졌었어 우리 함께 한 날은 그리 길게 가진 못했지 어느 밤 얄리는 많이 아파 힘없이 누워만 있었지 슬픈 눈으로 날갯짓 하더니 새벽 무렵엔 차디차게 식어 있었네 굿바이 얄리 이젠 아픔 없는 곳에서 하늘을 날고 있을까 굿바이 얄리 너의 조그만 무덤가엔 올해도 꽃은 피는지 눈물이 마를 무렵 희미하게 알 수 있었지 나 역시 세상에 머무르는 것 영원할 수 없다는 것을 설명할 말을 알 순 없었지만 어린 나에게 죽음을 가르쳐 주었네 굿바이 얄리 이젠 아픔 없는 곳에서 하늘을 날고 있을까 굿바이 얄리 너의 조그만 무덤가엔 올해도 꽃은 피는지 굿바이 얄리 이젠 아픔 없는 곳에서 하늘을 날고 있을까 굿바이 얄리 언젠가 다음 세상에도 내 친구로 태어나 줘
  주니퍼  ,다시 사랑할 수 있도록,한걸음씩 천천히 다가와 내가 널 안아줄꺼야 너의 지친 마음 이젠 내게 기대줘 다시 사랑할수 있도록 지우려고 노력하지는마 그냥 이대로 내품에 안겨 다른 니가 되길 난 더 원치 않아 지금 모습이면 충분해 너 밖에 없는거야 내 모두 가져갈 사람 너 뿐인걸 약속해줘 이 세상 마지막 날까지 널 사랑할 사람 날 허락 한다고 기억속에 묻혀진 아픈 추억마저 내곁에서 행복하길 기도할께  나 밖에 없는거야 널 다시 웃게 할 사람 나뿐인걸 약속해줘 이 세상 마지막 날까지 널 사랑할 사람 날 허락한다고 기억속에 묻혀진 아픈 추억마저 내곁에서 행복하길 워  나 약속할께 눈물이 널 찾지 않도록 언제까지 니곁에서 지켜줄께
  The Psychedelic Furs  ,Love My Way,"There's an army on the dance floor It's a fashion with a gun my love In a room without a door A kiss is not enough in Love my way, it's a new road I follow where my mind goes They'd put us on a railroad They'd dearly make us pay For laughing in their faces And making it our way There's emptiness behind their eyes There's dust in all their hearts They just want to steal us all And take us all apart But not in Love my way, it's a new road I follow where my mind goes Love my way, it's a new road I follow where my mind goes Love my way, it's a new road I follow where my mind goes So swallow all your tears my love And put on your new face You can never win or lose If you don't run the race"
  Marilyn Manson  ,Rock Is Dead,All simple monkeys  with alien babies  Amphetamines for boys  Crucifixes for ladies  Sampled and soulless  Worldwide and real webbed  You sell all the living  For more safer dead  Anything to belong  Anything to belong  Rock is deader than dead  Shock is all in your head  Your sex and your dope  is all that we're fed  So fuck all your protests  and put them to bed  God is in the TV  Rock la la la la la la  Rock la la la la la la  Rock la la la la la la  Rock la la la la la la    1000 mothers are  praying for it  We're so full of hope  And so full of shit  Build a new god  to medicate and to ape  Sell us ersatz  dressed up and real fake  Anything to belong  Anything to belong  Rock is deader than dead  Shock is all in your head  Your sex and your dope  is all that we're fed  So fuck all your protests  and put them to bed  God is in the TV  Rock la la la la la la  Rock la la la la la la  Rock la la la la la la  Rock la la la la la la  la la la la la la  la la la la la la  la la la la la la  la la la la la la    Rock is deader than dead  Shock is all in your head  Your sex and your dope is  all that we're fed  So fuck all your protests  and put them to bed  Rock is deader than dead  Shock is all in your head  Your sex and your dope is  all that we're fed  So fuck all your protests  and put them to bed
  Extreme  ,He-Man Woman Hater,"No Women Allowed  Let me tell you about this love and hate relation Between a man and a woman And so none of you all get the wrong interpretation I can't live with them I'm gonna die without them  Sooner or later You'll be a he man woman hater It's inevitable And to become one You've gotta really hate to love them He man woman hater  He, he man woman hater You know I love to hate cause I hate to love them  He man's behavior Doesn't need no explanation We all got a one track mind He men have always had a sexual preoccupation It's gonna be your place or it's gonna be mine  Sooner or later You'll be a he man woman hater It's inevitable And to become one You've gotta really hate to love them He man woman hater  He, he man woman hater You know I love to hate cause I hate to love them He, he man woman hater Can't live with em gonna die without 'em"
  Suicide Silence  ,The Price of Beauty,"Holding you down by your throat Just enough to keep your Fucking mouth shut Can't stand to hear you scream, God Because he's not fucking here, bitch  And how does it feel now  Don't worry you're not another rape victim It's just me destroying your beauty Don't worry you're not another rape victim It's just me destroying your beauty  And how does it feel now And how does it feel now  That I'm ripping out All of the fake pieces In your face  That I'm ripping out All of the fake pieces In your face  And what will you do now Once all of your beautiful skin Is in my pockets Is in my pockets  What cosmetic will fix this mess What cosmetic will fix this mess Fix this mess Fix this mess That is now your face  Was this all worth it For your fake fucking beauty Was this all worth it For your fake fucking beauty  The price of beauty was more Than you thought How does it feel now How does it feel now The price The price Was more than you thought"
  YUNGBLUD  ,"I Love You, Will You Marry Me","Chorus Park hill romance We got the love but they put out the fire Park hill romance 'Cause they expect us to walk on the wire Park hill romance We got the love but they put out the fire Park hill romance 'Cause they expect us to walk on the wire  Verse 1 A kid lifts up a spray can And never thought it would be famous what he did Turned the mess into a dreamland With a quirky act of romance A version of Romeo and Juliet This time with Adidas sneakers and cigarettes A couple of kids trying to cut down the safety net They twisted the story so they could bring glory to it  Pre-Chorus I love ya, will you marry me Oh, what a shame we gotta pay for reality Ain't it sad, sad, sad  Chorus Park hill romance We got the love but they put out the fire Park hill romance 'Cause they expect us to walk on the wire Park hill romance We got the love but they put out the fire Park hill romance 'Cause they expect us to walk on the wire  Verse 2 They didn't write her name on the article That to me just seems pretty farcical Now coppers take coppers Out of his hands from a ban from alcohol Fundamental narcissistic Tried to make out he didn't exist When they wrote on the what When they wrote on the T-shirts, cool merch and postcards And lighting it up like a piece of art They kicked him to the side and left him to starve On the memory that's re-breaking his broken heart  Pre-Chorus I love ya, will you marry me Oh, what a shame we gotta pay for reality Ain't it sad, sad, sad I love ya, will you marry me Oh, what a shame we gotta pay for reality Ain't it sad, sad, sad  Bridge Every day, every day, every single day Every day, every day, every single day  Pre-Chorus I love ya, will you marry me Oh, what a shame we gotta pay for reality Ain't it sad, sad, sad I love ya, will you marry me Oh, what a shame we gotta pay for reality Ain't it sad, sad, sad  Chorus Park hill romance We got the love but they put out the fire Park hill romance 'Cause they expect us to walk on the wire Park hill romance We got the love but they put out the fire Park hill romance 'Cause they expect us to walk on the wire"
  Tom Grennan  ,I Might,"Oh I love, oh I love, love my freedom More than happy to be at a table for one Go to a movie with just yours truly Stay out all night or go to sleep early  [Pre-Chorus 1] I do what I want to do Got no one to answer to Live whatever life I choose I'm free  [Chorus] Don't want no one taking up my time Staying on my mind, changing up my life Don't want no one messing up my bed Fucking with my head, it's no lie But when you look at me like that I might  [Verse 2] Oh I like, oh I like singing loudly In my room out of tune with no one around me Being stupid, acting crazy Work hard all day, I spend the day being lazy  [Pre-Chorus 2] I go where I want to go Living fast or taking it slow Like it out here on my own I'm free  [Chorus] Don't want no one taking up my time Staying on my mind, changing up my life Don't want no one messing up my bed Fucking with my head, it’s no lie But when you look at me like that I might  [Bridge] Might never walk away Might beg you to stay Might change everything just to keep you close to me  [Chorus] Don't want no one taking up my time Staying on my mind, changing up my life Don't want no one messing up my bed Fucking with my head, it’s no lie But when you look at me like that I might, I might, I might When you look at me like that I might"
  San Fermin  ,Bride,"Roses in my hair Roses in the yard I can see the people in their places on the lawn  Dazzling in white Blindingly alone In and out of strangers I am floating like a ghost  Then ooh ooh ooh Suddenly I'm dissociating Then ooh ooh ooh Out of body, out of mind Out of mind, oh no  And I I I Am done with my perfect Done with my perfect lies And I I I Am done with the perfect Am one with the perfect bride  Fizzing through my blood Trying to fight it down Paralyzed and lidded I am mumbling the sounds I can feel the boil Poison chemicals Buzzing in my body trying to wrestle for control  Then ooh ooh ooh Suddenly I'm dissociating Then ooh ooh ooh Out of body, out of mind Out of mind, oh no  And I I I Am done with my perfect Done with my perfect lies And I I I Am done with the perfect Am one with the perfect bride  Da du dah da da da da da Da du dah da da Da du dah da da da da da Da du dah da da Da du dah da da da da da Da du dah da da  Roses in my hair Dazzling in white Dress me up in ribbons just to wake under the knife  Then ooh ooh ooh Suddenly I'm dissociating Then ooh ooh ooh Out of body, out of mind Out of mind, oh no  And I I I Am done with my perfect Done with my perfect lies And I I I Am done with the perfect Am one with the perfect bride  Da du dah da da da da da Da du dah da da Da du dah da da da da da Da du dah da da Da du dah da da da da da Da du dah da da"
  Miike Snow  ,Change Your Mind,"Early in the morning, up and fly away You know why you don't walk here round the sun, no, my face Couldn't get back to celebrate And I know you're backing off, you want it both ways  [Pre-Chorus] At night, I'm trading, gold diamonds for stars Blinded by fire, showing me who you are Fuck it, fade away, child 'til another day, child Gotta keep my state of mind  [Chorus] Maybe I have to wait a while Maybe I have to wait a while Maybe I could change your mind Maybe I could change your mind, woah, oh  [Verse 2] Step into the backroom, take your breath away Even though it's been some time, you still love my taste Trying to meet your eyes, I keep my sanity Though I know you're backing off, you want it both ways  [Pre-Chorus] At night, I'm trading, gold diamonds for stars Blinded by fire, showing me who you are Fuck it, fade away, child 'til another day, child Gotta keep my state of mind  [Chorus] Maybe I have to wait a while Maybe I have to wait a while Maybe I could change your mind Maybe I could change your mind, woah, oh  [Outro] I could feel the waves from you and I Slamming on shore on the other side But I have to wait 'til it's time Fly away, fly away I could feel the waves from you and I Slamming on shore on the other side But I have to wait 'til it's time Fly away, fly away I could feel the waves from you and I Slamming on shore on the other side But I have to wait 'til it's time Fly away, fly away Oh, I could feel the waves from you and I Slamming on shore on the other side But I have to wait 'til it's time, oh, oh, oh, oh Fly away, fly away"
  더더 (THETHE)  ,눈물이 흐르다,이제 그 시절은 없어 예전의 그 모습도 그때의 그 소녀는 가고 여기없어 바래져간 기억뿐 저기 푸르른 날들은 이제 반짝이다 멀리 사라져 넌 이제 다른 모습의 누군가로 살아가겠지 떠나가줘 눈물이 흐르고 Yeah 싱그러운 너의 웃음이 떠오르고 슬픔이 아니야 Yeah 그 추억 모두 아름다웠어 햇살이 밝게 비추고 아무 말도 없어 그때로 돌아가고 싶지 않을 뿐야 내 모든 것이 변해가 너를 그리던 외로운 기억 언제까지 여기 남을까 이미 난 다른 곳을 보고 있는걸 그 길을 따라 가고 있어 오늘이 아니야 Yeah 그 얼굴을 잊지 않을래 그 미소를 후회가 아니야 Yeah 끝난 사랑도 아프지않아  이제 그 시절은 없어 예전의 그 모습도 그때의 그 소녀는 가고 여기없어 바래져간 기억뿐 저기 푸르른 날들은 이제 반짝이다 멀리 사라져 넌 이제 다른 모습의 누군가로 살아가겠지 떠나가줘 눈물이 흐르고 Yeah 싱그러운 너의 웃음이 떠오르고 슬픔이 아니야 Yeah 그 추억 모두 아름다웠어 오늘이 아니야 Yeah 그 얼굴을 잊지 않을래 그 미소를 후회가 아니야 Yeah 끝난 사랑도 아프지않아
  Blur  ,Beetlebum (2012 Remaster),"Beetlebum What you done She's a gun Now what you've done Beetlebum Get nothing done You beetlebum Just get numb Now what you've done Beetlebum  And when she lets me slip away She turns me on all my violence is gone Nothing is wrong I just slip away and I am gone Nothing is wrong She turns me on I just slip away and now I am gone  Beetlebum Because you're young She's a gun Now what you've done Beetlebum She'll suck your thumb She'll make you come Coz she's your gun Now what you've done Beetlebum  He's on, he's on, he's on it"
  Alvvays  ,Atop A Cake,I lie on a sofa awake it's what you said last night You'd like us on top of a cake but you won't let me take a bite Flowers arriving in fleets can't we talk about this Why let the state in our sheets can't we do without it Well I don't mean to wind you up but i'd like to slow it down how do i remain a pup if you put be in a gown What's it got to do with you what's it got to do with me How could i lose control when you're driving from the backseat What's it got to do with you what's it got to do with me How could i lose control when you're driving from the backseat Corners begin to repeat I think we're getting lost We walked to the end of the street but we were bitten by the frost So if you have to thaw me out youcan put me in a pail Can we take another route I don't want to wear a vail What's it got to do with you what's it got to do with me How could i lose control when you're driving from the backseat What's it got to do with you what's it got to do with me How could i lose control when you're driving from the backseat I'll wait in the lobby for someone to show And if they don't come I will know where to go The bodies are lined up outside in the hall I don't want to decay in a mall If everything you say is true then why would I disagree how could I lose control What's it got to do with you what's it got to do with me How could I lose control when you're driving from the backseat When you're driving from the backseat
  White Zombie  ,Thunder Kiss `65,Well sweet little sista's high in hell cheat'n on a halo Grind in a odyssey holocaust heart kick on tomorrow Breakdown agony said ectasy in overdrive she come a Riding on the world thunder kiss'n 1965 yeah wow Five yeah wow demon warp is coming alive in 1965 Five five yeah livin' fast and dying young like a Endless poetry my motor psycho nightmare freak out Inside of me my soul salvation liberation on the drive The power of the blaster move me faster 1965 yeah Wow five yeah wow demon warp is coming alive in 1965 five five yeah gimme that gimme that now now Now yeah roll'n like a supersonic another fool that Gets down on it pig sweat a million miles I got a heart Atomic style I make it look easy that's what I said Blast of silence explodes in my head yeah yeah yeah Gimme that gimme that now step To the moonshine frenzy hail the Resurrection what's new pussycat Can you dig the satisfaction well You can't take it with you but you Can in overdrive yeah some like it Hot and twist'n 1965 yeah wow Five yeah wow demon warp is Coming alive in 1965 five five
  Queen  ,Hammer To Fall (Remastered 2011),Here we stand Here we fall History won't care at all Make the bed Light the light Lady Mercy won't be home tonight We don't waste no time at all Don't hear the bell but you answer the call It comes to you as to us all We're just waiting for the hammer to fall  Every night And every day A little piece of you is falling away Lift your face the western way Build your muscles as your body decays Tow your line and play the game Let the anesthetic cover it all Til one day they call your name You know it's time for the hammer to fall  Rich or poor or famous for To you it's all the same oh no oh no Lock your door But the rain is pouring through the window pane oh no Baby now your struggles are all in vain yeah  For we who grew up tall and proud In the shadow of the mushroom cloud Convinced our voices can't be heard We just wanna scream it louder and louder and What the hell we fighting for Just surrender and it won't hurt at all Just got time to say your prayers While your waiting for the hammer hammer to fall  While your waiting for the hammer to fall
