artist,title,lyric
  Disturbed  ,Uninvited Guest,"Thought I was rid of you Thought it was over with Thought I was over it Thought I evicted you from my heart Kicked you out of my mind So nothing left of you Wouldn't be left behind  Ooh, but you still take up all my space You just won't go away  You stay in my head Like an uninvited guest, uninvited guest You still haunt my heart Guess you haven't left me yet, haven't left me yet Ooh like an uninvited guest  Still see you everywhere You're still in every room Filled you with every move I can't go on without erasing you from my heart Tired of feeling this pain Seems you're the only ghost I just can't chase away  Ooh, you still inhabit every thought I prayed that you'd be gone  You stay in my head Like an uninvited guest, uninvited guest You still haunt my heart Guess you haven't left me yet, haven't left me yet  I don't want to fill you around I just want you, want you out So please go, please  You stay in my head Like an uninvited guest, uninvited guest You still haunt my heart Guess you haven't left me yet, haven't left me yet You stay in my head Like an uninvited guest, uninvited guest You still haunt my heart like an uninvited guest"
  U2  ,I`ll Go Crazy If I Don`t Go Crazy Tonight,"She’s a rainbow and she loves the peaceful life  Knows I’ll go crazy if I don’t go crazy tonight  There’s a part of me in the chaos that’s quiet  And there’s a part of you that wants me to riot    Everybody needs to cry or needs to spit  Every sweet tooth needs just a little hit  Every beauty needs to go out with an idiot  How can you stand next to the truth and not see it  Oh, a change of heart comes slow    It’s not a hill, it’s a mountain  As you start out the climb  Do you believe me or are you doubting  We’re gonna make it all the way to the light  But I know I’ll go crazy if I don’t go crazy tonight    Every generation gets a chance to change the world  Pity the nation that won’t listen to your boys and girls  ‘Cos the sweetest melody is the one we haven’t heard  Is it true that perfect love drives out all fear  The right to appear ridiculous is something I hold dear  Oh, but a change of heart comes slow    It’s not a hill, it’s a mountain  As you start out the climb  Listen for me, I’ll be shouting  We’re gonna make it all the way to the light  But you now I’ll go crazy if I don’t go crazy tonight    Baby, baby, baby  I know I’m not alone  Baby, baby, baby  I know I’m not alone    Oh oh oh    It’s not a hill, it’s a mountain  As we start out the climb  Listen for me, I’ll be shouting  Shouting to the darkness  Squeeze out sparks of light    You know we’re gonna go crazy  You know we’ll go crazy  You know we’ll go crazy if we don’t go crazy tonight    Oh, slowly now  Oh, be slow"
  AJR  ,Infinity,Was it all in my head In an empty bed And I told you that I need you baby Can't you see I'm alone oh oh I was lost in my feet On an empty street So I saved your seat infinity Forever figures 5 and 3 You know oh oh Cross my heart and hope to die Stick a needle in my eye My mama says to pick the best And you are it HEY All our troubles gone Like when we were young Take me back to where we all began Here we are again like we should have been Oh my lady can I have this dance My lady HEY All our troubles gone Like when we were young Take me back to where we all began Was it hard to believe Wear your heart on my sleeve And I'll hold you when you're lonely When you're cold cause you're the only girl for me Cross my heart and hope to die Since you came into my life My mama says to pick the best And you are it HEY All our troubles gone Like when we were young Take me back to where we all began Here we are again like we should have been Oh my lady can I have this dance My lady HEY All our troubles gone Like when we were young Take me back to where we all began Take you dancing in the park Stroll the west side after dark oh oh Your are shining you're an angel When these words are set on paper You will never be a stranger now Hey All our troubles gone Like when we were young Take me back to where we all began Here we are again like we should have been Oh my lady can I have this dance HEY All our troubles gone Like when we were young Take me back to where we all began Here we are again like we should have been Oh my lady can I have this dance My lady Can I have this dance HEY All our troubles gone Like when we were young Take me back to where we all began Cross my heart and hope to die Since you came into my life My mama says to pick the best And you are it
  Traffic  ,Smiling Phases (Mono Version),"You rise upon a black day, coming from a mile away And every time I hear you say, that I don't have to be this way You sneak upon a mean moon, that casts it's shadow too soon When the spell is in tune, your shadow slips away  Good man gets the good wife, while bad boy's cleaning up his knife And all I got is trouble and strife to help me on my way You're running round to nowhere, someone said it might be there But I'm telling you beware, the hand that fights you'll feed  Investigating downtown, Sergeant Gruesome got shot down National Guard came all around, but couldn't find his knees Mickey Mouse was all put out, Donald Duck began to shout Rumors that were put about, said they would get theirs next"
  AC/DC  ,Are You Ready,"Are you ready Are you ready Are you ready Are you ready  Sweet apple pie Standing in the street Hands outta line Looking for some meat (heat?) She take you high When you feel her sting She make you fly And you know you're coming  Who all need it - who Who all need it - you Who all need it, who all need it (yes you do) You all breathe it, we all need it Are you ready for a good time Then get ready for the night line Are you ready for a good time Then get ready for the night line Are you ready for a good time  She making eyes At everything she meet ain't it a crime When she make you pump heat She make you fly Because that's her thing She make you dry And you know you're broken in  Who all need it, who all need it (yes you do) You all breathe it, we all need it Are you ready for a good time Then get ready for the night line Are you ready for a good time Then get ready for the night line Are you ready for a good time  Get with it  Who all need it, who all need it You all breathe it, we all breathe it Are you ready for a good time Then get ready for the night line Are you ready for a good time Are you ready for a good time Are you ready Are you ready for a good time I want a good time Are you ready for a good time Are you, are you ready Are you ready for a good time Good, good, good, good time Are you ready for a good time Are you ready, ready, ready  Are you ready for a good time Are you ready for a good time"
  Ben Folds  ,Adelaide,Shattered at dawn so far for so long Feeling you leap out of time Thinking I don’t want this thing to end I want a blue sky Where our stony paths meet Comfy color sheets Thinking when our pale knees need a cigarette in a morning beat under the blue sky Last night at the bar I was wrong I was only hurting And you were acting too polite with me Hello to the ?ale through the storms and the rain Like a couple of empty starting in post parts A a a ah the blue sky A a a ah sky high A a a ah Pawn shop billboard we buy gold or dreams Just fade and twist it’s a heartache that never ended The brightness of air I’m walking somewhere And when they ask you just tell them that you knew me back then under the blue sky A a a ah sky high A a a ah below the blue sky A a a ahh sky high
  Jason Mraz  ,The World As I See It (Live),The world as I see it is a remarkable place A beautiful house in a forest of stars in outer space From a birds eye view I can see it has a well rounded personality From a birds eye view I can see we are family It's not hard for me to love you Hard for me to love you No it's not a difficult thing It's not hard for me to love you Hard for me to love you Because you are the world to me Yeah the world as I see it is a remarkable place Every man makes a difference And every mother's child is a saint From a birds eye view I can see we are spiraling down in gravity From a birds eye view I can see you are just like me It's not hard for me to love you Hard for me to love you No it's not a difficult thing It's not hard for me to love you Hard For Me To Love You Unconditionally No it's not hard for me to love you Hard for me to love you No it's not a difficult thing It's not hard for me to love you Hard For Me To Love You Because You Are The World To Me You are the mountain you are the rock You are the cord and you're the spark You are the eagle you are the lark You are the world and you're remarkable You're the ocean eating the shore You are the calm inside the storm You're every emotion you can endure You are the world and the world is yours No It's not hard for me to love you Hard for me to love you No it's not a difficult thing it's not hard for me to love you Hard for me to love you unconditionally No it's not hard for me to love you Hard for me to love you No it's not a difficult thing It's not hard for me to love you Hard for me to love you because you are the world to me Yeah the world as I see it is a remarkable place
  Steel Attack  ,Heavy Metal God,You better have an easy living to show them So waste your time with peace and love You better run if the evil is near you He shows no mercy don't show no fear Heaven can wait it the god is waiting for me Heaven can wait the heavy metal god will wait Heavy metal god the one and only Heavy metal god let me be Heavy metal god he will show me Heavy metal god set me free  You better face the reality There is no god with wings of steel A metal chorus symphony Up in the sky makes it real Heaven can wait if the god is waiting for me Heaven can wait the heavy metal god will wait Heavy metal god the one and only Heavy metal god let me be Heavy metal god he will show me Heavy metal god set me free  A masquerade behind your face We need a life and we wane be free They crucified the evil him self The metal god will be free Heaven can wait it the god is waiting for me Heaven can wait the heavy metal god will wait Heavy metal god the one and only Heavy metal god let me be Heavy metal god he will show me Heavy metal god set me free Heavy metal god the one and only Heavy metal god let me be Heavy metal god he will show me Heavy metal god set me free Heavy metal god Heavy metal god Heavy metal god Heavy metal god Heavy metal god
  Issues  ,Black Diamonds (Feat. Scout),We keep the cash on deck We keep the cash on deck Swerved out black-black diamond If you cut records like cocaine We keep the cash on deck
  클랑 (KLANG)  ,Gravity (English Ver.),I will love you through the pain coz you'll love me just the same Doesn't matter where you are I'll be running back to you You will love me through the pain coz I'll love you just the same Doesn't matter where I am you'll be running back to me oh my love I close mine but all I see are still your eyes All I hear with covered ears is still your voice All i could see and hear seems to be you Have I gone quite mad For you for you When I stand in front of you my eyes would linger When you stand in front of me my voice would tremble I don't know why but I just keep on staring Have I gone quite mad For you for you I will love you through the pain coz you'll love me just the same Doesn't matter where you are I'll be running back to you You will love me through the pain coz I'll love you just the same Doesn't matter where I am you'll be running back to me oh my love When you're close I feel the warmth you‘re my sunlight And the skies you brighten them you‘re my moonlight And you were always there when I need you You're my sun and moon Oh it's you It's you I will love you through the pain coz you'll love me just the same Doesn't matter where you are I'll be running back to you You will love me through the pain coz I'll love you just the same Doesn't matter where I am you'll be running back to me oh my love I will love again I will love again I will love you ‘til the end coz you'll love me just the same Doesn't matter where we are It'll always be this way You will love me ‘til the end coz I'll love you just the same Doesn't matter where we are coz we'll always be this way oh my love I will love you love you love again I will love you love you love again
  Eels  ,Dog Faced Boy,"Coming home from the school today Crying all along the way Ain't no way for a boy to be Begging ma to shave me please  You little punks think you own this town Well someday someone's gonna bring you down Life ain't pretty for a dog faced boy Life ain't pretty for a dog faced boy  You, take back what you said now That's the last time i cry You tell me what it is to be a friend, now 'till i walk beside you on the street now  Ma won't shave me Jesus can't save me Dog faced boy  Life ain't pretty for a dog faced boy Life ain't pretty for a dog faced boy Life ain't pretty for a dog faced boy Life ain't pretty for a dog faced boy  Going back to the school tomorrow Hang my hairy head in sorrow Ain't no way for a boy to be Aint' no way to set me free, now  Ma won't shave me Jesus can't save me Dog faced boy  Ma won't shave me Jesus can't save me Dog faced boy"
  The Click Five  ,Mary Jane,I didn't cry the day you moved away I didn't think that I could feel this pain Until I saw the stranger that was you Whatever happened to our innocence and the somethin' that you said about being friends tell me how help me say the words out loud could it be that nothings gonna change cause time has got a way of taking back everything you thought you had can you see the girl you used to be the one I lost when I let go of you oh whatever happened to mary jane ooh ooh ooh ooh ooh ooh ooh ooh I need to wake up from this state of mind the situation is the same kind I gotta get your memory out of my head would you catch me if I had to fall would you even find the time for that at all tell me how tell me how help me say the words out loud could it be that nothings gonna change time has got a way of taking back everything you thought you had can you see the girl you used to be the one I lost when I let go of you oh whatever happened to mary jane ooh ooh ooh ooh ooh ooh ooh ooh  cause time has taken back everything I thought we had Mary Jane help me say the words out loud could it be nothings gonna change cause time has got a way of taking back everything you thought you had can you see the girl you used to be the one I lost when I let go of you oh whatever happened to mary jane ooh ooh ooh ooh oh whatever happened to ooh ooh ooh ooh mary jane
  박완규  ,언제나,넌 아직 모르겠지 너를 바라보는 나의 간절한 마음 가득 담겨 있는 너의 조각 이런 설레임 나의 힘겨운 하룰 비추네 이젠 나의 마음을 고백해 볼까 언젠가 내게 말한 첫사랑의 아픈 추억 다시는 사랑하지 않겠다는 너의 다짐 그런 아픈 기억들 이젠 모두 지워도 돼 이제는 내가 너의 곁에 오호 난 언제나 너란 한 사람을 바라보며 품에 가득 너를 안고 크게 말할거야 너를 아프게 하거나 힘들게 하진 않아 이젠 마음을 열어 나를 봐 워  넌 아직 모르겠지 너를 바라보는 나의 간절한 마음 가득 담겨 있는 너의 조각 이런 설레임 나의 힘겨운 하룰 비추네 이젠 나의 마음을 고백해 볼까 언젠가 내게 말한 첫사랑의 아픈 추억 다시는 사랑하지 않겠다는 너의 다짐 그런 아픈 기억들 이젠 모두 지워도 돼 이제는 내가 너의 곁에 난 언제나 너란 한 사람을 바라보며 품에 가득 너를 안고 크게 말할거야 너를 아프게 하거나 힘들게 하진 않아 이젠 마음을 열어 나를 봐 언제나 니 곁에 난 언제나 너란 한 사람을 바라보며 품에 가득 너를 안고 크게 말할꺼야 너를 아프게 하거나 힘들게 하진 않아 이젠 마음을 열어 나를 봐 워허
  The Smiths  ,There Is A Light That Never Goes Out,"Take me out tonight  Where there's music and there's people  And they're young and alive  Driving in your car  I never never want to go home  Because I haven't got one  Anymore  Take me out tonight  Because I want to see people and I Want to see life  Driving in your car  Oh, please don't drop me home  Because it's not my home, it's their Home,  and I'm welcome no more  And if a double-decker bus  Crashes into us  To die by your side  Is such a heavenly way to die  And if a ten-ton truck  Kills the both of us  To die by your side  Well, the pleasure - the privilege is mine  Take me out tonight  Take me anywhere, I don't care I don't care, I don't care  And in the darkened underpass I thought Oh God, my chance has come at last  (But then a strange fear gripped me and I Just couldn't ask)  Take me out tonight  Oh, take me anywhere,  I don't care I don't care, I don't care  Driving in your car  I never never want to go home  Because I haven't got one, da ...Oh,  I haven't got one    And if a double-decker bus  Crashes into us  To die by your side  Is such a heavenly way to die  And if a ten-ton truck  Kills the both of us  To die by your side  Well, the pleasure - the privilege is mine    Oh, There Is A Light And It Never Goes Out  There Is A Light And It Never Goes Out  There Is A Light And It Never Goes Out  There Is A Light And It Never Goes Out  There Is A Light And It Never Goes Out  There Is A Light And It Never Goes Out  There Is A Light And It Never Goes Out  There Is A Light And It Never Goes Out  There Is A Light And It Never Goes Out"
  Maroon 5  ,The Sun,After school Walking home Fresh dirt under my fingernails And I can smell hot asphalt Cars screech to a halt to let me pass And I cannot remember What life was like through photographs Trying to recreate images life gives us from our past And sometimes it's a sad song But I cannot forget Refuse to regret So glad I met you Take my breath away Make everyday Worth all of the pain that I have Gone through And mama I've been cryin' Cause things ain't how they used to be She said the battles almost won And we're only several miles from the sun Moving on down my street I see people I won't ever meet Think of her take a breath Feel the beat in the rhythm of my steps And sometimes it's a sad song But I cannot forget Refuse to regret So glad I met you Take my breath away Make everyday Worth all of the pain that I have Gone through And mama I've been cryin' Cause things ain't how they used to be She said the battles almost won And we're only several miles from the sun The rhythm of her conversation The perfection of her creation The sex she slipped into my coffee The way she felt when she first saw me Hate to love and love to hate her Like a broken record player Back and forth and here and gone And on and on and on and on But I cannot forget Refuse to regret So glad I met you Take my breath away Make everyday Worth all of the pain that I have Gone through And mama I've been cryin' Cause things ain't how they used to be She said the battles almost won And we're only several miles She said the battles almost won And we're only several miles from the sun
  Bon Jovi  ,Does Anybody Really Fall In Love Anymore? (Demo),"I walk down the street, people passing me by They look you up and down but they don't look you in the eye I'm just another stranger in my own hometown Looking for a angel but heaven can't be found I said hey are you lonely tonight Hey I'm gonna make it But that don't make it right Does anybody really fall in love anymore Does anybody really give their heart to somebody Does anybody really have opened the door I know, I know, you gotta love somebody I know, I know, I've got to find somebody to love There's a sad face in the mirror and I'm sad to say it's me Like a ghost up in the attic only love can set you free I've been running round in circles on this roller coaster ride There's a lonely world around us, we get sucked in by the tide I said hey, love ain't a crime So why is everybody so afraid to cross the line Does anybody really fall in love anymore Does anybody really give their heart to somebody Does anybody really have opened the door I know, I know, you gotta love somebody I know, I know, I've got to find somebody to love I said hey, I'll be alright Cause I know that someone somewhere's gonna Say these words tonight Does anybody really fall in love anymore Does anybody really give their heart to somebody Does anybody really have opened the door I know, I know, you gotta love somebody I know, I know, I've got to find somebody to love"
  Bastille  ,Pompeii (Audien Remix),I was left to my own devices Many days fell away with nothing to show  And the walls kept tumbling down In the city that we love Great clouds roll over the hills Bringing darkness from above  But if you close your eyes Does it almost feel like Nothing changed at all And if you close your eyes Does it almost feel like You've been here before How am I gonna be an optimist about this How am I gonna be an optimist about this  We were caught up And lost in all of our vices In your pose as the dust settles around us  And the walls kept tumbling down In the city that we love Great clouds roll over the hills Bringing darkness from above  But if you close your eyes Does it almost feel like Nothing changed at all And if you close your eyes Does it almost feel like You've been here before How am I gonna be an optimist about this How am I gonna be an optimist about this  Oh where do we begin The rubble or our sins Oh where do we begin The rubble or our sins  And the walls kept tumbling down In the city that we love Great clouds roll over the hills Bringing darkness from above  But if you close your eyes Does it almost feel like Nothing changed at all And if you close your eyes Does it almost feel like You've been here before How am I gonna be an optimist about this How am I gonna be an optimist about this  If you close your eyes Does it almost feel like Nothing changed at all
  Ecobridge  ,서른 한번째 봄,눈을 뜨면 아무 의미없는 하루만 또 한 번 지나갔음에 지쳐 돌아보면 좋기만 하던 추억들이 오늘을 더 힘들게 해 날려 버려도 지울 수 없었던 새겨논 날들이 어설피 기억에 남아 죽도록 좋았던 참 많이 웃었던 아름답던 내 사랑아 눈 감으면 빛바랜 그 시절 향기가 흩어진 사진들처럼 남아 꽃이 피던 어느 봄날의 온기처럼 다시 또 설레이게 해 날려 버려도 쉽게 사랑했던 이별의 날들이 어느새 내안에 녹아 죽도록 아팠던 참 많이 울었던 아름답던 내 사랑아  술에 취한 날 끝이라고 생각했던 날 철없던 날에 미련이 남아 오늘 이렇게 그리워해 지울 수 없었던 새겨논 날들이 어설피 기억에 남아 죽도록 좋았던 참 많이 웃었던 아름답던 내 사랑아 쉽게 사랑했던 이별의 날들이 어느새 내안에 녹아 죽도록 아팠던 참 많이 울었던 아름답던 내 사랑아
  Supertramp  ,Free As A Bird,When a spirit is broken Why go on When there's nothing to say And a love just a token It was strong Now it's fading away Ah but I'm free as a bird As I walk right out that door You have my word I won't bother you no more Yes I'm doing alright As I face t
  George Thorogood & The Destroyers  ,Bad To The Bone,On the day I was born    The nurses all gathered 'round    And they gazed in wide wonder    At the joy they had found    The head nurse spoke up    And she said leave this one alone    She could tell right away    That I was bad to the bone        Bad to the bone    Bad to the bone    B-B-B-B-Bad    B-B-B-B-Bad    B-B-B-B-Bad    Bad to the bone        I broke a thousand hearts    Before I met you    I'll break a thousand more baby Before I am through    I wanna be yours pretty baby    Yours and yours alone    I'm here to tell ya honey    That I'm bad to the bone        Bad to the bone    B-B-B-Bad    B-B-B-Bad    B-B-B-Bad    Bad to the bone        (Music Run)        I make a rich woman beg    I'll make a good woman steal    I'll make an old woman blush    And I'll make a young girl squeal    I wanna be yours pretty baby    Yours and yours alone    I'm here to tell ya honey    That I'm bad to the bone        B-B-B-B-Bad    B-B-B-B-Bad    B-B-B-B-Bad    Bad to the bone        (Music Run)        Now when I walk the streets    Kings and queens step aside    Every woman I meet    They all stay satisfied    I wanna tell you pretty baby    What I see I make my own    I'm here to tell ya honey    That I'm bad to the bone        Bad to the bone    B-B-B-B-Bad    B-B-B-B-Bad    B-B-B-B-Bad    Bad to the bone
