artist,title,lyric
  Hanson  ,If Only,"Well every single time I see you I start to feel this way It makes me wonder if I am ever gonna feel this way again. There's a picture tearin in the back of my head I see it over and over I wanna hold you and love you In my arms and then I wanna need you cuz I need to be with you till the end Then I hear myself reply ""You've got to hold it in"" this time tonight  If only I had the guts to feel this way, if only you'd look at me and want to stay, if only I could take you in my arms and say, I won't go cuz I need you  Sit here waiting, wondering, hoping that I'll make this right Cuz all I think about is your hands, your face and all these lonely nights There's a feeling screaming in the back of my head Saying it over and over I wanna hold you and love you In my arms and then I wanna need you cuz I need to be with you till the end Then I hear myself reply ""She'll never let you in"" this time tonight  If only I had the guts to feel this way, if only you'd look at me and wanna stay, if only I could take you in my arms and say, I won't go cuz I need you I wanna hear you say it'll always be this way  And we'll be hand in hand for everynight and everyday I wanna scream and shout cuz rules are never doubt And all I care about is you and me and us and now If only I had the guts to feel this way, if only you'd look at me and wanna stay, if only I could take you in my arms and say, I won't go cuz I need you  Please don't go cause I need you now Yeah. Cuz I need you If only, yeah cuz I need you now If only cuz I need you, I need you If only , cuz I need you If only cuz I need you If only, yeah, if only... I need you now....yeah"
  The Cure  ,Boys Don`t Cry,I would say I'm sorry If I thought that it would change your mind But I know that this time I've said too much Been too unkind I try to laugh about it Cover it all up with lies I try and Laugh about it Hiding the tears in my eyes 'cause boys don't cry Boys don't cry I would break down at your feet And beg forgiveness Plead with you But I know that It's too late And now there's nothing I can do So I try to laugh about it Cover it all up with lie I try to laugh about it Hiding the tears in my eyes 'cause boys don't cry boys don't cry I would tell you That I loved you If I thought that you would stay But I know that it's no use That you've already Gone away Misjudged your limits Pushed you too far Took you for granted I thought that you needed me more Now I would do most anything To get you back by my side But I just Keep on laughing Hiding the tears in my eyes 'cause boys don't cry Boys don't cry
  Stone Temple Pilots  ,Between The Lines,"Lovely disguise, read between the lines You rock the magic plane with no abbreviation Three, four you sell what you bought And there ain't no magic pen to get back what you lost  I like it when we talk about love  I like it when we talk about love You always were my favorite drug Even when we used to take drugs  Even when we used to take Even when we used to take Even when we used to take Even when we used to take  Penguins don't fly Crocodile Sunday smile Really like to fish but don't like superficial people Shoe store heard it all before From pearly whites to pearly gates What do we have to argue 'bout  I like it when we talk about love I like it when we talk about love You always were my favorite drug Even when we used to take drugs  Even when we used to take Even when we used to take Even when we used to take Even when we used to take  Leave me all alone before (Get out the way) Never did what she was told (Get out the way) Seems to play at time of war (Get out the way) Less is big and listens more?  Lovely disguise, read between the lines You rock the magic plane with no abbreviation Three, four you sell what you bought And there ain't no magic pen to get back what you lost  I like it when we talk about love  I like it when we talk about love You always were my favorite drug Even when we used to take drugs  Even when we used to take Even when we used to take Even when we used to take Even when we used to take"
  러브홀릭  ,Magic,Dreaming life 뭘 대체 원하니 비춰진 너를 믿지마 끌리는 대로 널 맡겨봐 자 눈을 감아 it's my magic 고갤 들어봐 놀라지마 지금부턴 맘 먹은 대로 다 할 수 있어 I'll never let you let you let you go 너의 눈을 버려 맘의 눈을 뜨는 거야 I'm gonna get you get you get you 나 스카이 보들 타고 자유롭게 날고 있어 Now I got you~  Higher life 참 대체 뭐라니 끝없는 계단 위에서 거칠은 숨만 내쉬는거니 자 나를 봐봐 it's my magic 눈을 열어봐 놀라지마 이제부턴 맘 먹은대로 다 할 수 있어 I'm just I can I can I can 나 이젠 너를 버려 변신 로봇되는 거야 I'm flying higher higher higher 나 스카이 보들 타고 너를 향해 가고 있어 I'll never let you let you let you go 너의 눈을 버려 맘의 눈을 뜨는 거야 I'm gonna get you get you get you 널 향해 가고 있어 I got you I got you I got you I'll never let you let you let you go 너의 눈을 버려 맘의 눈을 뜨는 거야 I'm gonna get you get you get you 나 스카이 보들 타고 자유롭게 날고 있어 Now I got you~
  The Stone Roses  ,Shoot You Down,You know it You show it And the time has come To shoot you down What a sound  When the day is done And it all works out I’d love to do it and you know you’ve always had it coming  You know it You show it And the time has come To shoot you down What a sound  When the day is done And it all works out  I’d love to do it and you know you’ve always had it coming  I never wanted The love that you showed me It started to choke me And how I wish I’d said No too slow I couldn’t take That too fast  I want you to know  You know it You show it But I can’t back down It’s far too late I can’t wait Now the time has come It’ll all work out And when this Thing is done It’ll leave no doubt  So when you’ve Had your fun Will you all walk out?  I’d love to do it and you know you’ve always had it coming I’d love to do it and you know you’ve always had it coming I’d love to do it and you know you’ve always had it coming
  뮤즈에로스  ,Black Rock N Roll,오늘의 증시하락 물가 높낮이 투자의 이자률 오늘의 환률 상황 그것은 삶을 풍족하게 하지 그러나 모두 함 잊어봐  : BLACK ROCK' & ROLL 신나게 모두다 어깨를 흔들며 웁스~ 춤춰봐. 모든 근심 걱정은 인생의 한 장면 걱정은 너만의 것~ 아니야  BLACK ROCK' & ROLL -뮤즈에로스 2집 -어머니의 땅 (89’)- 작곡 / 작사 : 심 상 욱  오늘의 개헌이 미래의 나의 입지 코메디언이 아닌 것이 힘을 아 딸랑‘ 딸랑’ 그것이 목표는 아니겠지 그러나 모두 벗어봐.  : B R & R 신나게 모두다 어깨를 흔들며-웁스~ 춤춰봐. 모든 근심 걱정은 인생의 한 장면 걱정은 너만의것~ 아니야  모두가 자기욕심에 도취가 되어 서로를 슬프게하지 다벗어봐 다시한번 생각 해보자고  오늘의 성경말씀 골목대장 되지 말고 헐벗은 자 위하여 십일조를 써보자고 그것만이 하늘에 뜻은 아니겠지.. 그러나 난 왜 이럴까? ( 출처 : 가사집 http://gasazip.com/370610 )
  Guns N` Roses  ,Madagascar,I won't be told anymore That I've been brought down in this storm And left so far out from the shore That I can't find my way back my way anymore Oh no I won't be told anymore That I've been brought down in this storm And left so far out from the shore Oh that I can't find my way back my way anymore Oh no I  Forgive them that tear down my soul Bless them that they might grow old And free them so that they may know That it's never too late For the many times what seemed like a memory I've searched and found the ways you used to lure me in I found the way oh why it had to be Mired in denial and so afraid If we ever find it's true That we have the strength to choose Our freedom or the chains We held together  I'm gonna tell you a story Stand up for righteousness What Stand up for justice What Stand up for truth How can a person grow up with all this around them You got to call on that something Where does it come from That can make a way out of no way All this hatred What we've got here is Fear That power that can make a way out of now no way Failure to communicate I tell ya I seen the lightning I've heard the thunder roll Everybody's acting like we can do anything and it don't matter what we do Maybe we gotta be extra careful because maybe it matters more than we even know Sometimes Hatred isn't somethin' you're born with I feel discouraged It gets taught Sometimes I feel discouraged I felt this fear He promised never to leave me never to leave me alone no never alone no never alone Let's get something straight alright Promised never to leave me This whole thing was fucked up Never to leave me alone All men betray All lose heart I don't want to lose heart I want to believe Together at the table of brotherhood I have a dream Free at last Free at last Thank God almighty WE ARE FREE AT LAST I won't be told anymore That I've been brought down in this storm And left so far out from the shore That I can't find my way back my way anymore Oh no I won't be told anymore That I've been brought down in this storm And left so far out from the shore That I can't find my way back my way anymore
  Feist  ,My Moon My Man (Grizzly Bear Remix),"My moon, my man So changeable and Such a loveable lamb to me My care, my coat Leave on a high note There's nowhere to go but on Heart on my sleeve Not where it should be The song's out of key again My moon's white face What day and what phase It's the calendar page again Take it slow Take it easy on me And shed some light Shed some light on me please Take it slow Take it easy on me And shed some light Shed some light on me please My moon and me Not as good as we've been It's the dirtiest clean I know My care, my coat Leave on a high note There's nowhere to go There's nowhere to go Take it slow Take it easy on me And shed some light Shed some light on me please Take it slow Take it easy on me And shed some light Shed some light on me please My moon my moon my man My moon my moon my man My moon my moon my man My moon my moon my man"
