artist,title,lyric
  태민 (TAEMIN)  ,거절할게 (Wicked),Oh Baby I know 넌 짓궂은 장난뿐인 그 말투 아파 넌 예쁘지만 얄미운 Devil 넌 나를 밀고 당기고는 또 밀고 아주 그냥 쉽지 Doo wop doo wop 제발 인정해 너는 항상 그런 Doo wop doo wop 식이었어 어느 날 아주 우연한 척 나타나 내 눈에 뿌린 너의 Crazy magic sugar Crazy magic sugar 난 눈이 멀고 세상에 오직 너 밖에 모르게 됐는데 오 너는 또 다른 생각해 이런 식이면 Let me go Let me go 거절할게 근데 용기 따윈 안 나지 이미 네게 길들여졌지 난 알아 난 너의 장난감 Woo woo 제일 좋아하는 Woo woo Let me go 날 영원히 가지고 놀 거란 걸 That's the way you want it 날 영원히 가지고 놀 거란 걸 That's the way you like it You gotta show me 네 마음을 네 진심을 딱 한 번도 안 보이던 나의 주인 나의 잔인한 연인 넌 내 맘 알 듯 모를 듯 애매한 그 표정뿐이지 Doo wop doo wop 제발 인정해 너는 항상 그런 Doo wop doo wop 식이었어 매일 밤 잠든 나의 꿈에 나타나 내 눈에 뿌린 너의 Crazy magic sugar Crazy magic sugar 난 눈이 멀고 세상에 오직 너 밖에 모르게 됐는데 오 너는 또 다른 생각해 이런 식이면 Let me go Let me go 거절할게 근데 용기 따윈 안 나지 이미 네게 길들여졌지 난 알아 난 너의 장난감 Woo woo 제일 좋아하는 Woo woo Let me go 날 영원히 가지고 놀 거란 걸 It's the way you want it want it want it Baby baby come and get it get it get it It's the way you like it like it like it Come on baby 이제 그만 거절할게 도망 가려 해 널 떠나려 해 행복하지 않은 이 멍청한 사랑 난 끝낼래 아무리 나 마음먹으려 해도 생각대로 안돼 아직도 난 네가 좋아 이런 식이면 Let me go Let me go 거절할게 근데 용기 따윈 안 나지 이미 네게 길들여졌지 난 알아 난 너의 장난감 Woo woo 제일 좋아하는 Woo woo Let me go 날 영원히 가지고 놀 거란 걸 That's the way you want it 날 영원히 가지고 놀 거란 걸 That's the way you like it 날 영원히 가지고 놀 거란 걸
  SHINee (샤이니)  ,Dream Girl,SHINee's Back 어디서부터 시작됐는지 그게 중요한 게 아냐 지금 내 눈엔 너무 완벽한 네 모습만 보이는 걸 회색 빛 이 세상에 네 입술만 붉게 빛나 입을 맞추려던 그 순간 또 꿈에서 깨네 에 아직도 네 얼굴이 이렇게 생생한데 잡았던 손의 온기가 이렇게 따스한데 밤이면 내게 다가와 아침이 되면 사라져 매일 이렇게 똑같이 너를 보낼 순 없는데 Baby 모두 꿈인 걸 알지만 Baby 오 제발 날 떠나지 말아 Dream Girl 손에 잡힐 듯 잡히지 않는 Dream Girl 매일 밤 이렇게 널 기다려 Dream Girl 달콤히 사랑을 속삭이고 아침이 되면 사라질 Dream Girl 잠깐만 멈춰서 이건 꿈이 아닌데 눈부신 그 미소 이건 네가 확실해 심장이 날 시켜 몰래 너를 따라가 코너를 돈 순간 꿈처럼 넌 사라져 Oh 꿈 속의 네 얼굴이 매일 밤 똑같은데 좀 더 가까워질 때도 이젠 된 것 같은데 살짝 미소만 흘리고 그대로 너는 사라져 매일 이렇게 똑같이 너를 보낼 순 없는데 Baby 모두 꿈인 걸 알지만 Baby 오 제발 날 떠나지 말아 Dream Girl 손에 잡힐 듯 잡히지 않는 Dream Girl 매일 밤 이렇게 널 기다려 Dream Girl 달콤히 사랑을 속삭이고 아침이 되면 사라질 Dream Girl 너 없는 하루가 두려워 내일이면 또 잊겠지만 애타게 붙잡아봐도 아무런 약속 없이 넌 내 곁을 떠나 그대 눈빛 그대 입술 보는 느낌 You're so beautiful 한 순간도 네게 눈을 뗄 수 없어 그 어떤 표현도 너한테는 뺄 수 없어 머리부터 발끝까지 그댄 One and only girl 하나부터 백까지 부드럽게 대하지 그대가 날 택하는 날에 이 세상은 Stop You're my world Dream Girl 손에 잡힐 듯 잡히지 않는 Dream Girl 매일 밤 이렇게 널 기다려 Dream Girl 달콤히 사랑을 속삭이고 아침이 되면 사라질 Dream Girl Dream Girl 손에 잡힐 듯 잡히지 않는 Dream Girl 매일 밤 이렇게 널 기다려 Dream Girl 우리의 사랑을 기억하고 밤이 깊으면 찾아올 Dream Girl
  카라  ,Beautiful Night,Oh beautiful night Nothing too special Break away But no no no no Break a heart so toc toc toc toc 다시 날 채울 자극이 필요해 Hot Place 심장이 두근두근 I Can't stop 난 멈출 수 없는 이곳 I don't care 시선은 벗어 버려 So I want Saturday night Hot Place 더 이곳에 몸을 던져 Oh Oh Oh No Oh Oh Oh One step 더 가까이 나를 맡겨 Oh Oh Oh Oh Oh Oh BE BE BE BE BE BE BE BE BE BE Nothing at all No No No No No Know 남들의 시선 들을 더 더 더 더 더 더 느끼며 또 흔들어 Break It Out You know know know know Break It Off You talk talk talk talk 멈춰버린 이곳에 I just go on Hot Place 내가 숨쉬는 이곳 I can't stop 멈출 순 없어 Tonight I don't care 시선을 즐기면서 So I want Saturday night Hot Place 더 이곳에 몸을 던져 Oh Oh Oh 너 Oh Oh Oh One step 더 가까이 나를 맡겨 Oh beautiful night 난 내 식대로 Nothing too special Oh beautiful night Oh beautiful night it's such a beautiful night 이대로 그냥 party till the sun rise 잠이 안 와 there aint no tomorrow so 절대 멈추지마 wanna dance wanna play 내가 원하는대로 다 해 바로 이순간 지금 이곳에 oh 아름다운 밤이에요 Hot Place 더 이곳에 몸을 던져 Oh Oh Oh No Oh Oh Oh One step 더 가까이 나를 맡겨 Oh Oh Oh Oh Oh Oh BE BE BE BE BE BE BE BE BE BE Nothing at all No No No No No Know 남들의 시선 들을 더 더 더 더 더 더 느끼며 또 흔들어
  태민 (TAEMIN)  ,최면 (Hypnosis),이제 잠이 들 거야 깊은 꿈속에 빠져들게 날 놔 줘 고요한 심연 속에 몸을 누이고 기억의 회로를 지워 머릿속 그 장면마다 네 추억인데 너 아닌 시간들은 없는 것 같아 가슴속 비밀노트를 꺼내 보아도 너에 대한 이야기로만 빼곡한데 눈을 뜨면 언제나 다시 제자리인 걸 너를 잊는 최면을 걸어 너무 보고 싶어서 현실로 또 돌아와도 여전히 너잖아 그래도 너잖아 우리 둘 눈부시게 아름다웠던 추억은 비워내도 다시 채워져 도무지 끝이 안 날 것만 같은데 견딜수록 더욱 아파져 네 생각에 눈을 뜨면 언제나 다시 제자리인 걸 너를 잊는 최면을 걸어 너무 보고 싶어서 현실로 또 돌아와도 여전히 너잖아 이렇게 나 간절한 적 없었는데 너를 잡지도 떠나지도 못해 깨어봐도 여긴 너의 그늘 아래야 사실 깨고 싶지 않은 걸까 이겨낼 수 없나 봐 결국 할 수 없나 봐 나는 너란 최면에 걸려 잊을 수가 없나 봐 풀 수 있는 단 한 사람 오로지 너잖아 너밖에 없잖아
  소녀시대-Oh!GG  ,몰랐니 (Lil` Touch),몰랐니 네 맘이 날 원하잖니 서둘러 내게 빨리 Lalalalala 빨리 Lalalalala 몰랐니 네 맘이 날 원하잖니 서둘러 내게 빨리 Lalalalala 빨리 Give me a lil’ touch I just wanna kiss boy 자 미리 하는 경고 계속 게임만 할 거라면 너의 술래가 되어줄게 바로 지금이야 my boy 망설이지 말고 천천히 나를 따라와 봐 이제 더 이상 도망칠 수 없어 Won't you give it up give it up to me baby give it up 마지막 기회야 몰랐니 네 맘이 날 원하잖니 서둘러 내게 빨리 Lalalalala 빨리 Lalalalala 몰랐니 네 맘이 날 원하잖니 서둘러 내게 빨리 Lalalalala 빨리 Give me a lil’ touch 점점 더 달아올라 터질 듯 해 3 2 1 off 날 잡을 순 없지 손쉽게 잡힐 내가 아니지 L O V E nah 진짜를 보여줘 시작이야 my boy 서두르지 말고 좋아 진짜는 이제부터 더 가까이 내게 다가올래 지금부터 my boy 봐주지도 말고 가까이 나를 따라와 봐 이제 내게서 벗어날 수 없어 Won't you give it up give it up to me baby give it up 마지막 기회야 몰랐니 네 맘이 날 원하잖니 서둘러 내게 빨리 Lalalalala 빨리 Lalalalala 몰랐니 네 맘이 날 원하잖니 서둘러 내게 빨리 Lalalalala 빨리 Give me a lil’ touch 더 은밀하게 널 파고들어 짙은 어둠처럼 짙은 어둠처럼 더 은밀하게 널 파고들어 짙은 어둠처럼 짙은 어둠처럼 몰랐니 네 맘이 날 원하잖니 서둘러 내게 빨리 Lalalalala 빨리 Lalalalala 몰랐니 네 맘이 날 원하잖니 서둘러 내게 빨리 Lalalalala 빨리 Give me a lil’ touch Give me a lil’ touch
  에이프릴 (APRIL)  ,Hey Yo Hey,갑자기 눈빛이 왜 그래 딴 데 봐요 부담돼요 안 하던 친절도 안 편해 괜히 시간 낭비 마요 가벼운 호기심에 그래 그럴 수도 있어 아무리 그래도 난 정말 변해버린 네 행동 이상해 어색해 불편해 눈치 보지 말고 그렇게 해요 Hey yo hey 그냥 하던 대로 아무렇게나 Hey yo hey yo 어차피 남자는 다 변해 괜히 처음만 잘하고 다 변해 신경 쓰지 말고 마음껏 해요 Hey yo hey yo 이 가방 내 건데 왜 들어 저리 가요 안 무거워 우리 집 가는 길 왜 네가 네가 훨씬 더 무서워 어쩌다 착각해서 그래 그럴 수도 있어 아무리 그래도 난 정말 변해버린 네 표정 이상해 어색해 불편해 눈치 보지 말고 그렇게 해요 Hey yo hey 그냥 하던 대로 아무렇게나 Hey yo hey yo 어차피 남자는 다 변해 괜히 처음만 잘하고 다 변해 신경 쓰지 말고 마음껏 해요 Hey yo hey yo 어디가 좋은지 제대로 설명해 아니 왜 말 못 해 거봐 답답해 왜 자꾸 맘대로 너 내키는 대로 말고 정말 진심이라면 확실하게 말해 Hey yeah 계속 잘해요 Hey yo hey 눈치 보지 말고 눈치 보지 말고 표현을 해요 Hey yo hey yo 어차피 여자는 다 원해 진짜 뻔한 사랑을 다 원해 신경 쓰지 말고 마음껏 해요 Hey yo hey yo Hey yeah
  동방신기 (TVXQ!)  ,Destiny,카에리따이 나가이 요루니 보쿠노 무네와 마다 마욧떼이루 카에레나이 아와이 아사니 츠게따 치카이 우소니 나루까라  아노 고로노 보쿠라노 카게가 이마 타치아가리 우고키다스 You know that I'm still waiting for you  Another day、Another night 미라이와 소코니 타치토맛떼 이루케레도 Now living without your love 키미노 후루에루 카타오 오모이다시떼와 이이키카세떼루 이마다케가 세츠나이 My destiny  와스레따이 키미노 히토미 키미노 나미다 키미노 타메이키오 와스레나이 링구 하즈시 기모치 카쿠시 스고스 마이니치 코코로다케 사켄데이루요 모- 이치도다케 츠따에타이  You know that my heart's beating for you Another way、Another line 에이엔난떼 신지떼이따 아오이도키 But Living without your lie 키미토 마와리미치데모 테오 토리앗떼 아루키타캇따 오모이데또 토케아우 My destiny  후타리데 이레바 카제모 나미모 쿠모모 코에라레루 키가시따 카나우나라 One more chance 지칸오 코에 토비타이 Spread my wings 우마레 카왓떼모 무스바레누 오모이나라바 So Living without your me 키미또 유메데 아에타라 소레다케데 이이 소레다케가 이이  이타미사에 우밧테 Another day、Another night 이마와 후타리데 소레조레노 미치오 스스무 Now Living without your love 키미노 유레루 마츠게오 오모이다시떼와 이이키카세테루 이마다케가 세츠나이 My destiny -
  비투비  ,Complete (Intro),깨지지 않는 내가 만들어 가는 길 확신도 못 해 약속도 못 해 Oh oh 그 누구도 정해주진 않아 쓰러져도 상관없어 Complete 내가 보여줄게 모든 게 사라져도 우린 포기하지 않아 내 안의 Complete 피하지 않겠어 내 안의 Complete 멈출 수 없잖아 끝이 없는 어둠 끝에 내가 서 있을게 어디든 함께 가자 Oh oh oh oh complete 쉽진 않겠지 너와 내가 꿈꾸는 길 답 없는 문제 어쩔 수 없는 시작이야 후회해도 좋아 쓰러져도 상관없어 Complete 모두 보여줄게 모든 게 사라져도 우린 포기하지 않아 내 안의 Complete 피하지 않겠어 내 안의 Complete 멈출 수 없잖아 끝이 없는 어둠 끝에 내가 서 있을게 어디든 함께 가자 Oh oh oh oh complete Oh no matter 남자는 때로 용기를 내야지 남들보다 두 배로 어이어이 거기 가만있는 것보다 Better 나랑 클래스 있게 가자 바짝 붙어 그대로 낭만과 현실의 저울질 중심을 잡아 사념은 버리기 지나고 보면 다 귀엽지 추구해라 너의 별을 낭중지추 내 안의 Complete 피하지 않겠어 내 안의 Complete 멈출 수 없잖아 끝이 없는 어둠 끝에 내가 서 있을게 어디든 함께 가자 Oh oh oh oh complete Prep complete we just killed the beat Who are we we’re BTOB Just in case you missed I’ll repeat it for you one more time We are BTOB
  GOT7 (갓세븐)  ,HEY,난 이해가 안 돼 하필 왜 그 앤데 니가 고른 사람 huh 여잔 나쁜 남자에 끌린다는 그 말에 설마 했는데 니 얘기네 대체 걔가 뭐가 좋아 내가 볼 땐 너를 좋아 하는 것 같지 않은데 왜 모르는데 너만 빼고 다 아는데 매일 속상해하는 타임라인 툭하면 번져있네 또 아이라인 왜 bye bye 하지 굳이 만나 못 참겠어 전해줘 I’m so mad at you HEY 너말야 조심해 너 조심해 곁에 그녈 더 아껴 HEY 너말야 긴장해 좀 긴장해 내가 그녈 뺏을지도 몰라 HEY 너에게는 과분 HEY 너 정말로 경고 HEY 또 울리면 가만 안 둬 bad boy HEY 너에게는 과분 HEY 너 정말로 경고 HEY 또 실수해 HEY be a MAN 뭣도 아닌 것이 여자 앞에서만 센 척 소문났어 어장관리 적당히 해 fake love Fan club 같이 영원할 것 같냐 그러다 확 내가 뺏어 She deserves to be loved 머리부터 발끝까지 LOVELY 너는 loveless 니가 던지는 건 마음 아닌 미끼 그저 낚싯대를 고르지 oh 정말 사람 볼 줄 몰라 절대 걔는 너를 몰라 주는 것 같기만 한데 왜 그러는데 너를 아프게 하는데 이러긴 싫었지만 행복을 빌었지만 이건 아니잖아 no HEY 너말야 조심해 너 조심해 곁에 그녈 더 아껴 HEY 너말야 긴장해 좀 긴장해 내가 그녈 뺏을지도 몰라 그 애가 너무 힘든데 해줄 게 너무 없네 고작 난 이렇게 화내는 것 밖엔 whoo 이럴 거면 왜 시작했어 자꾸 괜찮대 또 울면서 더 못 봐주겠어 HEY 너말야 조심해 너 조심해 곁에 그녈 더 아껴 HEY 너말야 긴장해 좀 긴장해 내가 그녈 뺏을지도 몰라 HEY 너에게는 과분 HEY 너 정말로 경고 HEY 또 울리면 가만 안 둬 bad boy HEY 너에게는 과분 HEY 너 정말로 경고 HEY 또 실수해 HEY be a MAN
  보아 (BoA)  ,Let Me,따라하지마 그러다가 다친다 리듬에 몸을 맡긴 난 Fabulous 흠뻑 젖은 내 몸이 말을 하지 You can't copy my swagger 내 다리는 비트를 느끼고 물처럼 흐르는 멜로디에 하나둘씩 잘 지켜봐 My step moves ma ma ma my step moves ma ma my step moves My favorite music is playing in this club 심장은 비트를 따라가고 이대로 날 지켜봐 나의 무대에 정신없는 너의 눈동자가 날 따라오네 눈이 즐겁니 날 알아 보겠니 음악을 따라가 내몸을 난 따라가 이제 내가 여기서 나만의 무대를 위해 Oh Oh Oh Oh Oh Oh Oh Oh Oh Oh 애처로워 너의 눈빛 Oh Oh Oh Oh Oh Oh Oh Oh Oh Oh 너는 불안해지지 Oh Oh 내 모든 것 Oh Oh 모든 움직임이 내 말을 대신해 즐기는 내 모든것이 My dictionary 하나 둘씩 꺼내서 만든 나의 stage Can't deny my perfection 내가 하고싶은 모든걸 이렇게 거부감 없이 너에게로 다가가지 한걸음씩 1 2 step oh My step moves ma ma ma my step moves ma ma my step moves My favorite stage just started it's show time 흡수되는 이 음악에 널 느껴봐 바로 지금 이렇게 나의 앞에서 정신 없는 너의 눈동자가 날 따라오네 나의 모든걸 바라보고있니 음악을 따라가 내몸을 난 따라가 누가뭐라해도 won't stop 이제 시작일뿐야 Oh Oh Oh Oh Oh Oh Oh Oh Oh Oh 애처로워 너의 눈빛 Oh Oh Oh Oh Oh Oh Oh Oh Oh Oh 너는 불안해지지 Oh Oh Oh I'll how you what is different between you you you and me I'll how you what is different between you you you and me Oh Oh Oh Oh Oh Oh Oh Oh Oh Oh Can you feel what I'm trying to say Oh Oh Oh Oh Oh Oh Oh Oh Oh Oh You can't copy my swagger  You can't copy my swagger
  업텐션 (UP10TION)  ,Dream You,헤어진 지 하루 이틀 지났을 뿐인데 옆에 있는 것처럼 더욱 선명하게 보여 너 어떻게 널 잊어 지워 오늘 밤이 지나면 꼭 너 돌아와 웃어줄 것 같은 밤이야 하늘은 유난히 파란색 오늘따라 힘드네 너와 했던 이런저런 추억들 아름답던 기억들이 나를 괴롭혀 오늘따라 많이 힘드네 넌 잘 지내겠지 이제 모두 잊었겠지만 난 아직 그 속에 갇혀 살아 I know 이제 와서 후회해 눈물이 나 나도 모르게 커져가는 시계바늘 소리에 잠이 오질 않아 나를 괴롭히는 네가 뒤로 누워봐도 눈을 감아봐도 계속 나타나 내가 미쳤나 봐 내가 이럴 줄 알았어 후회해 너를 잡을 걸 그랬어 돌리려 해도 어찌해보려 해도 이제는 늦은 걸 알아 Baby I missing you Falling in love with you 너 언제든 돌아와 줄래 기다리는 나에게로 다시 Baby 나 only you 난 오직 너 하나뿐이야 한 번 더 보고 싶어 너의 웃고 있는 얼굴 Baby Baby 그려보려 해도 자꾸 희미해져 가는 아름다운 눈 코 입술 얼굴 조금 조금씩 잊혀져 가 나를 모르겠어 in dream 꿈속에선 너 떠올라 한시도 살 수 없을 것만 같은데 다 같은 말 같은 생각으로 차갑게 변한 나 손댈 수도 없이 멀어져 버린 우리 사이 똑같잖아 더 꽉 잡아 보려 해도 멀어진 꿈 돌이킬 수 없단 걸 알면서도 놓지 못할 뿐 잘 지내나 봐 SNS에 남긴 말 내가 없어져도 너는 괜찮을 것만 같아 요즘 바보처럼 웃고 다녀 누가 볼까 해서 주위 사람들이 너를 욕할까 봐 그냥 웃어 아프잖아 떠나간 빈자리가 커서 그래 채워지지 않아 뭐를 해도 그래 또다시 한 번 더 기회를 주겠다면 다시 너를 놓지 않아 never 나는 절대 널 애써 기다려 널 애써 믿어봐 널 한 번은 생각하겠지 너도 날 찾겠지 해 매일 밤에 네가 내 꿈속에 찾아오듯이 Baby I missing you Falling in love with you 너 언제든 돌아와 줄래 기다리는 나에게로 다시 Baby 나 only you 난 오직 너 하나뿐이야 한 번 더 보고 싶어 너의 웃고 있는 얼굴 Baby Baby
  여자친구 (GFRIEND)  ,Bye,안녕 아직은 배우지 못한 말 하나 이제 조금씩 알 것 같아요 혼자 기다리다 숨죽여 울먹이는 내 모습 아직 어리기만 감당하지 못하겠어요 믿어지지 않아서 내게 유일했던 너의 그 위로들이 저기 저 구름 뒤로 사라져 그만 이 별들아 나를 도와줘요 you're my sky 영원히 이게 끝이 아니길 나에게는 우리 추억이 잊지 못할 선물 같아 널 만나고 싶어 볼 수 없다 해도 어디선가 나를 감싸줄 너의 기억 힘든 내색 하나도 없이 웃어주던 그 모습 적어도 내게는 말해주지 왜 그랬어요 꿈이라고 말해줘 내게 소중했던 너의 그 약속들이 저기 저 구름 뒤로 사라져 그만 이 별들아 나를 도와줘요 you're my sky 영원히 이게 끝이 아니길 나에게는 우리 추억이 잊지 못할 선물 같아 널 만나고 싶어 되돌리고 싶어 이뤄지지 않을 거란 걸 알고 있어 날 돌아보지 말아요 참아왔었던 눈물이 쏟아져 버릴 때 나는 괜찮으니까요 이별이 불어오는 곳으로 더욱 더 높이 저 멀리 알아줘요 I don't wanna cry 내 사랑은 어디 가지 않아요 영원히 너의 그 마음을 언제까지 기억할게 보고 싶을 거야 내 곁에 없어도 어디선가 나를 감싸줘 이젠 안녕
  동방신기 (TVXQ!)  ,비누처럼 (Like a Soap),전화기 너머 넌 화가 나 있지 그 자식 대체 무슨 말을 한 건지 넌 한참 싸운 얘기를 털고선 조금은 후련해진 건지 웃어 정말 평범한 목요일 밤 난 언제나처럼 전화를 붙잡고 너의 가장 편한 친구 정도로 그래 가장 가까운 어디쯤에 비누처럼 자릴 채워 Ah 마음이 아파 Oh Why 왜 못 보는 거야 너의 작은 방 네 맘 속에 가장 특별한 구석 거기에 앉고 싶어 Ah 너만 보는데 Oh Why 왜 아직 몰라 더 이상 존재감 없는 하얀 비누처럼 놓여 있기는 싫어 여긴 이렇게 속 타는데 넌 하품까지 섞인 목소리 난 오늘도 영 못 잠들겠는데 너는 안녕 잘자 그렇게 말해 꿈 속에도 보고 싶어 Ah 마음이 아파 Oh Why 왜 못 보는 거야 너의 작은 방 네 맘 속에 가장 특별한 구석 거기에 앉고 싶어 Ah 너만 보는데 Oh Why 왜 아직 몰라 더 이상 존재감 없는 하얀 비누처럼 놓여 있기는 싫어 점점 굳어 가나 봐 내 맘이 조각나나 봐 이렇게 지내다간 정말 우리 안돼 이젠 기다릴 수 없어 Ah 마음이 아파 Oh Why 왜 못 보는 거야 너의 작은 방 네 맘 속에 가장 특별한 구석 거기에 앉고 싶어 Ah 너만 보는데 Oh Why 왜 아직 몰라 더 이상 존재감 없는 하얀 비누처럼 놓여 있기는 싫어
  보이프렌드  ,그 곳에 (Standing With U),달이 뜬다 별이 뜬다 까만 밤 하늘을 비춘다 니가 떠올라 나를 깨운다 잔잔히 내 가슴에 흘러 천천히 내 기억을 들춰 한 줄 빛으로 너에게 이어져 나를 데려다 주잖아 너라는 세상 그 안에 나 서있어 추억 속을 헤매이면서 난 너의 향기를 또 느낀다 넌 그곳에 서서 나를 또 불러낸다 나를 보고 슬퍼는 말라고 너의 바람이 내 얼굴을 만지고 간다 나를 본다 너를 본다 기억 너머 맘을 흔든다 니가 차올라 나를 태운다 찬찬히 그 시간을 훑어 조금씩 내 감정을 적셔 낡은 인연의 끈으로 되살려 네게 데려다 주잖아 너라는 세상 그 안에 나 서있어 추억 속을 헤매이면서 난 너의 향기를 또 느낀다 넌 그곳에 서서 나를 또 불러낸다 나를 보고 슬퍼는 말라고 너의 바람이 내 얼굴을 만지고 간다 My love my all 내 안에 숨은 힘 어떻게 잊겠어 널 지울 수 있겠어 my life and you're my light 너는 깊은 마음 속 울림 날 깨우고 날 이끌어 이게 꿈이면 깨지 않기를 너에게 끌려 이끌려 난 걸어가 니 느낌을 되살려 주잖아 그리움 다독여 주잖아 넌 그곳에 서서 나를 또 불러낸다 나를 보고 슬퍼는 말라고 너의 바람이 내 얼굴을 만지고 간다
  XIA (준수)  ,Reach,널 보냈던 날 그래 그날 뭔가에 홀린 듯한 알 수 없는 생각에 그만 널 놓아버렸어 이젠 끝이라고 그 말 한마디 내가 미쳤지 담을 수 조차 돌이킬 수 없는 홧김에 바보짓을 해버렸어 나 진심 아닌데 다 거짓말이야 이 노랠 들어줘 내 맘을 알아줘 내 눈을 바라봐줘 넌 알고 있잖아 네 마음에 상처 씻을 수 있다면 때늦은 후회지만 온 몸을 다해 외쳐 너 뿐이라고 행복했던 지난 시간들 처음부터 끝까지 함께 했던 누구보다 완벽한 반쪽이야 온통 우리 둘 이런 사랑 다시는 못해 찬란했던 흔적의 발걸음을 어리석게도 다 지워버렸어 이게 아닌데 이젠 혼자야 이 노랠 들어줘 내 맘을 알아줘 내 눈을 바라봐줘 넌 알고 있잖아 네 마음에 상처 씻을 수 있다면 때늦은 후회지만 온 몸을 다해 외쳐 너 뿐이라고 핸드폰 사진첩에도 집안 구석 어딜 봐도 하염 없이 길을 걸어도 온통 너인데 왜 난 이제서야 정말 바보야 Woo 제발 이 노랠 들어줘 내 맘을 알아줘 내 눈을 바라봐줘 넌 알고 있잖아 네 마음에 상처 씻을 수 있다면 때늦은 후회지만 온 몸을 다해 외쳐 너 뿐이라고
