artist,title,lyric
  동방신기 (TVXQ!)  ,지금처럼,부서진 나의 작은 가슴으로 이제는 내 모든 것을 말 할 수 있어 사랑의 시작을 내게 가르쳐준 그대를 다시 보내고 싶진 않아  한참 네게 모질게도 굴던 내겐 너무나 그 다정했던 이별의 말 이젠 나도 변했어 그대 없는 기나긴 매일을 후회 없이 살 수 있을까  길었던 나의 방황의 끝을 이제야 알게 됐어 네가 준 기적 같은 사랑  지금처럼만 Then I will never cry 또 언제까지 내 맘 속에 네가 살수 있게 거친 세상 그 안에서 우리 끝일 수는 없어 I know that we're meant to be  믿을 수 없어 너무나 다른 아침 눈뜨면 나를 기다린 특별한 매일 세월이 흘러가 거리의 색이 바뀔 때쯤 난 다시 웃을 수 있을까  알고 있나요 I've waited for you to share my nights forever so ever 오직 한사람인걸  지금처럼만 Then I will never cry 또 언제까지 내 맘 속에 네가 살수 있게 거친 세상 그 안에서 우리 끝일 수는 없어 I know that we're meant to be  그대 발 닿는 곳에 어디라도 내가 항상 서있을 꺼에요 많은 날들 남아 이별은 아직 이른걸  지금처럼만 then I will never cry 또 언제까지 내 맘 속에 네가 살 수 있게 거친 세상 그 안에서 우리 끝일 수는 없어 이별은 내겐 아직 이른걸  지금처럼만 Then I will never cry 또 언제까지 내 맘 속에 네가 살수 있게 거친 세상 그 안에서 (그안에서) 우리 끝일 수는 없어 I know that we're meant to be -
  나르샤 (Brown Eyed Girls)  ,아는 여자,알고 있나요 그대 보고싶어  종일 기다린 나죠  그저 가벼운 인사란 걸 알면서  그대의 뒷모습을 보면  다시 서운해지죠  듣고 있나요 그댄 모르죠  난 그저 그대의 아는 여자죠  그대 왜 날 못 봐요  언제나 내가 바라보는 곳  그대 밖에 없는데  차라리 내게 잘해주지 마요  그게 난 더 아파요  애써 그대를 잊으려는 다짐도  다정한 그 미소에  그 말투에 난 또 무너져  듣고 있나요 그댄 모르죠  난 그저 그대의 아는 여자죠  그대 왜 날 못 봐요  언제나 내가 바라보는 곳  그대 밖에 없는데  그대 나를 보세요  나의 맘을 보세요  누구보다 그댈 원하는 사람 나인데  듣고있나요 그댄 모르죠  난 그저 그대와 가까운 거죠  그대 왜 날 못봐요  언제나 내가 바라보는 곳  그대 밖에 없는데  느껴지나요 내가 있어요  언제나 나 바람 그대뿐인데  그대 알고 있나요  나의 하루를 채우는 사람  오직 그대라는 것  언제나 내 눈엔 오직 그대만 있죠
  보이프렌드  ,야누스 (JANUS),지금 웃고 있지만 애써 참고 있어 난 떨리는 내 두 손을 힘껏 잡고 있어 난 속고 있는 거야 넌 괜찮다는 내 말에 등 뒤에서 눈물을 모두 쏟고 있어 난 떨리던 작은 어깨가 그 작은 입술이 미안해 내 앞에서 주저 앉는 너 뜨겁던 나를 삼키고 니 눈물 훔치며 미안해 온 힘을 다해 안는 나 너의 어깨 너머 뱉는 한숨 너의 어깨 너머 차오는 눈물 그건 나만 아는 시선에 남긴다 끝까지 너의 기억 안에 살고 싶고 너의 기억 안에 웃고만 싶어 바보처럼 그저 너에게 웃는다 You're not a bad girl You're not a bad girl 날 위한 눈물 그 눈물 거둬 그 애가 다쳐 나 땜에 다쳐 그러니 참고 또 참아야 해 네가 왜 네가 왜 네가 왜 나 땜에 울어 넌 항상 밝게 웃어 왜 울어 잊어 난 다 털고 편하게 떠나 못 믿니 네 발목 잡고 싶지 않아 나의 가슴 깊이 뛰는 심장 나의 가슴 깊이 잡아둔 미련 그건 나만 아는 맘으로 묻는다 끝까지 너의 웃음만을 보고싶고 너의 웃음만은 지키고 싶어 어제처럼 그저 나에게 웃어줘 You're not a bad girl You're not a bad girl 여기 내 심장 내 심장 속에 내 속을 감춰 널 위해 감춰 나를 다잡고 또 잡아야 해 너만이 내 주인이고 원하면 나를 떠날 수 있고 기꺼이 너를 보내 널 위해 나는 널 보내 You're not a bad girl You're not a bad girl 날 위한 눈물 그 눈물 거둬 그 애가 다쳐 나 땜에 다쳐 그러니 참고 또 참아야 해 지금 웃고 있지만 애써 참고 있어 난 떨리는 내 두 손을 힘껏 잡고 있어 난 속고 있는 거야 넌 괜찮다는 내 말에 등 뒤에서 눈물을 모두 쏟고 있어 난
  DIA (다이아)  ,Pick up the phone,Babe 밤새 내가 생각날 걸 uh woo uh woo 넌 분명 내게 전부 반했는걸 uh woo uh woo 떨리는 뭔가가 느껴지지 넌 색다른 나에게 빠져 이미 잡힐 듯 안 잡혀 애가 탈 걸 날 갖고 싶다면 Ringa Ringa Ring 어서 전활 걸어 지금 나를 불러줘 니 맘을 전해줘 baby baby 못 이기는 척하고 네게 안기고 싶어 더는 망설이지 말고 내게 한발 더 다가와 Boy Pick up the phone Pick up the phone Pick up the phone right now Pick up the phone Pick up the phone now Boy Pick up the phone Pick up the phone Pick up the phone right now 더는 망설이지 말고 내게 전화를 걸어줘 Yeah pick it up 말하자면 이상형 네가 말한 대로 꾸며봤어 uh woo uh woo 나 이제 밀당은 그만할래 남자답게 해 날 이끌어줘 투명한 두 눈에 나만 담아 너 아닌척해 봐도 소용없어 망설여진다면 지금이야 내 번호를 눌러줘 Ringa Ringa Ring 어서 전활 걸어 지금 나를 불러줘 니 맘을 전해줘 baby baby 못 이기는 척하고 네게 안기고 싶어 더는 망설이지 말고 내게 한발 더 다가와 Boy Pick it up 눈 감아도 선명해져 Call me up 1분 1초 널 기다려 내게 머문 눈빛 또 나를 부른 목소리 말 안 해도 알겠지 My love my love my love 어서 전활 걸어 지금 나를 불러줘 니 맘을 전해줘 baby baby 못 이기는 척하고 네게 안기고 싶어 더는 망설이지 말고 내게 한발 더 다가와 Boy Pick up the phone Pick up the phone Pick up the phone right now Pick up the phone Pick up the phone now Boy Pick up the phone Pick up the phone Pick up the phone right now 더는 망설이지 말고 내게 전화를 걸어줘 Yeah pick it up
  태연 (TAEYEON)  ,This Christmas,왠지 따뜻했던 그날 밤 눈꽃이 내려앉은 두 볼에 스치듯 가벼운 너의 입술이 난 아직 잊혀지지가 않아 Beautiful night 그날의 널 기억해 마치 시간을 되돌린 듯 날 찾아와주길 Christmas 꿈결같던 Christmas 기억하고 있어 네가 남긴 달콤한 속삭임 커져간 떨림 Oh Christmas 네가 있던 Merry Christmas 영원할 것 같았던 간절한 이 마음을 전해 I pray on This Christmas 문득 생각이나 그날 밤 유난히 따뜻했던 두 손이 얼어붙은 내 맘을 녹여주던 난 왠지 어제처럼 느껴져 Beautiful night 그날의 널 기억해 마치 운명이 우릴 채운 듯 날 찾아와주길 Christmas 꿈결같던 Christmas 기억하고 있어 네가 남긴 달콤한 속삭임 커져간 떨림 Oh Christmas 네가 있던 Merry Christmas 영원할 것 같았던 간절한 이 마음을 전해 I pray on This Christmas 찬란했던 그 겨울 앞에 내가 서있어 다시 찾아온 계절이 너를 반기고 함께 와주길 Christmas 꿈결같던 Christmas 기억하고 있어 네가 남긴 달콤한 속삭임 커져간 떨림 Oh Christmas 네가 있던 Merry Christmas 영원할 것 같았던 간절한 이 마음을 전해 I pray on This Christmas 간절한 이 마음을 전해 I pray on This Christmas
  신화  ,As long as you love me,"As long as you love me As long as you love me -  Although loneliness has always Been a friend of mine l'm leaving my life in your hands People say i'm crazy and that i'm blind Risking it all in a glance  How You got me blind is still a mystery I can't get you out of my head Don't care what is written in your history As long as you're here with me  I don't care who you are Where you're from what you did As long as you love me Who you are where you're from Don't care what you did As long as you love me  Every little thing that you have said and done Feels likely it's deep within me Doesn't really matter if you're on the run It seems likely we're meant to be  I don't care who you are Where you're from what you did As long as you love me Who you are where you're from Don't care what you did As long as you love me  I've tried to hide it so that no one knows But I guess it shows When you look into my eyes  What you did and where you're comin' from I don't care As long as you love me, baby  I don't care who you are Where you're from what you did As long as you love me who you are where you're from Don't care what you did As long as you love me  Who you are where you're from what you did As long as you love me Who you are where you're from As long as you love me  Who you are As long as you love me what you did I don't care As long as you love me -"
  태연 (TAEYEON)  ,U R,오랫동안 내 마음엔 구름 가득 비가 내려 따스한 햇살 비추길 간절히 바랬죠 어깨를 적신 빗방울도 마르면 나만 홀로 남겨질까 너무나도 두려웠죠 그댄 빛처럼 비 갠 뒤처럼 내 마음에 떠오르죠 이렇게 Cause you are 내게 내린 빛과 You are 너무 고운 꿈과 일곱 빛으로 온 세상을 더 아름답게 물들여 언제나 Yeah U R 텅 빈 푸른 언덕 위에 무지개는 지붕이 돼 그 아래 가만히 누워 하늘을 보아요 세상 가장 평온함과 처음 느낀 설렘 누구보다 사랑스러워 고갤 돌리면 그대 미소에 나도 몰래 손을 뻗죠 이렇게 Cause you are 내게 내린 빛과 You are 너무 고운 꿈과 일곱 빛으로 온 세상을 더 아름답게 물들여 언제나 Yeah U R 내 창을 적신 비가 그치면 Under the Rainbow 그대 기다리겠죠 차마 난 하지 못했던 얘기 못했던 그 모든 비밀 오늘은 전하고 싶어 You are 항상 나의 곁에 You are 여린 내 맘 속에 더 눈부시게 아름답게 온 밤하늘을 채우는 You're my star Yeah U R Oh U R U R Oh U R
  더블에스301  ,HELLO MELLO,Just like a Strawberry Ice Cream 새콤달콤 매일이 새로워 제발 꿈이 아니길 오늘도 간절히 기도해요 Just like a Sweet Marshmellow Cream 알콩달콩 동화 속 이야기 변치 않아 Destiny 매일매일 웃게 해줄게 아직 많이 서툰 나인 걸 하지만 용기를 내볼게 조금은 쑥스러워도 오늘만은 별은 지고 세상은 변해도 난 지킬 거야 Every Day and Every Night 넌 이 자리만 지키면 돼 Baby Hello Mello Be My Love 누가 뭐래도 넌 My Love 언제라도 어디서라도 내 옆에 있어 Come to my world Baby Hello Mello By My Love 영원토록 넌 So My Love 하늘 아래 나 약속할테니 You're the only one My Only Love 때로는 멜로영화처럼 때로는 순정만화처럼 Never wanna be the same 너를 위한 주인공이 될게 햇살이 뜨거운 여름도 눈 내리는 새하얀 겨울도 이 손 놓지 않을래 하루종일 함께 할 거야 Listen to my heart my baby girl 아직은 쉽진 않아도 오늘은 조금 다른 걸 Don't you know that 별은 지고 세상은 변해도 난 지킬 거야 Every Day and Every Night 넌 이 자리만 지키면 돼 Baby Hello Mello Be My Love 누가 뭐래도 넌 My Love 언제라도 어디서라도 내 옆에 있어 Come to my world Baby Hello Mello By My Love 영원토록 넌 So My Love 하늘아래 나 약속할테니 You're the only one My Only Love Baby Hello Mello Be My Love 천 번을 말해도 My Love 이 세상을 살아가는 이유 바로 너라고 말할 거야 Yeah Baby Hello Mello By My Love 영원토록 넌 So My Love 하늘아래 나 약속할테니 You're the only one My Only Love
  인피니트  ,마주보며 서 있어,여기에 우리 둘이 서있어 서로 마주보면서 슬프네 조용해 모두 멈춰진 듯 해 싸늘한 바람 만이 감도네 이대로 난 너를 보내긴 싫어 난 이제 선택을 해야만 해 널 위해 날 위해 네 눈을 보면서 이별을 고하려 하네 우린 마주보며 서있어 우린 마주보며 울었어 마주잡았던 두 손 흩어지네 이젠 안녕 이제 우린 헤어져야 해 이제 우린 이별해야 해 Oh 난 우리 함께한 시간 고통 기쁨 모두 잊을게 지금 이순간부터 Love is gone but there's only you in my heart 너라는 여자를 만난 이 기적 같은 순간에서 이기적이게 도망 가려 해 사랑해서 떠난단 말도 안 되는 이유로 비겁하게 떠나가려 해 우리 함께 했던 수많은 약속 안에 이별이란 건 없었는데 야속하게 나쁜 남자가 돼서 거짓을 뱉으며 이 인연을 벗어나려 해 이대로 난 너를 보내긴 싫어 난 이제 선택을 해야만 해 널 위해 날 위해 네 눈을 보면서 이별을 고하려 하네 우린 마주보며 서있어 우린 마주보며 울었어 우리 함께한 시간 고통 기쁨 모두 잊을게 지금 이순간부터 두려워 습관적으로 든 담배처럼 함께였는데 뜨겁게 물고 빨 때 애태우듯 더 세게 나를 갉아먹어 힘들게 사랑해도 좋았지만 남겨진 건 쓸쓸한 재뿐이어도 털고 나면 담담해 너와 나의 사랑 스쳐간 추억 Inside of my head 아름답게 피워줘 연기처럼 네게 흘려 보낼게 my dear 우린 마주보며 웃었어 우린 마주보며 웃었어 마지막 인사하며 손끝으로 이젠 안녕 나는 먼저 한발 걸었어 눈을 감고 그냥 걸었어 Oh 난 서로를 부르는 목소리에 결국 우리는 다시 마주보며 서있어 마주보며 서있어 마주보며 서있어 마주보며 서있어
  DAY6 (데이식스)  ,First Time,Woo woo woo Yeah 한때 우린 서로가 서로를 운명이라 믿었었 지만 아냐 실은 사실은 you were 운명 같아 보였던 우연 그동안 오랫동안 너 없이 혼자 남아 앓고만 있었지만 이제 이제는 다시 너를 잡고 있지 않게 For the first time 너와 다른 곳을 향해 걸어가 I say goodbye to you you For the first time 다른 꿈을 가지고 걸어가 I say goodbye to you 이 말이 마지막이 될 수 있게 한땐 그땐 죽고 못 사는 사이였어도 순식간에 우리가 내내 약속했던 내일은 거짓으로 아픔이 커질수록 시간이 가버린 걸 알게 돼 그럴수록 어쩔 수 없이 내 두 손 두발 다 들게 돼 Ooh 흘러 지나간 날들을 되돌리긴 Too far 이젠 더 이상 너를 가질 수 없어 I know you know we know 이제야 너를 보내 For the first time 너와 다른 곳을 향해 걸어가 I say goodbye to you you For the first time 다른 꿈을 가지고 걸어가 I say goodbye to you goodbye 이 말이 마지막이 될 수 있게 I got to say I got to say I got to say good bye I got to say I got to say I got to say good bye I got to say good bye For the first time 너와 다른 곳을 향해 걸어가 I say goodbye to you you For the first time 다른 꿈을 가지고 걸어가 I say goodbye to you goodbye 이 말이 마지막이 될 수 있게
  브라운아이드걸스  ,You,yeah yeah yeah yeah 그대는 내게 바람과 같네 돌아와 babe Feeling me now Feeling me now Baby Feeling me now Feeling me now 모르겠니 모르겠니 Baby Ah Ah Ah Ah Ah Ah Ah Ah Ah Ah Ah Ah Ah Ah Ah Ah Ah Ah Ah Ah 그에게 기대하는 습관은 버려두자 허황된 꿈들 가득 품은들 시간이 지나갈수록 너의 손해 뭔들 못하겠어 만약 그게 니게 된다면 애타겠어 지금 내가 이 상황 너라면 너도 사실 알지 그가 원한건 나이지 아까운 시간 체력 낭비 이젠 굿바이지 바로 나야 나 니가 아닌 나야 나 깜찍한 두 눈 도톰한 입술 그가 바란 나야 아냐 나야 나 너도 아닌 나야 나 매력 있는 눈 날씬한 다리 날 바라보잖아 Feeling me now Feeling me now Baby Feeling me now Feeling me now You You 모르겠니 모르겠니 Baby Ah Ah Ah Ah Ah Ah Ah Ah Ah Ah 나를 보며 나만 보며 묘한 미소 짓는 저 얼굴을 아직도 넌 모르겠니 Baby Ah Ah Ah Ah Ah Ah Ah Ah Ah Ah 하하하하하 니가 날 모르지만 나는 널 알겠고 그의 맘도 알겠어 현실을 알게 꼭 말해줄게 난 계속 안타까워 그를 보는 너를 보면 like a fire 이글거려 너의 눈에 너의 눈에 맘에 몸에 너의 몸에 눈에 맘에 하지만 그의 팔에 안겨 미소 짓는 건 나네 미안하지만 내가 정리해줄게 맘이 아파도 속이 쓰려도 너는 내 남자야 미안하지만 다 말을 하자면 어젯밤에도 오늘 밤에도 함께 한건 나야 Feeling me now Feeling me now Baby Feeling me now Feeling me now You You 모르겠니 모르겠니 Baby Ah Ah Ah Ah Ah Ah Ah Ah Ah Ah 나를 보며 나만 보며 묘한 미소 짓는 저 얼굴을 아직도 넌 모르겠니 Baby Ah Ah Ah Ah Ah Ah Ah Ah Ah Ah  You 어딜 보니 내가 여깄는데 You 나를 사랑한다고 말해줘 You 오늘밤도 니 옆은 내꺼야 Feeling me now Feeling me now Baby Feeling me now Feeling me now Baby Feeling me now Feeling me now You You 모르겠니 모르겠니 Baby Ah Ah Ah Ah Ah Ah Ah Ah Ah Ah 나를 보며 나만 보며 묘한 미소 짓는 저 얼굴을 아직도 넌 모르겠니 Baby Ah Ah Ah Ah Ah Ah Ah Ah Ah Ah Feeling me now Feeling me now Baby
  태민 (TAEMIN)  ,Back To You,아무것도 아니었지 Yeah Yeah 네가 나를 안아주기 전까진 꽤 괜찮은 놈이라는 걸 너로 인해 조금씩 알게 됐어 근데 이건 몰랐던 거지 이별 뒤의 노랫말들이 이렇게도 참기 힘든 고통인지 넌 내가 꾸던 꿈 Woo woo 내가 쉬던 숨 Woo woo 보고 듣고 느끼고 믿었던 세상이 사라져 What I can do to get back to you back to you yea yea yeah 늦기 전에 돌아갈게 나를 위해 조금만 열어둘래 Oh 네가 없는 밤은 너무 길어 기약 없는 약속이란 싫어 다정한 그 입술로 날 깨워 늘 그랬듯 뒤척이고 뒤척이겠지 그리움과 괴로움 사일 어디도 난 속할 수가 없을 테니 넌 내가 꾸던 꿈 Woo woo 내가 쉬던 숨 Woo woo 보고 듣고 느끼고 믿었던 세상이 사라져 What I can do to get back to you Oh 모든 기억이 아득해져 간절한 내 의지와는 반대로 아직 그곳에 서있기를 서있기를 Girl I just miss you Yea-yeah 내가 살던 품 Yea-yeah 보고 듣고 느끼고 믿었던 세상이 사라져 What I can do to get back to you To get back to you Back to you
  청하  ,Drive,가까워진 우리 끝이 조금씩 느껴져 스쳐 가는 초침 소리 커져 가 조금 두려워 달콤한 꿈속에 빠져 깨고 싶지 않았어 I never know 반짝이는 네 눈 속에 날 이제 다시 볼 수 없을 것 같아 You drive me out of my mind 이게 너와 나의 마지막 애꿎은 경적 소리만 Why don’t you stop me now 내가 기다리는 너의 말 이젠 나 네게 더 이상 Oh one last time with you Kiss me one more time will you 몰랐었던 게 아닌데 아파 자꾸만 나 아무렇지 않은 척 웃어 보이려 하지만 우린 여기까지일까 두 눈에 오늘의 너를 담아두려 애써 I need you oh 날 감싸던 너의 체온도 이제 느낄 수 없을 것만 같아 You drive me out of my mind 이게 너와 나의 마지막 애꿎은 경적 소리만 Why don’t you stop me now 내가 기다리는 너의 말 이젠 나 네게 더 이상 Oh one last time with you Kiss me one more time will you Oh one last time with you Kiss me one more time will you 날 안아주던 너의 그 손을 잡아볼 순 없겠지만 돌아봐줘 날 안아줘 나 너 없이는 안돼 Please come back my baby 조금만 천천히 slow down 내가 우는 모습 참 싫다 애꿎은 라디오 볼륨을 올려 지금 이 길이 끝나면 널 다시 볼 수 없겠지 I got you on my mind Oh one last time with you Kiss me one more time will you Oh one last time with you Kiss me one more time will you
  몬스타엑스  ,Amen,I wanna love you baby 오 널 위해 노래하게 해줘 Yeah I wanna kiss you baby 내가 너의 남자라 말해줘 Yeah 이 거리 위를 걷자 다들 부러워할 거야 오늘 넌 내게 말해 사랑한다 할거야 오늘이 가기 전에 네가 내 품 안에 들어왔으면 해 누구 보다 널 원해 I want you baby 매일 난 니가 내 여자였으면 해 오늘도 나 기도해 Yeah Amen 왠지 모르게 나 네 앞에 있으면 괜히 작아지는 것 같애 근데 보고 싶어 now 두근두근 대는 내 심장 널 향해 뛰네 왠지 모르게 나 네 앞에 있으면 괜히 작아지는 것 같애 너무 보고 싶어 now 두근두근 대는 내 심장 널 향해 뛰네 너의 예쁜 눈을 보고서 대체 누가 아무일 없겠어 저기 좀 봐 봐 남자들 다 다 너 하나만 쳐다보잖아 섹시한 니 다릴 두고서 대체 누가 다른걸 보겠어 저기 좀 봐 봐 남자들 다 다 나에게는 전부 적이야 오늘이 가기 전에 네가 내 품 안에 들어왔으면 해 누구 보다 널 원해 I want you baby 매일 난 니가 내 여자였으면 해 오늘도 나 기도해 Yeah Amen I want you girl 너를 어떻게 하면 널 가질 수 있을까 아직 내 마음 다 보여 줄 수 없지만 너를 위해 모두다 해줄 수 있어 예 하루에 한번씩은 니 미소가 떠올라 어딜 봐도 너 같은 여자는 없을 거야 너를 생각 하면 나 심장이 떨려와 이 세상에 너보다 예쁜 여잔 없을 거야 오늘이 가기 전에 네가 내 품 안에 들어왔으면 해 누구 보다 널 원해 I want you baby 매일 난 니가 내 여자였으면 해 오늘도 나 기도해 Yeah Amen
  라니아  ,DR Feel Good (English Ver.),Dr. Dr. Give me somethin' to make me feel good Not just a regular prescription today Ain't talkin' ritalin I need to feel real good After our last encounter everything changed I need a f f f fix Some type of dr dr dr drug Come on and fill the prescription Something is better than nothin' Whatever you did Just do it again You got me feelin' F f f feelin' feelin' Dr. Dr. feel good Come make me feel real good Strap me down into my chair I've been feelin' real bad Dr. Dr. feel good Come make me feel real good Strap me down into my chair I've been feelin' real bad I wanna feel real good I need to feel real good I wanna feel real good Cause I've been really bad bad I wanna feel real good I need to feel real good I wanna feel real good Cause I've been really bad bad Dr. Dr. I'm already back for more I try to bottle you up But this shit just didn't work I just can't let it go I'm losing control I wish I never decided to explore I need a f f f fix Some type of dr dr dr drug Come on and fill the prescription Something is better than nothin' Whatever you did Just do it again You got me feelin' F f f feelin' feelin' Dr. Dr. feel good Come make me feel real good Strap me down into my chair I've been feelin' real bad Dr. Dr. feel good Come make me feel real good Strap me down into my chair I've been feelin' real bad I wanna feel real good I need to feel real good I wanna feel real good Cause I've been really bad bad I wanna feel real good I need to feel real good I wanna feel real good Cause I've been really bad bad Whatever you did Just do it again Come on feel my prescription You got me feelin' f feelin' Whatever you did Just do it again come on feel my prescription You got me feelin' f feelin' Dr. Dr. feel good Come make me feel real good Strap me down into my chair I've been feelin' real bad Dr. Dr. feel good Come make me feel real good Strap me down into my chair I've been feelin' real bad
  보아 (BoA)  ,기적 (Destiny),지금까지 기다려왔던 내 안의 나를 찾고 있어 웃었던 시간 울던 시간 그리고 또 살아가는 나 미래의 꿈을 꾸고 있는 네 곁에 웃음을 전해주고 싶은 나지만 Destiny is shine or not 너와 난 어디로 향해 가고 있는지 Please hold me tight across the time 어떤 내 모습 이라도 강하게 부드럽게 감싸 안아주는 걸 그댈 만난 내 마음은그댈 향하고 있는걸 전해지고 있나요 사랑이라는 건가요 아무 의미 없는 음악도 그리고 크리스마스 까지도 사랑이란 운명과 함께 의미를 담기 시작하죠 함께하며 느낄 수 있는 Happiness 지루하게 느껴지는 때에도 난 Never mind I'll smile to you 그대곁에 함께 영원할 걸 약속해 It's miracle so miracle 남김없이 감싸안아 내겐 너무 소중해 You're my special reason 이 세상에 기적이란단 하나 뿐 이라 하면 그래요 yes 그대를 그대를 만나게 된 것 Please hold me tight across the time 어떤 내 모습 이라도 강하게 부드럽게 감싸 안아 주는걸 그댈 만난 내 마음은그댈 향하고 있는걸 전해지고 있나요 사랑이라는 거죠 It's miracle so miracle 남김없이 감싸안아 내겐 너무 소중해 You're my special reason 이 세상에 기적이란 단 하나 뿐이라 하면 그래요 yes 그대를 그대를 만나게 된 것
