artist,title,lyric
  여은  ,싸운날,하루가 또 지나가 우리 많이 싸웠던 그날 다 그만하자고 화를 내던 그 밤 몇 번이고 진심이냐며 정말 간다고 뒤 돌아가던 너 온종일 기다렸어 언제나 그랬던 것처럼 내게 화 풀라고 다 잘못했다고 말해줄 것 같은데 며칠째 넌 연락이 없어 날 불안하게 만들지 마 너 빨리 전화해 왜 답이 없는데 다 내 잘못이라 해도 그냥 져주면 되잖아 항상 그랬었잖아 금방 웃어줬잖아 넌 이게 끝일 수는 없잖아 빨리 내게 전화해 네 맘 뭔지 알겠어 충분히 나 아팠으니까 장난이었다고 보고 싶었다고 돌아와야 하잖아 그렇잖아 이러지 말고 차라리 화를 내란 말야 너 빨리 전화해 왜 답이 없는데 다 내 잘못이라 해도 그냥 져주면 되잖아 항상 그랬었잖아 금방 웃어줬잖아 넌 이게 끝일 수는 없잖아 빨리 내게 전화해 습관처럼 헤어지잔 그 말 다시는 꺼내지 않을게 모른 척 돌아와 제발 항상 날 울리고 꼭 안아줬잖아 많이 보고 싶으니까 이제 그만 좀 나타나 아직 사랑이잖아 너도 내 맘 알잖아 내일도 기다릴 테니까 이제 제발 전화해
  모모랜드 (MOMOLAND)  ,BAAM (Inst.),Bae Bae Bae BAAM BAAM Bae Bae Bae BAAM BAAM 자꾸 어지러워 생각지도 못한 네가 훅 훅 훅 들어와 BAAM BAAM 나를 흔들어 무심하게 던진 말에 Pick Pick Pick 쓰러져 BAAM BAAM 영혼 없는 듯 들었다 차가운 말투 놨다 네가 보는 No Doubt 시선에 No Doubt 나는 없고 굳이 왜 굳이 왜 굳이 왜 굳이 왜 선을 긋는 듯 이랬다 벽을 치던 저랬다 그런 네가 어떻게 oh 네가 어떻게 why 네 눈을 본다 눈을 본다 눈을 본다 우우우 빠져든다 빠져든다 난 우 우우우 눈을 감아도 자꾸만 보여 어떻게 해 Baby Tell Me Why 널 보면 뛰는 마음 마음 마음 생각나 매일 밤 밤 밤 자꾸 oh 내가 왜 이래 베베 갈수록 더 숨길 수 없는 마음 마음 마음 널 보면 자꾸 이렇게 또 oh 내가 왜 이래 베베 베베 베베 Bae Bae Bae BAAM BAAM Bae Bae Bae BAAM BAAM 네가 날 보니까 나도 널 보잖아 뚜루루뚜 삐비빅 신호를 보내잖아 Eh-eh 동공이 흔들려 Hmm-hmm 심박이 빨라져 Ya-ah 네가 날 보니까 BAAM 관심 없는 듯 조였다 짧은 네 말투 풀었다 갑자기 분위기는 No Doubt No Doubt 싸늘하게 굳이 왜 굳이 왜 굳이 왜 굳이 왜 벽을 치는 듯 밀었다 선을 긋던 당겨 그런 너를 어떡해 oh 너를 어떡해 Why 내 눈을 본다 눈을 본다 눈을 본다 우우우 빠져든다 빠져든다 넌 우 우우우 꿈속에서도 자꾸만 보여 어떻게 해 Baby Tell Me Why 널 보면 뛰는 마음 마음 마음 생각나 매일 밤 밤 밤 자꾸 oh 내가 왜 이래 베베 갈수록 더 숨길 수 없는 마음 마음 마음 널 보면 자꾸 이렇게 또 oh 내가 왜 이래 베베 베베 베베 한순간에 BAAM 날 내려놓게 하는 Baby You u u u u u 갑자기 BAAM 정신없게 흔들어대는 You u u u u u 널 보면 뛰는 마음 마음 마음 생각나 매일 밤 밤 밤 자꾸 oh 내가 왜 이래 베베 갈수록 더 숨길 수 없는 마음 마음 마음 널 보면 자꾸 이렇게 또 oh 내가 왜 이래 베베 베베 베베 Bae Bae Bae BAAM BAAM Bae Bae Bae BAAM BAAM
  쥬얼리  ,Stay With Me,차분히 생각해보면 어차피 답은 뻔한데 네 옆 여자친구 보다 훨씬 내가 낫잖아 솔직히 니가 아까워 헤어져 뭐가 두려워 넌 그야말로 내가 꿈꾸던 남자야 이제 난 널 가질거야 어차피 넘어올거야 알잖아 괜한 너의 맘 숨기지마 이제 난 달라질거야 상관마 눈치보지마 괜찮아 누가 뭐래도 넌 내꺼야  착각은 자유라지만 모두 날 훔쳐 보잖아 몰래 훑어봐도 내가 봐도 매력있잖아 다가와 내게 말해봐 안 그럼 후회할거야 난 그야 말로 니가 꿈꾸던 여자야 이제 난 널 가질거야 어차피 넘어올거야 알잖아 괜한 너의 맘 숨기지마 이제 난 달라질거야 상관마 눈치보지마 괜찮아 누가 뭐래도 넌 내꺼야 자꾸만 네가 생각나 그리워 미칠지몰라 원하면 어서 내게 와 They luv me cuz I'm Sexy sweet like a chick physically you're complicated man screw that shit you know what mean boy I'm the true queen in this gamez break up with that fool everybody stay with me 벗어나 그녀에게서 눈치채 붙잡기전에 남은 건 식은 사랑 밖에 없잖아 사는게 행복할거야 아마도 고마울거야 어쩌면 나를 만난건 행운이야 내가 더 사랑할거야 맨날 꼭 안아 줄거야 웃음만 가득한 너로 만들거야  I remember Stay with me  I remember Stay with me
  god  ,슬픈 사랑,니 맘속 너무 작은 내 모습이 어쩔 수 없는 벽이 되어버렸어 널 위해 해줄 수 있는게 없어 미안해 이젠 나의 맘을 이해해 지금 나 도착했어 여기 널 만나기로 우리 처음 만났었던 바로 그 곳으로 오늘도 항상 그랬듯이 먼저 나와 나를 기다리고 있는 그 모습이 밝은 햇살에 비춰 눈부셔 지금 너의 모습이 나의 가슴에 묻혀 영원히 남아 있을꺼야 잊지 못할꺼야 사랑해 하지만 오늘이 우리의 마지막인거야 끝인거야 그래 맞아 그랬었지 언제나 함께 우리 둘만의 사랑 키워가곤 했지 이젠 너의 환한 웃음속에 슬픔 없게 해달라는 기도만이 마음속에서 커져가 나 다 포기해도 좋아 다 네가 있기 때문에 알기에 너무나 소중한사랑 이기에 힘이 드는걸 이제는 보내야 한다고 외치는 마음 뿐인걸 우리의 예쁜 추억 나 생각나 햇살에 비친 너의 모습 생각나 이제는 모두가 추억일 뿐 보내야 한다는 걸 잘 알고 있어 다가 갈 수 없어 가슴이 울고 있어 화려함에 둘러싸인 너의 모습을 보고 있어 저기 창가에 비친 내 모습 왜이리 초라한지 어쩌면 우린 서로 다른 세상에 사는건지 용기를 내어 말하기가 너무 힘든걸 아무것도 필요 없다고 나 생각했는걸 깨달았어 너를 보내야만 했어 돌아서서 다가갈 수 없었어 어쩌지 어디서 어떻게 말을 하지 결국 이거였어 그래 알아버렸지 너와 나 이루어 질 수 없다는 너와 나 너무나 다른 세상속에 있다는 사실 그 슬픈 사실 하지만 받아들일 수 밖에 없는 현실 그것이 진실 어떡하면 어떻게하면 다른 길이 있다면 아니 너만 행복해질 수 있다면 잊어줘 너와 나의 모든 사랑 떠나줘 아무것도 없는 내게서 나에게 주었던 너의 사랑 흘러간 시간속에 모두 묻어줘 간지러워 이러지마 왜 그래 일루와봐 어 잠깐만 잠깐만 사람들이 보잖아 보긴 누가 본다그래 아무도 없잖아 아무튼 하지마 야 나 그럼 진짜 안한다 앞으로 계속 절대 안한다 알았지 알았지 치 나 지금 왜 그렇게 슬퍼지나 알고 있었는데 왜 난 울고있나 이젠 어떡하나 너 없는 난 왜 나만 돌아서지 못하고 서있나 나 지금 왜 이렇게 슬퍼지나 알고 있었는데 왜 난 울고있나 이젠 어떡하나 너 없는 난 왜 나만 돌아서지 못하고 서있나
  샤크라  ,Make A Love,I know there's sometime to say goodbye make a love 들리니 사랑의 소리가 한아름 꽃으로 펼쳐질 세상처럼 보이니 너 보이니 사랑의 세상이 화려한 하늘 빛처럼 아름답게 밀려와 make a love 너 혼자가 된다면 새로운 사랑을 느껴봐 make a love 너 어제의 아픔을 눈감고 다시 되새겨봐 넌 모든지 너무 쉽게 날 생각을 했었어 내 최고의 사랑으로만 대해주기를 바래 이제야 알아 사랑이란 다 서로 이해야 해 시작이야 오늘부터 난 사랑의 시작이야 다음 세상에서 만나도 날 사랑하고 싶게 모든 걸 너에게 주겠어 미래의 신부를 꿈꾸면서 리멤버 사랑은 배려 사랑은 행복 사랑은 순수 사랑은 너와 나 사랑은 느낌 사랑은 희생 사랑은 바보의 아름다운 소리 넓디 넓은 세상에 그대가 나에게 오게해준 저 하늘에게 감사해 make a love 너만을 사랑해줄 진실한 사랑을 찾았어 make a love 너만을 사랑할래 어제도 오늘도 미래도 넌 모든지 너무 쉽게 날 생각을 했었어 내 최고의 사랑으로만 대해주기를 바래 이제야 알아 사랑이란 다 서로 이해해야 해 시작이야 오늘부터 난 사랑의 시작이야
"  지코 ,  강다니엘  ",Refresh,두 귀에 손을 포개 눈 감고 앞을 상상해 보통의 삶을 사는 게 어떤 건지 잘 모르겠어 날 데리고 도망가 줘 늘 자유롭고 싶고 혼자이긴 싫어 집 밖을 나서도 닫힌 방 같아 신호라도 주듯이 깜빡이는 불빛 꺼내놓아 툭 Everybody knew 빨간색 하늘과 파란색 바닷가 여름이 담긴 병에 차갑게 땀이 맺혀 Searching for meaning We all need to refresh 숨죽이며 기다린 날이야 목청껏 외쳐 Let's make it better Let's kick it together 가끔 놓쳐도 I don't mind 그만큼 가벼워진 걸 춤을 잘 추고 싶다면 조금만 템포를 낮춰 급해서 좋을 게 없어 Time out 여전히 오락가락 짜증 났다가 신이 나 다시 그게 삶의 장단 Hop out out the chair 걱정 마 다음은 아무도 못 가로채 받아들여 너다움을 we can’t get back yesterday 하늘 높이 뛰어서 주제넘게 감성 충만한데 시간은 턱없이 부족해 enjoy your every moment 빨간색 하늘과 파란색 바닷가 여름이 담긴 병에 차갑게 땀이 맺혀 Searching for meaning We all need to refresh 숨죽이며 기다린 날이야 목청껏 외쳐 Let's make it better Let's kick it together
  민아 (걸스데이)  ,My First Kiss (Inst.),나만 모르는 그 기분 친구들 이미 모두 알고 있대 아직 어린아이라며 이렇게 다들 나를 놀리잖아 I wanna Know 짜릿한 느낌 가슴터질것 같은 떨림을 Come On 아까부터 도대체 뭘 망설이는건데 오 조금더 다가와봐 조금 더 살며시 눈을 감아줄게 처음이란 말 살짝 겁나도 괜찮을거야 너니까 우리 둘 사이 떨리는 느낌 이 어색함을 깨뜨려줘 이 순간 네게만 허락된걸 지금이야 바보야 나 나나나 1 2 3 & 4 yeah My first kiss my my my first kiss My first kiss my my my first kiss My first kiss my my my first kiss My first kiss I wanna Know 달콤한 feeling 손만 잡아도 빨개지는 나지만 준비됐어 촉촉한 내 입술을 봐봐 조금 더 다가와봐 조금 더 살며시 눈을 감아줄게 처음이란 말 살짝 겁나도 괜찮을거야 너니까 우리 둘 사이 떨리는 느낌 이 어색함을 깨뜨려줘 이 순간 네게만 허락된걸 지금이야 바보야 나 나나나 I wanna Know My first kiss my my my first kiss My first kiss 밤늦게 보고 싶다 했잖아 설레게 만든 건 너잖아 이제와 쭈뼛쭈뼛 하니 넌 기다린 나는 어떡해 한발 더 다가와봐 조금 더 살며시 눈을 감아줄게 처음이란 말 살짝 겁나도 괜찮을거야 너니까 우리 둘 사이 떨리는 느낌 이 어색함을 깨뜨려줘 이 순간 네게만 허락된걸 지금이야 바보야 나 나나나 멈추지 말아줘 나 나나나
  틴탑  ,리모콘 (Remote Control),yeah baby 오늘도 역시 너는 이뻐 그래서 나 사실은 할 말이 있어 사실 난 너에게 무언가 주려고 해 baby 이건 보이지가 않아 들리지도 않아 이걸 쓸 수 있는 사람은 오로지 너와 나 너도 이제 다 알잖아 yeah yeah 할게 난 다 할게 니가 원하는 대로 시키는 대로 할게 누르기만 해 Girl 누르기만 해 My babe you know it 할게 난 다 할게 니가 원하는 대로 시키는 대로 할게 누르기만 해 Girl 누르기만 해 My babe baby 아무 때나 눌러도 돼 Girl 새벽 다섯 시 아니면 밤에 혼자 길을 걸을 때 Oh yeah 집이 어려워 담보가 필요 할 때도 It's ok It's alright Oh baby girl 난 다 줄게 언제든 갖다 쓸래 계약을 해 만료기간은 한강이 마를 때 그땐 니가 날 차도 돼 yeah 할게 난 다 할게 니가 원하는 대로 시키는 대로 할게 누르기만 해 Girl 누르기만 해 My babe you know it 할게 난 다 할게 니가 원하는 대로 시키는 대로 할게 누르기만 해 Girl 누르기만 해 My babe baby 널 웃기려는 건 맞지만 장난은 아냐 어떻게 하면 더 잘 할 수 있을지 만 생각 해 난 yeah 하루 종일 니 생각만 하고 있어 난 절대 감추지 않을게 I will be your x-ray girl Promise I'm a put you first I'm a put you first Girl I'm a put you first 할게 난 다 할게 니가 원하는 대로 시키는 대로 할게 누르기만 해 Girl 누르기만 해 My babe you know it 할게 난 다 할게 니가 원하는 대로 시키는 대로 할게 누르기만 해 Girl 누르기만 해 My babe baby
  방탄소년단  ,Jamais Vu,또 져버린 것 같아 넌 화가 나 보여 아른대는 Game over over over 만약 게임이라면 또 load하면 되겠지만 I guess I gotta deal with this deal with this Real world 차라리 게임이면 좋겠지 너무 아프니까 I need to heal my medic But I’m another star 완벽하지 못했던 나를 탓해 Brake in my head brake in my step always 그저 잘하고 싶었고 웃게 해주고 싶었는데 damn Please give me a remedy 멈춰버린 심장을 뛰게 할 remedy 이제 어떻게 해야 해 날 살려줘 다시 기회를 줘 Please give me a A remedy a melody 오직 내게만 남겨질 그 memory 이쯤에서 그만하면 꺼버리면 모든 게 다 편해질까 괜찮지만 괜찮지 않아 익숙하다고 혼잣말했지만 늘 처음인 것처럼 아파 부족한 gamer 맞아 날 control 못하지 계속 아파 ‘Cause 시행착오와 오만 가지 내 노래 가사 몸짓 하나 말 한마디 다 내 미시감에 무서워지고 또 늘 도망가려 해 But 잡네 그래도 네가 내 그림자는 커져가도 내 삶과 넌 equal sign So 내 remedy는 your remedy Please give me a remedy 멈춰버린 심장을 뛰게 할 remedy 이제 어떻게 해야 해 날 살려줘 다시 기회를 줘 Please give me a Remedy 또 다시 뛰고 또 넘어지고 Honestly 수없이 반복된대도 난 또 뛸 거라고 So give me a remedy 멈춰버린 심장을 뛰게 할 remedy 이제 어떻게 해야 해 날 살려줘 다시 기회를 줘 Please give me a remedy 성공인가 돌아왔어 멈춰버린 심장을 뛰게 할 remedy 집중해서 꼭 네게 닿고 말겠어 떨어지고 넘어지고 이제 어떻게 해야 해 익숙한 아픔이 똑같이 날 덮쳐 날 살려줘 이번에도 쉽지 않아 다시 기회를 줘 관둘 거냐고 No no never I won’t give up
  태양  ,죄인,죄인   저 하늘에 한숨을 뱉지  빨간 노을이 눈에 들어왔나봐  자꾸 닦아도 멈추지 않고  참아봐도 아프고 아파  내가 잘못되면  너 때문인지 알아  날 망치게 한 원인  모두 다 너니까  다른 사람을 만나  불행해 주겠니  기도해 줄테니  지우고 지워내도  곁에 있는 것만 같아  너만은 절대 못 잊을 것 같아  버려진 선택 모두 끝인데  멍청한 바보라 날 욕해  너를 사랑한 죄인  그 누군가 지금 니 곁에  나 대신 웃고 있는 사람이  나보다 얼마나 잘났길래  너밖에 모르던 날 떠나 왜  내가 잘못되면  너 때문인지 알아  날 망치게 한 원인  모두다 너니까  다른 사람을 만나  불행해 주겠니  기도해 줄테니  지우고 지워내도  곁에 있는 것만 같아  너만은 절대 못 잊을 것 같아  버려진 선택 모두 끝인데  멍청한 바보라 날 욕해  너를 사랑한 죄인  지나가는 시간  점점 멀어지는 너  불러도 보지만  돌아보지 않는 너  너에 그 이름이  너에 그 입술이  날 가둔 날 묶은  감옥과도 같지    영원히 너를  평생 원망할 것 같아  우리에 맹세 의미 없는 후회  오늘도 밤새 뒤척여 보네  멍청한 바보라 날 욕해  너를 사랑한 죄인  니가 곁에 있는 것만 같아  절대 못 잊을 것 같아  선택 모두 끝인데  너를 사랑한 죄인  너를 사랑한 죄인  너를 사랑한 죄인
  정은지  ,LOVE DAY (PANDA Ver.),참 많이 궁금해 전부 다 궁금해 왜 잠이 안 오고 니 얼굴만 보여 친구들 모여서 니 말이 나오면 왜 내가 들떠서 더 듣고 싶은지 사실 난 이 느낌이 이상해 구름 위가 있다면 여길까 너를 많이 많이 좋아해 똑같이 말하고 싶은데 내가 그래도 될까 좀 더 기다려볼까 나도 많이 많이 좋아해 사실 난 이런 맘이 첨인데 더 기다려줄래 거기 있어줄래 내 뭐가 좋은지 난 그게 궁금해 언제부터 내가 니 맘에 살았니 Yeah Yeah 예쁜 여자들은 참 많고 많은데 넌 정말 나밖에 안 보이는건지 누구 어디 사실 난 우릴 자꾸 상상해 이런 기분 어쩐지 수상해 같은 하늘 아래서 똑같은 말 이제 해도 될 것 같은데 너를 많이 많이 좋아해 똑같이 말하고 싶은데 내가 그래도 될까 좀더 기다려볼까 나도 많이 많이 좋아해 사실 난 이런 맘이 첨인데 더 기다려줄래 거기 있어줄래 누가 좋아해 더 내가 더 나 손 내밀면 그 손 안 놀 자신 있다면 너를 너무 너무 좋아해 똑같이 말할 수 있는데 왜 난 떨리는건지 자꾸 망설이는지 아니 너를 너를 사랑해 이제는 내 맘 다 말해줄게 널 믿어볼게 난 이 사랑속에서 같이 걸어가자 둘이
  쥬얼리  ,소나기,알아 우린 이렇게 서로 웃고 있어도 시간에 흩어져야 하는 그런 사랑이라는걸 내게 너의 기억만 혼자 남긴채 간다고 애써 힘들게 말할 필요는 없어 처음 너를 보던날 내게 건넨 미소가 어느새 내 맘속에 번져와 가득히 날 채웠는데 아직 못다 보여진 나의 사랑을 남긴채 너는 그렇게 떠나가야만 하니 그냥 모른척 떠나줘 나에겐 눈물만 남겨질 마지막 인사까지 할 수는 없어 우리 이대로 헤어져 다신 볼수는 없어도 지금처럼 너를 내 맘속에 간직할꺼야 사랑해 잊지마 우리 짧은 사랑 흘러내린 소나기처럼 이제는 그쳐야만 하지만 언젠가 다시 만날 날을 기다리면돼 그때는 커버린 나의 사랑 줄수 있게  혼자 울기만 했었어 잘가란 말조차 못했지 점점더 멀어지는 니모습 보며 아무 준비도 없이 널 그저 보내야 했지만 내맘 가득 너를 영원토록 간직할꺼야 사랑해 잊지마 우리 짧은 사랑 흘러내린 소나기처럼 이제는 그쳐야만 하지만 언젠가 다시 만날 날을 기다리면돼 그때는 커버린 나의 사랑 줄수있게 그럼 넌 웃으며 내 맘 모두 받으면 돼
  펜타곤  ,SKATEBOARD,우린 나비처럼 훨훨 스케이트보드 타고 슝 너무 기분 좋은 Summer 활짝 꽃 피지 Blooming 너와 난 구름을 타고 분홍빛 하늘을 달려 너무 기분 좋은 Summer 스케이트보드 타고 슝 하루하루 똑같아 지루한 Summer days 한 폭의 그림 같아 너를 마주할 땐 길 잃은 것 같아 괜찮아 둘이라면 난 그곳이 어디든 괜찮아 너랑 있으면 내 기분이 스케이트보드 타고 날아가 너와 나 둘만의 시간 속에만 있게 해줘 그대로 난 헤엄칠 거야 우린 나비처럼 훨훨 스케이트보드 타고 슝 너무 기분 좋은 Summer 활짝 꽃 피지 Blooming 너와 난 구름을 타고 분홍빛 하늘을 달려 너무 기분 좋은 Summer 스케이트보드 타고 슝 스케이트보드 타고 너와 나 우리 둘이 하늘을 달려 난 꿈꾸고 있는 것 같아 Ah yeah Ah yeah 높은 파도 위를 Surfing 바람을 가로질러 한강으로 Goal in 짝을 지어 뛰자 Dolphin Calling to 네가 가진 Best friend 또 Soulmate 모두 불러 슈퍼보드 타지 미련 없는 하루를 보내보자 맑은 하늘을 향해 큰소리 내본다 우린 멀어질 수 없는 사이가 되고파 어디로든 떠나자 너와 나 너와 나 둘만의 시간 속에만 있게 해줘 그대로 난 헤엄칠 거야 우린 나비처럼 훨훨 스케이트보드 타고 슝 너무 기분 좋은 Summer 활짝 꽃 피지 Blooming 너와 난 구름을 타고 분홍빛 하늘을 달려 너무 기분 좋은 Summer 스케이트보드 타고 슝 Someone like you Summer like you baby 너만이 나를 파도 치게 했지 Ah 그렇게 날 안아줘 스케이트보드 타고 너와 나 우리 둘이 하늘을 달려 난 꿈꾸고 있는 것 같아 Ah yeah Ah yeah
  아이비아이 (I.B.I)  ,I.B.I,문득 길을 걷다 보면 나만 빼고 다 너무 좋아보여 어제와 같은 내 하룬 이미 본 영화처럼 지루한데 그런 마음은 나빠요 행복이란 멀리 있지 않은걸 yeah 이미 잘하고 있어요 우린 다 알고 있어요 아무도 몰래 몰래 용기낼래 아무도 몰래 몰래 예뻐질래 구름 속에 감춰진 별빛이 너를 비추며 언젠가 빛날 네 꿈을 위해 아무도 몰래 몰래 사랑할래 이 시간 지나면 알게 될 거야 네 꿈은 이미 너에게 더 가까워진걸 I believe It Do your dance Do your dance Do your dance I believe It Do your dance Do your dance 자꾸 쫓기는 것 같아 괜히 조급한 마음 어떡하죠 힘들단 말은 숨기죠 투정 부리는 어린 아이같아 잠깐 하늘을 쳐다봐 크게 숨을 쉬고 생각해봐 yeah 뜨거워진 가슴 안고 다시 너를 찾아 떠나 아무도 몰래 몰래 용기낼래 아무도 몰래 몰래 예뻐질래 구름 속에 감춰진 별빛이 너를 비추며 언젠가 빛날 네 꿈을 위해 아무도 몰래 몰래 사랑할래 이 시간 지나면 알게 될 거야 네 꿈은 이미 너에게 더 가까워진걸 턱 끝까지 차오른 가쁜 숨을 몰아 내쉬면 yeah 모든게 선명해져 소중한 것들이 내 곁에 있다는 걸 YO 언제나 I believe 모든게 다 뜻대로 잘 될 거야 꼭 조금만 더 너 힘을 내 YO GET UP GET UP 너 GET UP GET UP YO 아무도 몰래 몰래 용기낼래 아무도 몰래 몰래 예뻐질래 구름 속에 감춰진 별빛이 너를 비추며 언젠가 빛날 네 꿈을 위해 아무도 몰래 몰래 사랑할래 이 시간 지나면 알게 될 거야 네 꿈은 이미 너에게 더 가까워진걸 I believe It Do your dance Do your dance Do your dance I believe It Do your dance Do your dance
  엠블랙  ,One,Yeah Listen to this 어둠이 날 감싸고 홀로 남았다해도 한치 앞이 캄캄해 보이지 않는다해도 상처받은 그대의 그 아픈 맘 맘 맘 감싸안을께 약속해 I'm gonna be down 반복되는 시간에 지친 그대 기댈곳이 없다면 여기 와서 내게 기대 너를 위해 함께 할테니 우릴 불러 다시 또 시작해 Right now 이제 다시 one better day one better day one better day 밝은 내일이 또 너를 기다리잖아 이제 다시 one better day one better day 내가 있어 너와 함께 가 혼자라는 생각들 대답없는 세상들 시곗바늘 처럼 tic tok 대는 나날들 힘들었던 시간들 모두 다 싹 다 잘라 이 빛이 기다렸잖아 반복되는 일상에 지친 그대 기댈곳이 없다면 이제 와서 내게 기대 너를 위해 여기 왔으니 우릴 불러 다시 또 시작해 right now 이제 다시 one better day one better day one better day 밝은 내일이 또 너를 기다리잖아 이제 다시 one better day one better day 내가 있어 너와 함께 가 이제는 뛰고 있어 언제든 나 함께 있어 자 이제 시작해 baby yes sir 이제 다시 one better day one better day one better day 밝은 내일이 또 너를 기다리잖아 이제 다시 one better day one better day 내가 있어 너와 함께 가
  아이즈(IZ)  ,The Day (Prod. Sweetune),라라라라 라라라라 라라라라 라라라라 매일 또 태양이 뜨듯이 내 맘에 니가 피고 지길 반복해 라라라라 oh 라라라라 oh 아무도 듣지 못해도 너만은 이 목소릴 알아낼거야 oh 라라라라 oh 라라라라 oh 노래해야 해 저 시간을 넘어 내 바램을 담아 가장 빛나는 우리 자리로 눈부실 그때로 닿을 때까지 난 라라라라 라라라라 라라라라 라라라라 서로의 시선이 맞닿을 그때엔 우리의 공간이 하나될 그때엔 oh 라라라라 oh 라라라라 oh 노래해야 해 저 시간을 넘어 내 바램을 담아 가장 빛나는 우리 자리로 눈부실 그때로 닿을 때까지 난 달려야해 저 시간을 넘어 널 만날 곳으로 저물지 않는 맘이 있어서 눈부실 그때로 닿을 때까지 난 라라라라 라라라라 라라라라 라라라라 라라라라 라라라라 라라라라 라라라라
