artist,title,Korean_clean_lyric
  이연실  ,목로 주점,드럽다 친구 오랜 친구 언제 웃다 드럽다 친구 오랜 친구 언제 찾다 오르다 이왕이면 크다 따르다 이왕이면 마주 앉다 말다 그렇다 그렇다 그렇게 마주 앉다 그렇다 그렇게 부딪히다 보다 가장 멋지다 목소리 기원 하다 가장 멋지다 웃음 화답 해주다 오늘 목로 주점 바람 백열등 그네 타다 월말 이면 월급 타다 로프 사고 연말 적금 타다 낙타 사자 그렇다 그렇게 오르다 그렇다 그렇게 사막 가다 가장 멋지다 친구 트리 연필 노트 오늘 목로 주점 바람 백열등 그네 타다
  Taylor Swift  ,Everything Has Changed (Feat. Ed Sheeran),
  김광석  ,이야기 넷,덥다 허리 아프다 하다 남다 전이 년도 말일 날다 병원 놀래다 우리 딸내미 다섯 딸아이 있다 태어나다 처음 보다 얼굴 의사 아니다 받다 의사 출근 있다 간호사 무슨 준비 하다 하다 나가다 사이 받다 되게 놀래다 사람 이렇게 태어나다 놀래기 하다 괴기 영화 저리 가르다 그렇다 차다 신기하다 사람 태어나다 남자 보다 돼다 그거 그날 그렇다 나서다 놀래다 가지 멍청하다 있다 이렇게 나가다 길거리 다니다 사람 하나 쉬다 보이다 자다 생기다 생기다 있다 자건 없다 자건 이렇게 그렇게 들다 태어나다 들다 소중하다 되게 없다 싶다 무시 낫다 싶다 괜히 매다 그렇다 스스로 되게 지다 똑같다 그렇다 그때 그렇다 생각 하다 만들다 노랩니 자유롭다 게라 하다 들다 드리다 물르다 행복하다 아쉽다 말다 모르다
  어쿠스틱클라우드  ,내일을 바라본다 (Vocal 석민아),기다 하루 끝나다 어느덧다 지하철 의자 기대다 창밖 바라보다 바라보다 바라보다 어리다 세상 묻히다 바쁘다 상속 잊다 이제야 그리다 보다 그리다 보다 바라보다 지나치다 다시 한번 마주 하다 매일 흘러가다 어리다 지나치다 다시 한번 마주 하다 지나치다 다시 한번 마주 하다 매일 흘러가다 어리다 아름답다 내일 그리다 보다 하루 하루 지나다 어느덧다 여름 가을 겨울 지나다 매일 흘러가다 매일 스치다 간다 바라보다 기다 하루 끝나다 어느덧다 지하철 의자 기대다 창밖 바라보다 바라보다 바라보다 창밖 바라보다 바라보다 내일 바라보다
  자전거 탄 풍경  ,그렇게 너를 사랑해,사랑 하다 해주다 언제나 항상 변하다 없이 하루 종일 내리다 빗방울 사랑 하다 해주다 그렇게 사랑 하다 언제나 항상 변하다 없이 하루 종일 내리다 빗방울 사랑 있다 세월 시간 무너지다 내다 내겐 하나 사랑 하다 언제나 항상 변하다 없이 검푸른바다 보다 깊이 사랑 있다 사랑 하다 해주다 언제나 항상 변하다 없이 놓다 수많다 크다 사랑 하다 해주다 그렇게 사랑 하다 언제나 항상 변하다 없이 우주 놓다 사랑 있다 세월 시간 무너지다 내다 내겐 하나 사랑 하다 언제나 항상 변하다 없이 붉다 노을 보다 보다 아름답다 사랑 있다 사랑 하다 약속 하다 사랑 하다
  Laura Marling  ,Sophia,
  솔개 트리오  ,아직도 못다한 사랑,오늘 갈대 홀로 울다 새다 마음 알다 보다 쓸쓸하다 바람 아득하다 밀려오다 소리 잃어버리다 옛날 행복 젖다 외로움 지치다 버리다 마음 어떻다 말로 하나요 모르다 가슴 아직도 다한 사랑 지난 홀로 울다 여인 마음 알다 보다 쓸쓸하다 바람 저만큼 밀려오다 소리 잃어버리다 옛날 행복 젖다 외로움 지치다 버리다 마음 어떻다 말로 하나요 싫다 돌아오다 아직도 다한 사랑
  나로  ,봄꽃 같은 너,그대 미소 사랑스럽다 닮다 싱그럽다 그대 목소리 좋다 그대 웃음 나르다 기분 좋다 안고 사랑 하다 해주다 그대 사랑 하다 정말 사랑 하다 그대 내다 행복 같다 그대 정말 너무 좋다 꽃처럼 싱그럽다 웃다 그대 미소 심쿵하다 쓰러지다 보고 보다 좋다 그대 미소 사랑스럽다 닮다 싱그럽다 그대 목소리 좋다 그대 웃음 나르다 기분 좋다 안고 사랑 하다 해주다 그대 사랑 하다 정말 사랑 하다 그대 내다 행복 같다 그대 정말 너무 좋다 꽃처럼 싱그럽다 웃다 그대 미소 심쿵하다 쓰러지다 보고 보다 좋다
  호우앤프랜즈  ,사랑이야,당신 누구 이렇게 마음 깊다 거기 찾아오다 어느새다 촛불 하나 이렇게 밝히다 놓다 어느 어느 이렇게 당신 피우다 놓다 처럼 이렇게 타오르다 있다 언젠가 어느 가다 하다 번은 보다 얼굴 가슴 항상 혼자 그리다 보다 모습 하다 불다 영혼 사랑 사랑 당신 누구 이렇게 마음 깊다 거기 찾아오다 어느새다 시냇 하나 이렇게 흘리다 어느 어느 바람 이렇게 당신 흘리다 놓다 처럼 조용하다 이렇게 영원하다 있다 언젠가 어느 가다 하다 번은 오다 같다 순간 가슴 항상 혼자 예감 하다 순간 한번 미소 터지다 버리다 영혼 사랑 사랑
  라임그린  ,커피,나르다 해주다 내다 상쾌하다 해주다 내다 잊다 해주다 나르다 적다 오후 카페 앉다 데이트 시작 하다 오늘 어떻다 힘들다 않다 서로 하루 해주다 모금 대면 입안 퍼지다 향기 모금 대면 향기 좋다 커피 입맞춤 내다 해주다 커피 섹시하다 향기 좋다 깊다 오다 이렇다 혼자 싫다 있다 마르다 입술 마르다 마음 채우다 모금 대면 입안 퍼지다 향기 모금 대면 향기 좋다 커피 입맞춤 내다 해주다 커피 섹시하다 향기 좋다 나르다 해주다 내다 상쾌하다 해주다
  Eric Clapton  ,Old Love ,
  랄라스윗 (lalasweet)  ,여름에게,막히다 열대야 들다 가다 시간 식히다 여름 쏟아지다 투명하다 빛나다 물줄기 풍경 좁다 우산 떨리다 숨결 감싸다 젖다 어깨 어디 있다 우산 사람 나지막하다 속삭임 어딘가 있다 내리다 여름밤 수줍다 고백 영원하다 거란 약속 여름 리지 않다 장마 없다 아주 건조하다 여름 여름 리지 않다 장마 없다 아주 건조하다 여름 유난히 낯설다 느껴지다 얼굴 차갑다 새벽 돌아보다 않다 가물다 도시 기억 매일 선명하다 리지 않다 여름밤 그리다 들다 어디 있다 우산 사람 나지막하다 속삭임 어딘가 있다 내리다 여름밤 수줍다 고백 영원하다 거란 약속 여름 리지 않다 장마 없다 아주 건조하다 여름 여름 리지 않다 장마 없다 아주 건조하다 여름 쏟아지다 빗줄기 사이 멀어지다 신기루 자꾸만 희미하다 가다 어디 있다 우산 사람 나지막하다 속삭임 어딘가 있다 내리다 여름밤 수줍다 고백 영원하다 거란 약속 여름 리지 않다 장마 없다 아주 건조하다 여름 여름 리지 않다 장마 없다 아주 건조하다 여름 여름
  양희은  ,저 높은 곳을 향하여,높다 하다 마다 나아가다 정성 모두 마다 붙드사 서다 하소 빛과 사랑 언제나 넘치다 괴롬 있다 비록 살다 빛나다 높다 마다 바라보다 붙드사 서다 하소 빛과 사랑 언제나 넘치다 험하다 높다 싸우다 나아가다 다시금 기도 인도 소서 붙드사 서다 하소 빛과 사랑 언제나 넘치다 따르다 올라가다 높다 서다 영원하다 복락 누리 즐겁다 노래 부르다 붙드사 서다 하소 빛과 사랑 언제나 넘치다
  강태구  ,멀리 아주 멀리,멀리 아주 멀리 다시다 찾다 없다 그리움 닿다 없다 멀리 아주 멀리 다시다 찾다 없다 그리움 닿다 없다 우연히 마주치다 되다 다시 좋아지다 멀리 아주 멀리 다시다 만날 없다 외로움 보이지 않다
  이지상  ,새,날개 누가 대신 달다 않다 기억 하다 주다 친구여 어리다 몸뚱이 집다 나오다 스스로 자라나다 그렇다 날개 여야 그렇다 날개 여야 아름답다 비상 꿈꾸다 있다 그렇다 날개 여야 그렇다 날개 여야 없다 만들다 기억 하다 주다 친구여 날개 누가 대신 주지 않다 기억 하다 주다 친구여 백두 잉태 한라 토양 자라나다 그렇다 날개 여야 그렇다 날개 여야 평화 바다 황홀하다 새벽 만나다 그렇다 날개 여야 그렇다 날개 여야 평화 대지 날개 접다 쉬다 있다 날개 누가 날개 누가 날개 누가 대신 달다 않다 기억 하다 주다 친구여
  Ward Thomas  ,Better Be Home Soon,
  Bahari  ,Wild Ones,
  이신영  ,그때 그 마음으로,오래되다 피아노 앉다 없다 노래 이제 크다 버리다 손가락 화려하다 연주 하다 그저 노래 하다 좋다 철부지 이제 알다 많아지다 쓸다 없다 고민 하다 있다 언제 유명하다 끄다 갖다 갈다 미래 이다 마음 노래 하다 마음 직할 소중하다 잊다 다시 생각 하다 보다 되다 아무 모르다 사랑 노래 이제 크다 버리다 마음 놓이다 있다 언제 안다 주다 갖다 갈다 사랑 이다 마음 사랑 하다 마음 함께 꾸다 갈다 소중하다 사람 잊다 다시 생각 하다 보다 되다 마음 노래 하다 마음 직할 소중하다 잊다 다시 생각 하다 보다 되다 마음 사랑 하다 마음 함께 꾸다 갈다 소중하다 사람 잊다 다시 생각 하다 보다 되다 다시 생각 하다 보다 되다 다시 생각 하다 보다 되다
"  양희은 ,  윤종신  ",배낭여행,배낭 하나 짊어지 떠나다 싶다 바람 따르다 구름 따르다 거치다 하나 없이 같이 떠나다 누군가 있다 차다 좋다 외롭다 혼자 부르다 노래 마음 하다 남아 있다 좋다 제자리 머물다 없다 걸다 멀리 멀리 떠나다 자다 보이다 같이 떠나다 누군가 있다 차다 좋다 외롭다 부르다 이름 마음 하다 사람 있다 주다 좋다 배낭 하나 짊어지 떠나다 싶다 바람 따르다 구름 따르다 거치다 하나 없이 산다 무엇 이다 행복 어디 모든 소중하다 우리 보이다 걸다 제자리 머물다 없다 걸다 멀리 멀리 떠나다 자다 보이다
  Glen Hansard  ,Leave,
  한마음  ,갯바위,바위 당신 나르다 사랑 하다 파도 어느 곱다 바람 불다 다가오다 손길 나르다 감싸다 향기롭다 입술 내다 주다 세찬 비바람 이다 파도 맺다 당신 조각품 당신 인하다 아름답다 바위 당신 나르다 사랑 하다 파도 우린 오늘 마주 보다 이렇게 서다 있다 세찬 비바람 이다 파도 맺다 당신 조각품 당신 인하다 아름답다 바위 당신 나르다 사랑 하다 파도 우린 오늘 마주 보다 이렇게 서다 있다 바위 당신 나르다 사랑 하다 파도 우린 오늘 마주 보다 이렇게 서다 있다 이렇게 서다 있다
  Sabrina  ,Bleeding Love (Album Version),
  이정희  ,그대생각,피다 길목 화사하다 웃음 달려오다 내리다 바람 불다 나부끼다 빗물 되어다 찾아오다 머무르다 헤어지다 텅빈 고독 머무르다 지나가다 텅빈 마음 바쁘다 바쁘다 날아오다 스치다 바람 잠시 다가오다 어디 서도 만날 있다 얼굴 만나다 인사 하다 있다 머무르다 헤어지다 텅빈 고독 머무르다 지나가다 텅빈 마음
  Angelo De Augustine  ,I Hope That All Of Your Dreams Come True,
  장필순  ,그림,그대 가슴 춤추다 나비 비바람 날개 접다 기다 잠들다 무지개 호수 외롭다 뱃길 희다 은하수 걸다 다다르다 꿈꾸다 오랜 시간 동안 지키다 그대 노래 바람 우리 그리다 그림 그대 가슴 춤추다 나비 비바람 날개 접다 기다 잠들다 오랜 시간 동안 지키다 그대 노래 바람 우리 그리다 그림
  Hanne Sorvaag  ,Days That End With Y,
  양현경  ,부엉이사랑,당신 품속 보내다 뒤뚱이 걸음 세상 만나다 진자리 갈아 주다 당신 손길 내겐 너무 악시 수줍다 당신 얼굴 오늘 하다 가닥 주름 늘다 작아지다 당신 어깨 오늘 기대 보다 후렴 좋다 모두 내다 주다 그래도 당신 괜찮다 하다 힘드다 세상 때로는 지치다 얼굴 보다 그냥 웃기 넓다 바닷물 세월 지나 모두 마르고 높다 산이 바람 쓸리다 어찌 잊다 당신 사랑 부엉이 슬프다 사랑 이제 쉬다 부엉이 슬프다 사랑 곱다 당신 머리 오늘 가닥 서리 오다 곱다 손길 박히다 내겐 너무
  에밀레  ,그대 떠난 빈들에 서서,너머 울다 지치다 소리 텅빈 가슴 채우다 어느 손길 있다 소리 조용하다 달래다 마리 날다 되어다 그대 날아가다 마리 날다 되어다 그대 날아가다 그대 가슴속 눈물 바람 가슴 날리다 날다 우린 모두 알리 소리 깊다 아픔 모두 나가다 조용하다 머리 숙이다 소리 아픔 맞다 마리 날다 되어다 그대 날아가다 마리 날다 되어다 그대 날아가다 그대 창밖 슬픔 따다 깊다 심다 리라 그대 가슴 아픔 따다 깊다 심다 리라 날아가다 마리 되다 그대 가슴 마리 작다 되다 되다
"  Norah Jones ,  The Peter Malick Group  ",Strange Transmissions,
  강민재  ,향기를 봄,만나다 나오니 매화 바람 날다 계절 없다 기분 너무 좋다 따다 바람 향기 향기롭다 부다 매화 향기 향기 닮다 발걸음 가벼워지다 매화 날리다 거리 잡고 걷다 모습 계속 보고 싶다 시간 지나다 또다시 찾아오다 향기 불다 바람 어딘 모르다 채우다 그날 향수 데려가다 매화 날리다 거리 잡고 걷다 모습 계속 보고 싶다 매화 날리다 거리 잡고 걷다 모습 계속 보고 싶다 매화 날리다 거리 잡고 걷다 모습 계속 보고 싶다 시간 지나다 또다시 찾아오다 향기 불다 바람 어딘 모르다 채우다 그날 향수 데려가다
  The Avett Brothers  ,Kick Drum Heart,
  루시드폴  ,천사의 노래,이제 노을 지리다 날다 날개 펼치다 시간 홀로 쓸쓸하다 잠들다 사람 쓰다듬다 시간 항상 언제나 이렇게 감다 그대만 있다 지금껏 그대 나르다 보다 없다 여지 그렇다 우리 만나다 있다 오래오래 바라보다 그대 뒤척일 노래 부르다 다시 잠들다 있다 은빛 날개 펴다 달빛 가리다 있다 정말 꾸다 있다 보다 왠지 나르다 보다 웃다 있다 같다 그대 다시 떠오르다 안녕 가야 내일 만날 있다 오래오래 바라보다 그대 뒤척일 노래 부르다 다시 잠들다 있다 은빛 날개 펴다 달빛 가리다 있다 정말 꾸다 있다 보다 왠지 나르다 보다 웃다 있다 같다 그대 다시 떠오르다 안녕 가야 내일 만날 있다 다시 떠오르다 안녕
  Phoebe Bridgers  ,Scott Street,
  양현경  ,내이름은 가을 코스모스,창가 떨어지다 낙엽 보다 떠오르다 모습 커다랗다 눈가 눈물 마치 사슴 같다 처음 보다 그날 가슴 작다 불꽃 피다 떠나다 그날 가슴 비만 하염없이 내리다 잊다 이름 가을 코스모스 잊다 마음 가을 바람 힘겹다 목소리 내다 하다 모습 사슴 같다 처음 보다 그날 가슴 작다 불꽃 피다 떠나다 그날 가슴 비만 하염없이 내리다 잊다 이름 가을 코스모스 잊다 마음 가을 바람 힘겹다 목소리 내다 하다 모습 사슴 같다 잊다 이름 가을 코스모스 잊다 마음 가을 바람 힘겹다 목소리 내다 하다 모습 사슴 같다
  권승구  ,라벤더바람,창문 비치다 아침 햇살 만들다 버리다 한번 오다 본적 없다 낯선 작다 기타 하나 메다 나르다 찾다 오다 멀리 긋다 라벤더 바람 불어오다 나르다 반기다 지도 한장 펼치다 놓다 처음 보다 따르다 무작정 나서다 오늘 따르다 차다 그림 같다 하늘색 구름 미소 짓다 있다 이제 떠나다 멀리 긋다 라벤더 바람 불어오다 떠나다 낯선 바람 소리 들다 불다 새롭다 노래 나르다 찾다 가끔 헤매다 잃다 진땀 나기 그래도 그게 더욱 설레다 하다 좋다 추억 되다 언제 다시 그대 오다 마음 들다 그렇다 정말 좋다 멀리 긋다 라벤더 바람 불어오다 떠나다 낯선 바람 소리 들다 불다 새롭다 노래 나르다 찾다
  Jake Owen  ,Days Of Gold,
  Simon & Garfunkel  ,Boxer,
  양희은  ,인생의 선물,봄산 피다 리도 리도 곱다 나이 들다 정말로 정말로 모르다 봄산 지다 리도 리도 곱다 나이 들다 정말로 생각 하다 만약 누군가 내다 다시 세월 돌려주다 웃다 조용하다 싫다 하다 다시 없다 안갯빛 같다 젊음 라면 생각 해도 들다 나이 들다 좋다 그것 인생 비밀 그것 인생 고맙다 선물 보다 들다 피다 꽃들이 리도 곱다 나이 들다 정말로 정말로 모르다 인생 피고 지고 비로소 마음 하나 들어오다 피다 나란하다 앉다 아무 하다 않다 고개 마음 알아주다 친구 하나 하나 있다 나란하다 앉다 아무 하다 않다 지다 함께 바라보다 친구 있다 이상 다른 바라다 없다 그것 인생 비밀 그것 인생 고맙다 선물
  스몰토크  ,봄비,사랑 그대 이르다 비처럼 찾아오다 한참 차갑다 정원 피우다 사랑 그대 꿈꾸다 나비 다가오다 한참 차갑다 어깨 그대 온기 해주다 기다 시간 지나가다 그대 잡다 그대 만나다 위해 거치다 바다 같다 시간 보내다 깊다 새벽 찾다 그대 나르다 보지 하다 스치다 지나다 오늘 어두워지다 따르다 마음 등불 밝히다
  Colbie Caillat  ,Tailor Made,
"  김윤아 ,  이선규  ",Moon River (비긴어게인2),
"  가인 ,  조형우  ",네 집을 보여줄래,오늘 데리다 같이 걷다 잠깐 아직 시간 남아 아니다 정말 귀찮다 않다 같이 가다 멀다 않다 오늘 날씨 좋다 그렇게 그렇게 오다 이대로 이렇게 그냥 보내다 아쉽다 점심 굶다 커피 하다 먹다 싶다 가기 한번 물어보다 보여주다 그리다 늦다 않다 시간 누가 잠시 있다 이상하다 생각 하다 그렇게 그렇게 오다 이대로 이렇게 그냥 보내다 아쉽다 점심 굶다 커피 하다 먹다 싶다 가기 한번 물어보다 보여주다 너무 속이다 보이다 왠지 그렇다 알다 남다 어떻다 하다 하다
  Don McLean  ,Sister Fatima,
  Cat Stevens  ,Sad Lisa,
  양병집  ,서울하늘 2,교동 어둠 덮다 빨갛다 익다 불빛 하나 켜다 가난하다 젊은이 거리 나오다 오늘 무얼 하다 무얼 말다 어여쁘다 아가씨 짧다 치마 입다 골목 골목 들어가다 신문 팔다 외치다 소리 밤하늘 위로 퍼지다 간다 좁다 명동 어둠 깔리다 백화점 진열 오색 켜다 수많다 사람 거리 나오다 오늘 무얼 살다 무엇 보다 잘생기다 아저씨 거리 면서 커다랗다 음식점 들어가다 과일 장수 아줌마 세다 소리 서울 밤하늘 위로 퍼지다 간다 어여쁘다 아가씨 짧다 치마 입다 골목 골목 들어가다 과일 장수 아줌마 세다 소리 서울 밤하늘 위로 퍼지다 간다
  은빛  ,찼는데 차였다 (Feat. 감성소년),눈물 지워지다 화장 많다 추억 지다 돌아서다 붙잡다 많다 노력 이별 하다 하다 모습 분명하다 차다 차이다 아니다 이다 기다리다 헤어지다 보다 알다 모르다 하다 초라하다 모습 눈물 깊다 가다 오다 않다 나완 다르다 모습 같다 불안하다 마음 많다 낯설다 느끼다 시간 분명하다 차다 차이다 아니다 이다 기다리다 헤어지다 보다 알다 모르다 하다 초라하다 모습 눈물 차다 같다 아직 같다 혼자 아프다 같다 다시다 오다 차다 차이다 보기 좋다 버려지다 미우다 다시 찾다 아니다 알다 또다시 후회 하다 되돌리다 없다
  Bob Dylan  ,Knockin` On The Heaven`s Door,
  The Brothers Four  ,Lady Greensleeves,
  카더가든  ,간단한 말,하루 지나가다 아쉬움 하다 켜다 두다 어쩜 내일 되다 해보다 있다 모르다 차다 이상하다 머물다 주다 사람 마음 보여주다 다치다 보다 간단하다 몰래 하루 채우다 기대하다 내일 나다 수도 있다 오늘 아름답다 서툴다 단어 어렵다 이상하다 멋지다 음악 듣다 좋아하다 차다 이상하다 웃다 주다 사람 마음 힘들다 간단하다 몰래 하루 채우다 기대하다 내일 나다 수도 있다 오늘 아름답다 결국 떠보다 다행 하다 고민 해보다 왜냐면 좋다
  7층 남자  ,이냉치냉,어느덧다 벌써 겨울 오다 가뜩이나 여친 없다 빨리 오다 그렇다 친구 영호 어느덧다 주년 기념일 수많다 커플 화이트 크리스마스 이번 그래도 하다 가지 기다리다 있다 누구 공감 하다 하다 그래도 그렇다 냉치냉 즐기다 눈송이 빙수 시리다 정도 차갑다 냉면 절대 녹지 않다 아이스크림 음료 항상 아이스 춥다 춥다 춥다 절대 포기 하다 없다 춥다 춥다 겨울 내리다 겨울비 빙판 가뜩이나 우산도 없다 오다 그렇다 그래도 하다 가지 기다리다 있다 누구 공감 하다 하다 그래도 그렇다 냉치냉 즐기다 눈송이 빙수 시리다 정도 차갑다 냉면 절대 녹지 않다 아이스크림 음료 항상 아이스 춥다 춥다 춥다 절대 포기 하다 없다 춥다 춥다 겨울 눈사람 얼리다 버리다 눈송이 빙수 시리다 정도 차갑다 냉면 절대 녹지 않다 아이스크림 음료 항상 아이스 춥다 춥다 춥다 절대 포기 하다 없다 춥다 춥다 겨울
  Yuna  ,Decorate,
  헤이달리 (Hey Dali)  ,그대,어쩌면 이다 슬프다 시간 걷히다 걸다 햇살 밀다 내다 피우다 만큼 이제 따다 가끔 나다 만나다 하다 사람 생기다 세상 하다 마음 그대 있다 있다 숨기다 오다 이제 있다 마주 설다 그대 그대 그대 그대 그대 주저 하다 이제 있다 용기 내다 그대 가끔 이다 가져가다 이다 서두르다 알아보다 기다리다 그대 있다 있다 주저 하다 이제 있다 용기 내다 그대 믿다 없다 일어나다 돌다 보다 온통 그대 부족하다 나다 가장 밝다 피어 오르다 그대 있다 있다 선물 같다 사람 별처럼 빛나다 순간 담다 두다 그대 그대 그대 그대 그대 보석 같다 사람 미소 짓다 사랑 하다 그대
  하리니 (HARINIIIII)  ,Happy birthday to you,눈부시다 아름답다 그대 한번 작다 이벤트 이렇게 박자 맞추다 치다 그렇다 시작 하다 햇살 오늘 좋아하다 보다 조명 부탁 하다 오늘 그대 어떻다 특별하다 되다 오늘 그대 행복하다 이다 아마 이제 같이 불다 보다 틀리다 괜찮다 재밌다 이렇게 화음 넣다 마저 들려주다 날씨 오늘 좋아하다 보다 바람 효과 부탁 하다 오늘 그대 사소하다 고민 잠시 접다 두다 돼다 오늘 그대 살찌다 음식 맘껏 먹다 오늘 그대 어떻다 특별하다 되다 오늘 그대 행복하다 이다 아마 센스 있다 선물 그렇다 모르다 맞다 요리 자다 하다 그래서 노래 때우다 솔직하다 맞다 오늘 그대 사소하다 고민 잠시 접다 두다 돼다 오늘 그대 행복하다 되다 아마
  신촌 블루스  ,비의 Blues,그대 나르다 보내다 말다 아직 다한 사랑 많다 그대 항상 머물다 싶다 그대 나르다 보내다 말다 언제나 처럼 나르다 사랑 하다 주다 지나가다 너무 아쉽다 정녕 그대 머물다 싶다 그대 나르다 잊다 말다 두운 거리 혼자 되어다 외로움 문뜩 돌다 보다 아련하다 떠오르다 지난 이야기 줄기 바람 부다 마운 내리다 비다 그대 어께 적다 없다 지기 아쉽다 눈물 그대 적다 두운 거리 혼자 되어다 외로움 문뜩 돌다 보다 아련하다 떠오르다 지난 이야기 줄기 바람 부다 마운 내리다 비다 그대 어께 적다 없다 지기 아쉽다 눈물 그대 적다 그대 나르다 잊다 말다
  Big Little Lions  ,Soon,
  동물원  ,어느 하루,이르다 아침 골목길 나서다 지붕 사이 쳐다보다 오늘 멀리 떠나가다 보다 사람 온종일 서둘다 마르다 잎새 어느덧다 흩날리다 사람 나오다 함께 걸다 보다 나무 사이 맴도 않다 쳐다보다 모습 노을 스며들다 사라지다 가다 사람 온종일 서둘다 마르다 잎새 어느덧다 흩날리다 사람 나오다 함께 걸다 보다 깊이 휘도 오솔길 꿈결 혼자 걷다 있다 모습 노을 스며들다 사라지다 가다 따다 따르다 다라
  커피소년  ,내가 왜 이럴까,그녈 바라보다 있다 건지다 사랑 걸다 그녈 보다 웃음 나다 사랑 걸다 꿈일 꿈일 있다 없다 일이 이렇다 대체 이렇다 자꾸만 가슴 떨리다 걸다 눈빛 목소리 자꾸만 괴롭히다 걸다 어떻다 하다 그녈 바라보다 있다 건지다 사랑 걸다 그녈 보다 웃음 나다 사랑 걸다 꿈일 꿈일 있다 없다 일이 이렇다 대체 이렇다 자꾸만 가슴 떨리다 걸다 눈빛 목소리 자꾸만 괴롭히다 걸다 이렇다 대체 이렇다 눈앞 자꾸 나르다 놓다 나르다 깨우다 내다 어떻다 마법 쓸다 어떻다 하다
  따로 또 같이  ,나는 이 노래하리오,바람 언덕 드세다 바람 흩어지다 날리다 외로움 그대 흔들다 그대 밝히다 그리움 언덕 쌓이다 남다 없다 오다 별빛 그대 슬픔 그대 빛나다 부르다 그대 함께 하리 노래 하리 그대 잡다 리오 그대 자리 노래 하리 그대 위해 부르다 리오 그대 자리
