artist,title,Korean_clean_lyric
  서유석  ,황소 걸음,서두르다 모든 뜻대로 자다 되다 조급하다 마음 무엇 얻다 황소 걸음 마음 하니 추수 정말 기쁘다 가다 보지 않다 어떻다 느끼다 가다 보지 않다 어떻다 보나 앉다 바라보다 지나다 시간 뿐이다 사람 빠르다 얼마나 빠르다 사람 느리다 얼마나 느리다 느끼다 생각 하다 마음 걸다 서두르다 모든 뜻대로 자다 되다 조급하다 마음 무엇 얻다 황소 걸음 마음 하니 추수 정말 기쁘다 가다 보지 않다 어떻다 느끼다 가다 보지 않다 어떻다 보나 앉다 바라보다 지나다 시간 뿐이다 사람 빠르다 얼마나 빠르다 사람 느리다 얼마나 느리다 느끼다 생각 하다 마음 걸다 마음 걸다 마음 걸다
  레몬버튼  ,빙고 (BINGO),쓰리다 없다 난난 걸어가다 스치다 알람 떠지다 재채기 하다 신경 써다 난난 레몬쥬스 하다 나누다 말다 단추 풀밭 넘어지다 멍하다 표정 지다 빙고 빙고 빙고 어쩜 그리다 자다 아니다 빙고 빙고 빙고 있다 빙고 빙고 빙고 빙고 어쩜 그리다 자다 아니다 빙고 빙고 빙고 있다 빙고 빙고 빙고 빙고 빙고 빙고 빙고 빙고 빙고
  Bob Dylan  ,When I Got Troubles,
  위시트리 프로젝트  ,"난 아직 Duet Ver. (With. 앙팡, 박상욱 Of 데일리노트)",아직 모르다 정말로 대다 좋아하다 건지다 멍하니 나르다 보다 너무 좋다 표정 웃다 주다 너무 좋다 목소리 좋다 이제 같다 정말로 대다 좋아하다 같다 아직도 아직도 아직도 아직도 전하 하다 그렇게 그렇게 그렇게 그렇게 잠시 있다 주다 사랑 하다 들키다 보다 하다 너무 좋다 오늘 하다 바라보다 주다 그냥 너무 좋다 좋아하다 좋아하다 좋아하다 좋아하다 하다 사랑 하다 사랑 하다 사랑 하다 사랑 하다 오늘 내일 영원하다 아직도 아직도 아직도 아직도
  Buddy Guy  ,Cities Need Help,
  Damien Rice  ,Cannonball,
  Tom Paxton  ,I Can`t Help But Wonder Where I`m Bound,
  Pajaro Sunrise  ,Eurohop,
  빌리  ,너의 남자친구,그렇다 차다 친하다 연락 하다 없다 나다 그렇다 연락 하다 그렇다 다툼 원인 되다 기다 나다 싫다 하다 하다 좋아하다 괜히 어색하다 그렇다 하다 켜다 흔들리다 친구 없다 만들다 야속하다 남친 바라보다 눈빛 잡다 손길 그저 친구 로서 이다 혼자 동해 하다 고민 정말 우습다 그렇다 하다 켜다 흔들리다 취한 착각 이다 생각 하다 이별 있다 아니다 해도 부르다 그렇다 우리 약속 하다 영원하다 친구 나다 잊다 새롭다 사랑 찾다
  The Yardbirds  ,I Ain`t Got You (Feat. Eric Clapton),
  어떤날  ,비오는 날이면,비다 날다 우산 받치다 모습 좋다 바람 날리다 풀잎 구르다 작다 빗속 잠기 지난 거치다 빗물 씻기다 내리다 작다 가슴 울리다 소리 바람 날리다 풀잎 구르다 작다 빗속 잠기 지난 거치다 빗물 씻기다 내리다 작다 가슴 울리다 소리
  William Fitzsimmons  ,Goodmorning,
  Ed Sheeran  ,The City (Live),
  조동진  ,진눈깨비,있다 당신 있다 당신 행복하다 사람 아직도 남다 찾다 있다 그렇게 아름답다 있다 외롭다 가요 당신 외롭다 가요 당신 행복하다 사람 아직도 바람 느끼다 있다 그렇게 아름답다 마음 있다 아직도 남다 찾다 있다 그렇게 아름답다 있다 아직도 바람 느끼다 있다 그렇게 아름답다 마음 있다
  Moses Sumney  ,Incantation,
  심현보  ,나른 봄 나른,오후 햇살 나르다 바라보다 이내 피다 웃다 그대 그대 바람 불어오다 나르다 어루만지다 이내 졸리다 하다 그대 그대 좋다 그대 나르다 나르다 햇살 그대 나르다 나르다 피다 아지랑이 보이다 어지럽히다 커피 향기 너무 좋다 오늘 너무 좋다 좋다 많다 좋다 그대 그대 그렇다 그대 너무 좋다 너무 좋다 그대 대란 너무 좋다 자꾸 웃음 그대 나르다 나르다 햇살 그대 나르다 나르다 피다 아지랑이 보이다 어지럽히다 그대 나르다 나르다 나르다 햇살 내다 그대 아지랑이 내다 보이다 다가오다 보다 그대 나르다 나르다 보다 바람 그대 나르다 나르다 꾸다 있다 보다 살금 살금 그대 나르다 나르다 햇살 그대 나르다 나르다 피다 아지랑이 보이다 어지럽히다
  Grey Reverend  ,Fate,
  옐로우 벤치 (Yellow Bench)  ,Pause,별빛 내리다 버스 정류장 가다 무표정 모습 왠지 지치다 보이다 매일 하루 너무 빠르다 늦추다 싶다 달려오다 쉬다 갈다 있다 어설프다 처음 홀로 떠나다 여행 설레다 느낌 아마 어지르다 고민 잠시 접다 모두 잊다 떠나가다 오랫동안 숨기다 이렇다 마음 좋아하다 음악 좋아하다 요리 맘대로 뜻대로 모두 즐기다 싶다 투명하다 퍼지다 지치다 숨다 피나 보다 서투르다 처음 홀로 떠나다 여행 낯설다 않다 느낌 매일 이렇다 다가오다 매일 이렇다 기분 이다 숨다 수가 없다 설레다 마음 좋아하다 음악 좋아하다 요리 맘대로 뜻대로 모두 즐기다 싶다 투명하다 퍼지다 지치다 숨다 피나 보다 따라서 걷다 보다 찾다 있다 잊다 모습 담다 싶다 투명하다 퍼지다 지치다 숨다 피나 보다
  건아들  ,젊은 미소,모든 어여쁘다 한송이 모진 바람 불어오다 데려가다 마음 알다 외롭다 마음 달님 마음 알다 마음 마음 영원하다 약속 홀로 고서 멀리 떠나가다 젊음 퍼지다 다시 피다 영원하다 젊다 미소 밝다 내일 하리 마음 영원하다 약속 홀로 고서 멀리 떠나가다 젊음 퍼지다 다시 피다 영원하다 젊다 미소 밝다 내일 하리
  Sufjan Stevens  ,Chicago (adult contemporary easy listening Ver.),
  양희은  ,당신의 꿈,있다 작다 있다 아주 작다 있다 있다 작다 있다 아주 작다 있다 라라라 라라라 라라라 작다 작다 떠나다 없다 멀리 떠나다 없다 아주 멀리 떠나다 없다 라라라 라라라 라라라 작다 작다 떠나다 없다 멀리 떠나다 없다 아주 멀리 떠나다 없다 아주 멀리 떠나다 없다 아주 멀리 떠나다 없다
  임지훈  ,세월속에 머문 사랑,많다 시간 가다 가끔 생각나다 추억 있다 혼자 가슴속 간직 잊다 없다 그대 사랑 잊다 너무 오랜 시간 이제 단념하다 하다 느끼다 있다 표현 하다 없다 기다 세월 흘러가다 외면 하다 없다 추억 미소 궁금하다 빛바랜 사진 한장 없다 마음 한구석 남다 젊다 열병 우리 세월 머물다 사랑 표현 하다 없다 기다 세월 흘러가다 외면 하다 없다 추억 미소 궁금하다 빛바랜 사진 한장 없다 마음 한구석 남다 젊다 열병 우리 세월 머물다 사랑 많다 시간 흘러가다 가끔 생각나다 추억 있다 혼자 가슴속 간직 잊다 없다 그대 사랑 빛바랜 사진 한장 없다 마음 한구석 남다 젊다 열병 우리 세월 머물다 사랑 많다 시간 흘러가다 가끔 생각나다 추억 있다 혼자 가슴속 간직 잊다 없다 그대 사랑 그대 사랑 빛바랜 사진 한장 없다 마음 한구석 남다
  심재준  ,비빔밥,우리 제일 크다 그릇 찾다 하다 그릇 퍼넣 나물 가지 고사리 콩나물 기타등등 얹다 고추장 하다 숟가락 맛있다 보다 가루 하다 차다 계란 올리다 보다 참기름 하다 방울 맛있다 보다 비빔밥 보다 가족 맛있다 보다 맛있다 보다 가루 하다 차다 계란 올리다 보다 참기름 하다 방울 맛있다 보다 비빔밥 보다 가족 맛있다 보다 가족 맛있다 보다
  엄인호  ,오늘도 하루를 그냥 보내네,오늘 내리다 두텁다 커튼 드리우다 괜시리 울적하다 지난 추억 젖다 오늘 하루 그냥 보내다 언제 아련하다 이루다 그대 사랑 그립다 말다 말다 시름 설음 젖다 오늘 하루 그냥 보내다 내리다 가슴 밉다 어디 추억 물든 슬프다 노래 소리 방안 가슴 젖다 방안 가슴 젖다 방안 가슴 젖다
  Jaymay  ,Lamb,
  Conway Twitty  ,As Soon As I Hang Up The Phone,
  Sara Evans  ,O Holy Night,
  양희은  ,작은 연못,깊다 오솔길 자그마하다 연못 고이 않다 멀다 옛날 연못 예쁘다 붕어 마리 있다 전해 깊다 작다 연못 어느 맑은 여름날 연못 붕어 마리 서로 싸우다 하다 마리 물위 떠오르다 살이 썩다 들어가다 따르다 썩다 들어가다 연못 없다 되어다 깊다 오솔길 자그마하다 연못 고이 않다 푸르다 나뭇잎 떨어지다 연못 작다 띄우다 깊다 가라앉다 잃다 꽃사슴 헤매다 연못 찾아오다 말다 잠들다 되다 서산 지고 저녁 고요하다 허리 무당벌레 하나 휘익 지나가다 검다 고인 한없다 세월 없이 몸짓 헤매다 수많다 계절 맞다 깊다 오솔길 자그마하다 연못 고이 않다 고이 않다
  정민아  ,떡국,떡국 하다 그릇 먹다 나이 먹다 엄마 먹다 먹다 티비 높다 먹다 공부 하다 매일 일해 먹다 올해 새해 다짐 금연 다이어트 연애 내년 새해 다짐 금연 다이어트 연애 연애 연애 연애 떡국 하다 그릇 늘다 나이 늘다 세상 살이 늘다 인생 늘다 아깝다 청춘 세월 하다 않다 오늘 떡국 먹다 나이 먹다
  장필순  ,빛바랜 시간 거슬러,책가방 메다 구두 신고 다녀오다 상쾌하다 아침 공기 공상 기다 새다 졸리다 오늘 어떻다 재미 생기다 도시락 비우다 낮잠 자고 편지 쓰다 도화지 닮다 웃다 소녀 오늘 어떻다 친구 무얼 하다 보내다 달다 빛바랜 시간 거슬러 날아가다 끝없이 펼쳐지다 눈부시다 오래 되다 메다 노랗다 부르다 안녕하다 세상 떠다니다 목소리 오늘 얼마나 빨리 하루 저물다 달다 빛바랜 시간 거슬러 날아가다 끝없이 펼쳐지다 눈부시다 나이 푸른 바람 정처 없이 떠돌다 제자 리더 나이 푸른 날개 이유 없이 누군가 떠나가다 외로이 쓰러지다 부러지다 아름답다
  Junior Wells  ,Take Off Your Shoes,
  Tuo  ,Beautiful Love,
"  정태춘 ,  박은옥  ",시인의 마을,창문 열다 내다보다 높다 걸리다 깃발 당신 가슴 불어오다 덥다 열기 세찬 바람 눈감다 들다 보다 멀다 대지 달리다 사납다 당신 고요한 가슴 닥쳐오다 가쁜 말발굽 소리 누가 내다 손수건 하다 던지다 리오 작다 가슴 얹다 리오 누가 내다 탈춤 장단 치다 리오 장단 춤추다 하리 고독 친구 방황 친구 상념 끊기다 않다 번민 시인 좋다 일몰 고갯길 넘다 가다 고행 방랑자 끼다 노을 바라보다 시인 마을 오다 소릴 들다 우산 접다 맞다 보다 더욱 가깝다 다가오다 당신 그늘 마음 뿌리다 젖다 대기 애틋하다 우수 누가 내다 다가오다 건네주다 리오 작다 잡다 리오 누가 운명 동무 되다 리오 어리다 시인 돼다 리오 고독 친구 방황 친구 상념 끊기다 않다 번민 시인 좋다 일몰 고갯길 넘어가다 고행 방랑자 끼다 노을 바라보다 시인 마을 오다 소릴 들다
  아를  ,꿈의 요새,이름 오다 어둠 쫓다 지키다 깊다 한밤중 오랜 불면 위로 요새 지다 온전 꿈속 데려가다 잡다
  David Choi  ,By My Side,
  김광석  ,기다려줘,아직 그대 이해 하다 하다 그대 마음 이르다 찾다 그대 슬프다 마음 비추다 있다 변하다 않다 사랑 되다 찾다 있다 어디서 찾다 있다 그대 마음 다다르다 찾다 있다 언제나 멀리 있다 그대 기다리다 주다 기다리다 주다 그대 이해 하다 있다 기다리다 주다 기다리다 주다 그대 이해 하다 있다 아직 그대 이해 하다 하다 그대 마음 이르다 찾다 그대 슬프다 마음 비추다 있다 변하다 않다 사랑 되다 찾다 있다 어디서 찾다 있다 그대 마음 다다르다 찾다 있다 언제나 멀리 있다 그대 기다리다 주다 기다리다 주다 그대 이해 하다 있다 기다리다 주다 기다리다 주다 그대 이해 하다 있다 기다리다 주다 기다리다 주다 그대 이해 하다 있다 기다리다
  Cocoon  ,Mother,
  한선희  ,길을 걸으며,건너다 고개 넘어서다 마을 어제 가다 오늘 갈다 새롭다 민들레 피고 까치 아가씨 지나다 바람 길다 언제나 새롭다 오늘 내일 오늘 내일 건너다 고개 넘어서다 마을 어제 가다 오늘 갈다 새롭다 민들레 피고 까치 아가씨 지나다 바람 길다 언제나 새롭다 오늘 내일 오늘 내일 오늘 내일 오늘 내일
  재주소년  ,나레이션3 (제주시청 어느 모퉁이 자취방),여행 떠나다 크다 기대 없이 데모 씨디 통해 우리 문라이즈 레이블 답신 받다 정말 같다 이다 시기 유재하 음악 대회 동상 받다 작업 우리 재주소년 이름 데뷔 앨범 발표 하다 되어다 오다 노래 공전 히트 기록 하다 이듬해 다시 복학 결정 하다 나다 친구 따르다 강남 제주 한라 대학 입학 하다 재밌다 특별하다 시험 치르다 아니다 수시 원서 접수 학교 짧다 통화 이름 묻다 상봉 이다 하다 자네 이름 마음 들다 나르다 합격 시키다 우리 그렇게 제주도 함께 내려오다 방학 미리 계약 하다 두다 원룸 동거 시작 하다
  Hafdis Huld  ,I Miss The Rain,
  Brooks & Dunn  ,Hard Workin` Man,
  Eric Clapton & B.B. King  ,Come Rain Or Come Shine,
  Johnny Cash  ,Help Me (Album Ver.),
  장재인  ,클라이막스,익숙해지다 섭섭하다 늦다 덮다 불안하다 찾다 싶다 이내 핸드폰 내려놓다 어깨 외로움 어느새다 내다 걸다 보다 인정 싶다 않다 이다 보다 이유 만들다 보다 이미 지난 크다 막스 무너지다 기대다 없다 돼다 보다 인정 싶다 않다 이다 보다 이유 만들다 보다 이미 지난 크다 막스 하나로 설레다 이루다 하나로 흔들리다 다시 이별 예감 오늘 어제 익숙하다 마침표 보다 아직 인정 하다 없다 그렇다 놓다 수가 없다 이유 만들다 주다 모습 어느새다 지치다 가다 기다림 기대다 사라지다 이미 지난 크다 막스 기쁨 슬픔 아픔 흘러가다 되다 기쁨 슬픔 아픔 흘러가다 되다 기쁨 슬픔 아픔 흘러가다 되다 기쁨 슬픔 아픔
  정태춘  ,"아, 대한민국...",맞벌이 영세 서민 부부 방문 잠그다 나가다 사이 지하 셋방 방안 놀다 어리다 자녀 빠지다 나오다 질식 하다 숨지다 나다 아버지 권씨 경기도 부천 직장 어머니 이씨 합정동 파출부 나가다 있다 나가다 하다 방문 자물쇠 잠그다 바깥 현관문 잠그다 두다 상태 이다 연락 받다 이씨 달려오다 열다 다섯 혜영 양은 바닥 엎드리다 영철 더미 묻다 숨지다 있다 어린이 숨지다 크기 바닥 흩어지다 옷가지 비키니 옷장 가구 타다 성냥 함께 그을리다 있다 부부 충남 계룡면 금대 농사 짓다 가난 이기다 지난 서울 오르다 오다 지난해 현재 지하방 전세 백만원 얻다 살아오다 어머니 이씨 경찰 평소 파출부 나가다 부엌 부엌칼 연탄 있다 위험 스럽다 나가다 잃다 유괴 당하다 같다 방문 채우다 없다 눈물 흘리다 평소 이씨 먹다 점심 요강 준비 하다 놓다 나가다 일해 오다 하다 살다 주택 모두 지하방 있다 각각 독립 구조 돼다 있다 젊다 아버지 새벽 나가다 어머니 벌다 파출부 나가다 지하실 단칸 어리다 우리 둘이서 아침 햇살 들다 높다 창문 아래 앉다 방문 자물쇠 잠기다 윗목 밥상 요강 엄마 아빠 돌아오다 우린 하다 없다 테레비 하다 우린 켜다 모르다 보다 테레비 나라 세상 엄마 아빠 하다 안나 우리 집도 우리 동네 안나 조그만 창문 햇볕 스럽다 우린 종일 눕다 천장 바라보다 들다 깨다 인지도 모르다 성냥 장난 하다 고프다 기도 먹다 치우다 오줌 마려 울다 요강 우린 그렇다 하다 없다 동생 아직 자다 하다 후미지다 계단 누구 하나 찾아오다 않다 도둑 강도 옆방 누가 살다 모르다 어쩌면 기다 낭떠러지 인지도 모르다 성냥 그만 옮기다 붙다 눈썹 머리카락 태우다 저기 옮기다 붙다 타오르다 우리 놀란 가슴 엄마 아빠 우리 그렇게 놀라다 엄마 아빠 우리 함께 거기 있다 방문 잠기다 열리다 연기 차고 우린 서로 부둥키다 안고 눈물 흘리다 엄마 아빠 엄마 아빠 우린 그렇게 죽다 엄마 아빠 거기 함께 있다 아니다 엄마 하다 있다 아니다 우리 연기 불길 부둥키다 안고 떨기 엄마 아빠 보고 싶다 방문 세차 손톱 나다 바닥 대기 동생 먼저 막히다 푸다 엄마 아빠 거기 하다 있다 아니다 우리 어느 도망치다 빠지다 나오다 시골 고향 마을 우리 식구 단란 하다 갈다 수만 있다 아니다 우리 가난하다 사람 축복 내리다 그렇다 나르다 아니다 엄마 아빠 주인 그렇다 세상 이다 엄마 아빠 너무 슬프다 이건 엄마 아빠 잘못 알다 그을리다 옷자락 작다 둥이 둥이 두다 떠나다 엄마 아빠 우린 이제 천사 되어다 나라 가다 천사 이렇게 슬프다 세상 다시 내다 오다 수가 없다 언젠가 우린 다시 나라 만나다 엄마 아빠 우리 세상 배우다 가장 예쁘다 말로 마지막 인사 하다 엄마 아빠 엄마 아빠 이제 안녕 안녕
  정태춘  ,"일어나라, 열사여",이상 마르다 너희 가지다 주검 찍히다 독재 흔적 붉다 피로 썩다 살로 외치다 이상 되다 마르다 너희 멸사 봉공 외치다 압제 바람 거짓 역사 되어다 갈대 일어서다 외치다 하다 죽다 감다 남다 모두 부릅뜨다 차다 민주 차다 역사 하다 주검 메다 함께 가다 이상 마르다 너희 모두 죽다 저기 민중 달다 나오다 외치다 앳된 목소리 그이 불다 깨우다 일어나다 열사 깨어나다 투사 일어나다 열사 깨어나다 투사 이상 마르다 이상 마르다 이상 마르다 바람 분다 보아 느끼다 사람 어깨 광풍 분다 보아 죽다 자의 혼백 살아오다 반역 발굽 아래 쓰러지다 우리네 일으키다 세우다 바람 분다 되다 역사 해방 깃발 되어다 저기 오다 부릅뜨다 하다 우리 잔악하다 압제 눈빛 하다 일어서다 하다 우리 패배 딛다 어간 역사 살아나다 승리 부활 상여 메다 나아가다 하다 우리 통일 해방 세상 찾다 부릅뜨다 하다 우리 잔악하다 압제 눈빛 하다 일어서다 하다 우리 패배 딛다 어간 역사 살아나다 승리 부활 상여 메다 나아가다 하다 우리 통일 해방 세상 찾다 나아가다 하다 우리 통일 해방 세상 찾다
  The Paul Butterfield Blues Band  ,Drunk Again,
  꽃다지  ,노래의 꿈,우리 젊다 그때 보다 멀다 바라보다 함께 하다 인간 인간 아름답다 있다 그렇다 세상 하다 함께 하다 허다 젊음 어쩔 없다 분노하다 어쩔 없다 생각 하다 복잡하다 세상 우린 무너지다 저리 불안하다 미래 하다 떠나가다 잡히다 같다 모든 떠나가다 허다 친구여 서럽다 말다 살아오다 살아가다 아직 많다 후회 말다 친구여 다시 돌아가다 대도 우린 자리 만날 젊음 흘러가다 우리 점점 늙다 간다 해도 우리 가슴 깊이 노래 잊다 허다 젊음 어쩔 없다 분노하다 어쩔 없다 생각 하다 복잡하다 세상 우린 무너지다 저리 불안하다 미래 하다 떠나가다 잡히다 같다 모든 떠나가다 허다 친구여 서럽다 말다 살아오다 살아가다 아직 많다 후회 말다 친구여 다시 돌아가다 대도 우린 자리 만날 젊음 흘러가다 우리 점점 늙다 간다 해도 우리 가슴 깊이 노래 잊다 젊음 흘러가다 우리 점점 늙다 간다 해도 우리 가슴 깊이 노래 잊다 노래 잊다
  Brad Paisley  ,River Bank,
  우리나라  ,평화의 노래 통일의 춤을,만나다 가슴 우리 하나 누가 우리 하나 되다 없다 우리 아니다 헤어지다 우리 우리 뜻대로 이제 다시 만나다 하나 되다 부르다 평화 노래 모두 목소리 높이다 세상 어느 아름답다 하다 춤추다 통일 신명 도록 그대 우리 서로 어깨춤 바로 통일 이제 끊다 버리다 하다 녹슨 철조망 어서 종이비행기 날다 보내다 어둠 뚫다 달려가다 그대 통일 열차 넓다 미래 넓다 세상 달려가다 부르다 평화 노래 모두 목소리 높이다 세상 어느 아름답다 하다 춤추다 통일 신명 도록 그대 우리 서로 어깨춤 바로 통일 부르다 평화 노래 모두 목소리 높이다 세상 어느 아름답다 하다 춤추다 통일 신명 도록 그대 우리 서로 어깨춤 바로 통일
  Blake Shelton  ,Austin ,
  유근호  ,Let Me In (Omni Ver.),우린 마치 풀리다 않다 물감 서로 침대 어지럽히다 알다 귓속 오른 타고 내려가다 추다 치다 머물다 감싸다 오늘 널브러진 우린 추다 뱉다 음악 급하다 하다 낮다 깔리다 조명 몸짓 비추다 그림자 눕다 바라보다 추다 치다 머물다 감싸다 오늘 며칠 지나다 우리 향기롭다 얼룩지다 질리 않다 안다
"  Peter, Paul & Mary  ",500 Miles ,타고 있다 기차 놓치다 버리다 가버리다 되다 마일 불어 기적 소리 들다 마일 마일 마일 마일 마일 기적 소리 들다 마일 마일 마일 마일 마일 떨어지다 있다 마일 마일 마일 마일 마일 떨어지다 오다 있다 셔츠 하다 없다 동전 하나 내겐 없다 가요 갈수 없다 갈다 없다 타다 기차 놓치다 신다 가버리다 알다 있다 마일 들리다 휘파람 소리 들리다
  한영애  ,Knockin` On Heaven`s Door (Bob Dylan),
  조형우  ,Fine (Feat. 장재인),어느새다 그대 어떻다 해도 아무렇다 않다 오늘 함께 하다 시간 길다 느껴지다 그대 아니다 미안하다 그렇다 필요 없다 마지막 만남 같다 시간 너무 쉬다 느껴지다 괜찮다 희미하다 추억 낯설다 표정 아쉬움 없이 차다 슬프다 이제 변하다 버리다 우리 사이 너무 멀다 느껴지다 알아보다 수도 없다 희미하다 추억 낯설다 표정 아쉬움 없이 차다 슬프다 진짜 아무렇다 않다 떨리다 붙잡다 않다 겠다 미치다 대다 잡다 돌아가다 순간 이대로 되돌리다 없다 걸다 뒤늦다 아프다 마지막 보다 그렇게 돌아가다 고맙다 말로 우리 이대로
  이명훈  ,가버린 친구에게 바침,날개 휘저으 구름 사이 뜨다 오다 떠나가다 버리다 사람 웃다 얼굴 흘러가다 강물 사라지다 버리다 사람 다시다 오다 머나멀다 떠나가다 한없이 넓다 가슴 세상 사랑 하라 날리다 낙엽 따라서 떠나가다 버리다 울다 보다 오지 않다 불다 보다 대답 없다 흙속 영원하다 들다 한없이 넓다 가슴 세상 사랑 하라 날리다 낙엽 따라서 떠나가다 버리다 울다 보다 오지 않다 불다 보다 대답 없다 흙속 영원하다 들다
  한마음  ,가슴앓이,내려오다 창문 머물다 다가오다 나르다 안다 예전 있다 모습 가지다 모든 주다 싶다 골목길 돌아서다 뛰어가다 그림자 버려진 사랑 어쩌란 흩어지다 마음 어쩌란 아프다 가슴 어쩌란 흩어지다 마음 어쩌란 아프다 가슴 크다 하나 눈물 고이 세상 모든 슬픔 가슴 오다 닿다 웃다 모습 세상 기쁨 담기다 가슴 한빛 비추다 안녕하다 돌아서다 뛰어가다 뒷모습 버려진 사랑 어쩌란말 흩어지다 마음 어쩌란말 아프다 가슴 어쩌란말 흩어지다 마음 어쩌란말 아프다 가슴 어쩌란말 흩어지다 마음 어쩌란말 아프다 가슴 어쩌란말 흩어지다 마음 어쩌란말 아프다 가슴
  라면소년  ,되게 대게,뱃길 시간 수심 미터 철갑 칼날 같다 손길 해초 자르다 개다 찾다 떠나다 성나다 바다 오다 열다 바다 받다 바다 거치다 파도 우리 막다 우릴 지키다 되게 대게 힘들다 모두 하다 되게 대게 하다 하다 되다 되다 이다 대게 그렇다 대게 되게 하다 되게 힘들다 대게 되게 대게 잡기 되게 힘들다 대게 되게 대게 이루어지다 가장 완벽하다 라면 찾다 되게 대게 힘들다 모두 하다 되게 대게 하다 하다 되게 하다 있다 생각 하다 되게 대게 힘들다 모두 하다 되게 대게 하다 하다 되다 되다 이다 대게 그렇다 대게 되게 하다 되게 힘들다 대게 되게 대게 잡기 되게 힘들다 대게 되게 대게 이루어지다 가장 완벽하다 라면 찾다 끼남 어어어어 어어어어
  Shania Twain  ,You`ve Got A Way,
  Lewis Watson  ,What About Today?,
  안치환  ,우리가 어느 별에서,우리 어느 만나다 타다 그립다 우리 어느 그립다 하다 아름답다 사랑 하다 있다 시들다 지다 저물다 바닷가 홀로 어두움 밝히다 그대 그대 그대 뜨다 새벽 지니 뜨다 새벽 지니 우리 어느 헤어지다 별빛 빛나다 우리 어느 잠들다 흔들다 새벽 깨우다 시들다 지다 저물다 바닷가 홀로 어둠 밝히다 그대 그대 그대 뜨다 새벽 지니 뜨다 새벽 지니 뜨다 새벽 지니
  Ashley Monroe  ,If Love Was Fair,
  Mocca  ,Life Keeps On Turning,
