artist,title,Korean_clean_lyric
  포크를 찾는 사람들  ,밤에 피는 장미,외롭다 홀로 걸다 가슴 피다 떨어지다 상처 남다 떨기 장미 슬프다 영혼 되다 잊혀지다 지난날 그립다 가슴 뜨겁다 마음 슬프다 장미 피다 장미 사랑 장미 같다 사랑 돌아오다 하다 시절 떨기 사랑 장미 같다 사랑 피다 장미 사랑 장미 같다 사랑 돌아오다 하다 계절 떨기 사랑 장미 같다 사랑 반복 피다 장미 사랑 장미 같다 사랑 돌아오다 하다 시절 떨기 사랑 장미 같다 사랑 장미
  Johnny Cash  ,Let The Train Blow The Whistle,
  우주프로젝트  ,새벽달빛,새벽 달빛 잠들다 유년 데리다 바래다주다 작다 불빛 같다 젖다 달빛 잠들다 새벽 위로 하다 주다 소리 같다 바람 흘러가다 찾아내다 있다 짙다 구름 덮이다 자리 있다 따르다 잇다 보다 어리다 나다 있다 유치하다 없다 꾸미다 잠들다 시절 따르다 잇다 보다 서툴다 나다 있다 수줍다 진심 이다 같다 시절 달빛 따르다 바람 흘러가다 찾아내다 있다 짙다 구름 덮이다 자리 있다 따르다 잇다 보다 어리다 나다 있다 유치하다 없다 꾸미다 잠들다 시절 따르다 잇다 보다 서툴다 나다 있다 수줍다 진심 이다 같다 시절 달빛 따르다
  열아홉스물  ,대전에서,안녕 오늘 어디 가보다 사실 하다 어디 좋다 백목련 예쁘다 거리 손잡다 걸다 좋다 같다 오월드 기린 만나다 갈다 갑천 자전거 타다 갈다 만해 알다 하다 세상 제일 재밌다 해주다 안녕 자다 가다 아니다 분만 있다 아직 보여주다 많다 보다 아름답다 대전 같다 유림 공원 산책 하다 갈다 천문 보다 갈다 만해 알다 하다 우주 제일 재밌다 해주다 재밌다 맛있다 모두 대전 있다 만해 알다 하다 우주 제일 재밌다 해주다 유림 공원 산책 하다 갈다 천문 보다 갈다 만해 알다 하다 우주 제일 재밌다 해주다 재밌다 맛있다 모두 대전 있다 만해 알다 하다 우주 제일 재밌다 해주다
  이장혁  ,제발 (Remastered),제발 그만 두다 인형 아니다 알다 다시 생각 해보다 들다 얼굴 다시 보다 외로워 바라다 완전하다 하다 한낱 외롭다 사람 제발 숨막히다 인형 되다 제발 목말 마음 열다 사랑 해보다 제발 그만 두다 새장 새다 너무 지치다 알다 다시 생각 해보다 처음 만난 거리 걸다 보다 외로워 바라다 완전하다 하다 한낱 외롭다 사람 제발 숨막히다 인형 되다 제발 목말 마음 열다 사랑 마음 열다 사랑 마음 열다 사랑 해보다
  Kings Of Convenience  ,Misread,
  산이슬  ,보내는 마음,그대 보내다 쓸쓸하다 길다 소녀 가슴 찬비 내리다 피다 시절 만나다 당신 낙엽 밟다 떠나가다 헤어지다 살다 내사 그대 잊다 생각나다 소식 전해 주오 해저 산길 흔들다 웃다 보내다 마음 헤어지다 살다 내사 그대 잊다 생각나다 소식 전해 주오 해저 산길 흔들다 웃다 보내다 마음
  김광석  ,슬픈 노래,기다 세월 흘러가다 알다 모두 잊다 알다 다가오다 마음 울리다 빗물 다가오다 흘러가다 알다 흔적 없이 잊다 알다 지나다 가로수 잎새 이슬 눈물 만난 세상 슬프다 우연 잊혀지다 않다 모습 그리다 사랑 기다 그림자 남아 걷다 길가 피어 세상 향기롭다 반기다 잊혀지다 추억 마음 울리다 향기롭다 다가오다 아직도 거리 있다 지나치다 바람 있다 그대 잊다 내리다 벤치 모두 잊어버리다 만난 세상 슬프다 우연 잊혀지다 않다 모습 그리다 사랑 기다 그림자 남아
  하찌와 TJ  ,축제의 밤,축제 끝나다 조용하다 거리 뜨겁다 가슴 시원하다 입가 맴돌다 휘파람 소리 운치 있다 우리 비추다 달빛 오늘 같다 생각 나다 없다 조금씩 변하다 같다 하루하루 한가운데 휩쓸다 이끌다 그렇게 꿈꾸다 살다 해도 영원하다 자다 없다 내일 뜨다 혹시 오다 맑다 생각 나다 없다 이제 안녕 멀리 들려오다 번개 소리 창문 울다 우리 그림 한겨울 같이 타다 인용 자전거 심각하다 진지하다 웃기다 말다툼 이제 벌써 멀다 생각 나다 없다 오늘 같다 생각 나다 없다 이제 안녕 이제 안녕 이제 안녕
  스노우핑거  ,너의 연애 브이로그 (Feat. 김민아),처음 그냥 그렇다 알다 마음 마음 좋아하다 하다 하다 마음 그렇다 좋아하다 절대 아끼다 하다 않다 없다 잖다 지나다 나서다 후회 하다 소용없다 고백 언제나 타이밍 잖다 허다 해보다 허다 너무나 좋아하다 허다 해보다 허다 너무나 사랑 하다 아무리 생각 하다 마음 좋아하다 생각 하다 좋아하다 하다 하다 마음 모르다 해도 생각 하다 고백 하다 없다 잖다 지나다 나서다 후회 하다 소용없다 고백 언제나 타이밍 잖다 허다 해보다 허다 너무나 좋아하다 허다 해보다 허다 너무나 사랑 하다 허다 해보다 허다 너무나 좋아하다 허다 해보다 허다 너무나 사랑 하다 허다 해보다 허다 너무나 좋아하다 허다 해보다
  Elsa Kopf  ,Dreams Behind The Door,
  Leonard Cohen  ,Bird On A Wire,
  Dan & Shay  ,How Not To,
  플랜더블유  ,Youth,어제 너무 닮다 오늘이 시작 되다 하루 하다 달이 바람 시작 하다 이미 늦다 지우다 버리다 늦다 버리다 방황 하다 늦다 바쁘다 타고 머리 어지럽다 흐릿해 희다 공기 있다 없다 어디가 종착역 있다 가까이 작다 쉬다 전혀 보이지 않다 구름 않다 여전하다 지나가다 계절 늦다 않다 새로이 바뀌다 정답 없다 정답 각박하다 상속 스산 공기 조언 없다 이정표 하나 없다 건조하다 흩날리다 그림자 없다 어디가 종착역 있다 가까이 작다 쉬다 전혀 보이지 않다 앓다 있다 청춘 시간 그립다 되다 일어나다 한걸음씩 걸다 나아가다 있다 어제 너무 닮다 오늘이 시작 되다 하루 하다 달이 바람
  양희은  ,저 바람은 어디서?,바람 어디서 불어 오다 어디 어디 바람 불어 가다 어디 살다 싶다 머나멀다 떠나다 언제 다시 돌아오다 아무렇다 약속 없이 세상 혼자 버려진 눈빛 밤하늘 수많다 빛나다 언제 꾸다 하다 마리 되다 높이 올라가다 세상 내다 보다 바람 어디서 불어 오다 어디 바람 불어 가다 아무래도 없다 산다 의미 어느 나르다 지나가다 바람 가르치다 주다 바람 어디서 불어 오다 어디 바람 불어 가다
  양희은  ,세노야 세노야,노야 노야 바다 우리 바다 우리 가다 노야 노야 기쁘다 일이 주다 슬프다 일이 주네 노야 노야 기쁘다 일이 바다 주다 슬프다 일이 받다 노야 노야 바다 우리 바다 우리 가다
  이한철X나우  ,이 나이쯤에 (With 바야흐로),나이 화분 가꾸다 나이 앞산 오르다 나이 거실 티비 편하다 눕다 막장 사랑 얘기 드라마 알다 나이 장미꽃 사보다 나이 유행가 부르다 나이 남다 머릴 기르다 무스 바르다 예쁘다 카페 커피 말다 나이 그대 만나다 달라지다 하루 나이 그냥 나이 웃다 있다 그대 보다 가슴 힘차다 뛰다 나이 설레임 느끼다 나이 하다 나이 하다 사람 만나다 마음 주다 사랑 금실 엮는다 나이 나이 그대 만나다 달라지다 하루 나이 그냥 나이 웃다 있다 그대 보다 가슴 힘차다 뛰다 나이 설레임 느끼다 나이 하다 나이 하다 사람 만나다 마음 주다 사랑 금실 엮는다 나이
  Julie Levy  ,Erev Shel Shoshanim,장미 저녁 장미 저녁 우리 작다 함께 나가다 보아 몰약 향신료 당신 아름답다 따라서 장미 저녁 우리 작다 함께 나가다 보아 몰약 향신료 당신 아름답다 따라서 장미 저녁 우리 작다 함께 나가다 보아 몰약 향신료 당신 아름답다 따라서 이제 서서히 다가오다 산들바람 긋다 장미 풍기다 당신 조용하다 노래 불다 주다 싶다 당신 바치다 사랑 노래 새벽 비둘기 찾다 당신 머리 이슬 젖다 아침 되어다 당신 입술 장미꽃 붉다 타오르다 당신 입술 키스 싶다 이제 서서히 다가오다 산들바람 긋다 장미 풍기다 당신 조용하다 노래 불다 주다 싶다 당신 바치다 사랑 노래 장미 저녁 우리 작다 함께 나가다 보아 몰약 향신료 당신 아름답다 따라서
  한동준  ,세상을 바꿔,오늘 하루 그냥 그렇게 변하다 없이 지나다 어쩔 없다 뭔가 느끼다 힘겹다 하루 무기 하다 그저 가지 차다 없다 뭔가 있다 두렵다 살다 동안 조금씩 아주 조금씩 바꾸다 보다 고개 들다 세상 보다 새롭다 희망 가슴 마음 열다 얘기 하다 보다 내일 있다 우어 없이 세상 바꾸다 오늘 하루 그냥 그렇게 변하다 없이 지나다 어쩔 없다 뭔가 느끼다 힘겹다 하루 무기 하다 그저 가지 차다 없다 뭔가 있다 두렵다 살다 동안 조금씩 아주 조금씩 바꾸다 보다 고개 들다 세상 보다 새롭다 희망 가슴 마음 열다 얘기 하다 보다 내일 있다 우어 없이 세상 바꾸다 고개 들다 세상 보다 푸르른 희망 우리 마음 열다 얘기 하다 보다 내일 있다 우어 하다 없이 세상 바꾸다
  박강수  ,시작하기,버리다 없다 이제 모든 잃어버리다 한번 기회 순간 놓치다 없다 마지막 영원하다 변하다 않다 시작 되어다 남다 시간 다주 어도 좋다 사람 그대 사랑 하다 있다 그대 하다 남다 시간 다주 어도 좋다 사람 그대 놓치다 수가 없다 마지막 영원하다 변하다 않다 시작 되어다 남다 시간 다주 어도 좋다 사람 그대 사랑 하다 있다 대화 하다 남다 시간 다주 어도 좋다 사람 그대
  Judy Collins  ,Song For Martin ,
  Hayley Ross  ,Barracuda,
  포커스  ,사랑이라는 이유로,사랑 이유 새우다 많다 멀어지다 기억 묻히다 함께 나누다 우리 많다 얘기 가슴 남아 다시 추억 미소 내다 남기다 주네 눈물 뒷모습 고여 떠나다 없다 같다 사랑 이유 많다 엮어가 언젠가 늘다 우리 함께 나누다 시간 위해 사랑 이유 많다 엮어가 언젠가 늘다 우리 함께 나누다 시간 위해 눈물 뒷모습 고여 떠나다 없다 같다 사랑 이유 많다 엮어가 언젠가 늘다 우리 함께 나누다 시간 사랑 이유 많다 엮어가 언젠가 늘다 우리 함께 나누다 시간 위해 라랄 라랄 랄라 랄라 랄라 라랄 랄라 라랄 라랄 라랄 랄라 랄라 랄라 라랄 랄라 라랄 라랄 라랄 랄라 랄라 랄라 라랄 랄라 라랄 라랄 라랄 랄라 랄라 랄라 라랄 랄라 라랄 라랄 라랄 랄라 랄라 랄라 라랄 랄라 라랄
  한대수  ,나혼자,하다 우리 사랑 없다 떠나다 모습 혼자 그냥 없이 무엇 진실 무엇 시련 한평생 그대 위해 바치다 혼자 닫히다 문소리 시간 가다 모르다 오른손 마주 잡다 언약 연기 희망 미래 어디 꿈속 헤매다 사랑 사랑 인생 길이
"  박강수 ,  박창근  ",바로 나,하다 내리다 햇살 의미 바로 바로 위로 떨어지다 눈물 대상 바로 바로 하다 내리다 의미 바로 바로 위로 떨어지다 슬픔 대상 바로 바로 가슴속 피다 붉다 당신 하다 영원 향기 취해 추다 깊다 깊다 빠지다 하다 내리다 햇살 의미 바로 바로 위로 떨어지다 눈물 대상 바로 바로 가슴속 피다 붉다 당신 하다 영원 향기 취해 추다 깊다 깊다 빠지다 하다 내리다 햇살 의미 바로 바로 위로 떨어지다 눈물 대상 바로 바로
  Hanne Sorvaag  ,Always On The Run,
  Laura Marling  ,Song For Our Daughter,
  Bob Dylan  ,Make You Feel My Love,
  Guantanamo Bay Surf Club  ,Escargot Blues,
  김의철  ,섬아이,막막하다 바다 솟다 외딴 하다 소녀 검다 그을리다 얼굴 리다 잠들다 어리다 소녀 오랜 바위 걸터 앉다 정경 꿈꾸다 아름답다 안고 한없이 한없이 미소 짓다 먹구름 밀려오다 소나기 쏟다 파도 소리 밀리다 리다 엿보다 하나 있다 오랜 바위 걸터 앉다 정경 꿈꾸다 아름답다 안고 한없이 한없이 미소 짓다
  Ralph McTell  ,Streets Of London,
"  J n joy 20 (유준상, 이준화)  ",이제 울지 마,그대 오다 가기 그대 오다 사랑 변하다 울먹울먹 하다 눈물 차마 닦다 하다 그게 후회 되다 돌아서다 얘기 하다 아니다 그냥 걸다 바람 자꾸 잡다 그대 떠나가다 하다 붙잡다 주다 차다 좋다 이미 늦다 버리다 지나 버리다 가슴 한번 그대 가다 모습 보다 버리다 마음 차마 없다 자다 가요 자다 가요 사랑 하다 그대 그대 울다 자다 가요 그대 그대 울다
  Melanie Safka  ,The Nickel Song,
  Jennifer Waescher  ,Beautiful You,
  더하얀  ,보고싶어 (With 지애),하다 사람 오다 대완 다른 사람 좋아하다 하다 사람 사람 오다 정반대 사람 나르다 알고싶다 하다 사람 괜찮다 아니다 괜찮다 알다 결국 지나가다 사람 이다 그대 생각나다 괜찮다 대다 아니다 하이 그대 보고 싶다 사람 그대 아니다 하이 익숙하다 그대 보다 멈추다 이렇다 하다 그대 없다 사람 설레다 하다 그대 사랑 하다 하이 그대 보다 사람 그대 아니다 하이 익숙하다 그대 보다 멈추다 믿다 되다 그대 같다 사람 그대 생각 나다 그대 아리 깊다 남아 그대 아니다 사람 힘드다 하이 그대 똑같다 그대 말투 눈빛 하이 그대 그렇다 그땐 정말 사랑 하다 사랑 하다 사랑 하다
  Rosemary & Garlic  ,Blue Boy,
  장필순  ,애월낙조,언제 하다 노을 보다 가다 싶다 나다 거길 기억 하다 그때 보다 노을 주홍 구름 덮이다 버리다 바다 믿다 없이 크다 붉다 태양 잠기다 누군가 하다 슬픔 노을 좋아하다 우리 아직 기억 하다 평화 순간 감사하다 노을 물든 순간 감사하다 노을 물든 조용하다 다가오다 푸른 밤하늘 어느새다 초저녁 바람 불다 애월 포구 작다 산책로 벤치 앉다 하다 모두 잊다 애월낙 물들다 순간 감사하다 노을 물든 순간 감사하다 노을 물든 조용하다 다가오다 푸른 밤하늘 어느새다 초저녁 바람 불다 애월 포구 작다 산책로 벤치 앉다 하다 모두 잊다 애월낙 물들다
  새봄 (saevom)  ,사랑으로부터 (Guitar ver.) (Inst.),열리다 그대 미소 내다 지다 젖다 들다 봄빛 웃음 여름 안기다 햇살 같다 사랑 아주 사소하다 아픔 연연하다 아무 모르다 안다 언제나 서로 있다 없다 대도 하다 헤아리다 보기 사랑 하다 웃다 있다 가끔 미우다 그대 다행 세상 하나 선물 우릴 위해 살아가다 불빛 지고 어둠 밀려오다 우릴 삼키다 버리다 오다 가을 고요하다 겨울 담담하다 오래도록 머물다 없다 은하 영영 이대로 아래 영원하다 걸음 맞추다 걷다 충분하다 기다리다 사랑 사랑 하다 웃다 있다 가끔 미우다 그대 다행 세상 하나 선물 우릴 위해 살아가다 하나 약속 하다 누가 우리 믿다 황홀하다 그대 찬란하다 그대 마지막 오다 고맙다
  William Elliott Whitmore  ,Bury Your Burdens In The Ground,
  이주아  ,아프고 아파,사랑 하다 하다 사랑 하다 하다 물어보다 꽃잎 슬프다 대답 기다리다 사랑 이렇게 또다시 상처 주다 이별 운명 아픔 몰다 넣다 시간 맡기다 마음껏 어도 보다 여전하다 아프다 아프다 아프다 아프다 모든 잊다 모든 지우다 물어보다 꽃잎 슬프다 대답 하다 사랑 이렇게 또다시 상처 주다 이별 운명 아픔 몰다 넣다 시간 맡기다 마음껏 어도 보다 여전하다 아프다 아프다 아프다 아프다
  해바라기  ,어서 말을해,바보 잡고 하다 바보 사랑 한단 하다 마디 잡고 하다 떠나다 가버리다 어서 흔적 없다 거리 거리 마다 하다 사람 주다 무슨 소용 있다 가다 나다 바보 잡고 하다 바보 사랑 한단 하다 마디 잡고 하다 떠나다 가버리다 어서 흔적 없다 거리 거리 마다 하다 사람 주다 무슨 소용 있다 가다 나다 어서 어서 어서 어서 어서 어서 어서 어서 어서 어서 어서 어서 어서 어서 어서 어서 어서 어서 어서 어서
  Bob Dylan  ,Thunder On The Mountain,
  해바라기  ,모두가 사랑이예요,모두 이별 공간 이별 수많다 시간 이지 이지 콧날 지고 아프다 슬픔 알다 모두 사랑 사랑 하다 사람 많다 사랑 해주다 사람 많다 모두 사랑 마음 넓어지다 예쁘다 같다 행복 알다 콧날 지고 아프다 슬픔 알다 슬픔 알다
  서유석  ,가는 세월,가다 세월 누구 수가 있다 흘러가다 시냇물 수가 있다 아가 자라나다 되다 슬픔 행복 우리 변하다 변하다 없다 날다 가다 달이 가다 가다 산천초목 끼다 되다 마음 영원하다 변하다 없다 날다 가다 달이 가다 가다 산천초목 끼다 되다 마음 영원하다 되다 마음 영원하다
  Colbie Caillat  ,You Got Me,
  원스윗데이  ,그대 내 마음에,그대 마음 그대 마음 그대 다가 오다 오다 건네다 있다 저기 그대 쳐다보다 무슨 일이 굳어지다 가다 입술 무슨 하다 하다 그대 마음 그대 마음 그대 마음 들어오다 들어오다 남자친구 있다 고백 하다 뵈다 하나 없다 그대 마음 그대 마음 그대 마음 들어오다 들어오다 하다 고백 받다 있다 웃다 사랑 하다 사랑 하다 뜨다 가장 먼저 얼굴 떠올리다 잠들다 항상 데이트 김칫국 말다 그대 마음 그대 마음 그대 마음 들어오다 들어오다 남자친구 있다 고백 하다 뵈다 하나 없다 그대 마음 그대 마음 그대 마음 들어오다 들어오다 하다 고백 받다 있다 웃다 이렇다 마음 알아주다 이렇다 마음 받다 그대 나오다 만나다 보다 망설이다 말다 이제 그대 마음 그대 마음 그대 마음 들어오다 들어오다 남자친구 있다 고백 하다 뵈다 하나 없다 그대 마음 그대 마음 그대 마음 들어오다 들어오다 하다 고백 받다 있다 웃다 사랑 해주다 사랑 해주다
  Simon & Garfunkel  ,"So Long, Frank Lloyd Wright",
  안치환  ,노동자의 길,그립다 고향 부모 떠나다 더냐 세월 묻히다 살아오다 노동자 허다 주눅 마르다 외로워 마르다 모든 슬픔 털다 버리다 노동자 참세상 우린 알다 가다 도나 하나 되어다 자랑스럽다 노동자 간주 부평초 떠가다 보다 없다 인생살이 세상 만물 일구다 내다 떳떳하다 노동자 더냐 허다 주눅 마르다 서럽다 마르다 눈물 따윈
"  John Lee Hooker ,  Canned Heat  ",You Talk Too Much,
  J.J. Cale & Eric Clapton  ,Danger,
  폴레폴레 레코드  ,외로움의 시작,머릴 부여잡다 뜨다 일어나다 하루 시작 하다 모두 떠나다 버리다 홀로 남다 우리 거울 나르다 보다 외로움 남다 식탁 홀로 앉다 먹다 공허하다 조금씩 채우다 있다 보다 딱하다 갈다 없다 답답하다 마음 발걸음 닿다 정처 없이 떠나가다 꺼지다 어둠 내려오다 밝다 아침 허락 되다 않다 보다 밝다 웃음 허락 되다 않다 보다 누가 있다 외로움 남다 딱하다 갈다 없다 답답하다 마음 발걸음 닿다 정처 없이 떠나가다 꺼지다 어둠 내려오다 밝다 아침 허락 되다 않다 보다 밝다 웃음 허락 되다 않다 보다 누가 있다 외로움 남다 누가 있다 외로움 남다 머릴 부여잡다 뜨다 일어나다 하루 시작 하다 모두 떠나다 버리다 홀로 남다 우리 거울 나르다 보다 외로움 시작 되다 외로움 시작 되다 외로움 시작 되다
  4월과 5월  ,욕심없는 마음,싶다 집다 작다 초가집 먹다 싶다 옥수수 욕심 없다 마음 하다 마르다 사람 사람 워워워 아하 입다 싶다 저고리 갖다 싶다 작다 성경책 욕심 없다 마음 하다 마르다 사람 사람 워워워 아하 싶다 집다 작다 초가집 먹다 싶다 옥수수 욕심 없다 마음 하다 마르다 사람 사람 워워워 아하 입다 싶다 저고리 갖다 싶다 작다 성경책 욕심 없다 마음 하다 마르다 사람 사람 워워워 아하
  Taylor Swift  ,Superman,
  Eric Clapton  ,Double Trouble,후렴
  양희은  ,내 님의 사랑은,사랑 따르다 흘러가다 봄바람 아롱대다 언덕 저편 아지랑이 사랑 따르다 흘러가다 푸른 물결 희다 파도 물든 저녁 노을 사랑 하다 그대 돌아오다 그대 없다 세상 누굴 위해 사나 사랑 따르다 흘러가다 가을 바람 떨어지다 젖다 작다 낙엽 사랑 따르다 흘러가다 눈길 위로 남겨지다 발자욱 사랑스럽다 그대 돌아오다 그대 그대 없다 세상 누굴 위해 사나 사랑 깊다 외로움 깊다
  김진호 (SG워너비)  ,치맥 (Inst.),오다 않다 여름밤 뜨겁다 나오다 상관없다 세상 이야기 오늘 이야기 함께 나누다 사람 원하다 전화 바람 좋다 딱하다 하다 없다 세상 좋아지다 기계 노예 돼다 점점 사라지다 나오다 오오오오오 맥주 들다 오오오오오 집키 들다 오오오오오 살다 오오오오오 우리 노래 하다 전화 바람 좋다 딱하다 하다 없다 세상 좋아지다 기계 노예 돼다 점점 사라지다 나오다 오오오오오 맥주 들다 오오오오오 집키 들다 오오오오오 살다 오오오오오 우리 노래 하다 지난 후회 지나 가버리다 오늘 순간 웃다 그렇다 오늘 기분 좋다 말다 서로 살다 느끼다 보다 오오오오오 맥주 들다 오오오오오 집키 들다 오오오오오 살다 오오오오오 우리 노래 하다 오오오오오 맥주 들다 오오오오오 집키 들다 오오오오오 살다 오오오오오
  Dan Seals  ,(You Bring Out) The Wild Side Of Me,
  Augustin  ,Magnet Balls (feat. Jana Iris),
  Simon & Garfunkel  ,The Boxer,
  송창식  ,사랑이야,당신 누구 이렇게 마음 깊다 거기 찾아오다 어느새다 촛불 하나 이렇게 밝히다 놓다 어느 어느 이렇게 당신 피우다 놓다 이렇게 타오르다 있다 언젠가 어느 가다 한번 얼굴 가슴 항상 혼자 그리다 보다 모습 한번 눈길 영혼 사랑 사랑 당신 누구 이렇게 마음 깊다 거기 찾아오다 어느새다 시냇물 하나 이렇게 흘리다 놓다 어느 어느 바람 이렇게 당신 흘리다 놓다 조용하다 이렇게 영원하다 있다 언젠가 어느 가다 한번 오다 같다 순간 가슴속 항상 혼자 예감 하다 순간 한번 미소 터지다 버리다 영혼 사랑 사랑
  징검다리  ,여름,기다 여름 오다 가슴 열다 넝쿨 장미 그늘 젊음 넘치다 산도 좋다 좋다 떠나다 여행 마주치다 사람 사랑 오다 가다 여름 젊음 계절 여름 사랑 계절 갈다 사이 바람 불어 하다 더위 씻다 오다 모닥 불가 우리 익다 여름 젊음 계절 여름 사랑 계절 갈다 사이 바람 불어 하다 더위 씻다 오다 모닥불 가다 우리 익다 여름 젊음 계절 여름 사랑 계절 여름 젊음 계절 여름 사랑 계절
  비스윗  ,그해 여름 (inst.),자주 마주치다 골목 이제 없다 어디 사라지다 버리다 걸다 해주다 이야기 많다 내다 보여주다 예쁘다 미소 이제 없다 알다 매일 기다리다 기억 남아 버리다 가로등 아래 시계 쳐다보다 언제 돌아오다 혼자 보내다 시간 늘다 기다리다 몰래 기다리다 어느 종일 보이지 않다 어디 사라지다 버리다 걸다 해주다 마음 커지다 가다 가로등 아래 시계 쳐다보다 언제 돌아오다 혼자 보내다 시간 늘다 기다리다 아쉽다 마음 시간 건네다 이름 모르다 그립다 기도 어렵다
  송용창  ,비행,멀리 불빛 비치다 응시 있다 나지막하다 바람 노래 들다 깊다 호흡 말다 날개 펼치다 기대다 없다 떠나다 물결 점점 탁하다 가다 파헤치다 병들다 스스로 보다 하다 세상 욕심 취해 점점 말라가 돌아가다 없다 비행 하다 날다 쉬다 찾다 하나 말르다 가다 묻다 물다 모든 눈물 누구 슬픔 건지다 물결 점점 탁하다 가다 파헤치다 병들다 스스로 보다 하다 세상 욕심 취해 점점 말라가 돌아가다 없다 비행 하다 날다 쉬다 찾다 하나 말르다 가다 묻다 물다 모든 눈물 누구 슬픔 건지다
  트윈 폴리오  ,모닥불,모닥불 타오르다 불꽃 피다 모닥불 노래 되어다 멀리 멀리 퍼지다 모닥불 희미하다 달빛 아래 없이 바라보다 눈길 모닥불 하나 되어다 어둔밤 감싸다 모습 새벽 우리 다가오다 아침 알다 우리 그대로 모닥불 함께 모닥불 타오르다 불꽃 피다 모닥불 노래 되어다 멀리 멀리 퍼지다 모닥불 희미하다 달빛 아래 없이 바라보다 눈길 모닥불 하나 되어다 어둔밤 감싸다 모습 이슬 우리 내려앉다 아침 아리다 우리 그대로 모닥불 함께
  이수만  ,모든 것 끝난 뒤,하다 구름 떠가다 둑길 건너 넘다 멀다 기적 소리 홀로 외로워 자리 떠나다 않다 누구 기다리다 무엇 바라다 누구 기다리다 무엇 바라다 끝나다
