artist,title,Korean_clean_lyric
  오마이걸  ,메아리,느낌 왠지 보다 있다 낯설다 않다 정글 야자나무 설레다 사실 초록빛 가깝다 온종일 오르락내리락 이렇다 알다 하다 그렇다 거기 안녕 좋다 아침 아무 가보다 멀리 가보다 사랑 모험 빨리 이렇다 달리기 있다 솔직하다 만인 같다 머리카락 올리다 묶다 달려가다 전하 싶다 맘속 메아리 소리 태양 아래 그을리다 뜨겁다 느껴지다 진심 좋아하다 아주 많이 보이다 들리다 확신 걸음걸이 목소리 인기척 서로 마음 한가운데 들어오다 있다 거지 머리 같다 때마침 적다 소나기 아무 가보다 높이 오르다 사랑 모험 마른하늘 빨리 날아오르다 느낌 기분 좋다 떨리다 멋대로 어깨 머리카락 올리다 묶다 달려가다 전하 싶다 맘속 메아리 소리 태양 아래 그을리다 뜨겁다 느껴지다 진심 좋아하다 아주 많이 메아리 소리 좋아하다 많이 메아리 소리 좋아하다 많이 메아리 소리 좋아하다 많이 메아리 소리 좋아하다 많이 머리카락 올리다 묶다 달려가다 전하 싶다 맘속 메아리 소리 태양 아래 그을리다 뜨겁다 느껴지다 진심 좋아하다 아주 많이 맘속 메아리 소리 좋아하다 아주 많이
  블락비 바스타즈  ,타이트하게,조금씩 들어가다 마르지 않다 적다 그대로 잡다 하루 종일 생각 해도 살결 느껴지다 생각 점점 젖다 들어가다 입술 자꾸 말르다 가다 하루 종일 상상 뜨겁다 멈추다 수가 없다 숨다 해도 거부 하다 없다 안고 싶다 타이 해주다 채우다 있다 이대로 계속 해주다 맞추다 내다 모습 기억 하다 있다 목소리 좋다 끌어안다 그렇다 대고 하다 무심코 머리 묶다 예쁘다 나르다 조이다 허물 벗기다 수험생 되다 성적 욕구 넘치다 하루 종일 생각 해도 살결 느껴지다 생각 점점 젖다 들어가다 입술 자꾸 말르다 가다 하루 종일 상상 뜨겁다 멈추다 수가 없다 숨다 해도 거부 하다 없다 안고 싶다 타이 해주다 채우다 있다 이대로 계속 해주다 맞추다 내다 모습 기억 하다 있다 나르다 다루다 나르다 다루다 그냥 그게 좋다 그냥 그게 좋다 나르다 다루다 나르다 다루다 그냥 그게 좋다 타이 해주다 채우다 있다 이대로 계속 해주다 맞추다 내다 모습 기억 하다 있다
  VERIVERY  ,With Us,혼자 걷다 있다 믿다 언제나 아픔 외롭다 폭풍 같다 견디다 누군가 붙잡다 주다 원하다 언젠가 공기 스미다 들다 같다 바라보다 웃다 만들다 혼자 알다 거치다 세상 혼자 알다 세다 바람 촛불 꺼지다 위태 나라 잡고 함께 하다 두렵다 않다 붉다 태양 바다 우린 영원하다 거치다 세상 놓이다 아직 멀리 우린 함께 하다 지치다 새벽 푸르다 변하다 추억 그리다 빛나다 싶다 시간 오다 쓰다 쓸다 눈물 삼키다 하나 되다 지키다 주다 마음 붉다 태양 바다 우린 영원하다 거치다 세상 놓이다 아직 멀리 우린 함께 하다 잃다 지도 내다 보여주다 서글프다 시간 걷다 대도 시련 내게로 다가 하나로 버티다 있다 태양 바다 영원하다 세상 놓이다 아직 멀리 우린 함께 하다 힘드다 하루 아프다 어제 감다 느끼다 아무렇다 않다 있다 멀다 미래 떨리다 정말 두렵다 않다 거치다 세상 놓이다 아직 멀리 우린 함께 하다
  원더걸스  ,One Black Night,이미 늦다 가져가다 순간 검다 온몸 퍼지다 가다 있다 빨르다 심장 소리 점점 커지다 갈증 돌이키다 없다 어둠 모든 삼키다 버리다 사이 서로 세상 전부 돼다 데려가다 주다 차오르다 검다 물들다 아침 우릴 찾다 하다 입술 번지 모든 제자리 잃다 점점 가까워지다 견디다 없다 전부 느껴지다 작다 떨리다 외로움 전부 지우다 어둠 모든 삼키다 버리다 사이 서로 세상 전부 돼다 데려가다 주다 차오르다 검다 물들다 아침 우릴 찾다 하다 어둠 모든 삼키다 버리다 사이 서로 세상 전부 돼다 데려가다 주다 차오르다 검다 물들다 아침 우릴 찾다 하다
"  이창섭 ,  엘키 (CLC)  ",연극이 끝난 후 (Feat. 허타) (Inst.),연극 끝나다 혼자 객석 남아 조명 꺼지다 무대 본적 있다 연극 끝나다 혼자 무대 남아 아무 없다 객석 보다 있다 음악 소리 분주하다 돌아가다 세트 멈추다 무대 위엔 정적 남다 어둠 있다 정적 남다 고독 있다 어김없이 찾아오다 공허하다 이제 깨어나다 제자리 돌아가다 하다 아직 꿈속 헤매다 그리다 매일 이상 연극 연극 아니다 살다 어리다 광대 빨갛다 나르다 밝히다 다른 돼다 오늘 잡다 당신 놓다 하나 연극 끝나다 가면 벗다 힘차다 박수 뜨겁다 관객 찬사 사라지다 객석 정적 남다 어둠 있다 배우다 무대 입다 노래 하다 춤추다 불빛 배우 따라서 바삐 돌아가다 끝나다 모두 떠나다 버리다 무대 위엔 정적 남다 홀로 남겨지다 싫다 이루다 생각 깊다 어둠 있다 연극 끝나다 잡고 싶다 연극 끝나다 연극 끝나다 정적 남다 연극 끝나다 어둠 있다 연극 끝나다 정적 고독 슬픔 남다
  종현 (JONGHYUN)  ,할렐루야 (Hallelujah),세상 이렇다 수가 이렇다 수가 너무 아름답다 이렇다 수가 뭐라다 머릴 굳다 보다 표현 하다 힘드다 명작 여자 남자 표적 넘다 없다 성스럽다 완벽 감사하다 천사 보이다 눈물 고여 할렐루야 천사 보이다 눈물 고여 감동 넘치다 할렐루야 내다 감탄 크다 감동 주네 기도 노랗다 하다 할렐루야 할렐루야 처음 보다 행운 전부 써다 전혀 아깝다 않다 엄청나다 어쩌나 여자 남자 표적 넘다 없다 성스럽다 완벽 감사하다 천사 보이다 눈물 고여 할렐루야 천사 보이다 눈물 고여 감동 넘치다 할렐루야 기쁘다 벅차오르다 눈물 흘리다 기도 노랗다 하다 할렐루야 할렐루야 할렐루야 할렐루야 이렇다 수가 이렇다 수가 보다 자꾸 나다 모르다 할렐루야 천사 보이다 눈물 고여 나다 모르다 할렐루야 신의 하다 또는 치명 실수 감사하다 존재 할렐루야 할렐루야 할렐루야 할렐루야
  비스트  ,미운사람,오늘 하루 시계 그대 주윌 맴돌다 내일 하루 그대 환상 채우다 차다 미우다 사람 그렇다 모르다 어떻다 예쁘다 얼굴 하다 둔하다 그대 그저 알아주다 오늘 모두 모두 그대 하다 떨리다 심장 이상하다 대다 보고 뛰다 있다 차갑다 눈빛 녹다 대다 따라가다 차다 미우다 사람 그렇다 모르다 어떻다 예쁘다 얼굴 하다 둔하다 그대 그저 이렇다 다가오다 마음 모두 모두 그대 드리다 그대 그저 알아주다 오늘 모두 모두 그대 하다 그대 그저 이렇다 다가오다 마음 모두 모두 그대 드리다
  VIXX (빅스)  ,CHAOS,눈빛 나르다 관통 하다 심장 꿰뚫다 몸속 호르몬 침투 하다 조종 하다 처음 보다 순간 환상 위해 준비 되다 천국 아니다 지옥 끌리다 있다 미치다 태우다 다가 갈수록 베이 알다 빠지다 없이 계산 없이 사랑 있다 머리 끌리다 버티다 수가 없다 마비 되다 머릿속 완전하다 몸짓 하나로 내다 차갑다 이성도 냉정하다 사고 완전하다 무너 뜨다 미치다 태우다 다가 갈수록 베이 알다 빠지다 비웃다 내다 손짓 하다 섹시하다 당신 비너스 치명 위험하다 다치다 준비 돼다 있다 남자 가다 자신 없다 맡기다 두다 자다 다루다 조심 깊숙하다 아무리 가지 채우다 심장 어딘가 뚫리다 버리다 들어가다 점점 비웃다 내다 손짓 하다
  신화  ,Trippin`,이미 알다 멈추다 없다 조금씩 다가가다 느끼다 있다 숨다 없다 내다 열리다 마음 모든 느끼다 보다 처음 보다 순간 눈빛 들어가다 있다 가까이 내게로 다가오다 함께 하다 있다 있다 느끼다 많다 순간 이상 흐려지다 숨다 없다 내다 열리다 마음 모든 느끼다 보다 처음 보다 순간 눈빛 들어가다 있다 가까이 내게로 다가오다 함께 하다 있다 이제야 돼다 더욱 커지다 작다 모습 하나 내겐 크다 의미 란걸 매일 원하다 원하다 위해 보여주다 걱정 미루다 두다 모든 그냥 내다 아무 생각 하다 않다 오다 돼다 아주 빨리 나다 모르다 다가가다 모르다 그대 들다 오다 두다 없다 너무 있다 마치 두다 없다 자리 모두 있다 처음 보다 순간 눈빛 들어가다 있다 가까이 내게로 다가오다 함께 하다 있다
  더보이즈 (THE BOYZ)  ,Get It,얼마나 가야 돼다 어딘데 이쯤 이면 알다 자꾸 도망가다 두렵다 시작 하다 하다 믿다 보다 다르다 보다 없다 행복 주다 보다 모든 위해 준비 되다 사람 같다 잡다 가다 믿다 따라오다 데려가다 놀라다 보여주다 많다 새롭다 많다 붙잡다 한번 믿다 보다 보다 눈치 따윈 보다 돼다 신경 보다 모두 닮다 부러워하다 아직도 믿다 보여주다 감고 느끼다 보다 위해 뛰다 보다 흔들리다 눈동자 점점 궁금하다 하다 알다 나르다 만나다 행복하다 거란 나다 아마 원하다 있다 두다 잡다 가다 절대 놓치다 데려가다 놀라다 보여주다 많다 새롭다 많다 붙잡다 한번 믿다 보다 보다 오늘이 달려가다 멀리 쉬다 돼다 막히다 미우다 아프다 하다 시간 날리다 달다 데려가다 놀라다 보여주다 많다 새롭다 많다 붙잡다 한번 믿다 보다 보다
  틴탑  ,흔들어놔! (Shake it !),흔들다 놓다 흔들다 놓다 흔들다 놓다 흔들다 놓다 흔들다 놓다 흔들다 놓다 실망 주다 싶다 않다 가슴 안다 사랑 해주다 싶다 그게 자다 돼다 같다 달라지다 이제 하다 오다 밝다 빛나다 값지다 선물 보답 해주다 싶다 그렇다 위로 날아가다 항상 꾸다 하다 그렇다 위해 누구 높다 날아오르다 영원하다 지켜보다 크게 소리치다 흔들다 놓다 흔들다 놓다 흔들다 놓다 흔들다 놓다 흔들다 놓다 흔들다 놓다 내일 뭐뭐뭐 생각 좀좀좀 위해 노노 노래 불다 늦다 서두르다 친구 불다 모으다 이건 값지다 선물 보답 해주다 싶다 그렇다 위로 날아가다 항상 꾸다 하다 그렇다 위해 누구 높다 날아오르다 영원하다 지켜보다 크게 소리치다 달라지다 모습 놀라다 아주 높다 깊다 색다르다 나르다 보여주다 값지다 선물 보답 해주다 싶다 그렇다 위로 날아가다 항상 꾸다 하다 그렇다 위해 누구 높다 날아오르다 영원하다 지켜보다 크게 소리치다
  오마이걸  ,미제 (Case No.L5VE),예고 없다 낙비 어쩔 모르다 서다 있다 조심 스레 안녕하다 작다 우산 건네다 떨어지다 빗방울 맘속 들어오다 화창하다 생각 그때 인사 이다 쓰다 지우다 번은 다짐 하나 같다 답안 갇히다 틀리다 버리다 모르다 홀린 홀린 그렇게 다시 그리네 누구 내지 않다 문제 빠지다 정답 헤매다 괜히 괜히 이름 모르다 기분 혼자 시간 헤매다 저기 멀리 보이다 이유 없이 나르다 보다 웃다 보다 괜히 발끝 보다 다정하다 눈빛 빠지다 하다 원래 이렇다 솔직하다 대답 하다 주다 홀린 홀린 그렇게 다시 그리네 누구 내지 않다 문제 빠지다 정답 헤매다 괜히 괜히 이름 모르다 기분 혼자 시간 헤매다 수수께끼 같다 미로 같다 사실 정답 없다 놀라다 않다 젖다 발끝 이상하다 인하다 떨어지다 점점 어렵다 문제 이름 홀린 홀린 그렇게 다시 그리네 누구 내지 않다 문제 빠지다 정답 헤매다 괜히 괜히 이름 모르다 기분 혼자 시간 헤매다 햇빛 어느 잡다 풀리다 해답
  준호 (2PM)  ,believe,어둠 나라 존재 보이다 고민 찾다 하다 모습 보이다 지켜보다 주렴 이끌다 주렴 꺼지다 어깨 초라하다 죽다 갈다 생각 하다 버티다 오다 지키다 안다
  몬스타엑스  ,Rodeo,거치다 없다 분위기 리듬 올라타다 돼다 시작 해보다 가다 빨리 빨리 불도저 전진 오늘 가다 뒤지다 보다 오늘 정답 가다 사막 차갑다 저기 아름답다 심장 터지다 같다 뜨겁다 열기 순간 멈추다 없다 세상 거치다 고르다 긴장 풀다 이건 미치다 즐기다 보다 살다 오르다 어질어질하다 내일 따윈 없다 반전 시작 하다 방패 달다 보다 내일 걱정 멀리 멀리 식지 않다 뜨겁다 나르다 채우다 걸다 뜨겁다 지르다 뒤지다 흔들다 놓다 빨리 빨리 빨리 빨리 세상 거치다 고르다 긴장 풀다 이건 미치다 즐기다 보다 살다 발걸음 따르다 그려지다 지도 이름 기준 돼다 격하 거치다 몰아치다 오르다 뜨겁다 세상 거치다 고르다 긴장 풀다 이건 미치다 즐기다 보다 살다
  ATEEZ (에이티즈)  ,WAVE,우린 오션 블루 파도 어디 함께 하다 있다 여전하다 어디 갈다 모르다 건배 건배 순간 뜨겁다 태양 아래 망설이다 버리다 망설이다 버리다 생각 하다 생각 하다 생각 하다 우린 벌써 많다 넘다 기억 하다 기억 하다 기억 하다 시간 흘러가다 저기 바다 넘다 찌다 태양 하다 갈다 멈추다 싶다 순간 머리 하다 쓸다 넘기다 외치다 더더 밀려오다 더더 밀려오다 거치다 파도 넘다 미지 미지 찾다 미시시피강 하류 건너 다니다 파도 수록 바다 하다 던지다 버리다 순간 즐기다 파도 슈잉 정신없이 찾다 준비 돼다 태양 아래 저기 바다 넘다 찌다 태양 하다 갈다 멈추다 싶다 순간 머리 하다 쓸다 넘기다 외치다 더더 밀려오다 더더 밀려오다 거치다 파도 넘다 있다 나다 서다 있다 잡다 잡다 우리 두다 돼다 거치다 거치다 좋다 우린 순간 우리 파다 파다 두렵다 힘껏 마주 하다 우린 태양 아래 누구 뜨겁다 걱정 하다 걱정 하다 걱정 하다 저기 파도 넘다
  소녀시대 (GIRLS` GENERATION)  ,Check,가까워지다 우리 거리 본능 피어 들키다 몰래 잡다 준비 돼다 미소 향기도 조금씩 조금씩 다가가다 감싸다 찾다 눈감다 않다 느낌 오지 다가오다 화려하다 조명 아래 거울 비추다 어제 너무 달라 너무나 달라 아직 놀라다 이르다 반도 보여주다 취향 저격 당한 미소 향기도 조금씩 조금씩 빠지다 빠지다 이름 부르다 눈감다 않다 느낌 오지 다가오다 누가 상관없다 하다 눈감다 않다 느낌 오지 다가오다 하다 않다 들다 사랑 내다
  마이네임  ,지울 수 없는 (Memory),한숨 한숨 울음 같다 좋다 햇살 내겐 너무 아프다 잊다 해봤다 애쓰다 써다 안되다 안되다 가보다 우리 사랑 하다 시간 그대로 혼자 이렇게 아직도 멈추다 있다 다른 사람 만나다 새롭다 사랑 하다 기억 숨기 감추다 살아가다 있다 그렇겐 하다 같다 절대로 안되다 같다 지우다 없다 사랑 하다 기억 내다 마지막 이다 보다 그렇다 보다 사랑 하다 있다 마지막 하나 그게 이다 보다 우리 있다 시간 그대로 혼자 이렇게 아직도 멈추다 있다 다른 사람 만나다 새롭다 사랑 하다 기억 숨기 감추다 살아가다 있다 그렇겐 하다 같다 절대로 안되다 같다 지우다 없다 사랑 하다 기억 하다 발도 나가다 수가 없다 돼다 우리 기억 자꾸 자꾸 나르다 가다 붙잡다 붙잡다 닿다 선명하다 얼굴 어떻다 지우다 다른 사람 만나다 새롭다 사랑 하다 기억 숨기 감추다 살아가다 있다 그렇겐 하다 같다 절대로 안되다 같다 지우다 없다 사랑 하다 기억 쉬다 않다 쉬다 지워지다 않다 소린 닮다 견디다 않다 견디다 수가 없다 목소리 어느새다 흐느낌 가깝다 언제나 모습 슬픔 가슴 숨다 있다 사라지다 없다 그건 짧아지다 겨울 어두워지다 사랑 하다 기억 어둠 계속 찾다 있다
  DIA (다이아)  ,연습생,수많다 하나 되다 모두 모으다 비추다 언젠가 높다 뜨다 있다 되다 싶다 그리다 만나다 정신 없다 하루하루 보내다 있다 하다 있다 걸다 창밖 보이다 저기 사람 웃음 짓다 부럽다 시간 거슬러 돌다 보다 혼자 제자리 같다 외롭다 않다 채우다 있다 있다 수많다 하나 되다 모두 모으다 비추다 언젠가 높다 뜨다 있다 되다 싶다 그리다 만나다 두운 방안 거울 모습 쉬다 않다 웃음 지다 보다 힘들다 않다 맘속 빛나다 있다 있다 수많다 하나 되다 마음 모두 모으다 비추다 언젠가 높다 뜨다 되다 싶다 그리다 만나다 희미하다 가다 붙잡다 나다 담다 되다 밤하늘 수많다 하나 되다 마음 모두 모으다 비추다 언젠가 높다 뜨다 되다 싶다 그리다 만나다 지치다 않다 똑같다 일상 여전하다 모습 시간 계속 돌다 보다 후회 없다 찰나 순간 바라다 오다 만나다 되다 웃음 짓다 얼굴 저기 사람 부러워하다 느낌 기억 하다 웃음 짓다 있다 계속 하다 걸다 지치다 않다
  쥬얼리  ,시간에게 (I`ll Be There),하다 마디 없이 떠나다 그래도 인사 정도 해주다 알다 대체 누굴 사랑 하다 이다 이렇게 버려지다 괜찮다 되돌리다 모든 시간 아프다 마음 슬픔 없다 데려가다 쉬다 없다 나르다 떠나다 잠시 데려가다 있다 떠나다 같다 그래서 그냥 기다리다 되다 알다 이렇게 나르다 떠나다 그렇다 나르다 미우다 하다 알다 되돌리다 모든 시간 메여 슬픔 없다 데려가다 숨쉬다 조차 없다 나르다 떠나다 잠시 데려가다 있다 돌아가다 싶다 시간 되돌리다 처음 나르다 떠나다 잠시 데려가다 있다
  Amber Liu (엠버)  ,Borders (Inst.),
  스피카  ,LONELY,흔들리다 네온 머리 깨다 아프다 하나 모자라 내다 자꾸 늘다 상처 이미 배다 어지럽다 눈앞 흐려지다 빠르다 바쁘다 빠르다 바쁘다 빠르다 바쁘다 다시 맘대로 가다 하다 있다 죽다 원한 모든 있다 오다 곳도 아니다 그리다 두렵다 오다 온통 불빛 따라서 흔들리다 계속 하다 맴도 목소리 그렇게 빨다 들어가다 매일 돌아가다 정신차리다 헤매다 헤매다 어디가 어딘 심장 가빠 하이힐 아프다 눈물 화장 지다 다시 정처 없이 걸어가다 이끌다 웃다 울다 오다 모두 변하다 없다 이리 힘들다 아프다 온통 불빛 따라서 흔들리다 빠르다 바쁘다 빠르다 바쁘다 빠르다 바쁘다 계속 하다 맴도 목소리 그렇게 빨다 들어가다 미치다 보다 겨우 눈물 한잔 말다 취했나봐 때문 다시 맘대로 가다 하다 있다 죽다 원한 모든 있다 오다 곳도 아니다 그리다 두렵다 오다 온통 불빛 따라서 흔들리다 빠르다 바쁘다 빠르다 바쁘다 빠르다 바쁘다 빠르다 바쁘다 빠르다 바쁘다 빠르다 바쁘다
  종현 & 태민 (SHINee)  ,그 이름,다가서다 멀어지다 하다 그립다 오늘밤 자다 이루다 수많다 사람 난건 우연이 아니다 가다 어디 바라다 보다 행복하다 소리치다 불다 이름 들다 있다 불다 보다 비추다 있다 보이다 마음 가다 어디 바라다 보다 행복하다 소리치다 불다 이름 들다 있다 불다 보다 가다 어디 바라다 보다 행복하다 소리치다 불다 이름 들다 있다 불다 보다
  비투비  ,너나 잘 살아,자다 잠기다 목소리 바뀌다 머리 이상하다 혹시 우리 이별 헤매다 보다 어딘가 괜찮다 우리 첫마디 이상하다 지치다 우린 알다 자다 좋다 사람 만나다 행복하다 웃다 보다 그게 예쁘다 자다 언젠가 늘다 웃다 다시 만나다 지난 얘기 나누다 먼저 갈다 사랑 하다 기억 미워하다 마음 고생 하다 우리 기억 하다 뜨겁다 입맞춤 행복하다 시간 초가 아깝다 놓치다 싫다 보고 세상 전부 이다 전부 이다 그렇다 전부 이다 오랜 시간 묵다 감정 이별 냄새 한숨 하다 내쉬다 잠깐 추억 잠들다 어쩌면 사람 알다 이별 만들다 자다 좋다 사람 만나다 행복하다 웃다 보다 그게 예쁘다 자다 언젠가 늘다 웃다 다시 만나다 지난 얘기 나누다 먼저 갈다 사랑 그게 지나다 행복하다 차다 힘들다 오다 그만하다 이제 다른 사람 찾아가다 그거 돼다 아름답다 잖다 나르다 잊다 그렇게 떠나다 아직도 선명하다 진심 그렇다 보내다 이제 그만하다 없다 완벽하다 잖다 다시 웃다 되다 처음처럼 사랑 하다 기억 사랑 하다 기억 미워하다 마음 미워하다 마음 고생 하다 우리 한순간 잊다 없다 사랑 하다 기억 사랑 하다 기억 미워하다 마음 고생 하다 우리
  레인보우  ,Black & White,가슴속 숨기다 두운 그림자 끌어당기다 운명 닿다 시간 본능 숨다 없다 이중 순간 이미 눈빛 바뀌다 버리다 맑다 미소 이상은 없다 돌이키다 없다 참다 오다 숨다 없다 개다 들다 보다 보다 눈부시다 자태 주체 하다 없다 감싸다 오로라 감추다 없다 누구 표현 하다 날개 헤어 없다 짙다 안개 어둠 잠기다 나르다 보다 동전 비치다 얼굴 거짓 나르다 감싸다 빠지다 나오다 없다 매혹 감추다 보다 소용없다 아름답다 이렇다 어둠 나오다 눈부시다 자태 주체 하다 없다 감싸다 오로라 감추다 없다 누구 표현 하다 날개 특별하다 어쩌다 되다 마법 빠지다 버리다 주위 맴돌다 어떡하다 하다 모르다 변하다 버리다 기억 하다 호수 비치다 아름답다 모습 달이 지기 안다 눈물 떨구다 잠기다 외로움 모두 지우다 있다 보다 시선 가리다 없다 아우라 빠져들다 보다 누구 표현 하다 날개 특별하다 어쩌다 되다 마법 빠지다 버리다 주위 맴돌다 어떡하다 하다 모르다 변하다 버리다 기억 하다 풀다
  라붐 (LABOUM)  ,어떡할래,어떡하다 꼬리 길다 잡히다 알다 어떡하다 계속 모르다 주다 모르다 나르다 두다 돌아서다 그녀 가다 이상 어떻다 하다 하다 어떡하다 무너지다 나르다 어떡하다 귓가 약속 모두 어떡하다 막히다 어이없다 완전 멘붕 대체 무슨 생각 꺼지다 바쁘다 아프다 이렇다 저런 이유 핑계 어떡하다 벌써 째다 반복 되다 없다 익숙하다 주말 그러면 되다 따라가다 이상 어떻다 하다 하다 뭐라다 따다 해보다 나다 않다 익숙하다 레퍼토리 진심 이제 내다 하다 열다 거짓 보이다 숨기다 숨기다 사랑 어떡하다 무너지다 나르다 어떡하다 귓가 약속 모두 어떡하다 막히다 어이없다 완전 멘붕 대체 무슨 생각 꺼지다 보다 감고 돌아서다 잊다 그렇다 없다 모두 착각 그렇게 어떡하다 무너지다 나르다 어떡하다 처음 돌아가다 싶다 모르다 돌이키다 싶다 없다 일로 해주다 어떡하다 전부 어떡하다 아직 보내다 아직 그렇다 용서 없다 어떡하다
  원더나인 (1THE9)  ,우리들의 이야기,아직 기다 꾸다 지나 기다리다 시간 햇살 비추다 웃다 설레다 지켜보다 주다 어디 있다 편이 돼다 간직 해주다 우리 언어 하다 바라다 오다 순간 다가오다 함께 헤치다 나가다 미래 아직 두렵다 기도 지치다 힘겹다 펼쳐지다 종이 진심 담기다 마음 모으다 하다 채우다 가보다 시작 하다 위해 써다 내려가다 이야기 우리 이야기 소중하다 간직 싶다 함께 하다 불빛 밝히다 언제나 우리 서로 밝히다 등불 돼다 두려움 보이지 않다 밝다 비추다 시작 하다 약속 하다 순간 있다 하다 않다 느껴지다 담기다 미소 서로 하나 맞다 가다 그렇게 우리 하나 되다 걸어가다 발자국 남기다 이제 돌아보다 아직 두렵다 기도 지치다 힘겹다 쓰이다 아름답다 담다 종이비행기 위로 날다 시작 하다 위해 써다 내려가다 이야기 우리 이야기 소중하다 간직 싶다 함께 하다 불빛 밝히다 언제나 언제 있다 오늘 힘들다 어딘가 부딪히다 넘어지다 힘내다 고맙다 시작 하다 약속 하다 순간 있다 끝없이 펼쳐지다 세상 선명하다 너머 헤매다 이지 않다 내다 다가오다 잡다 보다 어디 데려가다 함께 시작 하다 위해 써다 내려가다 이야기 우리 이야기 소중하다 간직 싶다 함께 하다 불빛 밝히다 언제나 하나 바라보다 위해 모든 걸다 시작 하다 약속 하다 순간 있다
