artist,title,Korean_clean_lyric
  몬스타엑스  ,"인터스텔라 (Feat. Yella Diamond) (Performed by 주헌, 형원, I.M)",크게 않다 차원 세계 아무 모르다 그저 지다 무대 매우 사나워지다 빙의 하다 맹수 먹잇감 노리다 심장 차가워지다 비웃다 보다 거리 같다 시대 아래 올라가다 준비 완료 비싸다 공연 관람 그렇다 우린 꾸다 달라 이제 우리 엄마 갖다 기다리다 보다 보다 가리키다 초침 미래 되다 방해 하다 너넨 끼다 이제 모두 다른 데리다 놓다 시작 싫다 내버리다 두다 제대로 하다 결코 어림 재다 수도 없다 인터스텔라 싫다 내버리다 두다 화려하다 결코 어림 재다 수도 없다 인터스텔라 자비 없다 그래서 대다 하다 너무 미우다 근데 달라지다 마치 하이 수현 매일 궤도 덥다 운전 레버 어서 되다 되다 놓다 성장 속도 차원 다르다 이건 상대성 이론 예시 되다 아마 아인슈타인 머리 폭탄 우스꽝스럽다 내미다 다른 별로 보내다 조롱 반면 하다 받다 어떻다 문제 전부 그리다 방해 하다 너넨 끼다 이제 모두 다른 데리다 놓다 시작 싫다 내버리다 두다 제대로 하다 결코 어림 재다 수도 없다 인터스텔라 싫다 내버리다 두다 화려하다 결코 어림 재다 수도 없다 인터스텔라 굳이 하다 흥부 제대로 가르다 올해 문제 아가 되다 눕다 자쿠지 게다가 선수 치다 고양이 생선 취했으 준비 마치다 동안 우주선 눕다 너희 지구 떠나다 그렇다 처럼 성층권 넘다 자다 나가다 오르다 인터스텔라 항상 기준 정해 주다 그렇다 보다 끝내 쓸다 왕관 따윈 없다 들다 하다 방해 하다 너넨 끼다 이제 모두 다른 데리다 놓다 시작 싫다 내버리다 두다 제대로 하다 결코 어림 재다 수도 없다 인터스텔라 싫다 내버리다 두다 화려하다 결코 어림 재다 수도 없다 인터스텔라 감고 매일 생각 하다 우주 가깝다 가다 자리 서다 있다 방해 하다 너넨 끼다 이제 모두 다른 데리다 놓다 시작 싫다 내버리다 두다 제대로 하다 결코 어림 재다 수도 없다 인터스텔라 싫다 내버리다 두다 화려하다 결코 어림 재다 수도 없다 인터스텔라
  신화  ,진담,오래 되다 같다 우리 처음 만난 가끔 생각나다 좋다 사람 같다 보이다 친구 지내다 보다 그게 자다 돼다 만날 마주치다 힘들다 마음 들키다 이렇다 모르다 진지하다 본적 없다 되다 작다 기대 행복하다 그릴 마주치다 서면 바보 되다 보다 따다 소리 늘어놓다 혼자 웃다 하다 수만 있다 괜찮다 내일 다시 만나다 노래 하다 노래 기다리다 지켜보다 눈빛 느끼다 있다 오다 부담 주기 싫다 이렇다 모르다 진지하다 본적 없다 되다 작다 기대 행복하다 그릴 때론 연인 때론 친구 지내다 수만 있다 볼때 혼자 불안하다 이렇다 안다 고민 되다 가끔 생각 하다 우리 사랑 하다 오늘 매일 때론 연인 때론 친구 지내다 수만 있다 볼때 혼자 불안하다 이렇다 안다 고민 되다 가끔 생각 하다 우리 사랑 하다 오늘 매일
  H.O.T.  ,너와 나 (You & I),함께 있다 좋다 사랑 하다 바라보다 눈빛 따다 나르다 보고 미소 짓다 모습 더욱 용기 얻다 돼다 정말 고맙다 들다 있다 지치다 피곤하다 그렇다 혼자 싶다 너희 생각 하다 우리 바라보다 하다 세상 없다 우리 없다 모든 너무 소중하다 오랜 시간 너희 보내다 마음 읽다 다시 하다 우리 사랑 있다 우린 하다 언제 모습 사랑스럽다 함께 하다 노래 함께 하다 시간 너무나 우리 소중하다 들다 있다 지치다 피곤하다 그렇다 혼자 싶다 너희 생각 하다 우리 바라보다 하다 우린 하다 언제 모습 사랑스럽다 함께 있다 동안 우리 함께 만들다 하다 추억 간직 하다 함께 하다 노래 함께 하다 시간 너무나 우리 소중하다 함께 하다 노래 함께 하다 시간 너무나 우리 소중하다 언제나 하다
  세븐틴  ,나에게로 와,오다 오다 깊다 나무 쉬다 고마움 너무 크다 그늘 숨다 있다 가지 펴다 나누다 슬픔 녹다 위로 되다 싶다 들다 오다 돼다 언제 오다 기대다 녹다 듯이 사라지다 슬픔 옷자락 머물다 눈물 지키다 시간 차다 고맙다 라면 괜찮다 오다 유일하다 나무 언제나 변하다 않다 마음 주윌 사실 차다 기쁘다 언제나 지켜보다 주다 슬픔 녹다 위로 되다 싶다 들다 오다 돼다 언제 오다 기대다 녹다 듯이 사라지다 슬픔 옷자락 머물다 눈물 지키다 시간 차다 고맙다 라면 괜찮다 오다 오다 위로 갈다 있다 소원 충분하다 오다 돼다 언제 오다 기대다 순간 커지다 기쁨 옷자락 머물다 눈물 함께 하다 시간 너무 고맙다 라면 괜찮다 오다
  원더걸스  ,Like Money (Feat. Akon),
  NCT 127  ,Wake Up,멈추다 보다 없다 미로 같다 거치다 조각 버리다 기억 끝없다 다른 깨우다 보다 기다 터널 찾다 무의식 따르다 스며들다 맥박 커지다 흔들다 모든 뜨다 사라지다 새롭다 감각 뜨다 순간 하나 세계 연결 되다 깊다 음악 느끼다 보다
  BIGBANG  ,But I Love U (GD Solo),그렇다 그렇다 사랑 웃기다 그렇다 쓰다 쓸다 끊다 담배 다시 하다 마디 없이 떠나가다 그대 노래 들리다 없이 맞다 외롭다 아침 그대 떠나다 지도 나침판 잃다 망치다 아무 준비 내다 멀리 도망치다 비너스 미워하다 빌다 너무 억울하다 자신 너무나 한심하다 말투 행동 걸음걸이 하나 도배 되다 닮다 습관 괴롭히다 잊다 않다 어떻다 잊다 모든 추억 페이지 있다 생일 바닷가 깊다 사랑 절벽 넘다 실연 아픔 내다 여자 잖다 밉다 친척 슬프다 웃다 바라지 않다 라며 맘대로 하다 라며 사랑방 애초 시작 말다 하다 시간 너무나 힘들다 맨날 전화기 붙들다 기다리다 항상 아무렇다 잘못 하나 없다 미안하다 하다 나르다 피하 대론 가버리다 있다 주다 싶다 잡다 주다 싶다 하다 않다 서툴다 제발 놓다 말다 그저 예쁘다 너무 빠지다 말다 친구 일단 다르다 누구 착하다 순수하다 그렇다 아니다 정말로 좋아하다 우린 변치 행복하다 해주다 머물다 시간 지나다 나다 힘들다 지치다 보이다 목소리 기대다 필요하다 기대 제발 안보 혼자 쓰러지다 개다 가슴 찢어지다 무너지다 우리 처음 만나다 좋다 서로 보고 있다 행복하다 사실 아직도 그렇다 근데 그렇다 요즘 보다 예전 느낌 네겐 없다 하다 추억 너무나 고달프다 물론 이겠다 이렇게 위로 하다 세월 가면 기억 연기 멀리 날아가다 사랑 내다 찾아오다 웃다 해주다 싶다 눈물 닦다 싶다 떠나다 그대 되돌리다 없다 마지막 그대 얼굴 보고 싶다 전화하다 아무 대답 없다 나르다 하다 내다 해주다 아직도 제자리 있다 주다 싶다 잡다 주다 싶다 하다 않다 서툴다 제발 놓다 주다 웃다 해주다 싶다 눈물 닦다 싶다 떠나다 그대 되돌리다 없다
  블락비 (Block B)  ,Give & Take (B-BOMB Solo),아직 빨갛다 해도 원하다 내다 보여주다 원하다 즐기다 돼다 여우 하다 그렇게 느끼다 돼다 원하다 내다 타오르다 서두르다 타이 채우다 싶다 미치다 같다 않다
  몬스타엑스  ,넘사벽 (Incomparable),아름답다 아름답다 사람 사람 아니다 같이 예쁘다 마치 꽃처럼 내다 피어 향기롭다 디테일 미끌미끌하다 시선 버벅대다 끌다 떨다 있다 보다 하다 없다 자신 없다 웃다 미치다 멈추다 버리다 사랑 싶다 이렇다 작아지다 맞추다 주다 싶다 내다 주다 외치 싶다 넘다 싶다 갖다 싶다 버리다 넘사벽 되어다 불다 막다 막다 가지다 모든 가지다 자꾸 상상 하다 모습 근대 설레다 미치다 보다 보다 마냥 찾다 되다 있다 계속 붙다 그냥 고백 하다 아니다 돼다 진심 담다 해주다 싶다 이렇다 작아지다 맞추다 주다 싶다 내다 주다 외치 싶다 넘다 싶다 갖다 싶다 버리다 넘사벽 되어다 불다 막다 막다 가지다 모든 가지다 아직 혼자 하다 상상 모르다 알다 그저 자신감 들다 고백 하다 싶다 마음 나오다 같다 마음 생각 하루 빼다 않다 매일 넘기다 힘드다 알다 어쩔 그냥 뚫다 버리다 되다 버리다 넘사벽 되어다 불다 막다 막다 가지다 모든 가지다
  조권  ,고백하던 날,어떻다 하다 수백 생각 하다 설치다 얼굴 엉망 오늘 따르다 머리 들다 하루 종일 어느새다 만나다 하다 시간 꽃집 들다 사다 장밀 살다 다른 살다 모르다 아줌마 이쁘다 오늘 만나다 이쁘다 하다 하다 얼굴 보다 사다 어쩜 이렇다 나오다 도대체 멍청하다 건지다 아니다 순진하다 건지다 이렇게 한심하다 튀어나오다 사실 하다 하다 사랑 하다 새우다 연습 하다 잊다 버리다 없이 그냥 건네다 꽃다발 밝다 웃다 주다 많이 좋아하다 천사 먹다 이렇다 저런 얘길 나누다 언제 하다 기회 엿보다 하다 사실 들다 아니다 되다 하다 하다 외롭다 하다 만나다 계속 이렇다 나오다 도대체 멍청하다 건지다 아니다 순진하다 건지다 이렇게 한심하다 튀어나오다 사실 하다 하다 사랑 하다 새우다 연습 하다 잊다 버리다 없이 그냥 건네다 고백 밝다 웃다 개다 천사 사랑 하다 사랑 하다 밤새 연습 하다 좋아하다 사랑 하다 주다 싶다 도대체 멍청하다 건지다 아니다 순진하다 건지다 이렇게 한심하다 튀어나오다 사실 하다 하다 사랑 하다 새우다 연습 하다 잊다 버리다 없이 그냥 건네다 고백 밝다 웃다 개다 천사 자다 하다
  f(x)  ,나비 (Butterfly),우리 우리 언어 하다 하나 하나 퍼즐 맞추다 갈래 갈래 갈래 길이 퍼지다 가면 궤도 날개 펴다 같이 처음 감정 숨기다 감추다 싶다 날개 펴다 나비 사랑 피어 나비 로직 얽히다 터널 탐험 하다 어둠 밝히다 중심 이기 박히다 뇌리 잡고 선율 위로 날개 펴다 떨리다 태초 같다 시간 공간 뿌리다 날개 펴다 나비 사랑 피어 나비 하다 나르다 놀래다 신기하다 아름답다 아름답다 신비하다 날개 펴다 나비 내려앉다 향길 맡다 나비 나비 나비
  러블리즈  ,이별 Chapter 1,남다 반지 자국 보다 정말 헤어지다 그렇다 생각 들다 사라지다 그땐 전부 잊다 하나 사진 지우다 보다 정말 좋다 이렇게 웃다 있다 시간 걸리다 같다 아무 나르다 재촉 하다 혼자 서도 자다 하다 있다 하다 혼자 끝내다 쉬다 없다 아무 없다 아무리 하다 지독하다 처음 앓다 감기 아프다 첨으로 얼굴 보다 정말 힘들다 안쓰럽다 초라하다 수록 점점 잊혀지다 보내다 문자 보다 정말 솔직하다 이렇게 간절하다 후회 하다 않다 같다 아무 나르다 재촉 하다 혼자 서도 자다 하다 있다 하다 혼자 끝내다 쉬다 없다 아무 없다 아무리 하다 지독하다 처음 앓다 감기 아프다 처음 가지다 그대 멋지다 사람 사실 변하다 않다 아무리 그대 해도 이름 잊다 말다 어느 떠오르다 기억 미소 짓다 그대 없다 해도 마음 대도 아직 슬프다 남다
  PRODUCE 101  ,Hands on me,뭔가 하다 우리 분위기 왠지 들다 완벽하다 혹시 같다 내다 해주다 이러다가 라면 적당하다 하다 라면 시작 내다 집중 하다 조명도 시선 오늘 우리 미치다 우리 안목 아주 탁월하다 다른 남자 이름 올리다 하다 질투 한번 우린 이제 좋다 일만 남다 바라보다 표정 가슴 뛰다 만들다 실감 아마 어쩌면 당연하다 오늘 우리 빼다 다른 무엇 신경 쓰다 내다 돼다 특기 잖다 예쁘다 축제 여주 그저 가다 대로 하고프다 대로 법칙 같다 없다 나르다 손끝 맡기다 연주 하다 즉흥 오늘 우리 미치다 우리 이대로 놓치다 후회 하다 다가오다 운명 같다 오늘 떠나다 시간 다시 돌아오다 않다 어떻다 상상 있다 좋다 장담 하다 오늘 우리 미치다 우리
  GOT7 (갓세븐)  ,Look,어딜 보다 여기다 보다 있다 생각 보이다 괜히 걱정 하다 있다 나르다 믿다 아직도 모르다 불안하다 보이다 눈빛 빠지다 보다 두려움 밀려오다 나르다 보다 보다 믿음 넘치다 섭섭하다 그저 같다 마음 이기다 느껴지다 모습 그대로 믿다 두다 필요 없다 나르다 찾다 싶다 바라보다 그렇다 그렇게 시선 맞추다 익숙해지다 보이다 대로 맞추다 누가 뭐라다 대도 우릴 놓다 없다 귀찮다 소음 끄다 두다 바라다 머릿속 비우다 어차피 시선 내다 두다 대체 걱정 하다 시간 얼마나 되다 괴롭히다 전투 준비 중이 기분 따르다 기분 변하다 슬프다 모습 너무나 받다 사장 파도처럼 지우다 버리다 고민 이제 행복 남다 괜찮다 가끔 잠시 하다 고민 이기다 믿다 아무 일도 없다 바라보다 그렇다 그렇게 시선 맞추다 익숙해지다 보이다 대로 맞추다 누가 뭐라다 대도 우릴 놓다 없다 함께 하다 싶다 모든 내일 생각 서로 바라보다 아직 모르다 시선 맞추다 익숙해지다 보이다 대로 맞추다 누가 뭐라다 대도 우릴 놓다 없다 귀찮다 소음 끄다 두다 바라다 머릿속 비우다 어차피 시선 내다 두다
  NCT 127  ,TOUCH,부르다 목소리 심장 언제 가다 따르다 말투 알아채다 있다 잡다 잡다 어떡하다 버티다 모르다 이렇다 모습 나다 놀라다 멋대로 자꾸 따라서 가다 매일 조금씩 쌓이다 시간 하다 멈추다 손끝 떨리다 기억 하다 이대로 느끼다 있다 찰나 같다 순간 커지다 느낌 모두 전해지다 손끝 끌어당기다 느낌 있다 얼마나 의미 있다 건지다 같다 공간 있다 같다 주윌 모든 스치다 모든 특별하다 이대로 느끼다 있다 찰나 같다 순간 커지다 느낌 모두 전해지다 이렇게 이렇게 그렇게 모두 전해지다 기억 없다 혼자 편하다 모습 우릴 이렇다 원하다 빠져들다 같다 손길 하나 모든 바뀌다 이대로 느끼다 있다 찰나 같다 순간 커지다 느낌 모두 전해지다 이렇게 이렇게 그렇게 모두 전해지다
  소녀시대 (GIRLS` GENERATION)  ,영원히 너와 꿈꾸고 싶다 (Forever),영원하다 꿈꾸다 싶다 기분 좋다 바람 따르다 부신 아래 아름답다 노래 좋다 향기롭다 걷다 기억 하다 처음 만나다 어색하다 낯선 시간 서툴다 어리다 그저 없이 지키다 고맙다 지치다 가슴 다시 숨쉬다 가난하다 마음 찾다 영원 이렇게 손잡다 같이 걷다 싶다 우리 세상 사랑 하다 사람과 함께 짧다 않다 시간 동안 잊다 하다 많다 기억 웃음 눈물 언제나 믿다 바로 이다 지치다 가슴 다시 숨쉬다 가난하다 마음 찾다 영원 이렇게 손잡다 같이 걷다 싶다 우리 세상 사랑 하다 사람과 함께 아무 우릴 방해 않다 시간 쫓기다 하다 이유 없다 때론 멀리 있다 같다 마음 하나로 같다 있다 아주 오랜 시간 지나다 모습 달라 영원 이렇게 둘이서 꾸다 싶다 소원 되어다 믿음 되어다 아주 오랜 시간 지나다 모습 달라 영원 이렇게 둘이서 꾸다 싶다 기적 되어다 함께 해주다 오랜 세월 영원하다 꿈꾸다 싶다
  동방신기 (TVXQ!)  ,You Only Love,포기 하다 없다 하나 사랑 설명 하다 수가 없다 이별 하다 슬픔 잠시 힘드다 어떻다 들다 없다 헤어지다 그대 선택 전부 인걸 슬픔 잠시 힘드다 어떻다 들다 없다 헤어지다 그대 선택 전부 인걸 사랑 짧다 행복 크게 다가오다 좌절 힘들다 하다 좌절 익숙하다 수많다 하루 대다 잡고 있다 헤어지다 그대 선택 전부 인걸
  씨스타19  ,Ma Boy (마보이),하다 않다 있다 하다 어떻다 있다 그래서 믿다 참고 기다리다 혼자 두다 않다 하다 약속 하다 손가락 걸다 사랑 그리다 어렵다 한마디 이면 되다 자꾸 변하다 나다 지치다 시간 갈수록 모르다 좋아지다 아프다 바라보다 무슨 사랑 아프다 어떻다 때문 미치다 인하다 하루 울다 매일 기분 모르다 하다 팔지마다 마지막 경고 사랑 그리다 어렵다 한마디 이면 되다 자꾸 변하다 나다 지치다 시간 갈수록 모르다 좋아지다 아프다 바라보다 무슨 사랑 아프다 어떻다 좋아지다 아프다 아니다 작다 속삭임 때론 나르다 보다 눈길 그거 하나 돼다 원하다 아직도 모르다 무슨 사랑 아프다 어떻다
  방탄소년단  ,FAKE LOVE (Rocking Vibe Mix),하다 슬프다 기쁘다 하다 수가 있다 하다 아프다 강하다 하다 수가 있다 사랑 사랑 완벽하다 모든 약점 숨기다 이뤄지다 않다 꿈속 피우다 없다 키우다 세상 주다 전부 바꾸다 우리 없다 오다 잊어버리다 나다 누구 이다 자다 모르다 돼다 거울 보다 대체 누구 하다 슬프다 기쁘다 하다 수가 있다 하다 아프다 강하다 하다 수가 있다 사랑 사랑 완벽하다 모든 약점 숨기다 이뤄지다 않다 꿈속 피우다 없다 키우다 위해 예쁘다 거짓 지우다 인형 되다 위해 예쁘다 거짓 지우다 인형 되다 모르다 웃다 보다 사랑 하다 해보다 나르다 보다 버리다 이해 하다 없다 낯설다 하다 좋아하다 나로 변하다 아니다 하다 예전 자다 있다 아니다 알다 멀다 사랑 사랑 나다 나다 모르다 위해 예쁘다 거짓 지우다 인형 되다 위해 예쁘다 거짓 지우다 인형 되다 하다 슬프다 기쁘다 하다 수가 있다 하다 아프다 강하다 하다 수가 있다 사랑 사랑 완벽하다 모든 약점 숨기다 이뤄지다 않다 꿈속 피우다 없다 키우다
  소녀시대 (GIRLS` GENERATION)  ,Mr.Mr.,걱정 하다 돼다 두렵다 재고 재다 늦다 버리다 매일 하루 다르다 불안하다 가다 앞서 가다 주다 누군가 모르다 감다 당당하다 보다 그렇다 바로 가슴 뛰다 하다 최고 남자 그게 바로 상처 깨지다 유리 조각 되다 나르다 내주다 선택 받다 그게 바로 아직도 믿다 하다 진짜 비밀 알다 특별하다 인지 미랠 열쇠 바로 가지다 소년 크다 끌어안다 빛나다 담다 당당하다 보다 그렇다 바로 가슴 뛰다 하다 최고 남자 그게 바로 상처 깨지다 유리 조각 되다 나르다 내주다 선택 받다 그게 바로 세상 누구 먼저 던지다 치열하다 치열하다 그대 이루다 하나 내일 갈다 당당하다 보다 그렇다 바로 가슴 뛰다 하다 최고 남자 그게 바로 상처 깨지다 유리 조각 되다 나르다 내주다 최고 남자 그게 바로
  (여자)아이들  ,달려! (Relay) (hue Remix),생각나다 되다 마법 그렇다 쉬다 않다 두다 보다 느껴지다 우리 하나 되다 느낌 심장 신호탄 이상 물러서다 공간 따윈 없다 소리 환호성 비키다 실패 따윈 없다 바람 느끼다 힘껏 달다 눈부시다 햇살 하다 아득하다 달다 보다 걱정 따윈 필요 없다 두다 하나 없다 소리치다 헤이헤이 따르다 힘들다 지치다 그렇다 이렇게 외치다 기세 포기 네겐 우리 있다 달다 빠르다 소리치다 그렇게 달다 빠르다 소리치다 그렇게 달다 빠르다 소리치다 그렇게 환호성 머릿속 울리다 마치 알람 달다 빠르다 달다 빠르다 달다 빠르다 소리치다 그렇게 이렇게 함께 바람 느끼다 힘껏 달다 눈부시다 햇살 하다 우리 우리 우리 케미 케미 우리 우리 우리 가능하다 오오오오 달다 보다 우어 이렇게 함께 바람 느끼다 힘껏 달다 눈부시다 햇살 하다 달다 보다
  SHINee (샤이니)  ,Tonight,어둠 쉬다 먼지 끼다 열다 들다 같다 한동안 푸른 지다 느끼다 여전하다 아름답다 가끔 내리다 언제 그렇다 당연하다 나르다 보다 웃다 하다 비우다 두다 다시 목소릴 그리다 마음 깊이 지다 깊이 푸르다 비추다 비우다 두다 오늘 하루 역시 뭔가 같다 쉬다 뱉다 이렇다 보다 헛늘었 외롭다 나이테 오늘 생각 하다 궁금하다 깊이 사랑 하다 만큼 여전하다 사랑 하다 없다 기다 새벽 밤새 치다 빛나다 하다 내미다 항상 당연하다 채우다 매일 닮다 하루 언젠가 위해 모으다 두다 모든 얘길 하다 비우다 두다 다시 목소릴 그리다 마음 깊이 지다 깊이 푸르다 비추다 비우다 두다 아직 어둠 듯이 어깰 감싸다 오지 기다 새벽 가도 늦다 작다 파도 등대 비추다 기다 새벽 가도 늦다 작다 파도 저기 오다 그대로 기적 비우다 두다 다시 목소릴 그리다 마음 깊이 지다 깊이 푸르다 비추다 비우다 두다 그리다
  영재  ,Forever Love,어둡다 되어다 밝히다 처음 보다 순간 이번 특별하다 알다 아마도 거짓 하다 비웃다 전부 하다 믿다 어렵다 기분 알다 확실하다 내다 너무 완벽하다 채우다 있다 모든 새롭다 있다 멈추다 말다 하나 멈추다 해도 지키다 약속 하다 믿다 보다 믿다 보다 약속 하다 믿다 보다 어둡다 되어다 밝히다 처음 보다 순간 이번 특별하다 알다 보고 있다 해주다 싶다 세상 주다 싶다 누가 있다 언제나 채우다 있다 모든 새롭다 있다 멈추다 말다 하나 멈추다 해도 지키다 약속 하다 세상 가지다 같다 하다 어디 가다 안다 두다 없다 내다 해주다 하나 하나 멈추다 해도 지키다 약속 하다 하나 믿다 보다 지키다 약속 하다 약속 하다 믿다 보다
  젝스키스  ,여우사냥,덤벼 보다 어디 해보다 걸다 붙다 보다 해보다 같다 없다 절대 덤벼 보다 어디 해보다 두다 붙다 보다 해보다 하나 돼다 하다 생각 하다 심각하다 사랑 하다 달라 하다 자꾸 여기저기 다른 남자 만나다 다니다 헛거 내다 해보다 그렇다 그렇다 나오다 보라 그렇다 사랑 하다 없다 내다 뺏다 보다 해보다 놓다 두다 보다 덤벼 보다 붙다 보다 이기다 사람 있다 근사하다 조건 내미다 사랑 당하다 사람 없다 씻다 죄다 찾아보다 보다 어디 같다 사람 있다 보다 보다 아무리 잘나다 남자 게임 돼다 제일 강하다 대체 문제 그리다 서다 달아나다 자꾸 다른 남자 괜히 만나다 보다 대다 어차피 끝나다 시간 낭비 그냥 있다 그대로 가다 내다 오다 돼다 빨리 오다 그렇다 보다 손해 덤벼 보다 어디 해보다 걸다 붙다 보다 해보다 같다 없다 절대 덤벼 보다 어디 해보다 두다 붙다 보다 해보다 하나 돼다 하다 그리다 복잡하다 하나 편안하다 해주다 보기 좋다 조건 유혹 엄청나다 사랑 당하다 누구 사랑 하다 사람 없다 찾아보다 그렇다 보다 손해 내다 어차피 내다 돼다 잡히다 완전 내다 잡히다 내다 어차피 내다 돼다 잡히다 완전하다 내다 잡히다
  아이오아이 (I.O.I)  ,Crush,심장 온통 비명 소리 보이다 들다 사고 나다 눈앞 자꾸만 심장 뛰다 머리 성적 려고 해도 자다 돼다 보다 정신 차려 큰일 나다 진짜 자꾸만 이르다 어지럽다 온종일 생각 다른 하다 돼다 그동안 평화롭다 일상 안녕 좋아하다 돼다 빠져들다 있다 이렇다 모르다 차다 나다 놀랍다 심장 심장 심장 보고 싶다 당장 벨트 매다 잡다 막히다 도로 답답답 급하다 거기 비키다 갓길 신호 붉다 우리 그린 라이트 자꾸만 심장 뛰다 따라잡다 수가 없다 어떡하다 보다 다시 정신 차려 큰일 나다 진짜 자꾸만 이르다 어지럽다 온종일 생각 다른 하다 돼다 그동안 평화롭다 일상 안녕 좋아하다 돼다 빠져들다 있다 이렇다 모르다 차다 나다 놀랍다 심장 심장 심장 내다 물어 괜찮다 하다 떠나다 어디 좋다 달다 보다 저기 멀다 상상 해도 이렇게 좋다 심장 이로써 평화롭다 일상 안녕 좋아하다 돼다 빠져들다 있다 이렇다 모르다 차다 나다 놀랍다 심장 심장 목소리 들다
