artist,title,English_clean_lyric
  The Unlikely Candidates  ,Your Love Could Start A War,know got ta love name written streets force nature fires running feet ohhh love love could start war love fighting would would die revelation ohhh love love could start love could start war dawn break thumb knees play game pressure getting stronger sleep burn sky constellation swear could die revelation ohhh love love could start war love fighting would die revaltation ohhh love love could start love could start war burn cry standing fear take life know end run dancin want fly hear singing tomorrow never dies would die revelation ohhh love love could start war love could start war fighting ohhh love love could start war love fighting would die revelation ohhh love fighting ohhh love love could start war love fighting would die revelation oh love love could start war
  Nirvana  ,Polly,polly wants cracker think get first think wants water put blow torch seed let clip dirty wings let take ride cut want help please got rope told promise true let take ride cut want help please polly wants cracker maybe would like food asked untie chase would nice seed let clip dirty wings let take ride cut want help please got rope told promise true let take ride cut want help please polly said polly says back hurts bored caught guard amazes instinct seed let clip dirty wings let take ride cut want help please got rope told promise true let take ride cut want help please
  신해철  ,매미의 꿈 (Crom`s flat Mix) Part 5 당신을 위로하고 싶은 마음에서 나온 가벼운 성의,
  Oh Wonder  ,All About You,walk around town like born golden crown speaking angels loud one understands ya got sharpest bite killer sharker might control water like desert matter full sick full sick cause say enough sipping silver cup brought blame hand feeds ya counting green night blessings never find seek undermine seek never die full sick full sick cause every time get stars eyes planets align centre pushing til walls wide mind centre see cover see another fooling mirror heart truth full sick full sick cause
  The Beatles  ,Taxman (Remastered 2009),hrmm let tell one nineteen cos taxman yeah taxman five per cent appear small thankful take cos taxman yeah taxman drive car tax street try sit tax seat get cold tax heat take walk tax feet taxman cos taxman yeah taxman ask want aahh mr wilson want pay aahh mr heath cos taxman yeah taxman advice die taxman declare pennies eyes taxman cos taxman yeah taxman working one taxman
  Wallows  ,Remember When,thought saw shadow door trick light seen never tell real anymore anymore anymore remember ran pool decorations room find right words use knew knew seemed long seemed long moments stay turn wrong look around gone oh oh oh oh oh oh oh oh oh oh oh oh places return faces remind still see place know close eyes remember felt like two alive let one people seek lost romance would go given chance oh oh oh oh oh oh oh oh oh oh oh oh oh oh oh oh oh oh oh oh oh oh oh oh
  Simple Plan  ,I`d Do Anything,another day going thinking time waiting wrote letter head cuz many things left unsaid gone think straight could one last chance make understand yeah anything hold arms try make laugh somehow put past anything fall asleep remember cuz know forget together broke rules dreaming droping school leave place never come back maybe years miss fear waiting could one last chance make understand let leave yeah anything hold arms try make laugh somehow put past anything fall asleep remember cuz know forget close eyes see close eyes try sleep forget na na na na na na anything na na na na na na na anything hold arms try make laugh somehow put past anything fall asleep fall asleep yeah anything fall asleep anything nothing anything fall asleep anything cuz know forget
  Pop Evil  ,Monster You Made,take good look still recognize different inside world trying change admit want change admit go like anymore erase monster become forgive damage done say begging mercy monster made better alone see torn mistakes stop believing could ever make things change much take know hurts long wait cant go like anymore erase monster become forgive damage done say begging mercy monster made used invincible indestructible human see beauty take good look see changed erase monster become forgive damage done say begging mercy monster made far away pain hear angels calling far away pain see demons falling far away pain hear angels calling far away pain see demons falling erase erase erase monster made
  이다오  ,커피 한잔 할래요,
  Jon McLaughlin  ,For You From Me,unexpected understatement year sure thought standing door way say name throws windows past closing everything see give away easily never stopped look whats behind everything want holding us together tonight tonight unexpected used chasing dreams catching sudden winner end used every door open closing always making sure supposing believe really give away easily never stopped look whats behind everything want holding us together tonight never fall defy laws world new ones way feel stupid real give away easily never stopped look whats behind everything want holding us together tonight give away easily never stopped look whats behind everything want holding us together tonight tonight
"  Crosby, Stills & Nash  ",Lady Of The Island,holding close undisturbed fire pressure chest breathe ear knew would happen first appeared lady island brownness body fireglow except places sun refused go bodies perfect fit afterglow lay lady island letting wander world inside eyes know like stay every tear runs dry lady island wrapped around peeping sun beams sunshine light stage red light never want finish begun lady island
  브이  ,여름아 부탁해 (Rock Ver.),summer love summer time hot go go summer time let go sunset let kiss one time baby oh beautiful lady suncap sunset go go go go lips eyes love much summer vacation baby beach beach beach paradise baby oh beautiful lady
  New Found Glory  ,Connected,quickest one shed skin forcing put walls climbing taller every cause hurry soon back work make love make love reconnect soon back arms back arms connected circle eyes tell bargained takes trying rip skin really know thick hurry hurry
  Halsey  ,Young God,says ooh baby girl know gon na legends king queen stumble heaven light end sun eyes know wan na go heaven human tonight sitting bottom swimming pool drowning thoughts sounds feel like young god know two us young gods flying streets people underneath running running running feel like young god know two us young gods flying streets people underneath running running running running running running running running running says oh baby girl get cut edges king everything oh tongue weapon light crack separating thighs wan na go heaven fuck tonight sitting bottom swimming pool drowning thoughts sounds feel like young god know two us young gods flying streets people underneath running running running feel like young god know two us young gods flying streets people underneath running running running running running running running running running
  김지영 (메스그램)  ,Sweetie,love got crush please love oh babe love love sweet love sweetie love got crush please love oh babe come bedside baby come bedside baby come bedside baby come bedside baby love love sweet love sweetie love got crush please love oh babe come bedside baby come bedside baby come bedside baby come bedside baby
  Frightened Rabbit  ,Still Want To Be Here,perfect place may never exist may never exist perfect time might years years away city overweight pressing pair us scowl sweat beneath overbearing crush chorus still want want still want want would live devil ditch near still want want verse shit street outside house junk fiends dance bus stop next rodeo clowns nowhere run hide like mislaid infants fuck faceless homes everyone lives chorus still want want still want want would live shallow pit near still want chorus still want want still want want would live shallow pit near still want
  White Lion  ,Broken Heart,stand alone trying fight pain broken heart left know really matter anymore thought love could last forever stand lost alone start new day alone gon na break away broken heart meet woman gon na take home pick pieces start know life much better cause know light shine life even broken heart broken heart fight pain broken heart broken heart know life much better cause know light shine life even broken heart broken heart fight pain broken heart broken heart life even broken heart broken heart fight pain broken heart broken heart
  가이즈  ,Liar,help liar smile voice close eyes looking blind help shouting chaos close eyes looking blind close eyes looking blind close eyes looking blind close eyes looking blind close eyes close eyes close eyes looking blind close eyes looking blind
  아이유  ,을의 연애 (With 박주원),running time
  Saliva  ,Open Eyes,miles miles cold lonely road standin alone truth told begins perfectly unfold wasted time nothing face pain alone first time life open eyes feel like could fly away till reach side sometimes must decided everything meant even try simple song inside along truth makes wrong would rather alone said crossed line said pulled finally realized strong first time life open eyes feel like could fly away till reach side sometimes must decided everything meant even try solo open eyes feel like could fly away till reach side sometimes must decided everything meant even try even try even try even try
  Tommee Profitt  ,You Made Me Do It (Feat. Ruby Amanfu),shall crossed line go breath skin eyes filled sin three seconds blood pouring chorus want hurt choice sorry made yeah made damn blew yeah made verse broke trust blew dust like bribes face erased leave choice avoid consequences left defenseless chorus see want hurt choice sorry made yeah made damn blew made interlude bridge unforgivable caught red handed every stunt pulled understand gon na pay say goodbye today bet made made chorus made made damn blew made made interlude outro made
  Daughtry  ,One Last Chance,tell need find way stop bleeding add mistakes tell leaving tell everything need know throw away say words late want left behind blind broken put back together empty promises since exist open know take time give one last chance make right say story ending think time stop pretending let turn page heart remember used say forever let go throw away say words late want left behind blind broken put back together empty promises since exist open know take time put past behind us tonight gon na fight give one last chance make right last chance make right want left behind blind broken put back together empty promises since exist open know take time give one last chance make right give one last chance make right last chance make right give one last chance make right oh yeah empty promises since exist open know take time give one last chance make right
  별  ,너의 뒤통수,
  Cash Cash  ,Breakout (Album Ver.),let go follow outside know long til holding hips tight know want leave em behind let catch cab downtown light fire make right cause nobody home tonight break take floor take home give things things supposed break take floor finally alone take home tonight sing oh oh sing oh oh ohhh night let go cause feeling wild know long til touching skin soft know want give tonight oh would never break heart girl give one chance make right cause nobody home tonight break take floor take home give things things supposed break take floor finally alone take home tonight sing oh oh sing oh oh ohhh night oh oh oh oh oh break take floor take home give things things supposed break take floor finally alone take home tonight finally alone finally alone break take floor finally alone take home tonight sing oh oh sing oh oh ohhh night
  Daughtry  ,What About Now,shadows fill empty heart love fading things saying see beyond scars make dawn change colors sky open ways made feel alive ways loved things never died make night love find today making meant love never went away lost behind words could never find baby late sun breaking eyes start new day broken heart still survive touch grace shadows fade light side love find today making meant love never went away lost behind words could never find baby late come far hold nothing fear right beside life today making meant love never went away lost behind words could never find today making meant love never went away lost behind words could never find baby late baby late baby late
  임재범  ,Blue,see another moon hanging beyond stars like buoy black hend sea half light half without wading milky way light years fly wayriding way father fate ieading home flashy venus screen jupiter behind still eyes scene warp speed cuz blue star home ward bound earth ward bound cuz newhorizon sea see moon clinging like babe earth backened blazing sun ready come twinkle little blue star cuz know almost touch comin closin gon na land land land land land land land land shores
  자우림  ,어른아이,
  한대수  ,아무리 봐도 안 보여,
  Manceau  ,I Wanna,wan na sing wan na feel fed seems like born soon dying hair fear use freaking plan gon na go right feeling closer hitchhiking til day breaks tears compromise one get wan na leave wan na dream wan na say wan na sing wan na feel fed wan na leave wan na dream wan na scream wan na sing wan na feel fed wan na leave wan na dream wan na say wan na sing wan na feel fed wan na leave wan na dream wan na scream gon na horse around gon na burn shine say going night willing party dance say stop telling lies god knows mind seems like future behind longing change want life disguise seems like got made wan na leave wan na dream wan na say wan na sing wan na feel fed wan na leave wan na dream wan na scream wan na sing wan na feel fed wan na leave wan na dream wan na say wan na sing wan na feel fed wan na leave wan na dream wan na scream gon na horse around gon na burn shine drop rain tiny grain sand wan na take hand things never never blind wan na leave wan na dream wan na say wan na sing wan na feel fed wan na leave wan na dream wan na scream wan na sing wan na feel fed wan na leave wan na dream wan na say wan na sing wan na feel fed wan na leave wan na dream wan na scream gon na horse around gon na burn shine gon na burn shine
  Rialto  ,Hard Candy,sugar high drops sky never stops first taste began wan na make understand hold melts hands even acts like stand hard candy ha ndy glycerine veins serene runs ever since first taste began wan na make understand hold melts hands even acts like stand hard candy h andy candy waste leaves bitter taste want feed shiny paper sham wan na make understand hold melts hands even acts like stand hard candy ha ndy hard candy hard candy hard candy hard candy
  이승환  ,못 말리는 봉팔이,
  넥스트  ,Hope,
  Bad Brains  ,With The Quickness,location gon na let tell yo crib crabit hot hot standings quickness well dem call hip hop others chuckin bop rushin go go check one drop jam disco acid rock mash hardcore dem rockers broke scene quickness pickney lead way quickness pickney stay mission one licked temptation time snatch fe crank steadfast soope wan fling well dem call hip hop others chuckin bop rushin go go check one drop jam disco acid rock mash hardcore dem rockers broke scene quickness people stay quickness children lead way alarm open arms quickness people lead way quickness children stay oh yea
  Elvis Presley  ,"I Want You, I Need You, I Love You",hold close hold tight make thrill delight let know stand start want need love heart ev ry time near cares disappear darling living want need love thought could live without romance came know go loving eternally please never leave alone cause die ev ry time apart want need love heart well thought could live without romance came know go loving eternally please never leave alone cause die ev ry time apart want need love heart
  럭스  ,"Our Life, Our Stage",wow wow wow wow wow wow wow wow wow wow wow wow
  Lasse Lindh  ,Hate On Me,lay hate got let go know could sum love done much good wrong wrong counts poisoned house love dreams blanket guilt let last time hate lay hate cut open shape tired body soul hate lay hate cut open shape tired hating please set free cuts like knife know walk pain fall break end good cause rise find man give never could bring light back eyes hate lay hate cut open shape tired body soul hate lay hate cut open shape tired hating please set free
  부활  ,가능성,radio radio
  James Taylor  ,Don`t Let Me Be Lonely Tonight (Remastered Ver.),wrong right tell lies hold tight save good byes morning light let lonely tonight say goodbye say hello sure enough good see time go say yes please say want lonely tonight go away damn go please gon na see getting knees undecided heart divided turning world upside wrong right right baby go tell lies hold tight save good byes morning light morning light let lonely tonight want lonely tonight want lonely tonight want lonely tonight
  The Wannadies  ,I Love Myself,always right thing alone good company god damn one handsome man star know quite like make hard baby nobody love love love oh yeah oh yeah love oh yeah oh yeah love never disappoint alone looking mirror god oh one pretty sight charm enough alone one ever disagrees nobody love love love oh yeah oh yeah love oh yeah oh yeah love love whatever say whatever say whatever whatever say whatever say whatever whatever say whatever say whatever whatever say whatever say whatever love love oh yeah oh yeah love oh yeah oh yeah love love love oh yeah oh yeah love oh yeah oh yeah
  Ed Sheeran  ,Nina,met teen one well could play guitar like ringing bells sometimes wonder summer could part time lover listening stevie wonder covers used lay stacks speakers play tour almost every day home flat used stay watching dvd smoking illegal weed getting high two kites needed breathe used air people see stay night like needed sleep go anywhere minds would take us also beautiful without make even need worry weight cause loved way god made us time reason could break cause would always tell away much distance relative time takes get plane make mistake say oh nina go nina cause never coming home road leave living road nina know nina cause nina oh leave every weekend winter wearing hoodie draw strings pulled tight keep face cold taking day trips local eat road cause every day away speak phone watching blue planet creating new habits two rabbits vanish back barb celtics disappear call selfish understand help put job everything except family friends forever guess take step back overlook situation cause mixing business feelings lead complications saying taking break evaluating quick make mistake late either deal pain wait get plane day say oh nina go nina cause never coming home road leave living road nina know nina cause nina uh leave love come love go make sing song go oh leave people grow fall apart mend broken heart take back go oh leave oh nina go nina cause never coming home road leave living road nina know nina cause road leave
  Flor  ,Hold On,come life people streets start rise sun starts open eyes make moment stay us count left count show way keep light going somewhere try fight feel like skin hair tangled head mind get twist turn teach run rather hold rather hold tight make right every moment spend without time pain something manage line us keep route come hell high water count left count show way keep light going somewhere try fight feel like skin hair tangled head mind get twist turn teach run rather hold rather hold tight know reason come alive come alive lives eyes know reason come alive come alive know reason come alive come alive lives eyes know reason come alive come alive skin hair tangled head mind get twist turn teach run rather hold rather hold skin hair tangled head mind get twist turn teach run rather hold rather hold tight
  Nap Eyes  ,I`ve Always Known You Care,always known care maybe seem like leaves turning air know hate lose stand win sometimes see things draw back shut feelings another disappointed stare project judgment friend known long time seen best worst hundred times nothing change mind always patient know blind realize oh yeah count
  어보이드 (AVOID)  ,누가 먼저랄 것도 없이,
  서지안  ,회상,
  Nada Surf  ,Jules And Jim,speed move weird never lose next lost mind go sleep lost mind go sleep gape lose sight even northern lights midnight sun well thoughts still run lost mind go sleep lost mind go sleep never felt pull hypnotized destabilized jules jim three catherine speed move weird never lose next lost mind go sleep lost mind go sleep never felt pull hypnotized never felt pull paralyzed destabilized jules jim three catherine three catherine three catherine
  MIKA  ,My Interpretation,talk life talk death everything like nothing words easy talk talk everything like something needs repeated need alibi realise things left unsaid taking space head make fault win game point finger place blame matter cause care ever talk emotion need reason care say happened end interpretaion make sense first wish count ten hold breath wonder l happen really matter half said true half could different would make better forget things know would somewhere go way see cause care ever talk emotion need reason care say happened end interpretaion make sense really sacrifice ever talk emotion need reason care say happened end interpretaion make sense make sense cause interpretation yeah yeah yeah
  Hippo Campus  ,tuesday,sometimes call tuesday sometimes call best day life maybe friday making conversation box wine chorus jake oh love call drunk tuesday verse jake sometimes think mundane sometimes think better like dad maybe progressive maybe working class chorus jake oh love call drunk tuesday verse jake friends say lucky ones terms relationship alcoholic tendencies underneath fingertips think love think know liquor speak want love wan na know chorus outro jake sometimes call tuesday sometimes think fine sometimes call tuesday sometimes best day life sometimes best day life sometimes best day life sometimes best day life sometimes best day life sometimes best day life sometimes best day life sometimes best day life sometimes best day life
  잠비나이  ,구원의 손길 (Hand Of Redemption),
  악퉁  ,Passion,breaking used something boring way sunset paradise singing dream destiny singing love breaking used something boring way sunset paradise singing dream destiny singing love paradise singing dream destiny singing love paradise singing dream destiny singing love
  Light Up The Sky  ,Breather,sun setting first day last return life left behind sealed watched burn believe come final days eyes open wide hope make alive heart racing feel bones storm raging breathing smoke running time war losing control must break chains stare eyes enemy one thing left let light sky fight gates hell fighting weakness never failed see world around fall look sky last goodbye heart racing feel bones storm raging breathing smoke running time war losing control must break chains getting sick tired got ta way defeat enemy get voices head fighting fighting fist strikes like lightning fist strikes like lightning war took never break taste blood
  FTISLAND (FT아일랜드)  ,Let it go!,let go baby niawanai sonna kao yamete furueru te tsukamaete ageru yuuutsu toka fuan nado sha la la kimi nara sekaijuu beautiful kanaeyou fantasy babe sagashidase wonderland tobitatsu sa let go sawagouze let go te wo nobase takaku sora ni todoku made let go kamawanai sonomama kimi de ii saa subete wo wasurete let go let go oozora bara maite goran osanai hi egaiteta yume wo shinjireba todoku hazu sha la la futari nara nan datte comin true mae ni see feel babe machiukeru dreamin world fumidasu sa let go susumouze let go karada goto atsuku mirai tsukinukero let go hajimeyou tobikiri new story saa mae dake mitsumete let go oh kimi koe ga kikitai nari yamanu hodo ni oh kimi koe ga kikitai always wan na girl oh baby konomama far away far away tsuresaritai yo kimi wo let go sawagouze let go te wo nobase takaku sora ni todoku made let go kamawanai sonomama kimi de ii saa subete wo wasurete let go let go
  김경호  ,사랑이 들린다면,love say know stay together look eyes say know stay together stay together look eyes
  Saosin  ,You`re Not Alone (Radio Edit),like wander evergreen park slowly searching sign ones used love says got nothing left live says got nothing left time think know alone know make live tell like spoiled rotten confused lies fed searching one eyes turn green seems happy time think know alone know make live tell alone know make know alone know make live tell tell alone know make make live tell live tell alone know know make live tell
  Hoobastank  ,Lucky (Album Ver.),knew felt another one need someone show way saw part nobody else could see life make feel lucky make feel lucky get break never chance make impressions want falls right place get see face nothing make feel lucky make feel lucky dark days sun rays hard ways today make feel make feel lucky lucky lucky
