artist,title,English_clean_lyric
  Soren Juul  ,Dear Child,surface sure words scratched room lit maybe stay maybe chance stopped time next plane comes takes away sometimes hard get feels like catch miss stories told love know waiting something sure wish thoughts may rest peace time might spend time foreign space ghost wall still keeps awake night sometimes hard get feels like catch miss stories told love know standing sit almost alone listening records still one phone safe song feel like waited sooner later earn wings find way home sometimes hard get feels like catch miss see innocence give compliments sometimes hard get feels like catch miss stories told love know
  Bell X1  ,"Eve, The Apple Of My Eye",left sent want back left sent want back clip wings snap leave sprawling pin plan mine oh lame see grass greener rains left died went cried came think never really know served time watched climb wrong incline know accept let turn screw accept let scream back applies equally thing share sky empty metaphors vain like see grass greener rains garden snake charmin eve said let give try lead us temptation matter hard try garden snake charmin eve says let give try eve apple eye lie behind cradle palm pat hair think sink swim cause could either whim
  잇츠 할리데이  ,눈 뜨고 눈 감을 때까지,
  자우림  ,Over the rainbow,
  Red Hot Chili Peppers  ,I Could Die For You,something inside cards know right want live somebody elses life want give get free smiles time could die oh life choose go tell sights eyes seen really wan na turn motion beauty abuse know use senses see everywhere take find way share come along go along wander yo free could die whatchu wan na oh life choose could die whatchu wan na oh life choose come tell wan na go means alone close door one know come along go along wander yo free could die whatchu wan na oh life choose could die whatchu wan na oh life choose make wan na say could die whatchu wan na oh life choose could die whatchu wan na oh life choose
"  로이킴 ,  정준영  ",Creep,look eye like angel skin makes cry float like feather beautiful world wish special special creep weirdo hell belong care hurts wan na control wan na perfect body wan na perfect soul want notice around special wish special creep weirdo hell belong running running run run run run run whatever makes happy whatever want special wish special creep weirdo hell belong belong
  Cold Mailman  ,I Was Wrong,woke expecting nothing found badly hidden treats walked expecting sunday stumbled onto saturday crowded streets record may broken anything dull words soflty spoken left echo skull thought found looked thought reached higher ground wrong wrong walked expecting riots found fireworks balloons bands every corner playing favourite tunes candy room starless played forty six strobe name jonas peace leave thought found looked thought found along doubt mind mattered missed point wrong wrong wrong wrong wrong wrong wrong
  CokeJazz  ,are you experienced?,experienced wonder curious let play guide experience curious thing ceiling closing say choke feeling reached universe black floating zero gravity fully experienced wonder curious raised limits let break universe black floating zero gravity fixated blue fixated blue fixated blue substance ye little faith alright ye pass thing mean roll sake feel alright blow space experienced wonder curious let play guide experience curious thing ceiling closing say choke feeling reached universe
  The Shins  ,Bait And Switch,finally ducks row peace quiet means subtraction got sure know two weeks spine traction eyes basket well god heart phase kind girl nobody daughter used powerful waves shallows breath taking water call beautiful wish moral compass better swim hide psychic derailer drive car sea spend night high cannon towering hemloch use always found creature habit real protection tell leave settle sees lie closer inspection like everyone else running terrible chomp smoke eyes simple man cursed honest heart go tear apart running terrible chomp smoke eyes simple man cursed honest heart go tear apart
  Rammstein  ,Keine Lust,ich hab keine lustich hab keine lustich hab keine lustich hab keine lustich habe keine lust mich nicht zu hassenhab keine lust mich anzufassenich hatte lust zu onanierenhab keine lust es zu probierenich hatte lust mich auszuziehenhab keine lust mich nackt zu sehenich hatte lust mit gro en tierenhab keine lust es zu riskierenhab keine lust vom schnee zu gehenhab keine lust zu erfrierenich hab keine lustich hab keine lustich hab keine lustnein ich hab keine lustich hab keine lust etwas zu kauendenn ich hab keine lust es zu verdauenhab keine lust mich zu wiegenhab keine lust im fett zu liegenich hatte lust mit gro en tierenhab keine lust es zu riskierenhab keine lust vom schnee zu gehenhab keine lust zu erfrierenich bleibe einfach liegenund wieder zahle ich die fliegenlustlos fasse ich mich anund merke bald ich bin schon lange kaltso kalt mir ist kalt ich hab keine lust
  White Lion  ,When The Children Cry,little child dry crying eyes explain fear feel inside cause born evil world mas killing man one knows become look done destroyed must build children cry let know tried cause children sing new world begins little child must show way better day young cause born world see live love peace presidents wars end one united world god children cry let know tried cause children sing new world begins become look done destroyed must build presidents wars end one united world god children cry let know tried children fight let know right children pray let know way cause children sing new world begins
  U2  ,Every Breaking Wave,every breaking wave shore tells next one one every gambler knows lose really summer fearless speak answerphone like every fallen leaf breeze winter leave alone alone go go way go mine helpless tide baby every dog street knows love defeat ready swept feet stop chasing every breaking wave every sailor knows sea friend made enemy every shipwrecked soul knows live without intimacy thought heard captain voice hard listen preach like every broken wave shore far could reach go go way go mine helpless tide baby every dog street knows love defeat ready swept feet stop chasing every breaking wave sea knows rocks drowning ocean know heart place know fear wind begin begin go go way go mine helpless tide baby every dog street knows love defeat ready swept feet stop chasing every breaking wave
  Sia  ,Lentil,waiting adore saw wish whole world could would never hurt desert work things thought could would lick tears eyes cry missed gone hurt leave deceive needed believed never meant let awake stake eye never meant let trying fall apart pictures stitches riches money could never buy give though heart achin breakin takin send way want hold unfold told coming back know okay everyday sun shines little brighter never meant let awake stake eye never meant let trying fall apart never meant let awake stake eye never meant let trying fall apart trying fall apart night set light wishing mind oh never meant let never meant let trying fall apart never let never meant let trying fall apart
  Imagine Dragons  ,Shots (Acoustic (Piano) / Live From The Smith Center / Las Vegas),touch place keep saying looking empty space oh wishing wishing gone gon na wrong oh going mess oh luck sorry everything oh everything done second born seems loaded gun shot shot shot hole everything loved oh shot shot shot hole every single thing loved luck waiting break keep saying looking way escape oh wishing taken granted help gon na wrong oh going mess oh luck sorry everything oh everything done second born seems loaded gun shot shot shot hole everything loved oh shot shot shot hole every single thing loved meantime let go roadside used know let drift away oh let drift away bay side used show moonlight let go let drift away oh let drift away always time change mind oh always time change mind oh love hear oh let drift away sorry everything oh everything done second born seems loaded gun shot shot shot hole everything loved oh shot shot shot hole every single thing loved meantime let go roadside used know let drift away oh let drift away bay side used show moonlight let go let drift away oh let drift away always time change mind oh always time change mind oh love hear oh let drift away
  이아립  ,책장을 넘길 때마다,
  나폴레옹 다이나마이트  ,MAMMOTH,
  Ryan Adams  ,Everybody Knows,come worst places come come try take home always need hard reciprocating fabric life gets torn everything changing know going hold spinning control together one us love everybody knows says name echoes head like canyon says name says know come sometimes thinking like cannonball shooting cannon forget whatever thinking everything changing know going hold spinning control together one us love everybody knows everything changing know going hold spinning control together one us love everybody knows everybody knows
  Lee DeWyze  ,A Song About Love,used make cry smiled since left undo goodbye word wish cud forget u told love try move hard get fall wrote song love nothing took blame even though knew wrong yeah calling name every time singing song coz yeah u told love time move hard get fall wrote song love nothing coz yeah u told love try move hard get fall wrote song love sad cuz enough wrote song love nothing
  Warmen  ,Separate Ways,stand worlds apart hearts broken two two two sleepless nights losing ground reaching feelin gone change mind go survive tide love divides someday love find break chains bind one night remind touched went separate ways ever hurts true love desert know still love though touched went separate ways troubled times caught confusions pain pain pain distant eyes promises made vain vain vain must go wish love never walk alone take care love miss love chorus twice still love girl really love girl ever hurts true love desert
  Paul McCartney & Wings  ,Live And Let Die (2018 Remaster),young heart open book used say live let live know know know ever changing world living makes give cry say live let die live let die live let die live let die matter ya got job got ta well got ta give fellow hell young heart open book used say live let live know know know ever changing world living makes give cry say live let die live let die live let die live let die
  Cat Power  ,Ruin,seen gypsies made way kept going kept rolling nowhere go nowhere go far seen bush wilderness every known city saudi arabia dug calcutta went mozambique istanbul rio rome argentina chile mexico taiwan great britain belfast desert spain little bitty island middle acific way back home town town bitching complaining yet people got sh eat bitching moaning many people know got sitting ruin sitting ruin far seen bush wilderness every known city saudi arabia dug calcutta went mozambique istanbul rio rome argentina chile mexico taiwan great britain belfast desert spain little bitty island middle acific way back home town town bitching complaining yet people got sh eat bitching moaning many people know got sitting ruin sitting ruin sitting ruin sitting ruin
  Alice Cooper  ,You & Me,get home work wan na wrap around wan na take sqeeze till passion starts rise wan na take heaven would make day complet movie stars share bed lovin tv enough workin man tell babe oh enough sometimes asleep starin ceilin gon na reach touch go dreamin could take heaven would make day complete cause movie stars ar share bed lovin tv yeah enough workin man tell sweetheart enough superstars share bed popcorn tv yeah enough workin man tell babe enough get home work wan na wrap around like hold sqeeze till passion starts rise wan na take heaven would make day complete movie stars share bed lovin tv enough workin man well tell baby enough
  김필  ,붉은 낙타,believe believe believe believe believe believe believe believe wan na go
  Annihilator  ,The Fun Palace,l waters pharr welcome invite world face nouse escape confront bash psychic house horrors lead pain take chorus panic conscience lied trapped inside panic ultimate nightmare welcome fun palace panic try scream dream panic ultimate nightmare welcome palace tonight tried invoke memories guilt driven unconscious mind living lives denied behold faces violence cut pieces look behind repeat chorus bridge look fun games taken awa confess dreams growing destroyed farewall impel back world face every sin take painful bounty representing keeper palace secrets held within repeat chorus goodbye fun palace
"  HOON.J ,  Effect Kim  ",나성에 가면,
  Majical Cloudz  ,Mister,say seen lie damns say seen tell hey mister want right x feel without love feel carried feel without love eyes scare feel mood love know trying feel mood love want loving hey mister want right x love come feeling love goes feeling say seen lie damns say seen tell hey mister want right x love come feeling love goes feeling
  Foy Vance  ,Sunshine or Rain,always baby always true yet never treated like treated never one end phone needed someone talk verse home much lately home yet always pick fall told would never change still feel chorus whenever need call name never leave side may take seasons make heart mend love babe come sunshine rain yeah verse truly want baby like long ago oh mate god made soul swore would never change oh still feel chorus whenever need call name never leave side may take seasons make heart mend love babe oh love babe refrain love babe love babe love babe love babe love babe love chorus whenever need call name never leave side may take seasons make heart mend love babe come sunshine rain ooh
  Judas Priest  ,Leather Rebel,hero night blood thunder rushing till dawn light sky turning red like renegade alone walk fire till crash blaze living edge start chain reaction sears neon light stealing action always takes fight leather rebel lightning dark leather rebel burning heart master streets bullet proof bound glory cities feet turning power running wild free one dares stand destiny rule darkest hours see future writings wall legend lifetime stories recall leather rebel lightning dark leather rebel burning heart see future writings wall legend lifetime stories recall leather rebel lightning dark leather rebel burning heart leather rebel lightning dark leather rebel burning heart leather rebel leather rebel leather rebel leather rebel
  Jason Mraz  ,Better With You,pack bags going away leaving day nice time alone nice know miss home wrote song let know better better better give meaning words love better better better love say words always head take heart better bed better appart alone better better better give meaning words love better better better love say words hoo hoo hoo hoo yeah live people surround love thing comes want know better better better better better give meaning words love better better love say words hoo hoo hoo hoo
"  Queen ,  Paul Rodgers  ",Love Of My Life (Live In Sheffield / 2005),love life hurt broken heart leave love life see bring back bring back take away know means love life leave stolen love desert love life see bring back bring back take away know means remember blown everythin way grow older side remind still love still love hurry back hurry back please bring back home know means love life love life
  We Came As Romans  ,Memories,ends road took together turn another page however forever got one chance seconds fading moonlight wishing thing wan na remember remember moment remember moment remember moment tonight thinking time burn rest lives last never look back give heart give hand cause nothing stopping making memories cause nothing stopping making memories another line begins wonder comes knew different chapters got one chance moonlight want hold gon na remember remember moment remember moment remember moment tonight thinking time burn rest lives last never look back give heart give hand cause nothing stopping making memories cause nothing stopping making memories never getting back admit always become partly one last night remember never getting back admit always become partly let take world together tonight thinking time burn rest lives last never look back give heart give hand cause nothing stopping making memories cause nothing stopping making memories cause nothing stopping one last night remember cause nothing stopping let take world together
  John Mayer  ,Bold As Love,anger smiles towering shiny metallic purple armor queen jealousy envy waits behind fiery green gown sneers grassy ground blue life giving waters taken granted quietly understand happy turquoise armies lay opposite ready wonder fight bold love yeah bold love bold love ask axis red confident flashes trophies war ribbons euphoria orange young full daring unsteady first go round yellow case mellow fact trying say frightened like emotions mine keep holding giving life rainbow like bold bold love yeah bold bold love bold bold love ask axis yeah knows knows knows knows everything bold bold love bold bold love bold bold love
  장기하와 얼굴들  ,새해 복 (Inst.),
  Radiohead  ,Codex (Illum Sphere RMX),sleight hand jump end clear lake one around dragonflies fantasize one gets hurt done nothing wrong slide hand jump end water clear innocent water clear innocent
  Descendents  ,Fighting Myself,run since ever standard family disaster lovers brothers bastards told go shook lumps took running short wisdom wits cunning one nothing unknown point waste blame never strictly speaking sane known fresh dirt wash old stains away tried drown memory learned swim clung kissed cheek sadistically dragged point waste blame never strictly speaking sane known fresh dirt wash old stains away angry psychic self defense wasting energy fighting something see fightin know time unfolds tangles strings attached feelings mangled threads severed still dangle drift away point waste blame never strictly speaking sane known fresh dirt wash old stains away last thing tried end hurting found enemy staring back mirror fightin fightin nobody ring broke things know fixed fought wanted anything stuck around kicks
  바닐라 유니티  ,내가 널 어떻게 잊어,know say goodbye say goodbye say goodbye say goodbye say goodbye say goodbye
  Chuck Berry  ,Almost Grown,know almost grown verse yeah right school said broke rule never dutch carouse around much bother leave alone anyway almost grown verse run around mob got little job going buy little car drive girl park bother us leave us alone anyway almost grown verse got eye little girl ah really world take dance started talkin romance bother us leave us alone anyway almost grown guitar solo verse know still living town done married settled really ball browse around bother us leave us alone anyway almost grown
  Allan Rayman  ,Beverly,oh oh oh wrong friends fight attention falls apart blames start pleased pay mind gets head time give cold shoulder cause always plays cool talks back sometimes back stays turned catch girl slipping yeah looking boy back stays turned girl wants world funny world beverly girl cruella de vil oh perfect sure good enough wrong friends fight attention falls apart blames start pleased pay mind gets head time give cold shoulder cause always plays cool talks back sometimes back stays turned catch girl slipping yeah looking boy back stays turned girl wants world funny world know keep goin beverly girl cruella de vil oh perfect sure never good enough beverly girl cruella de vil oh perfect sure never good enough matter anyway matter anyway matter anyway matter anyway matter anyway matter anyway matter anyway matter anyway matter anyway matter anyway matter anyway matter anyway beverly girl cruella de vil oh perfect sure never good enough beverly girl cruella de vil oh perfect sure never good enough beverly girl cruella de vil oh perfect sure never good enough beverly girl cruella de vil oh perfect sure never good enough
  비갠후  ,꿈이었으면,
  Judas Priest  ,Jawbreaker,deadly viper peering coil poison coming boil ticking like time bomb fuse running short verge snapping caught pressure building years bore load cracks appear frame starts distort ready explode jawbreaker crouching coner wound spring piercing eyes flash shimmering muscles contorted claws dug dirt every ounce fibre alert
  Evanescence  ,Lost In Paradise,believing something distant human denying feeling hopelessness promises made let believed broken nothing left feel cruel wanting falling time lost paradise much like past exist still much like feel like belong scared nothing left feel cruel wanting falling time lost paradise one day feel pain anymore take away shadows cause let go nothing left feel cruel wanting falling time lost paradise alone lost paradise
  Maroon 5  ,Story,mean things pleased way things wear dress protect scar seen give please yourelf wish somewhere else justified things tried said near moment stay never go home know everything ever goes story broken heart comes true comes true learned secrets yet burn things said took dive feel alive never heard truth love know pain cause want sit watching eyes close slowly open mine near moment stay never go home know everything ever goes story broken heart comes true comes true confused know life hit miss days stung much sun think may one cover shrouded could listen pain listen know everything ever goes story broken heart comes true know everything ever know story broken heart comes true comes true true comes true true
  달콤한비누  ,서투른 노래,
  Ok Go  ,1000 Miles Per Hour,another long quiet night another long quiet lonely night spent side lot left say lot still could say change mind little bit money could buy us car little luck could get away let get drive one thousand miles hour fly wheat fields water towers go go go go let go let go let go let go look eye know look right cry always day wake morning awake let disappear little bit money could buy us car little luck could get away let get drive one thousand miles hour fly wheat fields water towers go go go go let go let go let go let go drive one thousand miles hour fly wheat fields water towers go go go go let go let go let go let go let go let go let go
  MIKA  ,Blame It On The Girls,intro sitting bar guy came said life stinks saw gold credit card saw way looking people across room looked face know well look face said dude perspective life sucks verse got looks books take pages tell got face make fall knees got money bank thank guess could think livin ease like lovers open show matter sitting much matter wondering hell wishing ugly like blame girls know blame boys keep hating blame mother things said blame father know dead blame girls blame boys blame girls blame boys life could simple never fail complicate every single time could children wife perfect little life blow bottle wine like baby stubborn child matter always looking axe grind matter wondering hell wishing lucky like blame girls know blame boys keep hating blame mother things said blame father know dead blame girls blame boys blame girls blame boys blame girls blame boys blame girls blame boys interlude got looks books take pages tell got face make fall knees got money bank thank guess could feel livin ease blame girls know blame boys keep hating blame mother things said blame father know dead blame girls blame boys blame girls blame boys blame girls blame boys blame girls blame boysssss
  P.O.D.  ,Freedom Fighters,today heard people say dem want live free greedily everyone pay play sun others fight skies gray say like way stay go away ooowoooo freedom fighters ignite jah ooowoooo freedom fighters shine jah live free free die free freedom fighters live free free die free ignite jah live free free die free freedom fighters live free free die free shine jah today heard people say say man came took choice away portray selfishness hate prepare die today say fade away appreciate life liberate ooowoooo freedom fighters ignite jah ooowoooo freedom fighters shine jah live free free die free freedom fighters live free free die free ignite jah live free free die free freedom fighters live free free die free shine jah right live peace must fight keep keep holds truth inside stand defend lay die right live peace must fight keep keep holds truth inside stand defend lay die ooowoooo freedom fighters ignite jah ooowoooo freedom fighters shine jah live free free die free freedom fighters live free free die free ignite jah live free free die free freedom fighters live free free die free shine jah live free free jah say live free jah say die free live free jah say die free live free jah say free live free die free stand defend lay die
  Iron Maiden  ,Sea Of Madness,street somebody crying night fires burn maybe tonight somebody crying reached point return oh eyes see believe oh heart heavy turn back leave chorus like eagle dove fly high wings see bring sadness like river flow towards sea go bring sadness sea madness somewhere hear voice calling dark burns dream got hope falling find world seen oh eyes see believe oh heart heavy turn back leave chorus madness sun shine sea madness wind fill sails madness see bring sadness towards sea go street somebody crying night fires burn maybe tonight somebody crying reached point return oh eyes see believe oh heart heavy turn back leave chorus
