artist,title,lyric
  비젤리 (Bee Jelly)  ,Hold On (Feat. Fancy Jung),This love is freakin' crazy 나와 다른 곳을 보잖아 Baby 이미 알고 있어 난 네 Phone을 흔드는 많은 Aquaman She just wants the spotlight 너에게 시선을 빼앗겨 언제나 Ooh But it doesn't matter 어쩌면 널 위해 뭐든 못할게 없어 누구에게나 보이는 스킨십 and 쉬운 Smile 내가 있던 없던 말던 You don't care about me 빠져들 것 같은 눈빛 눈이 부셔 보여 난 너에게 난 취해버려 Oh Baby She wants somebody to love I can do anything for you Hold on to your heart all day She wants somebody to love I can do anything for you I would go through all this pain She just wants the spotlight 너에게 시선을 빼앗겨 언제나 Ooh But it doesn't matter 어쩌면 널 위해 뭐든 못할게 없어 누구에게나 보이는 스킨십 and 쉬운 Smile 내가 있던 없던 말던 You don't care about me 빠져들 것 같은 눈빛 눈이 부셔 보여 난 너에게 난 취해버려 Oh Baby She wants somebody to love I can do anything for you Hold on to your heart all day She wants somebody to love I can do anything for you I would go through all this pain 언제나 너에게 바라고 바래 언제나 너만을 원하고 원해 언제나 너만을 그리는 내 맘을 받아줘 Oh Baby She wants somebody to love I can do anything for you Hold on to your heart all day She wants somebody to love I can do anything for you I would go through all this pain She wants somebody else not me Just look at me baby I can do anything for you
  유영 (Swim)  ,좋아해,아무 이유 없이 나는 니가 참 좋은데 자꾸 이유를 붙여 네게 좋음을 표하곤 해 언제부터인지 그런 거 난 잘 모르는데 이때부터였나 하는 건 참 많아서 나 혼자서만 라라 라라라라 라라 라라라 라라 라라라라 라라 라라라 라라 라라라라 라라 라라라 라라 라라라라 라라 라라라 난 네가 좋아서 나 혼자서 막 끙끙 앓다가 네게 전하지 못한 말만 자꾸 쌓여만 가 너만 괜찮다면 난 네게 표현하고 싶어 내 마음을 내 마음을 라라 라라라라 라라 라라라 라라 라라라라 라라 라라라 라라 라라라라 라라 라라라 라라 라라라라 라라 라라라 너라는 바다에 갇혀버린 난 하나의 배 같아 돛이 없고 닻이 없어 혼자선 갈 수가 없어 너라는 바람이 부는 대로 난 계속 흘러만 가 세상 내 맘대로 안 되는데 왜 행복할까 아무 이유 없이 나는 니가 참 좋은데 자꾸 이유를 붙여 네게 좋음을 표하곤 해 좋아하고 보니 좋아할 이유가 참 많은데 좋아한단 말은 아직 한 번도 못했는데 난 네가 좋아서 나 혼자서 막 끙끙 앓다가 네게 전하지 못한 말만 자꾸 쌓여만 가 너만 괜찮다면 난 네게 표현하고 싶어 널 좋아해 널 좋아해 라라 라라라라 라라 라라라 널 좋아해 라라 라라라라 라라 라라라 널 좋아해 라라 라라라라 라라 라라라 널 좋아해 라라 라라라라 라라 라라라 예예 라라 라라라라 라라 라라라 라라 라라라라 라라 라라라 좋아해
  곱슬머리  ,남자 둘이 부르기엔 너무 달달한 노래,눈부신 햇살이 그대의 뺨에 물들 때 달콤한 향기가 코끝에 스칠 때 조그마한 그 손이 내 손에 맞닿을 때 함께 걷던 그 길이 설레일 수밖에 조그마한 너의 두 손을 덥석 나 항상 걷던 그 길이 오늘따라 웬일인지 너무 짧게 느껴져 환한 너의 미소와 달콤한 너의 향기가 너무 심쿵 하니까 혹시 네게 닿을까 살짝 스치진 않을까 하는 마음에 네가 사라질까 봐 바람에 날아갈까 봐 네 손을 덥석 잡아버렸어 Baby 나와 같이 걸을래요 Baby 네 걸음에 맞출게 두 손 잡아 줄게 네 옆에서 떨어지지 않을게 Baby 나와 함께 할래요 Baby 항상 웃게 해줄게 네가 잠들 때까지 머리 쓰다듬어줄게 Baby Baby Baby 항상 네 곁에 있어줄게 Baby Baby Baby 항상 네 편이 되어줄게 Baby Baby Baby 네가 어디에 있든 너와 함께할게 너만을 아껴줄게 너만을 사랑할게 네가 필요할 때면 언제든 달려갈게 Baby Baby Baby Baby Baby Baby Baby Baby Baby Baby Baby Baby
  노브레인  ,웃으며 지낼 수 있어,달빛은 고요하게 빛나 밤하늘 가지런히 빛나게 하지만 쓸쓸이 홀로 걷고있는 내 맘을 비춰줄것은 남아있지 않네 둘이서 함께 걷던 거리를 걷고 또 걷다보면 언젠가 너의 모습이 눈 앞에 보일것 같아  미치도록 생각날땐 네 이름을 크게 저 하늘에 외칠꺼야 미치도록 눈물날땐 네 사진을 보며 나의 마음을 달래어 볼께  괜찮아 그런대로 나도 웃으며 지낼수 있게 된것같아 어차피 우린 아직 젊고 만남이 있다면 이별도 있는거겠지  어여쁜 환하게 웃던 너의 얼굴이 생각나도 이제는 모든것이 지나간 추억으로 남겠지  미치도록 생각날땐 네 이름을 크게 저 하늘에 외칠꺼야 미치도록 눈물날땐 네 사진을 보며 나의 마음을 달래어 볼께 이런 내 마음 넌 알지 아마 모르겠지 너와의 그 약속 난 아직 기억하는데  미치도록 생각날땐 네 이름을 크게 저 하늘에 외칠꺼야 미치도록 눈물날땐 네 사진을 보며 나의 마음을 달래어볼께   나의 마음을 달래어볼께  나의 마음을 달래어볼께 -
  푸디토리움  ,Avec (아베크 / 함께),J'ai une question Si tu sais guerir les blessures panses moi Car mon corps a souffert Mes cicatrices sont cheres J'aimerais que tes mains les nettoient N'ouvre pas les yeux Chasse toute ces douleurs du passe Laisses-toi Porter par le plaisir De vivre une autre histoire Je n'y arriverai pas sans toi My dear je vois notre avenir Magnifique Si mes maux reviennent de plus belle Et prennent le pas sur nous Qu'ils me tiennent Mon ami brise Ne laisse pas la crainte d'etre abime Ternir notre idylle Je comptes sur toi Je veux que tu sois Ici tout contre moi Que mes doutes se levent Que te parlent mes reves Qu'au son de ta voix Rien qu'avec toi Oui cela va de soit Je me sente si bien Ma raison de vivre entre tes mains J'ai une question Si tu sais guerir les blessures panses moi Car mon corps a souffert Mes cicatrices sont cheres J'aimerais que tes mains les nettoient N'ouvre pas les yeux Chasse toute ces douleurs du passe Laisses-toi Porter par le plaisir De vivre une autre histoire Je n'y arriverai pas sans toi Cheri je nous vois dans l'avenir Magnifiques Si tes maux reviennent de plus belle Et prennent le pas sur nous Qu'ils te tiennent Mon amie souhaitee Ne crains pas que je sois ecorche Puise dans notre idylle Je suis a toi Je veux que tu sois Ici tout contre moi Que mes doutes se levent Que te parlent mes reves Qu'au son de ta voix Rien qu'avec toi Oui cela va de soit Je me sente si bien Ma raison de vivre entre tes mains Je veux que tu sois Ici tout contre moi Que mes doutes se levent Que te parlent mes reves Qu'au son de ta voix Rien qu'avec toi Oui cela va de soit Je me sente si bien Ma raison de vivre entre tes mains Je veux que tu sois Oui tout contre toi Je me sens si bien quand mon amour dors dans tes bras Au son de ta voix Oui tout contre toi Je me sens si bien quand mon amour dors dans tes bras Je veux que tu sois Oui tout contre toi Je me sens si bien quand mon amour dors dans tes bras
  바버렛츠 (The Barberettes)  ,Be My Baby,The night we met I knew I needed you so And if I had the chance I'd never let you go So won't you say you love me I'll make you so proud of me We'll make 'em turn their heads every place we go So won't you please Be my be my baby Be my little baby My one and only baby Say you'll be my darlin' Be my be my baby Be my baby now My one and only baby Whoa oh oh oh I'll make you happy baby just wait and see For every kiss you give me I'll give you three Oh since the day I saw you I have been waiting for you You know I will adore you 'til eternity So won't you please Be my be my baby Be my little baby My one and only baby Say you'll be my darlin' Be my be my baby Be my baby now My one and only baby Whoa oh oh oh So won't you please Be my be my baby Be my little baby My one and only baby Say you'll be my darlin' Be my be my baby Be my baby now My one and only baby Whoa oh oh oh Be my be my baby Be my little baby My one and only baby Be my be my baby Be my baby now My one and only baby Whoa oh oh oh Be my be my baby Be my little baby My one and only baby Be my be my baby My one and only baby
  브라운트리  ,꿈꾸는 소년,눈부시게 쏟아지는 어느 햇빛속에 그녀가 있어 나를 보며 웃음짓는 그녀는 나의 나의 나의 나의 나의 나의 Lover 밤 하늘에 숨어있는 많은 별들속에 그녀가 있어 피어있는 꽃들도 그녀를 보고 웃네 나의 나의 나의 나의 나의 나의 Lover 길을 걷다보면 늑대들이 슬금슬금 다가와 불안하게 만들어 하늘에서 내려온 천사같은 그녀는 내가 정말 사랑하는 여자죠 나와 함께 이 길을 걷고 평생을 나와 함께 해줘 내 안에 숨겨왔던 말 너만을 사랑해 나와 함께 이 길을 걷고 평생을 나와 함께 해줘 내 안에 숨겨왔던 말 너만을 사랑해 언제인가 닫혀있던 나의 마음속에 그녀가 있어 나를 보며 웃음짓는 그녀는 나의 나의 나의 나의 나의 나의 Lover 길을 걷다보면 늑대들이 슬금슬금 다가와 불안하게 만들어 하늘에서 내려온 천사같은 그녀는 내가 정말 사랑하는 여자죠 나와 함께 이 길을 걷고 평생을 나와 함께 해줘 내 안에 숨겨왔던 말 너만을 사랑해 나와 함께 이 길을 걷고 평생을 나와 함께 해줘 내 안에 숨겨왔던 말 너만을 사랑해 나와 함께 이 길을 걷고 평생을 나와 함께 해줘 내 안에 숨겨왔던 말 너만을 사랑해 나와 함께 이 길을 걷고 평생을 나와 함께 해줘 내 안에 숨겨왔던 말 너만을 사랑해 사랑해 사랑해
  사비나앤드론즈  ,Bird,Some kind of you Only for my love Only for my love Only for love Some kind of you Only for my love Only for my love Only for love 때론 내게 또 네게 들려 가벼운 입맞춤 그리고 my voice 아물지 못했던 너를 내가 감싸줄게 Yeah I was falling in love Some kind of you Only for my love Only for my love Only for love 작은 의자에 내 발을 올려놓고 포근한 베개를 베어주던 그대 그리고 꼭 안아주던 너 my love Some kind of you Only for my love Only for my love Only for love 달을 올려다 보는 그대의 눈에 고인 눈물이 흘러도 괜찮아 Let it fall Lover is in your arm My love
  시와  ,기차를 타고,흐리게 보이는 초록의 산들과 산 위에 구름과 초록의 논밭과 그 옆에 달리는 기차 언제쯤 돌아올까 알 수 없는 당신과 지나간 당신과 떠나보낸 당신과 그들을 생각하네 같이 이 기차를 탈 수 있을거라 생각했었지 그랬었지 함께 기차 안에서 맥주도 마셔보리라 했었지 창 넓은 식당칸에서 갈수록 늘어가는 갈수록 비어가는 늘어가는 욕심과 비어가는 마음을 늘어가는 욕심과 비어가는 마음을 흐리게 보이는 초록의 산들과 산 위에 구름과 초록의 논밭과 그 옆에 달리는 기차
  기프트 (GIFT)  ,내일의 나에게,감정이 앞서 전한 말에는 누군가 긁히고 날 지키기 위한 성급한 판단에 상처를 입어요 앞뒤 가리지 않는 짧은 생각에 후회를 하네요 오늘 하루도 여전히 너에게 상처를 주네요 그렇게 무뎌져 날 똑바로 마주했을 때 자신이 없다면 난 그대의 하얗고 검은 창문에도 비치지 않을게 그대가 없다면 조금 넉넉해진 내 마음과 나의 창문에 비가 내리겠지 미안하다는 말 한마디가 그렇게 어려운 걸까요 내일의 나에게 미안할 텐데 고집을 피워요 그렇게 무뎌져 날 똑바로 마주했을 때 자신이 없다면 난 그대의 하얗고 검은 창문에도 비치지 않을게 그대가 없다면 조금 넉넉해진 내 마음과 나의 창문에 비가 내리겠지 조금만 내려놓을 수 있었다면 내 마음도 지나고 나서야 들려오더라 왜 이제야 끝에 다 와서야 알게 되더라 왜 이제야 자신이 없다면 난 그대의 하얗고 검은 창문에도 비치지 않을게 그대가 없다면 조금 넉넉해진 내 마음과 나의 창문에 비가 내리겠지
  캐스커  ,고양이편지,네가 슬플 때 힘겨워할 때 내가 얼마나 힘이 되는진 몰라도 두 눈을 한번 깜빡 큰 눈망울을 반짝대는 날 떠올리는 건 어때 길을 걸을 땐 늘 같은 표정 괜히 시무룩해 보이는게 싫다면 너도 두 눈을 깜빡 세상 모든 게 반짝대는 듯 행복한 표정 지어보렴 고양이처럼 그래 나처럼 걱정없이 살아보면 어때 고양이처럼 그래 나처럼 너도 행복하면 좋겠어 가끔 외롭지 울 일도 많지 사람의 삶이란 꽤나 쓸쓸해보여 그래도 내가 팔짝 너의 무릎에 납작 누워서 널 웃게 만들잖아 너도 알지만 게으른 나는 아무것도 안해 그저 뒹굴기만 해 그래도 나는 항상 네가 어딨든 너를 생각해 널 많이 사랑하고 있어 고양이처럼 그래 나처럼 걱정없이 살아보면 어때 고양이처럼 그래 나처럼 너도 행복하면 좋겠어  고양이처럼 그래 너처럼 걱정없이 살아가고 싶어 고양이처럼 그래 너처럼 나도 행복하면 좋겠어 고양이처럼 그래 나처럼 걱정없이 살아보면 어때 고양이처럼 그래 너처럼 나도 행복하면 좋겠어
  유월  ,겨울의 끝에서,겨울의 끝에서 널 찾을 수 있을까 겨울의 끝에서 널 잊기로 했었어 짧지 않았던 그때를 이미 추억하고 있는지 궁금해서 또 궁금해서 너의 흔적을 찾아보곤 해 왜 난 꼭 이렇게 아파하고 또 아파해야 이렇게 또 혼자 남게 되는지 왜 난 꼭 이렇게 슬퍼하고 또 슬퍼해야 이렇게 또 봄이 오게 되는지 헤어지자는 그 말 한마디가 어찌나 슬프던지 어찌나 아프던지 내게 남았던 네 그 향기조차 이젠 사라져서 또 사라져서 더는 맡을 수도 없는데 왜 난 꼭 이렇게 아파하고 또 아파해야 이렇게 또 혼자 남게 되는지 왜 난 꼭 이렇게 슬퍼하고 또 슬퍼해야 이렇게 또 봄이 오게 되는지 그랬는지
  레이지 본  ,피터팬 신드롬,"키가 큰 거인 할머니가 준 50원 하나 오락실에 쌍용 끝판을 깨고 말거야 힘쎈 비에이 나쁜 닭머리 언제나 나를 힘들게 하는 악당 나의 뒤에는 동네 친구들 모두의 기대 한 몸에 가득  평생 오락만 하고 싶었어 이젠 오락실이 집이야 동네 꼬마들이 친구야 모든 게임 다 깨버렸어 주머니에 천원 생겼지 담배 한 갑도 살 수 없겠지 차라리 어린 시절이 그리워 천원만 있으면 무적  영원히 방학인 세상을 꿈꿨어 매일 TV엔 만화영화만 나오기를 바랬어 기도를 해 하루 종일 나가 놀겠지 친구들과 이곳 저곳 모험을 떠나는 거야 풍뎅이 작은 거북이 보물 찾아 모험을 떠나는 거야  이젠 바라지도 않는데 영원할 것만 같은 방학 뒹굴 뒹굴 방은 넓구나 나는 장판 디자이너 새벽 옆집에 밝은 창문 너도 밤새 게임했구나 oh, yes, thank you, of course please e-mail me 그 날의 피로를 같이 풀자  힘내 보자 친구 다같이 힘내 보자 친구 다같이 힘내 보자 친구 다같이 힘내 보자 친구 다같이  Wild Card 아침은 또 오겠지 Wild Card 해는 다가오겠지 Wild Card 이젠 도망치지마 백수의 왕따윈 이제 그만  Never Land 나이를 먹지 않는 Never Land 피터팬 나의 인생 Never Land 웬디와 헤어져라 후크선장 멋진 인생  Wild Card 오락만 하고 싶었어 Never Land 영원할 것 같은 방학 Wild Card 주머니 50원 하나 Never Land 모험을 떠나는 거야  Wild Card 오락만 하고 싶었어 Never Land 영원할 것 같은 방학 Wild Card 주머니 50원 하나 Never Land 모험을 떠나는 거야"
  달콤한 소금  ,까망비,주룩주룩 비가 내린다 스르르르 맘이 녹는다 언젠가 비가 주륵주륵 내리던 그 날에 내 맘도 비가 내렸지 하늘에 구멍이 뚫린 것 같아 까맣게 내 맘도 허전해진다  언젠가 비가 주륵주륵 내리던 그 날에 내 맘도 비가 내렸지 하늘에 구멍이 뚫린 것 같아 까맣게 내 맘도 허전해진다 주룩주룩 비가 내린다 스르르르 맘이 녹는다 주룩주룩 비가 내린다 스르르르 맘이 녹는다  주룩주룩 비가 내린다 스르르르 맘이 녹는다 주룩주룩 비가 내린다 스르르르 맘이 녹는다 떠나가던 그 날 사랑하던 그 밤 떠나가던 그 날 사랑하던 그 밤
  검정치마  ,젊은 우리 사랑,오 젊은 사랑 그것은 너무도 잔인한 것 어린 맘에 몸을 실었던 내가 더 잔인한가 모든게 잘못 돼서 죽어 버릴 듯 위태롭던 우리 일 년은 눈물과 거짓말이 배어나오던 수많은 상처들만 남겼다 오 흉터도 하나없이 깨끗이 아물어 버린 그 곳 우리 추억을 집어 삼켰던 예전엔 내입이 있던 곳 이제는 말해줘도 괜찮을텐데 그 어려웠던 한 마디를 눈물과 거짓말이 배어나오던 수많은 상처들이 대신 말한다 젊은 피가 젊은 사랑을 후회 할 수가 있나 나도 뭐가 뭔지 모르겠는데 언젠가는 나도 누구의 버림을 받겠지 그래도 나는 아무 상관없는 걸 오 그때는 몰랐었네 내가 왜 그랬는지 아주 오래전의 일들이 날 많이 괴롭혔던가 나 역시 흘린 피가 젊었을텐데 이젠 나도 그녀와 닮았네 눈물과 거짓말이 배어나오던 수많은 상처들은 벌써 잊었다 젊은 피가 젊은 사랑을 후회 할 수가 있나 나도 뭐가 뭔지 모르겠는데 언젠가는 나도 누구의 버림을 받겠지 그래도 나는 아무 상관없는 걸 정말로 나는 아무 상관없는걸 될대로 되고 망해도 좋은걸 내가 정말 사랑했던사람은 나 나 나 나 나 나 젊은 피가 젊은 사랑을 후회 할 수가 있나 나도 뭐가 뭔지 모르겠는데 언젠가는 나도 누구의 버림을 받겠지 그래도 나는 아무 상관없는 걸
  블랙홀  ,바람을 타고 (Original Ver.),비교 될 수 있도록 자유롭게 가는거야 억눌렸던 마음이 날아가게 가는거야  어떤 보호조차도 그 어떤 혜택 조차도 날 위한 신호는 아니야  날 막지마 내버려둬 바람처럼 갈수있게   기죽을 순 없잖아 나도 같이 사는거야 내가 흘린 땀들이 값싼 것은 아닌거야  너의 자랑보다도 내 가진 가난보다도 날 무시하는 네게 화가 나  날 막지마 내버려둬 바람처럼 갈수있게  어두운 꿈이지만 남겨진 나의 세계
  3호선 버터플라이  ,방파제,소리 파도 소리 귓속 껍질 속 첫 빛깔 바깥 꽃 푸른 방파제 총들은 널려 있어 꽃들은 죽어가 안개 속을 걸어가 바람 속을 흩어져 대답 질문 다문 입술 썩은 물 말 없는 얼굴 질문 망각 문 shoot shoot shoot shoot at the Sun shoot shoot shoot shoot at the Star look look look look in the mirror kick kick kick your ass  왜 이런 곳에 있는 거야 대답하지마 니 질문 듣기 싫어 난 너의 노예가 아냐 꼬릴 잘라버려 소리 파도 소리 귓속 껍질 속 말 없는 입술 질문 망각 방파제  shoot shoot shoot shoot at the Sun shoot shoot shoot shoot at the Star look look look look in the mirror kick kick kick your ass
  블루파프리카  ,길 없는 길 (Feat. 이종민 Of 장기하와 얼굴들),구름 위로 고개 내민 수줍은 달 바라보면 나를 보며 웃음 짓던 네 모습이 으으음 생각이 나 세상 위로 속삭이는 별빛마저 잠들고 나면 내 맘 깊이 숨겨왔던 그리움을 으으음 꺼내본다 언젠가 태양이 떠오르면 난 다시 가슴에 널 묻겠지만 이렇게 별도 없는 밤 하늘 가득 오직 그대뿐 나는 길 없는 길로 그대 모습 따라 흘러간다 언젠가 태양이 떠오르면 난 다시 가슴에 널 묻겠지만 이렇게 별도 없는 밤하늘 가득 오직 그대뿐 나는 길 없는 길로 그대 모습 따라서 그대 함께 걷던 그날처럼 그렇게 구름 위로 고개 내민 수줍은 달 바라보면 나를 보며 웃음 짓던 네 모습이 으음 생각이 나 생각이 나 생각이 나
  이스턴사이드킥  ,당진,새들 떠다니네 전보다 조금 낮은 이 내 앞의 바다 빗속을 데우네 그늘진 곳도 비는 내려오듯 노랜 느리고 파도는 빠르다 노랜 잊혀지고 낯선 듯 넘어가고 내 앞의 바다만 빗속을 데우네 웃고 있구나 그 때는 추웠지 가져갈 듯이 또 쳐다보더라 울다가도 생각하니 우리들 말고는 지나는 것도 하나 없더라 나는 그때 낯설고 까만 밤을 안고 너를 기다리며 바다만 보았지 그늘진 곳도 비는 내려오든 노랜 느리고 기억은 빠르다 모두 잊혀지고 헤어져 넘어가고 내 앞의 바다만 빗 속을 데우네 웃고 있다가 한참을 더 서서 데려갈 듯이 또 바라보다가 울다가도 생각하니 우리들 말고는 지나는 것도 하나 없더라
  라이프 앤 타임  ,남해,오 나의 바닷가 잊혀지지 않는 물결의 빛이여 그 순간들 모두 지워지지 않는 기억의 끈이여 오 나의 바닷가 잊혀지지 않는 물결의 빛이여 그 순간들 모두 지워지지 않는 기억의 끈이여 셀 수 없이 쌓여온 모래알과 같은 사건들 정처 없이 날라가는 저 새와 같은 사람들 사정 없이 몰아치는 파도와 같은 감정들 끝도 없이 펼쳐진 저 수평선과 같은 꿈 오 나의 바닷가 잊혀지지 않는 물결의 빛이여 그 순간들 모두 지워지지 않는 기억의 끈이여 셀 수 없이 쌓여온 모래알과 같은 사건들 정처 없이 날라가는 저 새와 같은 사람들 사정 없이 몰아치는 파도와 같은 감정들 끝도 없이 펼쳐진 저 수평선과 같은 꿈 셀 수 없이 쌓여온 모래알과 같은 사건들 정처 없이 날라가는 저 새와 같은 사람들 사정 없이 몰아치는 파도와 같은 감정들 끝도 없이 펼쳐진 저 수평선과 같은 꿈
  노르웨이 숲  ,고백하는 날 (Vocal 혜빈 of 달콤),Love 하루에도 몇 번씩 고백하고 싶은데 그게 쉽지가 않아 넌 나를 너무도 몰라 두근두근 떨리는 설레이는 내 맘을 우 이렇게 달콤한 날에 너와 내 손을 마주잡고 두 눈을 맞추고 우 나에게 이런 사랑은 처음이라 그래 떨리지만 말하고 싶어 널 좋아한다고 널 사랑한다고 And i love you love you love you love you 고백하고 싶어 널 안고 싶다고 널 갖고 싶다고 And i want you want you want you want you 고백 하는 날 우 이렇게 기분 좋은 날에 너와 내 손을 마주잡고 입술을 맞추고 우 나에게 이런 사랑은 처음이라 그래 너에게만 말하고 싶어 널 좋아한다고 널 사랑한다고 And i love you love you love you love you 고백하고 싶어 널 안고 싶다고 널 갖고 싶다고 And i want you want you want you want you 고백 하는 날 널 좋아한다고 널 사랑한다고 And i love you love you love you love you 고백하고 싶어 널 안고 싶다고 널 갖고 싶다고 And i want you want you want you want you 고백 하는 날
  Offing  ,Circle,난 네가 좋아져 버렸어 하지만 난 너를 잃고 싶지 않아 만약 내가 가까이 간다면 우리는 언젠간 헤어져야겠지 우아 아 아 아 아 아 우아 아 아 아 아 아 그 여름 날 아 겨울 이었나 눈에 속눈썹이 들어간 것처럼 이유도 영문도 모른 채 이물질처럼 내 두눈에 박혀서 우 아 아 아 아 알고 있어 우 아 아 아 아 알고 있지만 맞은 편 정거장 밖으로 보이는 너의 모습 무척 반가워 우리가 가까이 간다면 둘중에 하나는 망가져야겠지 우 아 아 아 아 알고 있어 우 아 아 아 아 알고 있지만 그러니까 난 지금이 좋아 만남도 헤어짐도 없는 너와 나 그냥 나는 이렇게 널 말야 맴돌기만 하는 게 좋은 것 같아 우아 아 아 아 아 아 우아 아 아 아 아 아 우아 아 아 아 아 아 우아 아 아 아 아 아
  에레나  ,Say Hello To Every Summer,소녀는 살며시 붓을 드네 방학은 어제로 끝났네 퇴색한물감 하얀색 커튼과 바람 9월은 흩어진 꽃의 한숨 소녀는 걸어서 길이 된 풍경을 가득 가슴에 담고서 긴 긴 소녀의 채색은 이어지고 아무리 가도 한 없는 슬픔뿐인 이곳에 뭔가 멈추고 끌어당겨 칠하네 하얀색 물감 지워버리네  긴 긴 태양의 날들이 끝나 가고 소녀는 약속 한 바도 없이 누굴 기다려 뭔가 붙들고 뒤흔들어 칠하네 하얀색 물감 지워버리네 선택도 연락도 없이 지난 방학은 어제로 끝났네 퇴색한 물감 하얀색 커튼과 바람 씩씩한 시간이 흘러가네 다정한 포옹도 잊고서 밀쳐진 어깨 하얀색 커튼과 바람  멀게만 느껴질 어느날에 꽃이피고 또지는 화폭을 소녀는 가슴에 품은 채 걸어온 길은 이제 그리지않네
