artist,title,lyric
  텐시러브 (TENSI-LOVE)  ,Hey Now,What’s the story Brilliant your life What’s this feeling changing emotion What’s the story Brilliant your life What’s this feeling changing emotion 익숙한 방안 속에 언제까지 꿈만 꾸니 누구도 알아주지 않을걸 인생은 생각만큼 길지 않다고 영원토록 이대로 일 순 없잖아 A little voice in my head A little breath in my heart 너에 삶의 교차로 위에서 Need a little time to wake up wake up 우리에겐 많은 시간이 없어 so Hey 너에게 기회를 줘 상처 입은 너를 위해 Hey 다시 꿈을 꾸면 너와 함께 걸어갈거야 it’s you Oh you all my everything 어느 날 거리에서 손을 놓친 아이처럼 더 이상 이정표는 없던걸 결국 혼자 걸을 길이라 해도 난 아직 준비조차도 없는데 A little voice in my head A little breath in my heart 너에 삶의 교차로 위에서 Need a little time to wake up wake up 두려움도 많은 어제였다고 go Hey 너에게 기회를 줘 내일이면 잊을거야 Hey 지금이 아니면 놓치고 말거야 네가 바라던 꿈들 I’ll give my everything 빠르게 변하는 세상 속 에서 하지만 I need your love baby I need your love 삶의 선택의 순간을 맞이하게 될 때 마다 내일이면 이 순간 놓치고 말거야 Oh Hey 네게 기회를 줘 많은 사람들 쉽게 변해 갈거야 현실 속 에서 삶은 모두 아름답진 않지만 All we have one life Not alone baby Not alone baby Oh oh oh 깨어나야만 해 hey now What’s the story Brilliant your life What’s this feeling changing emotion What’s the story Brilliant your life What’s this feeling changing emotion hey now
  흐른  ,Global Citizen,어느 늦은 새벽에 모니터를 켜보니 국제 뉴스면에선 온통 만물이 죽어가 가자에선 폭탄이 케냐에선 종족분쟁 잠깐 슬퍼하다가 케냐산 커피 한 모금 풀을 먹는 소에게 옥수수를 먹여서 뚱뚱해진 소들로 햄버거를 만들어 저멀리 잠비아에선 옥수수가 없어 죽어가 잠깐 생각하다가 오늘 저녁은 햄버거 이어폰을 흐르는 펫샵 보이즈는 노래해 음악이 계속되는 한 모두 괜찮겠지 당신들 순진한건지 아니면 득도한건지 헷갈려 하다가 케냐산 커피 한 모금 국제뉴스 면에선 온통 만물이 죽어가 나는 대한민국에서 케냐산 커피를 마셔 펫샵 보이즈는 노래해 I think it's gonna be alright I think it's gonna be alright I hope it's gonna be alright 국제뉴스 면에선 온통 만물이 죽어가 나는 대한민국에서 케냐산 커피를 마셔 펫샵 보이즈는 노래해 I think it's gonna be alright I think it's gonna be alright I hope it's gonna be alright
  Zabe (자베)  ,니가 좋다 (with 산들),널 좋아한다고 해버릴까 실수인 척 말해볼까 더 이상 못 참겠어 이런 맘 아는지 매일 니 생각에 고민을 해봐도 장난스런 미소가 자꾸 설레게만해 빠져버렸어 초콜릿보다 부드러운 니가 햇살보다 간지러운 니가 두근두근 니 향기에 빠져서 fall in love with you 그래 니가 너무 좋다 온종일 니 생각에 엔도르핀이 팍팍 하루 종일 축 처져도 비타민이 듬뿍 머리부터 발끝까지 너무 완벽해 니 품 안에 안기고 싶다 넌 지금 뭘 할까 내 생각은 할까 고민고민 해봐도 마음만 커지는걸 빠져버렸어 초콜릿보다 부드러운 니가 햇살보다 간지러운 니가 두근두근 니 향기에 빠져 내 맘 가져가 초콜릿보다 부드러운 니가 햇살보다 간지러운 니가 두근두근 니 향기에 빠져 fall in love with you 그래 니가 너무 좋다
  jayme  ,Blue hour,스쳐 지나가버릴 것만 같았던 기억 속에 난 녹아 버린 걸 눈을 뜨면 깨어날 줄 알았던 꿈 그 안에서 또 하루를 살아가 파란 하늘 선명해지는 그 시간 속으로 널 찾아가 낯선 태양 가까이 날개를 펴고 하늘 높이 날아도 단지 그런 느낌 함께이기에 소중한 걸 Blue sign Blue sky 달빛이 내려온 Blue eye Blue night 새로운 꿈속에서 햇살이 널 비추던 그 밤을 기억할게 다시 손을 잡아줄 태양이 뜰 때까지 그저 달려왔던 너와 나 눈을 감아 봐도 떠올라 가만히 내려온 꿈의 기억이 선명해진 건 우연이 아니야 흘러버린 시간의 날들이 내게서 깨지진 않을까 걸어온 길의 끝에 만난 목적지가 혹시 다르진 않을까 난 더 조금씩 눈을 떠볼래 나를 좀 더 믿어볼래 낯선 태양 가까이 날개를 펴고 하늘 높이 날아도 단지 그런 느낌 함께이기에 소중한 걸 Blue sign Blue sky 달빛이 내려온 Blue eye Blue night 새로운 꿈속에서 햇살이 널 비추던 그 밤을 기억할게 다시 손을 잡아줄 태양이 뜰 때까지 늘 내 곁에 있었던 네게 모든 걸 줄게 전부 안고 갈게 멀어지지는 말아줘 내 손을 잡아줄 수 있는 건 오직 너뿐이니까 더 가까이 날아줘 언제든 찾을 수 있는 곳에서 네가 닿을 때까지 이 밤을 건너갈게 너만을 기억할게 낯선 태양 가까이 날개를 펴고 하늘 높이 날아도 단지 그런 느낌 함께이기에 소중한 걸 Blue sign Blue sky 달빛이 내려온 Blue eye Blue night 새로운 꿈속에서 햇살이 널 비추던 그 밤을 기억할게 다시 손을 잡아줄 태양이 뜰 때까지
  Vinter Noon  ,Dear My Little.. (Vocal By 조지은) (One Take Live),세상이 내 작은 손바닥만 하던 그런 때에 너를 만났지 내 세상은 너로 가득 찼고 너에게도 내가 전부였었지 우리가 함께 할 순간들은 영원할 거라 그렇게 의심 없이 믿고 있었어 너와 내 시간에 끝은 없는 거라 나는 아무런 준비를 하지 않았어 만약에 우리가 좀 더 어른이 된다면 어른이었다면 이렇게 상처만 남길 그런 말들 대신에 예쁘게 포장된 맘만을 쏟아지는 별들은 하늘의 눈물 그날의 밤바람에 널 태워 보냈지 사실은 정말 많이 보고 싶은 걸 아직도 가끔 말을 걸곤 해 나를 미워하지도 못하는 너인 걸 알아 아무것도 모르던 까만 눈동자 마지막 이야기만은 들어주지 않을래 아무것도 모른 건 나였어 정말 미안해 만약에 우리가 좀 더 어른이 된다면 어른이었다면 이렇게 상처만 남길 그런 말들 대신에 예쁘게 포장된 맘만을
  블랙 텅스  ,마주침,익숙함에 당연함에 한 번에 갑작스러운 마주침이 마주침이 오 난 흔들리는 네 눈빛은 숨죽여 두근거리고 온 몸으로 느껴지는 오 난 타버린 기억 속에 남아있던 내 모습이 어제와 오늘 속에 또 다른 만남으로 살짝 약간의 긴장감 춤추는 온갖 생각 빠져드는 황홀한 오 그대의 모습 현실과 착각 사이에 순진한 상상 무뎌진 감각들 사이로 표현 못할 짜릿함 형용할 수 없는 이 순간 피할 수 없는 중독으로 타버린 기억 속에 남아있던 내 모습이 어제와 오늘 속에 또 다른 만남으로 살짝 약간의 긴장감 춤추는 온갖 생각 빠져드는 황홀한 오 그대의 모습 타버린 기억 속에 남아있던 내 모습이 어제와 오늘 속에 또 다른 만남으로 살짝 약간의 긴장감 춤추는 온갖 생각 빠져드는 황홀한 오 그대의 모습
  박동  ,너가 있어,말투에서 느껴지는 알 수는 없는 것도 걸어가다 무심코 손을 잡는 것도 우린 다 알고 있어 너가 있어 걷고 있어 너의 손등에 닿는 내 손바닥이 아무렇지 않게 섞여있는 우리 다리에 우린 다 알고 있어 너가 있어 걷고 있어 너가 있어 걷고 있어 너가 있어 걷고 있어
  도마  ,초록빛 바다 (온스테이지 Ver.),초록빛 바다 그곳으로 너와 함께 떠나고 싶다 발 담그고 물장구치고 춤도 추고 모랠 묻혀 가며 민트색 돌고래 보라색 불가사리 황금빛 태양 그 아래서 사랑을 나누네 사랑을 나누네 사랑을 오오 사랑을 사랑을 나누네 나누네 사랑을 오오 사랑을 바리바리 짐을 싸지 않아도 돼 발이 발이 닿는 대로 걸어 바리바리 짐을 싸지 않아도 돼 그냥 발이 발이 닿는 대로 발 담그고 물장구치고 춤도 추고 모랠 묻혀 가며 민트색 돌고래 보라색 불가사리 황금빛 태양 그 아래서 사랑을 나누네 사랑을 나누네 사랑을 오오 사랑을 사랑을 나누네 나누네 사랑을 오오 사랑을 단둘이 단둘이 단둘이
  SIYA (시야)  ,그저 그냥 걸어갈 뿐이야,내 눈 속에 비친 이 거리는 그대로였어 저 멀리 이어진 골목 위를 마냥 거닐어 잊혀져 있던 내 기억이 문득 떠올라 설레이던 곳 그저 그냥 걸어갈 뿐이야 저 달빛이 내 길을 비춰 그저 그냥 걸어갈 뿐이야 넌 변함없이 춤추고 있으니 어두운 시간 틈 잠들었던 내 기억들 새벽 공기 속에 어디론가 날려 보내고파 내일이 오면 이 기억은 내 가슴 깊이 잠들겠지만 그저 그냥 걸어갈 뿐이야 저 달빛이 내 길을 비춰 그저 그냥 걸어갈 뿐이야 넌 변함없이 춤추고 있으니 그저 그냥 걸어갈 뿐이야 푸른 새벽 거친 이 길을 그저 그냥 걸어갈 뿐이야 넌 변함없이 웃고 있을 테니
  제이린 (J-rine)  ,또바기,오늘은 어떤 하루였니 힘이 들진 않았니 그럴 때면 고갤 돌려봐 내가 여기에 있잖아 주저앉고 싶을 때 전부 놓고 싶을 때 항상 네 곁에 있는 나 늘 매일같이 옆에 있을게 포기는 않도록 그렇게 울고 싶을 때 나를 찾아줘 한 발짝 뒤에 여기 있을게 언제나 같은 내가 돼줄게 한결같이 꼭 그렇게 주저앉고 싶을 때 전부 놓고 싶을 때 항상 네 곁에 있는 나 늘 매일같이 옆에 있을게 포기는 않도록 그렇게 울고 싶을 때 나를 찾아줘 한 발짝 뒤에 여기 있을게 언제나 같은 내가 돼줄게 한결같이 꼭 그렇게 네게 위로가 되었으면 해 너의 존재가 내게 그렇듯 어디든 내가 함께 해줄게 변함없이 꼭 약속해
  다운헬  ,너 자신을 알라 (Metal),죽느냐 또 사느냐는 것도 참 중요한 문제지만 너 자신을 모른다는 것이 지금 현재 더 큰 문제 다 뿌린데로 거둔다는걸 부메랑처럼 되돌아와 이제는 너 자신을 알라 남을 평가하기전에 오 너 자신을 알라 너보다 못한 사람 세상에 없어 너 자신을 알라 조금은 예의들을 지켜 오 너 자신을 알라 누군가 니가 던진 말한마디에 울고죽는다 죽느냐 또 사느냐는 것도 참 중요한 문제지만 너 자신을 모른다는 것이 지금 현재 더 큰 문제 널 아껴주는 사람 가슴이 모두 니꺼라 착각은 마 이제는 너 자신을 알라 머니가 세상다가 아냐 오 너 자신을 알라 사랑은 또 행복은 사는게 아냐 너 자신을 알라 사람의 눈물 밟지 마라 오 너 자신을 알라 누군가 니가 던진 말한마디에 울고죽는다 너 자신을 알라 남을 평가하기전에 오 너 자신을 알라 너보다 못한 사람 세상에 없어 너 자신을 알라 조금은 예의들을 지켜 오 너 자신을 알라 누군가 니가 던진 말한마디에 울고죽는다
  차이나 몽키 브레인  ,훨씬낫지,어디서 무얼 하나요 나의 새빨간 그대여 오늘도 늦은 밤 회식자리 언제쯤 끝나나요 철없는 다 큰 소년의 꿈은 4억을 모아서 세상에서 하나뿐인 너와 결혼하고 싶네요 그녀가 이쁘다고 탐내지는 말아요 그녀가 웃는다고 침 흘리지 말아요 그녀를 갖겠다고 욕심내지 말아요 그녀는 내 꺼라고 언제쯤에 멍청한 나는 너와 언제쯤에 멍청한 나는 너와 언제쯤에 멍청한 나는 너와 손이라도 잡을 수 있을까 오늘은 이 길을 통해 집에 가는 길인가요 오늘밤 그 길을 잃어 내 품 안으로 들어오세요 그녀가 말 건다고 착각하지 말아요 그녀가 뽀뽀해도 당황하지 말아요 그녀가 고백해도 좋아하지 말아요 다 내게 한 거니까 언제쯤에 멍청한 나는 너와 언제쯤에 멍청한 나는 너와 언제쯤에 멍청한 나는 너와 손이라도 잡을 수 있을까 손이라도 잡을 수 있을까 손이라도 잡았으면 해 언제쯤에 멍청한 나는 너와 언제쯤에 멍청한 나는 너와 언제쯤에 멍청한 나는 너와 언제쯤에 멍청한 나는 너와 언제쯤에 멍청한 나는 너와 언제쯤에 멍청한 나는 너와 언제쯤에 멍청한 나는 너와 손이라도 잡을 수 있을까 손이라도 잡을 수 있을까 손이라도 잡았으면 해 그 새끼보다 내가 훨씬 낫지
  406호 프로젝트  ,DRAMA,기억하기도 어려운 따분한 일상의 반복 흐릿하고 희미한 하루 의미 없이 이어지던 일일드라마 드디어 주인공이 나타난 순간 눈을 뗄 수 없이 쏟아져 내리는 별빛으로 뒤덮인 배경 너는 그 아래서 나를 처음 보곤 티 없이 맑게 웃음 지었어 이제 모든 건 달라졌어 지루하던 시간은 끝났어 모든 장면을 너로 채워줘 매일 수없이 등장해 다음 이야길 기대하게 해줘 평범하고 흔한 내 대사와는 달리 너의 대답은 늘 새로워서 뻔한 나마저 특별하게 해 너의 목소리가 자꾸 노래처럼 들려 이제 모든 건 달라졌어 지루하던 시간은 끝났어 모든 장면을 너로 채워줘 매일 수없이 등장해 다음 이야길 기대하게 해줘 결말은 그 누구도 쉽게 예측할 수 없지만 다 그렇듯이 모든 로맨스의 마지막 장은 두 사람의 미소로 끝나게 돼있어 이제 모든 건 달라졌어 지루하던 시간은 끝났어 모든 장면을 너로 채워줘 매일 수없이 등장해 다음 이야길 기대하게 쉼 없이 연습해왔던 지난날 속에서 그토록 바래온 나의 엔딩을 완벽하게 해줘
  아침 (achime)  ,02시 무지개,새벽은 아직이고 밤은 한참인 그 때 사거리에서 우연히 그녀와 마주쳤네 신호가 바뀌고 차들은 으르렁 으르렁 그녀는 뭔가 결심한 듯 갑자기 헤드라이트를 조명 삼아서 그녀는 갑자기 dance를 시작해 포니테일 힘차게 궤도를 그리고 흩날리는 스커트 무지개 피우네 도시는 어째선지 비웃지 못하고 있네 그녀의 움직임 뒤를 따라오는 rainbow 횡단보도의 끝이 알려주는 마지막 멈추지 말고 그대로 날아가줘 헤드라이트를 조명 삼아서 그녀는 갑자기 dance를 시작해 포니테일 힘차게 궤도를 그리고 흩날리는 스커트 무지개 피우네 헤드라이트를 조명 삼아서 그녀는 갑자기 dance를 시작해 포니테일 힘차게 궤도를 그리고 흩날리는 스커트 무지개 피우네
  멜로우파크  ,Forever I Love You,비가 내리고 난 후 햇살 번지는 거리에서 희미한 시간 속에 지친 나 홀로 서있을 때 love forever I love you love forever I love you I love you i'm bring your sky I want sustain love forever I love you love forever I love you I love you and your smile 해맑은 너의 웃음 거리를 가득 매워가고 햇살 번지는 거리 너를 만나러 가는 꿈길 love forever I love you love forever I love you I love you i'm bring your sky I want sustain love forever I love you love forever I love you I love you and your smile  love forever I love you love forever I love you I love you i'm bring your sky I want sustain love forever I love you love forever I love you I love you I wanna feeling to your blue eyes
  단편선과 선원들  ,러브송,어울리지요 눈을 감고 말해봐요 당신이 원하는 것 원하지 않는 것 이제는 준비가 됐어 이유도 없이 비가 내려 흠뻑 젖어 울었죠 시간이 참 쏜살같아요 우리 같이 걸어가요 호호호 웃는 벌레들 이 손을 놓지 마 호호호 웃는 벌레들 걸음걸음 마다 호호호 웃는 사람들 우울한가요 우리 잠깐 바람 좀 쐬고 올까요 조금은 멈춰 서도 괜찮아 가만히 라도 난 좋아 어제는 밤새 끝없이 아래로 떨어졌어요 붙잡지 못해 미안한 마음 나는 두려워 내가 호호호 웃는 벌레들 호호호 웃는 사람들 이 손을 놓지 마 호호호 웃는 벌레들 걸음걸음 마다 호호호 웃는 사람들
  뷰티핸섬  ,Better Than Me,요즘 난 해 저무는 바다 바라보며 생각에 잠기네 한동안 잊혀진 지나간 시간들을 회상하며 잃어버린 내 시간들 바삐 달리는 세상 자고 있던 내 영혼 깨워 일으켜 세워야지 도저히 참을 수 없어서 Ohhh I don't want to stand in one place 더 나은 나를 위해 오늘 spread my wings 그때까지 혼자 일어나 자신있게 말 할거야 Ha haha everyone is Ha haha better than me 요즘 난 온종일 브라우징하면서 혼자 상상하지 모든것 나를 위해 존재 하는 것 같아 만일 맞다면 나는 왜 아직 이럴까 바삐 달리는 세상 자고있던 내 영혼 깨워 일으켜 세워야지 도저히 참을 수 없어서 Ohhh I don't want to stand in one place 더 나은 나를 위해 오늘 spread my wings 그때까지 혼자 일어나 자신있게 말할거야 Ha haha everyone is Ha haha better than me Ohhh I don't want to stand in one place 더 나은 나를 위해 오늘 spread my wings Ohhh I don't want to stand in one place 더 나은 나를 위해 오늘 spread my wings 그때까지 혼자 일어나 자신있게 말 할거야 Ha haha Yeah Ohhh I don't want to stand in one place 더 나은 나를 위해 오늘 spread my wings 그때까지 혼자 일어나 자신있게 내게 말 할거야 Ha haha everyone is Ha haha better than me better than me
  라이엇 키즈(RIOT KIDZ)  ,PART OF ME,YOU ALWAYS MAKING ME TO SEE THE PART OF ME I HOPE YOU’RE NEVER BE HURT YOU ALWAYS MAKING ME TO SEE THE PART OF ME I HOPE YOU’RE NEVER BE HURT I DON’T CARE I WILL BE OKAY PLEASE DON’T SAY YOU WILL BE OKAY JUST TELL ME WHEN THERE IS THE WAY LET ME KNOW I SOMETIMES I WORRY ABOUT WORRYING DON’T WANNA WORRY ABOUT WORRYING IT’S ONLY MAKING ME HURT THEN I’LL BE OKAY AND I DON’T WANNA WONDER ABOUT MONEY JUST WANNA TELL YOU I’M SORRY I HOPE YOU’RE NEVER BE HURT I’M GONNA MAKE IT ME TO SHOW THE PART OF ME I WISH YOUR ANSWER BE HEARD YOU WANNA NOTICE THIS YOU’RE NOT THE PART OF ME SO YOU WILL NEVER BE HURT I DON’T CARE I WILL BE OKAY PLEASE DON’T SAY YOU WILL BE OKAY JUST TELL ME WHEN THERE IS THE WAY LET ME KNOW YOU TOLD ME DON’T TELL ME THAT NO ONE’S GONNA BE HERE YOU TOLE ME JUST TELL ME THAT YOU WILL ALWAYS BE HER I SOMETIMES I WORRY ABOUT WORRYING DON’T WANNA WORRY ABOUT WORRYING IT’S ONLY MAKING ME HURT THEN I’LL BE OKAY AND I DON’T WANNA WONDER ABOUT MONEY JUST WANNA TELL YOU I’M SORRY I HOPE YOU’RE NEVER BE HURT BUT UMALL THIS IS NOT FOR YOU HERE
  박아셀  ,하루,하루를 지나 또 하루가 지나가버린 그 자리에 내가 남겨진 이유를 난 오늘도 물으며 시작해 나는 어디로 흘러가 또 어디를 지나가게 될까 빼곡히 가득 찬 마음의 짐을 하나 둘 씩 비워내고 내게 주어진 이야기를 울고 웃으며 들려주면 그 소리가 너의 이야기로 숨쉬게 되지 않을까 그렇게 하루의 내가 있는 이유가 이게 아닐까 나는 어디로 흘러가 또 어디를 지나가게 될까 빼곡히 가득 찬 마음의 짐을 하나 둘 씩 비워내고 내게 주어진 이야기를 울고 웃으며 들려주면 그 소리가 너의 이야기로 숨쉬게 되지 않을까 그렇게 하루의 내가 있는 이유가 이게 아닐까
  잔별  ,너에게 가는 길,아직도 이런 내 맘을 모르겠어 괜시리 웃음만 나는 나 널 바라보다 놓치면 어쩌나 모르게 애태운 시간들 여전히 미소가 가장 밝은 너는 늘 나를 웃음 짓게 해 말을 할까 고민을 하다가 오늘도 날이 지나갔어 지금도 나는 멀리서 바라만 봐 사랑은 상처만 주니까 꽃피는 계절에 나는 널 꼭 만나서 확실히 얘기할게 비탈진 언덕을 지나 너에게 가는 길 조금은 어색한 표정 지으며 너에게 말을 거네 이제서 나는 너에게 다가갈게 사랑이 상처를 준대도 빛나는 계절에 나는 널 꼭 만나서 확실히 얘기할게 비탈진 언덕을 지나 너에게 가는 길 조금은 어색한 표정 지으며 너에게 말을 거네 비탈진 언덕을 지나 너에게 가는 길 조금은 어색한 표정 지으며 너에게 말을 거네
  곤  ,일기장,할 일 없이 거릴 거닐다 보면 많은 사람들의 발걸음 왜 나와 같지 않은지 내 모습은 어젯밤에 그리던 모든 걸 알 수 있어 보이던 그것에 한없이 작은지 그리도 바라던 내 모습이었는데 꿈 속에 바라던 내 모습이었는지 몰라 몰라 늦은 저녁 전화부를 뒤지며 지나친 어제를 그리다 내 모습을 보게 돼 아무렇지 않은 듯 웃으며 넘기겠지 술에 취해 혼자 또 혼자 또 혼잣말을 늘어가며 아무도 모르는 그 얘기를 풀어가며 웃겠지 그리도 바라던 내 모습이었는데 꿈 속에 바라던 내 모습이었는지 몰라 몰라 몰라 몰라 아무렇지 않은 듯 웃으며 넘기겠지 술에 취해 혼자 또 혼자 또 혼잣말을 늘어가며 아무도 모르는 그 얘기를 풀어가며 웃겠지
  twte.  ,우린 다 알면서 왜,우린 다 알면서 왜 되물었을까 안될 걸 알면서 왜 붙잡았을까 우린 왜 왜 왜 우린 왜 왜 왜 왜 왜 왜 우린 왜 왜 왜 넌 아무 말 없었고 난 땅만 쳐다봤네 침묵은 더 많은 말을 해줬어 한숨을 토하고선 난 먼저 돌아섰어 집으로 가는 버스에 올라서 앉아 생각에 잠겼어 안될 걸 알면서 왜 붙잡았을까 우린 다 알면서 왜 되물었을까 안될 걸 알면서 왜 붙잡았을까 우린 왜 왜 왜 우린 왜 왜 왜 왜 왜 왜 우린 왜 왜 왜
  우쿨렐레 피크닉  ,이것 또한 지나가리라,마음이 아플 때 기뻐질 수 있는 한마디 마음이 기쁠 때 슬퍼질 수 있는 한마디 이것 또한 지나가리라 슬픔이 찾아와 나를 집어 삼킬 때 마음에 새기라 이것 또한 지나가리라 행운이 찾아와 행복이 넘쳐날 때 감사히 외치리라 이것 또한 지나가리라 사랑이 떠나가 삶이 사라져갈 때 가슴에 말하라 이것 또한 지나가리라 걱정이 날아가 기쁨이 찾아올 때 가슴에 새기리라
  프롬  ,마중가는 길,어젯밤 한숨도 잘 못 잔 것 같지만 기분은 개운한 걸 창문커튼 사이로 보이는 햇빛이 오오오오 마중가는 길 날씨도 좋아 커피한잔을 사서 공항으로 가는 버스에 올라보니 이제 막 두근대기 시작하는 설레임 오오오오 마중가는 길 오오오오 너무 오랜시간 오오오오 기다려온 날 오오오오 저 창 밖으로 오오오 우리가 스쳐가고 오오오 예전 그날처럼 오오오 니 웃음소리가 들린 것 같은 it's just a feeling 길가에 고양이도 오늘 더 예뻐서 참치캔을 선물하고 어제는 널 데려 갈 가게도 들러봤어 오오오오 마중가는 길 오오오오 너무 오랜시간 오오오오 기다려온 날 오오오오 저 창 밖으로 오오오 우리가 스쳐가고 오오오 예전 그날처럼 오오오 니 웃음소리가 들린 것 같은 좀 피곤해도 오오오 오늘은 밤새도록 오오오 너의 손을 잡고 오오오 끝없이 너의 얘길 듣고 싶은 It's just a feeling It's just a feeling I'll show your everything 오늘은 밤새 눈을 맞추고 오늘은 밤새 못다한 얘기로 오늘은 밤새 깨끗한 시트를 펴고 아꼈던 향초를 켜고 실컷 늦잠을 자자고 깨끗한 시트를 펴고 아꼈던 향초를 켜고 실컷 늦잠을 자자고
  11월  ,가끔은 말야,가끔은 말야 나도 모르게 이런 생각에 잠기곤 해 너를 만나고 네 눈을 보며 말하고 싶다 감출 생각은 하나 없는데 내 마음도 열려 있는데 부끄러운 난 용기가 없어 작아지곤 해 곁에 있는 사랑으로 평안함을 느끼는 걸 너도 나와 같길 어디서든 그러길 버림받은 인생이란 어디에도 없다는 걸 너도 알게 되길 언젠가는 알기를 곁에 있는 사랑으로 평안함을 느끼는 걸 너도 나와 같길 어디서든 그러길 버림받은 인생이란 어디에도 없다는 걸 너도 알게 되길 언젠가는 알기를 멀리서 바라보다가 희미해져 간다 해도 너의 자리 너의 모습 기억하고 있을게 기도할게 곁에 있는 사랑으로 평안함을 느끼는 걸 너도 나와 같길 어디서든 그러길 버림받은 인생이란 어디에도 없다는 걸 너도 알게 되길 언젠가는 알기를 가끔은 말야 나도 모르게 이런 생각에 잠기곤 해 너를 만나고 네 눈을 보며 말하고 싶다
