artist,title,lyric
  미스티 블루  ,Radio Days,"하늘색 바람이 스치고 간 머릿결은 깃털 되어 내 얼굴 어루만지고 내 머리를 쓰다듬던 가늘고 여린 너의 손 나른하던 그 손길 하얀 창틀 위에 앉은 햇살의 말없는 오후 수줍게 빛난 우리 미소 띈 약속 이제는 빛 바랜 낙서가 되어버린 이야기 다시는 돌아갈 수 없는 radio days 향긋한 커피와 우유 빛 멜로디는 부드럽게 조용히 우릴 감싸고 내 눈물 안아주던 설레이게 맑은 너의 눈, 따스하던 그 눈빛 하얀 창틀 위에 앉은 별빛의 투명한 새벽 수줍게 빛난 우리 미소 띈 약속 이제는 부서진 거울이 되어버린 이야기 다시는 돌아갈 수 없는 radio days  하얀 창틀 위에 내린 마법의 눈부신 바다 새롭게 시작된 영원한 의미 이제는 지나간 바람이 되어버린 이야기 다시는 돌아갈 수 없는 radio days 이제는 시들은 꽃잎이 되어버린 이야기 다시는 돌아갈 수 없는 radio days"
  Rainbow99  ,아주 천천히 (With 사람또사람),우린 아무도 모르게 아주 천천히 헤어지고 있었던 거야 우린 서로 또 모르게 아주 조금씩 멀어지고 있었던 거야 아주 천천히 우린 아무도 모르게 아주 천천히 헤어지고 있었던 거야 우린 서로 또 모르게 아주 조금씩 이해할 수 없었던 거야 아주 천천히 슬퍼할 시간없이 복잡한 마음없이 헛된 바램들 없이 헤어지고 있었던거야 커다란 상처없이 별다른 미련없이 슬픈 눈물도 없이 헤어지고 있었던거야 아주 천천히 우리는 서로의 맘을 확인하지 않고 우리는 서로의 뒷모습을 보지 않고 우리는 더이상 새로움을 찾지 않네 아주 천천히 슬퍼할 시간없이 복잡한 마음없이 헛된 바램들 없이 헤어지고 있었던거야 커다란 상처없이 별다른 미련없이 슬픈 눈물도 없이 헤어지고 있었던거야 슬퍼할 시간없이 복잡한 마음없이 헛된 바램들 없이 헤어지고 있었던거야 커다란 상처없이 별다른 미련없이 슬픈 눈물도 없이 헤어지고 있었던거야
  제희  ,여전히 느린 꿈,습관처럼 집어들었네 허전함과 핸드폰을 하루종일 뒤적거리지만 나는 없네 어디에도 없네 그냥 별이 되는건 어떠려나 이러나 또 저러나 아무도 모를테니 그냥 살아가는 건 어떠려나 이러나 또 저러나 아무도 모를테니 오늘도 난 상처투성이 여전히 난 이기적인 아이 남들보다 느린 꿈을 꾸고있네 지겨운 얘기 누군가에겐 그럴꺼야 그냥 별이 되는건 어떠려나 이러나 또 저러나 아무도 모를테니 그냥 살아가는 건 어떠려나 이러나 또 저러나 아무도 모를테니 그냥 그냥 별이 되는건 어떠려나 이러나 또 저러나 아무도 모를테니 그냥 살아가는 건 어떠려나 이러나 또 저러나 아무도 모를테니
  얼지니티  ,유학생,파란 눈동자의 한국말이 참 신기 했었다고 귀여웠었다고 건대 앞에 사는 뮤지션 그대는 신촌까지 데려다 줬죠 If I can't hear you sing any more 이제는 무슨 노랠 들어요 한국말을 잘은 못해도 이런걸 사랑이라 하나요 Wish I could be here with you Wish I could be here with you Wish you could be here with me Wish you could be here with me 미시간 호수가 어딘지 물어보면 건대호수밖에 모르는 그대 미국 가는 길에 들으라고 녹음해줬었던 내 노래 If I can't hear you sing any more 이제는 무슨 노랠 들어요 한국말을 잘은 못해도 이런걸 사랑이라 하나요 Wish I could be here with you Wish I could be here with you Wish you could be here with me Wish you could be here with me Wish I could be here with you Wish I could be here with you Wish you could be here with me Wish you could be here with me Wish I could be here with you Wish I could be here with you Wish you could be here with me Wish you could be here with me
  위은총  ,소풍,아침 일찍 일어나 준비한 도시락에 사랑 한 스푼 오늘은 너와 함께 나들이 가는 날 눈부신 햇살을 맞으며 바람을 따라서 걷는 이 길 어쩌다 닿은 네 손을 덥썩 잡아버렸네 꽃처럼 아름다운 네 손을 이렇게 좋은 날 이렇게 좋은 날 너와 함께 하는 이 모든 게 좋아 이렇게 좋은 날 이렇게 좋은 날 우리 사랑스러운 이 모든 게 좋아 파란 하늘 하얀 구름 너와 단 둘이 걷는 이 길 해처럼 밝은 미소에 와락 안아버렸네 솜처럼 포근한 네 마음을 이렇게 좋은 날 이렇게 좋은 날 너와 함께 하는 이 모든 게 좋아 이렇게 좋은 날 이렇게 좋은 날 우리 사랑스러운 이 모든 게 좋아 사랑스러운 이 모든 게 좋아 사랑스러운 네 모든 게 좋아
  RONY  ,Feeling,I can feel your love I can feel your heart I can feel your love I can feel your heart I can feeling When you’re smiling Like a dreaming Falling in the love I can feeling When you’re smiling Like a shining Everything is Love And just like you and just like me Feel the love Feel the love to sparkle in your eyes I can feel your love I can feel your heart I can feel your love I can feel your heart I can feel your heart I can feel your love I can feel your heart I can feel you anywhere I can feel your love I can feel your heart I can feel you anywhere Just like you and just like me Just like you and just like me Just like you and just like me Just like you and just like me
  란준  ,ㄱ (Feat. 초승),난 문뜩 그런 생각이 들어 난 왜 이곳에 발을 내딛은 걸까 난 항상 그런 생각이 들어 너에게 나는 무엇을 해줄 수 있는지 푸르른 시름을 내쉴 때쯤 날 감싼 너를 위한 목소리를 전해 난 너의 기억을 위해 숨 쉬어 먼 훗날 나 없이 홀로일 너를 위해 숨 쉬어 난 너의 기억을 위해 숨 쉬어 행여 서로를 추억할 날을 위해 푸르른 시름을 내쉴 때쯤 날 감싼 너를 위한 목소리를 전해 난 너의 기억을 위해 숨 쉬어 먼 훗날 나 없이 홀로일 너를 위해 숨 쉬어 난 너의 기억을 위해 숨 쉬어 행여 서로를 추억할 날을 위해 난 너의 기억을 위해 숨 쉬어 먼 훗날 나 없이 홀로일 너를 위해 숨 쉬어 난 너의 기억을 위해 숨 쉬어 행여 서로를 추억할 날을 위해
  이상웅  ,권태,홀로 집에 우두커니 있다는 걸 알아 눈을 떠보면 침대에 누워 창문 밖을 보니 그새 또 비가 오네 얼마나 지나야만 마음을 다잡을 수 있을까 시계 초침은 또 째깍째깍 흘러만 가네 I’m sorry mama I’m sorry dad 이렇게 못난 아들래미 때문에 한숨이 나와 내 손 안엔 울리지 않는 핸드폰만 쥐어있네 밖엔 또 비가 주륵주륵 내 마음에도 비가 얼마나 지나야만 마음을 다잡을 수 있을까 시간은 멈추지 않고 째깍 째깍 흘러만 가고 있는데 I’m sorry mama I’m sorry dad 이렇게 못난 아들래미 때문에 한숨이 나와 내 손 안엔 울리지 않는 핸드폰만 쥐어있네 할 수 있는 게 잘 안 보여 이렇게 못난 핑계들로 가득 찬 나 노력하면 된다는 거 나에겐 해당 사항 하나가 없네 아아아아 아아아 아아아아아아아아 하후우우우우 후우우우우 밖엔 또 비가 주륵주륵 내 마음에도 비가
  오왠 (O.WHEN)  ,오늘,새벽4시 잠들지 않아 돌아갈 수 없는 시간들을 생각하곤 해 습관처럼 마음이 아려와 집으로 가는 길은 자꾸만 멀어지는데 저만치 멀어지는 찾을 수 없는 잡을 수 없는 Take it easy 나만 왜 이렇게 힘든 건가요 오늘밤이 왜 오늘의 나를 괴롭히죠 아무것도 한게 없는 하루인데 나는 왜 이렇게 눈치만 보고 있는 건지 아쉬움은 나를 찾아 다가오네 창문 밖은 벌써 따뜻한데 Take it easy 나만 왜 이렇게 힘든 건가요 오늘밤이 왜 오늘의 나를 괴롭히죠 한번만 다시 또 일어설 수 있나요 음음음 오늘도 슬픔에 잠겨 밤을 지우고 있나요 Take it easy 나만 왜 이렇게 힘든 건가요 오늘밤이 왜 오늘의 나를 괴롭히죠 Take it easy 왜 오늘의 나를 괴롭히죠
  라벨  ,Karl Marx,다문 입술로 한 천번을 외쳐야 그대 한번은 돌아보나 그 뻔한 거짓말에 나의 상처가 덧나지 않게 여기 나의 품에 깃발에 불을 지펴다오 다시 뜨겁게 태워야 해 다시 새롭게 태어나야 해 난 이대로는 안돼 모두 태워야 해 벌어진 문틈 그 사이로 그댄 이제는 들릴 텐데 한 천번의 침묵에 너의 귀가 다 너덜거릴 쯤엔 그땐 이미 늦어 버린 후 오 자비란 없어 다시 뜨겁게 태워야 해 다시 새롭게 태어나야 해 난 이대로는 안돼 모두 태워야 해 사람들이 나를 떠났을 때 넌 나의 곁에 남았어야 해 니가 나를 떠나려 했을 때 널 잡았어야 해 날 뜨겁게 널 새롭게
  브라운팟  ,그대 내게로 와서,그대 없이 난 안전했어 내 작은 방안에서 별도 달도 끝내 보지 않던 오직 내 가슴속만 그대 시선 머문 후엔 더 이상 발 디딜 곳이 없어 나는 이제 허물어져 닿을 길 없는 목마름 속에서 내 마음 이제 빈 곳이 없어 온통 네 이름 가득해 너는 내게 가만히 속삭여 오직 널 노래하라고 손짓하나 아득해져 네 눈짓에 나는 목이 메어 나는 이제 허물어져 닿을 길 없는 목마름 속에서 그대 내게로 와서 말할 수 없는 의미가 되어 그대 내게로 와서 결국 날 차지해 그대 내게로 와서 꺼지지 않는 오늘이 되어 그대 내게로 와서 결국 날 차지해 나도 그대를 흔들 수 있다면 그대도 나로 눈멀 수 있다면 그대 내게로 와서 말할 수 없는 의미가 되어 그대 내게로 와서 결국 날 차지해 그대 내게로 와서 꺼지지 않는 오늘이 되어 그대 내게로 와서 결국 날 차지해
  Yellow Monsters  ,I Don`T Wanna Be With You,1234 개처럼 살아도 2413 늑대 행세를 해 허세에 취한 너 오디션 스타 하루살인걸 1234 개처럼 살아도 2413 늑대 행세를 해 밴드 오디션 Slayer 대 Green Day TV노리개 아니란걸 알면서도 널 버리고 아니란걸 알면서도 너는 그 길로 아니란걸 알면서도 너를 죽이고 아니란걸 알면서 I don't wanna be with you Don't wanna wanna be Don't wanna wanna be Don't wanna be with you again Don't wanna wanna be Don't wanna wanna be Don't wanna be with you again Don't wanna wanna be Don't wanna wanna be Don't wanna be with you again 우리는 어차피 친구가 될 수 없다네 1234 개처럼 살아도 2413 늑대 행세를 해 로큰롤 스타 대기업 노리개 하루살인걸 1234 개처럼 살아도 2413 늑대 행세를 해 Major System 따라하는 Indie Band Culture Is Dead 아니란걸 알면서도 널 버리고 아니란걸 알면서도 너는 그 길로 아니란걸 알면서도 너를 죽이고 아니란걸 알면서 I don't wanna be with you Don't wanna wanna be Don't wanna wanna be Don't wanna be with you again Don't wanna wanna be Don't wanna wanna be Don't wanna be with you again Don't wanna wanna be Don't wanna wanna be Don't wanna be with you again 우리는 어차피 친구가 될 수 없다네 네 이름은 없어 네 존재도 없어 네 마음도 없어 널 쓰레기통에 힘겹게 살아온 널 버려 I don't wanna be with you Don't wanna wanna be Don't wanna wanna be Don't wanna be with you again Don't wanna wanna be Don't wanna wanna be Don't wanna be with you again Don't wanna wanna be Don't wanna wanna be Don't wanna be with you again 우리는 어차피 친구가 될 수 없다네 Don't wanna wanna be Don't wanna wanna be Don't wanna be with you again Don't wanna wanna be Don't wanna wanna be Don't wanna be with you again Don't wanna wanna be Don't wanna wanna be Don't wanna be with you again 우리는 어차피 친구가 될 수 없다네 Don't wanna be with you
  얼스 (Earls)  ,너무잘어울려,상큼한 너는 딸기 아이스크림 젠틀한 나는 초코 와플 어울리는 우리 어울리는 우리 쓰디쓴 너는 에스프레소 달콤한 나는 리얼 브라우니 어울리는 우리 어울리는 우리 너무 잘 어울려 미치겠어 죽겠어 너무 잘 어울려 미치겠어 왜 이리도 우린 사르르 녹는 넌 머쉬멜로우 달달한 나는 뜨거 핫 쵸코 어울리는 우리 어울리는 우리 너무 잘 어울려 미치겠어 죽겠어 너무 잘 어울려 미치겠어 왜 이리도 우린 너무 잘 어울려 미치겠어 죽겠어 너무 잘 어울려 미치겠어 왜 이리도 우린 너무 잘 어울려 미치겠어 죽겠어 너무 잘 어울려 미치겠어 왜 이리도 우린
  안여림  ,손대면 톡,Woo 솔직히 말하면 첨엔 별로였었어 말투도 행동들도 예쁜게 없어 하지만 너를 알아갈수록 내 마음이 끌려 오늘은 너에게 말 할거야 이렇게 말야 니 눈에 살고 싶어 니 맘에 있고 싶어 손대면 톡 터질 것 같은 내 맘 느낀다면 내게 와줘 Woo 솔직히 말하면 내가 아깝기는 해 나만큼 널 좋아해 줄 사람 또 없을 텐데 니 눈에 살고 싶어 니 맘에 있고 싶어 손대면 톡 터질 것 같은 내 맘 느낀다면 어떡하면 좋을까 저 달 끝까지 내 맘이 닿게 된다면 얼마나 좋을까 음 잠 못 이루는 오늘 밤 니 눈에 살고 싶어 니 맘에 있고 싶어 손대면 톡 터질 것 같은 내 맘 느낀다면 괜찮다면 내게 와줘
  델리스파이스  ,고양이와 새에 관한 진실,길을 걷던 한 소년은 물었지 엄마 저건 꼭 토끼 같아 라고 심드렁한 엄마는 대답했지 얘야 저건 썩은 고양이 시체일 뿐이란다  오 뒤틀린 발목 너덜너덜해진 날개를 푸드덕거려도 보지만 날수없는 작은 새 한마리를 누가 쳐다나 보겠어  길을 떠나던 한 소녀는 물었지 아빠 저건 꼭 토끼 같아 라고 무표정한 아빠는 대답했지 얘야 저건 썩은 고양이 시체일 뿐이란다  오 뒤틀린 발목 너덜너덜해진 날개를 푸드덕거려도 보지만 날 수 없는 작은새 한마리를 누가 쳐다나 보겠어  오 뒤틀린 발목 너덜너덜해진 날개를 푸드덕거려도 보지만 날 수 없는 작은새 한마리를 누가 쳐다나 보겠어 -
  유성윤  ,"닿을 듯 말 듯 (Feat. 신은서, 윤재)",너와 나의 거리는 가깝지만 먼 사이 한 걸음씩 다가갈 수 있다면 만날 수 있을 텐데 손을 뻗어보아도 닿을 수 없는 우리 조금 더 가까워진다면 너에게로 달려가 One Two Three 좀 부끄럽지만 Two Two Three 말을 꺼내볼까 Step by Step 매일 밤마다 상상하던 너에게 하고 싶은 말 어딜 봐 여길 봐 딴 곳은 보지도 마 언제나 네 곁에 있고 싶은 나 그대는 나에게 뭐라고 말을 할까 떨리는 내 마음 One Two Three 좀 부끄럽지만 Two Two Three 말을 꺼내볼까 Step by Step 매일 밤마다 상상하던 너에게 하고 싶은 말 어딜 봐 여길 봐 딴 곳은 보지도 마 언제나 네 곁에 있고 싶은 나 그대는 나에게 뭐라고 말을 할까 떨리는 내 마음 어딜 봐 여길 봐 딴 곳은 보지도 마 언제나 네 곁에 있고 싶은 나 좋아해 사랑해 수백 번 말해본다 내 맘을 받아줘 어딜 봐 여길 봐 내 맘을 받아줘 좋아해 사랑해
  폴라로이드  ,함께했던 시간들은 영원 할수 없다,함께 했던 시간들이 영원 할 순 없을까 하루하루 지날수록 왜 또 희미해질까 난 알고 있어 이게 또 다른 시작을 의미 한다는 걸 때론 다툼으로 토라져있던 그 기억도 이젠 느낄 수 없다는 것쯤은 알고 있어 점점 지워져가 너란 사람 그래서 내가 더 싫어 그래 나는 괜찮다고 아무렇지도 않다고 또 말을해 내게 내게 좋은 사람 만났다고 이젠 울지 않는다고 또 일부러 나를 토닥이고 있어 함께 했던 시간들이 영원 할 순 없을까 하루하루 지날수록 왜 또 희미해질까 난 알고 있어 이게 또 다른 시작을 의미 한다는 걸 때론 다툼으로 토라져있던 그 기억도 이젠 느낄 수 없다는 것쯤은 알고 있어 점점 지워져가 너란 사람 그래서 내가 더 싫어 함께 했던 시간들이 영원 할 순 없을까
  수정선  ,화해,머리를 자르고 사람들을 피해 어두운 내 방문을 굳게 잠갔을 때 방 한 구석에 내 얼굴빛 거울 붉어진 두 눈에 난 죄인이 아니라고 눈 먼 죄가 없는 나라 약속된 벌이 없는 나라 헛된 미움 없는 나라 내 안엔 없는 먼 나라 그런 나라 비바람이 불던 내 꿈속 바닷가 혼자 놀던 아인 어디론가 떠나고 내가 모르는 어느 섬에서 날 찾아 날아와 지쳐 죽은 새 한 마리 어리석음이 없는 나라 지혜로움만 있는 나라 헛된 욕심 없는 나라 내 안엔 없는 먼 나라 모두 떠난 바닷가에 눈감은 새 묻어 놓고 지쳐 돌아와 누운 방엔 그대 나란히 잠든 나라 그런 나라 Just far away to me Just far away to me Just far away
  봄꽃연주  ,사랑하면 좋을까 (Vocal. PinkPlum (핑크플럼)),사람들 모두 왜 넌 연애 안 하니 왜 혼잔 거니 나도 궁금해 Oh 잠 못 드는 설렘이 너무 신기해 사랑하면 좋을까 나는 모르겠어 사랑하면 좋을까 외로움에 더 지쳐가는 것 같아 One my love your my love 자꾸 설레이게 해줘 사랑하면 좋을까 종일 웃음 나고 사랑하면 좋을까 하루하루 행복하겠지 그런 날이 나에게 오길 세상 모두 예뻐 보이는 그런 날이 와 어디서 만나 Oh 시작을 한 걸까 나만 빼고 다 사랑을 한대 Oh 빨개지는 두 볼이 너무 신기해 나만 왜 못하는 걸까 항상 살랑 봄이 왔는데 나도 꽃 길을 같이 걷고 싶다고 벚꽃 내려앉은 그 길을 같이 걷고 싶다고 나 사랑할 수 있겠지 바라는 건 하나 그저 나를 향해서 웃는 태양 같은 사람 One my love your my love 자꾸 설레이게 해줘 사랑하면 좋을까 좋은 두근거림 사랑하면 좋을까 나를 향하는 네 눈길도 그저 부러울 뿐이라고 나도 사랑하고 싶다고 가슴 뛰는 그런 사랑 해볼래 올해는 꼭 해볼래
  망각화  ,The Girl In The Storybook,숨이 멎을 듯 빛났지 아직까지 난 아직까지 난 기억해 빼곡히 적힌 너의 이름을 보며 소리내어 널 소리내어 널 불러 더 이상 찾을 수 없는 또 참을 수 없는 그리움 모든 이야기들이 담긴 이 한권 노랗고 네모난 책 그 곳엔 기억에 담을 수도 없이 많고 많은 이야기들이 너를 찾아 어서 떠나가라하네 My girl in the storybook 오랜 기다림에 지쳐 이젠 어느 누구에게로 가버린 너 니가 좋아했었던 내 목소리론 누구에게도 어울리지 않는 나 내 마음이 너무 아파 말할 수 없었던 그 누구에게도 숨이 멎을 듯 빛났지 아직까지 난 아직까지 난 기억해 그 날에 멈춰버린 마음이 소리내어 널 소리내어 널 오랜 기다림에 지쳐 이젠 어느 누구에게로 가버린 너 니가 좋아했었던 내 목소리론 누구에게도 어울리지 않는 나 내 마음이 너무 아파 말할 수 없었던 그 누구에게도 내 마음이 너무 아파 말할 수 없었네 누구에게도 또 너에게도 The girl in the storybook The girl in the storybook The girl in the storybook yeah The girl in the storybook The girl in the storybook The girl in the In this book
  머플리아토 (Mufflyato)  ,마음의 무게,사는게 그래 바람도 불고 파도도 치다가 아무렇지 않게 평온한 바다와도 같이 변하지 차라리 가라앉는 것이 편하지 사는게 그래 음음음 시간이 그래 잠도 안 오고 새로 산 시계는 요란한 소리로 시간은 넘친 욕조 속의 물이지 게다가 수도꼭지 조차 없으니 시간이 그래 음음음 하지만 워우워우워 워우워 그대가 내게 말을 건네고 내게 손을 내미네 하지만 워우워우워 워우워 그대가 젖은 나를 말리고 그대 향기 묻히네 매일이 그래 연속의 연속 사랑은 단어로 사전에 박힌 채 생각은 생각하는 자의 몫이지 표현은 이미 사라진지 오래야 매일이 그래 음음음 하지만 워우워우워 워우워 그대가 내게 말을 건네고 내게 손을 내미네 하지만 워우워우워 워우워 그대가 젖은 나를 말리고 그대 향기 묻히네 하지만 워우워우워 하지만 워우워우워 하지만 워우워우워 워우워 하지만 워우워우워 하지만 워우워우워 하지만 워우워우워 워우워
  더 코코스  ,Good Time,We’re having a good time We’re having a good time We’re having a good time We’re having a good time We’re having a good time So fine your smile We’re having a good time So fine your smile We’re having a good time Tonight 오늘 같이 별이 빛나는 밤에 Tonight 우리 지금 여기서 one more time We’re having a good time We’re having a good time We’re having a good time We’re having a good time We’re having a good time We’re having a good time 우리 오늘 여기서 모두 모여서 하늘을 바라보면서 너와 나의 이야기를 시작하는 거야 모두 모여서 서로를 바라보면서 우리 우리 오늘 여기서 모두 모여서 하늘을 바라보면서 너와 나의 이야기를 시작하는 거야 모두 모여서 서로를 바라보면서 우리 So fine your smile We’re having a good time We’re having a good time We’re having a good time We’re having a good time We’re having a good time We’re having a good time We’re having a good time We’re having a good time We’re having a good time We’re having a good time We’re having a good time We’re having a good time We’re having a good time We’re having a good time We’re having a good time Tonight 오늘 같이 별이 빛나는 밤에 Tonight 우리 지금 여기서 one more time
  김보선  ,예쁜 아가씨,거기 앉은 예쁜 아가씨 오예 나를 한번 봐줄래요 예 긴 생머리 곱게 기른 오예 나 그녀에게 반했어요 예 카페모카를 시키네요 나도 그걸 좋아해요 I like it baby 우린 공통점이 아주 아주 많을 것만 같네요 나를 좀 봐요 예쁜 아가씨 고갤 좀 돌려봐요 예쁜 아가씨 당신의 남자가 예쁜 아가씨 나 그녀에게 오늘 밤 고백하고파 예쁜 아가씨 날 좀 봐주세요 날 좀 난 당신의 남자죠 예쁜 아가씨 날 좀 봐주세요 날 좀 운명의 당신 이제서야 만났죠 예쁜 아가씨 예쁜 아가씨 한 남자 옆에 앉네요 오호 혹시 남자 친군가요 아닐거야 그건 안돼 아니에요 아마 그는 오예 남동생일 거에요 예 나를 좀 봐요 예쁜 아가씨 고갤 좀 돌려봐요 예쁜 아가씨 당신의 남자가 예쁜 아가씨 나 그녀에게 오늘 밤 고백하고파 예쁜 아가씨 날 좀 봐주세요 날 좀 난 당신의 남자죠 예쁜 아가씨 날 좀 봐주세요 날 좀 운명의 당신 이제 예쁜 아가씨 날 좀 봐주세요 날 좀 난 당신의 남자죠 예쁜 아가씨 날 좀 봐주세요 날 좀 운명의 당신 이제서야 만났죠 예쁜 아가씨 예쁜 아가씨 예쁜 아가씨 예쁜 아가씨 예쁜 아가씨 예쁜 아가씨 예쁜 아가씨 예쁜 아가씨 예쁜 아가씨 예쁜 아가씨 예쁜 아가씨 예쁜 아가씨
  Uncle B (엉클비)  ,소녀에게,우린 만난 적도 없고 이름도 모르는 사이지만 알고 싶어요 그대가 무엇을 그리 바라보고 있는지 뜻을 이루지 못한 과거일까 여기 홀로 앉아 있는 현재일까 한 치도 알 수 없는 미래인 걸까 곁에 아무도 없어 괴로웠던 시절 나는 제대로 알 수도 가늠할 수도 없지만 곁에 앉아 있을게요 함께 바라봐요 나와 그대 함께요 곁에 서 있을게요 나의 손잡아요 우리 함께해요 다가가 말을 해봐도 아무 대답 없이 외면하지만 듣고 싶어요 그대 가슴속에 어떤 멍이 들어 있는지 뜻을 이루지 못한 과거일까 여기 홀로 앉아 있는 현재일까 한 치도 알 수 없는 미래인 걸까 곁에 아무도 없어 괴로웠던 시절 나는 제대로 알 수도 가늠할 수도 없지만 곁에 앉아 있을게요 함께 바라봐요 나와 그대 함께요 곁에 서 있을게요 나의 손잡아요 우리 함께해요 곁에 아무도 없어 괴로웠던 시절 나는 제대로 알 수도 가늠할 수도 없지만 곁에 앉아 있을게요 함께 바라봐요 나와 그대 함께요 곁에 서 있을게요 나의 손잡아요 우리 함께해요 우리 함께해요
  흔적  ,조그만 방에서 만든 멜로디,조그만 방에서 만든 멜로디 아직은 어색하지만 잊은 것 같아 생각해보면 그때 그 모습 떠올라 어색한 웃음 지으며 때론 사진첩을 넘기며 따뜻한 커피 한잔과 시원한 바람을 나는 노래하겠지 가끔 생각해보면 꿈을 꾸는 것 같아 빛나던 시절 속에 흐르는 우리의 멜로디
