artist,title,lyric
  오늘도 무사히  ,Guilty,Oh no more father I wish to confess I wish to confess Yes father I'm guilty is that what you want to hear from me I think I'm innocent but I'm wrong I was born with a far more monstrous crime And I know I'll get no justice here so let the Gods decide my fate Cuz I'm the crippled cuz I'm disabled I've been on trial for that my entire life Oh I'm guilty of being a dwarf I wish I was the monster you think I am I wish I was the monster you think I am Cuz I'm the crippled cuz I'm disabled I've been on trial for that my entire life Oh I'm guilty of being a dwarf Cuz I'm the crippled cuz I'm disabled I've been on trial for that my entire life Oh I'm guilty of being a dwarf
  생각의 여름  ,덧,비가 내리네 젖은 꽃들이 떨어지네 꺾인 자리로 다시 빗물이 떨어지네 그래서 아물지 못하는 나의 손 끝은 그래서 아물지 못하는 나의 손 끝은 그래서 아물지 못하는 나의 손 끝은 그래서 아물지 못하는 나의 손 끝은 그래서 아물지 못하는 나의 손 끝은 비가 내리네 젖은 꽃들이 떨어지네
  낯선마음  ,나,난 언제나 다르다는 것에 어색했어 생각 마음 심지어 습관까지도 매 순간 다른 걸 받아들이긴 어려웠고 같잖은 이야기 충고는 불편해 난 어릴 적 친구가 없는 게 어색했어 같지않은 학년 게다가 다른 나이도 언제나 다른 걸 받아들이긴 어려웠고 같잖은 이야기 충고는 불편해 너와 내가 다르단 것에 익숙해야 할수록 준비되지 않은 마음만 쫓아가기 바빠 모든 걸 떼 내고 놓치고 놓아 보낸 후에야 알게 되는 그런 나도 너랑 나도 다르단 것에 적응해 간다 너와 내가 다르단 것에 익숙해야 할수록 준비되지 않은 마음만 쫓아가기 바빠 모든 걸 떼 내고 놓치고 놓아 보낸 후에야 알게되는 그런 나도 너랑 나도 그런 나도 너와 나도 다르단 것에 적응해 간다
  닥터코어 911  ,98,찌그러질대로 그렇게 찌그러져버렸네 아픔의 98은 그렇게 모두 잊어버려졌네 사라진 사람들을 기억밖으로 버려두고 쾌락은 아픈 진실의눈을 가리고 달마다 날마다 뼈빠진 죽노동에묻혀서 지쳐서 잠들었어 쪼들린 생활에도 변함없이 올해도 쌓여만은 가는 나이는 내 착한친구 퍼붓는 빗물속에 그렇게 떠나보내고 난 아무런 도움 못됐던 난 이렇게 또 살아남아 구차하게나마 네게 용서를 빌어 너 편히 눈을감아 이렇게 새천년이왔다 한세기가 갔다 하지만왔다 갔다 한들 뭐가 달라질게있나 조잡한이기심에 시들어가는 나의꿈이 잘난 너의 입에 의해 피해 받네 너의 주둥아릴 치워라 이젠 닥쳐라 가진자만 갖게되는 좆같은세상에서 무슨꿈이 있더냐 끝을 내리라 가슴속에 끓어오르는 너의 증오만이 남게되리라 처참히 무너진 사라진 보금자리 위에 철없이 뛰노는 막막한 미래들 아픔과 눈물과 한숨으로 얼룩졌던 그많은 수많은시간들을 떠올려 달마다 날마다 뼈빠진 죽노동에묻혀서 지쳐서 잠들었어 쪼들린 생활에도 변함없이 올해도 쌓여만은 가는 나이는 이렇게 새천년이왔다 한세기가 갔다 하지만왔다 갔다 한들 뭐가 달라질게있나 조잡한이기심에 시들어가는 나의꿈이 잘난 너의 입에 의해 피해 받네 너의 주둥아릴 치워라 이젠 닥쳐라 가진자만 갖게되는 좆같은세상에서 무슨꿈이 있더냐 끝을 내리라 가슴속에 끓어오르는 너의 증오만이 남게되리라  이제그만 너무도 변한 세상에선 상상할수없지 너는 98년에 대해 뭐를아는지 98년 그들은 너무나 지쳐버린 두해를 보내고 또 다시 새천년을 맞아 밀레니엄이네뭐네하며 그렇게 떠들어대도 변한것 하나없이 그렇게 흘러가막힌 방안구석엔 한숨만이 흘러 내 가슴속엔 또다시 피눈물이 흘러 내눈물이흘러 내아버지와 아버지는 또다시 새해를맞아도 대체변한것 하나없는 세상의시선을 맞아 이제는 뭘 더 뭘 더 뭘 더뭘해야 나에게 짊어진 피눈물을 닦아줄수있나 나 뒤를보고 그렇게 돌아봐도 달라질 기색하나없는 오히려 더해만가는 이런세상 모두의이상을 담기엔 너무나벅찬 세상 이것이 바로 너만의 환상 이렇게 꿈만 잔상 이렇게 새천년이왔다 한세기가 갔다 하지만왔다 갔다 한들 뭐가 달라질게있나 조잡한이기심에 시들어가는 나의꿈이 잘난 너의 입에 의해 피해 받네 너의 주둥아릴 치워라 이젠 닥쳐라 가진자만 갖게되는 좆같은세상에서 무슨꿈이 있더냐 끝을 내리라 가슴속에 끓어오르는 너의 증오만이
  박아셀  ,배,어떤 이의 얘길 들려주려 해 흔들리는 배 위에 불안해하는 너와 나의 모습과 닮은 어디로 떠내려갈까 그 곳에 가긴 하는 걸까 두려워하는 어디서 불어올 지 모르는 바람과 해를 잃어버린 듯한 캄캄한 하늘과 두 팔을 펼쳐봐도 아무도 닿지 않아 소리 없이 울었어 차라리 나의 숨을 거두어가면 어때요 난 이 바다의 끝을 모르니 모두가 날 몰아 비난하고 저주해도 살아내는 일은 이제 충분하다고 그렇게 묻고 잠시 자고 난 후 흔들리던 눈 앞엔 누군가 서 있었어 눈물이 가득 차 그를 바라보며 아무런 말 없이 그의 손을 잡으며 조용히 덤덤한 듯 그에게 얘기했어 그랬구나 괜찮아 얼마나 많은 시간들을 홀로 견뎌 온 거니 왜 아무 말도 없었던 거니 기억해 너와 같은 곳을 바라보며 함께 배에 오른 내가 있다고 꼭 해주고 싶은 이 이야기는 지금도 계속 되고 있단다
  Room306  ,침묵,빌 에반스를 나눠 듣던 황색 조명 아래서 우린 아마 세시간 쯤 이야기를 나눴을거에요 서로의 숨결이 날 무겁게 누르는 감각이 갈수록 무겔 더해가는 막다른 순간까지 한참 웃고 한참 울고 기뻐하고 분노하고 수백의 단어와 수백의 표정을 주고 받았을거에요 서로의 숨결이 날 무겁게 짓누르는 막다른 순간까지 황색 조명에 비춘 먼지를 타고 핑퐁을 하듯이 하지만 그대 나는 아마 연기를 하고 있었을지도 몰라요 해지면 나는 그대와 주고 받았던 모든 것들을 되짚어 제자리에 돌려놓고 잃어버린 것은 없었는지 제자리를 그리워하듯 잊어버리고 말거에요 아 그대와 주고 받았던 모든 것들이 과연 모든 것들이었을까 그대는 알지 못할 아무도 본 적 없는 나의 뒷 모습 어떤 단어와 어떤 표정이 있었을지 해지고 난 뒤 난 돌아와 정리를 하고 침묵 그대와 주고 받았던 모든 것들이 과연 모든 것들이었을까 그대는 알지 못할 아무도 본 적 없는 나의 뒷 모습 어떤 단어와 어떤 표정이 있었을지 해지고 난 뒤 난 돌아와 정리를 하고 침묵
  아키버드  ,꿈의 거리,여긴 어디지 언제 한번쯤 온 적 있는 것 같아 저기 저 골목길도 새침하게 지나가는 저 작은 고양이도 혹시 꿈은 아닐까 그래 그런 것 같아 지금 여기가 내 꿈속일 수도 있잖아 이제부터 난 원하는 대로 어디로든 마음대로 갈 거야 외로워도 돼 두려워도 돼 꿈을 꾸고 있는 거라면 여긴 어디지 언제 한번쯤 본 적 있는 것 같아 저기 저 구름도 반짝이며 흔들리는 저 작은 나뭇잎도 혹시 꿈은 아닐까 그래 그런 것 같아 어느새 꿈에 들어와 걷고 있었나 봐 이제부터 난 원하는 대로 어디로든 마음대로 갈 거야 외로워도 돼 두려워도 돼 꿈을 꾸고 있는 거라면 잠에서 깨면 사라질 모든 것 아쉽기도 하지만 그래도 이제부터 난 원하는 대로 어디로든 마음대로 갈 거야 외로워도 돼 두려워도 돼 여긴 아마도 꿈의 거리
  김보선  ,별,도망치려 했었지 피가 흐르는 싸움을 피해서 난 이길수가 없었지 이기려고 하지 않았으니 누구보다 당당했던 어깨는 쳐져있고 나는 널 못믿고 널 내치고 널 욕하고 불타는 불타오르는 저 하늘 저 별을 봐 자신을 불태워 빛나게 하네 빛나네 빛나게 하네 저 하늘 환히 빛나네 찰나의 노래는 영원이어라 니가 날 불렀을 때 비로소 난 내가 됐어 몰랐었어 내가 소중한 존재였나 하찮은 인생이야 너무나 착각이었나 돌이키진 말아 한걸음을 살아 누구보다 당당했던 어깨를 활짝펴고 나는 나를 믿고 나를 믿는 너를 믿고 불타는 불타오르는 저 하늘 저 별을 봐 자신을 불태워 빛나게 하네 빛나네 빛나게 하네 저 하늘 환히 빛나네 찰나의 노래는 영원이어라 순간의 영원 영원의 노래 불타는 불타오르는 저 하늘 저 별을 봐 자신을 불태워 빛나게 하네 빛나네 빛나게 하네 저 하늘 환히 빛나네 찰나의 노래는 영원이어라 빛나네 빛나게 하네 저 하늘 환히 빛나네 찰나의 노래는 영원이어라
  권나무  ,배부른 꿈,내가 좋아한 사람들은 멋진 사람들 작은 쪽배를 타고서도 어두운 밤바다로 나가는 사람들을 따라서 나도 작은 배를 타고 파도를 견뎌 가며 고독이 기른 눈빛으로 아름다운 당신과 내 사랑하는 당신과 세상을 다 가진 듯 취한 밤 아름다운 당신과 내 사랑하는 당신과 세상을 다 가진 듯 취한 밤 난 좋은 꿈을 꾸었네요 내가 좋아한 사람들은 멋진 사람들 작고 낡은 집에 살아도 따뜻하고 평화로운 사람들을 따라서 나도 작은 집을 짓고 겨울을 견뎌 가며 고독이 기른 눈빛으로 아름다운 당신과 내 사랑하는 당신과 세상을 다 가진 듯 취한 밤 아름다운 당신과 내 사랑하는 당신과 세상을 다 가진 듯 취한 밤 난 좋은 꿈을 꾸었네요 난 좋은 꿈을 꾸었네요 난 좋은 꿈을 꾸었네요 난 좋은 꿈을 꾸었네요 난 좋은 꿈을 꾸었네요 난 좋은 꿈을 꾸었네요 난 좋은 꿈을 꾸었네요 난 좋은 꿈을 꾸었네요 난 좋은 꿈을 꾸었네요 난 좋은 꿈을 꾸었네요 난 좋은 꿈을 꾸었네요 난 좋은 꿈을 꾸었네요 난 좋은 꿈을 꾸었네요 난 좋은 꿈을 꾸었네요 난 좋은 꿈을 꾸었네요 난 좋은 꿈을 꾸었네요 난 좋은 꿈을 꾸었네요 난 좋은 꿈을 꾸었네요
  유발이  ,행복은 무얼까?,행복은 무얼까 사랑은 무얼까 사는 건 무얼까 나는 누굴까 행복은 무얼까 사랑은 무얼까 사는 건 무얼까 나는 누굴까 행복은 멀리 있지 않고 사랑은 하면 된다던데 산다는 건 다 그렇다 하던데 나는 행복을 그리는데 단지 사랑을 꿈꾸는데 하루하루 살아가기 바쁜 것 같아 행복은 무얼까 모두 왜냐 하고 묻는데 어떻게 할 거냐 하는데 뭐가 이리도 복잡한 건지 그저 행복하고 싶은데 사실 사랑 받고 싶은데 이유 없는 물음표의 대답은 행복은 무얼까 사랑은 무얼까 사는 건 무얼까 나는 누굴까 행복은 무얼까 사랑은 무얼까 사는 건 무얼까 나는 누굴까 나는 누굴까 나는 누굴까 나는 누굴까 나는 누굴까 나는 누굴까
  소보  ,조심스럽게,난 내가 그저 원한다면 모든 할 수 있을거라 생각했어 너의 그 마음을 무뎌진 마음을 멍하니 하루를 끝마치고 집에 돌아오는 길에 생각했어 지금의 너라면 날 보고 웃을까 할 수 있는 모든걸 했다고 믿었던 어리석기만 했던 나인데 많은 시간 지나고 여기에 앉아서 우뇌의 편지를 적어본다 다시 말하고 싶어 사랑했었다고 미안했었다고 다시 못 올 그날로 나 돌아가고파 이 초라한 노래를 들고서 상처 받기 싫어서 상처만 주었던 어리석기만 했던 나인데 전쟁같은 삶속에 항상 변함없이 내 눈물 닦아준 넌 어디로 바라 볼 수 없었어 돌아선 발걸음 돌아선 뒷모습 텅빈길 한 가운데 나 홀로 남겨져 이 초라한 노래를 불러본다 다시 말하고 싶어 사랑했었다고 미안했었다고 다시 못 올 그날로 나 돌아가고파 이 초라한 노래를 들고서 바람에 날려가기를 너에게 전해지기를
  해파리소년 (Jelly boy)  ,Everyday Trouble,바람 시원하게 슬픈 날 적시고 못된 그 모습에 취해 흣날리듯 날아 머리위에 사뿐히 가끔 우두커니 멍한 날 깨우지 몹쓸 병에 걸린 내게 춤을 추듯 날아 머릿속을 비우네 스쳐가 얼굴위로 행복한 날아가 하늘위로 차갑게 혼자 애태운 내게 작지만 내겐 커다란 선물 감사할께 스쳐가 얼굴위로 행복한 날아가 하늘위로 차갑게 스쳐가 얼굴위로 행복한 날아가 하늘위로 차갑게
  9 (9와 숫자들)  ,통근버스,그대는 항상 인형처럼 웃고 있지만 그 까닭을 저는 몰라요 새벽 별을 부르던 달콤한 대화도 제 것이 아님을 알아요 멀리서 바라보인 그대 몸짓을 몇 번이고 복기해요 난 모른 척 스치는 그 많은 순간에 그댄 어떤 기분인가요 어서 솔직하게 말을 해 봐요 더는 헛된 꿈에 빠지지 않게 좀 더 또렷한 목소리로 저를 불러 줄 수 있는지 나란히 앉은 좁은 자리는 늘 똑같지만 제 맘은 점점 커져 가네요 막연히 기다리던 더 좋은 날들이란 영영 안 올지도 몰라요 차창에 꾸벅이는 그댈 한참 바라봐요 난 매일 반복되는 생활 속에서 그대 기쁨은 무언가요 이제 솔직하게 말을 해 줘요 더는 헛된 꿈에 빠지지 않게 좀 더 특별한 표정으로 절 바라봐 줄 수 있는지 솔직하게 말을 해 줘요 헛된 꿈에 빠지지 않게 꽉 찬 저 달이 저물기 전에 그대 정말 진심을 내게 보여줘
  바닐라 유니티  ,회색반지,너의 손에 맞춰 끼웠던 반지를 보며 울고 있는 건 함께 새겼던 우리들 이름이 흐릿해져서 you & me 식어버린 커피잔 앞에서 you & me 이별이 만든 어색함만 you & me 향기도 없는 종이 꽃이었나 what should i do love 반지를 보면서 환하게 웃는 널 기억하면 슬픈 건 네게 준 추억이 그것 뿐이라서 그 반지 뿐이라서 you & me 식어버린 커피잔 앞에서 you & me 이별이 만든 어색함만 you & me 타고남은 흔적뿐이지만 한번만 단 한번만 what should i do for you  내 손엔 반지 자욱이 하얗게 드리운 채 서럽게 부르는데  이런 내 부족함이 힘없는 겁쟁이처럼 힘겹게 부르는데  이런 내 그리움이 배고픈 아이처럼 서럽게 부르는데
  빌리어코스티  ,그 언젠가는,수줍게도 나른했던 그 빛 작아진 아픔 속에 갇혀있던 날들 그 어둠을 벗어날 곳을 찾아 흐르는 듯이 차오르다 머무르곤 했지 날으는 저 하늘에 꽃잎을 얹어 따라오는 이 바람을 품에 안고 그 언젠가는 이 고요함에 익숙해져 다시 한 번 그곳을 그리리 그때의 시간을 놓아줄 이 작은 맘을 담아서 자유롭게 가고 싶어 그 언제라도 어디가 되어도 숨겨둔 나의 작은 섬 그 언젠가는 날으는 저 하늘에 꽃잎을 얹어 따라오는 이 바람을 품에 안고 그 언젠가는 이 고요함에 익숙해져 다시 한 번 그곳을 그리리 그때의 시간을 놓아줄 이 작은 맘을 담아서 자유롭게 가고 싶어 그 언제라도 어디가 되어도 숨겨둔 나의 작은 섬 그 언젠가는 닿을 수 없을 것만 같아서 떨려오는 이 마음을 붙잡고 불어오는 바람에 내 몸을 맡긴 채로 그 언젠가는 이 고요함에 익숙해져 다시 한 번 그곳을 그리리 그때의 시간을 놓아줄 이 작은 맘을 담아서 자유롭게 가고 싶어 그 언제라도 어디가 되어도 숨겨둔 나의 작은 섬 그 언젠가는
  로켓트리 (Rockettree)  ,아침산책,구름처럼 어디로 가게될까 알 순 없어도 바람부는 춤을 추는 언덕의 나무들처럼 오늘 하루 감사하게 만나보기를 한 걸음더 가볍게 나서길 기도해  이른 아침 아직은 잠이 덜깬 거리로 나가 우쭐한듯 스스로 기특해하는 기분으로 오늘 하루 감사하게 만나보기를 한걸음 더 가볍게 나서길 기도해 어디선가 걷고있는 나를 본다면 그댈 위해 걸어볼께 즐거운 나의 하루  구름처럼 어디로 가게될까 알 순 없어도 바람부는 춤을 추는 언덕의 나무들처럼 오늘 하루 감사하게 만나보기를 한 걸음더 가볍게 나서길 기도해
  뷰티핸섬  ,Before It`s Too Late,다시 찾아온 새벽 햇살은 그녀의 얼굴에 오늘 그댄 어제처럼 변함없이 눈이 부셔 하지만 우린 깨어있어야 할 이 시간 저 부는 바람같이 가버릴 시간 아름다운 순간 So make everything count Before it’s too late Before it’s too late 지금 내 품에 그녀 사랑에 빠진 우리 그리고 난 난 알고 있지 이 행복은 영원하진 않아 So make everything count Before it’s too late Before it’s too late So don’t waste any time Before it’s too late Before it’s too late So make everything count Before it’s too late Before it’s too late So don’t waste any time Before it’s too late Before it’s too late Before it’s too late
  수상한 커튼  ,메리 크리스마스,기억하니 그때 했던 약속 영원히 함께일 거라 믿고 있던 함께 있는 것만으로 선물 같던 많이 울고 웃던 때 믿을 수 없는 시간들 속에 한동안 멍하니 돌이켜봤어 서툴고 미련한 내가 미워 오늘도 전화를 망설이다 메리 메리 크리스마스 니가 있는 곳에서 메리 메리 크리스마스 오늘은 웃고 있길 바래 메리 메리 크리스마스 니가 있는 곳에서 메리 메리 크리스마스 오늘은 웃고 있길 메리 메리 크리스마스 니가 있는 곳에서 메리 메리 크리스마스 오늘은 웃고 있길 바래
  윤덕원 (브로콜리너마저)  ,갈림길,돌아가는 그 길엔 아무 생각도 나지 않았지 이젠 더 이상 서로를 힘들게 하지 않겠네 엇갈리네 우리는 참 길고 오래도 그 시간들을 지나 이제는 다른 길을 가야 하잖아 그래 이제 보내야 할 것들은 지나치는 길에 두고 오려 해도 하지만 그럴 수록 떠오르는 마음같지 않던 안녕이란 말 그대여 고마운 사람아 어떤 마음으로 날 떠나 갔나요 그대 돌아서는 그 걸음 걸음도 자꾸 희미하게 젖어들던가요 그대여 미안해 말아요 아직 우리에겐 시간들이 많잖아 언젠가 우연히 마주친다면 그땐 눈으로만 안녕을 말해줘요 그래 이제 보내야 할 것들은 지나치는 길에 두고 오려 해도 하지만 그럴 수록 떠오르는 마음같지 않던 안녕이란 말 그대여 고마운 사람아 어떤 마음으로 날 떠나 갔나요 그대 돌아서는 그 걸음 걸음도 자꾸 희미하게 젖어들던가요 그대여 미안해 말아요 아직 우리에겐 시간들이 많잖아 언젠가 우연히 마주친다면 그땐 눈으로만 안녕을 말해 그대여 미안해 말아요 아직 우리에겐 시간들이 많잖아 언젠가 우연히 마주친다면 그땐 눈으로만 안녕을 말해 줘요
  슬라이드로사 (Slide Rosa)  ,목요일 오후 네시,지루한 하루가 조금은 지난감 뜨거운 햇살에도 바람이 느껴지는 까페에 앉아서 얘기를 나누는 목요일 오후 네 시 거리를 오가는 많은 사람들 중에 인사를 건네 오는 오래된 친구들 오늘은 또 무슨 이야기로 술 한 잔 할까 목요일 오후 네 시 그 시절 모이던 술집엔 우리를 반기던 언제나 졸리운 눈길로 모른 척 하던 고양이 있었지 햇살에 빛나는 웃음만큼 따스한 테이블 위에 놓인 커피만큼 포근한 손을 흔들어 인사를 나누는 목요일 오후 네 시 목요일 오후 네 시 목요일 오후 네 시 목요일 오후 네 시 목요일 오후 네 시
  너드커넥션 (Nerd Connection)  ,좋은 밤 좋은 꿈,저 많은 별을 다 세어 보아도 그대 마음은 헤아릴 수 없어요 그대의 부서진 마음 조각들이 차갑게 흩어져 있는 탓에 그댄 나의 어떤 모습들을 그리도 깊게 사랑했나요 이제 내가 해줄 수 있는 건 좋은 밤 좋은 꿈 안녕 좋은 밤 좋은 꿈 안녕 시월의 서늘한 공기 속에도 장미향을 난 느낄 수가 있죠 오월 어느 날에 피었던 빨갛던 밤을 기억하거든요 그댄 나의 어떤 모습들을 그리도 깊게 사랑했나요 이제 내가 해줄 수 있는 건 좋은 밤 좋은 꿈 안녕 까만 밤이 다 지나고 나면 이야기는 사라질 테지만 이름 모를 어떤 꽃말처럼 그대 곁에 남아 있을게요 나는 그대 어떤 모습들을 그리도 깊게 사랑했었나 이제 내가 해줄 수 있는 건 좋은 밤 좋은 꿈 안녕
  우쿠루쿠  ,봄에는 기분이 좋아,봄에는 기분이 좋아 춥지 않아서 그냥 어딘가 떠나볼까봐 바람도 불고 우리 봄에는 기분이 좋아 가벼운 마음으로 누군가 돕고 싶구나 손에 손잡고 우리 봄의 노래 봄의 기운 봄의 마음 봄의 기억 봄의 여행 봄의 걸음 봄의 우리 봄에는 기분이 좋아 아지랑이처럼 그냥 누군가 만나볼까봐 바람도 불고 우리 봄에는 기분이 좋아 가벼운 걸음으로 오늘도 너와 있구나 그래서 좋아 우리 봄의 노래 봄의 기운 봄의 마음 봄의 기억 봄의 여행 봄의 걸음 봄의 우리 봄의 노래 봄의 기운 봄의 마음 봄의 기억 봄의 여행 봄의 기분 봄의 걸음 봄의 우리 봄에는 기분이 좋아 봄에는 기분이 좋아 봄에는 기분이 좋아 봄에는 기분이 좋아
  구르는 돌  ,감귤,푸른 바다 하르방 과수원 눈부신 햇살 날 어루만지네 푸른 내 몸 점점 익어가고 할머니 나를 따러 다가오시네 난 푸른 제주도 상큼한 귤이 될거야 감귤 난 오렌지보다 맛있는 귤이 될거야 감귤 거실탁자 온 가족 모였네 내 친구들 하나둘 집어가는데 귀여운 소녀 날 집어들더니 날 벗길 때 난 눈을 감았네 난 그대에게 맛있는 귤이 될거야 감귤 난 모두에게 상큼한 귤이 될거야 감귤 하지만 난 이제 알아버렸네 난 그저 껍데기였네 하지만 난 이제 알아버렸네 난 그저 껍데기였네 하지만 난 이제 알아버렸네 난 그저 껍데기였네 하지만 난 이제 알아버렸네 난 그저 껍데기였네
  이한철  ,"세비야 (Feat. Cesar Machado, 나희경)",일어나 반쯤 열린 창 너머 아무도 걷지 않은 길을 나서네 낯선 돌 길 위 작은 가게를 지나 눈 앞에 펼쳐진 아침을 보다가 니가 떠올라 그렇게 떠올라 이 먼 곳에서 널 발견하게 돼 맘이 아려와 여전히 아려와 도망치듯이 지구 반대편의 나 한 숨이 나오네 걸어온 뒤를 돌아보다가 두고 온 일들이 문득 생각나 미안했던 일 고마운 사람들 또렷이 떠올라 눈 앞이 흐려지네 모두 떠올라 그렇게 떠올라 이 먼 곳에서 그 사실을 알게 돼 맘에 두었던 전하지 못했던 그런 말들이 입 안 가득 맴돌아 입술을 깨무네 수화기 너머 한낮의 목소리 들려줘 고마워 내 맘이 씽긋 웃네 나의 사람아 나의 사랑아 조금 기다려 난 달라질거야 언덕을 넘어 호수를 지나 니가 있는 곳 그 곳에서 만나자 우리의 사랑이 우리의 우정이 영원토록
  오소영  ,아무도 모르게,나에게만 보여줄래 네 마음속 숨어있는 아픈 기억들 아무렇지 않게 웃어 네 눈물을 아무도 모르게 라 두려움 모두 잊고 라 아이처럼 웃는 거야 그 누구보다 기쁠 거야 두려워말고 바라볼래 그 누구도 그 무엇도 널 막진 않아 아무렇지 않게 웃어 네 마음을 아무도 모르게 라 화려한 옷을 입고 라 모델처럼 걷는 거야 폼 나게 그 누구보다 멋질 거야 오 넌 정말 좋은 사람인 걸 오 난 그걸 알 수 있어 라 라 두려움 모두 잊고 라 아이처럼 웃는 거야 그 누구보다 기쁠 거야
  피아 (PIA)  ,SHINE,헤어나지 못해 갇혀있던 거칠었던 내 기억에 상처 받아 아파하던 그런 널 바라볼 수 밖에 없어 또 다시 나 갇혀 그렇게도 지쳐있던 넌 순수한 그리움에 날 대신해 아래로 아래로 아래로 느낄 수 있어 네 자신을 봐 여기 거대한 너 널 믿어봐 크게 외쳐봐 네 자신을 봐 멈추지 않는 너 난 널 원해 내 기억에 혼돈스럽고 또 지나쳤던 건 이제 모두 떨치고 싶어 깊은 늪 소용돌이 속 던져버려 다 지우고 싶었어 거침없고 거대했던 너 두려움에 맞선 너 멈추지마 보여봐 그대로 그대로 멈출 순 없어 그대로 멈출 수 없어 느낄 수 있어 네 자신을 봐 여기 거대한 너 널 믿어봐 크게 외쳐봐 네 자신을 봐 멈추지 않는 너 난 널 원해 마침내 어두운 밑바닥 도시 저편 거기 웅크린 날 보며 알았어 난 느꼈어 날 이제 멈출 수 없어 날 여기 재울 수 없어 날 느낄 수 있어 네 자신을 봐 여기 거대한 너 널 믿어봐 크게 외쳐봐 네 자신을 봐 멈추지 않는 너 난 널 원해 크게 외쳐봐 네 자신을 봐 멈추지 않는 너 난 널 원해 크게 외쳐봐 네 자신을 봐 멈추지 않는 너 난 널 원해
