artist,title,lyric
  럭스  ,항상 좋을 순 없잖아 (feat. VOVO of NOBRAIN),자책 하지 않아도 믿고 있으니까 아무 말도 필요 없으니까 포기 하고 싶어도 그렇게 너는 다시 또 일어날꺼니까 그래도 괜찮아 아무렇지 않아 아무도 탓하지 않아 힘겨웠던 만큼 넌 더 강해진거야 그래도 괜찮아 아무렇지 않아 넌 절대 약하지 않아 지금이 제일 멋있으니까 Everythings gonna be allright Everythings gonna be allright Everythings gonna be allright Everythings gonna be allright Everythings gonna be allright Everythings gonna be allright 행복했던 순간 과 사랑스런 기억들 매일 같이 좋을순 없잖아 상처 받고 아파도 너 답게 일어선다면 내일이올꺼야 그래도 괜찮아 아무렇지 않아 넌 다시 일어날꺼야 힘겨웠던 만큼 넌 더 강해진거야 그래도 괜찮아 아무렇지 않아 넌 절대 약하지 않아 지금이 제일 멋있으니까 Everythings gonna be allright Everythings gonna be allright Everythings gonna be allright Everythings gonna be allright Everythings gonna be allright Everythings gonna be allright
  로맨틱멜로디초비  ,허수아비,저기 언덕위에 홀로이 서있는 붉은 노을속에 허수아비 아저씨 허수아비 아저씨 허수아비 아저씨 우 그립고 그립다 허수아비 아저씨 오늘도 그 곳에 홀로이 서있는 두팔벌린 나의 허수아비 아저씨 허수아비 아저씨 허수아비 아저씨 우 그립고 그립다 허수아비 아저씨 우 그립고 그립다 허수아비 아저씨
  더핀 (The Finnn)  ,여우에게,파란하늘 모두 두쪽이 난 후 왜 눈앞에 널 난 안을 수 없나요 지난일에 얹혀진 느낌들 속에서 난 아직 남아 있나봐요 사진속에 갇힌 내모습을 보며 헝클어진 기억들을 떠올릴때 웃지는 말아요 약속했던 순간 이렇게 흘러가는 거죠 모두 짝이 있는 이런 사막에서 난 왜 혼자인가요 이게 원래 이런 건가요 둘씩 피어나는 사람들 속에서 난 하나의 꽃인거죠 없는마음 속에 품은채로 와서 비웃으며 내 앞에 섰을때에 같잖은 말들로 내게 수를 쓰진 마요 죄다 티가 나는 걸요 아무렇지 않은 듯한 흘러가는 사람속에 너는 하나였던 건가요 알 수 없을 것만 같던 한 번 숨긴 표정 속에 가진게 드러나는 거죠 마지 못해서 그냥 말을 걸순 없죠 우리 추억들속에 차가움을 심어놔요 지나면 남이 되는 사이에 한푼의 아쉬움은 없는거죠 갖다 붙이지는 말아요 그저 잠시 있던 일인걸요 지나면 남이 되는 사이에 한푼의 아쉬움도 없었나요
  게이트 플라워즈  ,잘자라,잘 자라 우리 아가 잘 자거라 비구름 몰려와 흐려져도 거센 바람 창문을 두드린대도 잘 자라 우리 아가 잘 자거라 소중한 꿈 때 이른 기회 끝내 사라지고 만대도 절대로 져버리지 않을 기대 그리고 조그만 품 안의 기적 다시 보지 못한다 해도 절대로 포기하지 않을 기대 그리고 조그만 잘 자라 우리 아가 잘 자거라 새들도 아가양도 없겠지만 앞뜰과 뒷동산이 무너져도 잘 자라 우리 아가 잘 자거라 버려진 꿈 때 이른 후회 끝내 이뤄지고 만대도 절대로 져버리지 않을 기대 그리고 조그만 희망 어떤 핍박이 길을 가로막아도 거친 압박에 무릎 꿇어도 끝까지 포기하지 않을 기대 그리고 품 안의 기적 어떤 핍박이 길을 가로막아도 거친 압박에 무릎 꿇어도 끝까지 포기하지 않을 기대 그리고 품 안의 기적
  Ashgray  ,너야 (Feat. 조준호 Of 좋아서하는밴드),요즘 난 기분이 좋아 피곤해도 너만 보면 마음이 편해 늦은 밤 잠이 안 올 때도 전화 할 사람 있고 재미없는 우스갯 소리도 웃어 줄 사람 너야 너야 왜 이제 왔냐고 사랑을 알게 해 준 너야 너야 내게도 이런 날이 왔어 감사할 사람 너야 요즘 난 기분이 좋아 나 하는 일만 아니라면 더 좋을테고 늦은 밤 잠이 안 올 때도 전화 할 사람 있고 재미없는 우스갯 소리도 웃어 줄 사람 너야 너야 왜 이제 왔냐고 사랑을 알게 해 준 너야 너야 내게도 이런 날이 왔어 감사할 사람 너야 내 맘 속에 커다란 그 이름 하나 내 맘 가득 담아둘 거야 너야 너야 너야 너야 너야 너야 너야 너야 너야 너야
  단편선과 선원들  ,모든 곳에,아니 아닌 말들이 아닌 밤이 아닌 말의 밤 아니 그리 두려운 밤은 오지 않아 오지 않아 네가 아닌 내가 아닌 모든 내 안에 들지 못한 내 아니 돼지가 아니 우는 물이 아닌 밤의 말이 되새김 되먹지 못한 머저리 내 손과 발 결박 결정 결과적인 부적절 부정 부조리 불행하고 늙고 보드라운 손 모든 곳에 있을 때 나는 꽃밭에서 너를 비웃는 사내 그 혀를 잘라요 눈이 아홉 개 달린 개 우리는 외계인 멀리 솟아오르는 지옥의 불길 손 내밀면 언제나 잡힐 것만 같던 네 어머니의 죄 없는 공장은 하이 앤 로우 하이 앤 로우 추운 눈을 가진 사람 느리게 번져오면 가장 높고 귀한 이 옷 매무새를 풀어 머리까지 잠긴 채 숨을 멈춥니다 모든 것이 제자리인 세계 우리는 외계인 멀리 솟아오르는 지옥의 불길 손 내밀면 언제나 잡힐 것만 같던 네 어머니의 죄 없는 공장은 하이 앤 로우 하이 앤 로우
  롱디 (LONG:D)  ,Alive (Feat. Yuri),오늘도 나는 괜찮을 줄 알았어 모든 게 그 자리에 있을 것 같았어 just a little bit caught in a middle it was fine Nobody's watching me and I'm not the one 어둡고 그늘진 데에 숨을 죽여 누워 있어 You are you are are You 언제나 지각생 네 손 본 체 만 체 I am nobody 이미 오래 전 손을 내밀어 다시 돌아가 for me I'm still alive I'm still alive It's true And we don't mind and we don't mind It's true 나 깨어 있다고 해서 달라지는 거는 없어 So I'm gonna sleep yo So I'm gonna sleep yo 어긋나는 게 멋지다 생각했던 삶 모든 면에서 떨어졌던 지각생 문제아 이해를 받기만 원했던 뭐든 괜찮은 척 세상에서 내가 제일 힘든 사람인 척 손을 내밀어도 그 손을 못 봐 놓쳤던 사랑 사람 기회들 모두 다 나는 Van gogh 귀머거리 정신병자 이젠 홀로 거울 속 내 모습도 못 봐 You are you are are You 언제나 지각생 네 손 본 체 만 체 I am nobody 이미 오래 전 손을 내밀어 다시 돌아가 for me I'm still alive I'm still alive It's true And we don't mind and we don't mind It's true 나 깨어 있다고 해서 달라지는 거는 없어 So I'm gonna sleep yo So I'm gonna sleep yo I'm still alive I'm still alive It's true And we don't mind and we don't mind It's true 나 깨어 있다고 해서 달라지는 거는 없어 So I'm gonna sleep yo So I'm gonna sleep yo
  안은정  ,어제는,어제는 하루종일 비가 내리고 오늘은 하루종일 눈물만 흐르네 꿈속에 너를 본 기억이 하루종일 가슴에 남아 잊은 듯 살아도 사는 게 아닌것을 몰랐어 시간이 흐르면 그리움도 아름다운 줄만 알았지 내게만 말해줘 니가 꿈꾸던 사랑은 뭐야 이렇게 나를 바보로 만들지 말고 나를봐 조금씩 무뎌질 줄 알았던 슬픔이 밤새 나를 안고 놓아주질 않아 어디에 있니 내가 그리워 하는 넌  어제는 하루종일 같이 듣던 음악을 듣고 이별의 이유를 찾다가 지쳐 오늘도 내일도 내게만 말해줘 니가 꿈꾸던 사랑은 뭐야 이렇게 나를 바보로 만들지 말고 나를봐 조금씩 무뎌질 줄 알았던 슬픔이 밤새 나를 안고 놓아주질 않아 wo  어제는 하루종일 비가 내리고 오늘은 하루종일 눈물만
  스테레오버블  ,엎드려서 말을 걸어,엎드려서 말을 걸어 나는 조금은 더운 상태 고갤 들고 눈을 감아 마른 눈커풀 촉촉하게 매일 건널 수 있다면 어둠에는 그다지 엎드려서 말을 걸어 나는 조금은 더운 상태 고갤 들고 눈을 감아 마른 눈커풀 촉촉하게 매일 건널 수 있다면 어둠에는 그다지 엎드려서 말을 걸어 나는 조금은 더운 상태 고갤 들고 눈을 감아 마른 눈커풀 촉촉하게 어쩌면 안주하는 둥지 속 핏덩이 일지라도
  내귀에 도청장치  ,Y(아),안돼 널 어떻게 잊어 잠든 널 어떻게 떠나 우리 꿈같은 시간은 영원히 우린 첨 만날 때부터 끝까지 함께 해달란 말 원치 않았지 모든게 간절한 이 밤 사랑은 없지만 그를 위해 사는 너 그것까지 알고 사랑한 내게 바라지마 서로 원할 때마다 다 얻는다면 그건 사랑 아냐 사랑해 그래서 갖지 못하나봐 더 그립게 하나 봐 다른 누굴 품은 그 후에도  그래 그래서 널 보내 모든 널 사랑하기에 싫어 널 놔주기 싫은 이 밤 잘할 수 있겠지 나 보고 파질 땐 그럴 땐 더 그를 위하는 거야 바라지마 서로 원할 때마다 다 얻는다면 그건 사랑 아냐 사랑해 그래서 갖지 못하나봐 그립게 하나 봐 다른 누굴 품은 그 후에도 바라지마 서로 원할 때마다 다 얻는다면 그건 사랑 아냐 사랑해 그래서 갖지 못하나봐 더 그립게 하나 봐 다른 누굴 품은 그 후에도 사랑은 다 얻을 수 없나 봐
  밀크티  ,쓰담쓰담,When I feel your love 그댄 내 머릿결을 쓰담 쓰담 쓰담 새빨간 두 볼을 쓰담 쓰담 쓰담 언제라도 그대 곁에 있다면 I will still love you 나를 믿어주는 오직 한사람 네 품에 기댈게 힘겨운 하루 지나면 내 손을 꼭 잡고 괜찮아 나의 어깰 토닥여줘 사랑한다고 말해 그래 그렇게 너 때문에 웃어본다 눈을 보며 내 맘을 읽을까 웃어주며 말없이 날 안아주는 너 그래 알고 있어 네 맘이 그려져 웃고 있어 이렇게 그댄 내 머릿결을 쓰담 쓰담 쓰담 새빨간 두 볼을 쓰담 쓰담 쓰담 언제라도 그대 곁에 있다면 I will still love you 나를 믿어주는 오직 한사람 네 품에 기댈게 또 밝아오는 아침에 울리는 벨소리 굿모닝 나의 귀에 속삭이네 좋은 아침이라고 그래 그렇게 너 때문에 웃어본다 주저앉아 울고만 싶을 때 하루쯤은 그냥 떠나고만 싶을 때 항상 나의 뒤에서 환히 비춰줘 그 길을 따라걸어 그댄 내 머릿결을 쓰담 쓰담 쓰담 새빨간 두 볼을 쓰담 쓰담 쓰담 언제라도 그대 곁에 있다면 I will still love you 나를 믿어주는 오직 한사람 네 품에 기댈게 그댄 내 머릿결을 쓰담 쓰담 쓰담 새빨간 두 볼을 쓰담 쓰담 쓰담 언제라도 그대 곁에 있다면 I will still love you 나를 믿어주는 오직 한사람 네 품에 기댈게
