artist,title,lyric
  미드나잇블루 (Midnight Blue)  ,고백,너에게 전하고 싶은 얘기가 있었는데 우연히 너를 마주했지만 그땐 나는 이미 아무런 말 한 마디 건네지 못한 채로 어느새 나는 이미 얼음이 되어 있었어 하루에도 몇 번씩 떠올렸어 너에게로 다가가 말해야 하는데 그 아름다운 얘기들 말해야 하는데 그 가슴 설레는 고백 그 흔한 세 글자는 더 이상 의미가 없어 너와 모든 걸 다 잊은 채로 달을 바라본다면 아직은 우리 사이에 안개가 하얗게 있어 이제는 싱그러운 햇살이 되어 밝게 비추고 싶어 하루에도 몇 번씩 떠올렸어 너에게로 다가가 말해야 하는데 그 아름다운 얘기들 말해야 하는데 그 가슴 설레는 고백
  Loi (로이)  ,체온,You Shout 나의 endorphin You mine 나의 agency You Shout 나의 Hope You Shout 나의 Hope Oh 나의 endorphin 넌 날 fallin in hope You shout 나의 endorphin You shout 나의 endorphin and hope 흐릿하게 물든 타인이 내게 보낼 사인이 들린다 어지럽게 몰린 말들이 fallin in hope Oh 나의 endorphin 넌 날 fallin in hope You shout 나의 endorphin You shout 나의 endorphin and hope Hoo- woo- woo- How How How How How Hoo- woo- woo- How How How How How Hoo- woo- woo- How How How How How Hoo- woo- woo- How How How How How How How How How How How How How How How
  최보통  ,우리는 사랑일까? (Feat. 미묘) (Remastered),나는 너를 참 사랑하는 걸까 너는 나를 사랑하는 걸까 아무 생각도 할 수가 없는데 아무 얘기도 건넬 수 없는데 이런 우리는 사랑일까 이런 우리는 사랑일까 비 오는 거리를 걷다가 문득 니 생각이 나면 사랑일까 즐거운 생각에 웃다가 문득 니 생각이 나면 사랑일까 이런 생각은 사랑일까 이런 생각은 사랑일까 이런 우리는 사랑일까 이런 우리는 사랑일까 나는 너를 참 사랑하는 걸까 나는 너를 사랑하는 걸까 나는 너를 사랑하는 거야 사랑하는 거야
  이브  ,너 그럴때면 (Piano Ver.),울고 싶을때.. 너무나 속상할때.. 친구들이 너의 마음을 몰라줄때.. 많이 힘들때 주저앉고 싶을때.. 집으로 가는길이 멀게만 느낄때.. 그럴땐 나를 생각해 너 초라해진대도 세상이다 너를 외면한대도 우워어워어~ 나는 널위해 사는걸 정말 널위해 사는걸 내가처음 고백한 그 날부터 언제까지나 나를 알겠니 넌 혼자가 아니야 알수있다면 다시는 슬퍼하지마  그럴땐 나를 생각해 너 초라해진대도 세상이다 너를 외면한데도 우워어워어~ 나는 널위해 사는걸 정말 널 위해 사는걸 내가 처음 고백한 그날부터 언제까지나 나는 널위해 사는걸 정말 널위해 사는걸 내가처음 고백한 그날부터 언제까지나 우워어워어~
  댄디남  ,이성중독,처음 본 순간 넌 내 눈을 멀게 해서 날 이 지경으로 만들었지만 난 전혀 싫지 않으니까 계속 진행해 줘 제발 손 떨릴려고 하잖아 잠이 들 수가 없잖아 보조제라도 주던지 니가 오던지 Pretty girl 시간이 점점 지나갈수록 더욱 더 파고드는 니 매력에 갇혀 빠져나올 수가 없어서 난 더 미쳐 가잖아 너로 인해서 그 순간이 너무 황홀했고 그 순간을 난 잊지 못해서 멀쩡히 살 수가 없으니까 딱 한 번만 더 내게 와 줘 숨을 쉴 수가 없잖아 무기력해져 가잖아 보조제라도 주던지 니가 오던지 Pretty girl 시간이 점점 지나갈수록 더욱 더 파고드는 니 매력에 갇혀 빠져나올 수가 없어서 난 더 미쳐 가잖아 분홍빛 입술에 취한 그 몽롱한 기분을 잊을 수 없어 Pretty girl 시간이 점점 지나갈수록 더욱 더 파고드는 니 매력에 갇혀 빠져나올 수가 없어서 난 더 미쳐 가잖아
  미미시스터즈  ,미미 (Feat. 크라잉넛),따사로운 봄날 아침 갑자기 하늘에서 비가 와 우산을 펼쳤더니 슬픈 나비처럼 날아가 랄라라라라랄라 랄라라라라라라라 랄라라라라랄라 랄라라라라라라라 꿀단지 손에 들고서 하루 종일 동네 거닐다 당신을 만난 순간 꿀 먹은 벙어리가 되었네 랄라라라라랄라 랄라라라라라라라 랄라라라라랄라 랄라라라라라라라 미미 괜찮니 비에 젖은 풍뎅이처럼 내일 모레면 모든 게 다 잘 될지도 몰라  촌스럽지만은 않아 시골 산딸기 같은 내 입술 눈부신 당신을 만나 언제나 끼게 된 선글라스 당신이 코 앞 에 있는데 미미 미칠 것만 같은데 도도함을 잃기 싫어 멍하니 먼 곳만 바라보네 랄라라라라랄라 랄라라라라라라라 랄라라라라랄라 랄라라라라라라라 미미 괜찮니 비에 젖은 풍뎅이처럼 내일 모레면 모든 게 다 잘 될지도 몰라 미미 괜찮니 술에 취한 양귀비처럼 내일 모레면 모든 게 다 잘 될지도 몰라 세월이 가면 철이 들겠지 하지만 지금이 그리울 거야 새빨간 입술을 찍어 발라도 지나간 시간은 다시 오지 않는가 미미 괜찮아 스쳐가는 소나기처럼 내일 모레면 태양이 잘 말려 주실 거야 미미 괜찮아 꽃이 피는 사춘기처럼 내일 모레면 모든 게 다 잘 될지도 몰라 미미 괜찮아 스쳐가는 소나기처럼 내일 모레면 태양이 잘 말려 주실 거야  미미
  어른아이  ,You,너의 손을 잡으면 따뜻해져 와  너의 손을 잡으면 표현하지 않아도 사랑한단 너의 말 전해지는 것 같아 너의 손을 잡으면 힘들고 지친 맘도  녹아버릴 것처럼  가끔은 불안해 지는 맘 초조해져 와도  너의 손을 잡으면  온 세상이 웃고 있는 것 같아 마법처럼
  한살차이  ,숨길 수가 없어요,그대를 만나면 새침한 척 하고 일부러 투정 부리고 질투 나는 마음에 얼굴 빨개져도 아닌 척 괜찮은 척 해요 많이 좋아한다 말하면 그대 내 곁을 떠날까 봐 혹시나 하는 맘에 내 마음 숨겨 보지만 사랑하고 있어요 생각보다 정말 많이 그댄 꿈에도 모를 거야 숨길 수가 없어요 커져 가는 마음을 두근거리는 소리가 들리나요 많이 좋아한다 말하면 그대 내 곁을 떠날까 봐 혹시나 하는 맘에 내 마음 숨겨 보지만 사랑하고 있어요 생각보다 정말 많이 그댄 꿈에도 모를 거야 숨길 수가 없어요 커져 가는 마음을 두근거리는 소리가 들리나요 보내기 싫다는 그대의 말에 난 시간이 늦었다 말해도 항상 그대 곁에 함께 있고 싶은 걸요 사랑하고 있어요 생각보다 정말 많이 그댄 꿈에도 모를 거야 숨길 수가 없어요 커져 가는 마음을 두근거리는 소리가 들리나요 두근거리는 소리가 들리나요
  강인성  ,너를 봄,너무 좋아서 말도 잘 못해 너무 좋아서 가까이 가지도 못해 우리 둘이 이렇게 멀리서만 바라보고 있어 가끔 우리 서로 눈 마주칠 때 왠지 모를 미소 입가에 머물고 우리 함께 걸었던 그날 밤새 설레 잠 못 잤어 문득 너를 보면 나와 똑같은 눈빛 오늘 말할까 내일 말할까 이런 내 맘 넌 알고 있는지 이렇게 말하고 싶어 너를 보고 있으면 다른 생각 안나 하루 종일 너만 볼 수 있겠어 매일 봐도 봐도 또 봐도 자꾸 보고 싶은 너의 얼굴과 미소 너와 눈 맞추면 세상이 멈춘듯해 너 말곤 다른 사람 보이지 않아 너와 함께하는 이 시간 시계야 이대로 멈춰줄 수 있겠니 문득 너를 보면 나와 똑같은 눈빛 오늘 말할까 내일 말할까 이런 내 맘 넌 알고 있는지 이렇게 말하고 싶어 너를 보고 있으면 다른 생각 안나 하루 종일 너만 볼 수 있겠어 매일 봐도 봐도 또 봐도 자꾸 보고 싶은 너의 얼굴과 미소 너와 눈 맞추면 세상이 멈춘듯해 너 말곤 다른 사람 보이지 않아 너와 함께하는 이 시간 시계야 이대로 멈춰줄 수 있겠니 너를 보고 있으면 다른 생각 안나 하루 종일 너만 볼 수 있겠어 매일 봐도 봐도 또 봐도 자꾸 보고 싶은 너의 얼굴과 미소 너와 눈 맞추면 세상이 멈춘듯해 너 말곤 다른 사람 보이지 않아 너와 함께하는 이 시간 시계야 이대로 멈춰줄 수 있겠니
  로코베리  ,마법의 주방,느즈막히 눈을 떠보니 아직 시곈 아침10시반 조금더잘까 하다 일어나 오늘은 우릴 위한 special day 달콤 새콤 에코 요리를 너만을 위해서 내가 할래 재료는 사랑 탁 질투는 초큼만 거기다 촉촉한 키스는 덤으로 넣요 아이야이야 아이야이야 이제는 진짜 순진한 참치와 친절한 연어씨도 아삭아삭 채소와 흰둥이 두부 쓰으삭 쓰윽삭 냄비에 풍덩 보글보글 찌개 끓는 소리 지글지글 전부치는 소리 두근두근 니가 오는 소리 콩닥콩닥 빠져드는소리 사랑에 빠지는 마법 재료는 사랑탁 질투는 초큼만 거기다 촉촉한 키스는 덤으로 넣요 아이야이야 아이야이야 이제는 진짜 너의앞 부끄런 나의 얼굴은 사과 울긋불긋 얼굴을 숙이고주문 외워 본다 사랑에 빠진다 그렇게 나에게 빠져 마법에 걸려버린다
  요술당나귀  ,카페라떼,너의 이름도 몰라 넌 언제나 카페라떼 하루 종일 너만 기다리며 커피 만드는 사나이 어떡해 널 좋아하는 것 같아 떨리는 내 마음 들킬까봐 조금씩 너에게 다가갈게 어떡해 널 좋아하는 것 같아 하얀색 하트를 그려 오늘은 꼭 말해야지 떨리는 손 너의 얼굴을 보며 좋아하시는 커피 나왔습니다 손님 어떡해 널 좋아하는 것 같아 떨리는 내 마음 들킬까봐 조금씩 너에게 다가갈게 어떡해 널 좋아하는 것 같아 미안해 널 사랑하는 나의 마음이 너무나 초라해 부끄러워 떨리는 목소리로 난 너에게 얘기해 난 어떡해 널 좋아하는 것 같아 어떡해 널 좋아하는 것 같아 떨리는 내 마음 들킬까봐 조금씩 너에게 다가갈게 어떡해 널 좋아하는 것 같아
  친구들  ,恨서리,그댈 바라보는 나의 눈빛도 따스한 그대의 손길도 나에게는 욕심 이었나 그댈 마주치길 바란 소망도 달리 느껴진 내 오감도 바래서는 안 되는 건가 어두운 그늘 밑의 노래와 망설여진 내일 모래가 응어리가져 한이 되고 간절하고 작은 나의 소원과 진심어린 나의 거짓말 미친듯이 불러 토해내도 어디까지인지도 모를 위선 위에 아슬아슬하게 선 너를 찾아 헤매이는가 그댈 바라보는 나의 눈빛도 따스한 그대의 손길도 나에게는 욕심 이었나 그댈 마주치길 바란 소망도 달리 느껴진 내 오감도 바래서는 안 되는 건가 어두운 그늘 밑의 노래와 망설여진 내일 모래가 응어리가져 한이 되고 간절하고 작은 나의 소원과 진심어린 나의 거짓말 미친듯이 불러 토해내도 어디까지인지도 모를 위선 위에 아슬아슬하게 선 너를 찾아 헤매이는가
  이 음  ,연애편지,저 하늘 보며 나 혼자 서 있지만 즐거워 너 생각했어 너 이 스탈 향기 좋아하는지 달콤한 치즈 케익 한 입 쏙 베어문 네 입술 가득 요기요기 입 삐죽삐쭉 어떻해 정말 눈 살짝 이런 어쿠스틱한 기분인걸 몰랐어 조각난 퍼즐 속 내 맘 다 맞춰놀 거란 걸 나 무지 귀엽지 새콤달콤해 잉 아님 말구 이젠 그만할까 정말 가까이 있음 쫌 더 그래 정말 튕겨튕겨 아 나 몰라몰라 갈팡질팡 뱅글 999 타고 우주 빙그르르 돌아가나 왜이래 환한 달빛 어쿠스틱 과자 모양이죠 알았어 솜사탕 폭신폭신 맘 다 보고싶어  눈 살짝 이런 어쿠스틱한 기분인걸 몰랐어 조각난 퍼즐 속 내 맘 다 맞춰놀 거란 걸 환한 달빛 어쿠스틱 과자 모양이죠 알았어 솜사탕 폭신폭신 맘 다 보고싶어  포프리 꽃 레터 네 머릿결 위 노을진 바다 하얀 Point Vincent 등대 야자수 캘리포니아 향긴 파란 하늘 끝없는 지난 날의 그 기억들이 요기 조기 가득 걸어놓은 추억들이 들려 이런 어쿠스틱한 기분이야 오 정말 그렇고 그런 기분 너무 좋아 그댈 손잡아 끌어안고 싶은 기분인걸 난 알아 그런 어쿠스틱한 찡한 느낌 오 정말 가득 품에 안기고 싶은 기분인 걸
  은교  ,아름다운 시절,현실과 꿈 그 두 가지 사이에서 헤엄치고 있다 생각했는데 그게 아니었네요 나와 나 이 한가지 사이에서 헤엄치고 있었어 아름다운 우리의 시절에 다른 사람의 안경을 쓰지 않고 반짝이는 것에 마음을 뺏겨서 가난을 슬퍼 말아요 오 다시 오지 않을 시절에 오 사랑을 미루지 마요 아름다운 우리의 시절을 방안에 다 가두지 말고 높은 곳에 맘이 뺏겨서 계단을 피하지 말아요 아름다운 우리의 순간에 무엇이 되려는 것보다 서로 사랑하는 시간으로 전부 채우고 싶어요 오 다시 오지 않을 시절에 오 사랑을 미루지 마요 오 가장 아름다운 순간에 오 나를 미루지 말아요 나는 나를 사랑해야만 해 나는 나를 지켜내야만 해 나는 너를 사랑해야만 해 나는 너를 지켜내야만 해 너는 너를 사랑해줘야 해 너는 너를 지켜내야만 해
  리차드파커스  ,자러간다,오늘도 저 달에 널 물으면 하루가 또 가겠지 이젠 이것도 버릇이 됐어 내 기도처럼 아침에 눈 뜨면 넌 내 곁에 있겠지 한심해도 난 믿어 본다 내 귀에 속삭이던 비밀도 손끝이 닿았던 여름도 아무 일 없다는 듯 외면한다 말로 할 수 없는 이 마음은 노트에 가둬 둔 채 이제 그만 난 자러간다 내일도 저 달에 널 물으며 긴긴 밤을 새겠지 소용 없단 걸 잘 알면서도 되감기 없는 영화 속에 우린 멈춰 섰고 차마 더는 볼 수가 없다 내 귀에 속삭이던 비밀도 손끝이 닿았던 여름도 아무 일 없다는 듯 외면한다 말로 할 수 없는 이 마음은 노트에 가둬 둔 채 이제 그만 난 자러간다 내 귀에 속삭이던 비밀도 손끝이 닿았던 여름도 아무 일 없다는 듯 외면한다 말로 할 수 없는 이 마음은 노트에 가둬 둔 채 이제 그만 난 자러간다 말로 할 수 없는 이 마음은 노트에 가둬 둔 채 이제 그만 난 자러
  바닐라 유니티  ,Mr.Joo,hey MR JOO 넌 왜 아프고 가난한데 웃고만 있니  hey MR JOO 넌 왜 아프고 가난한데 웃고만 있니 지쳐 울 법도 한데 히죽대는 널 보면 눈물이 흘러 난 조심스런 말투와 순수하고 바보 같기 까지한 너무 원하고 원했던 순간인데 반지도 준비했는데 이제 너만 오면 되는데 아파서 못 오니 어디 있니 지금  hey MR JOO 뭐가 그렇게도 좋길래 웃기만 하니 모두 변해 가는데 나도 변해가는데 왜 그대로니 넌 평범한 옷차림과 바보 같지만 순수함을 간직한 너무 원하고 원했던 순간인데 밤새 잠도 못 잤는데 오늘은 꼭 온댔는데 문 열리는 소리에 괜시리 초조해 지는데 조금 촌스러운 양복을 입고 있는 사람이 날 바라보며 해맑게 웃고 있네 꿈꿔왔던 지금이야 영원히 기억할 거야 너만 바라보는 바보가 될 거야 너만 바라볼 거야  너만 보는 바보가 될 거야
  스위밍풀  ,춤이나 출까요,그냥 시간을 보냈지 당신도 날 알고 있어 점점 내게 다가왔지 나도 모르게 살며시 무슨 말인지 몰라요 음악 소리에 묻혀 들리지 않아요 뭘 더 생각해 너와 나의 맘이 흘러 녹아 닿을 때면 무슨 말이든 해 봐요 그냥 춤이나 출까 나 지겨워져요 아무 생각도 할 수 없다면 춤이나 출까요 친절하지는 않았고 웃음조차 어색했지만 서로를 향하는 시선을 멈출 수 없는 끌림은 무슨 말인지 몰라요 그냥 춤이나 출까 나 지겨워져요 뭘 더 생각해 너와 나의 맘이 흘러 녹아 닿을 때면 무슨 말이든 해 봐요 음악 소리에 묻혀 들리지 않아요 아무 생각도 할 수 없다면 춤이나 출까요 지루하지는 않나요 나만 바라보고 있어 지루한가요 뭘 더 생각해 너와 나의 맘이 흘러 녹아 닿을 때면 무슨 말이든 해 봐요 그냥 춤이나 출까 나 지겨워져요 아무 생각도 할 수 없다면 춤이나 출까요
  Yellow Monsters  ,Dear (Feat. 호란),사라져가네요 흩어져가네요 지워져가네요 끝인건가봐요 꿈이라도 좋아 널 볼 수 있다면 그대 어떤가요 익숙해졌나요 노을빛 하늘의 저 비눗방울이 우리 모습 같아 잡을 수 없어요 사라져버릴까 우리의 추억이 너무 두려워요 제발 나를 떠나지 마요 나를 떠나지 마요 나를 떠나지 마요 나를 떠나지 마요 사라져가네요 흩어져가네요 지워져가네요 끝인건가봐요 꿈이라도 좋아 널 볼 수 있다면 그대 어떤가요 제발 나를 떠나지 마요 나를 떠나지 마요 나를 떠나지 마요 나를 떠나지 마요 제발 나를 떠나지 마요 나를 떠나지 마요 나를 떠나지 마요 나를 떠나지 마요 나를 떠나지 마요 나를 떠나지 마요 나를 떠나지 마요 나를 떠나지 마요 사라져가네요 흩어져가네요 지워져가네요 끝인건가봐요 꿈이라도 좋아 널 볼 수 있다면 그대 어떤가요 익숙해졌나요 사라져가네요
  튜즈데이 (Tuesday)  ,안부,오랜만이야 잘 지냈니 어제 일 같은데 시간 참 빠르지 어색함을 서로 알고 있지만 별 일 없는 듯 안부를 물었지 많이 변했지 이 거리도 우리 추억이 묻었던 카페도 사라지고 남아있는 흔적은 너와 나만의 쓸쓸한 기억 뿐 뒤돌아보면 우린 참 어렸었는데 사소한 일에 서로를 아프게 했는지 사랑이 전부라 믿었던 그 때는 왜 사랑이 서툴렀을까 그 날 1년 후 난 졸업을 했었고 그 해 6월에 취직을 했었어 다른 사람과 또 이별을 했었고 그렇게 8년을 보냈어 뒤돌아보면 우린 참 어렸었는데 사소한 일에 서로를 아프게 했는지 사랑이 전부라 믿었던 그 때는 왜 사랑이 서툴렀을까 혹시 너도 같은 기억인 거니 나만 바보같은 생각인건 아닌지 행여 다시 라는 말조차도 조심스러워 하지만 너를 놓칠 수는 없는데 잘 지냈었니 이 말을 하기까지가 숱한 날들을 널 그리워하며 살았어 아직 모르니 왜 안불 묻는지 이젠 서툴지 않을 것 같은데 음
  윤지희  ,비가 와서 (Feat. 이하은),일어나 창 밖을 보니 비가 와 투두둑 이런 날엔 그냥 가만히 있고 싶어 비가 와서 아무것도 하기 싫은 그런 날 너랑 나랑 같이 앉아 하늘만 바라보자 구름은 까맣고 저 하늘도 흐리지만 비 오는 오늘이 너 있는 오늘이 좋기만 하다 비가 와서 아무것도 하기 싫은 그런 날 너랑 나랑 같이 앉아 하늘만 바라보자 할 일은 너무 많은데 하기가 싫어 나 뒹구르르 굴러서 너에게 가고 싶은데 비가 와서 아무것도 하기 싫은 그런 날 너랑 나랑 같이 앉아 하늘만 바라보자 구름은 까맣고 저 하늘도 흐리지만 비 오는 오늘이 너 있는 오늘이 좋기만 하다 비가 와서 아무것도 하기 싫은 그런 날 너랑 나랑 같이 앉아 하늘만 바라보자 서로만 바라보자
  사뮈 (Samui)  ,인생은 짧어,인정하고 싶진 않지만 시작이 있음 끝이 있다고 바보 같았던 어제도 다시 돌아오지 않는다고 후회하고 싶지 않아서 이것저것 재기만 하다가 죽을 때가 돼서야 느끼겠지 좀 더 재밌게 살 수 있었을 텐데 인정하고 싶진 않지만 시작이 있음 끝이 있다고 바보 같았던 어제도 다시 돌아오지 않는다고 후회하고 싶지 않아서 이것저것 재기만 하다가 죽을 때가 돼서야 느끼겠지 좀 더 재밌게 살 수 있었을 텐데 인정하고 싶진 않지만 시작이 있음 끝이 있다고 바보 같았던 어제도 다시 돌아오지 않는다고 다시 돌아오지 않는다고
  러브엑스테레오  ,Like A Waterfall In The Sky,Free your emotions Time to close your eyes Lose your focus As you fall asleep tonight 저 하늘에 떨어지는 폭포처럼 저 하늘에 불타는 구름처럼 Sleepless ocean Waving through your eyes Splash down your senses Like a waterfall in the sky Good bye Good night Good bye Good night 저 하늘에 떨어지는 폭포처럼 저 하늘에 불타는 구름처럼 Good bye Good night Good bye Good night Good bye Good night Good bye Good night Good bye Good night Good bye Good night Good bye Good night Good bye Good night Like a waterfall in the sky
  반다 (vanda)  ,Daily mood,어떤 날엔 한없이 따뜻하네 어떤 날엔 차갑기만 해 난 매일 다른 기분에 머물러 있네 It's my daily mood 하루에 끝에 서있는 나를 보네 어리숙한 순간에 감정들과 함께 난 매일 다른 나에게 얘길 하지 It's my daily mood 언제쯤 괜찮아질까 알 수 없는 나의 daily mood 누구에게도 말하지 못할 나도 모르는 나의 daily mood It's my daily mood It's my daily mood It's my daily mood It's my
  로맨틱 펀치  ,카니발 아무르 (자우림),미안해요 고마워요 즐거웠어요 산뜻하게 헤어져요 질척이지 말고 어쩌다 마주치면 모르는 사이인 양 눈치껏 모른 척 해주세요 미안해요 고마워요 즐거웠어요 산뜻하게 헤어져요 질척이지 말고 세상에 많고 많은 사람들 중에 어째서 단 한 사람만을 만나서 세상에 많고 많은 사람들 중에 한 가지 사랑만을 해야 하나요 사랑 받고 싶어요 사랑하고 싶어요 내일은 다시 새로운 방법으로 어제의 사랑으론 행복하지 않아요 오늘은 지금까지 몰랐던 사랑에 빠져보고 싶어요 달콤하게 징징대지 말아줘요 깨끗하게 사라져줘요 자존심쯤은 지켜줘요 눈물만은 참아줘요 인생사가 그런 것을 어쩌겠어요 이미 끝난 게임인 걸 아쉬워 말아요 세상에 많고 많은 사람들 중에 어째서 단 한 사람만을 만나서 세상에 많고 많은 사람들 중에 한 가지 사랑만을 해야 하나요 사랑 받고 싶어요 사랑하고 싶어요 내일은 다시 새로운 방법으로 어제의 사랑으론 행복하지 않아요 오늘은 지금까지 몰랐던 사랑에 빠져보고 싶어요 미안해요 고마워요 즐거웠어요 산뜻하게 헤어져요 질척이지 말고 미안해요 고마워요 즐거웠어요 산뜻하게 헤어져요 질척이지 말고 어쩌다 마주치면 모르는 사이인 양 눈치껏 모른 척 해주세요 미안해요 고마워요 즐거웠어요 산뜻하게 헤어져요 질척이지 말고 미안해요 고마워요 즐거웠어요 산뜻하게 헤어져요 질척대지 말고 미안해요 고마워요 산뜻하게 헤어져요
  소소한일상  ,You Are Special,너는 정말 모를꺼야 내가 얼마나 너 때문에 행복한지 바라보기만 해도 웃음이 나와 기쁨을 감출 수가 없어 넌 볼수록 참 아름답고 내 맘이 좋아 자꾸만 생각이나 네 작은 몸짓 하나하나 모두 다 한 없이 사랑스럽기만 해 You Are Special 내 마음을 가득히 채우는 이 세상 유일한 한 사람 이 세상이 이토록 아름다운 건 바로 네가 있기 때문이야 You Are Special 항상 똑같았던 내 세상을 아주 특별하게 한 한 사람 고마워 네가 이 세상에 있어서 너는 나의 기쁨 나의 사랑 너는 정말 모를꺼야 내가 얼마나 너 때문에 아팠는지 네가 우울하거나 힘이 없을 때 내 마음도 함께 아픈 걸 네가 슬플 때나 기쁠 때나 너와 항상 함께 해주고 싶어 네가 겪는 일들 하나하나 모두 다 너의 힘이 되주고 싶은 걸 You Are Special 내 마음을 가득히 채우는 이 세상 유일한 한 사람 이 세상이 이토록 아름다운 건 바로 네가 있기 때문이야 You Are Special 항상 똑같았던 내 세상을 아주 특별하게 한 한 사람 고마워 네가 이 세상에 있어서 너는 나의 기쁨 나의 사랑 사랑해 사랑해 사랑해 너를 너를 정말 사랑해 내 모든 걸 주고 싶어 영원히 너만 사랑할게 사랑해 사랑해 사랑해 너를 너를 정말 사랑해 내 모든 걸 주고 싶어 영원히 너만 사랑할게 영원히 너만을 사랑할게
