artist,title,lyric
  애즈원  ,Mama,나 다른곳에 있어도 그대의 맘을 알아요 나를 위하여 늘 기도하겠죠 혹시 아프지는 않을까 힘들어 울지 않을까 잘 지내는지 불안해하겠죠 그런 그대가 있어 너무나도 고마워요 지켜봐줘요 나의 미래들을 너의 맘속에 깊이 오늘도 그대의 사랑느껴요 힘들었던 시간들을 이겨내게 하죠 이제 약속할께요 돌려줄께요 고마운 그대 사랑에 나 보답해 드릴께요 늘 하늘같은 그대가 멀리 사라질까 두려워 볼 수 없어서 더 그런가봐요 많이 보고싶어질때면 더 미안한 맘이 들어 잘해내야지 다짐하게 하죠 그런 그대가 있어 너무나도 고마워요 지켜봐줘요 나의 미래들을 너의 맘속에 깊이 오늘도 그대의 사랑느껴요 힘들었던 시간들을 이겨내게 하죠 이제 약속할께요 돌려줄께요 고마운 그대 사랑에 나 보답해 드릴께요 언제라도 좋은 모습에 그대 웃을 수 있도록 그런 내가 될께요 너의 맘속에 깊이 오늘도 그대의 사랑느껴요 힘들었던 시간들을 이겨내게 하죠 이제 약속할께요 돌려줄께요 고마운 그대 사랑에 나 보답해 드릴께요
  범키  ,느껴 (My Everything),내 곁에 잠들어 있는 널 볼 때면 난 느껴 지금이 꿈이 아닌 것이 너무나 난 기뻐 우 우리 매일 함께 눈 뜨는 것 지금 이 순간이 선물인걸 날 보며 미소 짓는 너를 볼 때마다 나는 느껴 다시 너의 웃는 모습을 볼 수 있다는게 기뻐 서로의 두 손을 잡고서 기도하며 잠이 드는 것 하루하루가 기쁨인걸 yeah 오늘은 내 목소리로 널 노래할게 Cause you are my soul my song my love my everyday 내일은 내 두 눈으로 널 그려줄게 Cause you are my home my joy my life my everything my everything you Rejoice evermore that's right Pray without ceasing Give thanks in everything 늘 기적 속에 살면서도 잘 모르고 두 눈을 뜨고 있어도 나는 보이지 않았지 캄캄한 어둠 속에 빠져서 잊고 있었어 너와의 매일이 축복인걸 But when I find it hard to see that in the dark you pick me up you show me how to understand my life to carry on 이제 난 알아 다시는 절대 잊지 않을게 이 모든 것들이 행복인걸 오늘은 내 목소리로 널 노래할게 Cause you are my soul my song my love my everyday 내일은 내 두 눈으로 널 그려줄게 Cause you are my home my joy my life my everything You're my everything You're my everything 늘 헤매었던 날 Baby you're my everything 넌 온전하게 만들어 You're my everything My everything you I'd rather have bad times with you than good by myself cause you're my soul my song my love my everyday I'd rather have hard times with you than good by myself cause you're my home my joy my life my everything
  CHAI (이수정)  ,Fallin`,I keep on fallin' In and out of love With you Sometimes I love ya Sometimes you make me blue Sometimes I feel good At times I feel used Lovin you darlin' Makes me so confused I keep on Fallin' In and out of love with you I never loved someone The way that I love you Oh oh I never felt this way How do you give me so much pleasure And cause me so much pain Just when I think I've taken more than would a fool I start fallin' back in love with you I keep on Fallin' In and out of love with you I never loved someone The way that I love you Im still fallin' In and out of love with you I never loved someone The way that I love you I'm Still loving you
  Mariah Carey  ,Fantasy (Bad Boy Fantasy) (Feat. O.D.B.),Oh when you walk by every night Talking sweet and looking fine I get kind of hectic inside Oh baby I'm so into you Darling if you only knew All the things that flow through my mind But it's just a Sweet sweet fantasy baby When I close my eyes You come and take me On and on and on It's so deep in my daydreams But it's just a sweet sweet fantasy baby Images of rapture Creep into me slowly As you're going to my head And my heart beats faster When you take me over Time and time and time again But it's just a Sweet sweet fantasy baby When I close my eyes You come and take me On and on and on It's so deep in my daydreams But it's just a sweet sweet fantasy baby I'm in heaven With my boyfriend My laughing boyfriend There's no beginning and there is no end Feels like I'm dreaming but I'm not sleeping It's just a Sweet sweet fantasy baby When I close my eyes You come and take me On and on and on It's so deep in my daydreams But it's just a sweet sweet fantasy baby
  Stevie Wonder  ,Fun Day (Album Version),"This is fun day Yours and my day This is fun day, dee ooh, wee ooh  This is fun day On a fine day When the air is filled with tweeting birds that sing together in the sun This is your day Yours and my day When you feel the joy of children playing, laughing from dust till dawn On a day like this you share your joy with everyone Share your peace, and share your joy, and share your love  This is fun day On a fine day When you feel the urge of getting up to start-up with the break of dawn This is your day Yours and my day When you turn on your radio and hear the DJ playing your favorite song On a day like this not even bad can rub you wrong Cause you say it's okay cause it's your day  I'm gonna go out to the park Where you feel the joy in every heart That's what I need to start each day off right Oh, I'll find a place for you and me Underneath the shade of a lover's tree Fun day should be each day in all our lives  This is fun day Yours and my day This is fun day, dee ooh, wee ooh  This is love day A celebration A day on every calendar that's set aside for everyone to give This is your day Such a fun day I cannot believe a day like this has come that's if this really is I'm so very proud to say that for this day I've lived To see your peace, to see your joy, and to see your love  I'm gonna go out to the park Where you feel the joy in every heart That's what I need to start this day off right  Oh, I'll find a place for you and me Underneath the shade of a lover's tree Fun day should be each day in all our lives  This is love day A celebration A day on every calendar that's set aside for everyone to give  Let me solo, let me solo, let me solo...solo"
  폴킴  ,Game,Everytime I need you 이미 돌아선 너의 시선 날 괴롭히는 건지 정해진 그림 속 난 없어 별거 아닌 이유 winner 없는 싸움 알고 있어 we losing this 소릴 지르고 널 아프게 해도 놓지 못해 울고 있어 사랑 Its a lonely game 모두 다 알면서 멈출 수 없어 crazy right 사랑 such a shame I know it 괜한 기대만이 날 더 위태롭게 해 I love you I love you everyday I hate you I hate you everyday Wanting your attention 사랑이란 우스운 변명 언제나 그랬듯이 버려지는 건 my happiness Why you saying sorry 변하지 않을걸 알고 있어 we losing this 또 소릴 지르고 널 밀어내봐도 No I don’t wanna set you free 사랑 Its a lonely game ah 모두 다 알면서 멈출 수 없어 crazy right 사랑 such a shame I know it 괜한 기대만이 날 더 위태롭게 해 독하게 돌아서야 하는데 그러지 못해 one more chance 나만 아픈 거야 넌 아무렇지 않아 baby I’m losing my mind 사랑 Its a lonely game Lonely game alright 사랑 such a shame I know it 위태롭게 해 I love you I love you everyday I hate you I hate you everyday
  마이큐(MY-Q)  ,funkUsummer (slowed ver.),You say you wanna go 여기를 떠나 가 right now 너도 원하잖아 You know you rather be there 열기가 뜨거운 곳에 Go pack your bag we leavin’ 무슨 말을 해야할지 너와 나는 알고있잖아 부정적인 생각들은 버려 새 옷으로 갈아 입고 가 Summer wanna go wanna get away with my baby Back seat 모두 타 빈자리 없도록 fill me in Wanna love you until forever ever And I ma make your body go funk u summer funk u summer Wanna funk your body tonight And I ma make your body go funk u summer funk u summer You say you wanna go 파도가 부서지는 곳에 전에 가 봤잖아 가봤잖아 너 뭐가 그리 두려운건데 너 원하잖아 uh Go pack your bag we leavin’ 무슨 말을 해야할지 너와 나는 알고있잖아 Say what you wanna say and do what you wanna do 부정적인 생각들은 버려 새 옷으로 갈아 입고 가 Summer wanna go wanna get away with my baby Back seat 모두 타 빈자리 없도록 fill me in Wanna love you until forever What I gotta do to you baby Pink색 반바지 얼음 넣은 싸구려 화이트 와인 Let me rock your body tonight 선탠 파도 소리는 내 BGM 전부 다 느껴 I ma love you forever ever And I ma make your body go funk u summer funk u summer Wanna funk your body tonight And I ma make your body go funk u summer funk u summer Na na na na na na na na Na na na na na na na na Na na na na na na na na Na na na na na na na na Na na na na na na na na Na na na na na na na na
  R. Kelly  ,I Decided,"I decided to stay home tonite I decided I`ma treat you right I decided to be there for you Decided to be on my P`s and Q`s I decided to give up my friends Decided I`ma take you out weekends Decided to give you a reason to trust These are decisions that I make for love Enough is enough no more running around (Searchin` for what`s right here at home) Because my luck is `bout to turn around (And I just can`t keep doin` you wrong) Girl I take it for granted that you will be here always (Tired of this ego trip) `Cause soon you`ll be searchin` for another man And I just can`t have that happen to me I decided to stay home tonite I decided I`ma treat you right I decided to be there for you Decided to be on my P`s and Q`s I decided to give up my friends Decided I`ma take you out weekends Decided to give you a reason to trust These are decisions that I make for love Now I`ve had about all that I can stand no more (I`m turnin` in my playa`s card) See I`m retirin` from the secret life I chose (Cause I just can`t keep breakin` your heart) It was silly of me to be the way that I was (First was blind, but now I see) Baby, soon you`ll be sayin` I`m fallin` out of love And I just can`t let it happen whoa whoa I I decided to stay home tonite I decided I`ma treat you right I decided to be there for you Decided to be on my P`s and Q`s I decided to give up my friends Decided I`ma take you out weekends Decided to give you a reason to trust These are decisions that I make for love When tha morning comes, you see the sun will shine on you and me Was on my way to losin` you, until` I found reality So cast away your doubts and fears, cause from now on I`ll be right here For always Forever more, I decided I decided to stay home tonite I decided I`ma treat you right I decided to be there for you Decided to be on my P`s and Q`s I decided to give up my friends Decided I`ma take you out weekends Decided to give you a reason to trust These are decisions that I make for loves Now I`ve had about all that I can stand no more (I`m turnin` in my playa`s card) See I`m retirin` from the secret life I chose (Cause I just can`t keep breakin` your heart) It was silly of me to be the way that I was (First was blind, but now I see) Baby, soon you`ll be sayin` I`m fallin` out of love And I just can`t let it happen whoa whoa I Girl I`m going to dump my friends Yes I will Truly I will We are going to be together on the weekend Whoa, whoa See these are the decisions I made for love For the two of us Get up off this bull and rebuild your trust Yeah, yeah, oh noooooo, whoa There will be No more cheatin` No more creepin` No more fuckin` No more sneakin`"
  Red House  ,Stop the rain,The place you took me I was happy at that time But now I’m stupid I lost myself & I um give me a one more chance Then we could be alright Then we could be alright Then we could be alright 딱 맞게 I’ll be your side 딱 맞게 I’ll be your side Drinkin’ in the bar And playin’ with some girls We are all grown up 새벽에 눈을 뜨고 큰 방을 어질러도 You won’t be mine 누군가 있어 Wherever I go 불이 꺼져도 혼자인 적도 없었지 내 곁엔 someone is around me but I'm still in the rain Oh we can get back soon 내 원래 자리로 돌아갈 그때쯤 너를 찾아야 Oh we can get back soon 나처럼 다시는 떠나지 않게끔 꼭 시간안에 너를 찾아 ooh ooh ooh ooh 딱 맞게 I’ll be your side 꼭 시간안에 너를 찾아 ooh ooh ooh ooh 딱 맞게 I’ll be your side I’m thinkin’ all the time remindin’ all my fault How can I bring you back um 난 너의 곁에 내가 없는게 다 운명일까 걱정 돼 I just wanna hold I just wanna go I just wanna hold the time I just wanna go Oh Oh we can get back soon 내 원래 자리로 돌아갈 그때쯤 너를 찾아야 Oh we can get back soon 나처럼 다시는 떠나지 않게끔 꼭 시간안에 너를 찾아 ooh ooh ooh ooh 딱 맞게 I’ll be your side 꼭 시간안에 너를 찾아 ooh ooh ooh ooh 딱 맞게 I’ll be your side
  Janet Jackson  ,No Sleeep (Feat. J. Cole),"Plush You're missing me, I'm missing you Whenever we meet, we ain't gonna get no sleep When I get to be together with you It's fait accompli, we ain't gonna get no sleep A vision rolling round in my head, but I don't really talk about it I'm loving what you're doing to me and I don't wanna do without it Day and night, I dream of us doing whatever But I guess I'll have to wait until that day comes You're missing me, I'm missing you Whenever we meet, we ain't gonna get no sleep When I get to be together with you It's fait accompli, we ain't gonna get no sleep 48 hours of love, It's gonna be a weekend marathon So you better get ready, my king Cause I'ma be the queen of insomnia Stay wide awake for every moment we spend together Cause every second you're away feels like forever You're missing me, I'm missing you Whenever we meet, we ain't gonna get no sleep When I get to be together with you It's fait accompli, we ain't gonna get no sleep Don't have time to sleep, but we can dream So think outside the box, my baby Show me how much you were missing me I'll read between the lines and I sure hope it rains Cole world yeah, yeah, yeah, yeah, yeah Yeah turn the overall volume up a lil bit, up a lil bit How's that yeah that's nice We ain't gonna get no sleep we not, just a lil more, just a lil more, now, just a lil more now We ain't gonna get no sleep we not, just a lil more, just a lil more, now, just a lil more now We ain't gonna get no sleep I go my way, you go yours You taste real life, I taste tours alright Sweet at first, but after a while Too much sugar, they say, is bad for your smile And I wear a frown now, cause I miss real I miss a warm house, and home cooked meals And you miss junk food, that's why we work You bring cooked food and I bring dessert Uh, and meet up at the place that we always do The one swimming through my mind, that was always you Our time together has inspired a song or two Or three, or four, or more, mi amor I'm sure, either you're the one or I'm caught in the matrix Staying up for hours while we talk and get wasted Not from weed smoke, or this cheap wine Drunk off love we both feel deep down But too scared to say cause we know how this seems Thinking, maybe we'd be better off friends with benefits For the moment this adrenaline, got me feeling like a kid again Butterflies like MJ, had to fit it in My schedule, check the bezel, gotta escape by six Damn, how'd it get so late so quick The sun rising already until the next time I love diving in your mind and coming out with every diamond I can find No sleep, no sleep You're missing me, I'm missing you Whenever we meet, we ain't gonna get no sleep we not, just a lil more, just a lil more, now, just a lil more now When I get to be together with you It's fate accompli just a lil more, now, just a lil more now we ain't gonna get no sleep no sleep Plush"
  Victor Davies  ,Would You Believe In Me,If I gave you my word that I loved you Would you believe in me? If I counted all the stars high above you Would you believe in me?  I’d use my soul to bring you pleasure My heart to bring you joy I’d build a love between us No other can destroy  I’d awake you with songs in the morning If you believe in me I would bring to your heart sweet contentment If you believe in me  This is the way of our fantasy And they say love ain’t what it used to be To be told we’re too old to let happiness unfold In our minds we are free so believe in me Believe in me
  세이  ,Broken,Yea yea EMO Yea yea still broken Yea yea Yea yea Still Broken Baby I’m into you 난 너 때문에 모든 것이 아름다워 Losing myself 널 위해서 이 세상이 없어져도 난 행복해 girl 너와 함께 보낸 추억 In my head and losing control 하나뿐인 멜로디 You and I a chemistry 널 놓치기 싫어 하루하루가 즐거워 I miss ya baby Girl you know what you mean to me 처음 본 순간 i would see 니 목소리가 좋아 모두 다 좋아 I just wanna hold ya 하루하루 니 생각나 Girl 넌 내 하나뿐인 Star 놓친 게 후회돼 내 머리 속엔 Over and Over again 내 연락은 씹지 좀 마 i just want you back with me baby 모두 다 후회돼 내 머리 속엔 Over and Over again Yea yea Over and Over Yea yea Over and over Yea yea Still broken 내가 고백할게 니가 돌아 오는 순간 내가 맞춰갈게 내가 부족했던 판단 니가 원하는 대로 해줄 테니까 마지막 기회는 또 없을까 시간은 돌릴 수 없을까 Fill me up u gotta fill me up like buttercup 널 다시 놓치지 않을게 날 한번만 믿어봐 하루하루 니 생각에 빠져버려 멍한 내 모습이 너무나 한심해 you feel me right Girl you know what you mean to me 처음 본 순간 i would see 니 목소리가 좋아 모두 다 좋아 I just wanna hold ya 하루하루 니 생각나 Girl 넌 내 하나뿐인 Star 놓친 게 후회돼 내 머리 속엔 Over and Over again 내 연락은 씹지 좀 마 i just want you back with me baby 모두 다 후회돼 내 머리 속엔 Over and Over again Yea yea Over and Over Yea yea Over and over Yea yea Still broken
"  바이브 ,  포맨 ,  벤 ,  임세준 ,  미(MIIII) ,  민연재  ",Merry Christmas,I wish you a merry Christmas We wish you a merry Christmas We wish you a merry Christmas We wish you a merry Christmas We wish you a merry Christmas and a happy new year We wish you a merry Christmas We wish you a merry Christmas We wish you a merry Christmas and a happy new year Merry Merry Merry Christmas 그대와 날 위해 준비된 이 밤 Merry Merry Merry Christmas 꿈같은 오늘이 온 거야 모두가 두근거리는 오늘 이 밤 아껴둔 내 사랑 드릴게요 하얗게 흰 눈이 내리는 밤 그대의 소원을 말해봐요 We wish you a merry Christmas We wish you a merry Christmas We wish you a merry Christmas We wish you a merry Christmas and a happy new year We wish you a merry Christmas We wish you a merry Christmas We wish you a merry Christmas and a happy new year Merry Merry Merry Christmas 우리가 그토록 기다린 이 밤 Merry Merry Merry Christmas 꿈 같은 그 날이 온 거야 모두가 두근거리는 오늘 이 밤 아껴둔 내 사랑 드릴게요 하얗게 흰 눈이 내리는 밤 그대의 소원을 말해봐요 We wish you a merry Christmas and a happy happy new year 손꼽아 기다려온 오늘 이 밤 이 시간은 너를 위해 쓸게 baby hold me tight 산타가 되어줄게 니가 원하는 걸 모두 다 줄게 We wish you a merry Christmas I'll be your present We wish you a merry Christmas We wish you a merry Christmas We wish you a merry Christmas and a Happy Happy Happy new year Merry Merry Merry Christmas 그대와 날 위해 준비된 이 밤 Merry Merry Merry Christmas 꿈같은 오늘이 온 거야 세상 모두가 설레이는 오늘 밤 그대와 내가 함께라면 하얗게 흰 눈이 내리는 밤 내 모든 사랑을 드릴게요 We wish you a merry Christmas I wish you a merry Christmas We wish you a merry Christmas
  dvsn  ,In + Out,Now tell me that you've always known my name I tell you that I've always fucked with you Just tell me that you like it hardcore girl And I'll do what you say And I wanna know how you feel inside And if imagination serves me right all night Tell me to go Out in Out in Out in Out Tellin' me Out in Out in Out in Out You’re tellin' me Out in Out in Out in What you wanna do In out In out I wanna go in and out of your body baby Tell me that you've always been my fan And everything you heard turned out so true I'm kneeling by your body baby kissing on your throne Now let me crown your highness baby your highness babe And I wanna know how you feel inside And if imagination serves me right all night Tell me to go Out in Out in Out in Out Tellin' me Out in Out in Out in Out You’re tellin' me Out in Out in Out in What you wanna do In out In out I wanna go in and out of your body baby Go in and out of your body baby Yeah yeah oh yeah
  Red House  ,Finna go lovin you,싫어하는 부류와 동시 커져가는 우주 철학적인 물음과 함께 흘러간 스물 난 나이값이 힘들고 맞서 싸우는 부류 어른의 나이지만 피하기만 하는 주류 No thanks that alcohol 난 꼬였고 I’m sick of you now Don’t take it personal It doesn’t matter Just my character I cannot lie 이 피로감 이해를 못해줘도 I don’t care finna go loving’ you Nobody else above you _uck all the people I know 귀찮아 모든게 finna go loving’ you Nobody else above you _uck all the people I know 귀찮아 모든게 finna go loving’ you 미워하는 부류와 내가 사랑하는 사람 그 주변엔 무음과 싸워 이겨내는 사람 사장이란 직책을 단 유일무이한 사람 너 힘든걸 알아 나도 마찬가지야 _uck the night 우수에 찼던 내 두 눈은 _uck compromise Don’t hit me up Don’t hit me up No thanks that alcohol 난 꼬였고 I’m sick of you now Don’t take it personal It doesn’t matter Just my character I cannot lie 이 피로감 이해를 못해줘도 I don’t care finna go loving’ you Nobody else above you _uck all the people I know 귀찮아 모든게 finna go loving’ you Nobody else above you _uck all the people I know 귀찮아 모든게 finna go loving’ you Nobody else above you _uck all the people I know 귀찮아 모든게 finna go loving’ you Nobody else above you _uck all the people I know 귀찮아 모든게 finna go loving’ you
  The Internet  ,Partners In Crime Part Three,We can conquer the world Just you and me no one else Tell me if thats cool What chu wanna do Ahh Ohhh Guns drawn in an all black car Bustin at all the lames Who got something to say about us We can rob this world blind And maybe next time They'll think twice Before they try fuckin with us Just imagine what it be like be like If you and me ruled everything Would it be Cool Or Would it be cool Can you imagine what it be like be like If you and me ruled everything Would it be Cool Or Would it be cool If we would conquer the world Would you be down to roll with me Like partners in crime Til the end of time Guns drawn in an all black car Bustin at all the lames Who got something to say about us We can rob this world blind And maybe next time They'll think twice Before they try fuckin with us Just imagine what it be like be like If you and me ruled everything Would it be Cool Or would it be cool Can you imagine what it be like be like If you and me ruled everything Would it be Cool Or Would it be cool
  에보니힐  ,Soulmate,오늘 난 그대에게 하지 못한 말 하려해요 오래 참아 왔던 말 그댈 내 앞에 두고 왜 이렇게 내 마음이 떨려 많이 준비했는데 babe 알고있죠 그대 눈을 바라보면요 떨리는 그 눈빛이 나를 원한다면 오늘밤 날 안아봐도 되요 나의 손을 잡아요 오늘이 우리둘의 마지막 밤이란 걸 너는 알고 있니 내일이면 나를 볼 수 없어 두려움은 모두 버려요 그대 떨고 있는 내 어깨 굳게 닫힌 네 입술 흔들리는 내 눈빛 부드러운 네 숨결 잡힐 듯 한 그림자 희미해진 기억들로 남기게  Baby 곁에서만 바라보던 날 이제 넌 나와 함께 하겠니 I know 조금만 더 기다려줘 다가오는 그대 그대 맘을 알아요 Oh baby 곁에 있어줘  오늘이 우리둘의 마지막 밤이란 걸 너는 알고 있니 내일이면 나를 볼 수 없어 두려움은 모두 버려요 그대 떨고 있는 내 어깨 굳게 닫힌 네 입술 흔들리는 내 눈빛 부드러운 네 숨결 잡힐 듯 한 그림자 희미해진 기억들로 남기게
  롬앤틱  ,스친 후 (With. 홍혁수 Of 지어반),우연히 지나가다 스친 익숙한 향기에 취해 괜히 또 나는 의기소침해져 아마도 그녀 향기 같아 너의 볼에 살짝 입맞춤할 때도 나의 품에 너를 담아 둘 때도 늘 나던 향기가 지금 스쳐가네 그녀도 알고 있겠지 내 어깨를 스친 후 넌 돌아보지 않았어 너의 어깨를 스친 후 난 돌아보고 말았어 너와 함께 나눈 추억들은 없어 내가 너에게 준 사랑은 없어 늘 나던 향기가 지금 스쳐가네 그녀도 알고 있겠지 내 어깨를 스친 후 넌 돌아보지 않았어 너의 어깨를 스친 후 난 돌아보고 말았어 내 어깨를 스친 후 넌 돌아보지 않았어 너의 어깨를 스친 후 난 돌아보고 말았어 너와 스친 후
