artist,title,lyric
  JRDN  ,Like Magic,your love is like magic magic magic your love is like magic magic magic the sky never been so blue the grass never looked so green and i i wanna give my all to you cause i never felt this feeling in my life got me going shorty your so bad my money never went so fast can't front your the best i ever had it was undiscovered love in you i found i just gotta have it i reach out and grab it your love is like magic baby uh uh oh your love is like magic baby uh uh oh can't even imagine you were miles away somewhere in outer space and just to see your face i'd have to find a way baby uh uh oh no this isn't average baby uh uh oh your love is like magic magic magic yea yea yea your love is like magic magic magic yea yea yea your love is like magic magic magic the airs never been so clear the months used to feel like years but that changes every time your near it's like i'm starting over everyday something sexy bout the way you smile it pulls me in and i just don't know how i'm hypnotized i'm under your spell baby i'm not going anywhere i just gotta have it i reach out and grab it your love is like magic baby uh uh oh your love is like magic baby uh uh oh can't even imagine you were miles away somewhere in outer space and just to see your face i'd have to find a way baby uh uh oh no this isn't average baby uh uh oh your love is like magic magic magic yea yea yea your love is like magic magic magic yea yea yea your love is like magic magic magic i know it's hard to believe it until the first touch we magicians know how to make you all believe in us when you believe in us there ain't no stopping us cause it's your love you know i just can't get enough oooh ooh i just gotta have it i reach out and grab it your love is like magic baby uh uh oh your love is like magic baby uh uh oh can't even imagine you were miles away somewhere in outer space and just to see your face i'd have to find a way baby uh uh oh no this isn't average baby uh uh oh your love is like magic magic magic yea yea yea your love is like magic magic magic yea yea yea your love is like magic magic magic your love is like magic magic magic your love is like magic magic magic
  Ashanti  ,So Over You,Verse 1  I must admit I was set trippin' early on So not my self boy you had me completely gone I lost my cool when I found out 'bout you And how cowardly you move I'm just glad that now I'm through I'm so over you  Chorus  I am finished cryin over your lyin' over denyin' I am so over you so over you Said I'm finished with it ain't no more hurtin' over here I done lost my cool for just a minute but I'm back and I'm doin my thing again Said I'm finished with it ain't no more hurtin' over here And I got my mind right ain't no more late nights waitin' up on ya  I'm so over you over you over you over you over you now I'm so over you over you over you over you over you now I'm so over you  Verse 2  Now we done been through this same cycle time and time Let you back in even when you broke this heart of mine I've had enough boy I swear this time I'm done You can pack up all your stuff frankly I don't give a f*ck I'm so over you  Chorus  I am finished cryin over your lyin' over denyin' I am so over you so over you Said I'm finished with it ain't no more hurtin' over here I done lost my cool for just a minute but I'm back and I'm doin my thing again Said I'm finished with it ain't no more hurtin' over here And I got my mind right ain't no more late nights waitin' up on ya I'm so over you over you over you over you over you now I'm so over you over you over you over you over you now  Bridge  I got my swagga back again and no I'm not tryna be your friend And no ain't no hittin' this again Ain't no late nights waitin' up on ya cause I'm so over you  Said I'm finished with it ain't no more hurtin' over here I done lost my cool for just a minute but I'm back and I'm doin my thing again Said I'm finished with it ain't no more hurtin' over here And I got my mind right ain't no more late nights waitin' up on ya  Said I'm finished with it ain't no more hurtin' over here I done lost my cool for just a minute but I'm back and I'm doin my thing again Said I'm finished with it ain't no more hurtin' over here And I got my mind right ain't no more late nights waitin' up on ya   KL.
  Eric Benet  ,Making Love,It feels unbelievable when my body's wrapped around you Forever could never be enough But it's not through physical When my soul is trying to reach you The heart is the way to making love Now I've come to understand Through a life of deeper meaning And wanting to love you even more The touch is divine but deeper inside You swear we should keep love alive Love has answered my call What has taken me All of this time I've been learning the way to Make love right All my days and my nights All of my life I Wanna spend it with you Making love I want to lay you down On the bed of our emotions Emrace you with tenderness and truth yes I'll be inside of you With the strength of my devotion And cherish each moment shared with you One rhythm of life body and mind Leaving this whole world behind In the heat of it all Only deeper we'll fall All of this time I've been learning the way to Make love right All my days and my nights All of my life I Wanna spend it with you Making love Love made every moment Every word we say Love found in the pleasure in the pain For always Days fall by the second and the years will fade But I won't waste the time Cuz I'm giving you All of my life I keep on learning new ways to Make love right And with all of my might Day and night I wanna spend it with you Making love making love All of this time I've been learning how to make Love right Everyday and all of my life I I want to spend with you Making love
  비니셔스 (Vinicius)  ,숨 (Feat. 김아일),오늘도 누워 너의 얘길 들어 긴 말없이도 너는 나를 알아 내가 잊었던 슬픔도 웃는 모습도 넌 기억해 내 모든 게 들이 쉬라고 숨을 조일 때 넌 날 쉬게 해 Ooah Can't fight with love Don't mess with love Ooah Can't fight with love Don't mess with love 힘들게만 느껴져 왔던 만남 너를 만나고 나 Now it all looks easy 이제 날숨의 타이밍 다시 들이쉴 생각에 겁이 나는 순간 너의 숨이 날 반겨 Satisfaction for hours When you inhale I exhale 넌 차오름을 뱉어 곧 난 반대의 무언가를 필요로 Like H2 meeting O 난 네가 찾던 홈 넌 나에게 Exit 내가 잊었던 슬픔도 웃는 모습도 넌 기억해 내 모든 게 들이 쉬라고 숨을 조일 때 넌 날 쉬게 해 Now what she do and what he do 모두 들이쉬라고 해 숨이 차오를 때 Now what she do and what he do 정말 참을 수 없게 숨이 차오를 때 Yea 우리 둘 man 우리 둘 난 너의 집 넌 나에게 탈출구 yea 우리 둘 man 우리 둘 난 너의 집 넌 나에게 탈출구 Ooah Can't fight with love Don't mess with love Ooah Can't fight with love Don't mess with love 넌 넌 나의 숨 넌 넌 나의 숨 넌 넌 나의 숨 넌 넌 나의 숨 넌 넌 나의 숨 넌 넌 나의 숨 넌 넌 나의 숨 넌 넌 나의 숨
  빅마마  ,The First Noel,"The first Noel the angels did sing Was to certain poor shepherds In fields as they lay  In fields where they lay keeping their sheep On a cold winter's night that was so deep  Noel, Noel, Noel, Noel Born is the king of Israel  oh- they looked oh they looked up and saw a star shining in the east beyond them far  Noel, Noel, Noel, Noel Born is the king of Israel  And by the light of that same star Three wise men came from country far To seek for a king was their intent And to follow the star wherever it went  Noel, Noel, Noel, Noel Born is the king of Israel -"
  Sergio Sylvestre  ,Let It Snow,Oh the weather outside is frightful But the fire is so delightful And since we've no place to go Let it snow let it snow let it snow It doesn't show signs of stoppin' And I brought some corn for poppin' The lights are turned way down low Let it snow let it snow let it snow When we finally kiss good-night How I'll hate going out in the storm But if you really hold me tight All the way home I'll be warm The fire is slowly dying And my dear we're still good-bye-ing But as long as you love me so Let it snow let it snow let it snow It doesn't show signs of stoppin' And I brought some corn for poppin' The lights are turned way down low Let it snow let it snow let it snow Pa pa pa And all the way home I'll be warm And all the way home I'll be warm Oh the weather outside is frightful But the fire is so delightful And since we've no place to go Let it snow let it snow let it snow Let it snow let it snow Let it snow ooh
  K. Michelle  ,How Do You Know?,"I'd rather be cold than wrapped up in love Can't seem to get it right, can't seem to get it right Fill me up and still leave me a little drive Love comes then cleans you out, love's got an enemy now How can I forget about the past So easily and start new again How do you know How do you know When you givin' him everything And he still made a mess of things How do you know Oh it feels so good in the moment But it's just the moment That'll soon be over Once my thoughts are sober And I'll trade it all, love Just to believe again Looking for reasons why It's never the right time How can I forget about the past So easily and start new again How do you know How do you know When you givin' him everything And he still made a mess of things How do you know We don't understand his words until it hurts Sometimes we're so blinded and always reminded So the fear made me mess it up again Maybe it was me, maybe it was him But I just don't know Don't know which way to go How do you know How do you know When you givin' him everything And he still made a mess of things How do you know"
  Whitney Houston  ,Greatest Love of All (Live),I believe the children are our future Teach them well and let them lead the way Show them all the beauty they possess inside Give them a sense of pride to make it easier Let the children's laughter remind us how we used to be Everybody's searching for a hero People need someone to look up to I never found anyone who fulfilled my needs A lonely place to be and so I learned to depend on me I decided long ago Never to walk in anyone's shadows If I fail If I succeed At least I lived as I believed No matter what they take from me They can't take away my dignity Because the greatest love of all is happening to me I've found the greatest love of all inside of me The greatest love of all It is easy to achieve Learning to love yourself it is the greatest greatest love of all I believe the children are our future Teach them well and let them lead the way Show them all the beauty they possess inside Give them a sense of pride to make it easier Let the children's laughter remind us how we used to be I decided long ago Never to walk in anyone's shadows If I fail If I succeed At least I lived as I believed No matter what they take from me They can't take away my dignity Because the greatest love of all is happening to me to me to me I've found the greatest love of all inside of me The greatest love of all is easy to achieve Learning to love yourself it is the greatest greatest love of all And if by chance that special place That you've been dreaming of Leads you to a lonely place Find your strength in love
  Ve-known (베논)  ,Drink N Love ( Ft. EDdmin ),Drink and Love baby Dom peri yeah Drink and Love baby all night long Drink and Love babe with somebody yeah Drink and Love baby all day long Drink and Love baby don’t care about it Drink and Love babe with somebody now Drink and Love baby Drink and Love baby Drink and Love baby with somebody now 이 밤을 혼자 보내기엔 너무 아까워 너와나의사인 너무나도 가까워서 집에 들가기엔 우린 너무 뜨거워 오늘이 마지막일지라도 상관없어 탕 하고 들어와 내맘을 여네 쿵 하고 들어와 내맘에 골인 탕 하고 들어와 쿵하고 골인 너무 답답해서 네게 knock knock했어 그녀를 처음본순간 난 어리바리 용길내서 말을건뒤 데려갔지 나의거릴 그녀와 함께 걷는 홍대거리 어색하기싫어 나는 찾고있지 주젯거릴 다신 오지않아 이밤은 가지 않을거야 이밤은 그러니깐 오늘밤은 JUST Drink and Love Baby Drink and Love baby Dom peri yeah Drink and Love baby all night long Drink and Love babe with somebody yeah Drink and Love baby all day long Drink and Love baby don’t care about it Drink and Love babe with somebody now Drink and Love baby Drink and Love baby Drink and Love baby with somebody now Drink and love 몸이 타 오르게 Treat me like gutter though Never mind Start a little fire with me yeah Start a little fire Baby Getting Drunk 너와나 Baby 오늘만을 tonight 조금만 더 더 now Baby don’t matter don’t mind And i’m blacking out Fallin over you now
  Harleighblu  ,Sittin` By The Window (Roce Ver.),"How deep's your love, how deep's your love for me Flowers they're amazing, you and me we're working Think of me, I'm not joking I think of you, we do this thing How deep's your love, how deep how deep's your love for me how deep We could just be, just us, you and me, just there pleasantly, doing what we usually do Yeah yeah How deep's your love, how deep is your love how deep's your love for me Hands held so tight, think we fit we're just right, battlin' together, although we fight Until we make up at the end of the night How deep's your love, how deep's your love for me How deep's your love, how deep's your love for me How deep's your love, how deep's your love for me"
  Mary J. Blige  ,Little Drummer Boy,Come they told me pa rum pum pum pum A new born King to see pa rum pum pum pum Our finest gifts we bring pa rum pum pum pum To lay before the King pa rum pum pum pum rum pum pum pum rum pum pum pum So to honor Him pa rum pum pum pum When we come Little Baby pa rum pum pum pum I am a poor boy too pa rum pum pum pum I have no gift to bring pa rum pum pum pum That's fit to give the King pa rum pum pum pum rum pum pum pum rum pum pum pum Shall I play for you pa rum pum pum pum On my drum Mary nodded pa rum pum pum pum The ox and lamb kept time pa rum pum pum pum I played my drum for Him pa rum pum pum pum I played my best for Him pa rum pum pum pum rum pum pum pum rum pum pum pum Then He smiled at me pa rum pum pum pum Me and my drum Me and my drum Come they told me pa rum pum pum pum Me and my drum When we come Me and my drum
  SWV  ,You`re Always On My Mind,"You're always on my mind (4x)  (Verse 1) [Coko] Boy, I can't seem to get you outta my head But there's something about you that makes me smile Don't change, I like the way you make me feel Can we take our time and do this for a while [Brian Morgan] Girl, I never thought I'd find someone to love me Now, you're the only one I want in my life And the special touch you give comes from you only I guess that's why you're always on my mind  (Chorus) You're always on my mind You're always on my mind You're always on my mind You're always on my mind  (Verse 2) [Coko] Sometimes, I find it hard to concentrate Because thoughts of us together fill my head When you're away, it's hard to sleep at night So, my pillow, like my thoughts of you, I hold tight [Brian Morgan] Girl, I never thought I'd find someone to love me Now, you're the only one I want in my life And the special tough you give comes from you only I guess that's why you're always on my mind  (Chorus)  (Bridge 4x) Thinking 'bout ya, thinking 'bout ya, I can't stop thinking 'bout ya (On my mind)  Repeat Chorus until fade"
  미아 (Mia)  ,Insta lover,이상한 꿈을 꾼 날이면 일어나 네가 잘 있는지 확인해 언제나 어제 널 본 것 같은 느낌이 들다가 네모난 화면 속 갇힌 널 한동안 보고 싶어 용기 내 말해보자 언제까지 이럴 수는 없어 나 너에게 가고 싶어 자꾸 반복되는 맘 umm i'm so i'm so You’re just Insta lover 만질 수 없는 Insta lover You’re just Insta Insta Insta lover 이제 움직이는 니가 보고파 화면 속 메세지 말고 진짜 너의 목소리를 너의 그 미소를 나 보고 싶어 안고 싶어 가지고 싶어 다 Insta lover no more Insta lover no more Insta Insta Insta lover 마지막으로 널 본 날이 언젠지 어떤 핑계로 다시 안녕 말 걸지 너도 날 계속 확인하는 걸 알지만 우린 여기 갇혀있는 걸 한동안 좋았잖아 너도 나와 같잖아 언제까지 이럴 수는 없어 너에게 가고 싶어 자꾸 반복되는 맘 um i'm so i'm so You’re just Insta lover 만질 수 없는 Insta lover You’re just Insta Insta Insta lover 이제 움직이는 니가 보고파 화면 속 메세지 말고 진짜 너의 목소리를 너의 그 미소를 나 보고 싶어 안고 싶어 가지고 싶어 다 Insta lover no more Insta lover no more Insta Insta Insta lover 나의 Insta lover 나의 Insta lover 이미 멀리 가 버린 건 아니라고 해줘 내 모든 하루 끝 곁에 니가 있었으면 이젠 말해줘 baby we already know ohh ohh ohh ohh ohh ohh ohh ohh ohh ohh ohh ohh ohh 널 보고 싶어 안고 싶어 가지고 싶어 난 다 no more Insta lover no more Insta lover no more Insta Insta Insta lover
  Whitney Houston  ,All At Once,All at once I finally took a moment And I'm realizing that You're not coming back And it's finally hit me all at once All at once I've started counting teardrops And at least a million fell My eyes began to swell And all my dreams were shattered all at once Ever since I met you You're the only love I've known And I can't forget you Though I must face it all alone All at once I'm drifting on a lonely sea Wishing you'd come back to me And that's all that matters now All at once I'm drifting on a lonely sea Holding on to memories And it's hurt me more than you know So much more than it shows All at once All at once I looked around and found that you were With another love In someone else's arms And all my dreams were shattered all at once All at once the smile that used to greet me Brightened someone else's day She took your smile away And left me with just memories all at once Ever since I met you You're the only love I've known And I can't forget you Though I must face it all alone All at once I'm drifting on a lonely sea Wishing you'd come back to me And that's all that matters now All at once I'm drifting on a lonely sea Holding on to memories And it's hurt me more than you know So much more than it shows All at once All at once I'm drifting on a lonely sea Wishing you'd come back to me And it's hurt me more than you know So much more than it shows All at once And that's all that matters now All at once I'm drifting on a lonely sea Wishing you'd come back to me
