artist,title,lyric
  유라윤  ,우리 둘이서,처음 만났었던 그 날 그 때 내 눈에 아직 남아있죠 오랜 시간 지나 오늘 우린 여전히 예쁘기만 하죠 Would you marry me 사랑해 너만을 Would you marry me I love you love you Would you marry me 평생을 우리 둘이 나랑 결혼해줘요 시원한 바람 불던 그 때 그대 아직도 많이 생각나죠 이제 포근한 이불이 되어 내 옆에 따뜻하게 안아줘요 Would you marry me 사랑해 너만을 Would you marry me I love you love you Would you marry me 평생을 우리 둘이 나랑 결혼해줘요 새 하얀 도화지에 너 라는 물감으로 나를 물들여줘 아직은 부족하지만 우리 둘이서 만들어가요 Would you marry me 사랑해 너만을 Would you marry me Would you marry me 평생을 우리 둘이 나랑 결혼해줘요 Would you marry me Would you marry me Would you marry me 너무 고마워요
"  정인 ,  노영심 ,  정재일  ",새벽길,새벽에 일어나 어두컴컴한 길을 걸어가보세  구둣방 할아범 벌써 일어나 일판 벌려 놓았네  밤새 하늘엔 별들이 잔치 벌렸나 어느 초라한 골목엔 버려진 달빛 고였나 희뿌연 바람이 헤진 옷새로 스며들어 오는데  해말간 새벽길 맨발로 걸어 봐도 좋겠네  예배당 종소리 깔린 어둠을 몰아가듯 울리네  밤새 하늘엔 별들이 잔치 벌렸나 어느 초라한 길목엔 버려진 달빛 고였나 희뿌연 바람이 헤진 옷새로 스며들어 오는데
  스틸 (Steel)  ,Cuz You (feat. Charcoal),난 거짓말은 안 해 특히 더더욱 너한테는 나는 네 생각 말곤 안 해 넌 지금 나랑 사랑해 Baby 넌 내 모든 것을 알아 누구에게도 말하지 못한 것도 입장 바꿔 생각해도 아마 네가 나라도 너에게 반해버릴 거야 되고 싶어 너의 session 넌 나의 motivation 난 지금 몰입해있어 뭐든지 준비되어있어 널 안아줄게 안아줄래 잡은 두 손 놓으면 안 돼 솔직히 말할게 전부 Cuz you 사실 이런 성격 아니야 baby You 이렇게 every day 난 너와 You 계속 every weekend 너와 You 솔직하게 말해 줄게 거짓말은 나는 못해 맘이 이끄는 대로만 해 그래서 널 보면 웃네 I don’t lie don’t lie 그럴 필요 없잖아 내가 알고 있는 미사여구는 다 너의 것이니까 Sometimes i try to hide But 주체가 안 되잖아 가끔 넌 나보다 날 더 잘 아는 것 같아 baby 아깝지 않아 지금 이 순간 모든 걸 가질 사람은 너야 말 못 한 비밀까지도 조금 더 가까이 와줘 솔직히 말할게 전부 Cuz you you 사실 이런 성격 아니야 baby You 이렇게 every day 난 너와 You 계속 every weekend 너와 You
  정인  ,살다가보면,오늘은 날씨가 너무 좋아 눈부셔 햇살도 따뜻해 웬일인지 안 풀리던 일도 내일이면 잘될 것만 같은데 날이 저물고 집에 돌아오는 길이 쓸쓸하게 느껴질 때마다 괜찮을 거야 혼잣말을 하곤 해 나도 모르게 자꾸 흥얼대 하루를 살다가 보면 다 괜찮아지겠지 이렇게 살다가 보면 다 괜찮아질거야 받았던 상처도 추억이 되고 다 괜찮아질 거야 살다가 보면 Oh Oh Yeah Oh Oh Yeah Oh Oh Yeah 살다가 보면 Oh Oh Yeah Oh Oh Yeah Oh Oh Yeah 살다가 보면 오늘은 날씨가 더욱 좋아 적당해 바람도 시원해 나도 이제 어른이 됐나봐 괜시리 또 생각에 잠기는데 날이 저물고 집에 돌아오는 길이 쓸쓸하게 느껴질 때마다 괜찮을 거야 혼잣말을 하곤 해 나도 모르게 자꾸 흥얼대 하루를 살다가 보면 다 괜찮아지겠지 이렇게 살다가 보면 다 괜찮아질거야 받았던 상처도 추억이 되고 다 괜찮아질 거야 살다가 보면 모두 다 잘 될거야 지금까지 난 다 잘해온 거야 할 수 있어 살다가 보면 살다가 보면 It's all good 하루를 살다가 보면 다 괜찮아지겠지 이렇게 살다가 보면 다 괜찮아질거야 받았던 상처도 추억이 되고 다 괜찮아질 거야 살다가 보면 Oh Oh Yeah Oh Oh Yeah Oh Oh Yeah 살다가 보면 Oh Oh Yeah Oh Oh Yeah Oh Oh Yeah 살다가 보면
  Barrett Strong  ,Money (That's What I Want),"The best things in life are free But you can tell me 'bout the birds and bees. Now gimme money THAT'S WHAT I WANT That's what I want THAT'S WHAT I WANT That's what I want, ye-ye-yeh, That's what I want. Money don't get everything it's true. What it don't get I can't use. So gimme money THAT'S WHAT I WANT A little money THAT'S WHAT I WANT That's what I want, ye-ye-yeh, That's what I want. Yeh gimme money THAT'S WHAT I WANT A little money THAT'S WHAT I WANT That's what I want THAT'S WHAT I WANT So gimme money THAT'S WHAT I WANT That's what I want, ye-ye-yeh, That's what I want. Your lovin' give me a thrill But your lovin' don't pay my bill. Now gimme money THAT'S WHAT I WANT That's what I want THAT'S WHAT I WANT That's what I want, ye-ye-yeh, That's what I want. Money don't get everything it's true. What it don't get I can't use. So gimme money THAT'S WHAT I WANT A little money THAT'S WHAT I WANT That's what I want, ye-ye-yeh, That's what I want. Yeh gimme money THAT'S WHAT I WANT A little money THAT'S WHAT I WANT That's what I want THAT'S WHAT I WANT So gimme money THAT'S WHAT I WANT That's what I want, ye-ye-yeh, That's what I want."
  양다일  ,섣부르진 않니,새로운 사람이라니 조금 섣부르진 않니 크게 다툰 건 맞지만 이게 끝이라니 항상 그랬던 것처럼 사랑한다고 말하면 곁에 있을 줄 알았어 근데 끝이라니 끝이라니 또 난 멀어진 후에 부족했던 날 원망하고 떠날 너의 생각에 잠 못 이룬 나였는데 섣부르진 않니 크게 다툰 건 맞지만 이게 끝이라니 끝이라니 또 널 보고 싶은데 늘 당연했던 너였는데 어제 같은 날들에 잠 못 이룬 나였는데 새로운 사람이라니 조금 섣부르진 않니 그래 아닌 건 알지만 이게 끝이라니 항상 그랬던 것처럼 사랑한다고 말하면 돌아올 거라 믿었어 근데 끝이라니 끝이라니
  길미  ,멈출 수 없어 (Can`t Stop),날카롭게 할퀴는 나를 세게 잡아줘 u know 너를 좀 더 알고 싶은 난 내 눈앞에 서있는 너 하나로 완벽한 tonight 너 없인 견딜 수 없어 can't stop thinking about you 작게 속삭여 WANT U 더 깊게 알고 싶어 내 안에 담고 싶어 나는 너를 보낼 수 없어 baby 나는 너를 멈출 수 없어 can't stop 나는 너를 참을 수 없어 baby 그 무엇도 두렵지 않아 널 가두고 싶어 네 목소린 날 간지럽혀 넌 불을 꺼 새카만 방 네 손위로 깍지를 껴 우리 사랑은 하얀 팝콘처럼 맛있게 터져 나와 와인처럼 새빨갛게 달아오른 널 깊게 음미해 입속 가득히 너를 머금고 즐길래 이 순간은 영원이 돼 멈추지 마 never 나를 가져 so hot 뜨겁게 밤을 새워 넌 내 허리를 감고 난 네 입술을 갖고 미치게 안고 싶어 내 안에 두고 싶어 나는 너를 보낼 수 없어 baby 나는 너를 멈출 수 없어 can't stop 나는 너를 참을 수 없어 baby 그 무엇도 두렵지 않아 널 가두고 싶어 baby I wanna fly I wanna fly baby wanna get high wanna get high baby hold me so tight I'm gonna give my heart tonight 나는 너를 보낼 수 없어 나는 너를 멈출 수 없어 나는 너를 참을 수 없어 그 무엇도 두렵지 않아 널 가두고 싶어 I remember last night I remember last night I remember last night I remember last night
  Luther Vandross  ,For You To Love,"It's the middle of the night And I can't sleep at all, I'm so uptight Tossin' and turnin' is how I've spent the time I've got so much on my mind hey  Something's got a hold on me I think it's love, don't you agree? It's got to be, I don't feel better I know what I've got to do I've got to get next to you  So I came here (For you to love) In the pouring rain (For you to love) And I know I'm ready (For you to love) I'll be the best I can (Honey, for you to love) Cause honey it's you I love Love, love yeah  I start to wonder what is true? And I get so confused (What should I do?) You make me worry When you say you understand But that I can't be your man  Something's gotta change your mind Now, if I get my love to you in time (Then you'll be mine) Ooh, I've got to get over Yes, that's what I've gotta do Look out 'cause I'm after you  I came here (For you to love) In a hurricane (For you to love) Just to be ready (For you to love) I'll be the kind of man (Honey, for you to love) Cause honey it's you I love Love love love yeah Cause honey it's you I love yeah  I wanted to see you I wanted to make your day I got myself ready To hear the words you would say Cause sometimes you talk to me so emotionally But then, you pull it back, baby Just let yourself love me  I came here (For you to love) I took a train, my dear (For you to love) So, you know I'm ready (For you to love) I never doubt, never fear (Honey, for you to love) Cause oh honey it's you I love Cause oh honey it's you I love Love, love, yeah  For you to love For you to love For you to love"
  K  ,단념,그대만 왜 모르나요 내가 그대를 이토록 사랑한단 걸 어쩌면 그댄 그렇게 차가운 표정 지을 수 있나요 나 모두 말리죠 다 그만두라고 그대 나의 맘을 모르듯 어쩌면 나도 그대를 모르나 봐요 이제 놓아줄께요 그대 그렇게도 힘이 든다면 아무리 해도 내가 될 수는 없다면 그 자리 비워드릴께요  오 왜 나는 안돼죠 음 늘 곁에 있어도 우워 그대 아픈 사랑까지도 다 지켜보며 기다린 나였었는데 우 워 이제 놓아줄께요 그대 그렇게도 힘이 든다면 아무리 해도 내가 될 수는 없다면 그 자리 비워드릴께요 곧 깨달을 수 있겠죠 나의 기다림 같은 건 아무 소용 없을거란 걸 오 나를 찾지 말아요 날 찾지 말아요 다른 이별에 가슴이 아파도 더는 나에게 기대어 울지 말아요 그대를 놓아줄 수 있게 오
  마크툽 (MAKTUB)  ,조우,낮선 도시의 밤처럼 첨 먹어본 음식처럼 내 귀를 한번에 녹인 Motown 노래처럼 니가 내게 온거야 I don`t Know I don`t move 널 보고 있으면 I don`t Talk I don`t Listen 너와 만나면 넌 나를 멍하게 만들어 자꾸만 넌 나를 바보로 만들어 자꾸만 너의 다리로 나를 감싸줘 너의 두팔로 나를 안아줘 내안에 거친 파도 그만 잠재워줘 Baby 예쁜 너의 입술로 I don`t Know I don`t move 널 보고 있으면 I don`t Talk I don`t Listen 너와 만나면 넌 나를 나쁘게 만들어 자꾸만 넌 나를 아쉽게 만들어 자꾸만 너의 다리로 나를 감싸줘 너의 두팔로 나를 안아줘 내안에 거친 파도 그만 잠재워줘 Baby 나쁜 너의 손길로 난 매일 밤 상상을 해 너와의 달콤한 Love Story 사랑해 사랑해 정말이야 Baby 보이지 않는 Handcuff 영원히 내게 묶였나봐 너의 다리로 나를 감싸줘 너의 두팔로 나를 안아줘 내안에 거친파도 그만 잠재워줘 Baby 예쁜 너의 입술로 너의 다리로 나를 감싸줘 너의 두팔로 나를 안아줘 내안에 거친파도 그만 잠재워줘 Baby 나쁜 너의 손길로 예쁜 너의 입술로 너의 사랑으로 I don`t Know I don`t move 널 보고 있으면
  거미  ,환각 (Sampling By `Where Are They Now` - Leon Ware),우연히 찾은 서랍 속 옛 사진 너와 함께 웃고 있는 내 얼굴 내 맘 깊은 곳 아픔이 눈물로 네 얼굴 적셔 우리 반지에 새긴 사랑의 영원 하자던 우리 약속이 널 다시 다시 내게로 데려와 줬으면 마술처럼 사라진 너의 향기 한숨만 내쉬며 보낸 축 늘어진 나의 하루 지나면 널 조금 미워할 수 있길 넌 자꾸 날 밀고 난 널 믿고 천천히 이별할 때 환각처럼 사라진 너의 모든 걸 마법처럼 잊게 돼 넌 자꾸 날 잊고 눈물짓고 천천히 잊혀질 때 환상처럼 사라진 너의 모든 걸 마법처럼 잊게 돼 눈물 짓게 돼 우연히 본다면 다시 널 보면 놓지 않겠어 너를 나의 너를 다시 또 다시 처음처럼 너에게 안길 텐데 안고 싶은데 잡고 싶은데 그냥 사라져 버린 너의 향기 다시 널 만질 수도 없는데 난 마술처럼 내 앞에 나타나서 아픔만 남기며 떠난 그댈 왜 난 아직 잊지 못하지 왜 너에게 갇혀 있는지 넌 자꾸 날 밀고 난 널 믿고 천천히 이별할 때 환각처럼 사라진 너의 모든 걸 마법처럼 잊게 돼 넌 자꾸 날 잊고 눈물짓고 천천히 잊혀질 때 환상처럼 사라진 너의 모든 걸 마법처럼 잊게 돼 모두 잊게 돼 i love you baby i need you baby 넌 자꾸 날 밀고 난 널 믿고 천천히 이별할 때 환각처럼 사라진 너의 모든 걸 마법처럼 잊게 돼 모두 잊게 돼 눈물짓고 천천히 잊혀질 때 환상처럼 사라진 너의 모든 걸 마법처럼 잊게 돼 모두 잊게 돼
  세연  ,끝,이제야 실감한 듯해 길었던 이별의 끝을 네 이별은 짧고 쉬운 듯 보여 비참해 끝까지 잡을 수 있다 믿었어 스쳐가는 다툼인 줄 알았어 한 순간에 남이 된 너와 나 아직 난 믿을 수 없어 시간이 흐른 뒤도 널 잊지 못한 채 끝없이 널 그리고 있을 나에게 살며시 다가와 따뜻하게 안아 줄 사람 난 그게 너이길 바래 언제나 함께일 거라 믿었어 마지막은 떠올려 본 적 없었어 모든게 내 착각이었다는 생각이 나를 더 외롭게 만들어 시간이 흐른 뒤도 널 잊지 못한 채 끝없이 널 그리고 있을 나에게 살며시 다가와 따뜻하게 안아 줄 사람 난 그게 너이길 바래 날 사랑해주던 그 눈빛 그 표정을 잊을 수 있을까 혹시 내가 떠오른다면 언제든 다시 나에게 돌아와도 돼 시간이 흐른 뒤도 널 잊지 못한 채 끝없이 널 그리고 있을 나에게 살며시 다가와 따뜻하게 안아 줄 사람 난 그게 너이길 바래 시간이 더 흘러도 널 잊지 못해 끝없이 널 그리고 있을 나에게 살며시 다가와 따뜻하게 안아 줄 사람 난 그게 너이길 바래
  SWV  ,Right Here,"S, The Double, The U, The V  Verse 1: Coko Lately there seems to be Some insecurities About the way I feel Where I wanna be Boy ya know it's with you No one can do The things you do to me Never to be mistaken Long as it's love we're making There's gonna be some rain Gonna be some pain  Pre-Chorus: Coko But as long as I know Boy time will show Our love will grow And I know  Chorus: SWV Love will be right here Be right here Right here Be right here No fear Have no fear No tears Love is here  Verse 2: Coko True love some don't believe in That's just what I'm givin' I'm gonna keep it strong I'll be holding on to you No one can do me like you do It's true Sure as the sun is shining Our love will keep on climbing There's gonna be some rain Gonna be some pain  Pre-Chorus: Coko But as long as I know Boy time will show Our love will grow And I know  Chorus: SWV Love will be right here Be right here Right here Be right here No fear Have no fear No tears Love is here  Interlude: Pharrell Williams S, W, S, V S-S, W, Double-V, U S, W, U, V-V  Chorus: SWV Love will be right here Be right here Right here Be right here No fear Have no fear No tears Love is here Love will be right here Be right here Right here Be right here No fear Have no fear No tears Love is here"
  Boyz II Men  ,On Bended Knee (Human Rhythm Mix),Darlin' I can't explain Where did we lose our way Girl it's drivin' me insane And I know I just need one more chance To prove my love to you If you come back to me I'll guarantee That I'll never let you go Can we go back to the days our love was strong Can you tell me how a perfect love goes wrong Can somebody tell me how you get things back The way they use to be Oh God give me a reason I'm down on bended knee I'll never walk again until you come back to me I'm down on bended knee So many nights I dream of you Holding my pillow tight I know I don't need to be alone When I open up my eyes To face reality Every moment without you It seems like eternity I'm begging you begging you come back to me Can we go back to the days our love was strong Can you tell me how a perfect love goes wrong Can somebody tell me how you get things back The way they use to be Oh God give me a reason I'm down on bended knee  I'll never walk again I'm down on bended knee Baby I'm sorry Please forgive me for all the wrong I've done Please come back home girl I know you put all your trust in me I'm sorry I let you down Please forgive me Gonna swallow my pride Say I'm sorry Stop pointing fingers the blame is on me I want a new life And I want it with you If you feel the same Don't ever let it go You gotta believe in the spirit of love It heal all things We won't hurt anymore No I don't believe our love's terminal I'm down on my knees begging you please Can we go back to the days our love was strong Can you tell me how a perfect love goes wrong Can somebody tell me how you get things back The way they use to be
  이햐  ,GROOVY BABY,아침보다 먼 나의 밤은 허전해 우주보다 먼 너의 답장은 여전해 지나치고 있는지 아니면 그냥 무시하는지 내가 또 원래 그래 애써 보이지 않지 지금은 또 이래도 나중엔 풀리겠다 하면서도 내가 또 원래 그래 애써 보이지 않지 baby coz i love so much coz baby so high 애기 같은 너의 투정 너무 귀엽지만 어째 완벽하게 내건 아닌 것 같아 뭐 여전해 허전해 여전해 우주보다 먼 너의 답장은 여전해 지나치고 있는지 아니면 그냥 무시하는지 내가 또 원래 그래 애써 보이지 않지 지금은 또 이래도 나중엔 풀리겠다 하면서도 내가 또 원래 그래 애써 보이지 않지 coz baby coz i love so much coz baby so high my groovy baby coz i love so much coz baby so high i'm a freak i'm a freak ohh i'm a freak i'm a freak ohh i'm a freak i'm a freak ohh i'm a freak i'm a freak ohh i'm a freak i'm a freak ohh i'm a freak i'm a freak ohh i'm a freak i'm a freak ohh
  Tanika Charles  ,Money,"Money, money, money Money all the time Money eat the cake and Money drink the wine Money, money, money Money for my thrills Our names on the lease together My name in your will Oh I’m gonna be just fine  Money, money, money Gets me in the mood Money in my jeans and Stuffed all in my shoes Money, money, money Money everywhere Money up in my sleeves and Stuffed in my brassiere  Dollars and cents and all of my friends You know life’s simple pleasures Won't pay my rent I want to get over, I want money You don’t got enough and that won't do “ Because I love the feel of C-notes in my hand, I want     Money, money, money Money for my thrills Our names on the reservation Your name on the bill I only want to get your money Honey won't you pay my bills I know that you can feel my loving But I’ve got to get my thrills  Money can’t buy happiness But it can buy nice things The Balenciagas, the Ferragamos I shop my pain away They say money can’t buy happiness But it can buy champagne Take my pain away on a rainy day I said what’s my favourite thing?  I’m talking about money I can’t live without money I got to get that money You better give me that money Money, money, money  Money for my thrills Our names on the lease together My name in your will I only want to get your money Honey won't you pay my bills You know that you can feel my loving But I’ve got to get my thrills"
  Lathun  ,Sweetest Thing,"Have you ever met somebody? Made you just wanna sing Made you just wanna talk about it Tell somebody  And I think you won't testify Never wanna break up Just want to wake up right next to you Getting the best of you  Oh, it's such a pleasure You make it better, giving a smile to me [Incomprehensible] I need you to be there  You are like a shining star But that's who you are It's such a shame that God only made one of you Giving you to me was such a blessed thing  And wherever I go It's only me and you And you should always know that  You're just the sweetest thing to me Sweeter than wine or candy, heaven sent to me You're just the sweetest thing to me Sweet like the sunshine after the heavy rain is clear to see  Listen me I never found a better one to make you settle down A best friend, never keep you stressing She's just the one who gave me everything I need I never had the need to be free  You're the morning, the evening The sunrise after sleeping, we're never awake I need you to be there you are A shining star that's who you are  And wherever I go It's only me and you You should always know that  You're just the sweetest thing to me Sweeter than wine or candy, heaven sent to me You're just the sweetest thing to me Sweet like the sunshine after the heavy rain is clear to see  Now for everybody, love somebody I wanna hear you say, yeah, yeah  You're just the sweetest thing to me Sweeter than wine or candy, heaven sent to me You're just the sweetest thing to me Sweet like the sunshine after the heavy rain is clear to see  You're just the sweetest thing to me Sweeter than wine or candy"
  박진용  ,지구본,내가 바라본 지구는 둥글고 다 똑같이 자기를 따라가면 우주로 쭉쭉 뻗어나갈 수 있는데 다른 사람의 놀림과 유혹에 휘둘려서 뭐가 맞는지 틀린지 못 정하고 끙끙 혼자 앓고 있어 자연스럽게 너를 믿고 따라가면 불안하지 않을 텐데 어떤 색깔로 세상을 칠할지는 결국 너 혼자 정해야 돼 아무 것도 바뀌지 않을 것 같고 너는 불쌍하고 억울함만 가득 찬 니 세상에 그 어느 것도 바꿀 수 있다고 그냥 하기만 하면 되는 거라고 마스터키는 항상 니 손에 spot light을 눈부시게 비춰 지금 여기에 취할 수 있게 어서 미친 듯이 춤추다보면 나도 모르게 어딘가로 가있을 거야 계속 go on 사람들을 내 맘대로 조종해봤자 얻을 수 있는 건 없어 하나 그대로인 건 누구보다 크지도 작지도 않은 너야 아무것도 바뀌지 않을 것 같고 너는 불쌍하고 억울함만 가득 찬 니 세상에 그 어느 것도 바꿀 수 있다고 걍 하기만 하면 되는 거라고 마스터키는 항상 니 손에 spot light을 눈부시게 비춰 지금 여기에 취할 수 있게 어서 미친 듯이 춤추다보면 나도 모르게 어딘가로 가있을 거야 계속 go on 미친 듯이 춤추다보면 나도 모르게 어딘가로 가있을 거야 계속 go on
  Laura Mvula  ,Green Garden,"Take me outside, sit in the green garden Nobody out there, but it's okay now Bathe in the sunlight, don't mind if rain falls Take me outside, sit in the green garden Oh ah, oh ah oh Oh ah, oh ah oh  [Pre-Chorus] And I'll fly on the wings of a butterfly High as a tree top and down again Putting my bag down, taking my shoes off Walk on the carpet of green velvet  [Chorus] Dance in my garden like we used to Oh ah, oh ah oh Dance in my garden like we used to Oh ah, oh ah oh  [Verse] Take me outside, sit in the green garden Nobody out there, but it's okay now Bathe in the sunlight, don't mind if rain falls Take me outside, sit in the green garden  I'll go wherever you go Wherever you take me, I'll go I'll go wherever you go Wherever you take me, I'll go  Take me outside, sit in the green garden Take me outside, sit in the green garden  [Pre-Chorus] And I'll fly on the wings of a butterfly High as a tree top and down again Putting my bag down, taking my shoes off Walk on the carpet of green velvet  [Chorus] Dance in my garden like we used to Oh ah, oh ah oh Dance in my garden like we used to  Take me outside, take me outside Take me outside, sit in the green garden  [Outro] I'll go wherever you go Wherever you take me, I'll go I'll go wherever you go Wherever you take me, I'll go  I'll go wherever you go Wherever you take me, I'll go I'll go wherever you go Wherever you take me, I'll go  I'll go wherever you go Wherever you take me, I'll go"
  융단  ,의미X,이런 거 다 부질없지 단어의 무게도 점점 가벼워지고 있잖아 이 마지막이라는 것도 어떤 시작의 끝인지 이젠 기억도 안 나잖아 처음엔 그냥 오해가 오해를 만든 건 줄 알고 다시 풀어낼 수 있을 줄 알고 천천히 하나씩 다시 거슬러 되짚어보니까 애초에 그런 게 아니었어 이렇게 아파하며 찢어질 거라면 그렇게 꼭 붙어있지 말 걸 그랬어 이렇게 다시 볼 수도 없을 거라면 차라리 처음이 없었음 좋았겠어 끝이라는 한 글자에 어떠한 의미도 없는 부질 없는 짓이 됐고 그렇게 길었던 시간도 이제 와선 아무것도 아닌 게 되어 버렸잖아 분명히 우린 잘 해왔어 그렇게 믿었고 서로를 위해 노력한다고 생각했는데 그런데 알고 보니까 우리의 노력은 결코 서로를 위한 게 아니었어 이렇게 아파하며 찢어질 거라면 그렇게 꼭 붙어있지 말 걸 그랬어 이렇게 다시 볼 수도 없을 거라면 차라리 처음이 없었음 좋았겠어 이제 와서 다 무슨 소용이냔 생각에 말하지 못했던 말인데 그 한마디가 자꾸 맴돌아서 불안해 후회 안 할 자신이 없는데 이렇게 아파하며 찢어질 거라면 그렇게 꼭 붙어있지 말 걸 그랬어 이렇게 다시 볼 수도 없을 거라면 차라리 처음이 없었음 좋았을까 그랬을까 이렇게 쳐다보며 원망할 거라면 그렇게 바라보며 행복해하지 말걸 이렇게 처참하게 부서질 거라면 차라리 그런 약속들은 하지 말걸
