artist,title,lyric
  Janet Jackson  ,Just A Little While,"Baby I like it when it feels this good You always seem to make me smile Can't nobody do what you do When you love me just a little while  I... I know you got somewhere to go And I've got somewhere to be right now We can wait all day long If you want to get a little while  I don't want to be a distraction to you No no no So maybe I'll just lay around Play by myself Or touch in all my favorite fruit  Can't stop thinkin' bout the things we do Or how it feels makin' love to you I'm ready to get it baby If you've got it to dish out Just love me for a little while  I wanna make it like a dream for you Turn every fantasy into the truth Ya know, I'll take it anywhere that you wanna go right now Just love me for a little while  I, I like sleeping in your clothes The smell makes it all come down When I think about me and you Sometimes I get a little wild  Baby, I know we did it all night long And I didn't want to burn you out Cause you know how much I like to do it in the morning, it's another while  I don't know if you have other things to do no no no So maybe I'll just lay around, play by myself Or touch in all my favorite fruit  Can't stop thinkin' bout the things we do Or how it feels makin' love to you I'm ready to get it baby If you've got it to dish out Just love me for a little while  I wanna make it like a dream for you Turn every fantasy into the truth Ya know, I'll take it anywhere that you wanna go right now Just love me for a little while  My passion flows like a river has no end I wanna know everything Ya let me do to you (Tell me what you like baby) (You wanna play with my strawberries) (Sometimes when I think about me and you, I get real wild)  Can't stop thinkin' bout the things we do Or how it feels makin' love to you I'm ready to get it baby If you've got it to dish out Just love me for a little while  I wanna make it like a dream for you Turn every fantasy into the truth Ya know, I'll take it anywhere that you wanna go right now Just love me for a little while  Just love me Just love me for a little while I'll take you anywhere Just love me for a little while Just love me for a little while Tell me everything you'll let me do to you Just love me for a little while -"
  Whitney Houston  ,I Believe In You And Me,I Believe In You and Me I Believe That we will be In love eternally Well as far as I can see You Will Always be the one For me Oh yes you will And I believe in dreams again I believe that love will never end And like the river finds the sea I was lost now I'm free Cuz I believe In you and me I will never leave your side I will never hurt your pride When all the chips are down baby Then I will always be around Just to be right where you are My love you know I love you boy I will never leave you out I will always let you in boy mmm oh baby To places no-one's ever been Deep inside can't you see That I believe in you and me Maybe I'm a fool To feel the way I do I will play the fool forever Just to be with you forever I believe in miracles And love is the miracle And yes baby you're my dream come true I was lost now I'm free Oh baby cuz i believe i do believe in you and me See I was lost now I'm free Cuz I believe in you and me
  정엽  ,나만의 것,아침에 눈을 떳을때 너를  길을걷다 멍하니 너를  지금은 내곁에 없는 너를  그리워하네 바보처럼  나보다 행복하기를 바래  내생각 하지 않기를 바래  더좋은 사람 만나길 바래  다시는 내게 올수없게  안개처럼 사라져가  아쉬워도 끝이 난날  함께한 추억모두(흘려보낼께)  널잊어야해 힘들어도  널지워야해 기억속에서  네가떠난 후에 난  죽을거같이 아파도  두번다시 울지안아  잊을게  아직도 휴대폰에 니이름  지우지도 못하고 있어  전화길 들고 한참을 서서  널 생각하네 바보처럼  안개처럼 사라져가  아쉬워도 끝이 난날  함께한 추억모두(흘려보낼께)  널잊어야해 힘들어도  널지워야해 기억속에서  네가떠난 후에 난  죽을거같이 아파도  다시너를 찾이않아  (힘들어도) 힘들어도  (기억속에서)기억해  다시너를 다시너를  찾지 않아
  Usher  ,Good Kisser (Disclosure Remix),"Make every minute worth it, baby This for Usher, baby Watch this I done been around the world I done kissed a lot of girls So I'm guessing that it's true Make me holla and I bet a million dollars Don't nobody kiss it like you Don't nobody kiss it like you Don't nobody kiss it like you, bang, bang, bang Ross Talking Smoking on this mCig,You can smell it Don't nobody kiss it like you Don't nobody kiss it like you Ugh Rebel without a cause No umbrella the money's stuffed in the doors Rodeo drive, the money old as Clive Davis Blue papers still chasing dead faces Dark tints, Rims chalk like razors 2 mill to the side for the cases Bawse Picky ring both hands Moskowitz wanna lean on a man Peter pan got exed out the plans Little homie still be moving like the fed My Spanish chick be on that Telemundo Pretty face and she got the fattest culo Kissing all on me, tension all on me Touch a little paper, start switching all on me I'm looking for the best kisser With a passport time to get missing Bawse Kisser, got lipstick on my leg, my baby Kisser, oh, oh She said she a good kisser I'mma rain on this parade, oh baby I done been around the world I done kissed a lot of girls So I'm guessing that it's true Make me holla and I bet a million dollars Don't nobody kiss it like you Don't nobody kiss it like you Don't nobody kiss it like you, bang, bang, bang This girl, she's my hero Get dinero, euros, pesos, francs and yen I ain't want to check off either I'm starin' at your barrel Pull the trigger, chitty, chitty, bang, babe See, I told her The devil is a lie Them other girls can't compete with mine You do it so good, you fuck my mind You pull it out, then you open fire You make me want to tap out and retire Your pretty lips leave me so inspired I think I got a winner Could be a keeper Kisser, got lipstick on my leg, my baby Kisser, oh, oh She said she a good kisser I'mma rain on this parade, oh baby Listen, the only thing I know You give it to me, baby, with good flow Don't ever run it back, come on, keep going Just give it to me, give it up to me, give it up to me I can't keep my control Every time that I see you hit that floor Just keep on giving it to me, I want mine Just come on baby, just give it to me, give it up to me Kiss it good, kiss it right Keep it up, we be kissing all night Kiss it good, kiss it right Keep it up, we be kissing all night Kiss it good, kiss it right Keep it up, we be kissing all night Kiss it good, kiss it right Keep it up, we be kissing all night Kisser, got lipstick on my leg, my baby Kisser, oh, oh She said she a good kisser I'mma rain on this parade, oh baby I done been around the world I done kissed a lot of girls So I'm guessing that it's true Make me holla and I bet a million dollars Don't nobody kiss it like you Don't nobody kiss it like you Don't nobody kiss it like you, bang, bang, bang"
  Brian McKnight  ,When U R Lovin Me,Everytime we close Feels like your burning my desire Everytime we touch Feels like we set the soul on fire baby your the one I want baby your the one I need baby there`s soul I `ve been waiting for for sure  Imma give you all I got Imma satisfy your needs baby there`s song I`ve been trying to tell ya that I `ve never felt nothing like when your loving me it`s so crazy that I `ve never felt nothing like when your loving me  the first time we kissed wasn`t like nothing nothing that tasted when we`re makin love not a single second of time is wasted oh ~  baby your the one I want baby your the one I need baby there`s soul I `ve been waiting for for sure  Imma give you all I got Imma satisfy your needs baby there`s song I`ve been trying to tell ya that I `ve never felt nothing like when your loving me it`s so crazy that I `ve never felt nothing like when your loving me  when you`re far away from me you can stay warm be free it`s not so hard for me to be by my self oh cause I have made a way to be next to you I don`t want no~body else Cause I`ve never felt nothing like and I never felt nothing like and I`ve never felt nothing like I `ve never felt oh oh~!~~ Ive never felt nothing like when you`re lovin me  yeh yeh
