artist,title,lyric
  윤종신  ,Welcome Summer,그까짓 자질구레한 거 내 인생의 작은 모래 알갱이도 안돼 Open the window let me feel that 사랑한다 말해 다 내려놓고 올라타 걱정 따윈 태양이 녹여줘 바싹 그을려 돌아올 생각해 Open your heart please let me feel that 모두 잊겠다고 말해줘 우리 지쳤던 지난 계절도 땀이 흐르겠지 올여름도 똑같겠지 뭐 그 여느 해처럼 어제까진 너의 선글라스 속 설레지 우리 둘만의 Summer night 거긴 별이 가득해서 잠 못 이룬대 돌아올 땐 나로 가득 채워 줄게 My love Welcome summer 숨 막히게 파란 바다 위 우린 하늘에게 두 눈 감고 말 걸겠지 Open the sky please let me feel that 행복하다 말해 짜릿 탄산 한 모금에 버블버블 나를 붕 뜨게 해 The kiss & Swimming 뭘 더 바라겠어 Open your heart please let me feel that 기억하겠다고 말해줘 우리 다가올 다음 계절도 땀이 흐르겠지 올여름밤 꿈같겠지 추억 어느 해 보다 빛나겠지 달빛 와인글라스 속 비추지 우리 둘만의 Summer night 가는 하루하루 아쉬워 잠 못 이룬대 돌아올 땐 나로 가득 채워 줄게 My love Welcome summer Welcome summer
  Usher  ,I`ll Make It Right,"Oh no, no, no, no, no, oh baby  [Chorus] I'll make it right Baby you know that I can make it right  Keep it on a cutie girl cause I'm really into you yeah Tell me is there a way that i can spend some time with you So much I want to know about you Seems like I can't do without you You really turn me on you got it goin' on Anything you ask i'll do for you So baby don't you see You mean the world to me Just one thing I have to know Baby can I make it right  [Chorus]  As I'm looking into your eyes all I see is you lovely face And there's nothin' I like more than to show you I adore The simple things that you do to me with the sweet little Things you say Baby when I kiss your lips it really brightens up my day Oh Oh Oh Anything you ask I'll do for you You mean the world to me Just one thing I have to know Baby can I make it right  [Chorus]  So baby don't you see you mean the world to me If you just swing my way I'll make it right So tell me where do we go from here Oh yeah  There's nowhere that we can go But take it nice and slow Baby enjoy the flow Lots of pleasures I can give I've got it waitin' here So put away your fears  [Chorus]"
  바비 킴  ,떠나야만 하는 이유,다 끝났어 사랑도 삶도 믿었던 모두가 완벽하게 날 속인것 뿐야 미쳤었을지도 몰라 너무 화가나 정확히 한방에 쓰러져 간다 내 인생조차 My Life 떠나야해 이제 어쩔 수 없어 돌리기엔 난 늦었어 Now It's The End 모든게 다 끝났어 Over 꽤 늦은밤 왜 하필 니가 내 친구란 놈의 집에서 나와 어떻게 니가 미쳤었을지도 몰라 너무 화가나 정확히 한방에 쓰러져 간다 내 인생조차 My Damn Life 떠나야해 이제 어쩔 수 없어 돌리기엔 난 늦었어 Now It's The End 모든게 다 끝났어 Over I Don't Know I Just Don't Know 마지막 그 순간까지도 내가 아닌 그를 감싸 안고 내게 소리쳐 I'm waning you get out n move Don't be a fool Cause I will shoot 내가 아닌 그를 감싸 안고 날 원망해 미쳤었을지도 몰라 너무 화가나 정확히 한방에 쓰러져 간다 내 인생조차 My Life 난 어떻게 떠나야해 이제 어쩔 수 없어 돌리기엔 난 늦었어 Now It's The End 모든게 다 끝났어 Over 그 누구도 이젠 믿을 수 없어 난 여기에 필요 없어 Now It's The End 모든게 다 끝났어 Over  모든 걸 다 잃었어
  Majid Jordan  ,Superstar,I just wanna spend my life with you With you Go around the world and to the moon With you I just wanna share the light with you With you Have some kids and move to France with you With you I just wanna spend my life with you With you Go around the world and to the moon With you I just wanna share the light with you With you Superstar You you you you you Tonight My eyes my eyes don't lie My heart knows wrong from right I'm done taking advice I don't wanna fight no I'm so crazy Thinking 'bout you None of my friends believe me None of them know the truth I love being with you Superstar I just wanna spend my life with you With you Go around the world and to the moon With you I just wanna share the light with you With you You you you you you superstar Back it up on me Now that you're mine Show me how you really feel inside tonight Angel in my life I just wanna spend my life with you Superstar Go around the world and to the moon Superstar I just wanna share the light with you Superstar Have some kids and move to France with you Superstar I just wanna spend my life with you Superstar Go around the world and to the moon Superstar I just wanna share the light with you With you You you you you you All the time Everywhere I go you're on my mind Only you know how I feel inside Take a risk when you see the signs New to this but you wanna try Memories of you back at my old place Running back like a replay In my head and it's two days 'Til I see you I can't wait You got too much on your plate You say Love me don't let go Wishing it was that simple Anything if you say so You get all that you ask for Superstar Superstar Superstar Thoughts of you playing on my mind Carry you with me all the time Superstar I just wanna spend my life with you Superstar Go around the world and to the moon Superstar I just wanna share the light with you Superstar Have some kids and move to France with you With you I just wanna spend my life with you Superstar Go around the world and to the moon Superstar I just wanna share the light with you Superstar You you you you you It's all for you It's all for you Superstar
  Artinb  ,Caramel,그런 거야 뭐 내일이라도 할 수 있으니 뭐 일단 보는 게 중요해 널 안는 게 제일 중요해 나와 Cafe를 가든 작은 공원으로 가든 내 옆에서 웃어주겠니 널 만날 수만 있다면 그 어떤 신호도 필요 없는 걸 모든 게 파란불 파란불 온통 파란불 파란불 널 만날 수만 있다면 너도 만약 내가 좋다면 이 파란불 파란불 그런 거야 뭐 다음에라도 할 수 있으니 뭐 일단 보는 게 중요해 따뜻한 게 제일 중요해 나와 Cafe를 가든 작은 미술관을 가든 내 옆에서 웃어주겠니 넌 너무 예쁘지 내 눈에 너의 눈 안에 별들을 새곤 해 너의 향기는 Caramel 같지 하얀색 거품이 사르르 앉지 너에게 어울리는 Caramel Latte 그 한잔 위에 음악을 깔게 너와의 시간 내겐 겨울에 뜨개질 혹은 트리 밑에 선물처럼 따뜻한 거겠지 널 만날 수만 있다면 그 어떤 신호도 필요 없는 걸 모든 게 파란불 파란불 온통 파란불 파란불 널 만날 수만 있다면 너도 만약 내가 좋다면 이 파란불 파란불 봄처럼 따뜻한 그대의 목도리 여름처럼 뜨거운 우리의 마음이 가을처럼 쓸쓸한 하루를 물들인 겨울이 음 음
  임지안 (LIM ZIAN)  ,서울은 지금 흐림,서울은 지금 흐림 내 맘도 비가 올 것만 같아 창가에 비친 모습 이젠 따뜻한 온기 없는 내 표정 스쳐지나가는 연인들의 행복해보이는 모습들에 나 몰래 고개숙이며 미소짓던 일도 지금 내 옆에서 멀어지는 행복들 잡으려고 애써 봐도 결국엔 이렇게 또 봄은 내게 다가와 넌 어떤지 너에겐 내가 어떤 의미였는지 잠이 들지 않는 새벽 또 빈손으로 너를 찾아봐 내겐 따스했던 우리 그 날 지금 여긴 흐려 잘 지내 그럭저럭 가끔은 외로워도 난 행복해 때론 눈을 감으면 보여 그때가 따스했던 봄비처럼 내겐 잠이 들지 않는 밤들 속엔 생각나는 너의 모습들에 나 눈을 감아도 느껴지는걸 울리지도 않는 전화기에 손을 대 버릇처럼 열고 닫아 결국엔 이렇게 다 버리지 못하는 나 넌 어떤지 너에겐 내가 어떤 의미였는지 잠이 들지 않는 새벽 또 빈손으로 너를 찾아봐 내겐 따스했었던 우리 그 날 Oh baby I can't live without you 너를 잊을수가 없어 아무래도 난 Can't forget you never never forget you 그래도 시간은 지나고 괜찮아질 걸 알아도 또 난 오늘처럼 비가 오면 또 널 서울은 지금도 흐려
  성우  ,붙어,Skinny DOPE Track 딱 달라붙어 딱 달라붙어 딱 달라붙어 네 몸을 내게 붙여 딱 달라붙어 딱 달라붙어 딱 달라붙어 네 몸을 내게 붙여 좀 더 가까이 붙어봐 난 널 보는데 어딜 봐 시간은 자정을 쳤고 우리에겐 내일은 없어 난 널 위한 멀티플레이어 어떤 위치건 상관없어 Woo yeah yeah 내가 실망이 아닌 기대를 안겨 줄게 잠수함 넌 바다 깊이 알고 싶은데 난 주먹 넌 보자기 날 밀어 내기만해 넌 돌아보지마 더 흥분되니까 날 느끼려면 turn around 이제서야 날 알아봐 오늘은 우리들 축제 잠도 못 잘거야 난 태양보다 훨씬 더 뜨거운 남자야 I need you girl 쉽게 벗겨 네 코트 넌 내가 그린초상화 붉은 립스틱에 번짐 딱 달라붙어 딱 달라붙어 딱 달라붙어 네 몸을 내게 붙여 딱 달라붙어 딱 달라붙어 딱 달라붙어 네 몸을 내게 붙여 딱 달라붙어 딱 달라붙어 딱 달라붙어 네 몸을 내게 붙여 딱 달라붙어 딱 달라붙어 딱 달라붙어 네 몸을 내게 붙여 원한다면 되어줄게 네 입에 막대사탕 달콤하고 끈적하게 녹아 내린 초코바 태연한 척 장난스러운 표정 짓고 있지만 점점 거칠어지는 네 숨소리 쉴 틈 없이 내게 뛰어들어 그대로 Diving 이미 뜨거우니까 필요 없는 Warm Up 넌 돌아보지마 더 흥분되니까 날 느끼려면 turn around 이제서야 날 알아봐 오늘은 우리들 축제 잠도 못 잘거야 바닥으로 저문 기분 올려줄게 Fly to the Moon 그네 타고 Swing 난 솔직해 넌 내꺼야 딱 달라붙어 딱 달라붙어 딱 달라붙어 딱 달라붙어 네 몸을 내게 붙여 딱 달라붙어 딱 달라붙어 딱 달라붙어 네 몸을 내게 붙여 딱 달라붙어 딱 달라붙어 딱 달라붙어 네 몸을 내게 붙여 딱 달라붙어 딱 달라붙어 딱 달라붙어 네 몸을 내게 붙여 좀 더 가까이 붙어봐 난 널 보는데 어딜 봐 yeah yeah yeah yeah yeah 내 손 잡아 나랑 업고 놀자 이젠 더 못 참아 내 눈 돌아가 조금 서툴러도 괜찮아 불이 꺼지면 또 올라와 아무도 이해 못할걸 너 혼자 알고 있어 baby 딱 달라붙어 딱 달라붙어 딱 달라붙어 네 몸을 내게 붙여 딱 달라붙어 딱 달라붙어 딱 달라붙어 네 몸을 내게 붙여 딱 달라붙어 딱 달라붙어 딱 달라붙어 네 몸을 내게 붙여 딱 달라붙어 딱 달라붙어 딱 달라붙어 네 몸을 내게 붙여
  Luther Vandross  ,Superstar,Don't you remember you told me you loved me baby You said you'd be coming back this way again baby Baby baby baby baby oh baby I love you I really do Long ago and oh so far away I fell in love with you before the second show  Your guitar and you sounds so sweet and clear But you're not really here It's just the radio Don't you remember you told me you loved me baby You said you'd be coming back this way again baby Baby baby baby baby oh baby I love you I really do  You looked for me to be yours You want my love but you're on the road Don't you remember me anymore Loneliness is such a sad affair  And I can hardly wait to be with you again  What to say to make you come again Come back to me again  I wanna be I wanna be anywhere you are Don't you remember you told me you loved me baby You said you'd be comin' back this way again baby Baby baby baby woo baby oh baby Yes I love you I really do  Play it easy play it easy Keep it right there keep it right there keep it right there  What are you gonna say It's alright it's alright Ooh baby it's alright it's alright Alright now Keep it right there keep it right there It's alright it's alright
  임정희  ,해요 (Feat. 미료 From Brown Eyed Girls),상처 받은 세상 모든 여자들에게 Listen 이젠 너를 떠날래 더는 니 곁에서 살지 않을래 내 맘에 상처를 이제 보듬을래 추억도 다 버릴래 니가 남겨줬던 추억이 날 많이 괴롭히지 않게 Yes 미련 난 몰라 Yes 눈물이 뭔데 Yes 상처투성이 사랑 따윈 난 안 할래 상처 받지 말기로 해요 더는 울지 말기로 해요 그래요 이기적인 그 사람들 때문에 그건 사랑도 아니에요 그냥 떨쳐버리면 되요 그래요 우린 그런 약한 사람 아니에요 He yo He yo He yo He yo He yo He yo He yo 항상 너만 생각하고 니 입장만 말하던 널 정말 내가 못 떠날 줄 알았니 사랑은 끝났지만 사랑한 적 있긴 한 건지 그런지 나는 모르겠어 Yes 미련 난 몰라 Yes 눈물이 뭔데 Yes 상처투성이 사랑 따윈 난 안 할래 상처 받지 말기로 해요 더는 울지 말기로 해요 그래요 이기적인 그 사람들 때문에 그건 사랑도 아니에요 그냥 떨쳐버리면 되요 그래요 우린 그런 약한 사람 아니에요 He yo He yo He yo He yo He yo He yo He yo 너와 나 언제나 함께 했었지 너와 함께라면 언제나 행복했었지 하지만 점점 그대 몰래 흘린 눈물들이 사랑이 주는 기쁨보다 커져버린 슬픔 이제야 알게 됐어 너란 사람 진실이란 없었겠지 너의 사랑 나의 가슴이 크게 외치고 있어 내게 당장 두 발로 널 떠나서 자유를 택해 상처 받지 말기로 해요 더는 울지 말기로 해요 그래요 이기적인 그 사람들 때문에 그건 사랑도 아니에요 그냥 떨쳐버리면 되요 그래요 우린 그런 약한 사람 아니에요 상처 받지 말기로 해요 더는 울지 말기로 해요 그래요 이기적인 그 사람들 때문에 그건 사랑도 아니에요 그냥 떨쳐버리면 되요 그래요 우린 그런 약한 사람 아니에요 He yo He yo He yo He yo He yo He yo He yo
  The Internet  ,Bravo,My love I thought you knew This karma thing don't pick and choose So every time that you perform I learn just a little more What a waste babe what a shame You were playing games Words come out your mouth Look around what a mess you made Watching from the crowd it's astounding You're on your way Thought that you had changed I found out it's just a role you play Well bravo baby Bravo baby oh My love let's get this straight This ain't your show this ain't your stage So no more standing ovations brought Well played baby Save it for the main stage baby Go back to where you came from came from Words come out your mouth Look around what a mess you made Watching from the crowd it's astounding You're on your way Thought that you had changed I found out it's just a role you play Well bravo baby Bravo baby yeah Yeah Yeah yeah Look Ooh yeah Ooh yeah I'm saying Ooh yeah Ooh yeah Yeah Ooh yeah Ooh yeah Damn Ooh yeah My my my my my Ooh yeah My my my my my Yeah yeah yeah
  So!YoON!(황소윤)  ,Athena (feat. SE SO NEON),발맞춰 걷던 사람들은 다 바람 한 톨에 사라져버렸나 기다림은 한 치 앞 세상은 순식간에 달아났고 고요한 창문 밖 저 멀리 오늘이 날 찾아왔네 I’ll be standing strong We always sing together 그렇게 우린 생에 모든 것을 다 바쳤던가 아님 모든 것을 다 잃었던가 변한 건 없고 내 맘은 여전히 그대 아 나는 눈을 감고 매일 생각해 오늘 우리 다시 만나네 I’ll be standing strong We'll be there for you
  리코 (Rico)  ,Dynamite,널 처음 만난 순간부터 더 이상 멈출 수 없게 됐어 내 도화선의 끝에서 작은 불씨가 붙어버린 걸 더는 바꿀 수 없어 타들어가는 이 불꽃의 운명을 계속 더 더 짧아져 이제는 멈출 수 없어 터질 것 같은 감정 Oh exploded dynamite I feel love like a dynamite I can’t handle it it’s love explosion Oh exploded dynamite I feel love like a dynamite I can’t handle it it’s love explosion Oh exploded dynamite I feel love like a dynamite Oh exploded dynamite I feel love like a dynamite 네 눈동자에 담겨진 우주 속에서 난 계속 헤매고 있어 I wanna find the way 아직 믿기 어렵지만 이 흐름을 거스를 수 없어 더는 바꿀 수 없어 타들어가는 이 불꽃의 운명을 계속 더 더 짧아져 이제는 멈출 수 없어 터질 것 같은 감정 Oh exploded dynamite I feel love like a dynamite I can’t handle it it’s love explosion Oh exploded dynamite I feel love like a dynamite 점점 숨기는 게 힘에 겨워 난 더 이상은 막지 못할 것 같아 달아나긴 늦었어 Oh exploded dynamite I feel love like a dynamite I can’t handle it it’s love explosion Oh exploded dynamite I feel love like a dynamite I can’t handle it it’s love explosion Oh exploded dynamite I feel love like a dynamite Oh exploded dynamite I feel love like a dynamite I can’t handle it it’s love explosion Oh exploded dynamite I feel love like a dynamite I can’t handle it it’s love explosion Oh exploded dynamite I feel love like a dynamite Oh exploded dynamite I feel love like a dynamite I can’t handle it it’s love explosion Oh exploded dynamite I feel love like a dynamite I can’t handle it it’s love explosion Oh exploded dynamite I feel love like a dynamite I can’t handle it it’s love explosion Oh exploded dynamite I feel love like a dynamite
  결 (KYUL)  ,한순간도,난 말야 오늘 밤도 니가 좋은 꿈을 꾸면 좋겠어 난 여태 한 순간도 사랑이 아닌 적이 없었어 난 말야 오늘 밤도 니가 좋은 꿈을 꾸면 좋겠어 난 여태 한 순간도 사랑이 아닌 적이 없었어 그래 한 순간도 난 말야 오늘 밤도 니가 좋은 꿈을 꾸면 좋겠어 난 여태 한 순간도 사랑이 아닌 적이 없었어 난 말야 오늘 밤도 니가 좋은 꿈을 꾸면 좋겠어 난 여태 한 순간도 사랑이 아닌 적이 없었어 그래 한 순간도
  다비크 (DAB19)  ,굿나잇,굿나잇 잘자 우리 애기라고 말하는 중에도 넌 아이 같은 웃음 지어 Tonight I love you forever 노래 불러 줄게 꿈에도 들릴 수 있게 굿나잇 Woo baby 고된 니 하루도 편히 녹여 줄게 지금도 난 Fallin’ in love again Oh 또 Fallin’ in love again Love you love you 꿈에서도 만나 널 사랑해줄게 I love you forever woo baby I want have a good-night 또 노래해줄게 I love you forever Woo baby 굿나잇 굿나잇 굿나잇 굿나잇 느낄 수 있니 내가 여기서 널 기다리고 있어 여기서 널 위한 목소리만 혼자서 난 널 기다리고 있어 여기서 For god sakes’s I have no time no lie you know 영원히 바뀔 것 같지 않아도 괜찮아 I’m sorry 원하는 걸 다 가진다면 Can you feel me Baby It is your thing 눈을 감아 I got for your good Night 시야가 8분 의 1도 안될 때 듣는 ma lullaby for you Cause you already know 지금 눈감은 널 보며 난 또 너의 곡을 써 굿나잇 Woo baby 고된 니 하루도 편히 녹여 줄게 지금도 난 Fallin’ in love again Oh 또 Fallin’ in love again Love you love you 꿈에서도 만나 널 사랑해줄게 I love you forever woo baby I want have a good-night 또 노래해줄게 I love you forever Woo baby 굿나잇 굿나잇 굿나잇 굿나잇 굿나잇
  Doja Cat  ,Beautiful,Powder set yes Came out impressed Kill them in that dress I'm beautiful Kill then in that I know it's so I'm beautiful I'm beautiful I know it's so I'm beautiful See you in that Powder set yes Came out impressed Kill them in that dress Kill them in that Powder set yes Came out impressed Kill them in that dress Kill them in that Hey Nayima 'Sup Sabrina Hey Naomi Love your features With a little bit of rouge on the cheek Bronze little bombshells cruise by the beach Louis on the clutch 'Boutin on the feets I'm doing too much with your dude in the sheets Now you soft like 300 count Little rubber band tuckin' 300 thou' Throw it on the floor make 300 bounce Can you make a 16 come out 300 mouths Cause I might have the check in the mail I might get 'em wetter like I'm underneath the sail Hungry little bunny I am coming for your tail So I can keep my mommy up and spend a hundred on the nails As usual I'm suitable Cute from the cooch to my cuticle And boo you should know I'm so doable It's quite provable That we beautiful beautiful Powder set yes Came out impressed Kill them in that dress I'm beautiful Kill then in that I know it's so I'm beautiful I'm beautiful I know it's so I'm beautiful See you in that Powder set yes Came out impressed Kill them in that dress Kill them in that Powder set yes Came out impressed Kill them in that dress Kill them in that And it ain't about being good looking It's your brains how they working Get that good sookie sookie I'm sorry if your man can't stop lookie looking Mistook me for a ho' and ain't nobody playing hookie And you ain't found your girl on Tinder yet The cookie like a temple you can call it gingerbread Be a good example at least on the internet Shorty posting all them selfies Help me is you single yet Tell me is you into head Cause maybe we can intersect Cos sexually you interest Boy visually you is a yes No respect And you dudes don't do your duty Can't see me shake my head at you Too focused on the booty You bastard bachelors Is really acting like you're Clooney Ya'll truly won't be players Til you learn to see the beauty Male groupies Can't say I blame you if I was you I would do me Im a cutie patootie but don't mistake that for hoochie Cause even if you think you knew me A woman changes with the seasons And I'm breathing out the new me Powder set yes Came out impressed Kill them in that dress I'm beautiful Kill then in that I know it's so I'm beautiful I'm beautiful I know it's so I'm beautiful I'm beautiful I know it's so I'm beautiful I'm beautiful I know it's so I'm beautiful
  마스  ,Drink,La la la Keeping my feeling la la la la la la la Kickin' that feeling la la la la Drunk in love Drink another Drippin'now Drink it now drink it now Drunk in love Drink another Drippin'now Drink it now drink another La la la Keeping my feeling la la la la la la la Kickin' that feeling la la la la Drunk in love Drink another Drippin'now Drink it now drink it now Drunk in love Drink another Drippin'now Drink it now drink another Drink it now now another Drippin'now drunk in love drink it now drink it now Drunk in love Drink another Drippin'now Drink it now drink it now la la la la la la la la la la la la la la Drippin'now another drunk in love drink it now drink it now Drunk in love Drink another Drippin'now Drink it now drink it now Drippin'now another drunk in love drink it now drink it now Drunk in love Drink another Drippin'now Drink it now drink it now Drunk in love Drink another Drippin'now Drink it now drink it now
  폴킴  ,좋은 사람,사실은 기대 없이 나간 자리 거기서 널 만났지 한참을 널 바라 봤어 조급한 맘으로 만나긴 싫어 서로 어색했던 그날의 우린 조금씩 마음을 열었었나 봐 몰랐는데 몰랐는데 더욱 가까워진 우리 하루하루가 사랑한단 한마디론 내 마음 다 보여 줄 순 없어 너가 배고파 하는 것 보다 널 사랑해 재미없어 할까 봐 나 아무 말 대잔치 이런 내가 좋으니 주위 사람들에게도 친절해 그런 너를 보고 있으면 나도 좋은 사람 그런 사람 될 수 있을 것만 같아 하루하루가 사랑한단 한마디로 내 마음 다 전할 수 있을까 여행 떠날래 라는 말보다 더 설레게 맛있는 걸 볼 때면 니가 먼저 생각나고 좋은 일이 생기면 가장 먼저 떠올라 사랑한다 사랑한단 말 Everyday 말해주고 싶어 하루하루가 좋은 사람 좋은 사람 너를 드디어 만난 것 같아 너를 만나고 나의 매일이 달라졌어 내가 더 많이
